frame,caption
001.jpg,A beautiful sunset over a city. The sky is orange and pink. There are many buildings in the city. There is a large body of water in front of the buildings. 
002.jpg,A man and a woman are standing behind a news desk. They are both dressed in business attire. The desk is white and has a red logo on it. There is a large screen behind them that shows a city. 
003.jpg,A man and a woman are standing in front of a news desk. The desk is white and has a red logo on it. The man is wearing a white shirt and tie and is holding a book in his hands. The woman is also wearing a short sleeve white shirt. There is a large screen behind them. There are many buildings and lights on them.
004.jpg,"The image is a graphic. It has a white background with red diagonal stripes. In the center of the graphic is a silver object that appears to be a camera. The camera has a red light on it. There is also a small text in the top right corner that reads ""HTV"" and the time is 18:30:12."
005.jpg,The inside of a store. There are pink and white balloons hanging from the ceiling. There is a pink sign hanging from a ceiling. 
006.jpg,People are shopping in a flower shop. There are many different types of flowers on display. A woman in a polka dot dress is holding a bouquet of flowers. A man in a blue shirt and a green hat is looking at the flowers.
007.jpg,A woman in a black dress is standing on a stage and speaking into a microphone. There is a large screen behind her. There are people sitting in chairs in front of a table. 
008.jpg,A rocket is launching into the sky. There is a lot of white smoke coming out of the rocket. There are two tall towers on either side of the launch. The sky is blue with some clouds in it.
009.jpg,A satellite is shown on a television screen. The background is black with white stars. The satellite is white and gold. There is red writing on the screen.
010.jpg,A red and white image is shown. There is a large red stripe on the right side of the image. There are small dots on the bottom of the red stripe. The dots are arranged in a triangle shape.
011.jpg,A man and a woman are standing behind a news desk. The desk is white and has a red logo on it. The man is wearing a pink shirt and tie and is holding a phone in his hands. The woman is also wearing a white shirt and has short black hair. There is a large screen behind them that has a city on it and the sky is red.
012.jpg,A man and a woman are standing behind a white desk. The man is wearing a pink shirt and a tie. The woman is also wearing a white shirt. They are both holding small red objects in their hands. There is a large screen behind them that has a city scene on it. 
013.jpg,A man and a woman are standing in front of a desk. They are both dressed in business attire. The man is wearing a pink shirt and a striped tie. The woman is dressed in a white blouse. She is holding a red folder in her hands. There is a large cityscape behind them. The sky is orange and pink.
014.jpg,A man and a woman are standing in front of a TV screen. The man is wearing a pink shirt and a tie. The woman is also wearing a white shirt and has short black hair. They are both holding objects in their hands. There is a large cityscape behind them. The sky above them is orange and red.
015.jpg,This is an aerial view of a city. There is a large white building in the middle of the grass. There are several smaller white buildings surrounding the building. 
016.jpg,A person wearing a white lab coat and a white surgical mask is standing in front of a machine. The person is wearing blue gloves on their hand. The machine is white and has buttons on it. 
017.jpg,There are several white trucks lined up on the street. There are trees on the side of the street next to the trucks. There is a white sky in the distance.
018.jpg,There are people wearing white shirts and blue gloves. They are wearing white hats and face masks. There is a large table in front of them. There are blue bins on the side of the table. 
019.jpg,Two people are wearing white shirts and blue gloves. They are standing in front of a table. There are red boxes on top of the table. The people are holding red objects in their hands. 
020.jpg,The image is taken inside of a store. There are pink and white balloons hanging from the ceiling. There is a large pink sign hanging from a ceiling. A person is standing in front of the sign wearing a black shirt and a face mask. The floor of the store is white and there are shelves on the right side of the image with various items on them.
021.jpg,The inside of a store. There are pink and white balloons hanging from the ceiling. There is a display of water bottles on the floor. 
022.jpg,There are three women standing in a store. They are looking at different products on the shelves. There is a sign on the wall behind them. One of the women is wearing a pink backpack. 
023.jpg,A woman is standing in front of a blue sign. The woman is wearing a white shirt and has long brown hair. There is a red door behind the woman. 
024.jpg,There are many green and yellow fruit on the ground. There are leaves coming off of the fruit. There is writing on the bottom of the picture. 
025.jpg,There are people standing in front of a fruit stand. There is a woman wearing a green shirt pushing a white cart. There are fruits and vegetables on the ground in the front of the stand.
026.jpg,A man and woman are walking through a grocery store. The man is wearing a black suit and carrying a blue shopping basket. The woman is wearing black pants and a face mask. There are fruits and vegetables on display on the left side of the man. A large pink light is hanging from the ceiling of the store.
027.jpg,A man in a white collared shirt is standing in front of a market. There are fruits and vegetables on display behind the man. There is a man standing behind him wearing a black shirt. 
028.jpg,A man is standing inside of a store. He is wearing a short sleeve shirt. There are shelves in front of him with bags of food on them. Bananas are sitting on top of the shelves. 
029.jpg,"People are shopping in a store. There are many flowers on display in front of the people. Some of the flowers are yellow, some are pink and some are white. There is a man wearing a green hat and a blue shirt."
030.jpg,There are several people standing in a room. There are plants on a shelf behind them. There is a little girl in a blue shirt standing in front of them.
031.jpg,There are several people standing in front of a display case. There are fruits and vegetables on the shelves in the case. The woman in front is wearing a red jacket and carrying a white bag. 
032.jpg,People are shopping in a supermarket. There are shelves on both sides of the people. There is a woman in a black shirt pushing a blue shopping cart. 
033.jpg,There are people shopping in a store. There are many flowers on display in front of the people. There is a woman wearing a black and white polka dot shirt. 
034.jpg,There are red and yellow decorations hanging from the ceiling. There are yellow flowers on the bottom of the decorations. 
035.jpg,A man and a woman are standing behind a news desk. The desk is white and has a red logo on it. The man is wearing a white shirt and tie and is standing behind the desk. He is wearing glasses and has short black hair. The woman is also wearing a short sleeve white shirt. She is holding something in her hands. There is a large screen behind them that has a cityscape of buildings and a red sky.
036.jpg,"A man and a woman are standing in front of a news desk. They are both dressed in business attire. The man is wearing a pink shirt and tie, while the woman is dressed in a white blouse. The desk is white and has a red logo on it. There is a large screen behind them that shows a city with tall buildings and a red sky."
037.jpg,"A man and a woman are standing in front of a news desk. They are both dressed in business attire. The man is wearing a pink shirt and tie, and the woman is a white blouse. The desk is white with a red logo on it. There is a large screen behind them. There are many buildings and skyscrapers on the screen."
038.jpg,"A man and a woman are standing behind a white table. They are both dressed in business attire. The man is wearing a white shirt and tie, while the woman is wearing an apron. There is a large cityscape behind them. The word ""giay"" is written on the table in red letters."
039.jpg,This is an image of a highway. The highway is very long. There are two bridges over the highway. Both bridges are made of concrete. The bridge on the left is gray and the one on the right is green. The sky above the bridge is light blue. There is white writing on the bottom of the image. The writing is in a foreign language.
040.jpg,An aerial view of a city is shown. There are many buildings and roads in the city. There is a large body of water next to the buildings.
041.jpg,This is an aerial view of a city. There are very tall buildings in the city. The buildings have many windows on them. There is a road in front of the buildings. The road has lots of cars on it. The sky above the buildings is gray.
042.jpg,This is an aerial view of a city. The city appears to be densely populated. There are a lot of tall buildings in the city. There is a road in the middle of the city with lots of cars on it. The sky above the city is blue with white clouds.
043.jpg,This is an aerial view of a city. There are many tall buildings in the city. The sky is blue with white clouds in it. There is a large body of water in front of the buildings.
044.jpg,An aerial view of a city is shown. There is a large body of water in front of the city. There are many buildings surrounding the water. In the water is a barge. The barge is blue and brown in color.
045.jpg,An aerial view of a city is shown. There is a large body of water in the center of the image. There are several buildings surrounding the water. A large blue boat is sitting on the road in front of the buildings.
046.jpg,An aerial view of a city. There is a large body of water in front of the buildings. There are trees on the side of the water. A large blue boat is sitting on the road next to the street. 
047.jpg,This is an aerial view of a city. There are many buildings surrounding the streets. There is a large white building in the middle of the buildings. 
048.jpg,This is an aerial view of a city. The city appears to be densely populated. There is a large body of water in the middle of the city. There are many tall buildings in the city as well. The sky above the city is gray and cloudy.
049.jpg,"A man and a woman are standing in front of a large screen. They are both dressed in business attire. The man is wearing a white shirt and a tie, and the woman is dressed in a white blouse and skirt. The screen behind them shows a city with tall buildings and a red sky. There is a large white table in the front of them."
050.jpg,A woman is standing on a news set. She is wearing a short sleeve shirt and a pink skirt. There is a large screen behind her with a picture on it. 
051.jpg,There are people sitting at a table. There is a laptop on the table in front of them. There are water bottles next to the laptop. 
052.jpg,A woman is standing in front of a green wall. She is wearing a colorful hat and a black jacket. The woman is holding a microphone in her hand. There are white signs on the wall behind the woman.
053.jpg,A woman is standing in front of a green wall. She is wearing a black hat and a black jacket. The woman is holding a microphone in her hand. There are white signs on the wall behind the woman. 
054.jpg,There are several people standing in front of a green wall. They are holding plaques in their hands. There is a man in a suit shaking hands with one of the women. 
055.jpg,A group of people are standing on a red stage in front of a green wall. They are all holding green and white signs. There is a large screen behind them with writing on it. 
056.jpg,A man in a blue shirt and khaki pants is handing money to another person. The man is wearing a green lanyard around his neck. There is a green sign behind the man. 
057.jpg,There are several people standing in front of a green wall. They are holding signs in their hands. There is a large screen behind them with writing on it. 
058.jpg,A man is standing in front of a white banner. He is wearing a blue collared shirt. There is a large green plant behind the man. 
059.jpg,There are several bottles on a table. The bottles are white with yellow lids. There is a white sign in front of the bottles. 
060.jpg,There are three people standing in a room. There is a man in a black suit and a woman in a brown suit. They are standing in front of a table with a blue table cloth on it. There are white bottles on the table. 
061.jpg,A woman is standing in a room. She has long black hair and is wearing a black jacket. There is a picture hanging on the wall behind her. 
062.jpg,A woman is standing in a room with her eyes closed. She has long black hair and is wearing a black shirt. There is a picture hanging on the wall behind her. 
063.jpg,There are several people standing around a table. There are flowers on the table in front of them. There is a woman in an orange shirt standing next to a man in a blue shirt. 
064.jpg,There are several people standing in a room. There is a man in a blue shirt standing in front of a white table with a white sign on it. 
065.jpg,There are several people standing around a table. There are jars on top of the table with green liquid in them. There is a man in a white shirt standing behind them. 
066.jpg,There are three people standing in front of a table. There is a man in a black shirt with a green lanyard around his neck. There are two women standing next to him. 
067.jpg,There are several people standing around a table. There is a green sign hanging from the wall behind them. There are many people standing in front of the table. 
068.jpg,A man is standing in front of a city skyline. He is wearing a white shirt and a tie. He has glasses on and is holding a tablet in his hands. The sky is orange and red. There are tall buildings all around the man.
069.jpg,A man is standing in front of a cityscape. He is wearing a white shirt and a tie. He has glasses on and is holding a tablet in his hands. The sky is orange and there are buildings in the background.
070.jpg,There is a small white and yellow boat in the water. There are small waves in front of the boat. There is a red logo on the top right of the image.
071.jpg,There is a white and blue boat in the water. There are small waves around the boat. There is a red and white logo on the bottom of the screen.
072.jpg,A man in a white uniform is wearing a white hat. There is a large body of water behind the man. There are tall buildings in front of the water.
073.jpg,A man is wearing a white uniform and a white hat. There is a large body of water behind the man. There are tall buildings in front of the water.
074.jpg,There is a large body of water in front of a bridge. There are people standing on the side of the bridge. The sky above the bridge is white. There is a red logo on the top right of the image.
075.jpg,There is a small red boat in the water. There is a person wearing an orange life jacket on top of the boat. The water is choppy and has small waves in it.
076.jpg,There is a person wearing an orange life jacket in the water. There is a large wave in front of the person. The person is holding onto a rope that is attached to the boat. 
077.jpg,There is a person wearing an orange life vest. They are sitting in a boat. There is water in front of them. 
078.jpg,A man in a white shirt and a white hat is standing in front of water. There is a large white boat in the water behind him. There are tall buildings behind the water. 
079.jpg,A man in a white uniform is wearing a white hat. There is water behind the man. There are buildings behind the water. 
080.jpg,There is a small white and yellow boat in the water. There is a red circle in front of the boat. There are words written on the bottom of the picture. 
081.jpg,A man in a white uniform is wearing a white hat. There is a large white boat in the water behind him. There are tall buildings behind the water. 
082.jpg,There is a large body of water. There is a person wearing an orange life jacket standing in the water. The person has a black helmet on their head. 
083.jpg,"A woman is standing in front of a red background. She is wearing a white short sleeve shirt and a white skirt. The woman is holding a small brown purse in her hands. There is a large picture on the right of the woman. The picture has a city skyline on it. The word ""giay"" is written in red on the picture."
084.jpg,A woman is standing in front of a red background. She is wearing a white shirt and holding a red object in her hands. There is a picture on the wall behind the woman. The picture has a city skyline on it. 
085.jpg,A woman is standing in front of a red background. She is wearing a short sleeve white shirt and a pink skirt. The woman is holding a brown wallet in her hands. There is a large screen behind the woman. 
086.jpg,There are several boats in the water. There are two people standing in front of the boats. One of the people is wearing a green shirt and a hat. 
087.jpg,There is a man in a green shirt standing in front of a large ship. The man is wearing a hard hat on his head. There is smoke coming out of the ship.
088.jpg,There are two people standing on a boat. They are holding ropes in their hands. There are large red spools of rope next to them. There is water behind them. 
089.jpg,There are two men standing next to each other. One of the men is wearing a black jacket and a green hat. There are large red poles in front of them. 
090.jpg,A man in a white shirt and black pants is writing on a white table. There is a white lamp on the table next to him. There are books on top of the table. 
091.jpg,Three men are sitting inside of a ship. They are wearing white shirts. The man in the front is holding a steering wheel. There are large windows on the side of the ship. 
092.jpg,A man in a white shirt is driving a boat. He is holding the steering wheel. There are large windows on the boat. 
093.jpg,A picture of a large room with many items in it. There is a person standing in front of a blue and red object. There are large white pillars in the room. 
094.jpg,There are several men standing on a dock. There is a large blue boat next to the men. There are green tents on the ground behind them. 
095.jpg,There are three people standing on a boat. They are wearing life jackets. There is a large building behind them. There are trees on the other side of the building.
096.jpg,There is a large boat in the water. There is a person standing on the side of the boat. There are clouds in the sky above the water next to the ship.
097.jpg,There are two people standing on a boat. One of the people is wearing a red life vest. There is a large rope in front of them. The boat is blue and red. 
098.jpg,There is a large gray boat in the water. There is a blue tarp on the side of the boat. There are yellow pipes on the boat next to a man in a black robe. 
099.jpg,A woman in a white shirt and a pink skirt is standing in front of a colorful background. She is holding a red object in her hands. There is a picture on the wall behind her. 
100.jpg,A woman is standing in front of a red background. She is wearing a short sleeve white shirt and a pink skirt. The woman is holding a small brown object in her hands. There is a large picture on the right of the woman.
101.jpg,There is a white building with a balcony on the front of it. There are two flags on the poles in front of the building. There is a tree in front and a white car on the street. 
102.jpg,A man is standing in front of a blue background. He is wearing a black uniform. There is a logo behind him that is blue and white. The man has short brown hair. 
103.jpg,A white truck is parked on the street. There are red lights on the top of the truck. There is a red building next to the street on the other side of the road. 
104.jpg,A white car is on the street. There is a large white truck next to the car. There are signs on the side of the truck. 
105.jpg,There is a large white truck with logs on the back of it. There are people standing in front of the truck. There is a picnic table next to the trucks. 
106.jpg,Two men in blue jumpsuits are bending over on the ground. They are behind a blue and white police tape. There is a white car parked on the street in front of the men. 
107.jpg,There are two men kneeling down on the ground. They are wearing blue suits. There is a black bag in front of them. There are potted plants on the sidewalk behind them. 
108.jpg,There are two glasses on top of a wooden table. There is a glass mug with water in it next to a pair of black sunglasses. 
109.jpg,A man in a blue jumpsuit is walking down the street. There is a blue and white tape on the ground in front of him. There are buildings behind him. 
110.jpg,There is a statue of a man riding a horse in front of a building. There is a man in a red and white shirt walking next to a wooden bench. 
111.jpg,A man is standing in front of a news desk. He is wearing a white collared shirt and a tie. The man is holding a tablet in his hands. There is a large cityscape behind the man. The sky is orange and red. 
112.jpg,A man is standing in front of a news desk. He is wearing a white shirt and a tie. There are tall buildings behind him. There is a red sky above the buildings.
113.jpg,A man is standing in front of a news desk. He is wearing a white shirt and a tie. There are tall buildings behind him. There is a red sky above the buildings.
114.jpg,A man is standing in front of a news desk. He is wearing a white shirt and a tie. There are tall buildings behind him. There is a red sky above the buildings.
115.jpg,"A satellite is shown in the image. The background is black and there are small white stars in the sky. The satellite is made up of metal. There is a large cylindrical object on top of it. The bottom of the satellite is covered in gold foil. The text on the image is in Vietnamese and it says ""UNESCO cong nhan Khu vuc hang dong da vai phia Bac Apennines (italia) la di san thien nh""."
116.jpg,A satellite is shown in the night sky. The sky is black and there are small white stars visible in the background. The satellite is gold and silver in color. There is a red banner in front of the satellite with white writing on it.
117.jpg,A man is wearing a gray jacket and a plaid shirt. He is sitting in a black chair. There is a white wall behind him. 
118.jpg,A man is wearing glasses and a plaid shirt. He has short gray hair and a mustache. There is a black curtain behind him. 
119.jpg,"The image is a night sky. The sky is black. There are many white stars in the sky. There is a large cloud in the middle of the image. The clouds appear to be white and gray. The image has a watermark in the top right corner that reads ""HTV7 HD 18:39:07"". There is also a date and time stamp in the bottom left corner that says 14/2/2024."
120.jpg,A man is sitting at a desk in front of a computer. He is wearing a black shirt and glasses. There is a large monitor and a small laptop on the desk. 
121.jpg,An Asian man with glasses is standing in front of a black curtain. He is wearing a blue and white checkered shirt. The man has his eyes closed and his mouth slightly open. There is a barcode on the left side of the image.
122.jpg,A black and white image of a sphere. The background is completely black. There is a barcode on the bottom left corner of the image. The barcode is white with black text. There are small white dots on the sphere.
123.jpg,"A satellite is shown in the image. The satellite is covered in gold foil. The background of the image is black. There are small white stars in the sky around the satellite. There is a red logo in the top right corner that says ""HTV7 HD 18:39:26"". Below the satellite there is a description in Vietnamese that is written in white text."
124.jpg,There are two people sitting at a white desk. There is a computer monitor and a laptop on the desk in front of them. They are both wearing white hairnets on their heads. 
125.jpg,A rocket is launching into the sky. There is a lot of white smoke coming out of the bottom of the rocket. There are two tall towers on either side of the launch. The sky behind the rocket is blue. 
126.jpg,A woman is standing in front of a screen. She is wearing a short sleeve white shirt and a pink skirt. The woman is holding a brown wallet in her hands. There is a large white screen behind the woman. 
127.jpg,A woman is standing on a television screen. She is wearing a short sleeve white shirt and pink bottoms. The woman is holding a brown wallet in her hands. There is a large screen behind the woman. 
128.jpg,A woman is standing on a television screen. She is wearing a short sleeve white shirt and pink bottoms. She has short dark hair and is holding a brown wallet in her hands. There is a large picture on the screen behind the woman.
129.jpg,There is a woman standing in front of a large screen. There is a red wall behind the woman. The woman is wearing a white shirt and a white skirt. 
130.jpg,There is a white building in front of a crowd of people. There is a large structure with lights hanging from it. There are windows on the front of the building. 
131.jpg,There is a stage with people standing on it. There are large lights hanging from the ceiling above the stage. There is a large guitar on the stage in front of the people. 
132.jpg,There is a large structure in the middle of a street. There are people standing on top of the structure. There is a crowd of people surrounding the structure in front of a building. The sky above the structure is dark.
