frame,caption
267.jpg,Two men are standing next to each other. One of the men is wearing a green uniform. The other man is wearing glasses and a red scarf. There is a white table behind them with water bottles on top of it. 
268.jpg,A little girl in a pink shirt is holding a green toothbrush. There are soldiers standing behind her. There is a white wall behind them. 
269.jpg,"A large crowd of people are gathered outside of a building. The building has arabic writing on the side of it. There are several flags in the crowd. Some of the flags are green, some are red, and some are yellow. There is a large white banner hanging from the building."
270.jpg,There are several people standing in front of a white sign. There is a man in a white jacket shaking hands with a woman in a black head covering. 
271.jpg,A crowd of people are gathered together in a protest. There are many flags in the crowd. Most of the flags are green and some of the people are holding them up. There is a man in the center of the crowd holding a red flag. The crowd is clapping and some people are taking pictures with their cell phones.
272.jpg,A large crowd of people are standing outside of a building. There are large green flags hanging from trees in front of the crowd. There is a man in a red jacket standing on a stage in between the people. 
273.jpg,A bunch of people are protesting. They are all holding up green flags. There is a white van in the middle of the crowd. There are some people standing on top of the van.
274.jpg,A bunch of people are protesting. They are all holding up green flags. There is a white van in the middle of the crowd. Some people are standing on top of it.
275.jpg,A woman in a yellow dress is standing in front of a large screen. There is a city on the screen behind her. There are lights on the ceiling above the screen. 
276.jpg,Two people are standing in front of a white table. There is a large screen behind them with a city on it. The man is wearing a blue shirt and a yellow tie. 
277.jpg,A man and a woman are standing behind a news desk. The desk is white and has a red logo on it. The man is wearing a blue shirt and a yellow tie. The woman is wearing an orange shirt and yellow pants. There is a large screen behind them.
278.jpg,Two people are standing behind a white table. There is a red wall behind them. There are lights on the ceiling above them. 
