frame,caption
142.jpg,There are two people standing in front of a large screen. There is a man in a blue shirt and a woman in a white shirt. They are both wearing glasses. 
143.jpg,Two people are standing in front of a screen. They are both wearing glasses. The man is wearing a blue shirt and an orange tie. The woman is wearing an orange and white shirt and black pants. There are tall buildings on the screen behind them.
144.jpg,There are several motorcycles and trucks on the street. There is a large blue truck next to a red truck. There are people standing on the sidewalk in front of a building. 
145.jpg,There are several people riding motorcycles on the street. There is a blue truck behind them. There are several buildings on the side of the street next to them. 
146.jpg,There is a large red truck driving down the street. There is a person riding on a motorcycle next to the truck. There are several buildings on the side of the street next to them.
147.jpg,There are several trucks parked on the side of the street. There are people standing on the sidewalk next to the trucks. There is a man in a green uniform standing in front of the truck. 
148.jpg,There is a brown building with a blue sign on the front of it. There is a white and red sign hanging from the side of the building. There are wires above the building in front of the sign. 
149.jpg,There are several motorcycles on the street. There is a large blue truck behind them. There are people standing in front of the truck. 
150.jpg,There is a large blue truck on the street. There are people on bikes next to the truck. They are all wearing white helmets. 
151.jpg,There is a large blue truck on the ground. There is a man in a blue shirt crouched down in front of the truck. There are large black tires on the truck
152.jpg,There is a large blue truck on the ground. There are two people standing in front of the truck. One of them is wearing a white helmet. There is a man in a blue shirt kneeling down next to it. 
153.jpg,There are several people standing on the street. There is a red truck and a blue truck behind them. There are people on motorcycles in front of them. 
154.jpg,A woman is standing in front of a city skyline. She is wearing a short sleeve shirt with flowers on it. She has short brown hair and glasses on. The sky behind her is orange and red. There is a tall skyscraper in the background.
155.jpg,A woman is standing in front of a cityscape. She is wearing a short sleeve shirt with brown flowers on it. She has short brown hair and is wearing glasses. The sky behind her is orange and red. There is a tall skyscraper in the background. 
156.jpg,There is a tall white building next to the street. There is a yellow sign on the front of the building. There are several cars parked in front of a white truck. 
157.jpg,There is a large building with large glass windows in front of it. There are people sitting at a table inside of the building. There is a sign on the front of the glass window. 
158.jpg,People are standing outside of a building. There are large windows on the front of the building. A man in a white shirt and black pants is walking on the sidewalk. There is a large white sign on the wall. 
159.jpg,There is a red sign in front of a building. There is a tree next to the sign. There are people in blue suits standing outside of the building.
160.jpg,A white van is driving down the street. There is a white truck next to the van. There are tall buildings on the other side of the road. 
161.jpg,There is a large tree in front of a white building. There is a black lamp post next to the tree. There are people standing under the tree wearing blue shirts. There appears to be a playground behind the trees. 
162.jpg,There are people standing outside of a building. They are wearing blue jackets. There is a tree in front of the building with green leaves on it. There are red chairs on the ground next to the building. 
163.jpg,A tall grey building is seen from the ground up. The sky is clear and blue. The building has many windows and balconies. It appears to be a high rise.
164.jpg,A tall white building has many balconies on it. There are many windows on the building. There is a tree in front of the building with green leaves. 
165.jpg,An ambulance is driving down the street. There is a sign on the sidewalk behind the van. There are trees on the other side of the sidewalk. 
166.jpg,A man is standing in front of a cityscape. He is wearing a blue collared shirt and an orange tie. He has black hair and glasses on. The sky behind him is orange and yellow. There are many tall buildings in the city.
167.jpg,There is a large cloud of smoke in the sky. There are street lights on the ground in front of a building. There is a tree next to the street. 
168.jpg,There is a small shack on the side of the road. There is a truck parked in front of the shack. There are power poles above the shack with wires hanging from them. 
169.jpg,There is a small building next to the street. There is a large pile of garbage in front of the building. There are power lines above the house. 
170.jpg,A picture of a building that is being destroyed. There is a ladder leaning against the side of the building. There are piles of rubble in front of the structure. 
171.jpg,There is a pile of trash on the ground. There is a large metal structure behind the trash. There are logs on top of the pile. 
172.jpg,There are many green plants in front of a white building. There is a motorcycle parked in the middle of the plants. There are leaves on the branches of the trees. 
173.jpg,A picture of a building that has been destroyed. There is a pile of rubble in front of the building. There are palm trees next to the rubble. 
174.jpg,A picture of a destroyed building. There is a pile of rubble in front of the building. The building appears to be in ruins. There are wooden poles sticking out of the rubble. 
175.jpg,A picture of a building that has been destroyed. There is a large pile of rubble in front of the building. There are trees surrounding the rubble. 
176.jpg,The background of the screen is red. The screen has a bright red color on it. There are small white dots on the screen. There is a small logo in the top right corner that says htv7 HD. The time is 18:42:51.
177.jpg,The image is a screenshot from a news channel. It is a nighttime scene. There is a large red truck parked on the side of the road. The headlights of the truck are on and there is a red light shining on the street. There are several buildings on both sides of the street and the sky is dark. The time of the channel is 18:42:56.
178.jpg,A picture of a building that has been destroyed. There are pieces of wood and other debris on the ground. There is a red stick sticking out of the side of the building.
179.jpg,There is a wall with a corrugated metal roof on it. There are wires hanging from the wall. There is a shadow on the wall under the wires. 
180.jpg,This is an image of a street. The street is very dirty. The ground is made up of small rocks. The rocks are gray. The building on the left is made of wood. The wood is light brown. There is a white box on the wall. The box has a design on it. The door of the building is closed. The roof of the buildings is made out of metal.
181.jpg,A picture of a destroyed building. There is a pile of rubble and debris in front of the building. The building appears to be in a state of disrepair. 
182.jpg,A picture of a building that is being destroyed. There is a lot of smoke coming out of the side of the building. There are pieces of wood in front of the wall. 
183.jpg,There are several motorcycles parked in front of a building. There is a pile of wood next to the motorcycles. There are green doors on the building. 
184.jpg,A narrow alleyway is shown in a foreign country. On the left side of the alley there is a green metal building. There is a pile of wood and other debris on the ground next to the building.
185.jpg,"The image is of a destroyed building. The building appears to be in a state of disrepair. There are broken pieces of paper and other debris scattered around the building. At the bottom of the image there is a caption in Vietnamese that reads ""Bao ve mai truong: Indonesia su dung dau diesel sinh hoc B30 cho tau hoa""."
186.jpg,A picture of a very dirty alleyway. There is a pile of garbage on the right side of the alley. There are a couple of wooden poles in the picture.
187.jpg,A picture of a destroyed building. There are pieces of wood and other debris on the ground. There is a red pipe sticking out of the wall. 
188.jpg,"The background is completely black. On the right side of the screen is a red and white image. At the top right corner is a logo that says ""HTV7 HD 18:43:38"". At the bottom of the image is a text in Vietnamese that reads ""Pakistan cong bo ke hoach ung pho bien doi khi hau va phat trien ben vung""."
189.jpg,There are people standing on a beach. There is a white cart behind them. There are yellow and red buckets on the ground in front of them. 
190.jpg,There are three men standing on a beach. They are wearing baseball caps on their heads. There is a large white object in front of them. There are yellow and red buckets on the ground next to them. 
191.jpg,There are several people standing in a circle. They are wearing colorful jackets and pants. They have helmets on their heads. There is a black sky behind them.
192.jpg,A man is standing in front of a group of people. He is wearing a black jacket and appears to be speaking into a microphone. The people behind him are wearing green and red jackets. The background is black. There is a red banner in front and on the banner. The banner has white writing on it.
193.jpg,A bright red light is shining on a white wall. There is a large red circle on the wall behind it. There are small white dots on the side of the red circle. 
194.jpg,The image is a graphic design. The background is red and white. There are dots on the red background. The lines are white and black. The design is made up of blocks. The blocks are red and silver. The numbers on the blocks are also red. There is a small logo in the top right corner of the image.
195.jpg,A man and a woman are standing behind a news desk. The desk is white and has a red and white logo on it. The man is wearing a blue shirt and a red tie. The woman has a white and brown shirt on. There is a large screen behind them. There are buildings on the screen.
196.jpg,Two people are standing behind a white table. There is a large screen behind them with a city on it. The man is wearing a blue shirt and an orange tie. 
197.jpg,A group of people are standing outside of a tunnel. They are wearing yellow hard hats and jackets. There is a large truck next to them. There are rocks on the side of the tunnel. 
198.jpg,A group of people are standing in a line. They are all wearing orange jumpsuits and yellow hard hats. There is a man in a gray jacket standing in front of them. 
199.jpg,There are several bottles in a room. They are all red with white writing on them. There is a light on the wall next to them. 
200.jpg,A dark tunnel with bright lights on the inside of it. There is a large truck driving through the tunnel. A person is standing in front of the truck wearing a hard hat. 
201.jpg,A large truck is driving through a tunnel. There are bright lights on the front of the truck. There is a large light on the ceiling of the tunnel.
202.jpg,Two people are standing in front of a large screen. They are both wearing glasses. One of them is wearing a blue shirt and a red tie. The other one is a woman wearing a white shirt and black pants. There are large buildings on the screen behind them. 
203.jpg,A man and a woman are standing in front of a white table. They are both wearing eyeglasses. The man is wearing a blue shirt and an orange tie. The woman has a white and brown shirt on. There are tall buildings behind them. 
204.jpg,A man and a woman are standing in front of a white table. They are both wearing glasses. The man is wearing a blue shirt and an orange tie. There is a large cityscape behind them. 
205.jpg,There are several birds flying in the sky. The sky is a light blue color. There is a watermark in the top right corner of the photo that says it is 18:46:16.
206.jpg,There are many birds flying in the sky. There is a large hill in front of the birds. The sky above the birds is gray. There are red words on the bottom of the screen.
207.jpg,There are people standing on top of a pile of trash. There is a gray airplane flying in the sky above them. There are several bags of trash in front of them.
208.jpg,There is a large pile of trash. There are many pieces of trash on the ground. There is a red item on top of the pile. 
209.jpg,A person is walking through a field full of trash. The person is wearing dark colored pants and boots. There are other animals in the field behind the person. The sky above the field is gray.
210.jpg,A white object is floating in the water. The water is blue and green. There are small bubbles floating around the white object. 
211.jpg,"An underwater scene is shown. There are green coral reefs in the water. There is a large white object in the middle of the coral reef. The image has a watermark in the top right corner that reads ""HTTV7 HD 18:46:41"". There are also words in the bottom left corner that say ""mo cat cao bat thuong & Ha Noi""."
212.jpg,The image is an underwater scene. It appears to be a fish in the water. There are a lot of green plants in the image. There is a small amount of text in the bottom left of the image that is in Vietnamese.
213.jpg,There are two men wearing white gloves on their hands. One of the men is kneeling down on the ground. There is a large white boulder next to them. There are small rocks on top of them. 
214.jpg,There is a white board on a wood table. There are many pieces of food on top of the board. There is a green container on the table next to the white board. 
215.jpg,A turtle is being held by a person wearing white gloves. The turtle is sitting on top of a black laptop. There is a person standing behind the turtle wearing a white shirt. 
216.jpg,There are people standing on the beach. There are small waves in the water in front of them. There is a man in a white shirt and a woman in a blue shirt. 
217.jpg,There are people standing in the water. They are holding hands. There are small waves in front of them. There is a blue sky above them.
218.jpg,There are people standing in the water. There is a large wave in front of them. They are wearing white shirts and black shorts. There are buildings behind them. 
219.jpg,A woman is standing in front of a large screen. She is wearing a short sleeve shirt and a black skirt. The woman is wearing glasses on her face. There is a man standing behind her wearing a blue shirt. There are large buildings on the screen behind her. 
220.jpg,A woman is standing on a news set. She is wearing a short sleeve shirt and a black skirt. She has glasses on her face. There is a large screen behind her. 
221.jpg,There are several people standing in front of a cart. There are yellow and red buckets on the ground next to them. There is a white building behind them. 
222.jpg,A picture of a beach with sand on it. There is a silver pole in front of the beach. There are trees on the beach next to the water. 
223.jpg,A picture of a drone is shown in the middle of a white background. The drone is tan in color and has four propellers on each of it's wings. There is a camera mounted on the front of the drone. The camera is white in color. There are words written below the picture in a foreign language under the picture.
224.jpg,A picture of something that looks like a tree trunk. There is a small green object in the middle of the picture. There are words written in a foreign language below the image. 
225.jpg,"There are many small black dots on a white surface. There is a red and white logo on the top right corner of the image. Below the logo, there is writing in a foreign language."
226.jpg,There are small pieces of fruit on the ground. The fruit are yellow in color. There are small sticks sticking out of the ground around them. There is writing on the bottom of the image. 
227.jpg,There are trees in the background. There is water in front of the trees. There are small waves in the water. The trees have green leaves on them. 
228.jpg,A man is standing in front of a purple sign. He is wearing a blue vest and a white collared shirt. There is water behind the man. 
229.jpg,A man is standing in front of a blue sign. He is wearing a blue vest and a white collared shirt. The man is gesturing with his hands. There is a large body of water behind the man.
230.jpg,There is a large body of water. There are trees on the other side of the water. The water is calm and has many ripples in it. There is a white sky above the trees. 
231.jpg,There is a lot of snow on the ground. There are sticks sticking out of the snow. There is writing on the bottom of the picture. 
232.jpg,There is a large body of water. There are trees on the other side of the water. The sky above the water is gray. There is a mountain behind the trees. 
233.jpg,There are trees in front of a blue sky. There is a black bird flying in the sky above the trees. The trees have green leaves on them.
234.jpg,The sky is mostly cloudy. The clouds are white. There is a bridge over the water. There are trees on the other side of the bridge. The trees are green and brown. The water is reflecting the sky.
235.jpg,A woman is standing in front of a red and orange background. She is wearing a white and brown shirt and black pants. She has glasses on and is holding a book in her hands. There is a large white screen behind the woman.
236.jpg,A woman is standing in front of a red background. She is wearing a white and orange shirt and black pants. She has glasses on and is holding a book in her hands. There is a picture on the screen next to the woman.
237.jpg,A woman is standing in front of a red background. She is wearing a white and orange shirt and black pants. She has glasses on and is holding a book in her hands. There is a picture on the screen next to the woman.
238.jpg,A large fire is burning in the sky. There is a large cloud of smoke above the fire. There are small waves in the water. 
239.jpg,There is a fire burning in the background. There is a man standing in front of the fire. He is wearing a red helmet on his head. There are two shelters next to the man. 
240.jpg,A woman is wearing a red hat and a white face mask. There is another woman behind her wearing a green hat and sunglasses. There are trees behind them. 
241.jpg,There is a large cloud of smoke in the sky. There are trees in front of the smoke. The sky is blue and there are no clouds in the picture.
242.jpg,A helicopter is flying in the sky. There is a large cloud of smoke coming off of the ground under the helicopter. The sky is blue and there are no clouds in it.
243.jpg,Ai Cap thong bao kha nang hamas sam tha mot so con tin. Ai Cap Thong bae kha Nang Hamas sam that sot sos con tin is written on the bottom of the screen. There is a fire burning in the middle of the trees. The fire is bright orange and yellow. There are green leaves on the trees as well. The time is 18:48:54.
244.jpg,Two men are wearing yellow hard hats and yellow jackets. They are standing in a forest. There are branches and leaves on the ground around them. 
245.jpg,There is a forest of trees. There is a large cloud of smoke in the sky above the trees. The sky is blue and orange. There are white flowers on the trees in the forest. 
246.jpg,A picture of a fire is shown in the dark. The fire appears to be going on. There is a lot of smoke surrounding the fire. There are many bright white lights on the fire that are illuminating the area. The sky around the fire is black.
247.jpg,A man is standing in front of a red background. He is wearing a blue shirt and a red tie. He has glasses on and is holding a red book in his hands. There is a picture on the wall behind the man. 
248.jpg,There are several people standing in a line. They are wearing red and yellow jackets. They have helmets on their heads. There is a black sky behind them.
249.jpg,"The image is a screenshot from a news channel. It shows a red, yellow and white police car. The car has the number 112 on the back of it. There is a person in the driver's seat of the car wearing a green and white uniform. The sky is dark and there are several street lights in the background."
250.jpg,A picture of a building is being shown in a foreign language. The building appears to be falling apart. There is a stairway leading up to the next level of the building. The wall is white and there is a large crack on the side of it. There are words written on the bottom of the picture in different languages.
251.jpg,A crack is on the ground. The crack is very deep. The ground is made of concrete. The concrete is light brown in color. There is some writing on the bottom of the picture. The writing is in a foreign language. The picture was taken at 18:49:36.
252.jpg,There are people sitting around a table. There is a man in a red vest standing in front of them. There are toys on the table. 
253.jpg,There are two men standing in front of a door. There are shelves behind them with water bottles on top of them. There is a large stack of red and black boxes on the side of the bottles. 
254.jpg,Two people are laying on beds in a dark room. They are both wearing black shirts and pants. The beds have white sheets on them. There is a red light on the left side of the room.
255.jpg,A woman is standing in front of a red background. She is wearing a white and orange shirt and black pants. She has glasses on and is holding a pen in her hand. There is a screen next to her with a picture on it.
256.jpg,A woman is standing in front of a red background. She is wearing a white and orange shirt and black pants. She has glasses on and a watch on her wrist. There is a picture on the right of the woman. 
257.jpg,There is a man in a white suit standing behind a white podium. There is a white fence behind him. There are people standing behind the fence. 
258.jpg,There are people standing on the street. There are large white bags on the ground in front of them. There is a blue sign behind them. 
259.jpg,There is a large crowd in a stadium. There is a man in a white shirt that is standing in front of the crowd. He is holding a large blue bottle. 
260.jpg,A woman is standing in front of a crowd. There is a silver fence behind her. There are people standing behind the fence. 
261.jpg,There is a large crowd of people standing behind a fence. There are trees next to the crowd. There is a blue van in front of the crowd on the street. 
262.jpg,A man is driving a yellow car. He is wearing a white helmet and sunglasses. There are people standing behind him watching him. There is a large pile of hay in front of him. 
263.jpg,There are two people driving a red car. They are wearing helmets on their heads. There is a large pile of hay next to them. There are people standing in front of them. 
264.jpg,There are people standing behind a fence. There is a large pile of hay on the side of the street. There are signs on the ground in front of the fence.
265.jpg,A man is standing in front of a large screen. He is wearing a blue shirt and a red tie. The man is holding a red object in his hands. There is a red and white sign behind the man. 
266.jpg,A man in a blue shirt and a red tie is standing in front of a television. There is a large screen behind the man. There are tall buildings on the screen behind him. 
267.jpg,A man in a blue shirt and an orange tie is standing in front of a large screen. There is a picture on the screen behind the man. There are tall buildings on the side of the screen. 
268.jpg,A man is standing in front of a screen. He is wearing a blue shirt and an orange tie. He has glasses on and is holding an object in his hands. There is a picture on the screen behind him. There are people in the picture with their hands up. 
269.jpg,A man in a blue shirt and an orange tie is standing in front of a screen. There is a large picture on the screen behind the man. There are tall buildings on the ground behind him. 
270.jpg,A large wave is in the water. There is a person standing on a surfboard in front of the wave. The sky above the wave is blue.
271.jpg,A large body of water with a large wave in the distance. There are small boats in the water. The sky above the water is blue. 
272.jpg,A wave is rolling in on the water. There is a small boat in the water in front of the wave. The sky above the wave is blue. 
273.jpg,There is a large wave in the water. There are people surfing on top of the wave. There is a person in a red shirt surfing on a white surfboard. 
274.jpg,A woman is standing in front of a red background. She is wearing a white shirt with brown flowers on it. She has glasses on and is holding a book in her hands. There is a picture on the screen next to the woman.
275.jpg,There is a woman wearing a white shirt with orange flowers on it. She is wearing glasses and has short brown hair. There is a large screen in front of the woman. 
276.jpg,There are people wearing pink shirts and pink hats. They are standing in a boat. There are trees behind them. There is a white sky above them. 
277.jpg,There are two boats on a large body of water. There are trees on the other side of the water. The boats are small and have people in them. There is a person standing on top of one of the boats.
278.jpg,There are several boats on a large body of water. There are trees on the other side of the water. The boats have people in them sitting in them. 
279.jpg,There are several people standing under a blue tent. There are white chairs behind the tent. A woman is wearing a pink hat and a black jacket. 
