frame,caption
001.jpg,A beautiful sunset over a city. The sky is orange and pink. There are a couple of big letters that spell out the name of the city. There is a large body of water in front of the buildings.
002.jpg,Two people are standing in front of a large screen. There is a red and white sign on the front of the screen. The man is wearing a blue shirt and an orange tie. 
003.jpg,A man and a woman are standing in front of a large screen. They are both wearing eyeglasses. The man is wearing a blue shirt and an orange tie. The woman is also wearing a white shirt and black pants. The screen behind them has a city scene on it. 
004.jpg,A black screen with a red and white image on it. There are small white dots all over the image. There is a red line on the left side of the screen. 
005.jpg,There is a large black building with a sign on top of it. The sign is green and red. There is a tall building next to the black building. 
006.jpg,Three people are sitting at a table. There is a large window on the wall behind them. A plant is sitting in a pot on the window sill. The man in the white shirt is holding chopsticks in his hand. 
007.jpg,This is an image of a street. The street is lined with buildings. The buildings are brown and white. There is a sign on the front of the brown building. The sign is white with black lettering. There are tall green trees on the sidewalk. The trees have large trunks. The tree trunk is light brown. The sidewalk is made of concrete.
008.jpg,A woman in a white lab coat and a blue scrub hat is standing over a person laying on a bed. The person is wearing a blue and white striped shirt. There is a white wall behind the woman. 
009.jpg,A woman is wearing a white uniform and a blue cap on her head. She has a white face mask on and white gloves on her hands. There is a person laying on a bed in front of her. 
010.jpg,Five men are standing on top of a pile of trash. They are holding white bags in their hands. The sky is blue and clear. The men are wearing baseball caps on their heads. The trash is piled up in piles. There is a red arrow pointing to the left.
011.jpg,There are people standing on top of a pile of trash. There are bags in their hands. They are wearing hats on their heads. There is a blue sky behind them.
012.jpg,A person is standing on a pile of trash. There are many pieces of trash on the ground. There is a red flag in front of the person. 
013.jpg,Two people are standing behind a white table. There is a large screen behind them with a city on it. The man is wearing a blue shirt and an orange tie. 
014.jpg,A man and a woman are standing behind a white table. The man is wearing a blue shirt and an orange tie. There is a large screen behind them with a city on it. 
015.jpg,Two people are standing in front of a white table. There is a large screen behind them with a city on it. The man is wearing a blue shirt and a red tie. 
016.jpg,There is a large black building with a sign on top of it. The sign is green and red. There is a tall building next to the black building. 
017.jpg,There is a large white structure in the middle of the street. There is a black screen on top of the structure. There are tall buildings next to the structure on the left. 
018.jpg,A silver SUV is driving down the street. There is a person riding a motorcycle behind the car. There are several stores on the side of the street next to the street with a green awning on them. 
019.jpg,There is a large yellow sign on the side of a building. The sign has red writing on it. There is a white sign next to the yellow sign. There are leaves hanging from the building.
020.jpg,A man is standing in front of a bunch of plants. He is wearing a white collared shirt. There is a microphone next to the man. 
021.jpg,A man is wearing a white collared shirt. There are plants behind the man. There is a red sign in front of the man with white writing on it.
022.jpg,A man is wearing a white collared shirt. There are plants behind the man. The man has short black hair. There is a microphone in front of him.
023.jpg,A man is wearing a white collared shirt. There are plants behind the man. There is a microphone in front of him. 
024.jpg,There are cars and motorcycles driving on the street. There is a large white building next to the street with palm trees in front of it. 
025.jpg,This is an image of a street. The street is lined with buildings. The buildings are made of brick. The building on the left is a coffee shop. The shop has a large green umbrella over it. The umbrella is closed. There are red chairs in front of the shop. There is a yellow stool under a tree. The tree trunk is very tall.
026.jpg,A brown building has a white sign on the front of it. There is a large green tree in front of the building. There are black letters on the building above the sign.
027.jpg,A woman is standing in front of a table. She is wearing a black shirt and has her hair in a bun. There is a large lamp hanging over the table. 
028.jpg,A man is standing in a kitchen preparing food. He is wearing a white face mask and a black hat. There is a red and white cooler on a counter in front of him. 
029.jpg,This is a picture of a room. There is a large painting on the wall behind the table. There are two black lamps hanging from the ceiling above the tables. The table has a white plate on top of it. 
030.jpg,A man is standing inside of a kitchen. He is wearing a black hat and a black shirt. He has glasses on his face. There is a silver kettle on the counter in front of him. There are plates stacked on a metal shelf next to him. 
031.jpg,A person is holding a small white object in their hand. There is a large metal bowl behind the person. The person has a gold ring on their finger. 
032.jpg,There are four people sitting around a table. There is a man in a white shirt writing on a piece of paper. There are two men and a woman sitting next to him. 
033.jpg,There is a large white structure in the middle of the street. There is a sign on top of the structure. There are cars and motorcycles on the street in front of the building. 
034.jpg,A man is standing in front of a city skyline. He is wearing a blue shirt and an orange tie. He has glasses on and is holding a red phone in his hands. The sky behind him is orange and yellow.
035.jpg,A man is standing in front of a city skyline. He is wearing a blue shirt and an orange tie. He has glasses on and has short black hair. There is a red sky behind the man.
036.jpg,There are people standing outside of a gas station. They are all wearing helmets on their heads. There are motorcycles parked in front of the station. There is a man in a blue shirt standing next to them. 
037.jpg,Two men are standing in front of a gas pump. They are wearing blue shirts and face masks. There is a large potted plant next to them. 
038.jpg,A white board is hanging on a wall. There is a blue sign on the board with numbers on it. There are words written on the wall under the sign. 
039.jpg,There are four people standing in front of a white car. There is a blue wall behind them with a blue door on it. There are pictures on the wall above the car. 
040.jpg,A man is standing in front of a white car. There is a gas station behind the man. There are blue pillars on the side of the gas station. 
041.jpg,A man in a blue shirt is standing in front of a gas pump. There is a red motorcycle behind the pump. 
042.jpg,Two people are standing in front of a large screen. There are tall buildings on the screen behind them. There is a man in a blue shirt and a woman in a white shirt. They are both wearing glasses.
043.jpg,There are two people standing in front of a white table. There are buildings behind them. There is a man in a blue shirt and a red tie. 
044.jpg,Two people are standing in front of a large screen. There are tall buildings on the screen behind them. There is a man in a blue shirt and a woman in a white shirt. They are both wearing glasses.
045.jpg,An orange icon is on a blue background. The orange icon has a pair of headphones on it. There are white squares on the ground in front of the orange icon. 
046.jpg,The image is a screenshot of a news channel. The background of the image is blue. There is a graphic of a person wearing headphones on the left side of the screen. There are numbers on the screen on the right side. The numbers are in red and white. The time is 18:33:06 on the top right corner.
047.jpg,"The image is a screen saver. It has a blue background with lines and squares on it. The lines are white and the squares are arranged in a grid pattern. The squares are all different shades of blue. There are small white dots scattered throughout the image. At the top right corner of the screen there is a red logo that says ""HTV7 HD 18:33:11""."
048.jpg,"The image is a screenshot of a video. The background of the image is blue. There is a white icon of a person wearing headphones on the left side of the screen. The person is white. There are lines of squares on the screen that are blue in color. The lines are white in color and are arranged in a grid pattern. The words ""Tong Dai Bihan Gia"" are written above the person icon. "
049.jpg,A blue sign is on a yellow wall. The sign has white writing on it. There is a watermark in the top right corner of the image.
050.jpg,There are several people sitting at a desk. There is a large brown desk in front of them. There are papers and a computer on top of the desk. 
051.jpg,A person's hand is resting on top of a pile of papers. The person is wearing a gold ring on their finger. There is a black keyboard behind the papers. 
052.jpg,A man and woman are sitting at a white desk. The man is wearing a blue shirt. There is a large black computer on the desk in front of the woman. A fan is sitting behind the woman on the other side of the desk. 
053.jpg,A white piece of paper with black writing on it. The writing is in a foreign language. There is a red stamp on the top right corner of the paper.
054.jpg,A person is sitting at a desk. There are several pieces of paper in front of the person. There is a roll of tape on the desk next to the paper. 
055.jpg,"A computer screen is displayed on a monitor. The screen is blue and has a square frame on it. There is a large letter ""P"" on the left side of the screen. There are lines and squares on the floor in front of the square frame. The words ""Xung dot Hamas-Israel"" are written below the frame. "
056.jpg,"A computer screen is displayed on a monitor. The background of the screen is blue. There are lines of white squares on the screen. There is white text in the middle of the image. The text reads ""https://tphcm.baohiemxahoi.gov.vn/Pages/default.aspx"". There is a red logo on the top right corner of the monitor."
057.jpg,The image is a screenshot of a video. The background of the video is blue. There is a checkered floor in the middle of the screen. The tiles are white and blue. The text is in white and is in a foreign language.
058.jpg,A woman is standing in front of a cityscape. She is wearing a short sleeve shirt with brown flowers on it. She has short brown hair and glasses on. The sky behind her is orange and red. There are tall buildings in the background. 
059.jpg,A woman is standing in front of a city skyline. She is wearing a short sleeve shirt with flowers on it and black pants. She has short dark hair and glasses on. The sky behind her is orange and red. There are tall buildings all around the woman.
060.jpg,A woman is standing in front of a city skyline. She is wearing a white and brown shirt and black pants. She has glasses on and has short dark hair. The sky behind her is orange and red. There is a tall skyscraper in the background.
061.jpg,There are many tall buildings in the background. There is a body of water in front of the buildings. There are small boats in the water. There appears to be dirt on the ground. 
062.jpg,A picture of a dirty area. There are many pieces of wood and leaves on the ground. There is a red and white sign in front of the picture.
063.jpg,This is an image of a city. The city appears to be in Vietnam. There are tall buildings in the background. The buildings are very modern. The sky is blue and clear. There is a large body of water in the front of the image. The water is calm. The trees are green and leafy. The street lights are tall and black.
064.jpg,A yellow and black construction vehicle is on the ground. There is a pile of dirt next to the vehicle. There are buildings behind the vehicle and a body of water in front of the building. 
065.jpg,A picture of a construction site. There is a very tall building in the background. The building is made of glass. There are many windows on the side of the building. The sky above the building is blue. The ground around the construction site is dirt. There's a yellow sign in front of the construction area. There appears to be a bulldozer in the dirt.
066.jpg,A picture of a construction site. There is a large yellow tractor in the dirt. There are tall buildings behind the tractor. 
067.jpg,There are tall buildings in the background. There is dirt on the ground in front of the buildings. There are trees next to the dirt. 
068.jpg,There are tall buildings in the background. There is a road in front of the buildings. There are light poles on the side of the road. 
069.jpg,A man is sweeping the street. He is wearing green pants and gray shoes. There is dirt on the ground behind the man. 
070.jpg,A yellow and black excavator is digging dirt. There is a large blue barrel on the ground next to the excavator. There are tall buildings behind the crane. 
071.jpg,There is dirt on the ground. There is a white curb in front of the dirt. There are red hoses coming out of the ground in the dirt next to the curb. 
072.jpg,There is a large black truck on the ground. There is a man standing next to the truck wearing a white shirt and black pants. There are tall buildings behind the truck. 
073.jpg,A pile of dirt is in front of a building. There is green grass behind the pile. 
074.jpg,There are tall buildings in the background. There is dirt on the ground in front of the buildings. There are light poles next to the dirt. 
075.jpg,Two people are standing in front of a screen. There are tall buildings on the screen behind them. There is a man in a blue shirt and a woman in a white shirt. They are both wearing glasses.
076.jpg,A man and a woman are standing in front of a TV screen. They are both wearing eyeglasses. The man is wearing a blue shirt and an orange tie. The woman has a white and brown shirt on. There are tall buildings behind them. 
077.jpg,A man and a woman are standing in front of a TV screen. They are both wearing glasses. The man is wearing a blue shirt and an orange tie. The woman has a white and brown shirt on. There are tall buildings on the screen behind them. 
078.jpg,There is a man laying in a hospital bed. There is a nurse standing next to the bed. The nurse is wearing a white uniform and a face mask. There are medical equipment hanging from the wall. 
079.jpg,There is a syringe with a plastic bag on top of it. The syringe is silver in color. There is a red and white sign under the syringe. 
080.jpg,There are several hospital beds in a room. There are people sitting on the beds. There is a man in a gray jacket standing in front of the bed. 
081.jpg,A man is wearing a blue and white striped shirt. There is a blue sign on the wall behind the man. The man has short black hair. 
082.jpg,A person is wearing a white glove and is holding a pair of scissors. There is a silver tray on top of a green blanket. There are silver bars in front of the tray. 
083.jpg,A person is laying on a bed. They are wearing a blue and white striped shirt. There is a red chair next to the bed. 
084.jpg,A woman is wearing a white lab coat and white gloves. She has a blue cap on her head and a white mask on her face. There is a hospital bed in front of her. 
085.jpg,A person is wearing white gloves. They are putting a bandage on the foot of the person. There is a white bed under the foot. 
086.jpg,A man is wearing a blue suit and a white shirt with a black tie. He has short black hair and is wearing glasses. There is a white wall behind the man.
087.jpg,A picture is hanging on a white wall. There is a picture on the wall with a black frame. The picture has a triangle on it. There are pictures on the bottom of the triangle. 
088.jpg,People are sitting at tables with red tablecloths on them. There are people standing in front of them wearing face masks. There is a white wall behind them with signs on it. 
089.jpg,A person is holding a white and blue electronic device. There is a screen on the device with numbers on it. The person is touching the screen with their thumb. 
090.jpg,There are two people sitting at a table. They are wearing white face masks. There are bottles on the table in front of them. 
091.jpg,There is a large blue sign in front of a white building. There is a tree next to the sign. The sign has white writing on it.
092.jpg,People are sitting at tables under a white tent. They are all wearing face masks. There is a blue sign on a pole in front of them. 
093.jpg,A person is laying on a white surface. They have a black cord wrapped around their arm. There is writing on the side of the cord. 
094.jpg,A man and a woman are standing in front of a white table. They are both wearing glasses. The man is wearing a blue shirt and an orange tie. He is holding a red object in his hands. There is a large picture of buildings behind them. 
095.jpg,Two people are standing in front of a large screen. There are tall buildings on the screen behind them. There is a man in a blue shirt and a woman in a white shirt. They are both wearing glasses.
096.jpg,Two people are standing in front of a large picture of a city. The man on the left is wearing a blue shirt and an orange tie. The woman on the right has a white shirt with orange flowers on it. They are both wearing glasses. 
097.jpg,A man is standing in the middle of a flooded street. He is wearing a blue jacket. There is a white car driving on the street. There are several people standing on the side of the street wearing red jackets. 
098.jpg,There is water on the ground. There are cars parked on the side of the street. There is a person wearing a red jacket walking in the water. 
099.jpg,There are several cars and motorcycles on the street. There are people standing on the sidewalk next to the cars. There is a red light on the back of a truck. 
100.jpg,There is a red boat in the water. There is a blue barrel on the side of the boat. There are ropes and other items on top of the red boat. 
101.jpg,A picture of a person's arm with a bandage on it. The bandage is white. There is blood on the bandage. The person is wearing blue shorts. The picture has a red border around it. There are words on the bottom of the picture. The time on the picture is 18:36:40.
102.jpg,There is a motorcycle laying on its side on the street. There is a blue truck behind it. There are people standing next to the motorcycles. 
103.jpg,A man is wearing a yellow jacket and a white helmet. He has a gray backpack on his back. There is a large truck behind the man. The truck is blue in color. 
104.jpg,Two people are standing behind a white table. There is a large screen behind them with a city on it. The man is wearing a blue shirt and an orange tie. 
105.jpg,Two people are standing in front of a large screen. There is a city on the screen behind them. The man is wearing a blue shirt and an orange tie. 
106.jpg,There is a yellow boat in the water. There is a red pole in front of the boat. There are several windows on the side of the yellow boat. 
107.jpg,"The image is a screenshot from a news channel. The channel name is HTV7. The time of the channel is 18:37:52. There is a picture of a boat in the water. The boat is painted yellow, blue and red. The water appears to be choppy."
108.jpg,There is a picture on the wall. The picture is yellow and brown. There is a white frame on the picture. There are words under the picture in a foreign language. 
109.jpg,There is a yellow wall next to a gray wall. There is a black tire on the ground in front of the wall. 
110.jpg,A picture of a yellow building. There is a white frame on the side of the building. The picture is taken from a distance. There are words written in a foreign language below the picture. 
111.jpg,There is a bright yellow wall. There is a small window in front of the wall. The window is white and there is a black screen on the window.
112.jpg,There is a red boat in the water. There is a yellow pole on the front of the boat. There are several ropes on the boat next to the pole. 
113.jpg,A person is getting their hair cut. There is a white bottle on the table in front of them. The person has a silver watch on their wrist. 
114.jpg,There are several boats in the water. The water is calm and has small waves in it. There are white clouds in the sky.
115.jpg,A man is standing in front of a city skyline. He is wearing a blue shirt and a red tie. He has glasses on and is holding a red object in his hands. The sky behind the man is orange and yellow. 
116.jpg,A man is wearing a blue shirt and a red tie. He is holding a tablet in his hands. There are tall buildings behind him. There is a red sky behind the man.
117.jpg,There are two men sitting at a table. There is a black laptop on the table in front of them. The man on the right is wearing a green uniform. 
118.jpg,A computer screen is open to a page of text. The text appears to be written in a foreign language. There is a red and white logo at the bottom of the screen.
119.jpg,A man is sitting in a room with white walls. He is wearing a black shirt. There is a green jacket hanging on a wall behind him. There are white doors on the wall behind the man.
120.jpg,There are several people standing on the street. There is a man on a motorcycle in front of them. The man on the motorcycle is wearing a black helmet. 
121.jpg,There is a man standing in a dark room. He is wearing a brown jacket. There is a person behind him wearing a white face mask. There are words written in front of the man.
122.jpg,There are three people standing next to a motorcycle. There is a man in a yellow jacket and a red helmet on top of the motorcycle. 
123.jpg,A man is standing in front of a group of people. He is wearing a yellow shirt. There is a large tree behind him. The sky above the man is dark. 
124.jpg,There are two men standing in front of a black background. One of the men is wearing a yellow collared shirt. The other man has short brown hair. There is a light behind the men. 
125.jpg,A woman is standing in front of a city skyline. She is wearing a short sleeve shirt with brown flowers on it. She has short brown hair and glasses on. The sky behind her is orange and red. There is a tall skyscraper in the background. 
126.jpg,A woman is wearing a white shirt with brown flowers on it. She is wearing glasses and is standing in front of a large city. There is a tall skyscraper in the background. 
127.jpg,There are three men sitting at a table. There is a large brown cabinet behind them. The man in the green shirt is writing on a piece of paper. 
128.jpg,A man is standing in front of a white wall. He is wearing a short sleeve shirt. There is a window behind the man. The man has short black hair. 
129.jpg,A man is riding a scooter down the street. He is wearing a white shirt and brown shorts. There is a silver car on the street behind him. There are several other scooters parked on the sidewalk next to the sidewalk. 
130.jpg,There is a silver car parked on the street. There is a man riding a motorcycle next to the car. There are two scooters parked in front of a building. 
131.jpg,A man is riding a scooter down the street. He is wearing a white shirt and brown shorts. There is a silver car parked on the street behind him. There are two scooters parked in front of a building. 
132.jpg,A man is riding a motorcycle. He is wearing a helmet on his head. The motorcycle has a red tail light on it. There are trees on the side of the road. 
133.jpg,There are two men sitting at a table. The man on the left is wearing a green shirt. He is holding a book in his hand. The book is white. The table is brown. There are lockers behind the men. The lockers are gray. There is a water bottle on the table in front of the table.
134.jpg,There are three men sitting at a table. There is a large brown cabinet behind them. There are windows on the wall next to the cabinet. The men are wearing green shirts. 
135.jpg,A man and a woman are standing in front of a white table. They are both wearing eyeglasses. The man is wearing a blue shirt and an orange tie. The woman has a white and brown shirt on. There are tall buildings behind them. 
136.jpg,A man and a woman are standing in front of a TV screen. They are both wearing glasses. The man is wearing a blue shirt and an orange tie. He is holding a small box in his hands. The woman is also wearing a white and brown shirt and black pants. There is a large cityscape behind them. The sky is orange and pink.
137.jpg,A man in a blue shirt and orange tie is standing next to a woman in a white shirt. They are both wearing glasses. There is a red wall behind them. 
138.jpg,Four men are standing in a room. They are all wearing black uniforms with yellow stripes on the sleeves and pants. They have red helmets on their heads. The walls of the room are white and there is a brown wall behind them. 
139.jpg,A man is wearing a red helmet and a blue jacket. He is holding something in his hands. There is a brown wall behind him. 
140.jpg,Two men are wearing red hard hats and blue jackets. They are holding a black machine. There is a white wall behind them. 
141.jpg,Two men are wearing black jackets and red helmets. They are holding black steering wheels. There is a silver door behind them. 
