frame,caption
280.jpg,There are several people standing in front of water. There are trees behind them. They are holding purple flowers in their hands. There is a woman in a pink jacket standing next to them.
281.jpg,There are people standing under a blue tent. There are white chairs behind the tent. A man is wearing a white hat and a black jacket. There is a woman in a pink shirt and black pants standing next to the man. 
282.jpg,A large group of people are walking in a parking lot. They are all wearing pink shirts and black pants. There are trees behind the people. There is a black tent behind them. 
283.jpg,There are people standing in a parking lot. They are wearing pink shirts and green jackets. There is a white tent behind them. There are cars parked in front of a building. 
284.jpg,There is a long red boat on the water. There are people in the boat wearing red shirts. They are holding paddles in their hands. There is a man in a red shirt standing on the side of the boat. 
285.jpg,A man is standing in front of a news set. He is wearing a blue shirt and an orange tie. There is a large screen behind him that shows a city with tall buildings and a red sky.
286.jpg,A man and a woman are standing behind a white desk. They are both wearing glasses. There is a large screen behind them. There are many buildings on the screen. 
287.jpg,There is a large cloud of black smoke in the sky. There is a white building next to the smoke. There are palm trees in front of the building. 
288.jpg,There are several people walking on a street. There is a building behind them with smoke coming out of it. There are power poles in front of the building.
289.jpg,There are people standing in front of a building. There is black smoke coming out of the building. The man in the blue shirt is wearing a white hat. 
290.jpg,There is a large black cloud of smoke in the sky. There is a building on fire in front of the building. There are wires hanging from the building above the fire.
291.jpg,There are three people standing outside of a building. There is a red fire extinguisher on the ground in front of the people. A ladder is leaning against the wall of the building. 
292.jpg,There is a red light in the background. There is snow on the ground in front of the light. There are white chairs on the snow. 
293.jpg,"The image is blurred. It appears to be a city at night. There are buildings in the background. The lights are bright and red. There is a watermark in the top right corner that reads ""HTV7 HD 18:57:47"". There are words in the bottom left and right corners that say ""TAN - LY HAN - QUOC THANG""."
294.jpg,There is a red light coming from a building. There are stacks of plastic bags on the ground in front of the building. 
295.jpg,Two people are standing behind a white table. There is a large screen behind them with a city on it. The man is wearing a blue shirt and an orange tie. 
296.jpg,A man and a woman are standing in front of a news desk. The desk is white and has a red logo on it. There is a large screen behind them. There are buildings on the screen. 
297.jpg,Two people are standing in front of a television set. There is a large screen behind them. There are many buildings on the screen. The man is wearing a blue shirt and tie. 
