frame,caption
133.jpg,"There is a large stage in the middle of a crowd. There is a sign above the stage that says ""Trawlermen"". There are several people standing on the stage. There are buildings on either side of the stage with people standing in front of them. "
134.jpg,There is a large white building in front of a crowd of people. There is a blue and yellow structure in the front of the crowd. There are people standing on top of the structure.
135.jpg,This is an image of a video game. The game is called Hana. There are a lot of characters in the game. There is a large face on the left side of the image. The face has two eyes and a nose. The eyes are glowing yellow. The mouth of the face is black. The letters on the image are blue and white.
136.jpg,There is a large crowd of people gathered on a street at night. There are tall buildings on the side of the street. There is a float in the middle of the crowd. The float is decorated with colorful lights and there is lots of smoke coming out of it.
137.jpg,There is a large float in the middle of a crowd of people. The float has colorful decorations on it. There is a building next to the float. 
138.jpg,There is a large float in the street. There are people standing on top of the float. There is a building behind the float with a red sign on it. 
139.jpg,There is a large stage with several people standing on it. There are people sitting in front of the stage watching the people on the stage. There is a white building behind the stage with a blue sign above it.
140.jpg,There is a large statue of an elephant. There are people standing around the statue. There is a white building behind the statue with people standing in front of it. 
141.jpg,A woman is standing on a stage with her arms stretched out in front of her. She is wearing a red shirt and a colorful skirt. There are large speakers behind her. There is a large building behind the woman. 
142.jpg,There is a float in the middle of the street. There are people standing on top of the float. There is a large crowd of people surrounding the float in front of a building. 
143.jpg,This is an image of a street. The street is lined with buildings. The buildings are yellow and white. There is a large structure in the middle of the street. There are people standing around the structure. The sky above the structure is dark black.
144.jpg,A man in a white shirt and tie is standing in front of a large screen. There is a city on the screen behind him. The man is wearing glasses and has short black hair. 
145.jpg,A man in a white shirt and tie is standing in front of a city. He is wearing glasses and has short black hair. There is a large screen behind him with a picture of a bridge over water on it.
146.jpg,A man in a white shirt and tie is standing in front of a large screen. There is a picture on the screen next to him. There are many people standing on a train track next to water. 
147.jpg,A man in a white shirt and tie is standing in front of a large screen. There is a large picture on the wall behind the man. There are many buildings on the ground behind him. 
148.jpg,There is a long train on a bridge. The bridge is over a large body of water. There is a mountain behind the bridge. There are people standing on the bridge next to the train. 
149.jpg,A man is taking a picture of himself on a bridge. He is holding a black phone in his hands. He has dark hair and is wearing sunglasses. There is a large body of water next to the bridge. The sky above the water is blue with white clouds.
150.jpg,There is a long bridge in the middle of the water. There are many people walking on the bridge. There is an airplane flying above the water in the distance. 
151.jpg,This is an aerial view of a bridge. The bridge is very long. The water below the bridge is calm and still. There are a few small waves in the water. There is a small boat on the bridge.
152.jpg,A man is wearing a white hat and a blue collared shirt. He is standing in front of a white and red wall. There is a window on the wall behind the man. The man is gesturing with his hands. 
153.jpg,A man is wearing a white hat and a blue shirt. He is standing in front of a white wall. There is a window on the wall behind him. 
154.jpg,A woman is standing in front of a blue and gold train. She is wearing a white top with black dots on it. The woman has short brown hair and is wearing large white earrings. The train has large windows on the side of it. 
155.jpg,A woman is standing in front of a blue train. She is wearing a white top with black dots on it. The woman has short brown hair. There is a ladder on the side of the train. 
156.jpg,There are several people standing on a bridge. There is a large body of water next to the bridge. The sky above the water is blue. There are trees on the other side of the water. 
157.jpg,There are several people standing on a bridge. There is a train on the tracks next to them. There are water next to the bridge. 
158.jpg,A black screen with a red and white image on it. There are small white dots all over the image. There is a red line on the left side of the screen. 
159.jpg,There are five men on a video call. They are all wearing black shirts. There is a white wall behind them. The man in the middle is wearing a white collared shirt. 
160.jpg,There is a black printer on a table. There are wires coming out of the back of the printer. There is a white paper roll on the table next to it.
161.jpg,Three people are sitting at a table. There is a laptop on the table in front of them. There are papers on top of the table. 
162.jpg,A person is sitting in a chair. They are wearing a black shirt. There is a white paper in front of the person. The person has a white mask covering their face. 
163.jpg,There are several motorcycles parked in front of a white building. There is a man in a green shirt holding a clipboard. There are two people standing next to the motorcycles.
164.jpg,A woman in a white dress is standing in front of a red background. She is holding a brown wallet in her hands. There is a picture on the wall behind the woman. 
165.jpg,"A woman is standing in front of a red background. She is wearing a white short sleeve shirt and a white skirt. The woman is holding a brown wallet in her hands. There is a large picture on the right of the woman. The picture is of a city with tall buildings and a bright yellow sky. The word ""giay"" is written in red on the picture."
166.jpg,A woman is standing in front of a red background. She is wearing a white short sleeve shirt and a white skirt. She has short black hair. The woman is holding a red wallet in her hands. There is a large picture on the right of the woman.
167.jpg,A woman is standing in front of a red background. She is wearing a short sleeve white shirt and holding a red wallet. There is a large picture on the wall behind the woman. The picture has red and yellow writing on it.
168.jpg,There are five pictures of a man on a video call. The first picture on the top left is a man wearing a gray shirt. The second picture in the middle is a boy wearing a white collared shirt. He is wearing a black shirt and glasses. The third picture is of the same man. He has short black hair. The fourth picture shows the same boy with glasses.
169.jpg,A black printer is sitting on a table. There are wires coming out of the back of the printer. There is a red and white sign on the bottom of the picture. 
170.jpg,There is a brown desk in a room. There are two large black monitors on top of the desk. There is a black printer on the desk next to the monitors. 
171.jpg,There are five images of a man on a video call. The first image on the top left shows a man wearing a gray shirt. The second image in the middle shows the same man with a white polo shirt on. The third image shows him wearing a black shirt and glasses. The fourth image shows the man with glasses on. There is a white background behind the men.
172.jpg,This is a picture of a printer. The printer is black in color. There are six stickers on the front of the printer. There is a white cord coming out of the back of the machine. The machine is sitting on a table. The table is black. The wall behind the printer is made of wood.
173.jpg,There is a brown desk in a room. There are two large black monitors on top of the desk. There is a black printer on the desk next to the monitors. 
174.jpg,A man in a pink shirt and tie is holding a book. He is wearing glasses. There is a large screen behind him. There are buildings on the screen. 
175.jpg,A man in a pink shirt and tie is standing in front of a screen. He is holding a red object in his hands. There is a large screen behind the man. 
176.jpg,A man in a white shirt and tie is standing in front of a window. He is holding a red book in his hands. There is a red and white sign behind the man. 
177.jpg,A group of people are standing outside of a building. They are all wearing green shirts. There is a motorcycle parked in front of the building. 
178.jpg,The building is white. There are windows on the building. There is a white box in front of the white building. The box has writing on it. 
179.jpg,There are several people standing in a line. They are all wearing green jackets. There is a blue motorcycle in front of them. 
180.jpg,There are several motorcycles parked on the street. There is a yellow motorcycle in front of them. There are people standing next to the motorcycles. 
181.jpg,There are several people standing outside of a building. There are two motorcycles parked in front of the building. One of the motorcycles is white and has a black helmet on top of it. There is a man in a green shirt standing in front the motorcycles.
182.jpg,A group of people are standing outside of a building. They are all wearing green jackets. There is a man sitting down in front of them. 
183.jpg,A group of people are standing outside of a building. They are all wearing green jackets. There is a man sitting down in front of the building. 
184.jpg,A white building has many windows on the side of it. There are clothes hanging from a line above the building. There is a white box on the wall next to the windows. 
185.jpg,There are several people standing in front of a white van. There are clothes hanging on a fence next to the van. 
186.jpg,There are several motorcycles parked in front of a building. There are two men walking towards the building. One of the men is wearing a red shirt and gray pants. 
187.jpg,A man in a pink shirt and tie is standing in front of a large screen. He is holding a red box in his hands. There is a red and white logo on the screen behind him. 
188.jpg,A man in a pink shirt and tie is holding a red book. He is wearing glasses and has a watch on his wrist. There is a large screen behind the man. 
189.jpg,A man in a pink shirt and tie is standing in front of a screen. He is holding a tablet in his hands. There is a picture on the screen next to the man. 
190.jpg,There are three people riding motorcycles down the street. There is a red light on the street in front of them. There are buildings on the side of the street next to them. 
191.jpg,A police officer wearing a green vest and a white hat is standing next to a black car. There is a red van parked on the side of the street. There are several street lights on the sidewalk. 
192.jpg,A police officer is standing on the side of a road at night. The officer is wearing a green vest and a black hat. There are two cars on the road in front of the officer. One of the cars has its headlights on. There is a tree on the sidewalk next to the cars. There several street lights on poles on the street.
193.jpg,There are three people sitting at a table. They are wearing hats on their heads. There is a blue bag on the table in front of them. 
194.jpg,There are five men sitting around a red table. They are wearing uniforms and hats on their heads. One of the men is wearing a yellow hard hat on his head. There are motorcycles parked behind them. A man in a white shirt is standing in front of them. 
195.jpg,A white piece of paper is sitting on top of a brown motorcycle. There is a black seat on the motorcycle. The ground under the motorcycle is gray. 
196.jpg,There are three police officers standing on the street. There is a white car parked in front of the officers. The lights on the motorcycle are turned on. The sky is dark and there is a street light on the sidewalk.
197.jpg,There are four people sitting at a table. There is a man in a black shirt with a white helmet on his head sitting in front of the table. The man in the black shirt is wearing a watch. 
198.jpg,There are three men sitting at a table. They are wearing uniforms and red hats. There is a white cup on the table in front of them. 
199.jpg,A woman is standing in front of a large screen. She is wearing a white shirt and a pink skirt. There is a red rug on the floor in between the screen. 
200.jpg,There is a man and a woman standing behind a white desk. There is a large screen behind them with a city on it. The man is wearing a white shirt and a tie. The woman has a white blouse on and is standing in front of the desk. 
201.jpg,A man and a woman are standing in front of a news desk. The desk is white and has a red logo on it. The man is wearing a white shirt and tie and is holding a book in his hands. The woman is standing behind the desk wearing a short sleeve white shirt. There is a large screen behind them that has a city on it and a red sky.
202.jpg,There is a picture of a submarine in the water. There is a large bridge behind the submarine. There are trees on the other side of the bridge. 
203.jpg,A submarine is seen in the water. There is a large bridge in the background. There are trees on the other side of the bridge. The water is blue and there are small waves in it.
204.jpg,There is a large ship in the water. There are large clouds in the sky above the ship. There is a smaller ship next to the larger ship. The water is calm and has small waves in it.
205.jpg,There is a large ship in the water. There are many clouds in the sky above the ship. There is a flag on the top of the ship hanging from a pole. The water is calm with small waves in it.
206.jpg,A large ship is sitting in the water. There are people standing on the side of the ship. There is a flag hanging from a pole on the top of the boat. 
207.jpg,There are several people sitting in chairs. There is a flag behind them on a small table. There are pictures hanging on the wall behind them. 
208.jpg,There are several people sitting in chairs in a room. They are all wearing suits and ties. There is a black table in front of them with water bottles and glasses on top of it. There are pictures hanging on the wall behind them. 
209.jpg,Four people are sitting in chairs and talking to each other. They are all dressed in business attire. There is a flag behind them that is black and white with a green and red stripe on it. The man on the right is wearing a blue suit and a blue tie. He has a watch on his wrist and is looking off to the side.
210.jpg,A man and a woman are sitting in a room. The man is wearing a black suit and a white shirt with a blue tie. The woman has blonde hair. There is a white wall behind them. 
211.jpg,A man and a woman are standing in front of a large screen. They are both holding small red objects in their hands. The man is wearing a pink shirt and a tie. The woman is also wearing a white shirt. There are large buildings on the screen behind them. There is a large orange sky above the buildings.
212.jpg,A man and a woman are standing in front of a white table. They are both holding red purses. The man is wearing a pink shirt and a tie. There are tall buildings behind them. 
213.jpg,A man and a woman are standing in front of a large screen. They are both holding red folders in their hands. The man is wearing a pink shirt and a striped tie. The woman is also wearing a white shirt and has short black hair. There are large buildings on the screen behind them. 
214.jpg,There are three people standing in a room. There is a man in a green uniform standing next to a woman in a white shirt and pink shorts. There are shelves on the wall behind them with bottles on them.
215.jpg,There are three people standing in a room. There is a man in a green uniform standing next to a woman in a white shirt and pink shorts. There are shelves on the wall behind them with bottles on them. 
216.jpg,There are two men standing in a room. They are wearing green uniforms. There is a large wooden cabinet behind them. There are shelves on the cabinet. 
217.jpg,A man in a green uniform is standing in a room with a woman in a white shirt and pink shorts. There is a large wooden cabinet behind them with bottles on top of it. A white fan is sitting on the floor in front of the cabinet. 
218.jpg,A man and a woman are standing in a room. There are clothes hanging on a rack in front of them. There is a green cabinet next to the closet. 
219.jpg,A man in a green shirt is standing in front of a bookshelf. There is a woman in a white shirt standing next to the man. There are books and bags on the shelves. 
220.jpg,A man in a green shirt is bending over a kitchen counter. There is a sink on the counter in front of him. There are wooden cabinets under the counter. 
221.jpg,A man in a green shirt is standing in front of a sink. There is a red bottle on the counter next to the sink. Above the sink is white cabinets. 
222.jpg,A man in a green shirt is standing in front of a glass door. There is a yellow wall behind the man. The man is wearing a black belt. 
223.jpg,There are two men sitting at a table. There are papers on top of the table. The man on the right is wearing a green shirt and glasses. He has a watch on his wrist. 
224.jpg,A man and a woman are standing behind a news desk. The desk is white and has a red logo on it. The man is wearing a white shirt and tie and is holding a red object in his hands. The woman is also wearing a short sleeve shirt and a necklace. There is a large screen behind them. There are many buildings on the screen.
225.jpg,A man and a woman are standing in front of a news desk. The desk is white and has a red logo on it. The man is wearing a white shirt and tie and is standing behind the desk. There is a large screen behind them. There are buildings on the screen. 
