frame,caption
131.jpg,A man is standing in front of a cityscape. He is wearing a blue collared shirt and a yellow tie. He has glasses on and is holding a red folder in his hands. The sky behind him is orange and red. There are tall buildings in the city behind him. 
132.jpg,A man is standing in front of a cityscape. He is wearing a blue shirt and a yellow tie. He has glasses on and is holding a tablet in his hands. The sky is orange and there are buildings in the background.
133.jpg,There are black flags hanging from the ceiling of a building. There is water under the ceiling. There are people standing on the side of the building. 
134.jpg,A scuba diver is standing in a pool of water. He is wearing a full scuba diving suit. He has an oxygen cylinder strapped to his head. The water is blue and there are white tiles on the floor of the pool.
135.jpg,The image is a screenshot from a video. It appears to be raining. There is a person in the middle of the image. The person is wearing a black outfit. There are white clouds in the sky. The weather is very cloudy. The time on the image is 18:40.07.
136.jpg,A scuba diver is in the water. He is wearing a full scuba diving suit. He has a scuba helmet on his head. There is water splashing up from his head as he scuba divers. The water is blue and there are tiles on the ground in front of him. There are words written on the bottom of the screen. 
137.jpg,There is a large swimming pool inside of a building. There is a man standing next to the pool wearing a red shirt and black pants. The pool has blue water in it. There are large pipes hanging from the ceiling of the building.
138.jpg,There is a large pool with blue water in it. There are two people sitting on the edge of the pool. One of them is wearing a blue shirt and a black mask on their face. 
139.jpg,A man is sitting on the edge of a swimming pool. He is wearing an orange shirt and black pants. There is a scuba mask in the water in front of him. 
140.jpg,A man is standing in front of a pool. He is wearing a blue shirt. The man has short brown hair. There is water splashing on his head. 
141.jpg,There is a large swimming pool inside of a building. There are black flags hanging from the ceiling in front of the pool. There is a man in a blue shirt and black shorts sitting on the edge of the swimming pool.
142.jpg,There is a woman wearing a black tank top. There is a necklace around her neck. The woman has long blonde hair. There are plants behind the woman. 
143.jpg,A man is wearing a blue shirt and white pants. He has an oxygen tank strapped to his chest. He is also wearing a mask on his head. 
144.jpg,There is a yellow basket on the ground. There are several items in the basket. There is a metal cage behind the basket with items in it. 
145.jpg,There is a gray object in front of a black fence. There is a blue and white sticker on the front of the object. There are words written on the bottom of the image.
146.jpg,The image is of a large indoor swimming pool. The pool is reflecting the sky and the ceiling of the building. There are black flags hanging from the ceiling. People are standing on the stairs to the left of the pool.
147.jpg,A woman in a yellow dress is standing in front of a large screen. The screen has a red and white logo on it. The woman is holding a red object in her hands. 
148.jpg,A woman in a yellow dress is standing in front of a red background. She is holding a gold trophy in her hand. There is a picture of the same woman next to her. 
149.jpg,There is a woman in a yellow dress standing in front of a screen. She is holding a brown box in her hands. There is a picture behind her that is of two men and a woman holding trophies in their hands. The man in the picture is wearing a black suit and a black hat. 
150.jpg,A man and a woman are standing on a stage. They are both holding golden awards in their hands. The woman is wearing a white dress with a black sash around her waist. The man is dressed in a black suit with a white shirt and a black tie. The wall behind them is black with white writing on it.
151.jpg,A woman is wearing a white bra. She is holding a black object in her hand. There is a gold foil wrapped object in front of the woman. 
152.jpg,A woman is smiling and holding a gold object in her hand. She is wearing a white bra. There is writing on the bottom of the image. 
153.jpg,A woman is standing in front of a gray wall. She is wearing a white bra and has black hair. There is a black microphone in her hand. The woman is speaking into the microphone. 
154.jpg,A woman is standing in front of a gray background. She is wearing a white halter top. She has black hair that is pulled back in a ponytail. The woman is holding a black microphone in her hand. There is writing on the bottom of the image.
155.jpg,A woman in a white dress is holding a golden trophy. There is a black wall behind the woman with writing on it. The woman has long black hair. 
156.jpg,A woman is standing in front of a gray wall. She is wearing a white dress and has black hair. The woman is holding a gold statue in her hands. There is writing on the bottom of the image.
157.jpg,A man is holding a golden object in his hand. He is wearing a black suit and a white shirt. There is a gray wall behind the man. 
158.jpg,A woman is standing in front of a red wall. She is wearing a black jacket and a white collared shirt. She has a necklace around her neck. The woman has short black hair. 
159.jpg,"A woman is standing on a red carpeted stage. She is wearing a long black and white dress with a black jacket over it. The woman has short dark hair and is smiling. There is a watermark in the top right corner of the image that reads ""HTV7 HD 18:41:54"". Below the image there is a caption in Vietnamese that ends with ""Viet Nam thu hon 6,9,9 do la My tu xuat khau sat sau 10 thang""."
160.jpg,There are three people standing on a stage holding trophies. They are wearing black suits. There is a black wall behind them with chinese writing on it. 
161.jpg,A woman in a yellow dress is standing in front of a red background. She is holding a tablet in her hands. There is a large screen behind her with fireworks on it. 
162.jpg,There are red and white lights in the sky. There is water in front of the lights. The water is reflecting the lights on the water. The sky is completely black. There are small white buildings in the distance.
163.jpg,Fireworks are lighting up the night sky. The sky is completely black. The fireworks are white and bright. There is a body of water in front of the fireworks. There are people standing on the other side of the water.
164.jpg,There are fireworks in the sky. The sky is black. The fireworks are white and pink. There are small white dots on the fireworks. There is a watermark in the bottom left corner of the photo that says 100 thanh pho toi nhat the gioi 2024. The time is 18:42:26.
165.jpg,There are fireworks in the sky. The sky is black. The fireworks are white and bright. There are small white dots on the firework. There is water under the fireworks. 
166.jpg,There are fireworks in the sky. The sky is black. There are many white and red fireworks. There is a large crowd of people watching the fireworks. 
167.jpg,There are fireworks in the sky. The sky is black. There are white and yellow fireworks. There is a crowd of people watching the fireworks. 
168.jpg,There is a stage with several people standing on it. There is a large screen behind them. There are lights hanging from the ceiling above the stage.
169.jpg,There are people standing in front of a structure. There are lights hanging from the branches of the structure. The sky above the structure is dark. There is an american flag hanging from a pole in the background.
170.jpg,There are fireworks in the sky. There are people standing in front of the fireworks. They are wearing white shirts. 
171.jpg,There are fireworks in the sky. The sky is black. The fireworks are pink and white. There are small white dots on the fireworks. There is a red and white logo on the top right corner of the screen. The time is 18:42:50.
172.jpg,A woman is standing in front of a screen. She is wearing a yellow dress and holding a brown object in her hands. There is a large white screen behind the woman. 
173.jpg,A woman in a yellow dress is standing in front of a red background. There is a picture next to the woman in the yellow dress. There are people standing behind a fence behind the woman. 
174.jpg,A large group of people are standing in a line outside of a building. They are all wearing shirts and shorts. There is a man in a black jacket standing in front of them. There are tall buildings behind them. 
175.jpg,A large group of people are running in a race. They are all wearing tank tops and shorts. There is a large building behind them with many cars parked in it. 
176.jpg,There are people running on a street. There is a large building behind them. There are people standing in front of the building. 
177.jpg,There are people walking on the street. There is a man in a turkey costume standing next to a woman. There are tall buildings behind them. 
178.jpg,There are people walking on a street. There are tall buildings behind them. There is a person in a costume standing in front of them. 
179.jpg,There are two people wearing costumes. They are running down the street. There is a man in a black shirt behind them. There are people standing behind a fence. 
180.jpg,There are two people dressed up in costumes. They are dancing. There are people standing behind a fence watching them. There is a large red ball behind the fence. 
181.jpg,Five people are standing together in a group. They are all wearing medals around their necks. Two of the people are wearing hats on their heads. There are buildings behind them. 
182.jpg,There are four people standing together. They are all wearing turkey hats on their heads. There are trees behind them in the grass. There is a building behind them. 
183.jpg,A woman is standing next to a mascot. The mascot is wearing a red and yellow outfit. There are people standing behind the woman. There is a white building behind them. 
184.jpg,A man is standing in front of a city skyline. He is wearing a blue shirt and a yellow tie. He has glasses on and is holding a red book in his hands. The sky is orange and there are tall buildings in the background.
185.jpg,A man is standing in front of a city skyline. He is wearing a blue shirt and a yellow tie. He has glasses on and is holding a red folder in his hands. There is a red sky behind the man.
186.jpg,There is a large elephant standing in a field of grass. There are trees behind the elephant. There is a smaller elephant under the larger elephant. 
187.jpg,There is a large elephant and two smaller elephants walking in the grass. There are trees behind the elephant. The elephant has long white tusks. 
188.jpg,There is a large elephant standing in a field. There are small baby elephants under the elephant. There is grass on the ground around the elephants. 
189.jpg,There is a large elephant walking in a field. There are two smaller elephants under the larger elephant. There is grass and trees in the field behind the elephant.
190.jpg,There is a large elephant with two smaller elephants under it. They are walking in the grass. There are trees behind them. 
191.jpg,There is a large elephant standing in the grass. There is a smaller elephant under the larger elephant. There are trees behind the elephants. 
192.jpg,There is a large elephant standing in the grass. There is a smaller elephant under the larger elephant. There are trees behind the elephants. 
193.jpg,There are several elephants standing in a field of grass. There are trees in the distance behind them. The elephants are all brown and have white tusks.
194.jpg,There are four elephants walking in the grass. There are trees behind the elephants. The elephants are large and brown. There is a baby elephant in front of the larger one. 
195.jpg,The image is completely black. On the right side of the image there is a red and black background. The red part of the background has small white dots on it. The dots are arranged in a circular pattern. The time and date are 18:44:39 on the top right corner of the screen.
196.jpg,"A logo is displayed on a white background. The logo is red and white. There are dots on the white background that are red. There is a large red circle in the middle of the logo. The word ""giay"" is written in white letters. Below the red circle is the word ""TIEP THEO"" in red letters."
197.jpg,"A document is written in Vietnamese. The document is titled UY BAN NHAN DAN QUAN 12. There are two lines of text on the document. The first line of text reads 8309/UBND-VP. The second line reads ""Quan 12, ngay 25 thang 11 nam 2023"". The third line reads, ""Kinh gui: - Trung tam Bao chi Thanh pho; - Cac co quan bao dai"". The document appears to be a formal document."
198.jpg,The image is a document written in Vietnamese. The document has a red and white border. The text on the document is written in a foreign language. There is a red stamp at the bottom right corner of the document.
199.jpg,There is a large white truck with a black tarp on the back of it. There is a silver fence in front of the truck. There are two people riding on a motorcycle in the street. They are both wearing helmets. 
200.jpg,A truck is parked on the street. There are many crates on the back of the truck. There is a motorcycle next to the truck on the ground. 
201.jpg,A woman in a yellow dress is standing in front of a red and orange background. She is holding a red folder in her hands. There is a large picture on the wall behind her. 
202.jpg,A woman is standing in front of a red background. She is wearing a short yellow dress. She has a microphone clipped to her shirt. The woman is holding a small brown object in her hands. There is a large picture on the right of the woman. The picture is of a city with tall buildings and a bright orange sky.
203.jpg,"The image is a document in Vietnamese. The document is titled UY BAN NHAN DAN QUAN 12. The text is written in both English and Vietnamese. There are two lines of text on the document. The first line of text reads 8309/UBND-VP. The second line reads ""Quan 12, ngay 25 thang 11 nam 2023"". The text below the text reads ""Kinh guri: - Trung tam Bao chi Thanh pho: - Cac co quan bao dai""."
204.jpg,The image is a postcard in Vietnamese. The postcard has a white background with black text. The text is written in a foreign language. At the bottom of the postcard there is a red banner with the number 16 on it.
205.jpg,The image is a text written in a foreign language. The text is written in black ink on a white background. There is a red stamp at the bottom of the image that says it is from the website htv7.com.
206.jpg,"The image is a text written in Vietnamese. The text is written in black ink on a white background. There is a red stamp on the top right corner of the image. The stamp has the letters ""HTV"" on it."
207.jpg,"The image is a text written in a foreign language. The text is written in black ink on a white background. There is a small logo in the top right corner that reads ""HTV7"" in red and black letters. Below the logo there is a red and white text that says ""Xe tai cho cho vien tro voo Gaza trong nguy ngyo 25/11"" in white letters."
208.jpg,"The image is a page from a book written in Vietnamese. The page has a white background and the text is written in black ink. There is a small logo in the top right corner that reads ""HTV7"" in red letters. Below the logo there is a description of the page in another language. The first word on the page is ""sau, suc khoie Giao vien chu nhiem binh thuong vai tue giang day cho den nay""."
209.jpg,The image is a postcard in Vietnamese. The postcard has two stamps on it. The stamp on the right is red with a white background and a white border. The text on the left is written in a foreign language. There is a copyright symbol in the top right corner of the postcard.
210.jpg,A woman is wearing a yellow dress. She is holding a brown object in her hands. There is a red and yellow sign behind the woman. 
211.jpg,A woman in a yellow dress is standing in front of a red background. She is holding a brown object in her hands. There is a large picture on the wall behind her. 
212.jpg,There is a large white truck with a black tarp on the back of it. There is a silver fence in front of the truck. There are two motorcycles next to the fence. 
213.jpg,There is a large white truck parked on the street. There are people standing in front of the truck. They are all wearing helmets on their heads. 
214.jpg,There are several motorcycles on the street. There is a white van behind the motorcycles. There are people standing on the sidewalk next to the van. 
215.jpg,Two men are standing in front of a white truck. One of the men is wearing a blue shirt and blue pants. The other man has a yellow shirt and a blue hat on. There are tall weeds next to the truck. 
216.jpg,A white truck is parked on the ground. There is a black tire on the truck. There are pieces of trash and debris all around the tire. 
217.jpg,A truck is parked on the side of the road. There is a motorcycle next to the truck. There are many boxes stacked on top of each other on the truck bed. The truck has large black tires on it. 
218.jpg,There are several cars parked on the side of the street. There is a man in a white shirt and a white hat on his head. There are wires hanging above the cars. 
219.jpg,There are two large trucks parked next to each other. There are people standing in front of the trucks. There is a man on a motorcycle wearing a red helmet. 
220.jpg,A man is standing in front of a city skyline. He is wearing a blue shirt and a yellow tie. He has glasses on and is holding a tablet in his hands. The sky behind him is orange and red. There are tall buildings and skyscrapers in the skyline.
221.jpg,A man is wearing a blue shirt and a yellow tie. He is wearing glasses and has short black hair. There is a city behind the man with tall buildings. 
222.jpg,There is a large green truck on the street. There is a white van next to the truck. There are people standing on the sidewalk in front of the van. 
223.jpg,A large green truck is driving on the street. There is a white trailer attached to the back of the truck. There are large black tires on the trucks.
224.jpg,There are several people standing on the sidewalk. There is a large green truck behind them. There are several motorcycles in front of the truck. 
225.jpg,A white motorcycle is laying on its side on the ground. There is a large bush next to the motorcycle. There are people standing behind the bike. 
226.jpg,There is a white motorcycle laying on the ground. There is a large bush next to the motorcycle. The motorcycle has a black seat on it. 
227.jpg,There is a large green truck parked on the street. There is a silver car next to the truck. There are two men standing in front of the car. One of them is wearing a white shirt and a blue hat.
228.jpg,There is a large truck on the street. The truck is green and red in color. There is a man standing next to the truck wearing a white shirt and black pants. There are white lines on the ground in front of the truck.
229.jpg,There is a large red truck parked on the street. There is a yellow pole in front of the truck. There are people standing next to the truck on the sidewalk.
230.jpg,A woman is standing in front of a red background. She is wearing a short yellow dress. She has short black hair and is holding a small brown box in her hands. There is a large picture on the right of the woman.
231.jpg,A woman in a yellow dress is standing in front of a red background. She is holding a brown object in her hands. There is a large picture on the right of the woman. 
232.jpg,There is a video playing on a computer screen. There are several people in green uniforms standing in a line. There is a red box in front of them. 
233.jpg,A pink certificate is displayed on a pink background. The certificate has a picture of a man on the left side of it. The man is wearing a blue shirt and tie. There is writing on the certificate above the picture of the man.
234.jpg,There are four people sitting around a table. There is a man in a white and blue shirt standing in front of them. There are papers on top of the table. 
235.jpg,A picture of a phone screen with a cartoon girl on it. There is a text message next to the girl. The phone screen has a blue background. There are several icons on the top of the screen. 
236.jpg,"A screenshot of a text message from a user named Bui Hoang Trung. The text message is written in Vietnamese. The background of the image is white. At the bottom of the screen there is a message in Vietnamese that says ""Môt chiec may bay nho nho bi rai tai ai""."
237.jpg,There are two women sitting at a red table. There is a man standing in front of them wearing a green shirt and a red hat. There are bags hanging on the wall behind them. 
238.jpg,There are two women sitting in red chairs. There are bags hanging from the ceiling behind them. There is a yellow shelf behind them with bags on top of it. 
239.jpg,A woman with long black hair is wearing a red shirt. There is a white door behind the woman. There are colorful items on a shelf behind her. 
240.jpg,A woman is standing in front of a red sign. She is wearing a red jacket and has black straps on her shoulders. There is a green chair behind her. 
241.jpg,A woman is standing in front of a red sign. The woman is wearing a red jacket and has black hair. There is a white door behind the woman. 
242.jpg,There are two men standing in front of a store. They are wearing green uniforms and hats. There is a red chair behind them. 
243.jpg,A man in a green uniform is wearing a red and gold hat. There are motorcycles behind him. There is a white building behind the man. 
244.jpg,A woman is sitting in a chair in front of a store. She is wearing a red jacket and a colorful dress. There is a plastic bag hanging above her head. 
245.jpg,There are two women sitting in red chairs. There is a white table in front of them with a glass on top of it. There are bags on a shelf behind them. 
246.jpg,A woman is standing in front of a yellow shelf. There are bags on top of the shelf. The woman has dark hair and is wearing a black jacket. 
247.jpg,There is a woman wearing a red shirt. There are bags on a shelf behind the woman. There is a building behind the girl. 
248.jpg,A man is standing in front of a city skyline. He is wearing a blue shirt and a yellow tie. He has glasses on and is holding a red folder in his hands. There is a red sky behind the man.
249.jpg,A man is standing in front of a cityscape. He is wearing a blue collared shirt and a yellow tie. He has glasses on and is holding a tablet in his hands. The sky is orange and there are tall buildings in the background.
250.jpg,A large black cloud of smoke is rising up into the sky. There is a field of grass in front of the smoke. There are small red flames on the ground. 
251.jpg,There is a large cloud of black smoke in the sky. There is a white building in front of the smoke. There are wires hanging from the building.
252.jpg,There is a large black cloud of smoke in the sky. There is grass and dirt on the ground in front of the smoke. There are clouds in the blue sky.
253.jpg,There is a building on fire. There is black smoke coming up from the roof of the building. The fire is bright orange and yellow. There are white pieces of paper hanging from the side of the fire.
254.jpg,There is a large building on fire. There is black smoke coming out of the building. The sky is white and cloudy.
255.jpg,A large black cloud of smoke is rising up into the sky. There is a field of grass in front of the smoke. There are trees in the distance behind the black cloud. 
256.jpg,A woman in a yellow dress is standing in front of a red background. She is holding a brown object in her hands. There is a large picture on the wall behind her. 
257.jpg,A woman in a yellow dress is standing in front of a red background. She is holding a brown object in her hands. There is a large picture on the wall behind the woman. 
258.jpg,A woman in a yellow dress is standing in front of a red background. She is holding a brown object in her hands. There is a picture on the wall behind the woman. 
259.jpg,There are three men sitting at a table. There are two computer monitors in front of them. There is a man standing behind them with his arms crossed. He is wearing a headset on his head. 
260.jpg,Four men are sitting around a long table. There are water bottles on top of the table. One of the men is wearing a blue jacket. 
261.jpg,Five men are sitting around a table. There is a large wooden table in front of them. There are water bottles on top of the table. The men are wearing jackets. 
262.jpg,A group of people are walking together. There are two women and two men behind them. They are all wearing military uniforms. One of the women is wearing a blue shirt and white pants. The girl in the pink shirt is holding the hand of the man in front of her. 
263.jpg,There are people standing in front of a van. There is a man in a white shirt standing next to a woman in a red dress. 
264.jpg,A group of people are walking down a street. They are dressed in military uniforms. There is a man in a white shirt and a boy in a blue shirt. 
265.jpg,A woman is wearing a white shirt with a red cross on it. There is a man behind her wearing a black face mask. They are standing in front of a white van. 
266.jpg,A man is being carried out of a van. He is wearing a white shirt and has a red cross on the front of his shirt. There is a man standing next to him wearing a black face mask and a green hat. 
