frame,caption
001.jpg,A beautiful sunset over a city. The sky is orange and pink. There are many buildings in the city. There is a large body of water in front of the buildings. 
002.jpg,A man and a woman are standing in front of a news desk. The desk is white and has a red logo on it. The man is wearing a blue shirt and a yellow tie. The woman is wearing an orange shirt and yellow pants. There is a large screen behind them. There are buildings on the screen.
003.jpg,A man and a woman are standing behind a news desk. The desk is white and has red writing on it. There is a large screen behind them. There are buildings on the screen. 
004.jpg,A man and a woman are standing behind a white table. The man is wearing a blue shirt and a yellow tie. The woman has a yellow shirt on. There is a large screen behind them with a city on it.
005.jpg,A bright red light is lit up against a black background. There are small white dots on the side of the light. There is a red arrow pointing towards the left. 
006.jpg,"The image is a graphic. The graphic has a diagonal red and white striped background. In the center of the graphic is a silver object that appears to be a propeller. On the top right corner is a small logo that says ""HTV"" in red letters. The time is 18:30:18."
007.jpg,People are sitting in chairs in a salon. There is a large screen on the wall behind them. There are people standing in front of the screen. 
008.jpg,There are several people sitting at a desk. There are several computer screens on the desk in front of them. There is a white wall behind them with pictures hanging on the wall. 
009.jpg,A crowd of people are standing outside at night. There is a stage in front of them that has a large screen on it. There are green lights hanging from the ceiling above the stage. 
010.jpg,A man and a woman are standing on a stage. They are both holding golden trophies in their hands. The man is wearing a black suit with a white shirt and a black bow tie. The woman is also wearing a white dress. She has short black hair. There is a gray wall behind them with writing on it.
011.jpg,"A video is being displayed on a computer screen. The video is titled ""Bui Hoang Trung"" and shows a group of military men in green uniforms and hats standing in formation. There is a red box in front of the men in uniform. Below the picture there is a description of the video and a video of a man in a suit and tie."
012.jpg,A screenshot of a video. The video has a red and white background. There is a picture of a girl in the middle of the screen. The girl has brown hair and is wearing a pink shirt. There are words above and below the picture of the girl.
013.jpg,A man and a woman are standing in front of a news desk. The desk is white and has a red logo on it. The man is wearing a blue shirt and a yellow tie. The woman has a yellow shirt on and is holding a red purse. There is a large screen behind them. There are many buildings on the screen.
014.jpg,A man and a woman are standing in front of a white desk. The man is wearing a blue shirt and a yellow tie. He is holding a red phone in his hands. The woman is wearing an yellow dress. There are tall buildings behind them. There is a red sky above them. 
015.jpg,A man and a woman are standing in front of a news desk. The man is wearing a blue shirt and a yellow tie. The woman is also wearing a yellow shirt. They are both holding red folders in their hands. There is a large cityscape behind them. The sky above them is orange and pink. 
016.jpg,A man and a woman are standing in front of a news set. The man is wearing a blue shirt and a yellow tie. He is holding a small red object in his hands. The woman is also wearing a yellow shirt and has short black hair. There is a large cityscape behind them. The sky is red and orange.
017.jpg,People are sitting in chairs in a room. There is a large screen on the wall behind them. There are people standing in front of the screen. 
018.jpg,A woman in a green shirt is sitting on a blue couch. She is holding a piece of paper in her hands. There are people sitting in chairs in front of a table. There is a blue wall behind them. 
019.jpg,"The image is of a document. The document is titled ""HTV7 HD 18:31:17"". There is a watermark in the top right corner of the image that reads ""HTTV7HD"". The document appears to be a form of some sort. There are several rows and columns of text on the document. Some of the text is written in a foreign language, while others are in English. There is also a legend in the bottom right corner that says ""TP:HCM: Benh ho hap tang khi trai chu""."
020.jpg,There are several people sitting at a desk. There are several computer screens on the desk in front of them. There is a woman in a white shirt standing behind them. 
021.jpg,A computer screen is turned on. There is a white paper on the screen. There are lines of text on the paper. The screen has a bar code on the bottom left corner of it.
022.jpg,There are several people sitting at desks. There is a woman in a white shirt sitting in front of a black computer. She has glasses on and is looking at the computer. 
023.jpg,A person is holding a piece of paper in their hand. There are several other papers on the table in front of them. The person is wearing a black shirt. There is a barcode on the bottom left of the paper.
024.jpg,There are several people sitting at desks. There is a large screen on the wall behind them. There are many computers on the desks in front of them. 
025.jpg,This is an image of a lobby. There are people standing in the lobby. The people are all wearing baseball caps. There is a little girl in the middle of the crowd. The girl is wearing a white shirt and blue shorts. The floor is shiny and white. The lobby has a circular design on the ceiling. The walls are painted a light brown color.
026.jpg,A man is standing in front of a colorful background. He is wearing a suit and tie. He has glasses on and is looking off to the side. There are flowers on the ground behind him. 
027.jpg,A man in a blue suit and a blue tie is sitting in a chair. There is a window behind him with white blinds on the window. 
028.jpg,This is an image of a building. The building is tan in color. There are large arched windows on the building. There is a clock on the front of the building above the entrance. The clock is white with black hands. The sky above the building is white. The windows have black shutters on them.
029.jpg,There are several people standing in a line. They are all wearing sunglasses. There is a woman in a brown dress in the middle. 
030.jpg,There are several people standing in a line. There is a man in a blue shirt wearing sunglasses. There are other people behind him wearing black hats. 
031.jpg,A man and a woman are standing in front of a news desk. They are both holding red folders in their hands. The man is wearing a blue collared shirt and a yellow tie. The woman has a yellow shirt on and a pair of earrings in her ears. There is a large cityscape behind them. The sky is orange and pink.
032.jpg,A man and a woman are standing in front of a white desk. They are both holding red folders in their hands. The man is wearing a blue collared shirt and a yellow tie. The woman is also wearing a yellow dress. There is a large cityscape behind them. The sky is orange and pink. 
033.jpg,A man and a woman are standing in front of a TV screen. The man is wearing a blue shirt and a yellow tie. He is holding a small red object in his hands. The woman is also wearing a yellow shirt. There is a large cityscape behind them. The sky above them is orange and pink. 
034.jpg,There are tall buildings in the background. There are people standing on the sidewalk in front of the buildings. There is a silver car parked on the street. 
035.jpg,There are several people standing in front of a building. There is a white fence behind them. There are trees behind the fence. The people are all wearing face masks. 
036.jpg,There are several children standing in a line. They are wearing uniforms and have red ties around their necks. There is a girl in a white shirt and a red hat on her head. There are trees behind them.
037.jpg,A woman is standing in front of a microphone. She is wearing a white collared shirt and a red tie. There are people sitting in chairs behind her. There is a large white wall behind them. 
038.jpg,A girl is wearing a white shirt with a blue collar and a red tie around her neck. She is holding a microphone in her hand. There are people sitting in chairs behind her. There is a white wall behind them. 
039.jpg,A woman is standing on a stage in front of a crowd of people. She is wearing a black skirt and holding a red folder in her hands. There are two large white screens on either side of the woman. A man in a uniform is standing behind her. He is holding a camera in his hands. The floor of the stage has a red carpet on it.
040.jpg,There are several people sitting in chairs. There is a white wall behind them with white doors on it. There are two people wearing face masks on their faces. 
041.jpg,There are several children sitting on the ground. They are all wearing white shirts and red ties. They have face masks on their faces. There is a woman in a white shirt sitting in front of them.
042.jpg,There are two screens on a wall. There is a picture of a building on the screen. There are cars parked in front of the building. 
043.jpg,There are several children standing in a line. They are wearing blue shirts and red ties. There is a girl in a white shirt and a red hat on. There are trees behind them.
044.jpg,There are people standing in front of a white building. There is a blue sign on the top of the building. The sky is blue and there are buildings in the distance.
045.jpg,A blue sign is hanging on a white wall. The sign says Ba Son Ba Son in white letters. There is a red sign below the blue sign. There are lights on the ceiling under the sign.
046.jpg,Four men are standing in an airport terminal. They are all wearing white hard hats and safety vests. There is a large blue sign hanging from the ceiling above them. 
047.jpg,This is a picture of a train station. There is a large silver train on the tracks. There are large gray pillars in the middle of the station. A person is walking up a set of stairs. The person is wearing a red jacket and a white helmet. 
048.jpg,An escalator is shown in a subway station. There are white steps leading up to the top of the escalator. The walls of the station are white and there are lights on the ceiling.
049.jpg,The image is a 3D rendering of an airport terminal. The floor is white and there are yellow bins on the right side of the image. There is a yellow sign with black text on it on the far right. There are four large gray pillars in the middle of the floor. There appears to be a silver escalator on the left side. The ceiling of the terminal is white.
050.jpg,There are three people standing in a room. They are wearing white hard hats on their heads. There is a silver railing in front of them. 
051.jpg,A man and a woman are standing in front of a TV screen. The man is wearing a blue shirt and a yellow tie. He is holding a red wallet in his hands. The woman is also wearing a yellow shirt. There is a large cityscape behind them. The sky above them is orange and pink. 
052.jpg,A man and a woman are standing in front of a TV screen. The man is wearing a blue shirt and a yellow tie. He is holding a small red object in his hands. The woman is standing next to him wearing a yellow shirt. There is a large picture of a city on the screen behind them. The sky above the city is orange. 
053.jpg,A man and a woman are standing in front of a TV screen. The man is wearing a blue shirt and a yellow tie. He is holding a red object in his hands. The woman is also wearing a yellow shirt. There is a large cityscape behind them. The sky above them is orange and pink. There are tall buildings in the distance. 
054.jpg,A man and a woman are standing in front of a news desk. The man is wearing a blue shirt and a yellow tie. He is holding a tablet in his hands. The woman is wearing an orange shirt and yellow pants. There is a large cityscape behind them. The sky above them is orange and pink. 
055.jpg,Five people are standing on a stage. They are all holding microphones. Two men are dressed in black suits with bow ties. One woman is wearing a long white dress. Another man is dressed in a black and white striped shirt and black pants. Two women are wearing long dresses. There is a large screen behind the people on the stage.
056.jpg,A man and a woman are sitting on a red couch. The woman is holding a black microphone. She is wearing a colorful shirt with flowers on it. There is a blue screen behind them. 
057.jpg,There are five people standing on a stage. There is a man in a black suit holding a microphone in front of a woman in a white dress. There are two men in black suits standing behind them. 
058.jpg,There is a man and a woman standing in front of a large field of sunflowers. The man is wearing a black and white striped shirt. The woman has a red and white shirt on with flowers on it. There is writing on the top of the screen behind them.
059.jpg,There are several people sitting in red chairs. There is a little girl in a white shirt standing in front of them with her hands on her head. 
060.jpg,There are people sitting in red chairs. There is a woman taking a picture with her phone. There are words written on the bottom of the picture. 
061.jpg,There are several people standing in a line. They are all wearing white uniforms. There is a large screen behind them with a large yellow flower on it. 
062.jpg,There is a man and a woman standing in front of a large field of sunflowers. The man is wearing a black striped shirt. The woman is also wearing a red and white shirt with flowers on it. There is a large sign behind them that is blue.
063.jpg,There are several children standing on a stage. They are wearing white shirts and black pants. They have yellow sunflowers on their shirts. There is a large screen behind them on the stage. 
064.jpg,A group of people are standing on a stage. They are all wearing white shirts and pants. They have sunflowers on their shirts. There is a large wall of sun flowers behind them. 
065.jpg,There are people standing on a stage. They are all wearing white pants and yellow shirts. There is a large screen behind them with palm trees on it. 
066.jpg,A woman is standing in front of a microphone. She is wearing a white shirt. There are people standing behind her. There is a red wall behind them. 
067.jpg,There is a woman with dark hair smiling. There is a man next to her wearing a white shirt with a yellow sun on it. There are words written in front of the woman. 
068.jpg,There are people standing on a stage. They are all wearing white shirts and black pants. They have yellow flowers on their shirts. The people are holding their hands up in the air. 
069.jpg,A man is wearing a blue striped shirt and black glasses. He is holding a microphone in his hand. There is a white wall behind the man. 
070.jpg,"An Asian man is talking on a news channel. He is wearing a blue and white striped shirt and has a microphone clipped to his shirt. He has short black hair and is wearing black framed glasses. The background is white and there is a red banner at the bottom of the screen that says ""Hai Phong: Tam giu tai tai xe gay nao loan truy"" on it."
071.jpg,There are people standing on a stage. There is a large screen behind them with sunflowers on it. There are lights on the ceiling above the stage. 
072.jpg,Many people are sitting in an auditorium. They are all wearing face masks. There are red seats in front of them. There is a man in a suit sitting next to a woman in a colorful dress. 
073.jpg,A woman in a yellow dress is standing in front of a red background. She is holding a brown folder in her hands. There is a large crowd of people standing in the street behind her. There are colorful lights hanging from the ceiling above the crowd. 
074.jpg,A woman in a yellow dress is standing in front of a red background. She is holding a small brown object in her hands. There is a large screen behind her with people on it. There are red lights on the stage. 
075.jpg,There is a crowd of people standing in front of a stage. There are green lights on the stage and a large sign above the stage. 
076.jpg,A woman is standing in front of a crowd of people. She is wearing a black shirt and has short brown hair. There are trees behind her. 
077.jpg,There are several people standing on a stage. There are lights on the stage behind them. There is a man in a white shirt holding a guitar in front of a microphone.
078.jpg,There are several people standing on a stage. There are lights on the stage behind them. There is a man in a white shirt standing in front of a microphone. He is holding a guitar.
079.jpg,A man is wearing a pink shirt and glasses. He is holding a microphone in his hand. There are people standing around him. There is a large screen behind him. 
080.jpg,There is a crowd of people standing in front of a stage. There is a large screen on the stage with people standing on it. There are trees surrounding the stage. 
081.jpg,There are several people standing on a stage. There is a large screen behind them with a woman holding a guitar on it. There are blue signs hanging from the stage.
082.jpg,There are several people standing in front of a microphone. There is a woman in a blue dress holding the microphone and speaking into it. There are trees behind them. 
083.jpg,There is a large screen in front of a crowd. There is a man playing a guitar on the screen. There are lights above the screen on the stage. 
084.jpg,A woman is standing in front of a microphone. She is wearing a white shirt. There are people standing behind her. There is a large building behind them. 
085.jpg,There are people standing on a stage. There is a large screen behind them. There are lights shining on the stage. 
086.jpg,There are several people standing in front of a building. They are all wearing glasses. There is a man in a white collared shirt in the front of the group. 
087.jpg,"A man is standing on a stage holding a microphone in his hand. He is wearing a red cap, black shirt and glasses. There are blue lights behind him. There is a microphone stand in front of him."
088.jpg,There are people standing on a stage. There are red lights hanging from the ceiling. There is a tree next to the stage. 
089.jpg,A man is playing a guitar on a stage. He is wearing a short sleeve shirt and glasses. There are blue lights behind him. 
090.jpg,There are several people standing in front of a tree. There is a man in a black shirt holding up his hands. There are people behind him wearing face masks. 
091.jpg,A man is standing in front of a cityscape. He is wearing a blue shirt and a yellow tie. He has glasses on and is holding a book in his hands. There is a red sky behind him. 
092.jpg,A man is wearing a blue shirt and a yellow tie. He is holding a tablet in his hands. There are tall buildings behind him. There is a red sky behind the man.
093.jpg,A man is standing in front of a city skyline. He is wearing a blue shirt and a yellow tie. He has glasses on and is holding a tablet in his hands. There is a red sky behind the man.
094.jpg,A bridge is lit up with red and blue lights. There are boats on the water in front of the bridge. The sky is black and there are buildings next to the water. 
095.jpg,There is a colorful building with lights on it. There are red and green doors on the building. There is a red sign in front of the door. 
096.jpg,A bridge is lit up with red and blue lights. There is water under the bridge. The sky above the bridge is black. 
097.jpg,There is a bridge that is lit up with colorful lights. There is water under the bridge. There are small buildings on the water. 
098.jpg,There are people standing in front of a white building. There is a blue pole in the front of the crowd. There are purple lights on the fence in front. 
099.jpg,A man is wearing a white face mask. There are silver bars in front of him. There is a light on the wall behind him. 
100.jpg,There are two people standing behind a silver fence. They are wearing a white face mask. There are red lights on the wall behind them. 
101.jpg,There is a group of people standing on a stage. They are holding white boxes in their hands. There is a large yellow screen behind them with writing on it. 
102.jpg,There are several people sitting at a table. There are red and white chairs around the tables. There is a camera on a stand in front of the table. 
103.jpg,There are several people sitting at a table. There is a camera on a stand in front of them. There are red and white chairs around the table. 
104.jpg,"On the left side of the image there is a solid black background. On the right side the image is red and black. The red part has small white dots on it. The dots are arranged in a circular pattern. The white dots are evenly spaced. There are also small red letters on the top right corner that say ""HTV"" and the numbers 18:36:50."
105.jpg,The image is a graphic design. The background is red and white. There are dots on the red background. The lines are white and black. The design is made up of blocks. The blocks are red and silver. The numbers on the blocks are big and bold. The letters are also red. There is a small logo in the top right corner of the image.
106.jpg,A crowd of people are standing outside at night. There is a silver fence in front of the crowd. There are bright lights shining on the ground next to the fence.
107.jpg,There are several people standing in front of a building. There is a white van parked in the front of the building. The van has blue lights on the top of it.
108.jpg,There is a large swimming pool inside of a building. There are black flags hanging from the ceiling above the pool. The pool has blue water in it. 
109.jpg,A man is wearing a scuba diving suit. He has a helmet on his head and a mask on his face. He is standing in front of a blue wall. There is a yellow ladder behind him. 
110.jpg,A man is standing in front of a cityscape. He is wearing a blue shirt and a yellow tie. He has glasses on and is holding a red folder in his hands. There is a red sky behind the man. 
111.jpg,A man is standing in front of a cityscape. He is wearing a blue collared shirt and a yellow tie. He has glasses on and is holding a red folder in his hands. The sky is orange and there are tall buildings in the background.
112.jpg,There are several people standing in front of a fence. There is a bright light on the ground next to the fence. The people are standing next to a walkway. 
113.jpg,There are several people standing in front of a white van. There is a red light on the top of the van. The van has a blue cross on the side of it.
114.jpg,There are several men standing in front of a white fence. There is a man in a white shirt and a black jacket. There are two men in uniform standing next to them.
115.jpg,There are several people standing in front of a building. There is a white van on the ground next to them. There are lights on the ceiling above the van.
116.jpg,There are several people standing in front of a white van. There is a blue sign on the wall behind them. There are three men in uniform standing next to the van.
117.jpg,"People are standing behind a gate that has a blue sign that says ""Casualty"" on top of it. The gate is made of metal and has bars on it. There is a large white wall behind the gate. "
118.jpg,There are several people standing around a white car. There is a man in a blue shirt standing in front of the car. 
119.jpg,A woman is wearing a yellow dress. She is holding a red object in her hands. There is a large screen behind the woman. There are buildings on the screen. 
120.jpg,A woman in a yellow dress is standing in front of a screen. She is holding a red folder in her hands. There is a picture on the screen behind her. 
121.jpg,There are several people riding motorcycles down the street. There are tall light poles lining the street in front of them. There is a large bus on the street next to them. 
122.jpg,There are several cars on the street. There are people walking on the sidewalk next to the cars. There is a large building on the side of the street in front of them. 
123.jpg,There are several people walking on a street. There are tall light posts on the sidewalk next to the street. The people are sitting on wheelchairs. There is a man in a jacket walking in front of them. 
124.jpg,There are several people riding motorcycles on a street. There are trees on the side of the street next to a sidewalk. There is a large cloud of smoke above the street.
125.jpg,There is a foggy street. There is a large bus on the street in front of a crowd of people. There are two people on a motorcycle in the front of the crowd. 
126.jpg,There is a hazy sky in the picture. There are buildings in the distance behind the fog. There is a red and white logo on the top right corner of the picture that says htv7 HD.
127.jpg,There is a large billboard on the side of the street. There are several cars and motorcycles on the street in front of the billboard. There is tall light poles on the sidewalk next to them. 
128.jpg,A gate is open in front of a building. The gate is blue and made of metal. There is an arch above the gate that has writing on it. There are trees behind the gate. 
129.jpg,There is a large red building with a blue gate in front of it. There is a man in a black jacket walking down the street. There are trees on the side of the building. 
130.jpg,There are several motorcycles driving on the street. There is a white van behind them. There are several people on the motorcycles wearing helmets. 
