frame,caption
001.jpg,A beautiful sunset over a city. The sky is orange and pink. There are many buildings in the city. There is a large body of water in front of the buildings. 
002.jpg,A man and a woman are standing in front of a large screen. They are both dressed in business attire. The woman is wearing a short sleeve red dress and has short brown hair. The man is dressed in a dark suit with a red and white striped tie. The screen behind them has a city scene on it. There is a red carpet on the floor under the two people.
003.jpg,A news anchor and a reporter are standing behind a desk. The desk is white and has a red logo on it. There is a large screen behind them. There are buildings on the screen. 
004.jpg,There is a man and a woman standing in front of a large screen. They are both dressed in business attire. The woman is wearing a red dress and has short brown hair. There is a red and orange screen behind them. 
005.jpg,"There is a large tree behind a street light. There is a flag hanging from a pole in front of the tree. The flag is red, yellow, green and blue. "
006.jpg,"There is a large green tree in front of a white sky. There is a colorful flag hanging from a pole next to the tree. The flag is red, yellow, green, blue and purple. "
007.jpg,There are people standing in front of a building. There is a red and white sign on the wall behind them. There are people in white shirts and ties standing in the front of the building.
008.jpg,There are several motorcycles on the street. There are street lights on the sidewalk next to the motorcycles. There is a man in a blue suit standing in front of them. 
009.jpg,There are several motorcycles on the street. There is a large bus behind them. There are street lights above the street next to the motorcycles. 
010.jpg,The image is red and white. On the right side of the image there are two red diagonal stripes. The red on the left side is very bright and the white on the right is a solid white color. There are small dots on the bottom of the red. The time and date are 18:30:32 on the top right corner of this image.
011.jpg,A woman is standing in front of a cityscape. She is wearing a short sleeve red dress. The woman has short dark colored hair. There is a red sky behind the woman. There are tall buildings in the city. 
012.jpg,A woman is standing in front of a city skyline. She is wearing a short sleeve red dress. The woman has short dark hair and is holding a brown book in her hands. There is a red sky behind the woman. 
013.jpg,A woman is standing in front of a cityscape. She is wearing a short sleeve red dress. The woman has short dark colored hair. The sky behind the woman is orange and red. There are tall buildings in the city.
014.jpg,"There is a large tree behind a street light. There is a flag hanging from a pole in front of the tree. The flag is red, yellow, green and blue. "
015.jpg,A bare tree with no leaves on it. There is a black pole with a red ball hanging from it. The sky behind the tree is white. 
016.jpg,A tree is shown from the side. The branches of the tree are very thin and have a bunch of leaves on them. The sky is very clear and there are no clouds in the sky.
017.jpg,There are several large trees in front of a yellow building. There are red and yellow flags hanging from the trees. There is a large white pole in the front of the tree. 
018.jpg,There are trees in front of a blue sky. There is a long pole with red flags hanging from the end of it. There are white flowers on the top of the pole.
019.jpg,There are people standing in a parade. They are wearing blue uniforms. There are trees behind them. There is a red flag hanging from a branch in front of them. 
020.jpg,There are several people standing in front of a fence. They are wearing blue robes and hats on their heads. There are colorful flags behind them. 
021.jpg,A man is shown on a TV screen. He is wearing a blue collared shirt. There is a yellow building behind him. There are trees behind the building. 
022.jpg,A man is wearing a blue shirt and a black hat. He is standing in front of a large brown drum. There is a yin and yang symbol on the drum. 
023.jpg,A man is wearing a blue shirt and a black hat. He is standing in front of a large brown drum. There is writing on the bottom of the picture. 
024.jpg,There are several people standing in a room. They are wearing colorful robes and hats on their heads. There is a large black cabinet behind them. 
025.jpg,There are people standing in front of a building. There is a white sign on the wall behind them. There are people in white shirts and ties sitting in a row. They are wearing hats on their heads.
026.jpg,A man is wearing a blue shirt and a red tie. He is writing on a piece of paper that is on top of a red table. There is a large bouquet of yellow flowers behind the man. 
027.jpg,A man in a blue shirt and a red tie is standing behind a table. There are yellow flowers on the table in front of him. 
028.jpg,There are several men standing in front of a building. There is a man in a blue shirt and tie holding a large piece of paper. There are yellow flowers next to the men.
029.jpg,There are four women standing together. One of the women is wearing a green dress. The other two women are wearing black headbands on their heads. There are trees behind them. 
030.jpg,There are several white signs hanging from a tree branch. There are red strings hanging from the signs. There is writing on the signs in red writing. 
031.jpg,A woman is standing in front of a microphone. She is wearing a white headband and a purple shirt. There are red signs behind her with writing on them. There is a man in a white shirt behind her. 
032.jpg,There is a statue of a person sitting in a room. There is a large red pillar next to the statue. There are two red candles on a table in front of the table. 
033.jpg,There are people standing in front of a table. There are decorations on top of the table. One of the people is wearing a face mask on their face. There is a person taking a picture of the decorations. 
034.jpg,A woman is standing in front of a microphone. She is wearing a white headband on her head. She has long dark hair. There is a man standing behind her. There are red signs behind the woman. 
035.jpg,There is a tan building with a red roof. There are trees in front of the building. There is a red sign on the front of a building. 
036.jpg,There are several people standing in front of a building. There is a man in a blue shirt and a black hat on his head. There are people sitting in chairs behind them. 
037.jpg,There is a woman in a white dress standing in front of a black door. There are red curtains hanging from the doors. There is gold decorations on the wall behind the woman. 
038.jpg,There is a woman in a white dress standing in front of a black door. There are red curtains hanging from the doors. There is a gold statue behind the woman. 
039.jpg,There are two glasses of red liquid in front of a large pot. There is a white vase with yellow flowers in it next to the glasses. 
040.jpg,There are several men standing in front of a building. They are all wearing white shirts and ties. There is a large mirror on the wall behind them. 
041.jpg,There is a building with a red roof on it. There are statues on top of the roof. There is a large tree behind the building. 
042.jpg,A man is standing in front of a city skyline. He is wearing a black shirt and a red tie. He has glasses on and is holding a tablet in his hands. The sky is orange and red. There are tall buildings all around the man.
043.jpg,A man is standing in front of a city skyline. He is wearing a black shirt and a red tie. He has glasses on and is holding a tablet in his hands. The sky is orange and red. There are tall buildings all around the man.
044.jpg,There are several boxes stacked on top of each other. The boxes are white with red and yellow writing on them. There is a red tray under the boxes.
045.jpg,There are people standing in a room. They are wearing white shirts and white hats. There are stacks of boxes in front of them. There is a large pipe hanging from the ceiling. 
046.jpg,A woman is wearing a white face mask and a white hat. She is standing in front of a machine. There are red boxes on the machine. 
047.jpg,There are several people wearing white shirts and white hats. They are wearing face masks on their faces. There is a large machine behind them. There are stacks of boxes on a table in front of them. 
048.jpg,There are several people wearing white shirts and white hats. They are wearing face masks on their faces. There is a large machine behind them. There are stacks of boxes on a table in front of them.
049.jpg,There are four people standing in a room. They are all wearing white uniforms and white hats. There are blue crates behind them. There is a man in a plaid shirt standing in front of them. 
050.jpg,There are four people standing in a room. They are all wearing white shirts and white hats. There are blue crates behind them. They all have face masks on their faces. 
051.jpg,There are people standing in a room. They are all wearing white shirts and white hats. There are boxes on a table in front of them. There is a large pipe hanging from the ceiling. 
052.jpg,There are two people standing in a room. There are large machines in front of them. There is a large window on the wall behind them. 
053.jpg,There are two people standing in a room. They are wearing blue scrubs. There are large machines in front of them. There is a large window on the wall. 
054.jpg,A man is standing in front of a large machine. He is wearing a blue shirt and black gloves. The machine is green and has several buttons on it. There is a white table in front the man. 
055.jpg,A man in a blue shirt is standing in front of a machine. There is a large green machine next to the man. There are papers hanging on the side of the machine. 
056.jpg,There are two men sitting at a desk. There is a large machine in front of them. The men are wearing blue shirts. There are windows on the wall behind them. 
057.jpg,A man in a blue shirt is standing in front of a microphone. There is a large green plant next to the man. The man has short black hair. 
058.jpg,There are five people wearing white shirts and white hats. They are wearing face masks on their faces. There is a large machine in front of them. 
059.jpg,There are several people wearing white uniforms and white hats. They are standing in front of a machine. There are blue baskets on the floor around them. 
060.jpg,There are people wearing white aprons and white hats in a room. There are boxes on a table in front of them. There is blue bins on the floor behind them. 
061.jpg,There are two men sitting at a white table. There is a blue box on the table in front of the man. There are white cabinets behind them. 
062.jpg,There is a large white machine in a room. There is a black button on the side of the machine. The machine has rust on it. 
063.jpg,Two men are wearing blue and red shirts. They are standing in front of a large blue machine. There is a white wall behind them. 
064.jpg,There are people standing in a room. There are machines in front of them. They are wearing blue jackets. There is a fan hanging from the ceiling. 
065.jpg,A woman is standing in front of a city skyline. She is wearing a short red dress and has short black hair. The sky behind her is orange and yellow. There are tall buildings all around her.
066.jpg,A woman is standing in front of a city skyline. She is wearing a short sleeve red dress. The sky behind her is orange and yellow. There are tall buildings all around her.
067.jpg,A woman is standing in front of a city skyline. She is wearing a short red dress and has short dark hair. The sky is orange and yellow. There are tall buildings all around the woman.
068.jpg,There are dead plants and debris on the ground. There is a large white building in front of the building. There are green leaves on the branches of the trees.
069.jpg,A man is walking down a path in a forest. He is wearing a black jacket and pants. There are tall trees on either side of the path. There is a large wall behind the man. 
070.jpg,There are many trees in a field. There is snow on the ground in front of the trees. There are red words on the top and bottom of the picture. 
071.jpg,A man is wearing a white collared shirt. There are tall buildings behind him. There is a white chair in front of the man. 
072.jpg,There are trees in the picture. The picture is very blurry. There are words written on the bottom of the picture in a foreign language. There is a watermark in the top right corner that says htv7 HD.
073.jpg,A man in a green uniform is standing behind another man. They are in front of a large screen. There are several screens on the wall behind them. 
074.jpg,A man in a green uniform is standing behind a man sitting in a black chair. There are several screens hanging on the wall behind them. The man in the green uniform has his hand on the back of the chair. 
075.jpg,A man in a blue jacket is walking through a forest. There are trees surrounding the man. The man is holding a white stick in his hand. 
076.jpg,A man in a green uniform is standing in front of a large screen. There is a microphone in his hand. There are several screens on the wall behind the man. 
077.jpg,There is a red fire truck parked on the street. There are people standing in front of the truck. There is a large white and yellow ball in the front of them.
078.jpg,A fire truck is parked on the side of the street. There are people standing in front of the truck. There is a white building next to the fire truck. 
079.jpg,A man in a green uniform is standing next to an older man. The older man is wearing a white shirt and has glasses hanging from his shirt. They are both looking at a piece of paper. There is a black fence behind them. 
080.jpg,A man in a green shirt is standing next to a woman in a black shirt. They are both looking at a book. There is a yellow sign on the wall behind them. 
081.jpg,There are three people standing in a room. They are wearing green uniforms. There is a woman in a black and white dress standing next to two men. There are items on a table in front of them. 
082.jpg,There is a blue wall in front of a white wall. There is a plastic bag hanging from a hook on the wall. The plastic bag has a red item inside of it. 
083.jpg,A man is wearing a green uniform. There are pictures behind the man on a white wall. There is a red cabinet behind him. 
084.jpg,This is an image of a playground. The playground has a yellow gate. The gate is closed. There is a red and yellow fire extinguisher on the ground. The ground is made up of cement. The cement is gray. The green part of the playground is made of metal. There are holes on the green part. The holes are silver. The text on the image is in a foreign language.
085.jpg,A man is standing in front of a city skyline. He is wearing a black shirt and a red tie. He has glasses on and is holding a tablet in his hands. The sky behind the man is orange and red. There are tall buildings all around the man.
086.jpg,A man is standing in front of a city skyline. He is wearing a black shirt and a red tie. He has glasses on and is holding a tablet in his hands. There is a red sky behind the man. 
087.jpg,There are several motorcycles driving down the street. There is a silver car on the street in front of them. There are trees on the side of the street next to the cars.
088.jpg,There are several motorcycles on the street. There is a white van behind them. There are trees next to the van. 
089.jpg,There are several cars and motorcycles on the street. They are all wearing helmets and face masks. There is a white van in front of them. 
090.jpg,There are several people riding motorcycles. They are all wearing helmets and face masks. There is a red and white striped barrier behind them. There are trees behind the fence. 
091.jpg,There are several motorcycles on the street. There is a white van behind them. There are people on the motorcycles wearing helmets. 
092.jpg,There is a white van on the street. There is a motorcycle next to the van. There are people on the motorcycle. They are all wearing helmets. 
093.jpg,There are several motorcycles driving down the street. There are several people on the motorcycles. They are all wearing white helmets and face masks. There is a blue sign behind them. 
094.jpg,There are several people riding motorcycles on the street. They are all wearing white helmets and face masks. There is a black car in front of them. There are several signs on the sidewalk. 
095.jpg,There are several motorcycles on the street. There is a white van behind them. There are several signs hanging from the buildings. 
096.jpg,Two people are sitting on a motorcycle. They are both wearing helmets on their heads. The motorcycle is red and there are bags on the back of it. There is a building behind them. 
097.jpg,There are several motorcycles driving down the street. There is a white van on the street in front of them. There are trees on the side of the street next to the sidewalk. 
098.jpg,There are several people riding motorcycles on the street. There is a white van behind the motorcycles. There are trees on the side of the street next to the van. 
099.jpg,There are several cars and motorcycles on the street. There is a man in a white shirt and a black helmet on the motorcycle. There are trees behind the cars. 
100.jpg,A silver minivan is driving on the street. There are other cars behind it. There is a bridge above the street with trees on it. 
101.jpg,There are several cars driving on the street. There is a large bridge above the street with a blue sign on it. There are trees on the side of the bridge. 
102.jpg,There are several motorcycles on the street. There is a white car behind them. There are trees on the sidewalk next to the car. 
103.jpg,A news program is being shown. There is a woman and a man standing in front of a large screen. The woman is wearing a red dress and is holding a book in her hand. The man is dressed in a suit and a red tie. There are large buildings on the screen behind them.
104.jpg,A news program is being shown. There is a man and a woman standing in front of a large screen. They are both dressed in business attire. The woman is wearing a red dress and the man is dressed in a dark suit and red tie. The screen behind them shows a city with tall buildings and a bright orange sky.
105.jpg,A man and a woman are standing in front of a large screen. They are both dressed in business attire. The woman is wearing a short sleeve red shirt and brown bottoms. The man is dressed in a dark suit with a red tie and black pants. The screen behind them shows a city with tall buildings and a red sky.
106.jpg,There is a person wearing a green shirt. They have a blue surgical cap on their head. There are hands in front of them. 
107.jpg,There are two people in a room. They are wearing blue scrubs and have surgical hats on their head. There is a woman in a green gown sitting on a green chair. 
108.jpg,There are several people standing around a table. They are wearing blue scrubs and masks on their faces. There is a man in a green scrubs standing in front of them. 
109.jpg,There are three people wearing blue scrubs and white gloves. They are standing in front of a green wall. There is a person in a green scrubs standing behind them. 
110.jpg,There is a large white monitor in front of a person. The person is wearing a white face mask. There is a person in a green shirt behind the monitor. 
111.jpg,There are several people in scrubs standing around a table. They are wearing surgical masks on their faces. There is a man with glasses on his face in front of them. 
112.jpg,There are several people wearing blue scrubs and white masks. They have plastic hats on their head. There is a blue wall behind them. 
113.jpg,A computer monitor is sitting on a table. The monitor has numbers on it in white and blue. There is a white wall behind the monitor. 
114.jpg,A man is wearing a white suit and a black and white checkered shirt. He has short black hair. There is a black car behind him. There are trees behind the car. 
115.jpg,A man is wearing a white suit and a striped tie. There is a black car behind him. There are trees behind the car. 
116.jpg,There are people sitting in red chairs in a room. There is a large screen on the wall in front of them. There are people standing in frontof the screen. 
117.jpg,A woman is standing in front of a screen holding a microphone. She is wearing a red blazer and a black shirt. There is a large bouquet of flowers behind her. 
118.jpg,A green sign is hanging on a white wall. The sign has white writing on it. There is a red logo on the top right corner of the sign.
119.jpg,A woman is standing in front of a city skyline. She is wearing a short sleeve red dress. The woman has short dark colored hair. The sky behind the woman is orange and red. There are tall buildings all around the woman.
120.jpg,A woman is standing in front of a city skyline. She is wearing a short sleeve red dress. The woman has short dark colored hair. The sky behind the woman is orange and red. There are tall buildings all around the woman.
121.jpg,A woman is standing in front of a city skyline. She is wearing a short sleeve red dress. The woman has short dark colored hair. The sky behind the woman is orange and red. There are tall buildings all around the woman.
122.jpg,There are several people sitting around a white table. There is a red and white sign hanging from the wall behind them. There are pictures hanging on the wall. 
123.jpg,There are two men sitting at a white table. There is a black backpack on the table in front of them. The man on the left is wearing a white shirt and has a face mask on. 
124.jpg,There is a woman wearing a red bra. There is a pink ribbon tied around the bra. The woman is wearing white gloves on her hands. 
125.jpg,A person is writing on a piece of paper. They are holding a pen in their hand. The paper is white and has black writing on it. There is a brown table under the paper.
126.jpg,There are three people standing in front of a white wall. There is a large white sign on the wall behind them. The people are all looking at their cell phones. 
127.jpg,A person is sitting in a chair. They have a white bandage on their arm and a red object in their hand. There is a cord attached to the arm of the person. 
128.jpg,There are several people laying in hospital beds. There are medical equipment around them. There is a man in a black shirt standing in front of them. 
129.jpg,A man in a black shirt and a red tie is standing in front of a screen. He is holding a tablet in his hands. There is a large white screen behind the man. 
130.jpg,There is a man in a black suit and a red tie standing in front of a red wall. He is holding a small tray in his hands. There is a picture next to the man in the suit and tie. There are several people in suits standing behind the man. 
131.jpg,There is a man wearing a suit and a red tie. He is holding a tablet in his hands. There are people standing in front of him wearing suits. There is a large crowd behind them. 
132.jpg,There are two women standing in front of a table. They are wearing yellow robes and hats on their heads. There is a large statue of a dragon on top of the table. There are plants in white vases on the table next to the statue. 
133.jpg,There are several people standing in front of a crowd. They are all wearing yellow robes and hats. There are many flags hanging from the trees behind them. 
134.jpg,There are several people standing in front of a crowd. They are all dressed up in suits and hats. There is a woman in a red dress and a man in a yellow robe. 
135.jpg,There are several people standing in front of a crowd. They are all dressed up in suits and hats. There is a woman in a red dress and a man in a suit standing behind her. 
136.jpg,There are several people standing in front of a crowd. There are several flags hanging from the ceiling. There is a woman in a red dress standing in the front of the crowd. 
137.jpg,There are several people standing in front of flags. There are trees behind them. There is a woman in a yellow outfit with a yellow hat on. 
138.jpg,There are people standing in front of a building. There are trees behind the building. They are wearing red robes and holding flags in their hands. There is a man in a suit standing next to them.
139.jpg,There are colorful flags in front of a large tree. The flags are multicolored. There is a watermark on the top right corner of the image.
140.jpg,There are several people standing in front of a building. There are several flags hanging from the building. They are all wearing suits and some of them have hats on. There is a woman in a red dress standing in the front of the crowd. 
141.jpg,There are several people standing in front of a table. There are several flags hanging from the ceiling behind them. There is a woman in a red dress holding a bouquet of flowers. 
142.jpg,There is a large tree in front of a white sky. There is a red ribbon hanging from the tree. There are words written below the tree in black writing.
143.jpg,A woman is standing in front of a large screen. She is wearing a short sleeve shirt and brown bottoms. The screen has a city scene on it. There is a red sky behind the woman. 
144.jpg,A woman is standing in front of a large screen. She is wearing a short sleeve red shirt and brown bottoms. The screen behind her is showing a city with tall buildings. There is a red sky above the buildings. 
145.jpg,A woman in a red dress is standing in front of a microphone. There is a large screen behind her with a picture of people standing in suits and a woman wearing a green dress. 
