frame,caption
292.jpg,There is a red flag with a yellow star on it flying high in the sky. There is a white ladder next to the flag. There are two men standing on the ladder. One of the men is wearing a white shirt and the other is wearing black. 
293.jpg,A person is standing on top of a metal ladder. There is a red flag hanging from a pole above the ladder. The person is wearing a red shirt and black shorts. 
294.jpg,There are two people standing on a ladder. There is a red flag on top of the ladder. The sky is blue and there are clouds in the sky. 
295.jpg,This is an aerial view of a construction site. There is a large pile of dirt in front of a building. There are several trucks surrounding the building. A white van is driving down the road. 
296.jpg,This is an aerial view of a highway. The highway is divided into two lanes. There are cars driving on both sides of the highway. There is a small red building in the middle of the road.
297.jpg,This is an aerial view of a highway. The highway is divided into two lanes. There are cars driving on both sides of the highway. There is a small building next to the highway with a red roof. 
298.jpg,This is an aerial view of a highway. There are two lanes of traffic on the highway. One lane has a blue car and a white car on it. There is a road next to the blue car. 
299.jpg,This is an aerial view of a road. The road is divided into two lanes. There is a white car driving down the road. There are several solar panels on the ground next to the street. 
300.jpg,A woman is standing in front of a large screen. She is wearing a short red dress and holding a brown purse. There is a large picture on the screen behind her. 
301.jpg,A woman is standing in front of a large screen. She is wearing a short red dress and has short black hair. The screen behind her has a picture of a city on it. There is a red and yellow logo on the screen. 
302.jpg,A woman is standing in front of a TV screen. She is wearing a short sleeve red dress. The woman is holding a brown wallet in her hands. There is a large screen behind the woman. There are buildings on the screen behind her. 
303.jpg,A man in a blue shirt is sitting in a chair. There is a white brick wall behind the man. The man has short black hair. 
304.jpg,A man is looking at the camera with a serious expression on his face. He has short black hair and is wearing a blue shirt. There is a window behind him with bars on it. 
305.jpg,A yellow tape measure is laying on the ground. There is a yellow sign with the number 5 on it. There are weeds and grass around the tape measure. 
306.jpg,There is a white building behind a chain link fence. There is a tree in front of the building. There are wires above the fence. 
307.jpg,The image is taken at night time. It is a security camera image. There is a barcode on the bottom left corner of the image. The barcode is a QR code. The time is 18:52:14. There are four pillars in the image that are white in color. The pillars are forming a roof over the entrance of a building. The building has a large glass window on the right side.
308.jpg,There is a long gray object on the ground. There is a yellow measuring tape in front of the object. The measuring tape has numbers on it. 
309.jpg,The image is of a house at night. The house is a two story structure. It is made of concrete. There is a covered porch on the front of the house. There are four pillars on the porch. There's a window on the right side of the building. The sky above the house is black. The sun is shining on the house from the outside.
310.jpg,There is a silver object on the ground. There are weeds around the object. There is a red and white logo on the top right corner of the image.
311.jpg,A man is wearing a blue polo shirt. There is a window behind the man. The man has short black hair. 
312.jpg,A man in a black suit and a red tie is standing in front of a red background. He is holding a tablet in his hands. There is a large screen behind the man. 
313.jpg,A man is standing in front of a screen. He is wearing a black suit and a red tie. The man is holding a tablet in his hands. There is a picture on the screen behind the man. 
314.jpg,A man in a black shirt and a red tie is standing in front of a large screen. There is a picture on the screen behind the man. The man is wearing glasses on his face. 
315.jpg,There are two men standing in a room. There is a white wall behind them with a window on it. The man in front of them is wearing a blue shirt and black pants.
316.jpg,There is a green block with a red number 3 on it. There is a blue bowl next to the block. There are wires coming out of the cup. 
317.jpg,There is a small electronic device on the ground. There is a plastic bag next to the device. The plastic bag has a blue screen on it. There are numbers on the screen. 
318.jpg,A man is standing in front of a yellow wall. He is wearing a white collared shirt and a red scarf around his neck. The man has dark colored hair that is falling over his shoulders. He has a serious look on his face.
319.jpg,A man is standing in front of a yellow wall. He is wearing a white collared shirt and a red scarf around his neck. The man has dark hair that is falling over his shoulders. There are white pipes on the wall behind the man.
320.jpg,A man is wearing a blue shirt. There is a yellow wall behind the man. The man has short hair and is frowning. 
321.jpg,A man is standing in front of a yellow wall. He is wearing a white collared shirt and a red scarf around his neck. The man has dark colored hair that is slicked back. There are metal bars on the wall behind the man.
322.jpg,A man is standing in front of a window. He is wearing a white collared shirt and a red tie around his neck. The man has short black hair. There is a white wall behind the man. 
323.jpg,Two men are sitting in a room. One of the men is wearing a white shirt and blue pants. There is a small wooden table in front of them. A computer is sitting on top of the table. 
324.jpg,A man in a black suit and a red tie is standing in front of a large screen. There is a picture on the screen behind him. The man is wearing glasses and is holding a tablet in his hands. 
325.jpg,A man in a black suit and a red tie is standing in front of a large screen. There is a picture on the screen behind the man. The man is holding a tablet in his hands. 
326.jpg,A man in a black suit and a red tie is standing in front of a large screen. There is a picture on the screen behind the man. The man is wearing glasses and is holding a tablet in his hands.
327.jpg,There are people sitting around a black table. There is a man in a white shirt sitting in front of a black bench. There are plants behind the table.
328.jpg,There are people sitting around a table. There is a red tray on the table with white cups on it. There are plants behind the table. 
329.jpg,There are three people sitting around a table. There are white cups on the table in front of them. There is a woman in a white shirt sitting next to a man. 
330.jpg,A man is laying on a bed. He is wearing a green shirt and black shorts. There is a white table in front of the man with a glass on top of it. 
331.jpg,A man is laying on a bed. He is wearing a green shirt and blue shorts. There is a man sitting in a chair next to the bed. 
332.jpg,A man is laying on a bed. He is wearing a green shirt and black shorts. There is a man standing in front of the bed wearing a face mask. 
333.jpg,There is a man in a green shirt laying on a bed. There is a white wall behind the bed. The man in the green shirt is wearing a face mask. 
334.jpg,There are several people sitting at a table. There is a green table cloth on the table with water bottles and a vase of flowers in front of them. There are windows on the wall behind them. 
335.jpg,There are several people sitting at a table. There are water bottles on the table in front of them. There is a window on the wall behind them. 
336.jpg,There are several men sitting in chairs. There is a table in front of them with water bottles on top of it. One of the men is wearing a red shirt and has black hair. 
337.jpg,There are four men sitting at a table. They are wearing blue shirts. There are water bottles on the table in front of them. There is a window behind them. 
338.jpg,Four people are standing in front of a red and green sign. There is a man in a green uniform standing next to two men and a woman. They are all holding white papers in their hands. 
339.jpg,Five men are standing in a room. The man in the white shirt is standing in front of a podium. There is a red sign hanging on the wall behind the men. The men are wearing blue shirts. 
340.jpg,There are nine men standing on a stage. They are all holding white papers in their hands. There is a red sign behind them with white writing on it. There are green curtains on the wall behind them.
341.jpg,A group of people are sitting around a table. There is a man in a white shirt standing in front of them. There are water bottles on top of the table. 
342.jpg,There are four men sitting at a table. They are wearing green uniforms. There are two water bottles on the table in front of them. There is a woman sitting behind them. 
343.jpg,There are two women sitting next to each other. One of the women is wearing a blue shirt. There is a man behind them sitting in a chair. There are pictures on the wall behind them. 
344.jpg,There are several people sitting around a table. There is a man in a green uniform sitting on a blue stool. There are water bottles on the table in front of him. 
345.jpg,A man is standing in front of a large screen. He is wearing a suit and a red tie. There is a city on the screen behind him. 
346.jpg,A man and a woman are standing behind a white table. They are both dressed in business attire. The woman is wearing a short sleeve red dress and has short brown hair. There is a large screen behind them with a city scene on it. 
347.jpg,The image is of a news studio. There is a man and a woman sitting behind a desk. The man is wearing a suit and tie. The woman is wearing headphones. The desk is white and has a red logo on it. The floor of the studio is gray. The walls are white and there is a large picture of a city on the wall behind the man and woman.
