frame,caption
146.jpg,A woman in a red dress is standing in front of a large screen. There is a picture on the screen behind her. There are tall buildings on the ground behind the woman. 
147.jpg,A woman in a red dress is standing in front of a screen. There is a large screen behind her. There are many people standing on a stage. 
148.jpg,A woman in a red dress is standing in front of a picture of a city. There is a large screen on the wall behind her. There are many tall buildings and skyscrapers on the ground. 
149.jpg,A cartoon picture of a woman is shown on a TV screen. The woman is wearing a yellow robe and a yellow hat. She is holding a sword in her hand. There is a brown wall behind the woman. 
150.jpg,A man is standing on a stage. He is wearing a suit and is holding a red stick in his hand. There is a large clock on the stage in front of him. There are fireworks behind him. 
151.jpg,There is a large stage with colorful lights on it. There are people standing on the stage in front of them. There is a lot of smoke coming off of the stage.
152.jpg,There are people standing on a stage. They are wearing yellow shirts. There are drums in front of them. There is a large red and yellow flag on the stage. 
153.jpg,There is a large colorful object in front of a black wall. There is a tree next to the object. There are lights hanging from the tree. 
154.jpg,There are several people standing on a stage. They are holding swords in their hands. There is a red carpet on the stage under them. There are stairs behind them. 
155.jpg,A man is wearing a gray suit and a white collared shirt. He has a blue lanyard around his neck. There is a large green bush behind him. There are yellow lanterns hanging from the ceiling. 
156.jpg,There are three people standing in front of a white wall. They are wearing red jackets and hats on their heads. There is a woman in a black dress holding a white ribbon. 
157.jpg,There is a stage with a lot of people standing on it. There is a person standing on top of a podium in front of them. There are lights on the stage behind them.
158.jpg,There is a woman in a red shirt standing in front of a silver fence. There is a large tree with red flowers on it behind the woman. There are people standing behind the fence. 
159.jpg,There are several women in white outfits holding large shields. There is smoke behind them. They are wearing headdresses with feathers on top of their heads. 
160.jpg,There is a woman in a red shirt standing in front of a silver fence. There is a large tree with red flowers on it behind the woman. There are people standing behind the fence. 
161.jpg,There is a stage that has people standing on it. There are lights around the stage. There is a lot of smoke coming out of the stage and people are standing in front of them.
162.jpg,A man is standing in front of a large screen. He is wearing a black jacket and glasses. There is a man sitting in a chair behind him. 
163.jpg,A man is standing in front of a computer screen. He is wearing a black shirt and white pants. There is another man sitting in a chair in a room behind him. There are large screens on the wall behind them. 
164.jpg,A video game is being shown on a TV screen. There is a large field of grass in front of a large tree. There are several people standing in the field. 
165.jpg,A man is standing in front of a screen. He is wearing a black suit and a red tie. The man is holding a tablet in his hands. There is a large screen behind the man. 
166.jpg,A woman is standing in front of a screen. She is wearing a short red dress. She has short black hair. The woman is holding a small black object in her hands. There is a large screen behind the woman. 
167.jpg,A woman is standing in front of a screen. She is wearing a red dress and holding a brown purse. There is a large screen behind her with a city on it. 
168.jpg,A woman is standing in front of a screen. She is wearing a red dress and holding a brown purse. There is a large screen behind her with a city on it. 
169.jpg,A woman is standing in front of a screen. She is wearing a red dress and holding a book in her hands. There is a large picture on the screen behind her. There are tall buildings on the other side of the picture. 
170.jpg,A man is standing in front of a large screen. He is wearing a black jacket and glasses. There is a man sitting in a chair behind him. There are several screens on the wall behind the man. 
171.jpg,A man is standing in front of a large screen. He is wearing a black suit. There are blue chairs behind him. There is a red and white sign on the bottom of the screen.
172.jpg,There is a man sitting in front of a blue wall. There are several screens hanging on the wall above the man. There is a large monitor on a stand in the front of him. 
173.jpg,A man is sitting at a desk in front of a computer monitor. He is wearing a black shirt. There are large screens hanging on the wall behind him. 
174.jpg,There is a man sitting in front of a blue wall. There are large screens hanging on the wall above the man. There is a computer monitor on a desk in frontof him.
175.jpg,There are two men standing in a room. There is a large screen on the wall behind them. The man standing in front of the screen is wearing a black shirt. 
176.jpg,A man is standing in front of a computer monitor. He is wearing a black jacket and glasses. There is a white wall behind the man. 
177.jpg,A man is standing in front of a computer screen. He is wearing a black shirt and pants. There is another man sitting in a blue chair in a room. There are large windows on the wall behind them. 
178.jpg,A man is wearing a black jacket. He is standing in front of a white wall. There is a large white object next to the man. The man has short black hair. 
179.jpg,There is a man in a black shirt sitting in front of a machine. There is another person standing behind him wearing a black suit. The wall behind them is white. 
180.jpg,There is a man wearing a black suit and a red tie. He is standing in front of a red wall. There is a picture on the wall behind the man. The man is wearing glasses on his face. 
181.jpg,A man in a black shirt and a red tie is standing in front of a screen. He is holding a tablet in his hands. There is a picture on the screen next to the man. 
182.jpg,A man in a black suit and a red tie is standing in front of a red background. He is holding a tablet in his hands. There is a picture on the screen next to the man. 
183.jpg,A woman is wearing a black jacket. She is holding a yellow object in her hand. There are sticks in front of her. 
184.jpg,A person is wearing a black jacket. They are holding a yellow and black object in their hands. There is a plastic bag under the person. 
185.jpg,A man is wearing an orange robe. He is standing in front of a white building. There is a gold fence behind him. 
186.jpg,A man is wearing a red shirt and white pants. He is standing in front of a red chair. There are sticks that are hanging on a rack behind the man. 
187.jpg,A man is wearing glasses. He is wearing a red shirt. There are water bottles behind the man. The man has short black hair. 
188.jpg,There is a woman in a gray shirt standing in front of a rack of clothes. There is a white building behind the woman. The woman is wearing a white hat on her head. 
189.jpg,A man is standing in front of a bunch of sticks. He is wearing a red shirt and glasses. He has short black hair. There is a white wall behind the man.
190.jpg,A man is wearing a striped shirt and black shorts. There are several brooms behind him. There is a small wooden table in front of the man. 
191.jpg,A person is holding a red power tool. There are white brooms behind the person. There is a wooden pole behind the brooms. 
192.jpg,There is a man wearing a red shirt. He is standing in front of a white truck. There is a red door on the truck. 
193.jpg,A woman in a red dress is standing in front of a screen. There is a large picture on the screen behind the woman. There are tall buildings on the ground. 
194.jpg,A woman is standing in front of a screen. She is wearing a red dress and holding a wallet. There is a large picture on the screen behind her. 
195.jpg,There is a hazy city in the background. There is a tall building in the middle of the city. There are several other buildings surrounding the tall building. 
196.jpg,This is an image of a city. The city appears to be in a foggy or smoggy area. There are tall buildings in the background. There is a tall tower in the distance. The sky is a light gray color. The buildings are very dark gray. The image has a red banner at the bottom with white writing on it.
197.jpg,There are several tall buildings in the distance. There is a large white building in the middle of the buildings. The sky above the buildings is hazy and white. 
198.jpg,There are two tall buildings in the distance. There is a hazy sky around the buildings. There are words written in front of the buildings in a foreign language. 
199.jpg,There are several tall buildings in the distance. There is a white sky above the buildings. There are watermarks on the bottom and top of the image.
200.jpg,There are several tall buildings in a city. There are many windows on the side of the building. There is a large tower on top of one of the buildings. The sky is gray and cloudy.
201.jpg,There are several cars driving on a road. There are tall buildings next to the street. There is a white van on the road in front of the cars. 
202.jpg,This is an image of a busy road. The road is filled with cars. There is a large bus in the middle of the road. There are many cars in the picture. The bus is blue and red. The cars are all different colors. The picture is taken in the day time. The sun is shining brightly on the street. The street has white lines on it.
203.jpg,A man is wearing a red face mask. He is wearing an orange and gray shirt. There is a white wall behind the man. 
204.jpg,A man is wearing a red face mask. He has short dark hair. There is a white wall behind the man. 
205.jpg,There are several cars driving on the street. There is a large red building next to the street with a large sign on the side of it. There are people walking on the sidewalk in front of the cars. 
206.jpg,A man is wearing a red mask. He has dark hair and is wearing an orange vest. There is a white wall behind the man. 
207.jpg,There are cars driving on the street. There are tall buildings next to the street in front of the cars. There is a tall light pole next to them. 
208.jpg,There are several cars and motorcycles on the street. There is a yellow car in front of the white van. There are buildings on both sides of the street next to the cars. 
209.jpg,There are several cars and motorcycles on the street. There are white and red stripes on the ground in front of the motorcycles. There is a green fence on the side of the street next to the cars. 
210.jpg,This is a picture of a city. There are tall buildings on both sides of the street. There is a large yellow truck driving down the street in front of a white car. There large green trees on the side of the road. The sky above the street is white. 
211.jpg,A hazy cityscape is shown in this image. There are several tall buildings in the background. There is a very tall tower in the middle of the city. The sky is filled with hazy clouds.
212.jpg,A man is standing in front of a screen. He is wearing a black suit and a red tie. The man is holding a tablet in his hands. There is a picture on the screen behind the man. 
213.jpg,A man is standing in front of a screen. He is wearing a black shirt and a red tie. The man is wearing glasses on his face. There is a picture on the screen behind the man. 
214.jpg,A video game is being shown on a screen. There are two characters standing in a field of grass. There is a large rock formation behind them. One of the characters has red hair and is wearing a backpack.
215.jpg,A video game is shown on a screen. There are several characters in the game. They are standing in a field of grass. There is a large mountain behind them. 
216.jpg,A video game is being shown on a television screen. There is a large mountain behind the screen with a yellow vehicle on it. There are rocks on the ground in front of the vehicle. 
217.jpg,This is a video game scene. There is a pink pig standing in front of a wooden structure. There are several other animals surrounding the structure. 
218.jpg,This is a video game scene. There is a large body of water in front of a large rock formation. There are trees on a hill next to the water. 
219.jpg,A video game is being shown on a screen. There are two characters standing in front of a large fire. One of the characters is wearing a red hat and holding a gun. 
220.jpg,A video game is being shown on a TV screen. There are two characters on the screen. One of the characters is green and the other is black and red. There is a brown floor under them. 
221.jpg,A video game is being played. There are several characters in the game. There is a large white statue in front of trees. 
222.jpg,A video game is being shown on a monitor screen. There is a green and purple character on the left side of the screen. In front of the character is a large explosion of fire and white lightning bolts. There are buildings in the background. 
223.jpg,There is a man sitting in front of a bed. There is a white pillow on the bed. The man has black hair and a black shirt on. 
224.jpg,A man is sitting in front of a computer screen. He is wearing a black shirt. There are two monitors on a desk behind him. There is a bookshelf behind the man with books on it. 
225.jpg,A video game is displayed on a monitor screen. There is a person standing in front of a large pile of rocks. The person is wearing a black outfit and has red hair. There are buildings behind the rocks. 
226.jpg,A video game is being played. There is a girl with red hair standing in front of a pile of rocks. There are large boulders behind the girl. 
227.jpg,A woman in a red dress is standing in front of a large screen. The screen has a red and white logo on it. The woman is holding a gold wallet. 
228.jpg,There is a woman in a red dress standing in front of a screen. There is a picture of two white dogs on the screen. The dogs are wearing a white gown. 
229.jpg,A woman in a red dress is standing in front of a screen. There is a man in a black shirt and a white dog on a table behind her. There are buildings on the screen behind the woman.
230.jpg,A man is walking with two white dogs. He is wearing a black suit and a white mask. There is a small white car behind him. There are pink tires on the ground next to the man. 
231.jpg,There is a man in a black suit with a white bear mask on his head. He is walking down a sidewalk. There is a small white car on the sidewalk in front of him. There are people standing next to him. 
232.jpg,There are two white poodles standing on the grass. There is a white dress on the dog. The dog is wearing a black hat. 
233.jpg,A woman with dark curly hair is wearing a pink shirt. There is a white table behind her. There are people sitting at the table. 
234.jpg,There are people sitting in chairs under a yellow and white tent. There are people standing in front of a stage. There is a white building behind the stage.
235.jpg,There are two dogs being held by a person. One of the dogs is white and the other dog is brown and white. The person is wearing black shoes. There is a red collar on the dog. 
236.jpg,There are two dogs standing next to each other. One of the dogs is wearing a hat and a bow tie. There is a person sitting behind them. 
237.jpg,A man is sitting in a chair outside. He is wearing a blue jacket and large silver earrings. He has dark sunglasses on and his hair is cut short. There is a field of grass behind the man. 
238.jpg,There are people standing in front of a yellow tent. There are people sitting in chairs under the tent. They are wearing hats on their heads. 
239.jpg,There are two white poodles standing on the grass. There is a motorcycle next to them. There are white flowers on the motorcycle. 
240.jpg,There are two white poodles standing next to each other. One of the dogs is wearing a black and white outfit with a red bow on its head. The other dog is also wearing a white outfit. They are standing in front of a cart that is sitting on the grass. There are white flowers on the cart.
241.jpg,A white car is shown from the side view mirror. The car is parked and the driver side window is open. There is a steering wheel in the driver's seat. There are trees behind the car.
242.jpg,Two men are walking towards a black car that is parked in front of them. One of the men is wearing a red shirt and blue shorts. The other man is wearing black shorts and a blue shirt. There is a white toilet with yellow flowers on it in front the car.
243.jpg,A man is sitting in a chair. He is wearing a blue collared shirt. There is a white brick wall behind the man. The man has short black hair. 
244.jpg,A red and white graphic has the number 6 on it. The number 6 is red and silver. There are small dots on the red background. There is a white stripe on the white background. 
245.jpg,A woman is standing in front of a screen. She is wearing a short sleeve red dress. The woman has short dark colored hair. There is a large picture behind the woman. 
246.jpg,A woman is standing in front of a screen. She is wearing a short red dress. She has short black hair and is holding a tablet in her hands. There is a large picture on the screen behind her. 
247.jpg,A woman is standing in front of a screen. She is wearing a short sleeve red dress. The woman is holding a wallet in her hand. There is a large picture on the screen behind the woman. 
248.jpg,A woman is standing in front of a screen. She is wearing a red dress and holding a brown purse. There is a large screen behind her with a picture of buildings on it. 
249.jpg,There are several motorcycles on the street. There is a large bus behind them. There are lights above the street on the poles. A man in a blue suit is standing in front of the motorcycles. 
250.jpg,There are several motorcycles on the street. There is a large white truck next to the motorcycles. There are two people standing in front of the motorcycle. 
251.jpg,There are several cars and motorcycles on the street. There are white cones on the ground in front of the cars. There is a white van in the middle of the road. 
252.jpg,This is an image of a busy street. There are several vehicles on the road. There is a large white truck in the middle of the street. The headlights on the truck are on. There appears to be a person riding a motorcycle in the front of the white truck. The motorcycle has a blue light on the top of it.
253.jpg,This is a traffic scene. There are several large trucks driving on the street. There is a large red truck on the side of the street next to a sidewalk. People are walking on the sidewalk next to the truck. 
254.jpg,There are several cars on the street. There are orange cones on the ground in front of the cars. There is a tree next to the street on the other side of the road.
255.jpg,There are several cars on the street. There is a large crowd of people standing on the side of the street next to the cars. There are orange cones on the ground in front of them. 
256.jpg,A man is standing in front of a screen. He is wearing a black suit and a red tie. The man is holding a tablet in his hands. There is a picture on the screen behind the man. 
257.jpg,A man in a black shirt and a red tie is standing in front of a red background. He is holding a tablet in his hands. There is a large screen behind the man. 
258.jpg,There are trees and bushes on the side of a road. There is a person riding a bike on the road. The road has a white fence on it. 
259.jpg,There is a white car on the ground. There are trees and bushes around the car. There is a red and white sign in front of the car with writing on it.
260.jpg,A picture of a white car. There is a side view mirror on the side of the car. The window is open and there is a stick sticking out of the window. 
261.jpg,A person is holding a white plastic bag. There is a tree behind the person. The person is wearing a black hat. 
262.jpg,"The image is a screenshot from a video. It appears to be taken inside of a car. The seats are black and there is a white cloth on one of the seats. The dashboard of the car is black. There is a windshield wiper on the right side of the image. The text on the image reads ""Nong dan Italia tiep tuc bieu thai thu do Roma""."
263.jpg,The image is a screenshot from a video. It is a black and white image. There is a yellow object in the car window. The yellow object appears to be a safety vest. The text on the image is in Vietnamese.
264.jpg,There is a white car on the ground. There is a man in a green shirt standing in front of the car. There are leaves and dirt around the man.
265.jpg,There are two men standing next to a white car. They are wearing green uniforms. There are weeds and grass around them. There is dirt under them. 
266.jpg,There is a man in a green suit climbing up a white car. There is another man wearing a green shirt in front of the car. 
267.jpg,A red background with white lines on it. There are small square lights on the left side of the red background. There is white writing on the bottom of the picture. 
268.jpg,There is a black screen with a picture on it. There is a bright light coming off of a table. There are leaves on the table in front of the table.
269.jpg,There are several people standing in a line. There are lights on in front of them. There is a black background behind them. 
270.jpg,"The image is a screenshot from a video. The background is completely black. The time and date of the video is 18:49:20. At the top right corner of the image there is a logo that says ""HTV7 HD"" in red letters. Below the logo there is the name ""Nguy co dai"" in white letters."
271.jpg,"The image is a screenshot from a video. The time is 18:49:26. The image is blurry. The background is black. At the bottom of the image there is a caption in Vietnamese that reads ""Nguy co dau tran tai Trinidad & Tobago lan sang Venezuela""."
272.jpg,There are two people standing in a room. They are wearing white shirts and black shorts. There is a white wall behind them. 
273.jpg,There is a black car in the dark. There are people standing in front of the car. There is a white light on the front of it. 
274.jpg,There are people standing in front of a fire. There is a man in a red shirt running towards the fire. 
275.jpg,A woman is standing in front of a large screen. She is wearing a short red dress. She has short black hair. The woman is holding a small brown purse. There is a large picture on the screen behind the woman. 
276.jpg,A woman is standing in front of a screen. She is wearing a short sleeve red dress. The woman has short black hair and is holding a brown purse. There is a large screen behind the woman. 
277.jpg,A woman is standing in front of a screen. She is wearing a red dress and holding a brown purse. There is a large screen behind her with a picture of a city on it. 
278.jpg,A woman is standing in front of a screen. She is wearing a red dress and holding a brown purse. There is a large picture on the screen behind her. There are tall buildings on the ground. 
279.jpg,A woman is standing in front of a screen. She is wearing a short sleeve red dress. The woman is holding a small brown purse. There is a large screen behind the woman. There are buildings on the screen. 
280.jpg,A woman is standing in front of a television screen. She is wearing a short sleeve red dress. The woman has short black hair. There is a large screen behind the woman. 
281.jpg,"The background of the screen is black. At the top left corner there is a thumbs up icon that says Thich. Below that there are three icons that say Thich, Binh luan, Gui, Chia se, and HTV7HD. The time is 18:50:11."
282.jpg,There are three men in a room. One of the men is wearing a green uniform. There is a man sitting at a table in front of him wearing a black shirt. 
283.jpg,A man is standing in front of a screen. He is wearing a black suit and a red tie. The man is holding a tablet in his hands. There is a picture on the screen behind the man. 
284.jpg,A man is standing in front of a screen. He is wearing a black suit and a red tie. The man is holding a tablet in his hands. There is a picture on the screen behind the man. 
285.jpg,A man is standing in front of a screen. He is wearing a black suit and a red tie. He has glasses on and is holding a tablet in his hands. There is a large picture on the screen behind the man. 
286.jpg,A man is standing in front of a screen. He is wearing a black suit and a red tie. He has glasses on and is holding a tablet in his hands. There is a large picture on the screen behind the man. 
287.jpg,This is an aerial view of a highway. The highway is divided into two lanes. There is a small building on the side of the road. There are several cars driving on the highway. 
288.jpg,This is an aerial view of a highway. The highway is divided into two lanes. There is a small building on the side of the road. There are several cars driving on the highway. 
289.jpg,There are three people standing on a tall metal structure. There is a man in a white shirt and blue jeans standing on the top of the structure. Next to him is a woman wearing a white top and white pants. There are clouds in the sky above them. 
290.jpg,There is a red flag with a yellow star on it. There is a man standing on top of a white ladder. There are mountains in the distance. There clouds in the sky. 
291.jpg,A man is standing on a metal ladder. He is wearing a white shirt and a white hat. There is a yellow bag hanging from the ladder. A red flag is hanging from a pole next to the man. 
