frame,caption
001.jpg,A beautiful sunset over a city. The sky is orange and pink. There are a couple of giant letters that spell out the name of the city. There is a large body of water in front of the buildings.
002.jpg,A man and a woman are standing in front of a news desk. The desk is white and has a red logo on it. The man is wearing a blue shirt and a red tie. He is looking down at something in his hands. The woman is standing behind the desk wearing a red dress. There is a large screen behind them. There are many buildings and skyscrapers on the screen.
003.jpg,A man and a woman are standing in front of a desk. The desk is white and has a red logo on it. The man is wearing a blue shirt and a red tie. The woman is also wearing a red dress. There is a large screen behind them. There are buildings on the screen. 
004.jpg,The image is a graphic. The background is red and white. There are dots on the red background. In the center of the graphic is gray. There is a white circle in the graphic.
005.jpg,A woman in a white shirt and black skirt is walking down the street. There are cars parked on the street next to the sidewalk. There is a green rug on the ground in front of the woman.
006.jpg,This is an image of a city. The city is lit up. There are tall buildings in the background. The buildings are light up green and white. There is a crowd of people in the middle of the street. The people are walking. The street is made up of concrete. The trees are tall and green. The sky is dark.
007.jpg,This is an aerial view of a city. There are tall buildings on the right side of the image. There is a lot of cars parked on the street. The trees are green and there are some buildings in the distance.
008.jpg,A car is driving on a road. There is a red and white sign on the side of the road. The car has a black grill on the front of it. 
009.jpg,Two men are standing in a room. One of the men is wearing a black baseball cap and a black long sleeve shirt and black pants. The other man is standing in front of a white wall. There is a table with water bottles on top of it. A woman is sitting at a white table with a black chair. The floor of the room is light brown.
010.jpg,There are people sitting around a table. There are laptops on top of the table. A man is standing in front of them pointing at the laptops. 
011.jpg,The image is a graphic design. The background is red and white. The design is made up of dots. The dots are small and are arranged in a pattern. There is a diagonal white and black striped pattern. In the center of the design is the number 6. The numbers are red and silver. The letters are bold and stand out against the background.
012.jpg,A man and a woman are standing behind a news desk. The desk is white and has a red logo on it. The man is wearing a blue shirt and a red tie. The woman is also wearing a red dress. There is a large screen behind them. There are buildings on the screen. 
013.jpg,A man and a woman are standing in front of a white desk. They are both holding red objects in their hands. The man is wearing a blue shirt and a red tie. There is a large cityscape behind them. The sky is orange and red. 
014.jpg,A man and a woman are standing in front of a white desk. They are both holding red objects in their hands. The man is wearing a blue shirt and a red tie. The woman is also wearing a red dress. There is a large cityscape behind them. The sky is red and orange. 
015.jpg,A man and a woman are standing in front of a white table. They are both holding red objects in their hands. The man is wearing a blue shirt and a red tie. There is a large cityscape behind them. The sky is orange and red. 
016.jpg,This is an image of a city street. The street is very wet. There are cars and a bus on the road. The bus is green and white. The headlights on the bus are on. There is a person standing by the car. The person is wearing a white shirt. The shirt is short sleeve. The man has short brown hair. The car is white.
017.jpg,"There are several yellow and red paper lanterns hanging from the ceiling of a building. There is a sign on the front of the building that says ""CIAO CAFE"". There are lights on the ceiling above the lanterns."
018.jpg,There are several yellow and red lanterns hanging from the ceiling. There is a white sign on the wall under the lanterns. There are people standing in front of a building. 
019.jpg,A woman is sitting in a chair and talking into a microphone. She is wearing a white collared shirt. There is a man sitting behind her wearing a yellow shirt. He is holding a black phone in his hand. 
020.jpg,People are walking on a sidewalk in front of a building. The building has lights hanging from the ceiling. There is a red light on a pole next to the sidewalk. 
021.jpg,There is a man wearing a camouflage shirt and a white face mask. He is standing next to a little girl. They are both looking at a book that is in front of them. There are plants behind them. 
022.jpg,People are walking on a sidewalk in front of a building. The building has lights hanging from the ceiling. There is a red light on a pole next to the sidewalk. 
023.jpg,There are two people standing in front of a table. There is a man wearing a camouflage shirt and a white face mask on his face. He is holding a book in his hands. There are plants on the wall behind them. 
024.jpg,There are white tables and chairs in front of a white building. There is a large tree next to the tables. There are plants next to a picture frame on a stand. 
025.jpg,A man is sitting in a room. He is wearing a blue collared shirt. There is a window behind him with white blinds on it. A desk is in front of the man with pens on top of it. 
026.jpg,Two men are walking down a sidewalk in front of a store. There is a large black umbrella over a table next to them. There are lights hanging from the ceiling of the store. 
027.jpg,A man is wearing a white shirt and a blue tie. He has glasses on and is speaking into a microphone. There are people behind him sitting at tables. 
028.jpg,This is an image of a city. The city is lit up. The lights are green. The buildings are tall. The sky is dark. There are many people walking around. The people are walking in a plaza. The plaza is surrounded by trees and bushes. The bushes are green and short. There is a man in a green shirt standing in the middle of the plaza.
029.jpg,This is an image of a street. The street is very dark. The sky is black. There are white buildings on both sides of the street. There is a large tree in the middle of the photo. The tree has green leaves on it. The building on the left has a large window on it's side. The window is white with a black trim. There sign on the right is blue with white letters. The sign has two arrows on it that are pointing in opposite directions.
030.jpg,There are several motorcycles on the street. There are large buildings next to the street with lights on them. There is a white crosswalk in front of the motorcycles.
031.jpg,This is an image of a street. The street is very busy. There are many vehicles on the road. The vehicles are parked along the sidewalk. The sidewalk is made of concrete. The sidewalks have trash cans on them. The trash cans are gray. There is a large green tree on the sidewalk in front of a building. The building has many signs on it. The signs are white with black text.
032.jpg,A man is standing in front of a city skyline. He is wearing a blue striped shirt and a red tie. The man is holding a small red object in his hands. The sky behind the man is orange and yellow. There are tall buildings in the skyline.
033.jpg,A man is standing in front of a city skyline. He is wearing a blue striped shirt and a red tie. The man is holding a red tablet in his hands. The sky behind the man is orange and pink. There are tall buildings all around the man.
034.jpg,A map of a city is shown on a TV screen. The map is colored purple and green. There is a red and white logo on the bottom left corner of the screen.
035.jpg,There are two large cranes on the ground. There are several buildings behind the cranes. There is grass in front of the buildings. 
036.jpg,There is a large green crane in the background. There is a white building behind the crane. There are weeds in front of the crane and the ground. 
037.jpg,A crane is lifting a large piece of wood. The crane is green and white. There is a white building behind the crane. 
038.jpg,A picture of a construction site. There is a large green crane in front of a building. There are trees behind the crane. 
039.jpg,There is a large body of water. There are wooden posts sticking out of the water in the water. The water is calm and there are green leaves on the ground in front of it.
040.jpg,There is a large green crane on the ground. There are two people standing next to the crane. There is a white building behind the crane with trees in front of it.
041.jpg,There is a large body of water in front of a building. There are trees and bushes on both sides of the water. There is a white ladder leaning against the side of the building. 
042.jpg,There is a large body of water in front of a white fence. There are two wooden posts in the water. There is grass next to the fence. 
043.jpg,A picture of a construction site. There are pipes laying in the dirt. There is a body of water next to the construction site with a large crane in the background. 
044.jpg,A picture of a construction site. There is a red and white backhoe in the ground. There are large white buildings behind the backhoe. 
045.jpg,There are construction workers on a building under construction. There is a red and white stripe on the side of the building. There are three men standing in front of the red stripe. They are wearing white hard hats. 
046.jpg,There is a bridge under construction. There are workers on top of the bridge. They are wearing white hard hats. There is a red and white striped tape in front of them. 
047.jpg,There are two men wearing white hard hats standing in front of a construction site. There is a large orange and white truck behind them. There are people standing around the construction site looking at the men. 
048.jpg,A man and a woman are standing in front of a white table. They are both holding red objects in their hands. The man is wearing a blue shirt and a red tie. The woman is wearing an off-white dress. There is a large cityscape behind them. The sky is orange and red. There are tall buildings in the distance. 
049.jpg,A man and a woman are standing in front of a white table. They are both holding red objects in their hands. The man is wearing a blue shirt and a red tie. The woman is wearing an off-white dress. There is a large cityscape behind them. The sky is orange and pink. There are tall buildings in the distance.
050.jpg,A man and a woman are standing in front of a white table. The man is wearing a blue shirt and a red tie. He is holding a red phone in his hands. The woman is also wearing a red dress. There is a large cityscape behind them. The sky is red and orange. 
051.jpg,A man and a woman are standing in front of a white table. The man is wearing a blue shirt and a red tie. He is holding a red wallet in his hands. The woman is also wearing a red dress. There is a large cityscape behind them. The sky is red and orange. 
052.jpg,A man in a yellow vest is wearing a yellow helmet and a white face mask. He is standing in front of a brick wall. There is another man in the blue shirt standing next to him. 
053.jpg,A man in a yellow shirt is wearing a yellow helmet. There is a black car in front of the man. There are people walking on the sidewalk behind him. 
054.jpg,There is a lot of trash on the ground. There are trees surrounding the trash. There is a silver fence in front of the pile of trash.
055.jpg,A large pile of trash is behind a silver fence. There is a blue dumpster next to the pile. There are trees in front of the dumpster. 
056.jpg,There are many motorcycles parked in a lot. There are tall buildings in the distance behind them. There is a small green building in front of the motorcycles.
057.jpg,There is a blue truck that is sitting in the grass. There are weeds all around the truck. There is a white fence behind the truck on the other side of the fence. 
058.jpg,There are several motorcycles parked in a row. There are trees behind the motorcycles. There is a red motorcycle in front of a black motorcycle. 
059.jpg,There are several motorcycles parked next to each other. There is a white motorcycle in front of a blue motorcycle. There are plants next to the motorcycles. 
060.jpg,There are several motorcycles parked in front of a building. There are trees behind the motorcycles. There is a red and white sign on the front of the building.
061.jpg,There are two men standing in front of a large pile of motorcycles. One of the men is wearing a green shirt and green pants. The other man is wearing an orange shirt. There is a red fire hydrant next to the men. 
062.jpg,A man and a woman are standing behind a white table. They are both holding red objects in their hands. The man is wearing a blue shirt and a red tie. There is a large screen behind them with a city on it. 
063.jpg,A man and a woman are standing in front of a large screen. They are both holding red folders in their hands. The man is wearing a blue shirt and a red tie. The woman is also wearing a red dress. The screen behind them has a cityscape on it. There is a red sky above the city. 
064.jpg,There is a man and a woman standing in front of a desk. The desk is white and has a red logo on it. The man is wearing a blue shirt and a red tie. There is a large screen behind them.
065.jpg,A man and a woman are standing behind a white table. They are both holding red folders in their hands. There is a large screen behind them with a city on it. The man is wearing a blue shirt and a red tie. 
066.jpg,There are several children standing in a room. They are wearing blue shirts and blue shorts. There is a woman in a white shirt standing in front of them. 
067.jpg,There are two women standing in front of a large screen. They are wearing white shirts and black pants. There are children sitting in chairs around them. There is a window behind them with curtains on it. 
068.jpg,There are several children standing in front of a woman. The woman is wearing a white face mask on her face. There are bushes behind the people. 
069.jpg,There are three children standing next to each other. There are trees behind them. There is a man in a white shirt standing in front of them. 
070.jpg,There are two women standing in front of a screen. They are wearing white shirts and black pants. There are children standing in a room in the front of them. There is a white pillar behind them. 
071.jpg,There are two women wearing yellow shirts. There are small children sitting on the ground in front of them. There is a large screen behind them. 
072.jpg,A woman is sitting in front of a white wall. She is wearing a short sleeve yellow shirt. There is a microphone attached to her shirt. The woman has long black hair that is tied up in a ponytail. 
073.jpg,There are several children standing in front of a screen. They are wearing yellow shirts and shorts. There are cartoon characters on the screen behind them. 
074.jpg,There are four children standing in front of a blue screen. They are wearing yellow shirts and black suspenders. They have black hair ties in their hair. 
075.jpg,There are several children standing in a room. They are wearing yellow shirts and shorts. There is a woman standing in front of them wearing a yellow dress. There are windows on the wall behind them. 
076.jpg,There are several children standing in a room. They are wearing yellow shirts and shorts. There is a woman in a yellow shirt standing in front of them. There are large windows on the wall behind them.
077.jpg,A man is wearing a black suit and a white shirt with a black and red tie. He has short brown hair and is wearing black glasses. There is a green plant behind him. 
078.jpg,A woman is standing in a room with a large screen on the wall in front of her. She is wearing a yellow shirt and a white skirt. There is a table with a green table cloth on it behind the woman. 
079.jpg,A small toy is sitting on top of a green piece of paper. There are other pieces of paper on the floor around the toy. 
080.jpg,Six children are sitting on the floor in a circle. They are all wearing yellow shirts and shorts. There is a green mat in front of them with a white and black toy on top of it. There are shelves behind them with colorful boxes on them. 
081.jpg,A blue screen has red writing on it. There is a logo in the middle of the screen. The logo is red and blue. There are white letters on the top of the blue screen. 
082.jpg,There are several people sitting in chairs. There is a white wall behind them. They are all wearing face masks on their faces. 
083.jpg,There are several people sitting in white chairs. There is a large screen on the wall in front of them. There are lights hanging from the ceiling above the screen.
084.jpg,A man and a woman are standing in front of a white table. They are both holding red objects in their hands. The man is wearing a blue shirt and a red tie. The woman is also wearing a red dress. There is a large cityscape behind them. The sky is red and orange. 
085.jpg,A man and a woman are standing in front of a white table. They are both holding red books in their hands. The man is wearing a blue shirt and a red tie. There is a large cityscape behind them. 
086.jpg,A man and a woman are standing in front of a white table. They are both holding red envelopes in their hands. The man is wearing a blue shirt and a red tie. The woman is also wearing a red dress. There is a large cityscape behind them. The sky is red and orange. 
087.jpg,This is an aerial view of a city. There are tall buildings in the background. There is a large parking lot in the middle of the city with lots of cars parked in it. 
088.jpg,The sky is white and cloudy. There are tall buildings in the distance. There is a flag on a pole in front of one of the buildings. The flag is red and white. At the bottom of the image there is a red banner. The banner has white writing on it.
089.jpg,"A man is standing outside on a sunny day. He is wearing a black jacket and a green shirt. Tall green trees can be seen on both sides of the man. People are riding bikes on a road near the man, and there are tall buildings in the background. Tall black light poles are standing on a grassy field near the people."
090.jpg,There is a large white arch in the distance. There are several tall buildings in front of the arch. There is a tree next to a black light pole. 
091.jpg,A white van is driving down the street. There is a large red crane behind the van. There are large buildings behind the crane. 
092.jpg,There is a pile of dirt in front of a construction site. There is a yellow crane behind the dirt. There are red boxes behind the crane. 
093.jpg,There are tall buildings in the distance. There is water in front of the buildings. There are small waves in the water. 
094.jpg,There are tall buildings in the distance. There is a large crane in front of the buildings. There are trees on the other side of the water. 
095.jpg,A man is wearing a blue collared shirt. He has short white hair and is wearing black glasses. There is a white wall behind the man.
096.jpg,A man is wearing a blue collared shirt. He has short white hair and is wearing black glasses. There is a white wall behind the man.
097.jpg,There are tall buildings in the distance. There is water in front of the buildings. The sky above the buildings is white. There are small waves in the water. 
098.jpg,There are several motorcycles driving down the street. There are trees lining the street next to the sidewalk. There is a man in a red shirt walking on the sidewalk in front of the motorcycles.
099.jpg,There are several people riding motorcycles on the street. They are all wearing helmets and face masks. There is a bus behind them. There are trees on the side of the street next to the bus. 
100.jpg,A family of four is sitting around a wooden table. There is a white cabinet in front of the table with dishes on top of it. There are two children sitting on chairs around the table. 
101.jpg,"A logo is displayed on a white background. The logo is red and white. There are small dots on the white background that are red in color. There is a large red circle in the middle of the logo. The word ""giay"" is written in white letters. Below the red circle is the word ""TIEP THEO"" in red letters."
102.jpg,A group of men are standing outside of a building. They are wearing white hard hats on their heads. There is a large gray pole in front of the men. There are wooden beams on the building. 
103.jpg,A man is holding a hammer in his hand. He is wearing a black shirt and gray pants. There is a person wearing a white helmet in front of him. There are stairs next to the man. 
104.jpg,A doll is standing on a red table. The doll is wearing a red dress with a yellow cape over it. There is a skeleton next to the doll. 
105.jpg,On the left side of the screen there is a robot holding a gun. The robot is wearing a yellow helmet. On the right side there is an x-ray image of a skull. Below the image there is text in Vietnamese.
106.jpg,A man and a woman are standing behind a news desk. The desk is white and has a red logo on it. The man is wearing a blue shirt and a red tie. The woman is also wearing a black dress. There is a large screen behind them. There are buildings on the screen. 
107.jpg,A man and a woman are standing in front of a news desk. The desk is white and has a red logo on it. The man is wearing a blue shirt and a red tie. He is holding a red object in his hands. The woman is also wearing a brown dress and high heels. There is a large screen behind them.
108.jpg,A woman is standing in front of a large screen. She is wearing a short red dress. There is a large picture on the wall behind her. 
109.jpg,A woman is sitting inside of a car. The car is black and has a yellow license plate on it. There is a large screen on the wall behind the car. 
110.jpg,A picture of an empty parking lot is shown on a foggy day. There are four poles in the background. The ground is covered in snow and ice. There is a red banner at the bottom of the picture with white writing on it.
111.jpg,There is snow on the ground. There are cars parked in front of a building. There is a person walking in the snow wearing a black jacket. 
112.jpg,A yellow tractor is driving through the snow. There is a white building behind the tractor. There are wires above the building. 
113.jpg,A green and white truck is parked in the snow. There is a flag on a pole next to the truck. There are power lines above the truck and the flag. 
114.jpg,A man is using a snow blower to clear snow from his yard. He is standing in front of a house that is partially covered in snow. There is a large amount of snow on the ground. A large tree is standing near the house. 
115.jpg,A person is standing in the snow. There is a lot of snow on the ground. There are trees next to the person. 
116.jpg,A truck is driving on a snowy road. There is a large cloud of snow behind the truck. There are poles on the side of the road. 
117.jpg,There are several cars driving on a road. There is a large white truck next to the cars. There are clouds of snow on the ground in front of them.
118.jpg,There is a small white building in the snow. There is a tree in front of the building. There are clouds in the sky above the house.
119.jpg,A large tree is standing in the snow. There is snow on the branches of the tree. There are poles in front of the trees. 
120.jpg,A tree is standing in the snow. There is snow on the branches of the tree. There are white clouds in the sky. 
121.jpg,A man is standing in front of a picture of a city. He is wearing a blue striped shirt and a red tie. The man is holding a red tablet in his hands. There are tall buildings behind the man. There is a red sky behind him. 
122.jpg,A man is standing in front of a city skyline. He is wearing a blue striped shirt and a red tie. The man is holding a red tablet in his hands. There is a red sky behind the man. 
123.jpg,A man is standing in front of a cityscape. He is wearing a long sleeve shirt and a red tie. The sky behind him is cloudy and pink. There are tall buildings in the distance. 
124.jpg,There is a large mountain that is covered in clouds. The clouds are white and fluffy. There is a red banner in front of the mountain.
125.jpg,There is a black car driving on the street. There are trees on the side of the street next to the car. There is a large mountain in front of the car with a lot of smoke coming out of it. 
126.jpg,A volcano is spewing lava and smoke into the sky. The sky is a deep purple color. The lava is bright orange and yellow. The smoke is thick and white. There are mountains in front of the lava.
127.jpg,There are several people standing around a table. They are all wearing face masks. There is a man in a blue suit standing in front of the table. 
128.jpg,A picture of a fire is shown in the dark. The fire is bright orange and red. There are clouds in the sky around the fire. The sky is black. There is a red logo on the top right corner of the picture.
129.jpg,A picture of a fire is shown. There is a large amount of smoke and fire in the picture. The fire is bright orange and bright. There are clouds in the sky around the fire.
130.jpg,There is a large cloud of smoke rising from a mountain. There are two palm trees in front of the mountain. The sky above the mountain is gray and cloudy.
131.jpg,A woman is standing in front of a screen. She is wearing a red dress and holding a red purse. There is a large white screen behind the woman. 
