frame,caption
292.jpg,"A man is crouching down in a public area. He is wearing a white beanie, a red and black long sleeve shirt and green pants. A small black dog is standing next to him. A skateboard is on the ground in front of the man. A basketball goal is sitting on a stand in the background. Tall green trees and bushes are standing near the court. Tall buildings can be seen behind the trees."
293.jpg,A cat is laying on the ground. There is a person kneeling down next to the cat. The cat is wearing a white collar. 
294.jpg,"A man in a red, white and black striped jacket is holding a cat. He is sitting next to a young boy. The boy is wearing a blue jacket. There is a basketball court behind them. "
295.jpg,A woman is standing in front of a large screen. She is wearing a red dress and white heels. There is a large city on the screen behind her. The sky is red and orange. 
296.jpg,A man and a woman are standing in front of a large screen. They are both dressed in business attire. The woman is wearing a red dress and the man has a white shirt and a purple tie. There is a large picture of a city behind them.
297.jpg,There is a fire burning on a power pole. There is black smoke coming out of the fire. There are wires above the power pole and umbrellas on the ground. 
298.jpg,There is a fire burning on a power pole. There is black smoke coming out of the top of the pole. The fire is bright orange and yellow. There are power lines above the fire. 
299.jpg,There is a fire on a power pole. There is black smoke coming out of the fire. There are people standing in front of the pole. 
300.jpg,There is a truck parked on the street. There is a motorcycle next to the truck. There are wires above the street hanging from a pole. 
301.jpg,A man in an orange jumpsuit and a white hard hat is standing on the sidewalk. There are power poles next to the street. There is a white van on the street behind the man. 
302.jpg,There are two wooden poles that have wires attached to them. There are several wires hanging from the poles. There is a blue sky behind the poles and wires.
303.jpg,A bunch of wires are laying on the ground. There is a white motorcycle next to the wires. There are cars and motorcycles on the street. 
304.jpg,A man and a woman are standing in front of a large screen. They are both dressed in business attire. The man is wearing a white shirt and a purple tie. The woman is dressed in a red dress. The screen behind them has a city scene on it. There is a red logo on the front of the screen. 
305.jpg,A man and a woman are standing in front of a large screen. They are both dressed in business attire. The woman is wearing a red dress and the man has a white shirt and a purple tie. There is a large city on the screen behind them.
306.jpg,A man and a woman are standing in front of a large screen. They are both dressed in business attire. The woman is wearing a short red dress and the man is dressed in a shirt and tie. The screen behind them has a city scene on it. There is a red carpet on the floor under the two people.
