frame,caption
274.jpg,A man in a blue shirt and a red tie is standing in front of a screen. There is a large picture on the screen behind the man. There are people walking on the street in front. 
275.jpg,A man in a blue shirt and a red tie is standing in front of a screen. There is a picture on the screen behind him. There are people walking in the snow. 
276.jpg,A man is standing in front of a crowd of people. He is wearing a white shirt and a red tie. There is a large white sign behind him. 
277.jpg,There are people running in the snow. They are wearing jackets and hats. There is a yellow van in the distance. There are trees behind the van. 
278.jpg,There is a sign with two horses on top of it. There is a small building under the sign. There are houses behind the sign in the snow. 
279.jpg,There are people standing in a room. There is a white wall behind them. They are wearing headphones on their heads. 
280.jpg,There are people standing in the snow. There is a white and blue arch in front of them. There are flags on poles behind them. 
281.jpg,A man is standing outside in the snow. He is wearing a white hat and a white scarf around his neck. There are several cars parked behind the man. The sky is blue and white.
282.jpg,There is snow on the ground. There are flags on poles on the side of the street. There is a person walking in the snow. 
283.jpg,There are several people walking in the snow. There is a large white cart in front of them. There are people wearing jackets and hats on their heads. 
284.jpg,A man and a woman are standing behind a white table. The man is wearing a blue shirt and a red tie. The woman is also wearing a red dress. There is a large screen behind them with a city on it. 
285.jpg,There is a house on fire. There is smoke coming out of the door of the house. There are people standing in front of the fire. They are wearing helmets on their heads.
286.jpg,A fireman is standing in front of a pile of rubble. He is wearing a black uniform with yellow and green stripes on the back. He has a long white hose in his hand. There is white smoke coming out of the pile. There are trees that have no leaves on them.
287.jpg,A white van is parked in front of a building. There are people on bikes next to the van. There is a pile of trash on the side of the building. 
288.jpg,The image is a dirty street. There is a lot of trash on the side of the street. The trash is in piles. The ground is made of dirt. The street is gray. There's a bicycle wheel in the bottom right of the image. The bicycle wheel is black. The fence on the left of the photo is made up of wood. The wood is weathered and worn. The sky is blue and cloudy.
289.jpg,There is a black car parked on the side of the street. There is a yellow sign next to the car. There are people standing on the sidewalk next to a green van. 
290.jpg,A group of men are standing outside in front of a building that has been destroyed. There is a lot of smoke coming out of the building. Some of the men are wearing short sleeve shirts and shorts. Two of them are wearing helmets on their heads. There are trees surrounding the men. 
291.jpg,There is a motorcycle parked in front of a building. There are people standing around the motorcycle. There is a tree next to the building. 
292.jpg,There is a fire burning in the background. The fire is bright orange and yellow. There is smoke coming out of the fire. There are branches and leaves hanging from the branches in front of a fire.
293.jpg,A firefighter is using a hose to put out a fire. He is wearing a black uniform with yellow and green stripes. There is a pile of trash in front of him. 
294.jpg,There is a pile of trash on the ground. There are two people standing next to the trash. There is a large white building behind them. 
295.jpg,Three firemen are standing near a pile of rubble and debris. They are wearing black and yellow uniforms and helmets. One of them is holding a long hose. There is tall weeds and branches in front of them. 
296.jpg,There are several people riding motorcycles down the street. There is a white building on the side of the street with a sign on it. There are trees next to the buildings. 
297.jpg,A man and a woman are standing in front of a white table. They are both holding red objects in their hands. The man is wearing a blue shirt and a red tie. There is a large cityscape behind them. The sky is orange and red. 
298.jpg,A man and a woman are standing in front of a white table. They are both holding red objects in their hands. The man is wearing a blue shirt and a red tie. There is a large cityscape behind them. The sky is orange and red. 
299.jpg,There is a red truck parked on the side of the street. There is a white car on the street next to the truck. There are bushes in front of the truck on the sidewalk. 
300.jpg,A red truck is driving down the street. There is a red car next to the truck. There are tall light poles on the side of the road. 
301.jpg,There are two cars that have been involved in a car accident. One of the cars is completely smashed in the front. The other car is completely red. There are green bushes in front of the two cars. There is a white pole next to the bushes.
302.jpg,A picture of a bunch of items laying on the ground. There is a plate on top of a metal object. There are plants next to the metal objects. There appears to be a red truck behind the plants. There appear to be broken pieces of the metal object laying around.
303.jpg,A red car is on the street. There are bushes in front of the car. There is a white pole next to the bushes. 
304.jpg,A red car has crashed into a red truck. There are bushes in front of the car. There is a white building behind the cars. 
305.jpg,There is a red car that has its doors open on the side of the street. There is a large red truck next to the car. There are bushes in front of the truck. 
306.jpg,A red car has crashed into a red semi truck. The semi truck is parked on the side of the road. There are bushes in front of the car. There is a building behind the truck. 
307.jpg,A red truck is parked next to a red car. There is a bush in front of the car. The car has its doors open. 
308.jpg,A red car is parked on the side of the street. There are bushes in front of the car. There is a red truck behind the cars. 
309.jpg,A large red truck is driving down the street. There are people standing on the sidewalk next to the street next to a tree. There is a red car behind the truck. 
310.jpg,A red truck is driving on the street. There is a red car in front of the truck. There are two people riding on the motorcycles. 
311.jpg,A red truck and a red car are on the street. There is a person riding a red motorcycle. They are wearing a white helmet and a face mask. 
312.jpg,There is a red car on the street. There is a large red truck next to the car. There are trees behind the cars. 
313.jpg,There is a man and a woman standing in front of a white table. There is a large screen behind them with a city on it. The man is wearing a blue shirt and a red tie. 
314.jpg,A man and a woman are standing in front of a desk. The desk is white and has a red logo on it. There is a large screen behind them. There are buildings on the screen. 
315.jpg,A man and a woman are standing in front of a large screen. They are both dressed in business attire. The man is wearing a white shirt with a red tie and black pants. The woman is dressed in a short sleeve brown shirt and brown bottoms. The screen behind them shows a city with tall buildings and a red sky.
