frame,caption
001.jpg,A beautiful sunset over a city. The sky is orange and pink. There are many buildings in the city. There is a large body of water in front of the buildings. 
002.jpg,A man and a woman are standing in front of a desk. They are both dressed in business attire. The desk is white and has a red logo on it. There is a large screen behind them that shows a city skyline. There are lights on the ceiling above them.
003.jpg,A man and a woman are standing in front of a large screen. They are both dressed in business attire. The man is wearing a white shirt and a tie. The woman is wearing an off-the-shoulder red dress. The screen behind them has a city scene on it. There is a red carpet on the floor under the man and woman.
004.jpg,There is a man and a woman standing in front of a desk. The desk is white and has a red logo on it. There is a large screen behind them. There are buildings on the screen. 
005.jpg,A red and white graphic is displayed on a screen. There is a large red light on top of a silver object. There are large red stripes on the screen. 
006.jpg,Many people are sitting in a room. They are all wearing face masks. There are white chairs in front of them. There is a large white pillar behind them. 
007.jpg,People are standing in line at an airport. They are all carrying suitcases. There is a red suitcase in front of them. 
008.jpg,A group of people are standing on a stage. They are wearing red dresses and holding red umbrellas. There is a man in a gold suit standing behind them. There are people sitting in front of the stage. 
009.jpg,There are people walking on a sidewalk. There is a woman in a red jacket standing in front of them. There are two people in costume walking next to her. 
010.jpg,A building is on fire. There is a lot of smoke coming from the top of the building. There are trees in front of the buildings. 
011.jpg,There is a large tree in front of a building. There is a white and blue building behind the tree. There are cars on the street next to the building. 
012.jpg,A white building is being sprayed with water by a fire truck. There is a tree in front of the building with purple flowers on it. 
013.jpg,A man and a woman are standing in front of a large screen. They are both dressed in business attire. The man is wearing a white shirt and a purple tie. The woman is dressed in a red dress. There is a large red screen behind them.
014.jpg,A man and a woman are standing in front of a large screen. They are both dressed in business attire. The woman is wearing a red dress and the man has a white shirt and a purple tie. There is a large city on the screen behind them.
015.jpg,A man and a woman are standing in front of a white desk. They are both dressed in formal attire. The woman is wearing a red dress and has long dark hair. The man is dressed in a white shirt and a red tie. There is a large cityscape behind them. The sky is red and orange.
016.jpg,There are several people standing in a room. There are people sitting in chairs next to them. There is a man in a striped shirt standing in front of them. 
017.jpg,There are several people sitting in chairs. There is a man in a white shirt standing in front of them. There are pillars behind them. 
018.jpg,People are walking through an airport. They are all wearing face masks. There is a man in a black shirt pulling a red suitcase behind him. There are people sitting behind a fence in front of them. 
019.jpg,People are walking through an airport. They are all wearing face masks. There is a man in a black shirt carrying a red suitcase. There are carts next to him with suitcases on them. 
020.jpg,There are several people standing in a crowd. They are all wearing face masks. There is a man in a white shirt that has an american flag on his shirt. 
021.jpg,There are people sitting on a bench. There is a man in a white shirt and blue shorts standing in front of them. There are lights behind them.
022.jpg,There is a woman standing in front of a man. The woman is wearing a white shirt. The man is holding a black phone in his hand. There are people sitting in chairs behind them. 
023.jpg,There are several people standing in a room. There are two large screens in front of them. There is a white wall behind them. 
024.jpg,There are several people standing in a room. There is a woman in a white shirt standing in front of them. There are other people standing behind them. 
025.jpg,There are several people standing in a room. There is a woman in a white shirt standing in front of a man in a brown shirt. There are large windows on the wall behind them.
026.jpg,People are standing and sitting in an airport terminal. They are all wearing face masks. There is a man in a brown jacket standing in front of a cart. 
027.jpg,Two men in uniform are standing in front of a crowd of people. They are wearing black hats and ties. There is a yellow building behind them. 
028.jpg,A man in a white shirt is standing in front of a counter. There are presents on the counter behind the man. There is a large white pillar behind him. 
029.jpg,A man in a white collared shirt is standing in front of a display of presents. There is a large white pillar behind the man. There are people standing in a line behind him. 
030.jpg,There are several cars parked in front of a building. There are blue and white signs hanging from the ceiling of the building. People are standing on the sidewalk next to the cars. 
031.jpg,There are several people standing in a line. There is a woman in a white shirt wearing a black backpack. There are people behind her wearing face masks. 
032.jpg,There are several people standing in a crowd. They are all wearing white face masks. There is a man in a white shirt wearing a white hat. 
033.jpg,A man is standing in front of a cityscape. He is wearing a white collared shirt and a red tie. The man is holding a tablet in his hands. The sky is orange and red. There are tall buildings and skyscrapers in the background.
034.jpg,A man is standing in front of a city skyline. He is wearing a white shirt and a red tie. The man is holding a tablet in his hands. The sky is orange and red. There are tall buildings in the skyline. 
035.jpg,A man is standing in front of a cityscape. He is wearing a white collared shirt and a red tie. The man has short black hair. The sky behind the man is orange and red. There are tall buildings in the background.
036.jpg,There are people standing on a sidewalk. There is a silver fence next to the sidewalk. A woman in a white shirt is sweeping the ground with a broom. There are cars parked on the street behind them. 
037.jpg,A broom is laying on the ground. There are leaves all around the broom. There is a white plastic bag on top of the leaves. 
038.jpg,A woman is wearing a white collared shirt. She is holding a microphone in her hand. There are people walking behind her on the sidewalk. There is a red car on the street. 
039.jpg,There are several motorcycles driving on the street. There is a black car behind them. There are trees lining the street next to the cars. 
040.jpg,A man is wearing a blue and white checkered shirt. He is wearing glasses and is holding a microphone. There is a large green plant behind the man. 
041.jpg,A man is wearing a blue and white checkered shirt. He is wearing glasses and is holding a microphone. There is a large green plant behind the man. 
042.jpg,There are red flags with a yellow star on them hanging from a string. There is a white building behind the flags. 
043.jpg,There are several people standing in front of a white building. There are blue signs on the front of the building. Some of the people are wearing green uniforms and hats. There is a woman in a white shirt standing next to them. 
044.jpg,There are tall trees on the side of the street. There is a white building next to the trees. There are clouds in the sky. 
045.jpg,There is a large body of water. There are trees on both sides of the water. The sky above the water is white. There is a bridge over the water in front of the trees. 
046.jpg,There is a large body of water. There are trees on both sides of the water. In the distance there are tall buildings. There is a bridge over the water in the distance. 
047.jpg,A picture of some cranes. The sky above the cranes is filled with clouds. There is writing on the bottom of the picture. 
048.jpg,There are several large cranes in a field. There are trees behind the cranes. There is a large arch in the middle of the field. 
049.jpg,This is an aerial view of a farm. The farm is surrounded by green grass and trees. There are several large white tanks on the ground. There is a large white building with a blue roof. 
050.jpg,A man and a woman are standing in front of a large screen. They are both dressed in business attire. The woman is wearing a red dress and the man is dressed in a white shirt and black pants. The screen behind them shows a city with tall buildings and a red sky with clouds. There is a large white chair that is set up on a red carpet.
051.jpg,A woman in a red dress is standing in front of a large screen. There is a large picture on the wall behind her. There are lights on the ceiling above the woman. 
052.jpg,A woman in a red dress is standing in front of a large screen. There is a large picture on the wall behind her. The woman is holding a red book in her hands. 
053.jpg,A group of women are standing on a stage holding red umbrellas. They are wearing red dresses and holding white fans in their hands. There is a man in a brown suit standing behind them. There are pink lights behind them on the stage. A woman in a white dress is standing in front of them.
054.jpg,There are people standing around tables. There is a white building behind them with windows on the front of it. There are red tablecloths on the tables. 
055.jpg,There are several people standing around a table. There is a man in a white shirt holding a small child. There are several glasses on the table in front of them. 
056.jpg,There are several people standing in front of a screen. They are wearing orange shirts. There are two women wearing blue shirts. 
057.jpg,There are several women standing in front of a screen. They are wearing orange shirts. One of the women is wearing a face mask on her face. There is a large screen behind them.
058.jpg,There are seven people standing in front of a large screen. They are all wearing orange shirts and holding red bags. There is a man in a black shirt standing behind them. There are words written on the top of the screen. 
059.jpg,A woman is wearing an orange shirt. There are red flags hanging behind her. There is a blue stuffed animal next to her. 
060.jpg,A woman is standing in front of a red wall. She is wearing an orange shirt and has a black strap over her shoulder. There is a blue stuffed animal next to the woman. 
061.jpg,A woman in an orange shirt is standing in front of a microphone. She is wearing a black strap around her neck. There is a boy in a white and orange shirt standing next to her. There are blue stuffed animals behind them. 
062.jpg,A woman is sitting in front of a microphone. She is wearing a white shirt and a green tie. There are yellow flowers on the wall behind her. There is a brown blinds behind the woman. 
063.jpg,A woman is wearing a white shirt and a green tie. There is a black microphone in front of her. There are yellow flowers on the wall behind the woman.
064.jpg,There are several people standing in front of a screen. There is a man in a blue shirt handing a folder to a woman in a red shirt. There are words written on the screen behind them.
065.jpg,There are seven people standing in front of a screen. They are all wearing blue shirts and holding red bags. There is a large screen behind them with writing on it. 
066.jpg,There are several people standing on a stage. They are holding red bags in their hands. There is a large screen behind them with writing on it. There are lights on the stage in front of them.
067.jpg,There are several people standing in front of a screen. There is a man in a blue shirt handing something to a woman. There are two other men standing behind them. 
068.jpg,There are four people standing in front of a screen. There is a man in a blue shirt handing something to a woman. There are two other men standing next to them. 
069.jpg,There are several people standing around a woman in a blue shirt. There is a man in a black shirt wearing a white face mask. There are two women in front of them holding a blue bag. 
070.jpg,There are several people standing in front of a screen. They are all wearing face masks. There is a man in a black shirt standing next to them.
071.jpg,There are several people standing in front of a screen. They are all wearing white shirts. There is a woman in a blue shirt handing a red bag to another woman. 
072.jpg,A man is standing in front of a cityscape. He is wearing a white collared shirt and a red tie. The man is holding a small tablet in his hands. The cityscape behind the man is filled with tall buildings and skyscrapers. The sky above the city is orange and red. There is writing on the bottom of the screen that is in a foreign language.
073.jpg,A man is standing in front of a cityscape. He is wearing a white collared shirt and a red tie. The man is holding a small tablet in his hands. The sky behind the man is orange and red. There are tall buildings all around the man.
074.jpg,There are several people standing around tables with flowers on top of them. There are two women in blue shirts standing in front of the tables. There is a red wall behind them with flowers hanging on it. 
075.jpg,A woman is holding a bouquet of sunflowers. She is wearing a black hat and a black shirt. There is a man in a green shirt standing next to her. 
076.jpg,A woman in a red shirt is holding a bunch of yellow sunflowers. There is a black bracelet on her wrist. 
077.jpg,Three white bowls are sitting on a table. There is a pink flower on the table in front of the bowls. There are nuts in the bowls in the middle of the table.
078.jpg,There are three white bowls on a table. There is a pink flower on the table next to the bowls. There are nuts in the bowls next to them. 
079.jpg,There are two women standing in front of a table. There is a large white vase on the table with flowers in it. The woman in front is wearing a red shirt and a scarf around her neck. 
080.jpg,A person is wearing a red jacket and a black and white checkered shirt. They are holding a bouquet of flowers. There are pink and yellow flowers in the bouquet. 
081.jpg,A bouquet of flowers is being shown. The flowers are pink and have green leaves. There is a person standing behind the flowers wearing black pants and a white shirt.
082.jpg,A woman is wearing a black and white checkered scarf. There is a large red sign behind the woman. There are flowers on the ground in front of the sign.
083.jpg,There are several people standing in front of a red wall. There is a person wearing a black shirt and a pink hat on their head. There are red circles on the wall behind them. 
084.jpg,There are several people standing around a large white vase with yellow sunflowers in it. There are red flags hanging from the vase. There is trees behind the people. 
085.jpg,A woman is wearing a colorful hat. She has a red shirt on with white buttons. There are yellow flowers on the shirt. There is another woman behind her wearing a white shirt. 
086.jpg,There is a wicker basket on the table. There are different types of food in the basket. There is a yellow rose in the middle of the baskets. 
087.jpg,There is a white table with a basket on top of it. There are yellow flowers in the basket. There is a plant next to the basket on the table. 
088.jpg,There are several people standing around a table. There are flowers on the table in front of them. There is a red box on top of the table. 
089.jpg,There are flowers on top of noodles. The flowers are pink and white. There is a green flower on the top of the noodles. 
090.jpg,There is a tray on the table. There are noodles on the tray. The noodles are green and pink. There is a sign next to the tray that is pink and white. 
091.jpg,There are several people standing around a woman. The woman is wearing glasses and is holding a white hat. There are leaves on the hat. 
092.jpg,A woman in a red dress is standing in front of a red background. She is holding a red book in her hands. There is a screen next to the woman with a picture on it. 
093.jpg,A woman in a red dress is standing in front of a screen. There is a picture on the screen next to the woman. The woman is holding a red book in her hand. 
094.jpg,A woman in a red dress is standing in front of a red wall. She is holding a red purse in her hands. There is a screen next to the woman with a picture on it. 
095.jpg,There are nine girls on a stage performing a dance. They are wearing black jackets and gray pants. There is a white sign behind them that says Flashmob. There are lights on the stage under them. 
096.jpg,There are several children standing on a stage. They are wearing black shirts and gray pants. There is a large blue wall behind them. There are people standing in front of the wall.
097.jpg,There are several people wearing blue and white uniforms. They are dancing on a stage. There is a large white sign behind them. 
098.jpg,There are several people standing on a stage. They are wearing blue and white uniforms. There are lights on the stage under them. There is a blue wall behind them. 
099.jpg,A man is standing in front of a large purple sign. He is wearing a black suit and a white shirt with a blue tie. The man has short black hair. 
100.jpg,A group of people are performing on a stage. They are wearing green shirts and black pants. There are lights on the wall behind them. 
101.jpg,There are people standing on a dance floor. They are wearing green shirts and black pants. There are lights on the floor that are reflecting off of the floor. There is a white wall behind them.
102.jpg,There are several people standing on a stage. There are blue banners hanging from the wall behind them. There is a blue mat on the floor in front of them.
103.jpg,There are several people standing in front of a crowd. There is a man in a suit and tie standing next to them. There are signs behind them on the wall.
104.jpg,There are several people standing in front of signs. There is a man in a blue shirt holding a blue sign. Next to him is a woman in a white shirt and glasses. 
105.jpg,There are several people standing in a room. There are blue signs hanging from the wall behind them. There is a man in a blue shirt holding up a large blue sign. 
106.jpg,There are several people standing on a stage. There are large blue signs behind them. They are waving their hands in the air. There is a man in a blue jacket standing in front of them.
107.jpg,There are several people standing in front of a blue sign. They are wearing red shirts and white pants. There is a man in a black shirt standing behind them.
108.jpg,There are several people wearing yellow shirts. They are holding up a trophy. There is a blue sign in front of them. 
109.jpg,There are people standing in front of a purple wall. There is a large sign on the wall with white writing on it. There are people wearing black vests. 
110.jpg,On the left side of the image there is a bright red line. The background is completely black. On the right side there is an image of a red and blue screen. The screen has small white dots on it.
111.jpg,There is a white table in a room. There are folded white cloths on top of the table. There is a black pair of socks on the table in front of the cloths. 
112.jpg,The image is a screenshot of a news channel. The channel is HTV7 HD. The time is 18:37:02. There is an image of a man in the center of the screen. The man is wearing a white head covering. The head covering has swirls on it. The text on the screen is in a foreign language.
113.jpg,A crowd of people are standing in front of a body of water. There are several boats in the water behind the people. Some of the people are holding up their phones. There is a large black speaker in the crowd. 
114.jpg,There are several people standing in front of a building. There are stairs leading up to the building. Some of the people are holding flags in their hands. There is a white van on the street. 
115.jpg,A man is standing in front of a cityscape. He is wearing a white collared shirt and a red tie. The man is holding a red tablet in his hands. The cityscape behind the man is lit up with colorful lights. There is a large body of water in the center of the city. The sky above the city is orange and red.
116.jpg,A man is standing in front of a cityscape. He is wearing a white collared shirt and a red tie. The man is holding a tablet in his hands. The sky is orange and red. There are tall buildings in the background.
117.jpg,A man is standing in front of a city skyline. He is wearing a white shirt and a red tie. The man is holding a tablet in his hands. The sky behind the man is orange and red. There are tall buildings all around the man.
118.jpg,A robot is laying on its side on a pink surface. It is gray and pink in color. There is a green light coming from the top of it. A person is standing behind the robot. They are wearing pink pants.
119.jpg,A white cell phone is being held by a person's hand. The screen of the phone is black and there is an image of a robot on the screen. There is a blue button on the phone that says go.
120.jpg,A man in a gray suit jacket is sitting in a chair. There is a pink carpet on the floor in front of him. There are several people standing in a room behind him. 
121.jpg,A man in a blue shirt is standing in front of a laptop. There is another man behind him wearing a green shirt. There are large screens on the wall behind them.
122.jpg,The image is a screenshot from a video game. It shows a character standing on a black and white checkered floor. The character is wearing a pink shirt and white pants. There is a gray box on the floor in front of the character. The game's logo is in the top right corner of the image.
123.jpg,A computer screen is displayed on a monitor. There is a white screen on the wall behind the screen. There are words written on the screen in black letters. The words on the bottom of the screen are red and white. 
124.jpg,"A computer screen is showing a story about Malala Yousafzai. The story starts with the words ""This is where I live with my father, mother, and two brothers. When the taliban came, they expressed my people and wageed war on the military. I need to tell the world what is going on. The BBC will share my story with the world. I had four of my diary entries around the city so that the Taliban couldn't find them. Return to Hub."
125.jpg,A video game is being shown. There is a person standing in a room. They are wearing an orange outfit. There are bars in front of the person. 
126.jpg,A man is standing in front of a television. He is wearing a blue button down shirt and black glasses. There is a large screen on the wall behind the man. 
127.jpg,A man is giving a presentation to a group of people. He is standing at a podium with a microphone in front of him. There is a large screen on the wall behind him. People are sitting in chairs facing him. 
128.jpg,A man is wearing a blue shirt and black glasses. There is a large screen behind the man. There are other people standing in front of the screen. 
129.jpg,A woman in a white shirt is standing in front of a large screen. There is a large blue wall behind the woman. The woman is holding a white tablet in her hand. 
130.jpg,A person is holding a tablet. There is a cartoon on the screen of the tablet. The person is wearing a blue shirt and has black hair. 
131.jpg,There are several people standing in a room. There are large screens hanging from the ceiling. There is a man sitting on a chair in front of a white table.
132.jpg,A man is standing in front of a cityscape. He is wearing a white collared shirt and a red tie. The man has short black hair. The sky behind the man is orange and red. There are tall buildings and skyscrapers in the background.
133.jpg,A man is standing in front of a city skyline. He is wearing a white shirt and a red tie. The man is holding a tablet in his hands. There is a red sky behind the man. 
134.jpg,There are white sheets on top of a white table. There are two white bags on the table next to them. There is a white wall behind the table. 
135.jpg,Two women are standing in a room. One of the women is wearing a white hat and a white scarf around her face. The other woman has a blue vest on and a red necklace around her neck. There is a large window on the wall behind them.
136.jpg,A woman is wearing a white headscarf. There is another woman behind her wearing a red outfit. There are red curtains behind them. 
137.jpg,A woman is wearing a white chef's hat. She is holding her hands up to her head. There is a white wall behind the woman. 
138.jpg,There is a black and pink wall hanging on the wall. There is a white cloth wrapped around the top of the wall hanging. There are two pieces of cloth on top of a red table. 
139.jpg,A woman is wearing a white headscarf. There is a man behind her wearing a red jacket. There are red curtains behind them. 
140.jpg,There are several black and white photos on a table. There is a person's hand in front of the photos. They are wearing a bracelet on their wrist. 
141.jpg,There are several people standing in front of a building. There is a hill behind them with people riding on horses. There are people wearing hats on their heads. 
142.jpg,A black and white picture of a man. The man is wearing a turban on his head. There is a white cloth wrapped around the man's head. 
