frame,caption
132.jpg,A woman in a red dress is standing in front of a red background. She is holding a gold wallet in her hands. There is a picture on the screen next to the woman. 
133.jpg,A woman is standing in front of a red background. She is wearing a short red dress with a large bow on the neck. She has long dark hair and is holding a small brown object in her hands. There is a picture on the right of the woman. The picture is of a construction site. There are buildings under construction in the background.
134.jpg,There is a woman in a red dress standing in front of a red wall. There is a picture on the wall behind the woman. The woman has dark hair and is holding a red object in her hands. 
135.jpg,There is a wooden stick on the ground. The wood is light brown in color. There is a person standing in front of the stick. The person is wearing a blue shirt.
136.jpg,A group of men are standing on a wooden structure. They are wearing white hard hats and white jackets. There are wooden beams in front of them. There is a red ladder next to them. 
137.jpg,There is a large building under construction. There is a tall metal tower next to the building. There are people standing on the top of the tower. 
138.jpg,There are several large cranes in the background. There is a large building under construction in front of the cranes. There are people standing on top of the building. 
139.jpg,A picture of a building being built in Nepal. There is a red crane on the left side of the building. There are people standing on the building under the crane. The sky above the building is gray and cloudy. 
140.jpg,A picture of a building under construction. There are people standing around the building. There is a large structure made out of wooden planks. The people are wearing white protective suits and helmets. 
141.jpg,A picture of a wooden structure being built. There are several people standing inside of the structure. They are wearing white hard hats on their head. There is metal scaffolding behind them. 
142.jpg,A group of people are standing on a building under construction. They are all wearing white hard hats. There are metal scaffolding around the building. The sky is gray and cloudy.
143.jpg,A picture of a building under construction. There are two cranes on the right side of the picture. The cranes are red and white. There is a large structure that is under construction on the left side. The sky above the picture is gray. The picture has writing on the bottom of it.
144.jpg,A man is standing in front of a city skyline. He is wearing a blue shirt and a red tie. The man is holding a red tablet in his hands. The sky behind the man is orange and red. There are tall buildings all around the man.
145.jpg,A man is standing in front of a city skyline. He is wearing a blue striped shirt and a red tie. The man is holding a red tablet in his hands. The sky behind the man is orange and yellow. There are tall buildings all around the man.
146.jpg,There is a red table with a doll on top of it. The doll is wearing a red dress with a yellow cape over it. There is a white skeleton next to the doll. 
147.jpg,A gold crown sits on top of a red cloth. There is a white pole next to the crown. 
148.jpg,There is a white mask on a yellow cloth. There is a red shirt under the mask. There are silver rings on the shirt. 
149.jpg,Two men are standing in a room. They are wearing white lab coats. One of the men is holding a microphone in his hand. There is a table in front of them with skulls and other objects on top of it. A red and white sign is hanging on the wall behind the men. Part of a picture frame can be seen hanging on a wall.
150.jpg,There are two men standing in a room. They are wearing white lab coats. There is a red and white banner hanging on the wall behind the men. A man is holding a microphone in his hand. 
151.jpg,A picture of a person laying on a black surface. The person is wearing a red dress with gold trim. There are white hands on the dress. There is a skeleton on the ground next to the person. 
152.jpg,Two men are standing in a room. They are wearing white lab coats. There is a large white screen in front of them. A red table is sitting against a wall behind them. There are skulls on top of the table. 
153.jpg,Two men are standing in front of a red table. They are wearing white lab coats and blue gloves. One of the men is holding a microphone in his hand. There is a red and white sign behind them. 
154.jpg,"A man in a white lab coat is standing in front of a projector screen. He is holding a microphone and appears to be giving a presentation. Another man is standing next to him, also wearing a lab coat. There is a red table in the middle of the room."
155.jpg,A man is wearing a white coat. He is holding two pieces of food in his hands. There is a black lanyard around his neck. 
156.jpg,A woman is wearing a red dress. She is holding a red wallet. There is a large screen behind the woman. The screen has a red logo on it. 
157.jpg,A woman in a red dress is standing in front of a red background. She is holding a tablet in her hands. There is a large screen next to the woman. 
158.jpg,There is a large crowd of people standing in front of a large screen. There is a picture of a woman on the screen. The woman has long black hair. 
159.jpg,There are several people standing in front of a crowd. There is a white building behind them. There are lights on the ground around them.
160.jpg,There are several people standing in front of a crowd. They are dressed in black and white. There is a barcode on the bottom left of the image. 
161.jpg,There is a lot of white fireworks in the sky. There are white dots on the top of the fireworks. The sky is black. There is a red light under the white fireworks. There's a barcode on the bottom left corner of the screen. There appears to be a lot more people watching the fireworks as well.
162.jpg,A woman with white hair is wearing white sunglasses. There are people standing behind her. There is a red sign in front of the woman. 
163.jpg,A man is standing in front of a crowd of people. The man is wearing a white shirt. There are street lights behind the man. 
164.jpg,This is a video of a man named David Jeria. He has short black hair and is wearing a white shirt. He is standing in front of a large crowd of people. There are colorful balloons in the background. There is a red banner at the bottom of the screen with white writing on it.
165.jpg,There is a man in a blue shirt. There are people behind him standing in front of him. There is a red sign on the bottom of the screen.
166.jpg,There are several people standing in a street. There are large columns in front of them. They are all wearing black and white hats on their heads. There is a building behind them. 
167.jpg,A woman is standing in front of a screen. She is wearing a red dress and holding a red book in her hands. The screen is white and has a red logo on it. There is a red background behind the woman.
168.jpg,There is a woman in a red dress standing in front of a red background. She is holding a tablet in her hands. There is a picture on the screen next to the woman. 
169.jpg,A woman is wearing a red dress. She is holding a red book in her hands. There is a picture next to the woman on the screen. 
170.jpg,There is a woman in a red dress standing in front of a large screen. There is a red and white sign on the screen behind the woman. The woman has dark hair and is holding a red purse. 
171.jpg,A fish is shown on a TV screen. The fish is orange and white. There are small yellow balls in front of the fish. The background of the screen is black. There is a red and white logo on the screen.
172.jpg,A small goldfish is sitting on a black table. There is a white ruler next to the goldfish. The goldfish has its head turned to the side. 
173.jpg,A man with gray hair and a beard is wearing a blue suit. He has a blue and white collared shirt on. There is a large body of water behind him.
174.jpg,A fish is shown on a TV screen. The fish is gray and has orange feet. There is a light behind the fish on the screen. 
175.jpg,A picture of a chicken is shown on a TV screen. The chicken is brown and has a red comb on it's head. There is a black background behind the chicken. 
176.jpg,A fish is swimming in the water. The fish is light brown and has a small orange flower in front of it. There is water bubbles above the fish. 
177.jpg,A woman with long blonde hair is standing in front of a tree. She is wearing a light pink shirt. There is a person in a blue shirt behind her. 
178.jpg,A woman with long blonde hair is sitting down. She is wearing a light pink shirt. There is a tree behind her. The woman is smiling and looking at the camera. 
179.jpg,There is a white object that appears to be splashing water. There are many small white lights around it. The background is black. There is a red and white logo on the top right corner of the image. There appears to a hand in front of the camera that is not visible.
180.jpg,A fish is shown in an advertisement. It is a close up of the face of the fish. The fish is light brown with some darker brown spots on it. It has a large blue eye. It also has two small orange fins on its head.
181.jpg,A brush is being shown in an advertisement. The brush is orange and white in color. The bristles of the brush are very long. There is a black background behind the brush.
182.jpg,A fish is shown on a TV screen. The fish is orange and white in color. There is a black background behind the fish. 
183.jpg,There are two small birds sitting on a black table. The birds are brown and have red feet. There is a black wall behind them. 
184.jpg,The image is red and white. There are dots on the red background. The dots are small and white in color. There is a big red circle in the middle of the image. The red color is very bright. The white background is very plain. The lines on the image are very thin and dark red.
185.jpg,"A logo is displayed on a white background. The logo is red and white. There are red dots surrounding the logo. There is a large red circle in the center of the logo with the word ""giay"" written inside of it. Below the red circle is the words ""TIEP THEO""."
186.jpg,A group of men are standing outside near a large yellow vehicle. They are wearing black and yellow jackets and green pants. There is a ladder leaning against the side of the vehicle. There are several blue and red containers stacked on top of each other. The sky is white and cloudy.
187.jpg,There is a white van on the street. There are people walking around the van. There is a man in a red shirt and green pants. 
188.jpg,Two men are walking towards a red car. One of the men is wearing a suit. There is a large building behind them. 
189.jpg,There are two men sitting at a table. There is a black laptop on the table in front of them. The man on the left is wearing a black jacket. 
190.jpg,A woman in a red dress is standing in front of a large screen. The screen has a red and white logo on it. The woman has dark hair and is holding a brown purse. 
191.jpg,A woman is standing in front of a red background. She is wearing a red dress and holding a red wallet in her hands. The woman has dark hair and is looking at the camera. There is a large screen to the right of the woman.
192.jpg,There is a woman wearing a red dress. She is holding a red purse. There is a red and orange background behind the woman. The woman has long black hair. 
193.jpg,There is a woman wearing a red dress. She is holding a red box in her hands. There is a picture next to the woman on the screen. 
194.jpg,There are several people sitting around a table. There are laptops on top of the table. A man is pointing at the people on the table with his finger. 
195.jpg,There is a white sign hanging on the wall. The sign has black letters on it. There is a watermark in the top right corner of the image.
196.jpg,There are several people standing in a room. There is a white table in front of them with a laptop on top of it. There are people sitting in chairs around the table. 
197.jpg,A white sign is hanging on a wall. The sign has black letters on it. There is a red logo on the top right corner of the sign.
198.jpg,There is a white bag with the brand Adidas on it. There is a keychain hanging from the bag. There are red boxes next to the bag on the table. 
199.jpg,There are people sitting around a large table. There are two men standing in front of the table. They are wearing face masks on their faces. The table has papers on top of it. 
200.jpg,A man is sitting at a desk in front of a computer. He is wearing a floral shirt and black glasses. The man is writing on a piece of paper. There is a water bottle on the desk next to the computer. 
201.jpg,A hand is holding a blue pen and writing on a white piece of paper. The paper is sitting on top of a wooden table. There is writing on the paper in black ink.
202.jpg,There are two people sitting at a desk. There is a laptop on the desk in front of them. There are papers and cups on top of the desk. 
203.jpg,A computer screen is turned on. There is a blue background on the computer screen. There are several icons on the screen. 
204.jpg,There is a large black table in front of a wall. There are small white tags on the table. There is a white piece of paper on top of the table next to the tags.
205.jpg,There are several people standing in a room. There are several motorcycles on the ground in front of them. There is a white wall behind them. 
206.jpg,There are several people standing in a room. There is a man in a black jacket with a yellow tag on his back. He is wearing a black hat. 
207.jpg,A white van is parked on the street. There is a large tree next to the van. The window on the van is closed. 
208.jpg,A man is standing in front of a news desk. He is wearing a blue shirt and a red tie. There are tall buildings behind him. There is a red sky behind the man.
209.jpg,A man is standing in front of a news desk. He is wearing a blue collared shirt and a red tie. The man is holding a red phone in his hands. There is a large cityscape behind the man. The sky above the city is orange and red. There are tall skyscrapers in the city. 
210.jpg,There are several people standing around a yellow truck. There are several blue shipping containers behind the truck. They are all wearing black jackets and green pants. 
211.jpg,This is an image of a shipping yard. The yard is filled with shipping containers. The containers are blue and brown in color. There is a yellow crane in the middle of the yard. There are people standing around the crane. The sky above the containers is gray and cloudy.
212.jpg,A man is wearing an orange safety vest. He is standing next to a large red wall. There is a large black tire hanging on the wall next to the man. 
213.jpg,A group of men are wearing black and yellow jackets and pants. They are standing in front of a yellow truck. There are large blue shipping containers behind the truck. The men are holding white ropes. 
214.jpg,There are several men standing on a boat. They are wearing orange vests and hard hats. There is a man in a white shirt standing on the deck of the boat. 
215.jpg,There are several men in blue uniforms standing around a blue stretcher. There is a yellow truck behind them. There are cars parked in front of the trucks. 
216.jpg,There are several men in blue uniforms standing around a blue stretcher. There is a yellow truck behind them. There are cars parked in front of the truck. 
217.jpg,There is a large yellow wall in front of a blue shipping container. There is a black tire on the ground next to the wall. 
218.jpg,A white van with a red cross on the side is parked. There are people standing in front of the van. There is a motorcycle next to the van on the ground. 
219.jpg,There is a white van with a red cross on the side of it. There is a man standing in front of the van. He is holding the door open. 
220.jpg,"A red background with lines on it. In the center of the red background there is white text that reads ""AN NINH TRAT TU"". At the top right corner of the image there is a small logo that says ""HTV7 HD 18:46:32"". Below the logo there is the phrase ""Hang trieu nguoi Dai Loan bo phieu bau nguai ke nhiem ba Thai Anh Van van vac thanh vien eu"" in white text."
221.jpg,There are three men standing in water. They are wearing blue and yellow jackets. There is a man in a black suit with a scuba mask on. There are branches in the water next to them.
222.jpg,There is a body of water that has some green plants in it. There is a person in the water wearing a black suit and a white shirt. They have a black helmet on their head.
223.jpg,There are two men standing in water. There are plants in front of them. One of the men is wearing a black jacket. 
224.jpg,There are two men standing in water. There are plants in front of them. One of the men is wearing a black jacket. 
225.jpg,There are several people standing in front of a building. There is a man in a green shirt with a black bag on his shoulder. There are plants next to the building.
226.jpg,There are three men standing next to a tree. One of the men is wearing a black jacket. There is a person wearing a red shirt and a black hat standing in front of them.
227.jpg,There are several people standing in a field. They are wearing hard hats on their heads. There is a man in a green shirt standing in front of them.
228.jpg,A group of men are standing outside at night. They are all wearing helmets on their heads. One of the men is wearing a green shirt and is holding a can in his hand. There are palm trees behind the men. 
229.jpg,A man in a green shirt and an orange hard hat is standing in a pile of grass. There are other people standing around him. There is a red bag on the ground next to him. 
230.jpg,A man is standing in front of a news desk. He is wearing a blue collared shirt and a red tie. The man is holding a red object in his hands. There is a large cityscape behind the man. The sky above the city is orange and red. There are tall skyscrapers in the city. 
231.jpg,A man is standing in front of a news desk. He is wearing a blue collared shirt and a red tie. The man is holding a red object in his hands. There is a large cityscape behind the man. The sky is orange and red. There are tall buildings in the city. 
232.jpg,There are several motorcycles parked on the street. There is a large tree that has fallen down on top of the motorcycles. There are buildings next to the street with red signs on them.
233.jpg,A red car is driving down the street. There are people walking on the sidewalk next to the car. There is a white car parked on the side of the street in front of a building.
234.jpg,This is a street view of a busy street. There is a white car driving down the street. Next to the car is a silver car parked in front of a building. There are several other cars and motorcycles on the other side of the road. 
235.jpg,There is a motorcycle parked on the ground. There is a large tree that has fallen on top of the motorcycle. There are leaves all around the motorcycle and the tree. 
236.jpg,There is a tree that has fallen down in front of a building. There is a red sign on the side of the building. The building has a blue and white sign on it. 
237.jpg,There is a tree that has fallen down in front of a building. There is a yellow sign with a smiley face on it. There are several people standing around the tree.
238.jpg,A bunch of people are outside on a sunny day. They are all riding motorcycles. There is a white car parked on the side of the road. There are a bunch of trees that have fallen down.
239.jpg,There is a large tree that has fallen down. There is a red building next to the tree. There are people standing in front of the building. 
240.jpg,There is a white building behind a tree. There is a person wearing a yellow hard hat standing in front of the tree.
241.jpg,A woman is wearing a red dress. She is holding a red book in her hands. There is a picture next to the woman that has a city on it. 
242.jpg,A woman is standing in front of a red background. She is wearing a short red dress with a collar on it. The woman has long dark hair and is holding a small book in her hands. There is a large picture on the right of the woman. The picture has a city skyline on it and the word giay is written in red.
243.jpg,A man is shown on a TV screen. He is wearing a short sleeve shirt. The man has short black hair. There is a picture hanging on the wall behind the man. 
244.jpg,A man is standing in front of a white wall. He is wearing a green collared shirt. The man has short black hair. 
245.jpg,There are people in a room. They are wearing green uniforms. There are boxes in front of them. There is a man in a white shirt sitting on the floor. 
246.jpg,There are two men in a room. There are boxes in front of the men. One of the boxes has green bottles in it. The other man is wearing a green shirt. 
247.jpg,There are several white bottles on a table. There are green plastic caps on the table in front of them. There is a person wearing a white shirt and gray pants. They are holding a white object in their hands. 
248.jpg,There is a pile of trash on the ground. There are bags of garbage next to a blue bucket. There is a black bag in front of the bags. 
249.jpg,A man in a green uniform is standing in front of a table. He is holding a white paper in his hands. There is a window on the wall behind him. 
250.jpg,Four men are standing in a room. They are wearing green uniforms. One of the men is wearing a red hat. There is a man in a blue jacket standing in front of them. 
251.jpg,There are two men standing next to each other. The man on the left is wearing a green uniform. He has a red patch on his shirt. He is also wearing a badge on his uniform. The other man is wearing an adidas shirt. They are standing in front of a white wall. There is a picture frame hanging on the wall behind them.
252.jpg,Four men are standing in a room. They are wearing green uniforms. One of the men is wearing a red hat. There is a table in front of them with papers on top of it. 
253.jpg,A man is standing in front of a news desk. He is wearing a blue collared shirt and a red tie. The man is holding a red object in his hands. There is a large cityscape behind the man. The sky is orange and red. There are tall buildings in the city. 
254.jpg,A man in a blue shirt and red tie is standing in front of a white table. There are tall buildings behind him. There is a red sky behind the man. 
255.jpg,There are three men standing on the side of the road. There are orange cones on the street next to them. There is a motorcycle parked on the sidewalk next to the street. 
256.jpg,There are three men standing on the street. There is a motorcycle parked on the side of the street in front of them. There are trees and grass on the other side of them in the distance. The sky above them is blue.
257.jpg,There are three men standing on the side of the road. There is a white van driving down the street. There are orange cones on the street in front of the men. There trees on the sides of the street next to the road on both sides. The sky above the street is blue. 
258.jpg,A man in a green shirt is sitting at a brown desk. There is another man sitting in a chair in front of him. There are brown cabinets behind them. 
259.jpg,There is a man sitting at a desk. There are two windows on the wall behind the man. There is a plant in a white pot on the desk in front of him. 
260.jpg,There is a man sitting at a table. He has a tattoo on his arm. He is wearing a black shirt. There is a whiteboard behind him on the wall. There are white cabinets behind him. 
261.jpg,A man in a green shirt is sitting at a brown table. There are two windows on the wall behind the man. There is a plant in a white pot on the table. 
262.jpg,A woman is wearing a red dress. She is holding a red book in her hands. There is a picture next to the woman that has a city on it. 
263.jpg,A woman is wearing a red dress. She is holding a red wallet. There is a picture next to the woman that has a city on it. 
264.jpg,There are cars parked on the street. There is a white building behind the cars. There are lights on the front of the car. 
265.jpg,There are three men standing next to each other. One of the men is wearing a green military uniform. The other two men are wearing jackets. There is a large building behind them.
266.jpg,There are four men standing around a table. There is a man in a green suit standing next to them. There are wooden chairs around the table. 
267.jpg,There are three men sitting at a table. There is a black laptop on the table in front of them. The man on the left is wearing a green jacket. 
268.jpg,There are two men sitting in chairs. There is a laptop in front of them on a table. The man on the left is wearing a black jacket. 
269.jpg,A man is looking down with his eyes closed. He has dark brown hair and long eyelashes. There is a white background behind the man.
270.jpg,A man is standing with his head down. He has short black hair. He is wearing a brown jacket. There is a black shirt on his head. There are words and numbers on the bottom of the image.
271.jpg,A man is sitting on a brown chair. He is wearing a brown jacket with a black collar. The man has short black hair. There is a white wall behind the man. 
272.jpg,Four men are sitting around a wooden table. There is a laptop on the table in front of them. One of the men is wearing a green suit and is typing on the keyboard of the laptop. 
273.jpg,A man is standing in front of a screen. He is wearing a blue shirt and a red tie. The man is holding a red object in his hands. There is a large white screen behind the man. 
