frame,caption
143.jpg,There are two women in a room. One of the women is wearing a red and white outfit. There is a white table in front of them with a plastic container on top of it. 
144.jpg,There are two people standing in a room. There is a white table in front of them with a plastic container on top of it. There are shelves behind them on the wall. 
145.jpg,The image is a screenshot from a video. It shows a person wearing a white shirt. The shirt has a red and blue design on it. The text on the image is in Vietnamese.
146.jpg,Two women are wearing white headscarves. One of the women is holding something in her hands. There is a white board behind them with a red curtain hanging from it. 
147.jpg,A woman is wearing a white head covering. She is holding a white cloth in her hands. There is a white ladder behind the woman. 
148.jpg,Three people are sitting down and they are all wearing white headdresses. The person in the middle is wearing a red and white headdress. They are holding a red cloth in their hands. 
149.jpg,A person wearing a black jacket is standing in front of a shelf. There are several shelves on the wall with hats on them. There is a light on the ceiling above the shelves. 
150.jpg,There is a green and white hat with gold embroidery on it. There is a white shirt under the hat. There are plastic bags behind the hat with red designs on them. 
151.jpg,A black and white picture of a woman. The woman is wearing a white scarf on her head. There is white writing on the side of the picture. 
152.jpg,A woman is looking at a black book on a white table. The book is black and has a picture of a woman on the cover. The woman is wearing a pink shirt and has silver bracelets on her wrist. There is a black bag on the table next to the book. 
153.jpg,A woman is standing in front of a screen. She is wearing a short red dress. She has long brown hair and is smiling at the camera. There is a large white screen behind her. 
154.jpg,There is a woman in a red dress standing in front of a red background. She is holding a book in her hands. There is a picture next to the woman in the red dress. 
155.jpg,A woman in a red dress is standing in front of a red background. She is holding a book in her hands. There is a picture next to her that is of a group of people in red jackets. 
156.jpg,There is a woman in a red dress. There is a picture next to the woman in red. There are clouds in the sky above the woman. 
157.jpg,There are several people walking on a street. They are wearing hard hats and holding long white poles. There are blue tents on the side of the street. There is a building behind them. 
158.jpg,There are several men in red jackets and black pants marching down a street. They are wearing hard hats on their heads. There is a large hill behind them. There are clouds in the sky above them.
159.jpg,There are several people wearing red jackets and hard hats. They are walking down a street. There is a large hill behind them. There are clouds in the sky.
160.jpg,There are people walking down the street. They are wearing dresses and white hats. There are blue umbrellas behind them. 
161.jpg,There are people walking on the street. They are wearing hats on their heads. There are clouds in the sky above them. There is a barcode on the bottom left of the image. 
162.jpg,A person is standing in front of a bright light. They are wearing a black jacket and a white helmet. There are white clouds in the sky. 
163.jpg,There are several people walking down a street. They are wearing colorful hats and long skirts. There is a hill behind them with clouds in the sky above them.
164.jpg,There are several people standing in a line. They are wearing white shirts and red skirts. They have hats on their head. There is a large mountain behind them. 
165.jpg,There are people walking on the street. There are tents on the side of the street next to the people. There is a man in a red robe walking in front of them. 
166.jpg,There are several people standing on a street. There is a large blue and red tent behind them. There are white clouds in the sky above them.
167.jpg,There are people standing under a colorful umbrella. There is a man wearing a blue backpack and a yellow hat. There are clouds in the sky above them.
168.jpg,There is a woman in a red dress standing in front of a red wall. There is a photo next to the woman in the red dress. There are people standing behind them in a crowd. 
169.jpg,There is a woman in a red dress standing in front of a red wall. She is holding a red book in her hands. There is a picture next to the woman in the red dress. 
170.jpg,A woman in a red dress is standing in front of a red background. She is holding a red folder in her hands. There is a large crowd of people behind her on the street. There are several umbrellas hanging from the trees. 
171.jpg,There is a woman wearing a red dress. She is holding a small book in her hands. There is a picture next to the woman with the dress on. 
172.jpg,There are several people standing in a crowd. There is a woman in a pink wig and a man in a black shirt. There are buildings behind them.
173.jpg,A drum is on the ground. There are colorful letters on the drum. There is a person wearing red and white striped socks. 
174.jpg,There is a silver drum with colorful writing on it. There are sticks sticking out of the drum. There is a person wearing red and white striped socks. 
175.jpg,A man is wearing a green hoodie and a green mask. He is standing in front of a crowd of people. There is a white bus behind him. 
176.jpg,A man is wearing a red costume. There are people behind him walking around. There is a white tent behind them. 
177.jpg,There are two men kissing each other. One of the men is wearing a red cape. There are drums in front of them. There is a man in a blue shirt standing next to them.
178.jpg,A man in a superman shirt is playing drums. There is another man next to him wearing a red shirt and a yellow cape. They are standing in front of a wall. 
179.jpg,A man with long blonde hair is standing in front of a crowd. There is a large white building behind the crowd. The man is wearing a red cape over his shirt. 
180.jpg,There are several people standing in front of drums. There is a man in a red cape standing next to them. There are other people standing behind them. 
181.jpg,There are several people standing in a crowd. There are trees behind them. There is a man in a black jacket standing next to a woman in a red outfit. 
182.jpg,A man is standing in front of a news desk. He is wearing a long sleeve shirt and a tie. The man is holding a book in his hands. There is a large cityscape behind the man. The sky above the city is orange and pink. 
183.jpg,A man is standing in front of a news desk. He is wearing a long sleeve shirt and a tie. The man is holding a red object in his hands. There is a large cityscape behind the man. There are tall buildings and skyscrapers in the city. The sky above the city is orange and pink. 
184.jpg,A man is standing in front of a television screen. He is wearing a long sleeve shirt and a tie. The man is holding a red object in his hands. There is a large cityscape behind the man. The sky above the city is orange and pink. There are tall buildings in the city. 
185.jpg,There are people standing on a sidewalk. There are two people wearing white masks on their faces. There is a woman in a red jacket standing in front of them.
186.jpg,There are two people wearing white masks. They are standing in front of a white building. There is a large yellow hat on their head. 
187.jpg,Many people are walking up the stairs. Most of the people are wearing hats and coats. Some people are carrying backpacks. There is a white building behind the people. 
188.jpg,There are several people standing in a line wearing colorful costumes. They have masks on their faces and headdresses. There is a man in a black jacket standing next to them. 
189.jpg,There are several people standing in front of a white building. There are crosses on the front of the building. The people are walking in a line. 
190.jpg,There are several people standing on a street. There is a man in a pink shirt and a pink hat on his head. There are several other people standing around him.
191.jpg,A man is wearing a fancy costume. He has a mask on his face. He is also wearing a hat on his head. There is a crowd of people behind him. 
192.jpg,A man is wearing a white suit and a white hat. There is a large white building behind the man. There are people standing in front of the building.
193.jpg,There are several people standing in a line. There are large white pillars behind them. There is a woman in a black jacket and sunglasses standing in front of them.
194.jpg,There are several people walking on a sidewalk. There is a man in a red jacket holding a book in his hand. He is wearing a white hat and a red necklace around his neck. 
195.jpg,There are several people standing on a street. There is a tall black light pole next to them. There are two people wearing masks on their faces. One of them is taking a picture with a cell phone. 
196.jpg,There are people standing on a street. They are wearing masks on their faces. There is a woman in a white dress with a hood on her head. 
197.jpg,A large crowd of people are standing outside of a large white building. The building has many columns on the front of it. There is a man in a gray jacket walking towards the crowd. 
198.jpg,There is a small boat in the water. There are people sitting in the boat. There is a wooden pole in front of the boat with a rope attached to it. 
199.jpg,A woman is wearing a red dress. She is holding a red object in her hands. There is a large screen behind the woman. The screen has a red and white logo on it. 
200.jpg,A woman in a red dress is standing in front of a red background. She is holding a brown purse in her hands. There is a picture next to the woman that is in a white frame. There are colorful flags hanging from the frame. 
201.jpg,A woman in a red dress is standing in front of a red background. She is holding a book in her hands. There is a picture next to the woman in the red dress. 
202.jpg,There is a large picture of a woman on the left. There is a picture of people on the right. There are flags on the top of the picture. There clouds in the sky above the picture of the woman. 
203.jpg,There is a large structure with many flags on top of it. There is smoke coming out of the sides of the structure. There are trees in front of the building. 
204.jpg,A man is wearing a black pirate hat with a red flower on it. He has a white shirt and a black jacket over it. There are people standing around him. There is a large body of water behind him. 
205.jpg,There are colorful flags hanging from the ropes of a ship. There is a tall palm tree next to the ship. The sky is blue with white clouds in it.
206.jpg,There are several people standing in a crowd. There are several boats in the water behind them. There is a large black speaker in front of the crowd. 
207.jpg,There is a crowd of people standing in front of a large white boat. There is a large black speaker in the front of the crowd. There are several boats in the water behind the people. 
208.jpg,There are people standing on a bridge. There are tall buildings behind them. There is a blue sky above the buildings. 
209.jpg,There is a man wearing a black pirate hat. He has a white shirt on with a black jacket over it. There are people standing behind him in front of buildings. 
210.jpg,There are people standing in front of a podium. There are flags behind them. There is a large building behind the people. 
211.jpg,A large crowd of people are standing on a pier. There are several large white boats in the water. There is a large building behind the crowd. 
212.jpg,A woman is wearing a brown hat with a red band around it. She has long black hair and a red dress. There are people standing behind her. There is a tall building behind them. 
213.jpg,There is a woman wearing a brown hat. She has long black hair. There is a large white building behind her. There are other people standing around her. 
214.jpg,There are people standing behind a white fence. There is a red and white pole behind the fence. The sky is blue and there are no clouds in the sky.
215.jpg,There are several boats in the water. There are people standing in front of the water watching the boats. There is a large white building in the distance. 
216.jpg,There are several boats in the water. There are people standing in front of the water watching the boats. There is a large white building in the distance. 
217.jpg,There is a white fence in front of a building. There are people standing behind the fence. There is a man wearing a red shirt and a brown hat.
218.jpg,There are many flags flying in the air. There are many people standing in front of the flags. There is a large white boat in the water. 
219.jpg,On the left side of the image there is a solid black background. On the right side there is an image of a red and black screen. The screen has small white dots on it. The sky is blue with white clouds.
220.jpg,"The image is a logo for a television channel. The logo is red and white. The background is white and there are red dots on the left and right side of the image. The red dots are arranged in a diagonal pattern. The letters of the logo are red and there is a big red circle in the center. The word ""giay"" is written in the middle of the red circle. The words ""Tiep Theo"" are written below the logo in red."
221.jpg,A crowd of people are walking down a busy city street at night. There are tall buildings on either side of the street. Some of the buildings have signs hanging from them. The sky above the buildings is dark.
222.jpg,A busy street is seen at night. There are a lot of people walking on the street. The buildings on either side of the street have signs on them. A white car is parked on the side of one of the buildings.
223.jpg,There are several buses and trucks driving on the street. There are people standing on the side of the street next to the buses. There is a large metal ladder in front of the trucks. 
224.jpg,A red bus is driving down the street. There is a large brown container next to the bus. There are several signs on the side of the street next to a tree. 
225.jpg,A woman in a red dress is standing in front of a large screen. She is holding a small device in her hands. There is a large picture on the screen behind her. 
226.jpg,A woman is wearing a red dress. She has long brown hair. She is holding a book in her hands. There is a picture next to her that has a city on it. 
227.jpg,A busy street is seen at night. There is a white car with its headlights on driving down the street. There are several people standing on the sidewalk in front of a building. 
228.jpg,There are people standing on the street. There are buildings next to the street with lights on them. There is a red light in front of the building. 
229.jpg,There are people walking on the street. There are buildings next to the street with signs on them. There is a red light in front of the building. 
230.jpg,There are people walking on the street. There are buildings next to the street with signs on them. There is a white car parked in front of the building. 
231.jpg,A busy street is seen at night in a foreign country. There are many people walking on the street. The buildings on either side of the street have signs on them. The sky above the street is black.
232.jpg,There are people walking on the street. There are several buildings next to the street with signs on them. There is a man in a black shirt and white shorts standing in the crowd. 
233.jpg,A man is standing in front of a news desk. He is wearing a long sleeve shirt and a tie. The man is holding a tablet in his hands. There is a large cityscape behind the man. The sky is red and orange. 
234.jpg,A man is standing in front of a screen. He is wearing a long sleeve shirt and a tie. The man is holding a red object in his hands. There is a large city on the screen behind the man. 
235.jpg,There are tall buildings next to each other. There are trees in front of the buildings. There is a crowd of people walking around the building. 
236.jpg,There are several people standing on a sidewalk. There is a white building behind them with large windows on the front of it. There are trees in front of the building. 
237.jpg,There is a large white building with lots of windows on it. There is a man in a white shirt standing in front of the windows. There are leaves on the side of the building.
238.jpg,There are people standing outside of a building. There are trees and bushes in front of the building. The man in the white shirt is talking on a phone. 
239.jpg,There are several people standing in front of a building. There is a large silver pole next to the people. There are green bushes and trees next to them. 
240.jpg,There are tall white buildings with many balconies on them. There is a tree in front of the building. There are black railings on the balconies.
241.jpg,There are several people standing outside of a building. There is a large palm tree in front of the building. The building has large windows on the front of it. 
242.jpg,There is a white building next to a street. There are red lanterns hanging from a tree in front of the building. There is a blue sign on the side of a building. 
243.jpg,There are people standing on a balcony of a building. There is a large palm tree in front of the balcony. There are red balloons hanging from the tree. 
244.jpg,Two tall white buildings are next to each other. There are balconies on the side of the buildings. There is a blue sky behind them. 
245.jpg,A tall white building with many balconies on the side of it. There is a large tree in front of the building. 
246.jpg,An ambulance is driving down the street. There is a man on a motorcycle in front of the ambulance. There are buildings on the side of the street next to the motorcycle. 
247.jpg,A woman in a red dress is standing in front of a red background. She is holding a tablet in her hands. There is a large picture on the wall behind her. 
248.jpg,There is a large white building behind a tree. There is a red truck parked in front of the building. There are people walking on the sidewalk next to the truck. 
249.jpg,A white building is behind a tree. There is a fire hydrant spraying water on the building. A ladder is attached to the top of the building that is being used to put out the fire. There are people standing on the ladder. 
250.jpg,There are several cars and motorcycles on the street. There is a large white building behind them. There are trees in front of the building. 
251.jpg,There is a large white building with a blue wall in front of it. There are trees surrounding the building. There is a ladder leading up to the building that is next to the blue wall. 
252.jpg,There is a large white building on fire. There is black smoke coming out of the building. There are trees in front of the buildings. 
253.jpg,This is a picture of a building. The building is white. There are balconies on the building. There is a fire hydrant on the top of the building that is spraying water. The sky above the building is blue with white clouds in it. The water is spraying out of a white bucket. The bucket is attached to a crane.
254.jpg,There is a white building with a blue building in front of it. There are windows on the side of the building. There is a silver tank on top of the white building. 
255.jpg,A tall white building with balconies on it. There is a crane next to the building. There are trees in front of the building under the crane. 
256.jpg,There is a white and blue building next to a street. There is a large white truck on the street in front of the building. There are trees on the sidewalk next to the street. 
257.jpg,A man is standing in front of a news desk. He is wearing a long sleeve shirt and a tie. The man is holding a tablet in his hands. There is a large cityscape behind the man. 
258.jpg,A man is standing in front of a news desk. He is wearing a white shirt and a red tie. There are tall buildings behind him. There is a red sky behind the man. 
259.jpg,A man is standing in front of a news desk. He is wearing a white collared shirt and a red tie. The man is holding a small red object in his hands. There is a large cityscape behind the man. There are tall buildings and skyscrapers in the city. The sky above the city is orange and pink.
260.jpg,A green bus is driving down the street. There is a white truck next to the bus. There are pink flowers on the side of the road. 
261.jpg,There are several cars and trucks driving on the street. There are buildings next to the street with a tall tower above them. There is a green bus on the side of the street in front of the buildings.
262.jpg,A red bus is driving down the street. There is a large brown container on the street next to the bus. There are people walking on the sidewalk in front of the building. 
263.jpg,There is a green and white bus on the street. There is a large white truck next to the bus. There are pink flowers on the side of the street next to a sidewalk.
264.jpg,There are several vehicles on the street. There is a large truck next to a green bus. There are people standing on the side of the street next to the bus. 
265.jpg,There are several people riding motorcycles on the street. There is a large red truck behind them with a ladder leading up to the top of it. There are trees on the other side of the road. 
266.jpg,There is a large truck with red containers on the back of it. There is a bridge over the truck. There are people on motorcycles in front of the truck and a green bus on the street. 
267.jpg,There is a large brown truck under a bridge. There is a blue car on the street in front of the truck. There are people on bikes next to the car. 
268.jpg,There is a large brown truck under a bridge. There are people standing in front of the truck. There is a blue car on the street next to it. 
269.jpg,There are several motorcycles on the street. There is a large white truck behind them. There are people standing on the sidewalk next to the motorcycles. 
270.jpg,There are several motorcycles and buses on the street. There is a man standing in front of them wearing a yellow helmet. There are trees behind the vehicles. 
271.jpg,There are several trucks on the street. There is a large bridge above the trucks. There are red containers on the truck. 
272.jpg,There are two large trucks on the street. There is a large red container behind the truck. There are red and white barriers on the side of the street in front of the trucks.
273.jpg,There are several trucks driving on the street. There are pink flowers on the side of the street next to the trucks. 
274.jpg,A woman in a red dress is standing in front of a red background. She is holding a tablet in her hands. There is a picture next to her that has a city on it. 
275.jpg,A woman in a red dress is standing in front of a red background. She is holding a book in her hands. There is a large picture on the wall behind her. 
276.jpg,A white car is on the street. There is a white fence next to the car. There are people standing in front of the car on the sidewalk. 
277.jpg,The image is a screenshot from a video. It shows a truck driving down a highway at night. The headlights of the truck are shining brightly. There is a white fence on the left side of the highway. The background of the image is black.
278.jpg,A group of people are standing on the side of the road at night. There is a large bright light shining down on the people. There are several cars parked on the street. 
279.jpg,There are several cars driving on the street. There is a large truck in front of the white car. There are two people standing on the side of the street next to a motorcycle. There appears to be a street light next to the cars. 
280.jpg,There are several cars driving on the street at night. There are bright lights shining on the cars. There is a street light next to the street. 
281.jpg,A man is standing in front of a large screen. He is wearing a purple shirt and a purple tie. The man is holding a red box in his hands. There is a red and white sign behind the man. 
282.jpg,A man in a purple shirt and tie is holding a tablet. There is a large screen behind the man. There are tall buildings on the ground behind him. 
283.jpg,A man in a purple shirt and tie is standing in front of a screen. He is holding a red box in his hands. There is a picture on the screen next to the man. 
284.jpg,A man in a purple shirt and tie is standing in front of a screen. He is holding a brown book in his hands. There is a picture on the screen next to the man. 
285.jpg,A person is riding a cat on a skateboard. The cat is black and white. There are trees on the side of the street. There is a building behind the trees. 
286.jpg,A cat is standing on top of a white skateboard. There is a white pole behind the cat. There are trees behind the pole. 
287.jpg,A man is wearing a red and white striped jacket. He is holding a gray and black cat in his hands. There is a basketball hoop behind the man. 
288.jpg,A cat is riding on top of a skateboard. The cat is black and white. The wheels of the skateboard are white. There is a person standing in front of the cat. 
289.jpg,A cat is laying on top of a white skateboard. There is a tall white pole behind the cat. There are trees on the other side of the pole. 
290.jpg,There is a white and black skateboard on the ground. There is a green basketball hoop in front of the skateboard. There are trees and buildings behind the basketball hoop.
291.jpg,A man is kneeling down on the ground. He is wearing a white hat on his head. There is a building behind him with red pillars on it. There are benches under the building. 
