frame,caption
145.jpg,There are several people in a room. They are wearing black jackets and helmets. There is a white van behind them. There are red and blue balloons in front of them. 
146.jpg,There are two men wearing black jackets and helmets. They are standing next to each other. There is a white truck behind them. 
147.jpg,There is a dark picture on the screen. There is a person standing in front of a white wall. The person is wearing blue shoes. 
148.jpg,A picture of a person is shown. The person is wearing a black hat. There are headphones on the person's head. There is a red background behind the person. 
149.jpg,There are several people standing around a table. There are lights on a tree behind them. There is a man in a white shirt standing in front of the table.
150.jpg,There is a red motorcycle on the ground. There are people standing next to the motorcycle. There is a white car behind them. 
151.jpg,There is a picture of a person laying down. The person is wearing a black suit. There is a red ball on the ground next to the person. 
152.jpg,A person is wearing a brown jacket and a black and white checkered shirt. The person is standing in front of a white wall. 
153.jpg,A man is sitting in a chair. He is wearing a brown jacket and a checkered shirt. The wall behind the man is white. The man has short black hair. 
154.jpg,Three men are walking outside of a gate. The gate is black and there is a white fence behind them. The man in the middle is wearing a black shirt and has his hands in his pockets. There is a man on the left wearing a blue shirt and jeans and carrying a black bag over his shoulder.
155.jpg,There are three men standing in a field. There are trees and bushes around them. The man in the blue jacket is standing in front of the other two men. 
156.jpg,A red and white background has a large number 6 on it. There are small dots on the red background. There is a large white stripe on the bottom of the picture. 
157.jpg,There are purple sea creatures on the ground. There is a black and white striped object in front of them. There are yellow poles on the object. 
158.jpg,"A picture of an animal is shown on a TV screen. The animal appears to be a hippopotamus. It is brown in color and has large, round eyes. There is a red border around the image. The words ""Phat Hien 4 Loai Bach Tuoc Bien Sau"" are written below the animal."
159.jpg,"This is an image of a cuckoo clock. The clock is brown and yellow. The hands on the clock are roman numerals. There is a small bird in the small window. The window is made of wood. The bird is brown. There are birds on either side of the window. There's a watermark in the top right corner of the image that says ""HTV9 HD""."
160.jpg,There are several clocks on the wall. They are made out of wood and have leaves on them. There is a chain hanging from one of the clocks. 
161.jpg,A woman in a white dress is standing in front of a city. She is holding a red purse in her hands. There is a large screen behind the woman. 
162.jpg,A woman in a white dress is standing in front of a screen. There are people standing behind a white table. There is a black speaker on the table. 
163.jpg,A woman in a white dress is standing in front of a screen. There is a picture on the screen next to the woman. There are people standing on a stage in the picture. 
164.jpg,A man is holding a cell phone in his hand. He is wearing a black watch on his wrist. There is a white table in front of the man with the cell phone on it. 
165.jpg,A person's hand is touching a cell phone. The cell phone is a silver color. The person is wearing a black watch. There is another cell phone next to the first one. The background is white.
166.jpg,There are several people standing in a room. There is a man in a black shirt holding a black camera in his hands. He is wearing glasses and has a black bag around his neck. Next to him is a woman with long brown hair. 
167.jpg,A hand is holding a phone case. The phone case is black and a burgundy color. The table is white. The text on the image is in Vietnamese.
168.jpg,The back of a phone is shown. It is silver in color. There are four black circles on the back of the phone. There is a small white button on the top right of the camera.
169.jpg,There are several people standing around a white table. There is a man in a black jacket standing in front of the table with a laptop on top of it. 
170.jpg,There are several people standing around a white table. There is a man in a black jacket standing in front of a camera. There are several phones on top of the table. 
171.jpg,A hand is holding a phone. There are three phones on top of the table. The hand is wearing a silver ring. There is a white sweater on the other hand. 
172.jpg,There are two phones on top of a white table. There is a person holding a black phone in their hand. They are wearing a silver ring on their finger. 
173.jpg,There are several people standing in a crowd. They are holding cameras in their hands. There is a man in a black shirt wearing glasses. 
174.jpg,There are several people standing in front of a white wall. There is a man in a black jacket holding a silver phone in his hand. There are several cameras on the wall behind him.
175.jpg,There are cars driving on the street. There is a large white building behind the cars. There are people walking on the sidewalk in front of the building. 
176.jpg,There is a large white building with many windows on the side of it. There are trees in front of the building. There is a black fence on the sidewalk next to the trees. 
177.jpg,A large group of people are standing outside of an Apple store. There is a large white apple logo on the front of the store. Some of the people are wearing hats on their heads.
178.jpg,A man is wearing a blue shirt and a tie. He is holding a tablet in his hands. There are tall buildings behind the man. There is a cloudy sky above the buildings.
179.jpg,A man is wearing a blue shirt and a tie. He is holding a tablet in his hands. There are tall buildings behind the man. There is a yellow sky above the buildings. 
180.jpg,There are many jellyfish on the ground. There is a large silver and yellow object next to the jellyfish. There are black rocks next to them. 
181.jpg,A robot is laying on the ground. The robot is gray and black. There is a white bucket next to the robot. 
182.jpg,An older man with a white beard and glasses is sitting in a room. There are pictures hanging on the wall behind him. The man is wearing a black shirt. 
183.jpg,An older man is wearing a black shirt and glasses. There are pictures hanging on the wall behind the man. The wall is white in color. 
184.jpg,There are several pieces of something on a white table. There are tags attached to the pieces of the items. There is a white piece of paper behind them. 
185.jpg,"A picture of an animal in the water. The animal is a pinkish color. There is a large rock in the middle of the picture. The water is murky and green. There are many small bubbles floating around the animal. The picture has a watermark in the top right corner that says ""HTV9 HD 06:49:24""."
186.jpg,"An octopus is shown in the water. It is purple and has small white dots on it. There is a watermark in the top right corner that reads ""HTV9 HD 06:49:26"". Below the image, there is a caption in Vietnamese that ends with ""EU thao luen muc tieu trung hoa ca""."
187.jpg,An older man with a white beard and mustache is wearing glasses. He is wearing a black shirt. There are pictures on the wall behind him. 
188.jpg,There is a lot of debris on the ground. There is a large machine to the right of the debris. There are many small objects on top of the pile of debris. 
189.jpg,There is a large black rock on the ground. There are small white worms on top of the rock. There is a white knife next to the rocks. 
190.jpg,There is a black and white image on a screen. There are small white dots on the image. There is a red and white logo on the top right corner of the screen.
191.jpg,There is a white object on the ground. There are small rocks around the white object. There is a small hole in the ground next to it.
192.jpg,A black and white image is displayed on a screen. There are small white flowers on the screen. The flowers are in the shape of leaves. There is a black background behind the flowers. The words on the bottom of the screen are in red and white.
193.jpg,"The image is a screenshot from a video. The background is black. In the center of the image there is an underwater scene. There is a large amount of green and gray coral. There are small white bubbles in the water. At the bottom of the screen there is a red banner with white text that says ""Lam phat & Canada tiep tuc tang lam giam kha nang ha lai suat""."
194.jpg,The image is an underwater scene. The background is completely black. In the center of the image there is a coral reef. There are various types of sea creatures. 
195.jpg,A woman is wearing a white dress. She is holding a red purse. There is a large screen behind the woman. There are buildings on the other side of the screen. 
196.jpg,A woman in a white dress is standing in front of a building. There is a picture of a pile of rocks next to the woman. 
197.jpg,A woman in a white dress is standing in front of a yellow background. She is holding a red wallet in her hands. There is a picture on the right of the woman. 
198.jpg,There are several white buildings with pointed roofs on top of them. There are trees in front of the buildings. There is a red and white sign on the bottom of the image. 
199.jpg,There are a bunch of stone huts. They are stacked on top of each other. There is a white building next to them. There are stairs leading up to the white building. 
200.jpg,There are several stone huts on the ground. There is a white building in front of the huts. There are stairs leading up to the white building. 
201.jpg,There is a large structure made of rocks. There is a white building behind the structure. The sky is blue in color.
202.jpg,This is an image of a town. The town has white buildings. The buildings have a lot of windows. There is a white van in the middle of the street. The van has a blue and white sign on the front of it. The sign has a white letter P on it. There are trees in front of the buildings with white umbrellas. The sky above the buildings is blue.
203.jpg,This is an image of a street. The street is very narrow. The buildings on either side of the street are white. There is an umbrella in the middle of the buildings. The umbrella is white. The sky above the buildings is light blue. There are trees in the distance. The trees are dark green. The building on the left has a brown door.
204.jpg,A woman is standing outside on a sunny day. She is wearing a black jacket and sunglasses. A white van can be seen parked on the street behind the woman. There are several large white buildings on the side of the street. Tall street lights are standing on the sidewalk in front of the buildings. Part of a blue sky is seen above the building.
205.jpg,A woman is standing outside on a sunny day. She is wearing a black jacket and sunglasses. There are tall buildings behind the woman. There is a white van parked in front of one of the buildings. A street light is standing on the sidewalk in between the building. A blue and white sign is hanging from a pole on the side of the street.
206.jpg,There are many conical shaped buildings. There are trees behind the buildings. The sky is blue and there are clouds in the sky. There is a white building in front of the trees.
207.jpg,A white building with a brown door. There are two white benches in front of the building. There is a black ladder leaning against the building against the wall. 
208.jpg,A man is standing in front of a white building. He is wearing a black shirt and a white jacket. He has sunglasses on and is smiling. There is a sign on the wall of the building. 
209.jpg,A man is standing in front of a white building. He is wearing a black shirt and a white jacket. He has sunglasses on and has short hair. There is a sign on the wall of the building. 
210.jpg,There is a white building with a pointed roof. There is a small window on the front of the building. There are plants on the windowsill. 
211.jpg,There are several white buildings with pointed roofs. There is a tree in front of one of the buildings. 
212.jpg,There are many conical shaped buildings. There are trees behind the buildings. The sky is blue and there are clouds in the sky. There is a white building in front of the trees.
213.jpg,A man in a blue shirt and tie is standing in front of a city. He is holding a tablet in his hands. There is a large picture on the wall behind him. 
214.jpg,A man in a blue shirt and tie is standing in front of a screen. He is holding a tablet in his hands. There is a picture on the wall behind him. There are tall buildings on the other side of the man. 
215.jpg,A man is standing in front of a screen. He is wearing a blue shirt and a blue tie. He has glasses on and is holding a tablet in his hands. There is a large picture on the wall behind him. 
216.jpg,The image is a screenshot of a news channel. The channel name is HTV9HD and the time is 06:51:27. There is an image of leaves in the background. The leaves are brown and appear to be made of wax. In the center of the image there is a wooden object that looks like a carved piece of wood. The object is brown in color and has a carved design on it.
217.jpg,There is a man standing in front of a counter. There are several clocks hanging on the wall behind the man. There is a wooden box on the counter next to him.
218.jpg,There is a wooden object that appears to be a machine. It is brown and white in color. There are wires hanging from it. There is a black object next to it. 
219.jpg,There is a clock on the wall. There are roman numerals on the clock. The clock is black. There is a light behind the clock on a wall. 
220.jpg,There are several clocks hanging on the wall. There is a picture frame hanging from the wall next to the clocks. The clocks are all different shapes and sizes. 
221.jpg,There are several clocks hanging on the wall. There are white lights hanging from the ceiling. There is a small wooden stool in front of a glass case. 
222.jpg,A man is standing in front of a wall full of clocks. The man is wearing a brown suit and a purple tie. The wall behind the man is white. There are many clocks on the wall. 
223.jpg,A man is wearing a brown suit and a tie. There are many clocks on the wall behind him. There is a wooden shelf behind him with a clock on it.
224.jpg,A man is standing in front of a wall full of clocks. The man is wearing a brown suit and a tie. The wall behind the man is white. There are many clocks on the wall. 
225.jpg,There are several clocks hanging on the wall. They are all brown in color. There is a mirror hanging from the wall in front of them. 
226.jpg,There is a statue of a lion in a room. There is a clock behind the statue on the wall. The statue is brown in color. 
227.jpg,There are several clocks hanging on the wall. They are made of wood and have leaves on the front of them. There are chains hanging from the sides of the clocks. 
228.jpg,There is a dark brown object that looks like a door. There is a small opening on the door with a small object inside of it. There are words written on the bottom of the image.
229.jpg,There are several clocks on the wall. They are all made of wood and have leaves on them. There is a white wall behind the clocks. 
230.jpg,A woman is wearing a white dress. She is holding a red purse in her hands. There is a large screen behind the woman. 
231.jpg,A woman in a white dress is standing in front of a screen. There is a picture of a man on the screen behind her. The man is wearing a white shirt and has a microphone in his hand. 
232.jpg,A woman is wearing a white dress. She has short dark hair. She is holding a red object in her hands. There is a picture next to the woman. 
233.jpg,There is a woman in a white dress standing in front of a wall. There is a large picture on the wall behind the woman. The woman is holding a red book in her hands. 
234.jpg,An old man is shown on a TV screen. He appears to be in his late 60's or early 70's. He has gray hair and wrinkles on his face. His eyes are blue and his mouth is slightly open. He is wearing a black jacket and a white collared shirt. The wall behind him is plain white.
235.jpg,There is a large mural on the wall. There is a ladder leaning against the wall next to the mural. There are two people standing in front of it. One of them is wearing a black jacket and black pants. 
236.jpg,There is a colorful wall in a room. There is a person standing in front of the wall. There are lights on the ceiling above the wall above the person.
237.jpg,A man is standing in front of a colorful wall. He is wearing a blue hoodie and white gloves. He has short hair and a beard. There is a barcode on the bottom left of the image. 
238.jpg,A man is standing in front of a colorful wall. He is wearing a blue jacket and white gloves. He has short hair and a beard. There is a white door behind him. 
239.jpg,There are people walking in a hallway. There is a wall next to them with red ribbons hanging from it. There are two people in front of them wearing black jackets. 
240.jpg,There are people standing in a room. There is a woman in a black suit standing in front of a wall. There are other people standing next to her. 
241.jpg,A woman is wearing a black jacket and glasses. She is standing in front of a white wall. There is a picture hanging on the wall behind the woman. 
242.jpg,"A bunch of lego minifigures are displayed on a white background. They are all different people with different outfits and hairstyles. Some of the people are holding objects in their hands. There is a watermark in the top right corner that says ""HTV9 HD"" and the time is 06:53:22."
243.jpg,There are a lot of lego minifigures displayed on a white wall. There are two rows and three columns of the same lego figures. Each lego figure has a different outfit on it. Some of the lego people are holding objects in their hands. One lego man is holding a guitar. The second row has a man with a hat on his head and a book in his hand. The third row has two people with hats on their heads and one person with a gun.
244.jpg,There is a large black object on a white pedestal. There is a man standing behind the object. There are pictures hanging on the wall behind the man. 
245.jpg,There is a white wall with a small window on it. There is a wooden stool on the floor in front of the wall. There are black bars on the wall next to the window.
246.jpg,The image is a video of an art gallery. On the right side of the image there is a large piece of art. The art piece is blue and orange. The frame is black and white. The floor of the gallery is gray. There are people walking in the gallery. The ceiling is white and arched.
247.jpg,A man is standing in front of a screen. He is wearing a blue shirt and a black tie. The man is holding a tablet in his hands. There is a large white screen behind the man. 
248.jpg,A man in a blue shirt and tie is standing in front of a television. He is holding a tablet in his hands. There is a large screen behind the man. There are people on a soccer field. 
249.jpg,A soccer game is being played in a stadium. There are many people in the stands watching the game. A player in a green uniform is kicking a white and black soccer ball. 
250.jpg,A soccer game is being played on a TV screen. There are several players on the field. They are wearing red and white uniforms. There is a white soccer ball in front of them. 
251.jpg,A soccer game is being played on a TV screen. There are several players on the field. There is a large crowd sitting in the stands watching the game. 
252.jpg,A soccer game is being played on a TV screen. There are several players on the field. They are wearing red and white uniforms. There is a crowd of people sitting in the stands watching the game. 
253.jpg,A soccer game is being played on a TV screen. There are several players on the field. They are wearing white and red uniforms. The field is green with white lines on it. There is a score board at the top of the screen.
254.jpg,"AFC Asian Cup Qatar 2023 - 16:59 TJK 0 - 0 QAT is displayed on the screen. The time is 06:57:00 and the channel name is HTV9HD. Below the screen, there is a description of the event written in Vietnamese."
255.jpg,There is a man and a woman standing in front of a desk. The desk is white and has a red logo on it. The man is wearing a blue shirt and a black tie. The woman has a white dress on and is holding a red purse. There is a large screen behind them. There are buildings on the screen.
256.jpg,There is a man and a woman standing in front of a desk. The desk is white and has a red logo on it. There is a large screen behind them. There are buildings on the screen. 
257.jpg,"The image is dark. The background is completely black. At the top right corner of the image there is a logo that says ""HTV9 HD 07:02:12""."
