frame,caption
001.jpg,A beautiful sunset over a city. The sky is orange and pink. There are many buildings in the city. There is a large body of water in front of the buildings. 
002.jpg,A man and a woman are standing behind a news desk. The desk is white and has red writing on it. There is a large screen behind them. There are buildings on the screen. 
003.jpg,A man and a woman are standing behind a white table. The man is wearing a blue shirt and black pants. He is holding a tablet in his hands. The woman is wearing an off-white dress. She has long black hair. There is a large screen behind them. There are many tall buildings on the screen.
004.jpg,A man and a woman are standing in front of a news desk. The desk is white and has a red logo on it. The woman is wearing a white dress and has long black hair. The man is wearing glasses and a blue shirt and tie. There is a large screen behind them. There are many tall buildings on the screen.
005.jpg,A man and a woman are standing in a dark room. The man is wearing a white shirt and tie. The woman is wearing white. There is a red and white object in front of the man. 
006.jpg,There is a woman standing in front of a table. There are many jars on top of the table. The jars are filled with different types of food. There is a shelf behind the woman with jars on it. 
007.jpg,This is an image of a market. The market has food on display. The food is red and orange. The containers are white. There is a green chair in the middle of the market. There are people in the market wearing face masks. The walls are covered with white shutters. The shutters are closed. The lights are hanging from the ceiling.
008.jpg,There are people standing in a market. There are boxes of food in front of them. There is a woman wearing a white shirt and carrying a black bag.
009.jpg,There are two men standing under a tree. There are fruits hanging from the branches of the tree. The men are wearing blue shirts. 
010.jpg,There are three people standing under a tree. The tree has green leaves on it. There is a red sign in front of the tree. 
011.jpg,A man is sitting on a bench in a room. There is a large picture hanging on the wall behind him. A woman is standing in front of him wearing a green jacket. 
012.jpg,The image is an abstract background. The background is red. On the left side of the image there is a white diagonal stripe. The white stripe on the right side has a thin red line. The red on the left has small dots on it. The dots are arranged in a triangle shape. The image has a shadow on the red background. There is also a date and time stamp in the top right corner.
013.jpg,There is a man and a woman standing in front of a white table. The man is wearing a blue shirt and a tie. The woman is also wearing a white dress. There is a large screen behind them. There are buildings on the screen. 
014.jpg,A man and a woman are standing behind a news desk. The desk is white and has a red logo on it. The man is wearing a blue shirt and tie and is holding a tablet in his hands. The woman is dressed in a white dress. There is a large screen behind them that shows a city with tall buildings. There are clouds in the sky.
015.jpg,A man and a woman are standing behind a news desk. The desk is white and has a red logo on it. The man is wearing a blue shirt and tie and is holding a clipboard in his hands. The woman is dressed in a white dress. There is a large screen behind them that shows a city with tall buildings. There are clouds in the sky.
016.jpg,There is a woman standing in front of a table. There are many jars on the table with different types of food inside of them. There is a shelf behind the woman with cans on it. 
017.jpg,A woman is standing in front of a large display of food. There are many jars and containers of food on the display. The woman is wearing a black and orange shirt. There is a red and white sign in front and on the bottom of the image. 
018.jpg,There are several jars on top of a shelf. The jars have white lids on them. There is a label on the front of the jars. 
019.jpg,There are many jars on the table. The jars are filled with different items. Some of the jars have lids on them. There are many different colors in the jars. 
020.jpg,There is a woman standing in front of a table. There are bags of food on the table behind her. There is a blue and white striped tent behind the woman. 
021.jpg,There are people standing in a market. There are jars and containers on the ground in front of them. There is a yellow wall behind them. 
022.jpg,Two women are standing in front of a table that has various items on it. One of the women is wearing a black shirt with a white apron over it. She is holding a white bowl in her hand. A man is standing behind her wearing a blue shirt. There are boxes of food on the table. 
023.jpg,There is a woman standing in front of a store. There is a man behind her wearing a white jacket. There are many items on display behind them. 
024.jpg,"A person is holding a bag of confetti. The confetti is in the shape of soccer balls. The colors of the confetti are red, white, green and blue. The person is wearing a white shirt."
025.jpg,This is an image of a market. The market is filled with various types of food. The food is in bags. The bags are white and brown. The bag has a label on it. The label is red. The text on the bottom of the image is in a foreign language. There are lights hanging from the ceiling. The lights are white.
026.jpg,A woman is standing in front of a display of food. She is wearing a scarf and a hat on her head. A man is standing behind her wearing a red shirt and a black hat. He is smiling at the camera. A woman is walking past the woman in a dress. She has her hand on the food display.
027.jpg,A person is wearing a white and black plaid jacket. They are standing in front of a large pile of food. There is a large white bag next to the pile of foods. The person has their hand on top of the food.
028.jpg,There are several people walking around a market. There are many boxes and bags on the ground in front of them. There is a yellow building behind them. 
029.jpg,There are people standing inside of a market. There are bags of food on a table in front of them. There is a white sign hanging from the ceiling. 
030.jpg,There are several plastic containers with food inside of them. There are several sandwiches in front of the containers. There is a barcode on the bottom left of the image. 
031.jpg,There are people standing around a market. There are bags of food on the table in front of them. There is a woman wearing a red helmet on her head. 
032.jpg,A woman is sitting in front of a store. She is wearing a white shirt with blue designs on it. There is a clear plastic bag behind her with yellow tags on them. 
033.jpg,A woman is sitting in front of a brown box that has the number 29 on it. There are bags of nuts and other items surrounding the woman. There is a man in an orange shirt standing behind her. 
034.jpg,A woman is sitting in front of a window. She is wearing a white collared shirt and glasses. The window behind her is blue. There is a black chair behind her. 
035.jpg,There are people standing in a market. There are boxes of food in front of them. There is a man in a striped shirt with a red hat on. 
036.jpg,A woman is sitting in a chair. She is wearing a white shirt and glasses. There is a blue wall behind her. The woman has dark brown hair. 
037.jpg,There are two people standing in a market. There are bags of food in front of them. There is a man in a blue shirt standing next to a woman in a black shirt.
038.jpg,A person is holding a bag of food. There are many bags of food in front of the person. The person is wearing a blue shirt. 
039.jpg,There are people standing in front of a store. There is a white sign hanging from the ceiling. There are bags of food on top of the table. 
040.jpg,There are people shopping at a market. There are many bags of food on the table. There is a woman wearing a red helmet on her head. 
041.jpg,A woman in a white dress is standing in front of a screen. She is holding a red folder in her hands. There is a picture on the screen next to the woman. 
042.jpg,A woman in a white dress is standing in front of a city skyline. She is holding a silver tray in her hands. There is a picture next to the woman on the screen. 
043.jpg,A woman is sitting in a green boat. She is wearing a blue jacket and has her hair pulled back into a ponytail. The woman is holding a long brown stick in her hand. There are three small net balls floating in the water in front of her. The water is calm and there are small ripples in it.
044.jpg,A person is holding a net. They are wearing a blue shirt. There is water behind them. The person is wearing a bracelet on their wrist. 
045.jpg,There are several brown buckets on the ground. There is a red bucket next to the buckets. The bucket has a white line on the bottom of it. 
046.jpg,A red bucket is sitting on top of a blue tray. There is a clear plastic strainer around the red bucket. There are wires coming out of the strainer. 
047.jpg,There is a red background with a picture of food on it. The food appears to be noodles. There is writing on the bottom of the picture that is in Vietnamese.
048.jpg,A woman is sitting in a green boat. She is wearing a blue long sleeve shirt. The woman is holding a net in her hands. There is water next to the boat. 
049.jpg,A hand is wearing a blue glove. There is a large net in front of the hand. There are words written on the bottom of the screen. 
050.jpg,A person is wearing a blue long sleeve shirt. They are holding a net in their hand. There is water in front of the person. 
051.jpg,A person is wearing a blue long sleeve shirt. They are holding a net in their hand. There is water under the person. 
052.jpg,A man is sitting in a green boat. He is wearing a blue shirt. There are two red buckets on the boat. The man is holding a long stick in his hand. 
053.jpg,There is a woman in a blue shirt sitting in a green boat. There are two red buckets in front of her. There is a white net hanging from the boat. 
054.jpg,"The image is a screenshot from a video. It appears to be raining. There are small black dots scattered across the image. At the bottom of the image there is a caption in Vietnamese that reads ""Bat 2 thanh nien a Hiep Hoa duo danh doi nam nu vi tieng net po""."
055.jpg,"The image is a still from a Vietnamese TV show. It is a black and white image of a rock. The rock appears to be wrapped in silver foil. At the bottom of the image there is a caption in Vietnamese that starts with the words ""ha duoi danh doi nam nu vi tieng net pó"". At the top right corner there is the logo for the channel ""HTV9 HD""."
056.jpg,A man in a blue shirt and tie is standing in front of a city. He is holding a red book in his hands. There are tall buildings behind him. 
057.jpg,A man is standing in front of a city skyline. He is wearing a blue shirt and a tie. He has glasses on and is holding a tablet in his hands. The sky is orange and cloudy.
058.jpg,A man in a blue shirt and tie is standing in front of a city skyline. He is holding a tablet in his hands. The man is wearing glasses and has short black hair. The sky is orange and yellow. There are tall buildings in the background.
059.jpg,There are several men sitting around a table. There is a white wall behind them with wires hanging from the ceiling. There are plates and glasses on the table in front of them. 
060.jpg,An elderly man with white hair is sitting on a brown bench. He is wearing a black collared shirt. There is a white wall behind him. 
061.jpg,There are two plates of food on the table. The plates are silver. The food is green and yellow. There is a glass next to the plates. The table is made of wood.
062.jpg,A white car is parked in a garage. There are people sitting at a table in front of the car. There is a yellow wall behind the car with a large window on it. 
063.jpg,A man is sitting in front of a table. There is a white kettle on top of the table. Next to the kettle is a silver water dispenser. 
064.jpg,A tree is in the middle of a field. The field has tall green grass and weeds. There are leaves on the ground around the tree. 
065.jpg,There are people standing under a large tree. There are lots of green leaves on the trees. There is grass under the tree. 
066.jpg,There is a tree with green leaves on it. There are large green fruits hanging from the tree. There is a white sky in the background. 
067.jpg,There are four men standing under a tree. The tree has green leaves on it. There is a man in a blue shirt standing under the tree. 
068.jpg,A tree with green fruit hanging from it. There are several large green fruits on the tree. There is a large green branch under the fruit. The sky behind the tree is white. 
069.jpg,There is a small stream running through a wooded area. There are trees on both sides of the stream. The sky above the stream is filled with white clouds. 
070.jpg,Three men are standing under a large tree. The tree has green leaves on it. One of the men is wearing a blue shirt. The other two men are wearing blue shirts. 
071.jpg,There are two men standing under a tree. There are green leaves on the branches of the tree. The man in a blue shirt is reaching up to the branch. 
072.jpg,A tree with green leaves on it. There are large green fruits hanging from the tree. There is a brown branch under the fruit. 
073.jpg,There are two men standing in front of a tree. The tree has green leaves on it. There are fruits hanging from the branches of the tree. One of the men is wearing a blue shirt. 
074.jpg,There are two men standing in a field. There are trees and bushes around them. The man on the left is wearing a blue shirt. 
075.jpg,There are two men standing under a tree. There are fruits hanging from the branches of the tree. The men are wearing blue shirts. 
076.jpg,There is a large field of tall green plants. There is a brown fence in front of the plants. On top of the fence is a small statue. 
077.jpg,A tree with green fruit hanging from it. There are several large green fruits hanging from the tree. There is a large green tree branch under the fruit. The sky behind the tree is white. 
078.jpg,Three men are standing under a large tree. The tree has many green leaves on it. The men are wearing blue shirts. One of the men is holding the branch of the tree. 
079.jpg,A tree with green leaves on it. There are brown branches on the tree. There is a red and white logo on the top right corner of the image. 
080.jpg,There are people standing under a tree. The tree has green leaves on it. There is a man in a blue shirt standing under the tree. 
081.jpg,There are trees in front of the camera. The trees have green leaves on them. There are clouds in the sky. The sky is blue. There is writing on the bottom of the screen. 
082.jpg,A woman is wearing a white dress. She is holding a red wallet. There is a picture next to the woman that has a city on it. 
083.jpg,This is an aerial view of a town. The town has lots of trees surrounding it. There is a road running through the town. There are several cars driving on the road. 
084.jpg,There are several large trucks on the street. There is a large white bus in front of the trucks. There are several people standing on the side of the street wearing helmets. 
085.jpg,There are several trucks lined up on the street. There are trees on the side of the street next to the trucks. The trucks have a black cover on the top of them. 
086.jpg,There are several cars and trucks lined up on the street. There are large trees next to the street behind the cars. There is a person riding a bike on the side of the road. 
087.jpg,This is an aerial view of a city. There are a lot of trees surrounding the road. There is a large body of water in the background. The sky above the road is white. 
088.jpg,An aerial view of a road is shown. There are many trees surrounding the road. There is a large body of water in the background. The sky above the road is white.
089.jpg,There are several cars and trucks lined up on the street. There are trees next to the street with green leaves on them. There is a person riding a motorcycle next to them. 
090.jpg,There is a large truck driving on the street. There is a blue sign in front of the truck. There are cars parked on the side of the street next to the sign. 
091.jpg,There are several trucks lined up on the street. There are cars next to the trucks. There is a man in a checkered shirt standing next to a white car. 
092.jpg,There are several cars lined up on the street. There are trees next to the street with green leaves on them. There is a large body of water behind the cars. 
093.jpg,There is a large white boat in the water. There are many windows on the side of the boat. There is a flag on the top of the building. 
094.jpg,There is a large white boat in the water. There is a red flag on the top of the boat. There are buildings in the distance behind the boats. 
095.jpg,There is a white truck parked under a bridge. There is a silver fence in front of the truck. There are cars parked next to the bridge. 
096.jpg,There are several cars parked in a parking lot. There is a man in a black jacket standing in front of the cars. There are clouds in the sky above them.
097.jpg,A green sign is hanging over two white pillars. There is a red circle on top of the sign. There are trees behind the sign and a small building behind the pillars. 
098.jpg,"Three men in uniform are walking through the gate of a building. The gate is green and there is a red sign above the gate that says ""Ky Luatla Suc Manh Cua Quan Doi"" on it. There is a man in a green uniform holding a gun on the left side of the gate. The man in the green uniform is standing in front of him."
099.jpg,A group of people are standing together. They are all wearing helmets. There are trucks behind them. There is a person standing in front of them with a red hat on. 
100.jpg,Three men are walking down a sidewalk. There is a black fence behind them. One of the men is wearing a blue shirt and carrying a black bag. 
101.jpg,"The image is a graphic design. The background is red and white. The design is made up of dots. The dots are arranged in a diagonal pattern. There is a large red logo in the middle of the image. The logo has the word ""giay"" written on it in a bold font. The letters of the logo are also red. The overall design is modern and eye-catching."
102.jpg,A man in a blue shirt and tie is standing in front of a city skyline. He is holding a tablet in his hands. He has glasses on and is wearing a watch on his left wrist. There is a white railing in the front of him. 
103.jpg,A man in a blue shirt and tie is standing in front of a city. He is holding a tablet in his hands. There are tall buildings behind him. 
104.jpg,A man in a green uniform is standing in front of a table. He is holding a piece of paper in his hands. There are two men standing next to him. One of them is wearing a striped shirt. 
105.jpg,A woman is standing in a room. She is wearing a striped shirt and blue pants. There is a small wooden table in front of her with a white container on top of it. A person is taking a picture of the woman with her phone.
106.jpg,This is an image of a room. The room is very dark. There is a black table in the middle of the room. There are black pillars in the room around the table. The door to the room is closed. The window to the left of the table has black shutters on it. The shutters are open. The floor is white.
107.jpg,The image is a security camera footage of a building. It is a black and white image. There is a window on the left side of the image. The window has black shutters on it. There are two doors on the right side. The floor is white and there is a table in the center of the room. There appears to be a person sitting on a chair in front of the window.
108.jpg,There are three people standing in a room. There is a green wall behind them. There are pictures hanging on the wall above them. They are holding up a large piece of art. 
109.jpg,There are three men standing in a room. One of the men is wearing a black shirt and a gray hat. There is a large cabinet behind them. 
110.jpg,There are two men in a room. There is a large black cabinet in front of them. There are pictures hanging on the wall above the cabinet. 
111.jpg,There is a room with many items in it. There is a man standing in front of a mirror. There are pictures hanging on the wall above the man. 
112.jpg,There are two men standing in front of a gate. The man on the left is wearing a blue baseball cap. There is writing on the gate. 
113.jpg,There are four people standing outside of a building. There is a man in a green suit standing in front of a blue and pink pillar. There are trees behind the building.
114.jpg,There are several people standing in front of a building. There is a man in a green suit standing next to a woman in pink pants. 
115.jpg,There are several men standing in front of a gate. There is a man in a green suit standing next to them. There are motorcycles parked on the side of the street.
116.jpg,There are several people standing in front of a building. There is a red sign on the side of the building with chinese writing on it. There are trees next to the building.
117.jpg,There are several people standing on a sidewalk. There is a building next to them with wooden boards leaning up against the side of the building. There are trees next to the sidewalk.
118.jpg,A woman is wearing a white dress. She is holding a red wallet. There is a picture next to the woman that has a city on it. 
119.jpg,A woman is wearing a white dress. She is holding a red wallet. There is a picture next to the woman that has a city on it. 
120.jpg,There are two men standing in a doorway. They are wearing green shirts and pants. There is a window on the wall behind them. The door is open and there is a green railing in front of them. 
121.jpg,A man is wearing a green shirt. There is a brown wall behind the man. The man has a black spot on his face. 
122.jpg,Two men are sitting at a green table. They are both wearing green collared shirts. There is a brown wall behind them with a window on the other side of the table. 
123.jpg,A man in a green uniform is sitting at a green table. There is a window on the wall behind the man. The man has short black hair. 
124.jpg,A man is shown from the neck up. He has short hair that is gray. He is wearing a green shirt. There is a brown wall behind the man. 
125.jpg,A man is standing in front of a brown wall. He is wearing a green polo shirt. There are holes on the wall behind the man. 
126.jpg,A knife is laying on a white surface. The handle of the knife is brown and has a metal chain hanging from it. The knife has a silver blade and a brown handle. 
127.jpg,"The image is of a motorcycle. The motorcycle is red and gray. There is a white license plate on the front of the motorcycle that reads ""67-C1 858.85"". The motorcycle has a spring on the back of it. The front tire is black and has silver spokes. There are rocks and grass next to the motorcycle."
128.jpg,A man is sitting in front of a brown wall. He is wearing a green shirt with a white stripe down the collar. The man has short gray hair. 
129.jpg,A man is wearing a blue shirt and a tie. He is holding a tablet in his hands. There are tall buildings behind the man. There is a cloudy sky above the buildings.
130.jpg,A man is wearing a blue shirt and a tie. He is holding a tablet in his hands. There are tall buildings behind the man. There is a cloudy sky above the buildings.
131.jpg,There is a large green sign with yellow writing on it. There are two white pillars under the sign. There is a red ball above the sign with a yellow star on top of it.
132.jpg,A man is wearing a camouflage uniform and a green hat. He is sitting in a chair. There is a white wall behind the man. 
133.jpg,A man is sitting down. He has short black hair. He is wearing a white collared shirt. There is a large window behind him. 
134.jpg,Three men are sitting at a table. Two of the men are wearing camouflage uniforms and hats. The other man is wearing a white jacket. There are large windows on the wall behind the men. 
135.jpg,A man is sitting in a chair. He is wearing a white collared shirt. The man has dark colored hair. There is a window on the wall behind the man. 
136.jpg,There are three people in a room. There is a man in a white jacket sitting in front of a desk. There are two other men in uniform standing behind the desk. 
137.jpg,A man is sitting in a chair. He is wearing a white collared shirt. There is a window on the wall behind the man. The man has dark colored hair. 
138.jpg,Three men are sitting around a table. Two of the men are wearing camouflage uniforms and green hats. The other man is wearing a white jacket. There are large windows on the wall behind the men. 
139.jpg,A man is sitting in a chair. He is wearing a white collared shirt. The man has dark colored hair. There is a window on the wall behind the man. 
140.jpg,A man is sitting at a table writing on a piece of paper. He is wearing a white jacket and has a watch on his wrist. The man has short black hair. The table is brown and made of wood.
141.jpg,Four men are standing in a room. They are wearing green uniforms and green hats. There is a large table in front of them. A man in a white jacket is sitting at the table. 
142.jpg,A woman is wearing a white dress. She is holding a red purse. There is a picture next to the woman that has a city on it. 
143.jpg,There is a woman in a white dress. She is holding a red wallet. There is a picture next to the woman that has a city on it. 
144.jpg,There are several people standing around each other. They are wearing black jackets and blue jeans. There is a white van behind them. 
