frame,caption
001.jpg,A beautiful sunset over a city. The sky is orange and pink. There are many buildings in the city. There is a large body of water in front of the buildings. 
002.jpg,A man and a woman are standing in front of a news desk. The desk is white and has a red logo on it. The man is wearing a white shirt and tie and is holding a tablet in his hands. The woman is also wearing a long sleeve white shirt. There is a large screen behind them that has a city scene on it with tall buildings and a cloudy sky.
003.jpg,A man and a woman are standing behind a news desk. The desk is white and has a red sign on it. The man is wearing a white shirt and tie and is holding a tablet in his hands. The woman is also wearing a blazer and has short black hair. There is a large screen behind them that shows a city with tall buildings.
004.jpg,A bright red light is lit up against a black background. There are small white dots all over the light. There is a shadow of a person on the light in front of it. 
005.jpg,This is an aerial view of a city. There is a large body of water in the middle of the city. The water is dark blue in color. There are buildings surrounding the water.
006.jpg,"There are a lot of small square pictures on the screen. There are many small squares in the picture. There is a picture of a man in a white shirt on the top right. There's a red logo on the bottom right corner of the screen that says ""HTV9 HD"". There are a bunch of people in the pictures."
007.jpg,"A red and white graphic is shown. The red part is on the left side and the white part on the right side. There are two red diagonal lines on the white background. There is a small logo in the top right corner that says ""HTV9 HD 06:30:48""."
008.jpg,A man and a woman are standing behind a white table. The man is wearing a white shirt and a black tie. The woman is dressed in a white blouse and black pants. They are holding tablets in their hands. There is a large cityscape behind them. There are clouds in the sky. 
009.jpg,A man and a woman are standing behind a white desk. The man is wearing a pink shirt and a black tie. The woman is also wearing a white shirt. There are tall buildings behind them. 
010.jpg,A man and a woman are standing behind a white desk. The man is wearing a white shirt and a black tie. The woman is also wearing a long white shirt. There are tall buildings behind them. 
011.jpg,A man and a woman are standing behind a white desk. The man is wearing a pink shirt and a black tie. The woman is also wearing a white shirt. There are tall buildings behind them. 
012.jpg,"This is an aerial view of a city. There is a large body of water next to the city. The water is dark blue in color. There are tall buildings on the right side of the water. The buildings are white, red, and blue. The sky above the city is blue with white clouds."
013.jpg,An aerial view of a city is shown. There is a large body of water in front of the city. There are several tall buildings surrounding the water.
014.jpg,An aerial view of a city is shown in this image. The city appears to be densely populated. There are many roads and streets visible in the image. There is a red banner at the bottom of the image with white writing on it.
015.jpg,An aerial view of a city is shown. There is a tall pink building in the middle of the city. There are many other buildings surrounding the pink building. The sky above the city is blue with white clouds.
016.jpg,An aerial view of a city is shown. There is a large blue swimming pool in the middle of the city. There are several smaller buildings surrounding the pool.
017.jpg,The image is a screenshot of a video. The background is dark and there are buildings in the distance. At the bottom of the image there is a text in Vietnamese that appears to be the title of the video. There is also a QR code on the bottom left corner of the screen.
018.jpg,There is a long road with a yellow line in the middle of it. There are trees on both sides of the road. There is a truck on the other side of the street. 
019.jpg,There is a long road with a yellow line on it. There are trees on both sides of the road. There is debris on the ground next to the street. 
020.jpg,There are two people riding bikes down the street. There are trees on the side of the street next to the sidewalk. There is a yellow and blue umbrella on the sidewalk in front of the building. 
021.jpg,This is a picture of a street. The street is paved. The road is light gray. There are white lines on the road. There is a large green hedge on the side of the street. Large green trees are on both sides of the sidewalk. The sky above the trees is white. The sidewalk is made of concrete. The building next to the sidewalk is dark gray.
022.jpg,There is a green sign on the side of a building. There are trees surrounding the sign. There is a small building next to the street. 
023.jpg,There is a long road in the middle of the picture. There are tall trees on both sides of the road. There is a wall on the side of the street. The sky above the road is gray. The road appears to be made of concrete. The picture was taken during the day time. The time is 06:32:00.
024.jpg,A man is standing in front of a city skyline. He is wearing a white shirt and a black tie. He has glasses on and is holding a tablet in his hands. The sky behind the man is yellow and gray. There are tall buildings in the background.
025.jpg,A man is wearing a white shirt and a black tie. He is wearing glasses and has short black hair. There are tall buildings behind the man. 
026.jpg,A man is standing in front of a city skyline. He is wearing a white shirt and a black tie. He has glasses on and is holding a tablet in his hands. The sky behind him is orange and yellow. There are tall buildings in front the man. 
027.jpg,A man is standing in a field of yellow flowers. He is wearing a green shirt and a beige hat. There is a small building behind the man. 
028.jpg,There is a man wearing a green shirt and a white hat. There are trees in front of the man. The trees have yellow flowers on them. There is a white sky behind the trees.
029.jpg,There are several people standing in front of a white van. There is a pink sign behind them. There are trees behind the van. 
030.jpg,There are several people standing in front of a white van. There are trees behind them. There is a red sign on the ground behind them with white writing on it. 
031.jpg,There is a red banner on the screen. There are people standing in front of a building. There is a tree behind them. The banner has white writing on it. 
032.jpg,There are several people sitting on the ground. There is a red basket in front of them. They are wearing jackets and pants. 
033.jpg,There is a group of people sitting around a table. There is a basket on the table in front of them. They are all wearing jackets and there is a building behind them. 
034.jpg,There are two girls sitting on the ground. They are wearing red shirts. There is a tree trunk behind them. There are other people standing in front of them. 
035.jpg,There is a red square on the screen. There are people sitting on the ground in front of a white building. There is a person in a yellow shirt standing in the front of the building.
036.jpg,There are people wearing red and yellow outfits. They are standing in a field of grass. There are people standing behind them in front of a building.
037.jpg,A woman is standing in front of a city skyline. She is wearing a white shirt and has short black hair. The woman is holding a tablet in her hands. The sky behind her is orange and yellow. There are tall buildings behind her. 
038.jpg,A woman is standing in front of a city skyline. She is wearing a white blouse and holding a red wallet. The sky is orange and cloudy. There are tall buildings behind the woman. 
039.jpg,A woman is standing in front of a city skyline. She is wearing a white shirt and has a microphone clipped to her shirt. The woman is holding a tablet in her hands. The sky is orange and cloudy. There are tall buildings behind the woman. 
040.jpg,"The image is a screenshot of a video. The background of the video is blue and purple. There is a red bar at the bottom of the screen that says that the video was recorded at 06:33:23. At the top right corner there is a logo that says ""HTV9 HD""."
041.jpg,There is a woman standing in front of a microphone. She is wearing a blue shirt. There is a large bouquet of flowers in the front of her. The woman has dark colored hair. 
042.jpg,There are several people sitting in chairs. There are two tables in front of them with blue tablecloths on them. There is a man in a suit and tie sitting next to another man. 
043.jpg,There are four people standing on a stage. There is a man in a suit standing in front of them. There are two women on either side of him. They are all wearing glasses. 
044.jpg,A man in a gray suit is shaking hands with a woman in a blue shirt. They are standing in front of a red table. There is a blue screen behind them. 
045.jpg,There are people standing on a stage. There is a large blue screen behind them. They are all holding white boxes in their hands. There are two men standing in front of them. 
046.jpg,There are three people standing in front of a blue wall. There is a man in a blue suit standing next to them. There are two women in white dresses standing behind them. 
047.jpg,There are three people standing on a stage. There is a man in a suit standing in front of them. There are two women standing next to them. They are all wearing white dresses. 
048.jpg,There are two women standing next to a man. They are wearing white dresses. The man is wearing a blue suit. There is a blue wall behind them. 
049.jpg,A man and a woman are standing in front of a white table. They are both holding tablets in their hands. The man is wearing a white shirt and a black tie. The woman is dressed in a white blouse and black hair. There are tall buildings behind them. The sky is blue and white. There is writing on the bottom of the screen.
050.jpg,A man and a woman are standing in front of a white table. The man is wearing a white shirt and a black tie. The woman is wearing an all white suit. There are tall buildings behind them. 
051.jpg,There is a man and a woman standing in front of a white table. The man is wearing a white shirt and a black tie. He is holding a tablet in his hands. The woman is standing next to him. There are tall buildings behind them. There is a cloudy sky above them.
052.jpg,A man and a woman are standing in front of a white table. The man is wearing a white shirt and a black tie. The woman is also wearing a long sleeve white shirt. There are tall buildings behind them. The sky is blue with white clouds.
053.jpg,There are several houses on the water. There is a person standing in front of one of the houses. There are clothes hanging on the clothes lines. There trees next to the houses in the water next to them. 
054.jpg,A man is standing in front of a bush. He is wearing a white collared shirt. The bush has many green leaves on it. The man has short black hair. 
055.jpg,There is a small building next to the water. There are people standing in front of the building. There is a blue boat in the water next to them. 
056.jpg,There are several people standing in front of a body of water. They are wearing hats and life jackets. The sky above them is blue. There are trees on the other side of the water. 
057.jpg,A man is standing in front of a bush. He is wearing a white collared shirt. The bush has many green leaves on it. The man has short black hair. 
058.jpg,There are two women sitting on a bench. There is a large green water bottle on a stool next to them. There are bowls on the table in front of them. 
059.jpg,There are two boys standing in front of a building. There is a blue sign hanging on the wall behind them. There are windows on the building. One of the boys is wearing a white shirt and blue pants. 
060.jpg,There is a small girl in a white shirt and blue pants standing in front of a fence. There is a man in a blue jacket and a green hat behind her. There are plants behind the fence. 
061.jpg,A man is wearing a blue uniform and a green hat. He is carrying two orange buckets. There are two little girls in front of him. They are also carrying orange bucket. There is a fence behind them. 
062.jpg,There are two people standing in front of a building. They are wearing orange vests. There are trees behind them. There is a blue sky above them. 
063.jpg,There are people walking down the street. There is a large tree behind them. There are buildings next to the trees. 
064.jpg,A person is standing on a platform. They are wearing flip flops on their feet. There are plants next to the platform. There is a red and white pole next to them. 
065.jpg,There are people sitting on a boat. They are wearing orange life jackets. There is a large boat in the water behind them. There are tires on the side of the boat. 
066.jpg,"The image is a graphic design. The background is red and white. The design is made up of dots. The dots are small and bright red. There is a large number 6 in the middle. The number 6 is outlined in red. The word ""glay"" is written on the number 6. The numbers are outlined in silver. The overall design is bold and eye-catching."
067.jpg,There are three men sitting around a red table. There are red chairs around the table. The man on the left is wearing a white shirt. There is a picture on the wall behind them. 
068.jpg,A man is sitting at a table. He is wearing a white shirt. There is a water bottle on the table in front of him. There are red chairs behind him. 
069.jpg,A large red X is on the ground. There is a white line under the X. There are people on motorcycles on the street. 
070.jpg,A red X is on a black and red background. There is a large white building behind the X. There are white words written on the bottom of the red X. 
071.jpg,A man is wearing a white shirt and a black tie. He is holding a tablet in his hands. There are tall buildings behind the man. There is a cloudy sky above the buildings.
072.jpg,A man is wearing a white shirt and a black tie. He is holding a tablet in his hands. There are tall buildings behind the man. There is a cloudy sky above the buildings.
073.jpg,A man is wearing a white shirt and a black tie. He is holding a tablet in his hands. There are tall buildings behind the man. There is a yellow sky above the buildings.
074.jpg,There are several people standing in a room. There is a man standing in front of a desk wearing a black suit and tie. There are two people sitting at a desk in chairs behind him. 
075.jpg,There are two men standing next to each other. They are both wearing a blue collared shirt. There are other people behind them sitting in chairs. There is a large yellow pole behind them. 
076.jpg,There are several men standing in front of a microphone. They are wearing blue collared shirts and green and red hats on their heads. There is a bald man in the front of the microphone. 
077.jpg,There are people sitting in chairs in a room. There are two columns on the wall behind them. There is a man in a blue shirt standing in front of a white wall. 
078.jpg,There are several men standing in front of a black podium. There is a microphone on the podium. They are wearing blue shirts and pants. There are people sitting in chairs behind them. 
079.jpg,A man is standing in front of a microphone. He is wearing a blue collared shirt. There is a large brown pillar behind the man. The man has short black hair. 
080.jpg,There are several men sitting at a table. There is a large window behind them on the wall. There are books and papers on the table in front of them. 
081.jpg,There are several men in blue uniforms standing in front of a podium. There are several people in green uniforms sitting behind them. There is a red sign hanging from the ceiling above them. 
082.jpg,There are five people sitting at a long table. There is a man standing in front of the table wearing a red suit and holding a paper. There are microphones on the table. 
083.jpg,There are several men in blue uniforms standing in front of a microphone. There are men in green uniforms sitting behind them. There is a man in a blue shirt sitting at a desk. 
084.jpg,There are several men standing in a line. They are all wearing blue shirts. There is a man in a green uniform with a red hat on. 
085.jpg,There are several men standing in front of a desk. There is a woman standing behind the desk wearing a black suit and a red tie. There are two men sitting behind the desks. 
086.jpg,A woman is standing in front of a city skyline. She is wearing a white shirt and has a microphone clipped to her shirt. The woman has short black hair and is holding a tablet in her hands. The sky is orange and cloudy. There are tall buildings behind the woman.
087.jpg,A woman is standing in front of a city skyline. She is wearing a white jacket and has short black hair. The sky is orange and cloudy. There are tall buildings behind the woman. 
088.jpg,Three men are sitting around a red table. There are red chairs around the table. A man in a white shirt is sitting on a red chair. There is a picture on the wall behind the men. 
089.jpg,A man is sitting at a table. He is wearing a white shirt. There is a water bottle on the table in front of him. There are red chairs behind him. 
090.jpg,There are three men sitting around a red table. There are green curtains on the windows behind them. There is a man in a white shirt sitting in front of the table. 
091.jpg,There are three men sitting around a red table. There are green curtains hanging from the window behind them. There is a man in a white shirt sitting in front of the table.
092.jpg,There are three men sitting around a red table. There is a man in a white shirt sitting on a red chair. There are pictures on the wall behind them. 
093.jpg,A man is sitting on a red couch. He is wearing a white shirt. The man has short black hair. There is a green wall behind the man. 
094.jpg,There are two men sitting at a table. The man on the right is wearing a green uniform. He has a red and gold badge on his shirt. He is writing on a piece of paper with a blue pen. The other man has a blue shirt on. There are green curtains on the window behind them. 
095.jpg,A silver and black revolver is laying on a red table. There is a small bullet next to the gun. The handle of the gun is black and the barrel is silver. 
096.jpg,A man is sitting at a table. He is wearing a white shirt. There is a water bottle on the table in front of him. There are red chairs behind him. 
097.jpg,A man is wearing a white shirt and a black tie. He is holding a tablet in his hands. There are tall buildings behind the man. There is a yellow sky above the buildings. 
098.jpg,A man is standing in front of a city skyline. He is wearing a pink and white striped shirt and a black and white tie. He has glasses on and is holding a tablet in his hands. The sky behind him is orange and yellow. There are tall buildings all around him.
099.jpg,A man is standing in front of a city skyline. He is wearing a white shirt and a black tie. He has glasses on and is holding a tablet in his hands. 
100.jpg,There is a man standing in front of a large black object. The man is wearing sunglasses on his eyes. There are trees behind the man. 
101.jpg,A blurry picture is being shown on a television. There is a red and white sign in front of the picture. There are words written on the sign.
102.jpg,A blurry picture is being shown. There is a man in a white shirt standing in front of a counter. There are windows on the side of the man. 
103.jpg,There are two men standing next to each other. They are wearing a white shirt and blue pants. There is a barcode on the bottom left of the image. 
104.jpg,Two men are standing in a room. One of the men is wearing a white shirt and blue pants. The other man is wearing an orange shirt and a red hat. There is a brown wall behind them.
105.jpg,Two men are standing in a room. One of the men is wearing a red hat and a white shirt. There is a large window behind the men. A plant is sitting in front of the window. 
106.jpg,There are two men standing in a room. There is a large window on the wall behind them. The man in front of the window is wearing a white shirt and black pants. 
107.jpg,A woman is standing in front of a city skyline. She is wearing a white shirt and has short black hair. The sky is orange and cloudy. There are tall buildings behind the woman. 
108.jpg,A woman is standing in front of a city skyline. She is wearing a white blazer and has short black hair. The sky is orange and cloudy. There are tall buildings behind the woman. 
109.jpg,A woman is standing in front of a city skyline. She is wearing a white shirt and holding a red object in her hands. The sky is orange and cloudy. There are tall buildings behind the woman. 
110.jpg,A large red X is on the ground. There is a person riding a motorcycle behind the X. There are lights on a pole above the street. 
111.jpg,A red X is on a black background. There is a large white building behind the X. There are cars on the street in front of the building. 
112.jpg,There is a large red X in the middle of the image. The X is large and red. There is a white building behind the X. There are people standing in front of the building. 
113.jpg,This is an image of a building. The building is a two story beige color. There is a small gate in front of the building. There are trees surrounding the gate. The sky above the building is light blue. The trees are green and leafy. The road is black. The sidewalk is made of concrete. The posts on the gate are red and white.
114.jpg,A computer screen is open to a video. There is a large red X in the middle of the screen. There are several buttons on the screen next to the x. 
115.jpg,A screen is displayed on a monitor. There is a picture of a building on the screen. There are words written in a foreign language above the picture of the building. 
116.jpg,A black car has a red and white rooster on the back of it. There is red writing on the side of the car. There are words under the rooster. 
117.jpg,A man is sitting in a chair. He is wearing a black and orange polo shirt. There is a table behind him with a black bag on top of it. 
118.jpg,"A close up of a boy's face is shown in this image. The boy has dark brown eyes and dark brown hair. There are two small eyebrows on the top of his head. There is a watermark in the top right corner of the image that reads ""HTV9 HD 06:41:24"". Below the image the words ""by bay khong nguoi lai"" are written."
119.jpg,A large red X is in the middle of a black and white photo. There is a tall building behind the X. The photo has a white wall on the left side of it.
120.jpg,There are five people sitting at a table. There are large gray lockers behind them. There is a large red X in front of the table. 
121.jpg,There are three men sitting at a table. There is a large gray cabinet behind them. The man on the right is wearing a blue and black polo shirt. 
122.jpg,There are two men standing next to each other. The man on the right is wearing a black hat and a white face mask. He is holding a walkie talkie in his hand. 
123.jpg,A man is wearing a white shirt and a black tie. He is holding a tablet in his hands. There are tall buildings behind the man. There is a yellow sky above the man with clouds.
124.jpg,A man is standing in front of a city skyline. He is wearing a pink striped shirt and a black and white tie. He has glasses on and is holding a tablet in his hands. The sky behind him is orange and yellow. There are tall buildings behind him. 
125.jpg,There is a small building with a large billboard on top of it. There are trees surrounding the building. There is a white guitar leaning against the wall.
126.jpg,There are several men standing in front of a brown gate. There is a large vase with flowers on it next to the men. 
127.jpg,There are several men standing in a room. There is a large vase in front of them. There are pictures hanging on the wall behind them. 
128.jpg,There is a broken vase on the ground. The vase is white and has flowers on it. There is a brick wall behind the vase. 
129.jpg,There is a white object on the ground. There is yellow stuff inside of the white object. The ground under the object is gray. 
130.jpg,There are four men sitting in a room. There are several pots and vases on the floor in front of them. There is a white door in the room. 
131.jpg,There are several pots on the ground. There is a white door behind the pots. There are green plants in front of the pots with large leaves on them.
132.jpg,There are several vases sitting on a table. There is a white wall behind them. The vases are all different colors and shapes. 
133.jpg,There are several ceramic statues on display. There are several elephants on top of each other. There is a blue elephant in the middle. 
134.jpg,There are several ceramic items on the table. There are two large vases that are green in color. There is a brown mug on top of one of the vases. 
135.jpg,There are several vases sitting on a table. There is a white wall behind them with a window on it. The vases are all different colors. 
136.jpg,There are two men standing next to a black car. There are trees behind the men. There is a white license plate on the back of the car. 
137.jpg,A black screen with a red and blue screen on it. There are small white dots on the screen. There is a small red logo on the top right corner. 
138.jpg,"The image is a graphic design. The background is red and white. The design is made up of dots. The dots are small and bright red. There is a big red number 6 in the middle. The number 6 is outlined in silver. The word ""glay"" is written in the center of the number 6. The numbers are outlined in red."
