frame,caption
136.jpg,"The image is of a red car. The car is a hatchback. It is a two-door sedan. It has a black exterior with tinted windows. The tires are black with rubber treads. The hubcaps are silver with the Volkswagen logo in the center. There is a barcode on the bottom left corner of the image that says ""facebook"" and the number ""6:41:24"" on the top right corner. There are water droplets on the ground around the car. "
137.jpg,A man is wearing a green shirt. There are wooden cabinets behind the man. There is a white sign on the door of the cabinet. 
138.jpg,Two hands are cuffed up together. They are wearing silver bracelets on their wrists. There is a white table in front of them. 
139.jpg,There are two people sitting at a table. They are both holding blue pens. There are papers on top of the table. There is a white wall behind them. 
140.jpg,A close up of a man's face is shown. The man has dark brown eyes and dark brown eyebrows. His nose is light brown and his skin is white. There are small white spots on his face. There is a white wall behind the man.
141.jpg,Two men are sitting at a table talking to each other. The man on the left is wearing a green shirt and has short dark hair. He is sitting in a blue chair. The other man is wearing green shirt. He has short black hair. The table is brown and the wall behind them is white. There is a brown cabinet behind the men.
142.jpg,A man is standing in front of a city skyline. He is wearing a long sleeve shirt and a tie. He has glasses on and has short dark hair. The sky behind him is orange and yellow. There are tall buildings behind him. 
143.jpg,A man is standing in front of a city skyline. He is wearing a gray shirt and a tie. He has glasses on and has short black hair. The sky behind him is orange and yellow. There are tall buildings behind him. 
144.jpg,A man is standing in front of a city skyline. He is wearing a long sleeve shirt and a tie. He has glasses on and has short black hair. The sky behind him is orange and yellow.
145.jpg,There are two people walking on the sidewalk. There are trees next to the sidewalk on the street. The sky is dark behind the trees. 
146.jpg,There are several motorcycles parked on the sidewalk next to a building. There are people standing in front of the motorcycles. There is a street next to the sidewalk. 
147.jpg,There are several motorcycles parked in front of a building. There is a large green sign hanging from the side of the building. The sky above the building is dark.
148.jpg,There are several motorcycles parked on the side of the street. There are people standing next to them. There is a tall light pole next to the street on the sidewalk. 
149.jpg,There are two people standing on a sidewalk. There are trees next to the sidewalk. They are wearing black pants and a black jacket. There is a white light pole in front of them.
150.jpg,There are people walking on the sidewalk. There are trees next to the sidewalk with lights on them. There is a man in a black shirt and a red hat on. 
151.jpg,This is an image of a street. The street is dark. There are street lights on the sidewalk. The sidewalk is light gray. There is a motorcycle parked on the side of the street.
152.jpg,There are several motorcycles parked on the sidewalk. There is a street next to the sidewalk with people walking on it. There are tall street lights on the side of the street.
153.jpg,There is a motorcycle on the street. There is a person standing on the sidewalk next to the motorcycle. There are trees next to them. 
154.jpg,This is an image of a street. The street is dark. The sidewalk is light gray. There are people standing on the sidewalk. There is a person sitting on the ground. The person is sitting down. The ground is wet. The building on the right has a green and yellow sign on it. The sign has white letters on them.
155.jpg,Two women are sitting on a red motorcycle. They are both wearing helmets on their heads. There is a man in a white shirt pushing a cart behind them. There are trees on the sidewalk next to the street. 
156.jpg,A man is wearing a gray shirt and a tie. He is holding a tablet in his hands. There are tall buildings behind the man. There is a cloudy sky above the buildings.
157.jpg,A man is wearing a gray shirt and a tie. He is wearing glasses and has short black hair. There are tall buildings behind the man. 
158.jpg,There are people standing in a room. They are wearing yellow vests and face masks. There is a white wall behind them with a purple sign on it. There are tables in front of them with white tables on top of them.
159.jpg,A man is wearing a white face mask. He is holding a syringe in his hand. There is a white wall behind the man. 
160.jpg,A man is wearing a white face mask and a white apron. He is wearing blue gloves on his hands. There is a man in a yellow vest standing behind him. 
161.jpg,Two people are standing in a room. They are wearing white shirts and blue gloves. One of the people is holding a white stick in their hand. There is a plastic bag on the other person's arm.
162.jpg,There are two people standing in front of a machine. They are wearing blue scrubs and have white masks on their faces. There is a person wearing gloves on their hands. They have a head covering on their head. 
163.jpg,A woman with short blonde hair is wearing glasses. She is wearing a black jacket and a striped shirt. There is a large window behind the woman. 
164.jpg,A picture of a woman named Helen Ward. The woman is wearing glasses and has short blonde hair. There is a large window behind the woman. There are many trees and buildings outside of the window. 
165.jpg,There are several people in scrubs standing around a person laying on a stretcher. They are wearing face masks and have blue gloves on their hands. There is a blue curtain behind them. 
166.jpg,There are two people standing in a room. There is a man wearing a white face mask on his face. He is wearing glasses. He has a blue shirt on. 
167.jpg,A person is wearing a blue surgical gown and blue gloves. They are standing next to a hospital bed. There is a yellow hanger hanging from the bed. 
168.jpg,There is a green bag on the table. There is a white pole in front of the bag. There are words written on the bottom of the screen. 
169.jpg,A woman is standing in front of a screen. She is wearing a pink blouse and black pants. She has long dark hair and is holding a red phone in her hands. There is a large screen behind the woman. 
170.jpg,A woman is standing in front of a screen. She is wearing a pink shirt and holding a red phone. There is a picture on the screen next to the woman. 
171.jpg,A woman is standing in front of a television screen. She is wearing a long sleeve purple shirt and black bottoms. She has long dark hair and is holding a red phone in her hands. There is a large screen on the right of the woman. The screen has a black car on it. There are buildings behind the woman on the screen.
172.jpg,There are several people standing in a room. There is a woman sitting on a white chair. There are lights hanging from the ceiling above the room.
173.jpg,There are several people standing in a room. There is a white car parked in front of the wall. There are two people sitting in white chairs. 
174.jpg,There are several people standing in front of a large screen. They are all wearing face masks on their faces. There is a black suitcase on the ground next to them. 
175.jpg,A white robot is on the floor. There are people standing around it. There is a black wall behind the robot. 
176.jpg,"A picture of a car is shown in a foreign language. The car is a dark grey color. There are words written in another language around the car. There is a logo in the top right corner that says ""HTV"" in red."
177.jpg,Afeela Sony Honda Mobility is displayed on the back of a car. The car is black and white. There is a red and white logo in the top right corner of the image. The time is 06:48:31.
178.jpg,An Asian man is shown on a TV screen. He is wearing a black suit and a white collared shirt. His hair is dark brown and he has a slight smile on his face. There is a white car behind him.
179.jpg,There are three large screens hanging on the wall. There is a silver car on the screen. There are two people standing in front of the screens. 
180.jpg,A man is wearing a black suit and a white collared shirt. The man has dark brown hair. There is a white car behind the man. 
181.jpg,There are two robots standing on a wooden floor. There is a white wall behind them. The robot on the left is black and white. The one on the right is green and black. There are black wheels on the robot. 
182.jpg,A picture of a white and black motorcycle. There is a small window on the side of the motorcycle. The motorcycle has a black handlebar on it. 
183.jpg,Two robots are sitting on top of white stairs. The robots are white and have black wheels. They have yellow and red lights on the front of them. There is a gray wall behind the robots. 
184.jpg,A man is wearing a gray shirt and a tie. He is wearing glasses and has short black hair. There are tall buildings behind the man. 
185.jpg,A man is standing in front of a city skyline. He is wearing a gray shirt and a tie. He has glasses on and has short black hair. The sky behind him is orange and yellow. There are tall buildings behind him. 
186.jpg,A man is standing in front of a city skyline. He is wearing a long sleeve shirt and a tie. He has glasses on and has short black hair. The sky behind him is orange and yellow. There are tall buildings behind him. 
187.jpg,The image is of a building with a logo on it. The logo is green and black. The building is made up of gray and black blocks. The sky is blue with white clouds. At the bottom of the image there is text in Vietnamese. The text is written in a foreign language.
188.jpg,"The image is an advertisement for a phone. The phone is black and white. The screen of the phone is white and has a green logo on it. The logo is a stylized letter ""D"" with a circle in the middle. The words ""NVIDIA SÉ SAN XUAT CHIP CANH TRANH VOI INTEL"" are written below the logo. The background of the image is blue."
189.jpg,A computer chip is shown in this image. The chip is black and has various gold and silver components. There is a small rectangular window in the middle of the chip.
190.jpg,"The image is an advertisement for a product. The background is completely black. The product is shown in the middle of the image. It looks like it could be a computer chip. There are red dots on either side of the screen. At the top right corner there is a red logo that says ""HTV9 HD"" in white letters. Below the logo there is red text that reads ""Vietnamese"" and ""Soc Trang: Bat qua tang 3 doi tuong van chuyen trai pho""."
191.jpg,"The image is an advertisement for an electronic device. The device is a smartphone with a white and black screen. The screen says ""NVIDIA"" in bold black letters. There is also a green logo with a stylized letter ""A"" in the middle. The logo is surrounded by a black border. The phone is on top of a blue circuit board."
192.jpg,"A computer monitor is turned on. The screen is black and there are white words on the screen. There is a small logo in the top right corner of the screen that says ""HTV HD""."
193.jpg,There is a woman sitting in front of several computer monitors. The woman is wearing glasses and has long black hair. There is a man behind her wearing a black suit. 
194.jpg,A man is sitting in front of a large computer monitor. He is wearing headphones on his head and glasses on his face. The monitor is turned on and there are several screens on the screen. There are words written in different languages on the screens.
195.jpg,A man and a woman are sitting at a desk in front of computers. The man is wearing a long sleeve shirt and glasses. He is typing on a laptop. There are several computer monitors on the desk. A water bottle is sitting on top of the desk next to the man. 
196.jpg,A man is sitting at a desk in front of a computer. He is wearing a black shirt and glasses. The computer is turned on and is sitting on top of a wooden desk. There is a black chair next to the desk.
197.jpg,There are people standing in front of computers. There is a man wearing a black shirt and a face mask on his face. There are blue walls behind them.
198.jpg,A computer monitor is turned on. There is a colorful image on the screen. There are words written in front of the screen in a foreign language. 
199.jpg,A blue and orange shoe is on the ground. There are yellow flowers behind the shoe. The shoe has orange laces on it. 
200.jpg,This is a video game. There is a blue shoe with orange laces on it. There are yellow flowers next to the shoe. 
201.jpg,There are two people standing in front of a row of televisions. They are wearing headphones on their head. There are four televisions on the wall behind them. There is a blue light on the ceiling above them. 
202.jpg,A woman is standing in front of a screen. She is wearing a long sleeve shirt and holding a red book in her hands. There is a picture on the screen next to the woman. 
203.jpg,There is a woman wearing a pink shirt. She is holding a red phone in her hand. There is a picture next to the woman that shows people taking pictures with their phones. 
204.jpg,There are several statues of women in a room. One of the women is wearing a pink robe and is sitting on the ground. There is a woman in a red dress standing next to them. 
205.jpg,A woman is standing in front of a cityscape. She is wearing a long sleeve shirt and a black skirt. She has long dark hair. The woman is holding a red object in her hands. There is a large screen next to the woman. The screen has a city on it. 
206.jpg,This is a picture of the United States of America. There is a man standing at a podium in front of an American flag. There are several people sitting in chairs behind the podium. There appears to be a large crowd of people standing around the room. 
207.jpg,This is a picture of the United States of America. There is a large American flag hanging on the wall behind a podium. There are several people sitting in chairs in front of the podium. 
208.jpg,A picture of a large room filled with people. There is a large American flag hanging on the wall. There are several people standing in front of a desk. 
209.jpg,Two men are kissing in front of an American flag. Both men are wearing suits. There is a wooden desk in between them with a microphone on it. There are papers on top of the desk. 
210.jpg,There is a man standing behind a podium with an American flag behind him. He is wearing a suit and tie. There are people sitting in chairs in front of him. There is a woman standing behind him wearing a black jacket and a red tie. 
211.jpg,There is a man standing behind a podium with an American flag behind him. He is wearing a suit and tie. There are people sitting in chairs in front of him. 
212.jpg,This is a scene from a TV show. There are several people sitting in a room. There is a man in a suit sitting at a desk in front of an american flag. 
213.jpg,A woman is standing in front of a screen. She is wearing a long sleeve shirt and holding a red phone in her hands. There is a large picture on the screen behind the woman. 
214.jpg,A large round table is surrounded by blue chairs. There are people sitting in front of the table. They are all wearing suits. 
215.jpg,A large group of people are sitting in a room. They are all wearing suits and ties. There is a large wooden desk in front of them with microphones on top of it. There are several people sitting in chairs in the room. 
216.jpg,A large round table is surrounded by blue chairs. There are people sitting in front of the table. There is a large painting on the wall behind the table and chairs. 
217.jpg,A large round table is surrounded by blue chairs. There are people sitting in chairs around the table. There is a large painting on the wall behind the table and a door on the side of the room. 
218.jpg,A bald man in a blue suit and tie is sitting at a wooden table. There is a microphone in front of him and a sign on the table that says Russian Federation. There are people behind him sitting in chairs. 
219.jpg,A bald man in a blue suit and tie is sitting at a table. There is a microphone in front of him. There are people behind him sitting in chairs. 
220.jpg,There is a large mountain behind a small town. There are trees in front of the mountain. There is a cloud of smoke coming off the top of the hill. 
221.jpg,This is an image of a field. The field is made up of dirt. The dirt is light brown. There are trees in the field that are green. The trees have small trunks. The sky above the field is light blue. There is a red and white logo in the top right corner of the image. The logo has letters and numbers on it.
222.jpg,A large hill is covered in dirt and rocks. There are trees on the other side of the hill. There is a white building in the distance. 
223.jpg,There is a large hill with dirt on it. There are trees in the distance behind the hill. There is a cloud of smoke coming off of the ground. 
224.jpg,A man is standing on top of a military tank. The tank is tan in color. There is a large gun mounted on the top of the tank. Next to the gun is a helmet. The man is wearing glasses. There are trees behind the man. 
225.jpg,Two men are sitting on top of a military tank. They are both wearing helmets and protective gear. One of the men is holding a large machine gun. The sky above them is blue. There is a tree behind the men.
226.jpg,A military tank is parked on the street. It has a long gun on top of it. There is a white fence next to the tank. There are trees behind the fence. 
227.jpg,A rocket is being launched into the sky. There is a bright white cloud of smoke coming from the bottom of the rocket. The sky is blue and there are no clouds in sight.
228.jpg,A white contrail is in the sky. The sky is a bright blue color. There is some writing in the top left corner of the picture. The writing is in a foreign language.
229.jpg,A woman is standing in front of a large screen. She is wearing a short sleeve shirt and a black skirt. There is a red carpet on the floor in the front of her. There are large buildings on the screen behind her. 
230.jpg,A man and a woman are standing in front of a news desk. The desk is white and has a red logo on it. The man is wearing a gray shirt and a tie. The woman has long black hair and a pink shirt. There is a large screen behind them. There are tall buildings on the screen.
231.jpg,A man and a woman are standing in front of a desk. They are both dressed in business attire. The desk is white and has a red logo on it. There is a large screen behind them that shows a city skyline. 
