frame,caption
273.jpg,There is a building on fire. There is a large cloud of black smoke coming out of the building. There are power lines above the building and a white umbrella is on the ground in front of it. 
274.jpg,There is a large black cloud of smoke coming from a building. There is a person standing in front of the building wearing a yellow backpack. There are trash on the ground around them.
275.jpg,There is a large black cloud of smoke coming from a building. There is a black van on the street in front of the building. A person is riding on a motorcycle in the street. 
276.jpg,There is a building on fire. There is black smoke coming out of the building. There are power lines above the street. A person is standing on a motorcycle in front of a pile of trash. 
277.jpg,Two people are standing behind a white table. There is a large screen behind them with a city on it. The man is wearing a blue shirt and a pink tie. 
278.jpg,Two people are standing behind a white table. There is a large screen behind them with a city on it. The man is wearing a blue shirt and a pink tie. 
279.jpg,Two men are standing in front of a large screen. There is a red carpet on the floor under them. The man in front is wearing a blue shirt and tie. 
