frame,caption
137.jpg,A man is standing in front of a city skyline. He is wearing a blue collared shirt and a tie. The sky is orange and red. There are tall buildings in the skyline.
138.jpg,A man is standing in front of a city skyline. He is wearing a blue collared shirt and a tie. The sky is orange and red. There are tall buildings in the skyline.
139.jpg,There are two children standing in front of a Christmas tree. The tree is decorated with silver and white ornaments. There is a white shelf next to the tree. 
140.jpg,A yellow airplane is behind a chain link fence. There is a white building behind the fence. 
141.jpg,The building is white in color. There are many windows on the side of the building. There is a red banner in front of the white building. The banner has white writing on it. 
142.jpg,A yellow cord is attached to a clear plastic bag. There is a white tag on the bag. The tag has a red and white striped design on it. 
143.jpg,There is a large yellow airplane on the ground. There are large white pillars in front of the airplane. There is a man sitting in front a desk wearing a black shirt.
144.jpg,A woman is sitting on a couch. She has long blonde hair and is wearing a gray shirt. There is a boy sitting next to her on the couch. There are pillows on the back of the couch next to the woman. 
145.jpg,A woman is sitting on a couch. She has long blonde hair and is wearing a gray shirt. A boy is sitting next to her on the couch. There is a pillow behind them. 
146.jpg,A yellow airplane is on the ground. There is black writing on the side of the airplane. There are two large engines on the plane. 
147.jpg,There are large black signs hanging on the wall. There is a picture hanging on a wall next to the signs. 
148.jpg,There is a large yellow airplane on the ground. There is a silver fence in front of the airplane. There are windows on the side of the plane. 
149.jpg,The building is white. There are many windows on the building. The sun is shining through the windows. The sky is partly cloudy. The clouds are white. The bottom of the building is yellow. There is some writing on the bottom left of the picture. The writing is in a foreign language.
150.jpg,A yellow airplane is flying in the sky. There is black writing on the side of the plane. There are two large engines on the bottom of the airplane. 
151.jpg,A yellow airplane is on the ground. There is black writing on the side of the airplane. There are two large engines on the plane. 
152.jpg,A woman is standing in front of a red and orange background. She is wearing a white blouse with ruffles on the shoulders. She has dark hair and is holding a red phone in her hands. There is a large white screen behind the woman.
153.jpg,A woman is standing in front of a red background. She is wearing a white blouse with ruffles on the shoulders. She has short black hair and is holding a red purse in her hands. There is a picture on the right of the woman that is behind a yellow tape.
154.jpg,There is a white van that has a large white sheet covering the back of it. There is a yellow tape around the van. There are people standing in front of the white van. 
155.jpg,There are two police officers standing behind a yellow tape. They are wearing black jackets and black pants. There is a large white vehicle behind them. They have a black helmet on top of them. 
156.jpg,A black SUV is parked next to a white car. There is a man in a blue shirt standing in front of the car. The door is open and a person is sticking their hand in the door. 
157.jpg,There is a man in a black suit standing in front of a white and blue bus. The man has short black hair and is wearing a white collared shirt. There is grass behind the man and the bus. 
158.jpg,Three men are standing outside of a building. They are all dressed in business attire. One of the men is holding a camera in his hand. The building has large glass doors and a tall white pole in front of it. There is a yellow tape around the entrance of the building. A large pot with yellow flowers is sitting on the sidewalk next to the men.
159.jpg,There are three men standing in front of a glass wall. The man in the middle is wearing a black suit and a white shirt. He is looking down at something in his hand. There is another man in a gray suit standing next to him. 
160.jpg,There are four people standing together. They are all wearing black tuxedos with white shirts and black bow ties. There is a woman in a black dress standing next to them. 
161.jpg,A man is smiling and waving his hand. He is wearing a white and black striped suit. There is a large window behind the man. 
162.jpg,A man is standing in front of a crowd. He is wearing a white shirt and a striped jacket. The man has short black hair and is smiling. There are words written on the bottom of the image.
163.jpg,A man is standing in front of a city skyline. He is wearing a blue collared shirt and a gray tie. The sky is orange and there are tall buildings in the background. The man has short black hair.
164.jpg,A man is standing in front of a city skyline. He is wearing a blue collared shirt and a tie. The sky is orange and red. There are tall buildings in the skyline.
165.jpg,A man is standing in front of a city skyline. He is wearing a blue collared shirt and a tie. The sky is orange and red. There are tall buildings all around the man.
166.jpg,There are people standing on a stage. There are people sitting in front of them. There is trees behind them on the other side of the stage. 
167.jpg,A crowd of people are watching a performance. There is a man in a white jacket and a white hat on the stage. There are trees behind the crowd. 
168.jpg,A man in a yellow suit is dancing in front of a crowd of people. The man is wearing a red and white mask on his head. There is a white wall behind the crowd. 
169.jpg,There are people standing in front of a crowd. There is a man in a white shirt and two people in red shirts are dancing. There are trees behind them. 
170.jpg,There are people standing in front of a crowd. There is a man in a red shirt and jeans standing up. There are trees behind them. 
171.jpg,A large crowd of people are standing in a field. They are all wearing hats and jackets. There is a blue fence in front of the crowd. The sky above the crowd is filled with white clouds.
172.jpg,There is a large crowd of people standing in front of a blue structure. There is a man in a plaid shirt with a large white hat on his head. 
173.jpg,A large crowd of people are standing in a field. There are umbrellas hanging from the roof of the crowd. There is a man in a blue jacket walking across the field. 
174.jpg,There are people standing in a field. There are many people sitting in front of them. There is a man in a brown jacket walking towards the people. 
175.jpg,There is a large crowd of people standing in a street. There is a white and red truck behind the crowd. There are buildings next to the street.
176.jpg,A woman is standing in front of a red and orange background. She is wearing a white blouse with ruffles on the shoulders. She has dark hair and is holding a brown wallet in her hands. There is a large white screen behind the woman. The screen has a red logo on it.
177.jpg,A woman is standing in front of a red background. She is wearing a white blouse with ruffles on the shoulders. She has short black hair and is holding a tablet in her hands. There is a picture of a person in the water next to her.
178.jpg,There is a woman standing in front of a red background. She is wearing a white blouse with ruffles on the shoulders. She has dark hair and is smiling. There is a picture on the screen next to the woman. 
179.jpg,There is a large ship in the water. The water is calm and has small waves in it. The sky above the ship is white. There is a red and white sign in front of the ship.
180.jpg,There is a large pile of rocks on the ground. There are small pieces of white and black rocks in the pile. There is a black hole in the ground next to the rocks.
181.jpg,There is a large pile of rocks on the ground. There is a red arrow pointing to the rocks. There are small white rocks in the pile.
182.jpg,A man is standing inside of a control room of a ship. He is wearing a long sleeve black shirt and dark bottoms. The room has large windows that let in lots of light. There is a large desk in front of the man with many computer monitors on top of it. A large black chair is sitting behind the man. Part of a white door can be seen behind the chair.
183.jpg,A man is sitting in a black chair. He is wearing a black jacket and a white collared shirt. There is a desk behind him with a computer on top of it. 
184.jpg,There are several small red boats in the water. There are small waves in front of the boats. There is a white sky above the water with clouds in it.
185.jpg,There are people in the water. They are wearing red wetsuits. They have black boots on their feet. There is water splashing around them. 
186.jpg,There are people in the water. They are wearing red life jackets. There is a blue pole in front of them. The water is choppy and there are small waves in it.
187.jpg,A woman is standing inside of a vehicle. She is wearing a red jacket and a black shirt. There are large windows on the wall behind her. The woman has blonde hair. 
188.jpg,There are several rows of orange life jackets hanging on a rack. There are people standing in front of the row of life jackets. There is a man in a red jacket standing next to them. 
189.jpg,There are several orange life jackets lined up against a wall. There are people standing in front of them. There is a man in a red jacket standing next to them. 
190.jpg,"There are people in the water. The water is calm. The sky is partly cloudy. The sun is going down. The people are laying down. They are wearing life jackets. The life jackets are bright red. They have black boots on them. There is a watermark in the top right corner of the photo that says ""HTV7 HD 18:43:26""."
191.jpg,There is a white and red boat in the water. There are people standing on the deck of the boat. They are wearing red clothes. 
192.jpg,There is a large white and red boat on the water. There are small waves in the water in front of the boat. The sky above the boat is gray.
193.jpg,There is a large white and red boat in the water. There are people standing on the deck of the boat. There is a flag hanging from the pole on the side of the ship. 
194.jpg,On the left side of the screen is a solid black color. On the right side is a red and black screen. The screen has small white dots on it.
195.jpg,A man is standing in front of a city skyline. He is wearing a blue collared shirt and a tie. The sky is orange and red. There are tall buildings all around the man.
196.jpg,A man is standing in front of a city skyline. He is wearing a blue shirt and a tie. The sky is orange and red. There are tall buildings in the skyline. 
197.jpg,There are several cars and motorcycles on the street. There is a tall white building behind them. There are trees in front of the building. 
198.jpg,There is a large white building with many windows on it. There are trees in front of the building. There is a red and white sign on the bottom of the screen.
199.jpg,A man in a blue shirt and gray pants is wearing a face mask. There is a white van behind him. There are bushes in front of the van. 
200.jpg,There are people walking on the sidewalk. There is a red car parked on the street in front of a building. There are trees and bushes next to the building. 
201.jpg,There is a silver car parked in front of a building. There is a red car behind the car. There are people standing outside of the building. 
202.jpg,There are several motorcycles on the street. There is a man in a green shirt standing in front of them. There are several people on the motorcycles wearing helmets. 
203.jpg,There are several cars parked on the street. There is a white van behind the cars. There are trees in front of the building. 
204.jpg,There is a tall white building in the middle of the street. There are cars and trucks on the street in front of the building. There is a large tree on the right side of the picture. 
205.jpg,A woman is standing in front of a red background. She is wearing a white blouse with ruffles on the shoulders. She has dark hair and is holding a red object in her hands. There is a large picture on the right of the woman. The picture has a city skyline on it and the sun is shining down on the buildings.
206.jpg,A woman is wearing a white blouse with ruffles on the shoulders. She is holding a red phone in her hands. There is a large screen behind the woman. 
207.jpg,A man is standing next to a car trunk. He is wearing a blue shirt and gray pants. There are shirts hanging on a rack behind the man. There is a white van on the street behind the car. 
208.jpg,There are three men standing in front of boxes. The boxes are stacked on top of each other. The men are wearing green uniforms. They are holding rifles in their hands. The man in the middle is wearing a blue shirt. 
209.jpg,A bunch of packages are stacked on top of each other. The packages are colorful. There is a gate behind the packages. The gate is made of metal. There are white chairs behind the gate. The ground under the packages is gray.
210.jpg,There are several packages stacked on top of each other. The packages are colorful and have writing on them. There is a bar code on the front of the packages. 
211.jpg,A bunch of packages are stacked on top of each other. The packages are colorful and have writing on them. There is a white tag on one of the packages. 
212.jpg,There are several boxes stacked on top of each other. There is a fence behind the boxes. The boxes are purple and yellow. 
213.jpg,There are boxes in a white box. There are two red boxes in front of them. There is a yellow sticker on one of the boxes. 
214.jpg,"There are boxes in a box. The boxes are wrapped in wrapping paper. The wrapping paper is pink, blue, and white. There is a yellow sticker on one of the boxes. The box is made of cardboard."
215.jpg,There is a large cardboard box on the ground. There are two small boxes in the box. There is a red logo on the side of the box that says chupa chips.
216.jpg,A woman is standing in front of a red background. She is wearing a white blouse with ruffles on the shoulders. The woman has dark hair and is holding a red folder in her hands. There is a large screen behind the woman with a picture of a city on it.
217.jpg,A woman is standing in front of a red background. She is wearing a white blouse with ruffles on the shoulders. She has short black hair and is holding a red wallet in her hands. There is a picture on the right of the woman. The picture has a city skyline on it and the sun is shining down on the buildings.
218.jpg,A woman is standing in front of a red background. She is wearing a white blouse with ruffles on the shoulders. The woman has dark hair and is holding a red purse in her hands. There is a large picture on the right of the woman. The picture is of a city with tall buildings and a bright yellow sky.
219.jpg,There is a tall tower with many wires attached to it. There is a person standing on the top of the tower. The sky behind the tower is gray.
220.jpg,There is a black and white picture of a tower. There is a person standing on the top of the tower. The sky above the tower is gray. There are wires hanging from the tower above the person.
221.jpg,There are two tall towers with wires attached to them. There is a red circle on the top of one of the towers. There are clouds in the sky above them.
222.jpg,A picture of a man standing on top of a tower. There is a red circle around the picture of the man. There are wires surrounding the tower. 
223.jpg,This is a black and white image of a tower. The tower has many wires attached to it. There is a person standing on the top of the tower. 
224.jpg,There is a black and white picture of a tower. There are wires coming off of the top of the tower. The sky behind the tower is gray. There is a red and white logo on the top right of the picture.
225.jpg,"The image is a screenshot of a video. The background of the video is white. The time is 18:50:42. There is a red logo in the top right corner that says ""HTV7 HD"". Below the logo there is red text that says, ""Nguy 27/12, vang SJC ve muc 79, 2 trieu dong/nguoi""."
226.jpg,This is a black and white image. There is a large tower with many wires attached to it. The wires are all different colors. The tower is made up of metal. There are wires hanging from the top of the tower.
227.jpg,The sky is gray and cloudy. There is a tower to the left of the image. The tower is made up of metal. The metal is black. There are lines in the sky. The wires are attached to the tower. The time on the image is 18:50:51.
228.jpg,There is a tall tower with many wires attached to it. There is a person standing on the top of the tower. The sky behind the tower is gray. 
229.jpg,A woman is standing in front of a colorful background. She is wearing a white blouse with ruffles on the shoulders and brown bottoms. She has dark hair and is holding a red tablet in her hands. Next to the woman is a large screen. On the screen is a picture of a city. There is a red and yellow logo on the screen.
230.jpg,A woman is standing in front of a colorful background. She is wearing a white blouse with ruffles on the shoulders and brown bottoms. She has dark hair and is holding a red purse in her hands. There is a large picture on the right of the woman. The picture has a red and yellow logo on it.
231.jpg,A woman is standing in front of a colorful background. She is wearing a white blouse with ruffles on the shoulders and brown bottoms. She has short dark hair and is holding a red purse in her hands. There is a large picture on the right of the woman. The picture has red and yellow writing on it.
232.jpg,A man in a black shirt is standing in front of a white boat. There is a blue boat on the boat. The man has short white hair. 
233.jpg,There is a large white boat on the water. There is a blue boat attached to the boat. There are clouds in the sky. 
234.jpg,There is a large white object on the ground. There are wires hanging from the top of the object. There is a red and white sign on the bottom of the image.
235.jpg,There is a large white object on the ground. There are trees behind the object. There is a red fence in front of the building. 
236.jpg,There is a large white boat in the water. There are wires hanging from the boat. There is a blue tarp on the boat in front of it. 
237.jpg,A white truck is parked on the side of a road. There is a large tree that has fallen across the road in front of the truck. There are several trees surrounding the truck on the other side of the road. 
238.jpg,A large tree has fallen down in a yard. There is a blue truck parked in front of a fence. There are trees behind the fence. 
239.jpg,A large tree has fallen down on a lawn. There is a blue truck parked in front of a house. There are many trees behind the truck. 
240.jpg,An aerial view of a residential area. There is a white car parked on the street. There are several trees surrounding the house. 
241.jpg,An aerial view of a house is shown. The house is red and white. There are several trees surrounding the house. There is a red logo on the top right corner of the image.
242.jpg,A large white structure is behind a fence. There is a black pole in front of the structure. There are words written on the bottom of the picture. 
243.jpg,There is a piece of aluminum foil on the ground. There is a brown object on the foil. There are wires above the silver foil. 
244.jpg,The roof of a building is falling apart. The roof is made of metal. The sky is partly cloudy. There are words written on the bottom of the picture.
245.jpg,"The image is a screenshot from a video. There is a large metal structure. The structure appears to be a building. The metal structure is gray in color. There are metal bars sticking out of the side of the structure. A piece of silver foil is sticking out from the metal. The image also has a watermark in the top right corner that reads ""HTV7 HD 18:58:19""."
246.jpg,The image is a picture of a building. The roof of the building is covered with a silver tarp. There is a hole in the roof. The sky is blue with white clouds in it. There are trees surrounding the building.
247.jpg,This is an image of a yard. The yard has a fence. The fence is made up of metal. The metal is gray. There are tall palm trees in the yard. There is a small house by the trees. The house has a gray roof. The grass is green and short. The photo was taken in the day time. The time is 18:58.
248.jpg,There are several boats on the ground. There is a blue boat in front of a white boat. There are clouds in the sky above the boats. 
249.jpg,Three men are standing next to a white truck. There is a chain link fence in front of the truck. The men are wearing hats on their heads. 
250.jpg,There is a large white wall next to a parking lot. There is a white and orange cone on the ground in front of the wall. There are palm trees on the side of the building.
251.jpg,There is a large white sign on the side of a building. The sign has black and red writing on it. There are white clouds in the sky behind the sign.
252.jpg,A woman is standing in front of a large screen. She is wearing a brown skirt and a beige jacket. There is a red rug under the woman. There are large buildings on the screen. 
253.jpg,A man and a woman are standing behind a news desk. The desk is white and has a red logo on it. There is a large screen behind them. There are buildings on the screen. 
254.jpg,A man and a woman are standing behind a news desk. The desk is white and has a red logo on it. The man is wearing a blue shirt and a tie. The woman is also wearing a white blouse. There is a large screen behind them. There are many buildings on the screen. 
