frame,caption
134.jpg,A woman is standing in front of a red background. She is wearing a pink shirt and black pants. She has short brown hair. There is a picture next to her that is of a large cargo ship.
135.jpg,A woman is wearing a white shirt and black pants. She is holding a red book in her hands. There is a large ship in the water next to the woman. 
136.jpg,There are two large black boats in the water. There is a large metal bridge above the boats. There are clouds in the sky above the boat.
137.jpg,"A cartoon image of the Atlantic Ocean and Gatun Lake. There is a boat on the left side of the image. The boat has a lot of colorful containers on it. The water is blue and calm. The land is green and brown. There are two gates in the image that say ""Lock"" and ""Lock""."
138.jpg,A cartoon image of a body of water. There is a small island in the middle of the water with a boat on it. There are several poles sticking out of the ground next to the water. 
139.jpg,A cartoon image of a boat in the water. There is a large body of water next to the boat. There are large green hills behind the water with a small lake in front of it. 
140.jpg,A cartoon picture of a boat in the water. There is a large mountain behind the boat. There are words written on the bottom of the picture. 
141.jpg,There is a large red ship in the water. There are many containers on the side of the ship. There is a hill behind the ship with trees on it. 
142.jpg,There is a large red ship in the water. There is a small white building next to the ship. There are trees on a hill behind the boat. 
143.jpg,"There is a large body of water. There are many containers stacked on top of each other. The containers are red, blue, and orange. There is grass on the other side of the water. "
144.jpg,A picture of a train on a bridge. The train is red and white. There are mountains behind the bridge. There is a blue sky above the train. 
145.jpg,This is an aerial view of a city. There is a long bridge crossing over a body of water. There are several buildings on the other side of the bridge. A large green and blue train is on the road. 
146.jpg,A large cargo ship is docked at a port. The ship is black and has many red shipping containers on it. There is a white building on the side of the ship. 
147.jpg,A woman in a pink shirt is standing in front of a red background. She is holding a book in her hands. There is a white church on the screen behind her. 
148.jpg,A woman in a pink shirt and black skirt is standing in front of a red background. She is holding a clipboard in her hands. There is a picture on the wall behind her. 
149.jpg,This is an image of a church. The church is white. The roof is also white. There is a steeple on the top of the building. The steeple has a bell at the top. The door is closed. There are two cross on the front of the church. One cross is black and the other is a dark color. The cross is lit up with white lights. The ground is covered in snow.
150.jpg,There are several trees in front of a white building. There is snow on the ground around the trees. The sky is white and cloudy.
151.jpg,There is a white house in the distance. There are trees in front of the house with no leaves on them. There is a window on the side of the building. 
152.jpg,This is a picture of a neighborhood. The ground is covered in snow. The snow is white. There is a house in the background. The house is light gray. There are large windows on the front of the house. The windows are dark gray. The roof on the house is covered with snow. There trees surrounding the houses. The sky above the houses is gray.
153.jpg,There is a sign that says Midwest Tree Nursery. The sign is yellow and black. There is an American flag on a pole behind the sign. There are trees in front of the sign with no leaves on them.
154.jpg,There is a large tree in the middle of a field. There is snow on the ground around the tree. There are several trees in front of the tree with no leaves on them. 
155.jpg,This is an image of a street. The street is covered in snow. The snow is white. There is a flag on the pole. The flag is red white and blue. The pole is black. The sky is very cloudy and gray. There are trees on the side of the road. The tree has no leaves on it. The house is small and white.
156.jpg,A woman is standing in front of a red and orange background. She is wearing a white shirt and black pants. She has short brown hair and is holding a red wallet in her hands. There is a large white screen behind the woman.
157.jpg,A woman is standing in front of a red background. She is wearing a white shirt and black pants. She has short brown hair. There is a picture on the right of the woman. 
158.jpg,There are several fish hanging from a silver pole. They are wrapped in red ribbons. There is a person standing in front of the pole. 
159.jpg,This is a screenshot from a video game. It shows a person wearing a black glove on their hand. They are standing in front of a brown table. There is a white cloth on top of the table. 
160.jpg,There is a blue table with a white sign on it. There is a picture of a fish on top of the sign. There are chinese writing on the sign under the picture. 
161.jpg,There is a large shark in the water. The water is blue and there is a white pipe sticking out of the side of the pool. There is water splashing around the shark.
162.jpg,There are two people standing in front of a building. They are wearing white fur hats. The people are holding white cups. There is snow on the ground around them. 
163.jpg,A man is standing in front of a city skyline. He is wearing a blue shirt and a pink tie. He has glasses on and is smiling. There is a red sky behind the man.
164.jpg,A man is standing in front of a city skyline. He is wearing a blue shirt and a pink tie. He has glasses on and is holding a tablet in his hands. There is a red sky behind the man. 
165.jpg,A man is standing in front of a city skyline. He is wearing a blue shirt and a pink tie. He has glasses on and is holding a red phone in his hands. The sky is orange and pink. There are tall buildings in the background.
166.jpg,This is an aerial view of an area. The area looks like a large hole. There is a small building in the middle of the hole. The building is blue and red. There are small white dots on the ground.
167.jpg,There are several people standing in a line. They are all wearing red robes. There is a white sky behind them. They have long black hair. 
168.jpg,There are several people standing in a line. They are all wearing red robes and black clothes. There is a blue sky behind them. They have long black hair. 
169.jpg,A large group of people are standing in a field. They are all wearing red clothes. There is a fence in front of them. There are blue buildings behind them. 
170.jpg,There are several women standing together. They are wearing colorful clothes and jewelry on their necks. There is a blue sky behind them. 
171.jpg,There are several women standing together. They are wearing red and gold necklaces and garlands around their necks. There is a blue sky behind them. 
172.jpg,A large crowd of people are standing on a beach. They are all wearing red shirts. There is a blue structure in the distance with a yellow flag on top of it. The sky above the crowd is blue.
173.jpg,There are several people standing in front of a large crowd. They are all wearing red and green outfits. There is a microphone next to them. 
174.jpg,There are people standing in a field. They are all wearing red clothes. There is a blue building in the middle of the field. There are flags on top of the building. 
175.jpg,"The image is a graphic design. The background is red and white. There are dots on the red background. There is a diagonal white and black striped pattern. The number 6 is in the center of the image. The numbers 6 and 6 are red and silver. The word ""giay"" is written in the middle of the red and gray letters. The date and time are 18:43:44."
176.jpg,Many boxes are stacked up in a room. The boxes are beige in color and have black and white writing on them. There is a white floor under the boxes. There are lights on the ceiling in the room. 
177.jpg,A picture of a room filled with boxes. The boxes are all stacked up. There are lights on the ceiling in the room. There is a red sign on the front of the picture. 
178.jpg,The image is of a room that has a fire inside of it. There is a metal gate in the middle of the room. There are shelves on the right side of the gate. On the left side there is a wooden table with a pink pot on top of it and a few other items on the table. The room has white curtains hanging from the window.
179.jpg,A picture of a building that has been destroyed. There is a white and pink tape in front of the building. There are several blue buckets on the ground in the room. 
180.jpg,A bright red light is shining on a white wall. There are two long red stripes on the wall. The red light has small white dots on it. There is a large red circle behind it. 
181.jpg,A man is standing in front of a cityscape. He is wearing a blue shirt and a pink tie. He has glasses on and is holding a red object in his hands. The sky is orange and there are buildings in the background.
182.jpg,A man is standing in front of a city skyline. He is wearing a blue shirt and a pink tie. He has glasses on and is holding a tablet in his hands. The sky is orange and pink. There are tall buildings in the background.
183.jpg,A woman is standing in a room. She is wearing a red shirt and pants. There is another woman standing behind her wearing a green shirt. There are boxes and shelves behind the woman. 
184.jpg,This is an image from a news channel. The channel is htv7 HD. The time is 18:45:24. The image is blurry. There are boxes stacked on top of each other. The boxes are gray and red. There is a white wall behind the boxes. The text on the image is in Vietnamese.
185.jpg,There is a large pile of white bags. There is a wooden crate behind the bags. The photo is black and white. 
186.jpg,There is a large pile of white bags. There is a red machine behind the bags. The bags are piled up in a pile. 
187.jpg,There is a white scooter parked in front of a pile of bags. There are brown boxes next to the scooter. There is a silver pole in the front of the motorcycle. 
188.jpg,A picture of a wheel on top of some boxes. There is a ladder next to the wheel. There are many boxes under the ladder. 
189.jpg,There are two men sitting at a table. There is a white truck behind them. There are boxes in the back of the truck. The men are wearing blue shirts. 
190.jpg,There are several boxes stacked on top of each other. There is a brown cardboard box on the top of the pile. There are black and silver items in a white box in front of the boxes. 
191.jpg,A woman is standing in front of a red and orange background. She is wearing a white shirt and black pants. She has short black hair and is holding a red folder in her hands. There is a large picture on the right of the woman.
192.jpg,A woman is standing in front of a red background. She is wearing a white shirt and black pants. She has short black hair. There is a large picture on the right of the woman.
193.jpg,There are cars parked on the street in front of a white building. There are two trees on the side of the street. There is a white van behind the cars. 
194.jpg,Three people are standing in a room with boxes on shelves. They are all wearing face masks. One of the people is wearing a green jacket. The other two people are wearing black jackets. There are large windows on the wall behind the people.
195.jpg,There are many boxes stacked up in a room. There are white lights on the ceiling. There is a person standing in front of the boxes. 
196.jpg,Two men are wearing face masks. They are bending over a white box. There are cardboard boxes behind them. There is a wall next to them. 
197.jpg,There are several brown boxes on the ground. There are white papers in the boxes. There is a barcode on the papers. 
198.jpg,A man is standing in front of a stack of white boxes. The boxes are stacked on top of each other. There are bags of green bags behind the man. The man is wearing a black jacket. 
199.jpg,A picture of a woman is being shown on a video call. The woman is completely naked. She is holding a pink box in her hand. She has long brown hair. There is a white wall behind her. 
200.jpg,A man is standing in front of a stack of white boxes. The boxes are stacked on top of each other. The man is wearing a black jacket. There are green bags behind the man. 
201.jpg,A man and woman are standing in a room. They are both wearing face masks on their faces. The woman is wearing a blue coat and glasses. She is holding a white box in her hands. There are shelves behind them filled with boxes and other items. 
202.jpg,There are many brown boxes on the ground. There is a green table cloth on the table in front of the boxes. There are white papers on the boxes with green laces on them. 
203.jpg,A white receipt is on top of a brown box. There is a black barcode on the receipt. There are green writing on the white paper. 
204.jpg,A woman in a blue uniform is standing in a room full of cardboard boxes. She is wearing a white face mask on her face. The woman is holding a piece of paper in her hands. There is a white box in front of her. 
205.jpg,A man and a woman are wearing face masks. They are sitting in front of boxes that are stacked on top of each other. The woman is writing on a piece of paper. The man is holding a bottle in his hand. 
206.jpg,A man in a blue shirt and a pink tie is standing in front of a city. He is holding a red object in his hands. There are tall buildings behind him. 
207.jpg,A man is wearing a blue shirt and a pink tie. He is holding a red object in his hands. There are tall buildings behind the man. There is a red sky above the buildings.
208.jpg,A picture of a room that has a fire inside of it. There are two metal gates in front of the fire. There is a shelf on the side of the door. 
209.jpg,There is a building in the background. There are wires hanging in front of the building. There is a white sign on the side of one of the wires. 
210.jpg,There are two men standing in front of a building. There is a tree next to the building. The man in the green shirt is wearing a black hat. 
211.jpg,The image is a video of a house in New Delhi. The house is very dirty. There is a green plant in the front of the image. There are dirty dishes on the ground in front of a large blue bucket. The door to the house is open and there is a big window on the side of the house. The time of the video is 18:47:20.
212.jpg,A picture of a building that is on fire. The fire is bright orange and yellow. There is a metal gate in front of the fire. There are white curtains hanging from the side of the building. 
213.jpg,There is a fire burning inside of a building. There is a pile of trash on the ground in front of the fire. There are pillows on top of the trash. 
214.jpg,A picture of a building that has been destroyed. There is a white and pink tape in front of the building. There are two large black gates on the building in the picture. 
215.jpg,The image is a scene from a TV show. It appears to be a house that has been destroyed. There is a lot of rubble and debris on the ground. There are broken metal bars in the room. On the right side of the image there is a metal shelf with dishes on top of it.
216.jpg,The image is a picture of a house. The house is very dirty. There is a red bucket on the right side of the image. There are blue and yellow buckets on the ground in front of the red bucket. The door of the house is open and there is a lot of smoke coming out of the door. The picture has a red and white tape on it.
217.jpg,There is a wooden building with a red flag hanging from the side of it. There are wires above the building. There is a tree in front of the building with branches and leaves on it.
218.jpg,A woman is standing in front of a red background. She is wearing a white shirt and black pants. She has short black hair and is holding a red book in her hands. There is a large picture on the right of the woman.
219.jpg,A woman is standing in front of a red background. She is wearing a white shirt and black pants. She has short black hair. There is a picture on the right of the woman. 
220.jpg,A picture of a building is shown in the dark. There are bright lights coming from the building. There is water on the ground. 
221.jpg,There is a large fire on the ground. The fire is bright orange and yellow. There is a white building in front of the fire. The ground around the fire is black.
222.jpg,There is a man standing on the street. He is wearing a black shirt and black pants. There is smoke coming out of a building behind him. There are people standing in front of the man. 
223.jpg,There is a large fire hydrant spraying water on a building. There are people standing on the sidewalk in front of the building. The sky is dark and there is smoke coming out of the hydrant.
224.jpg,There is a large fire burning inside of a building. The fire is bright orange and yellow. There is smoke coming out of the building. There are people standing in front of the fire.
225.jpg,There is a large fire on a building. There is smoke coming out of the building. The fire is bright red and yellow. There are people standing in front of the fire. 
226.jpg,There is a fire hydrant spraying water on the street. There is a large white cloud of smoke coming out of the hydrant. There are people standing on the sidewalk in front of the fire truck. 
227.jpg,A man is wearing a blue shirt and a pink tie. He is holding a red phone in his hands. There are tall buildings behind him. There is a red sky behind the man.
228.jpg,A man in a blue shirt and a pink tie is standing in front of a city. There are tall buildings behind him. There is a red sky behind the man. 
229.jpg,There are two men standing in front of a bus. The man on the left is wearing a black shirt and a baseball cap. He is also wearing glasses. The bus is black and has several windows on it. It is parked on the side of the street. There are lights on the front of the bus.
230.jpg,There are three men standing on a sidewalk. One of the men is wearing a face mask on his face. There is a man in a black shirt standing in front of him. 
231.jpg,Two men are standing on a sidewalk. There is a white car parked on the street in front of a building. One of the men is wearing a black shirt and blue pants. The other man is kneeling down on the ground. He has a face mask on and is touching the hand of the man kneeling down.
232.jpg,There are three men standing on a sidewalk. One of the men is wearing a black shirt and a black helmet. There is a black bag on the ground in front of them.
233.jpg,There is a man wearing a face mask. He is kneeling down. There is another person standing next to him. They are wearing green pants and black sandals. 
234.jpg,A person is sitting on the ground with a green bag in front of them. They are wearing a black shirt and black pants. There is a white bag on the floor next to them. The person is holding something in their hands. 
235.jpg,There are two people sitting on the ground. There is a green bag in front of them. They are holding a white cloth in their hands. 
236.jpg,A woman is wearing a white shirt and black pants. She is holding a red folder in her hands. There is a large screen behind the woman. 
237.jpg,A woman is wearing a white shirt and black pants. She is holding a red book in her hands. There is a large screen behind the woman. There are buildings on the screen. 
238.jpg,There are several motorcycles driving on the street. There is a large truck behind the motorcycles. There are buildings next to the street behind the truck. 
239.jpg,There are two large trucks on the street. There is a large gray container on the back of the truck. The truck on the left has a black tarp on it. 
240.jpg,There is a large blue truck driving down the street. There is a red and white barricade on the side of the street in front of the truck. There are buildings on both sides of the road. 
241.jpg,A white car has crashed into a yellow truck. The driver of the white car is sitting in the driver seat. There is a piece of plastic in the window of the car. 
242.jpg,There are several large trucks on the street. There is a yellow truck next to a large gray truck. A man in a white shirt is kneeling down in front of the trucks. 
243.jpg,A white car has been hit by a truck. There is a red and white truck next to the white car. There are people on motorcycles behind the car. 
244.jpg,A white car that has crashed into a yellow truck. There is a building behind the car with a green gate on it. 
245.jpg,A white car has been hit by a truck. The front of the car is completely smashed in. The truck is blue and red. There is a building behind the car. 
246.jpg,A man is standing in front of a city skyline. He is wearing a blue shirt and a pink tie. He has black hair and glasses on. There is a red sky behind the man.
247.jpg,A man is standing in front of a cityscape. He is wearing a blue shirt and a pink tie. He has glasses on and is holding a tablet in his hands. 
248.jpg,A man is shown on a TV screen. He is wearing a white collared shirt. The man has short black hair. There is a white refrigerator behind the man. 
249.jpg,Four people are sitting around a table. Two of the people are wearing green shirts. There are red chairs behind the table. There is a white wall behind them. 
250.jpg,A man is wearing a white collared shirt. There is a white wall behind the man. The man has short black hair. 
251.jpg,Four people are sitting around a table. The table has a blue table cloth on it. There are red chairs around the table. There is a white wall behind the people. 
252.jpg,A man is sitting in a chair. He is wearing a brown sweater. There is a red chair in front of him. The man has short black hair. 
253.jpg,Two people in green uniforms are standing in front of a table. There is a white board on the wall behind them. The man and woman are looking at hats on the table. 
254.jpg,A table is covered with a blue and white table cloth. There is a black helmet on top of the table. There are people standing behind the table wearing green uniforms. 
255.jpg,A man in a green shirt is holding a long black stick. There is a blue water bottle behind the man. There are hats on top of a table. 
256.jpg,Two people are sitting at a table. They are both wearing green short sleeve shirts. One person has a pen in their hand and is writing on a piece of paper that is in front of them. There is a blue table cloth on top of the table. 
257.jpg,Three people are sitting around a table. The table has a blue table cloth on it. There is a woman in a green uniform sitting at the table. She is writing on a piece of paper. There are two men sitting in front of her. One of the men is wearing a white shirt. 
258.jpg,A man is standing in front of a screen. He is wearing a blue shirt and a pink tie. The man is holding a red object in his hands. There is a large white screen behind the man. 
259.jpg,A man is standing in front of a television screen. He is wearing a blue shirt and a pink tie. He has glasses on and is holding a red object in his hands. There is a large picture on the screen behind the man.
260.jpg,A man is doing a handstand in front of a barbell. He is wearing red shorts. There is a man in a gray shirt squatting down next to him. 
261.jpg,Two men are wrestling in a ring. The man on the right is wearing red shorts and red shoes. The other man is wearing a gray jacket and black shorts. There are people standing behind them watching the match.
262.jpg,Two men are doing pushups in a gym. Behind them is a barbell with weights on it. There is a large picture of a man in white pants on the wall behind the barbell. In front of the man on the ground is a monitor with the numbers 99 and 00:54:58 on the screen. 
263.jpg,A man is hunched over and looking down. He has very muscular arms and chest. His hair is short and black. He is wearing a white shirt.
264.jpg,There is a man wrestling with another man. They are both wet. There is a television behind them that is turned on. The television has a white screen on it. 
265.jpg,A man is doing a push up on the ground. He is wearing a red shirt and red shoes. There are people standing behind him watching him. There is a bar behind him. 
266.jpg,"A man is standing in front of a black background. He is wearing a black shirt. The man has short dark hair. There is a logo on the top right of the image that says ""HTV7 HD 18:57:53""."
267.jpg,A shirtless man is laying on the ground. He has his arms stretched out to the sides. His eyes are closed and he has a smile on his face. There is a red and white sign in front of the man.
268.jpg,Four men are standing in a room. Two of the men are wearing hoodies on their heads. One of them is holding a framed picture in his hands. Another man is wearing a suit and glasses on his face. There is a camera on a tripod stand in front of them. The walls of the room are black.
269.jpg,A man is bending over on the ground. He is wearing an orange shirt and orange shoes. There is a man crouched down behind him. There are two other men standing behind them. 
270.jpg,A man is standing in front of a large screen. He is wearing a blue shirt and a pink tie. There are large buildings on the screen behind him. 
271.jpg,Two people are standing behind a white table. There is a large screen behind them with a city on it. The man is wearing a blue shirt and a pink tie. 
272.jpg,There is a lot of black smoke coming out of a building. There are people on motorcycles in front of the building. 
