frame,caption
001.jpg,A beautiful sunset over a city. The sky is orange and pink. There are many buildings in the city. There is a large body of water in front of the buildings. 
002.jpg,Two people are standing behind a white table. There is a large screen behind them with a city on it. The man is wearing a blue shirt and a pink tie. 
003.jpg,Two men are standing in front of a large screen. They are both wearing shirts and pants. One of the men is wearing a blue shirt and a pink tie. There is a large city on the screen behind them.
004.jpg,"The image is completely black. On the right side of the image there is a red and white graphic. The graphic has small white dots on it. At the top of the graphic there is white text that reads ""HTV7 HD 18:30:12""."
005.jpg,People are standing in a room. There is a chandelier hanging from the ceiling. There are pillars in front of the people. They are wearing red robes. 
006.jpg,A frame is displayed on a red background. The frame is ornate and has a gold border. There is a white paper inside of the frame. The paper has writing on it.
007.jpg,People are standing inside of a building. There is a blue sign hanging from the ceiling. There are glass cases in front of the people. 
008.jpg,This is an image of a building. The building is white with gray trim. There are large windows on the front of the building. There is a pointed roof on the top. The sky above the building is light blue with white clouds. The road in the image is dark gray with white lines on it. The trees on the right side of the image have no leaves on them.
009.jpg,There are people standing in front of a building. There are blue lights on the wall behind them. There is a person wearing a yellow jacket. 
010.jpg,"The image is a graphic design. The background is red and white. The design is made up of dots. The dots are arranged in a grid pattern. There is a large number 6 in the middle. The number 6 is outlined in red. The word ""giay"" is written in a smaller font below the number 6. The numbers are outlined in silver."
011.jpg,Two people are standing in front of a white table. There is a large screen behind them with a city on it. The man is wearing a blue shirt and a pink tie. 
012.jpg,Two people are standing behind a white table. There is a large screen behind them with a city on it. The man is wearing a blue shirt and a pink tie. 
013.jpg,A man and a woman are standing in front of a news desk. The man is wearing a blue shirt and a pink tie. He is holding a red box in his hands. The woman is also wearing a white shirt and black pants. There is a large screen behind them that shows a city with tall buildings. The sky above the city is orange.
014.jpg,Two people are standing in front of a screen. There are tall buildings on the screen behind them. There is a man in a blue shirt and a woman in a white shirt. They are both wearing glasses.
015.jpg,"The image is of a building. The building is called Phong Dieu Vo Thuan. There are red and yellow signs on the front of the building. Under the signs there are tall pillars with red, white and blue decorations on them. There is a light hanging from the ceiling. The sky is blue and there are trees in the background."
016.jpg,There is a man wearing a blue hat. There is a yellow wall behind the man with a clock on it. There are people standing in front of the wall. 
017.jpg,There is a large white bowl on a table. There is food inside of the bowl. There are vegetables next to the bowl on the table. 
018.jpg,This is an image of some food. The food looks like rice. The rice is light brown and white. There are white take out containers behind the food. There is purple rice in the middle. The purple rice has small white seeds on it. The containers are white.
019.jpg,A man is singing into a microphone. He is wearing a black and gold crown on his head. His mouth is open and his hand is holding the microphone up to his face. The background is blurry.
020.jpg,There are several people standing in front of colorful decorations. There is a woman in a blue jacket clapping her hands. There are red and yellow decorations hanging from the ceiling. 
021.jpg,A man is standing in front of a building. He is wearing a blue shirt and a blue hat on his head. There are colorful decorations on the building behind him. 
022.jpg,There are people standing under a large dragon. They are dressed in red and yellow. There is a ladder behind them. 
023.jpg,There are people standing in front of a building. They are wearing red and white outfits. There is a large arch in the front of the building. There are red lanterns hanging from the ceiling. 
024.jpg,There are people standing in front of a building. There is a red sign on the front of the building. The people are wearing colorful costumes. 
025.jpg,A frame is sitting on a table. The frame is red and gold. There is writing on the frame. There are lights behind the frame on the wall. 
026.jpg,There are three women standing in front of a red counter. They are wearing pink dresses and hats on their heads. There is a gold frame around the counter. 
027.jpg,Two people are standing in front of a white table. They are both holding red objects in their hands. One of the people is wearing a blue shirt and a pink tie. There are tall buildings behind them. 
028.jpg,A man and a woman are standing in front of a cityscape. The man is wearing a blue shirt and a pink tie. He is holding a red object in his hands. The woman is wearing an off-white shirt and black pants. The cityscape behind them is filled with tall buildings. There is a large orange sky above the city.
029.jpg,A man and a woman are standing in front of a white table. They are both holding red tablets in their hands. The man is wearing a blue shirt and a pink tie. The woman is also wearing a white shirt and black pants. There is a large cityscape behind them. The sky is orange and pink.
030.jpg,A man and a woman are standing in front of a large cityscape. The man is wearing a blue shirt and a pink tie. He is holding a red object in his hands. The woman is also wearing a white shirt and black pants. They are standing behind a white table. The sky behind them is orange and pink. There is writing on the bottom of the screen.
031.jpg,People are standing in line at an airport. There is a red rope fence in front of them. There are signs hanging from the ceiling above the people. 
032.jpg,A woman is wearing a white face mask on her face. She has brown hair tied up in a bun. There is a blue shirt on the woman. There are chairs behind her. 
033.jpg,People are standing in line at an airport. They are all wearing face masks. There are suitcases in front of them. There is a counter next to them with people standing behind it. 
034.jpg,People are standing in line at an airport. There are silver barriers in front of them. There is a white sign on one of the barriers. 
035.jpg,There are people standing in line at an airport. There is a blue sign in front of them. There are silver poles around them. 
036.jpg,A man in a blue shirt is standing in front of a crowd of people. There is a woman in a pink shirt and a white hat on her head. 
037.jpg,There are people standing in a line. There is a woman in a red dress standing in front of a fence. There are signs on the fence. 
038.jpg,There are several people standing in a line. They are all holding black suitcases. There is a blue barrier in front of them. 
039.jpg,A man in a striped shirt is standing in front of a white counter. There are people standing behind him with luggage. There is a man sitting in a chair behind the counter. 
040.jpg,There are several people standing in a room. There is a man in a blue shirt standing in front of them. There are people behind him wearing face masks. 
041.jpg,There are three people standing in front of a counter. There is a man in a green shirt and a woman in a black dress. They are all looking at the counter. 
042.jpg,There is a man in a green uniform standing next to a woman. They are both looking at something in their hands. There are people standing in a line behind them. There is a large white pillar in front of them.
043.jpg,A man in a green uniform is standing next to a woman in a black jacket. They are standing in front of a white counter. There are people standing behind them in a line. 
044.jpg,There is a man in a green uniform standing next to a woman. They are standing in front of a white counter. There are people standing in a line behind them. 
045.jpg,A woman is standing in an airport terminal. She has long brown hair and is wearing a black jacket. There are several people standing in line behind her. 
046.jpg,There are several cars lined up on the street. There is a woman standing in front of one of the cars. She is wearing a face mask and carrying a purse. There are signs hanging from the ceiling. 
047.jpg,There are several cars lined up on the street. There are trees and bushes next to the cars. There is a walkway above the cars with a gray cover over it.
048.jpg,There is a green building with a sign on the front of it. There are people standing in front of the building. There is a white car parked in frontof the building next to green bushes. 
049.jpg,A green car is parked on the street. There is a man in a green shirt standing next to the door of the car. There are trees on the sidewalk in front of the building. 
050.jpg,A green car is parked on the street. There are people standing next to the car with luggage. There is a man in a green shirt and black pants standing in front of the car. 
051.jpg,A man is standing in front of a city skyline. He is wearing a blue shirt and a pink tie. He has glasses on and is holding a red object in his hands. The sky is orange and pink. There are tall buildings in the background.
052.jpg,A man is standing in front of a city skyline. He is wearing a blue shirt and a pink tie. He has glasses on and is holding a red phone in his hands. There is a red sky behind the man.
053.jpg,A large green sign is hanging over a white building. There is a picture of a woman on the sign. There are lights under the sign on the ceiling. 
054.jpg,There is a blue wall in front of a desk. There are lights hanging from the ceiling on the desk. A woman is wearing a face mask on her face. There is a man standing behind the desk wearing a white mask on his face. 
055.jpg,People are standing inside of a building. There is a blue sign hanging from the ceiling. There are glass counters in front of the people. 
056.jpg,There are people standing in a room. There is a blue wall behind them. There are lights hanging from the ceiling in front of them. 
057.jpg,"Four gold coins are displayed in a black box with a red mat inside. The box is sitting on a white table. The gold coins have a red square in the middle with a design around it. There is a logo on the left side of the gold coins. There are words written on the bottom of the picture below the coins. On the top right corner of the image there is a watermark that reads ""HTV7 HD 18:33:28""."
058.jpg,There are several people standing in front of a glass display case. They are wearing yellow shirts. There is a mannequin with a necklace on it behind the people. 
059.jpg,There are four white boxes on a white surface. There are gold rings on top of the boxes. There is writing on the white boxes. 
060.jpg,There are several rings on display in boxes. There is a red stone on one of the rings. There are black beads on the other ring. 
061.jpg,There are several people standing in front of a glass display case. There is a woman in a yellow shirt standing behind the glass case. 
062.jpg,There are several people standing around a counter. There is a man in a red shirt and a red tie standing in front of the counter. 
063.jpg,There are small white boxes on a table. There is a white tag on the boxes with black writing on it. There are two gold flowers on top of the boxes. 
064.jpg,There are several bracelets on display. They are all gold and silver. There is a pink item on the shelf next to them. 
065.jpg,People are shopping in a store. There are gold ornaments hanging from the ceiling. There is a man in a blue shirt standing in front of a counter. 
066.jpg,Three gold plated items are displayed in a white box. Each item has an image of a person on it. Below the image there is a description of the items in Vietnamese.
067.jpg,There are people standing in a room. There is a man in a white shirt standing in front of a glass display case. There are signs hanging from the ceiling. 
068.jpg,There is a display case in a store. There are many items on display in the case. There is a white mannequin in front of the display case. 
069.jpg,Two women are talking to each other. One of the women has long brown hair and is wearing a white shirt. The other woman has short brown hair. There is a computer screen in front of them. There are flowers next to the computer screen.
070.jpg,There are several people sitting at a white desk. There is a black computer monitor in front of them. There are papers and a calculator on top of the desk. 
071.jpg,A tablet is sitting on a table. There are papers in front of the tablet. There is a person wearing a white shirt on top of the table. 
072.jpg,A woman is sitting on a white couch. She is wearing a red and white striped shirt and black pants. There is a brown purse on the table in front of her. A man is sitting at a table with a white shirt on. He is holding a tablet in his hands. A picture frame is on a table next to the man. Brown blinds are hanging on a window behind the woman.
073.jpg,There are several people sitting at a long white table. There are red chairs around the tables. There is a man in a black jacket standing in front of the table. 
074.jpg,The building is white and has red writing on the top of it. The writing is in a foreign language. The sky is very cloudy and it looks like it may be overcast.
075.jpg,A man and a woman are standing in front of a white table. They are both holding red objects in their hands. The man is wearing a blue shirt and a pink tie. The woman is also wearing a white shirt and black pants. There is a large cityscape behind them. The sky is orange and red. There are words written on the bottom of the screen.
076.jpg,Two people are standing in front of a large screen. There are tall buildings on the screen behind them. There is a man in a blue shirt and a woman in a white shirt. They are both holding red boxes in their hands. 
077.jpg,A man and a woman are standing in front of a white table. They are both holding red objects in their hands. The man is wearing a blue shirt and a pink tie. He is wearing glasses on his face. The woman has short black hair and a white button down shirt. There is a large cityscape behind them. The sky is orange and red.
078.jpg,There are four men standing in front of a white curtain. They are all wearing white shirts. There is a man in a black shirt that has the word SUCCI on it. 
079.jpg,There are several people riding motorcycles down the street. There are buildings on both sides of the street next to them. There is a green canopy on one of the buildings. The sky above the street is blue.
080.jpg,Five young men are standing in a line in front of a white curtain. They are all looking at the camera. Two of the men are wearing white shirts and one of them is wearing a black shirt with the word SUCCI on it. The other two men are not wearing shirts. They all have dark hair.
081.jpg,There are several people standing around motorcycles on the street. There is a white fence next to them. There are buildings behind them. 
082.jpg,A motorcycle is parked on a sidewalk. The motorcycle is black and purple. There is a white license plate on the motorcycle. There are large planters on the sidewalk. 
083.jpg,A man in a green uniform is standing in front of a green curtain. There is a gold statue behind him. There are purple flowers in a vase next to the man.
084.jpg,There are two men sitting at a table. The man on the left is wearing a green shirt. There is a printer behind them. There are white curtains on the window. 
085.jpg,A picture of a motorcycle with a white license plate. The license plate says 59-M1 145.63. The motorcycle is black. There is a red motorcycle behind the black one. The background of the picture is dark.
086.jpg,A man is wearing a green uniform and a red hat. He is standing in front of a white wall. There is a plaque on the wall behind him. 
087.jpg,A man in a green military uniform is wearing a red and gold hat. He is standing in front of a white wall. There is writing on the wall behind him. 
088.jpg,There are several men in uniform sitting on motorcycles. They are all wearing helmets on their heads. There is a man in a white shirt behind them. 
089.jpg,There are several people riding motorcycles down the street. There are several buildings on the side of the street next to the motorcycles. There is a white fence on the sidewalk in front of the motorcycle. 
090.jpg,A man is standing in front of a window. He is wearing a blue collared shirt. There is a microphone in his hand. There are several buildings and trees behind the man. 
091.jpg,There are several people riding motorcycles down the street. There are buildings on the side of the street next to them. There is a green umbrella on the sidewalk in front of the building. 
092.jpg,A woman is wearing a black shirt with yellow flowers on it. She is wearing glasses and is holding a microphone. There are buildings behind the woman. 
093.jpg,There are several men in uniform standing in a line. They are all wearing green pants and hats. There are trees behind them. There is a white building in front of them.
094.jpg,A woman is wearing a black shirt with yellow flowers on it. She is wearing glasses and is holding a microphone in her hand. There are buildings behind the woman. 
095.jpg,A large group of people are standing on a street. They are all wearing green uniforms and yellow helmets. There are several motorcycles parked in front of them. There is a white building behind them. 
096.jpg,There are several motorcycles on the street. There is a white building behind them with a red sign on the front of it. There are people standing in front of the building.
097.jpg,Two people are standing in front of a large screen. They are both dressed in business attire. The man is wearing a blue shirt with a pink tie and black pants. The woman is dressed in a white shirt with black pants and black shoes. The screen behind them has a city scene on it. There is a red and white logo on the front of the screen.
098.jpg,Two people are standing behind a white table. There is a large screen behind them with a city on it. The man is wearing a blue shirt and a pink tie. 
099.jpg,A man and a woman are standing in front of a white table. The man is wearing a blue shirt and a pink tie. He is holding a red object in his hands. The woman is wearing an all white shirt and black pants. There is a large cityscape behind them. The sky is orange and red. There are words written on the bottom of the screen.
100.jpg,A picture of a metal fence. The fence is white. There is writing on the bottom of the picture. There are clouds in the sky. The sky is cloudy. The picture was taken in the day time. The time is 18:36.04.
101.jpg,A mountain is seen in the distance. There are clouds in the sky above the mountain. There is a bridge in front of the mountain that is white in color. 
102.jpg,The sky is cloudy and the sun is setting. There is a tall tower in the distance. The tower has a pole on top of it. In front of the tower is a small structure with a star on top.
103.jpg,There is a tall tower with a pole on top of it. There is a fence in front of the tower. There are clouds in the sky above the building. 
104.jpg,There is a tower on top of a hill. There are clouds in the sky above the tower. There is a fence in front of the tower on the ground. 
105.jpg,A woman is standing in front of a cityscape. She is wearing a white collared shirt and black pants. The woman has short black hair. The sky behind the woman is orange and red. There are tall skyscrapers in the background. 
106.jpg,A woman is standing in front of a city skyline. She is wearing a white collared shirt and black pants. The woman has short brown hair and is wearing earrings. The sky behind the woman is orange and red. There are tall skyscrapers and buildings all around the woman.
107.jpg,A picture of a large wave in the water. There is foam on the top of the wave. The water is white and gray in color. There are small waves in front of the large wave. 
108.jpg,There is a large wave in the water. The water is gray and white. There is foam on the top of the wave. There are small white dots on the water next to the large wave. 
109.jpg,There is a large wave in the water. There is a blue object in the wave. There are clouds in the sky above the wave and water. 
110.jpg,There is a large black animal in the water. There is water around the animal. There are words written on the bottom of the picture. 
111.jpg,There are several people standing in front of a blue truck. There is a man in a white shirt and a green hat on. There are clouds in the sky above them.
112.jpg,There are several people standing in front of a blue truck. There is a man in a suit and a black hat on. There are clouds in the sky above them.
113.jpg,A picture of a dead animal laying on the ground. There is a white plastic bag next to the animal. There are people standing in front of the bag. 
114.jpg,There is a large black object on the ground. There is writing on the top left of the image. The writing is in a foreign language. 
115.jpg,There are people standing in front of a white bag. There is a large black object on top of a wooden table. There are trees and bushes behind them.
116.jpg,"On the left side of the image there is a solid black background. On the right side the image is red and black. The red part has small white dots on it. The dots are arranged in a grid pattern. The white dots are evenly spaced. There are also small red letters on the top right corner that say ""HTV"" and the numbers 18:37:21 HD."
117.jpg,A man is standing in front of a cityscape. He is wearing a blue shirt and a pink tie. The man is holding a red object in his hands. The sky behind the man is orange and red. There are tall buildings in the city. 
118.jpg,A man is wearing a blue shirt and a pink tie. He is wearing glasses. There are tall buildings behind him. There is a red sky behind the man. 
119.jpg,A man is standing in front of a city skyline. He is wearing a blue shirt and a pink tie. He has glasses on and is holding a phone in his hands. The sky is orange and pink. There are tall buildings in the background.
120.jpg,This is an image of a city. The building is white. The buildings are very tall. There is a flag on the building. The flag is red white and blue. The trees are very leafy and green. The sky is light blue and white. There are people walking on the sidewalk. The sidewalk is made of concrete. The concrete is gray.
121.jpg,A picture of a space shuttle is shown on a TV screen. There are black bars in front of the picture. There is a large white and yellow rocket on the ground. 
122.jpg,A picture of a rocket is shown. The rocket is white and yellow in color. There are several metal structures surrounding the rocket. There is writing on the bottom of the picture in Chinese.
123.jpg,There are two people standing in front of a large white object. They are wearing white hats on their heads. There is a person on a bike next to them. 
124.jpg,Two robots are seen on a TV screen in 1972. The robots are white and black and appear to be in a fighting stance. There is a large cloud of smoke behind them. The TV screen is black and there is a brown bar at the bottom of the screen with foreign writing on it. The time is 18:38:42.
125.jpg,Two soldiers are seen on a screen in a foreign language. They are wearing helmets and appear to be in a battle. There is a ladder leaning against a wall on the left side of the screen.
126.jpg,"A picture of a space shuttle is shown on a TV screen. The TV screen is black and there are white words on the bottom of the screen that say ""NASA TV"" on the top right corner. On the top left corner there is a small logo that says ""HTV"" in white letters. The bottom left corner has a small blue logo."
127.jpg,A rocket is being launched from a launch pad. There is a tall tower next to the rocket. There are many clouds in the sky above the launch. 
128.jpg,A rocket is launching into the sky. There is a lot of white smoke coming out of the bottom of the rocket. The rocket is silver in color and is pointed up into the air. The sky is dark and there are buildings in the background.
129.jpg,A rocket is launching into the sky. The rocket is black in color. There is a lot of fire and smoke coming out from the bottom of the rocket. The sky is cloudy and gray.
130.jpg,A rocket is launching into the sky. There is a lot of smoke coming out from the bottom of the rocket. The sky is blue and clear.
131.jpg,There is a small building in front of two tall towers. There is a large rocket on top of the building. There are mountains in the distance. 
132.jpg,The image is a screenshot of a news program. There are two people in the image. The man on the left is wearing a blue shirt and a pink tie. He is also wearing glasses. He has short black hair. The woman next to him is wearing white. They are both sitting in front of a large screen. The screen has a red sunset on it. There is a large white sign on the right side of the screen.
133.jpg,A woman in a white shirt and black pants is standing in front of a red background. She is holding a piece of paper in her hands. There is a picture on the screen next to her. 
