frame,caption
001.jpg,A beautiful sunset over a city. The sky is orange and pink. There are many buildings in the city. There is a large body of water in front of the buildings. 
002.jpg,A man and a woman are standing behind a news desk. The desk is white and has a red logo on it. The man is wearing a blue shirt and a tie. The woman is also wearing a beige shirt. There is a large screen behind them. There are buildings on the screen. 
003.jpg,A man and a woman are standing behind a news desk. The desk is white and has a red logo on it. The man is wearing a blue shirt and a tie. The woman is standing behind the desk. There is a large screen behind them. There are buildings on the screen. 
004.jpg,The image is very dark and red. There is a white stripe on the right side of the image. There are dots on the red area. The dots are small and white. The red area has a large hole in the middle of it. The white stripe has a thin red line on it.
005.jpg,"The image is blurry. The background is white with red diagonal stripes. There is a gray object in the middle of the picture. The gray object has a light on top of it. The light is reflecting off of the gray object. The image has a watermark in the top right corner that says ""MTV""."
006.jpg,There are people sitting at a desk. They are all wearing white shirts and have face masks on. There is a white table in front of them with many computers on it. There are black chairs around the desk. 
007.jpg,There is a white machine on a white table. There is a person wearing a white shirt and a red bracelet on their wrist. The machine has a red label on it.
008.jpg,There are several men wearing red and yellow outfits. They are standing in front of large drums. There are white pillars behind them. The men are holding sticks in their hands. 
009.jpg,A man in a red and yellow shirt and red pants is walking down a street. There is a large orange and yellow decoration in front of the man. There are people standing behind him watching him. 
010.jpg,A person wearing a striped shirt is sitting at a table. They are holding a black tablet in their hands. There is a wooden table in front of them. 
011.jpg,"A red and white image is displayed on a monitor screen. The monitor screen has a large red object on the left side of it. The object appears to be a glass or a bottle of something. There is a white background with large red diagonal stripes on it. On the top right corner of the screen there is a small logo that reads ""HTV7 HD 18:30:34""."
012.jpg,A man and a woman are standing behind a white table. They are both holding red objects in their hands. The man is wearing a blue collared shirt and a tie. The woman has a white blouse on with ruffles on the shoulders. There is a large cityscape behind them. The sky is red and orange.
013.jpg,A man and a woman are standing behind a white desk. The man is wearing a blue collared shirt and a tie. The woman is wearing an off-white blouse with ruffles on the shoulders. They are both holding red objects in their hands. Behind them is a large cityscape with tall buildings. The sky is orange and pink.
014.jpg,A man and a woman are standing behind a white desk. The man is wearing a blue shirt and a tie. The woman is also wearing a white blouse. There is a large picture of buildings behind them. 
015.jpg,There is a large white building with many windows on the front of it. There is a red flag on top of the building. There are many flags in front of the white building. 
016.jpg,There is a large white building with many flags in front of it. There is a white car parked on the street next to the flags. There are palm trees in the front of the building. 
017.jpg,A white machine is sitting on top of a white table. There is a person wearing a white shirt and a black tie. The machine has a black cord coming out of it. 
018.jpg,There are people sitting at a desk. They are all wearing white shirts and have face masks on. There are computers on the desk in front of them. 
019.jpg,There are several people sitting at desks. There are green chairs in front of them. There is a white wall behind them. 
020.jpg,A person is standing in front of a white printer. There are blue binders on the wall behind the printer. The person is wearing a white bracelet on their wrist. They are holding money in their hands.
021.jpg,A hand is writing on a paper. The hand is holding a pen. The pen is blue and green. The paper is white. There is a barcode on the bottom left corner of the screen. There are numbers and letters on the screen as well. The time is 18:31:19.
022.jpg,There are two women sitting at a desk. There is a white cabinet behind them with a plant on top of it. The women are wearing white shirts and green ties. 
023.jpg,There is a white machine that has money in it. There are two hands on top of the machine. There is a blue and yellow sticker on the side of it. 
024.jpg,A man and a woman are standing in front of a white table. They are both holding red objects in their hands. The man is wearing a blue shirt and a tie. The woman has a beige blouse on. There is a large cityscape behind them. The sky is red and orange. 
025.jpg,A man and a woman are standing in front of a white table. They are both holding red objects in their hands. The man is wearing a blue shirt and a tie. There are tall buildings behind them. 
026.jpg,A man and a woman are standing in front of a white table. They are both holding red objects in their hands. The man is wearing a blue shirt and a tie. There are tall buildings behind them. 
027.jpg,A man and a woman are standing in front of a white table. They are both holding red objects in their hands. The man is wearing a blue shirt and a tie. The woman has a white blouse on. There are tall buildings behind them. There is a red sky above them.
028.jpg,There is a large white sign in front of a building. There are several flags on top of the sign. There is a red and yellow flag on the building. 
029.jpg,There are several people standing in front of a building. They are all wearing white shirts and black pants. They have face masks on their faces. There is a large green plant in a pot next to them. 
030.jpg,There are several people standing in a line. They are all wearing white shirts and have face masks on. There is a building behind them with a tree in front of it.
031.jpg,There are several people walking down a street. There is a white building behind them with a yellow sign on the front of it. There are trees in front of the building.
032.jpg,There is a woman wearing a black suit and a blue lanyard around her neck. She is holding a microphone in her hand. There is a crowd of people behind her standing in front of a building. There are trees behind the crowd. 
033.jpg,A blue and white sign is hanging on the wall of a building. The building is light green in color. There are two windows on the building. There is a light hanging from the ceiling above the windows.
034.jpg,This is an image of a classroom. The classroom is filled with students. The students are sitting in front of a blackboard. The blackboard is made of chalk. The chalkboard is black. There is a large screen on the wall. The screen is red and white. The girl is standing in the middle of the room. She is wearing a white dress. The girls are wearing white shirts. The desks are brown.
035.jpg,There are three kids sitting at a table. There is a green curtain hanging on the wall behind them. The kids are wearing white shirts with red stripes on them. 
036.jpg,A woman in a green dress is standing in a room. There is a green table in front of her with a laptop on it. There are large windows on the wall behind the woman. 
037.jpg,A woman is standing in front of a building. She is wearing a pink dress and has a microphone in her hand. The building behind her is green and yellow. There are trees on the building. 
038.jpg,There are several children sitting in desks. There is a blue wall behind them with a picture of a planet on it. There are windows in front of the wall. 
039.jpg,A woman is standing in front of a classroom. She is wearing a long brown dress and has a microphone in her hand. There is a large screen on the wall behind her. 
040.jpg,A woman is standing in front of a building. She is wearing a pink dress and has a microphone in her hand. The building behind her is green and yellow. There is writing on the front of the building.
041.jpg,There are many desks in a room. There are people sitting in front of the desks. There is a man standing in the middle of the room. The man is wearing a white shirt. 
042.jpg,There are several children sitting at desks. There are head phones on top of the desks. The children are wearing white shirts and red ties. There is a window behind them with a curtain on it.
043.jpg,There are four boys sitting at desks. There is a man sitting at a desk in front of them. There are several computer screens on the desks. 
044.jpg,A man wearing a blue shirt is sitting in front of a computer. He has a microphone attached to his ear. There is a white wall behind the man.
045.jpg,"A man and a woman are standing behind a white desk. They are both dressed in business attire. The man is wearing a blue shirt and tie, while the woman is wearing an off-white blouse. Behind them is a large screen with a city scene on it. There is a red and white logo on the desk."
046.jpg,A woman is standing on a news set. She is wearing a brown skirt and a white blouse. There is a large screen on the wall behind her. 
047.jpg,There are people standing on the street. They are all wearing helmets. There is a large tree next to them. There are red decorations on the side of a building. 
048.jpg,There are several signs on the side of a building. There are red lanterns hanging from the signs. There is a person wearing a black shirt and a white hat standing in front of them. 
049.jpg,A man is standing in front of a white wall. He is wearing a short sleeve shirt. There is a red sign hanging on the wall behind him. 
050.jpg,An elderly man is standing in front of a store. He is wearing a white shirt and has short black hair. There are bags hanging from the ceiling behind him. 
051.jpg,A woman is wearing a white face mask and a gray hoodie. She has black hair tied up in a bun. There are yellow and red flowers behind the woman. 
052.jpg,There are people standing in front of a table. There are red decorations hanging from the ceiling above the people. There is a man in a black jacket standing next to a woman. 
053.jpg,There is a red circle hanging from the ceiling. There is a picture of a colorful dragon on the circle. There are plastic bags under the circular red circle. 
054.jpg,A man is bending over a table. He is wearing a white helmet and a white shirt. There are red poles in front of him. There is a large dragon statue on the table. 
055.jpg,There are people standing in front of a store. There are red and yellow decorations hanging from the ceiling. There is a woman wearing a black shirt. 
056.jpg,There are several red lanterns hanging from the side of a building. There is a woman in a pink jacket standing in front of them. There are trees next to the building. 
057.jpg,There are decorations hanging from the ceiling. There are pink and yellow flowers on top of the decorations. There is a green sign on the side of the building. 
058.jpg,A man is standing in front of a store. He is wearing a blue collared shirt. There are colorful decorations hanging from a rack behind him. There is a green sign on the front of the store. 
059.jpg,A red sign with white writing on it is hanging from a red string. There is a gold keychain hanging from the string under the sign. There are red decorations hanging behind the signs. 
060.jpg,A man is standing outside of a store. He is wearing a blue collared shirt and a black cap on his head. There is a green sign hanging from the building behind him. There are flowers hanging from a rack in front of the man. 
061.jpg,There are red decorations on a table. There are two red plates on top of the table. The plates have writing on them. There is a yellow sign behind the plates. 
062.jpg,A person's hand is touching a box. The box is filled with red packets. There is a gold watch on the wrist of the person. 
063.jpg,A man is standing behind a white desk. He is wearing a blue shirt and a black tie. There are tall buildings behind him. There is a red sky behind the man. 
064.jpg,A man is standing behind a white podium. He is wearing a blue collared shirt and a tie. There are tall buildings behind him. There is a red sky behind the man. 
065.jpg,A man is standing behind a white podium. He is wearing a blue collared shirt and a tie. There is a large city behind the man. There are tall buildings and skyscrapers in the city. 
066.jpg,There are several people wearing red and yellow outfits. They are playing drums. There is a large building behind them with red flags hanging from the building. 
067.jpg,A man is standing in front of a microphone. He is wearing a white collared shirt and glasses. There are colorful decorations on the wall behind the man. There is a black and white sign on the microphone. 
068.jpg,A dragon is being held up by a crowd of people. The dragon is yellow and red. There are red flags behind the dragon. There is a large building behind the crowd. 
069.jpg,A dragon is shown on a TV screen. The dragon is red and yellow. There are buildings behind the dragon. There is writing on the bottom of the screen. 
070.jpg,There are three men wearing red and yellow shirts. They are standing in front of large drums. There are large yellow signs behind them. 
071.jpg,There are people standing in front of a yellow sign. There are trees behind the people. There is a man in a red shirt holding two large drums. 
072.jpg,There are several people wearing red and yellow costumes. There is a large building behind them with a large screen on the wall. There are flags in front of the building.
073.jpg,A man in a blue shirt is standing in front of a large dragon. There is a man behind him holding a camera. There are lights on the ceiling above the man. 
074.jpg,A man is standing in front of a yellow wall. He is wearing a red and white collared shirt. There is a microphone in his hand that is black and silver. The man has short black hair. 
075.jpg,A man in a red shirt is standing in front of a yellow wall. There is writing on the wall behind the man. There are two golden trophies on a table behind him.
076.jpg,There are several people standing in front of a wall. They are dressed up in colorful costumes. There is a large white and yellow dragon on the wall behind them. There are people standing behind them wearing red shirts. 
077.jpg,There are several men standing in front of a wall. There is a large dragon decoration hanging from the wall behind them. There are several people holding cameras in their hands. 
078.jpg,There are several men standing in front of a white wall. There is a large dragon decoration on the wall behind them. There are red flowers hanging from the decoration. 
079.jpg,A man is wearing a red shirt. He is holding a microphone in front of him. There is a yellow wall behind the man with writing on it.
080.jpg,A man is standing in front of a wall. He is wearing a red shirt with a black collar. There is a microphone in his hand. A large tree with yellow flowers is next to the man. 
081.jpg,A dragon is being shown on a television screen. The dragon is yellow and red. There are small red and yellow flags behind the dragon. 
082.jpg,A man is standing in front of a wall. He is wearing a colorful shirt and glasses. There is a large red dragon on the wall behind the man. A microphone is sitting on the man's hand. 
083.jpg,There are several people standing in front of a wall. They are dressed up in colorful costumes. There is a man in a red shirt holding a stick in his hand. 
084.jpg,A man is standing in front of a wall. He is wearing a colorful shirt with yellow flowers on it. He has black hair and glasses on his face. There is a large red dragon on the wall behind the man.
085.jpg,There are several people standing in front of a wall. There is a large red and yellow animal on the stage. There are signs on the wall behind the animal. 
086.jpg,There are several people standing in front of a large white and yellow animal. They are wearing red and yellow outfits. There is a man in a red shirt standing behind them. 
087.jpg,There are four people standing in front of a large picture. There is a woman in a red shirt standing behind them. There are two men in pink shirts standing next to the picture. 
088.jpg,"A woman is standing in front of a colorful background. She is wearing a white blouse with ruffles on the shoulders. She has dark hair and is holding a red folder in her hands. There is a large picture on the right of the woman. The picture has a city skyline on it and the word ""giay"" is written in red."
089.jpg,A woman is standing in front of a red background. She is wearing a white blouse with ruffles on the shoulders. She has short black hair and is holding a red object in her hands. There is a large picture on the right of the woman. The picture is of a city with tall buildings and a bright yellow sky.
090.jpg,There is a large black podium in front of a white wall. There are people sitting in black chairs behind the podium. There is a man in a blue shirt standing behind a podium.
091.jpg,There are three people sitting at a table. There is a large black door behind them. There are microphones in front of them on the table. 
092.jpg,A man is standing in front of a microphone. He is wearing a collared shirt. There is a man in a green uniform behind him wearing a face mask. 
093.jpg,There are three people sitting at a table. There is a large black door behind them. There are microphones in front of them on the table. 
094.jpg,There are several people sitting in chairs in front of a podium. There is a woman in a pink jacket standing behind the podium. 
095.jpg,A woman in a pink jacket is standing in front of a microphone. There is a man in a suit sitting behind her. There are men in green uniforms standing behind them. 
096.jpg,A woman is standing in front of a microphone. She is wearing a pink jacket and a gray shirt. There are two men behind her wearing green uniforms and hats. They are also wearing face masks. 
097.jpg,There are three people sitting at a table. There is a blue sign on the table in front of them. There are two men and a woman sitting next to each other. 
098.jpg,A blue sign is sitting on a table. The sign has white writing on it. There is a white wall behind the sign. 
099.jpg,There are several people sitting in a room. They are all wearing face masks. There is a man in a green uniform standing in front of them. 
100.jpg,There are three people sitting at a table. There is a man in a blue uniform standing in front of a microphone. There are two women sitting next to him. The woman on the left is holding a piece of paper. 
101.jpg,There are several people standing in a line. They are all wearing white face masks. There is a man in a blue shirt wearing a red jacket. 
102.jpg,There are several men standing in a line. They are all wearing face masks. There is a man in a red jacket next to a man wearing a blue jacket. 
103.jpg,There are several people sitting in chairs. There is a podium in front of them with a microphone on top of it. There are men and women in uniform sitting next to each other. 
104.jpg,A news anchor is standing behind a desk. He is wearing a blue shirt and tie. There is a large screen behind him with a city on it. A woman is standing in front of him wearing a brown skirt and a beige shirt. 
105.jpg,A man and a woman are standing in front of a large screen. They are both dressed in business attire. The man is wearing a blue shirt and tie and is standing behind a white desk. There is a large picture of a city on the screen behind the man. The sky is red and orange. 
106.jpg,A man and a woman are standing in front of a large screen. They are both dressed in business attire. The man is wearing a blue shirt and tie and is standing behind a white desk. There is a large picture of a city on the screen behind the man. There are tall buildings and skyscrapers in the picture. 
107.jpg,A news program is being shown. There is a man and a woman standing in front of a large screen. The man is wearing a blue shirt and tie and is standing behind a white table. There are buildings on the screen behind him. 
108.jpg,There are five men sitting at a long brown desk. There are four chairs behind the desk. They are all wearing uniforms and have microphones in front of them. There is a black door behind them with a gold emblem on it. 
109.jpg,A man in a green military uniform is sitting behind a brown chair. He is wearing glasses and has short black hair. There is a microphone in front of him and a red sign on the podium. 
110.jpg,A man is standing behind a podium and speaking into a microphone. He is wearing a blue jacket. There are several people behind him sitting in chairs. They are wearing green uniforms. 
111.jpg,A man and a woman are sitting at a desk. The man is wearing a green military uniform. He is wearing glasses on his face. There is a laptop on the desk in front of him. The woman is sitting next to him. She is also wearing a uniform. There are two black chairs behind them. The desk has a microphone on it.
112.jpg,A woman is sitting in a chair. She has long brown hair and is wearing glasses. There is a blue sign in front of her that has foreign writing on it. The wall behind the woman is white.
113.jpg,A man in a blue jacket is standing behind a podium. There is a microphone in front of him. There are people sitting in chairs behind him. 
114.jpg,A man is standing in front of a microphone. He is wearing a blue shirt and glasses. There are people behind him sitting in chairs. There is a white wall behind them. 
115.jpg,There are people sitting in chairs in a room. There is a large desk in front of them with a black curtain hanging from the ceiling. There are windows on the sides of the room. 
116.jpg,There are five people sitting at a long brown desk. There is a logo on the wall behind them. There are people sitting in front of the desk wearing green hats. 
117.jpg,There are people sitting in a room. There is a man in a blue jacket standing in front of a desk. There are laptops on top of the desks. 
118.jpg,"A logo is displayed on a white background. The logo is red and white. There are red dots on the sides of the logo. There is a large red circle in the middle of the white logo. The word ""giay"" is written in red letters. Below the red circle is the word ""TIEP THEO""."
119.jpg,A white van is parked behind a yellow tape. There is a man in a black jacket walking towards the van. There are people standing in front of the van wearing black jackets. 
120.jpg,There are three police officers standing in front of a white car. They are wearing black jackets and black pants. There is a yellow tape around the car. 
121.jpg,There are people laying in the water. There are small waves in front of them. They are wearing red life jackets. 
122.jpg,A person is wearing a red life jacket. They are sitting in the water. There are small waves in front of them. 
123.jpg,There is a person laying on the ground in the water. They are wearing a red life jacket. There is another person in a life jacket floating on the water behind them. The water has small waves in it. 
124.jpg,A woman is standing in front of a red and orange background. She is wearing a white blouse with ruffles on the shoulders and brown bottoms. The woman is holding a red wallet in her hands. There is a large white screen behind the woman. The screen has a red logo on it.
125.jpg,A woman is standing in front of a red background. She is wearing a white blouse with ruffles on the shoulders. The woman is holding a red folder in her hands. There is a picture next to the woman on the screen. 
126.jpg,There is a woman standing in front of a red wall. She is wearing a white blouse with ruffles on the shoulders. The woman is holding a red wallet in her hands. There is a picture next to the woman on the screen. 
127.jpg,A person is wearing a striped shirt and black pants. They are holding a white box in their hands. There is a black bag on the table in front of them. 
128.jpg,A woman is sitting at a desk. She is wearing a black and white striped shirt. There is a large black screen on the wall behind her. There are papers on the desk in front of her. 
129.jpg,A woman is sitting in a chair in front of a table. She is wearing a black and white striped shirt. There is a large screen on the wall behind her. 
130.jpg,A person wearing a black and white striped shirt is sitting at a table. There is a black watch on their wrist. The person is holding a brown bag. 
131.jpg,A woman is wearing a black and white striped shirt. She is sitting at a wooden table. There is a brown bag on the table in front of her. She has a black watch on her wrist. A small green bottle is sitting on top of the table. 
132.jpg,A woman is wearing a black and white striped shirt. She is sitting in front of a brown table. There is a black television hanging on the wall behind her. 
133.jpg,A woman is wearing a striped shirt. She is sitting in front of a brown table. There is a black t.v. hanging on the wall behind her. 
134.jpg,A woman is opening a brown purse. She is wearing a black and white striped shirt and a black watch on her wrist. There is a wooden table in front of the woman. 
135.jpg,A woman is wearing a black jacket. She is holding a can in her hand. There is a large tree behind the woman. 
136.jpg,A man is standing in front of a city skyline. He is wearing a blue collared shirt and a dark colored tie. The sky behind him is orange and red. There are tall buildings all around the man.
