frame,caption
001.jpg,A beautiful sunset over a city. The sky is orange and pink. There are many buildings in the city. There is a large body of water in front of the buildings. 
002.jpg,"A man and a woman are standing in front of a large screen. They are both dressed in business attire. The man is wearing a blue shirt and tie, while the woman is wearing red. The screen behind them has a city scene on it. There is a red carpet on the floor in between the two people. The floor of the room is gray."
003.jpg,"A man and a woman are standing behind a news desk. They are both dressed in business attire. The man is wearing a blue shirt, black pants and a tie. The woman is dressed in a short sleeve red shirt and black pants. The desk is white and has a red logo on it. There is a large screen behind them that shows a city skyline. The sky is blue with white clouds."
004.jpg,The image is a digital art piece. The background is completely black. On the right side of the image there is a sphere that is red and black. The sphere is made up of small white dots. The dots are arranged in a grid-like pattern. There is a bright light on the top right corner of the sphere.
005.jpg,A group of people are standing outside. They are wearing blue shirts and white gloves. Some of the people are wearing face masks. There is a green fence behind the people. 
006.jpg,There are several people standing in front of a large tree. There is a man in a blue shirt and a woman in a red shirt. They are all wearing white gloves. 
007.jpg,There are several people standing on the sidewalk. There is a motorcycle parked on the street in front of them. There are buildings next to the street. 
008.jpg,People are walking down a street. There are tall buildings on both sides of the street. One of the buildings has a white awning on it. The sky is blue and there are no clouds in the sky. The people walking down the street are wearing face masks.
009.jpg,There are several people standing in a room. They are all wearing blue jackets and have face masks on. There are red chairs in front of them. 
010.jpg,Two men in military uniforms are sitting in front of a microphone. There is a screen behind them with a white sign on it. The man on the right is wearing glasses. 
011.jpg,This is an aerial view of a large body of water. The water is dark blue in color. There are several boats on the water. There is a large rock formation in the water near the shore.
012.jpg,"The image is a graphic. The background is red and white. There are diagonal white and red stripes on the image. There is a gray object in the middle of the image that is blurred. The gray object has a small hole in the center of it. The light is reflecting off of the gray object. The image has a watermark in the top right corner that reads ""HTV9 HD 06:30:06""."
013.jpg,There is a man and a woman standing behind a white table. The man is wearing a blue shirt and tie. The woman is also wearing a red dress. There is a large screen behind them with a city on it. 
014.jpg,There is a man and a woman standing in front of a desk. The desk is white and has a red logo on it. The man is wearing a blue shirt and a tie. The woman is also wearing a red dress. There is a large screen behind them. There are buildings on the screen. 
015.jpg,A man and a woman are standing in front of a white table. The man is wearing a blue shirt and a tie. The woman is also wearing a red dress. There are tall buildings behind them. 
016.jpg,A man and a woman are standing in front of a cityscape. The man is wearing a blue shirt and a tie. He is holding a red folder in his hands. The woman is wearing red dress. She has short black hair. The sky is orange and cloudy. There are tall buildings in the background.
017.jpg,There are several people standing on a sidewalk. There is a fence behind them with plants on the ground in front of them. There are buildings behind the fence. 
018.jpg,There are several people standing on a street. There is a large tree in front of a building. There are two men standing next to the tree holding a white sign.
019.jpg,A woman is standing in front of a white fence. She has her eyes closed and is wearing a black top with pink flowers on it. There is a large green plant in the front of her. 
020.jpg,There are two men standing on a sidewalk. One of the men is wearing a red shirt and black pants. There is a white sign next to the men. There are large piles of grass in front of the building. There's a man sitting in the back of a large machine that is lifting the grass.
021.jpg,There are people standing on a sidewalk. There is a black fence behind them. There are trees and bushes behind the fence. A man in a blue jacket is holding a shovel. 
022.jpg,A man is standing in front of a tree. He is wearing a blue and white checkered shirt. There are other people behind him walking on the street. 
023.jpg,This is an aerial view of a construction site. There is a large pile of dirt and grass next to a large body of water. There are several workers wearing hard hats and safety vests working on the ground. 
024.jpg,A man is standing in front of a bush. He is wearing a blue and white collared shirt. There are trees behind the man. There is a white truck behind the bush. 
025.jpg,There is a woman wearing a blue shirt. She has glasses on and is standing in front of motorcycles. There are trees behind her. 
026.jpg,A man is wearing a blue shirt and black pants. He is standing in a pile of trash. There is a white pipe next to him. 
027.jpg,There are people standing on the side of a hill. There are trees on the hill next to them. There is water on the ground next to the hill. 
028.jpg,There is a woman wearing a blue shirt. She has glasses on and is standing in front of motorcycles. There are trees behind her. 
029.jpg,Two women are bending over in a field. They are wearing white shirts and black pants. One of the women is wearing a green hat on her head. There is a pile of rocks behind them. 
030.jpg,A man in a blue shirt is carrying a large bag. There is a pile of grass in front of the man. There are buildings behind the man with the bag. 
031.jpg,A man is wearing a blue shirt and a tie. He is holding a tablet in his hands. There are tall buildings behind the man. There is a cloudy sky above the buildings.
032.jpg,A man is wearing a blue shirt and a tie. He is holding a red book in his hands. There are tall buildings behind the man. There is a cloudy sky above the buildings.
033.jpg,A man is wearing a blue shirt and a tie. He is wearing glasses and has short black hair. There are tall buildings behind the man. 
034.jpg,A man in a blue shirt and tie is standing in front of a large sign. The sign is white and has writing on it. There are trees behind the man. 
035.jpg,A large crowd of people are gathered outside. There are two red tents set up behind the crowd. There is a large white sign hanging from a pole in front of the people. The sign has red writing on it. 
036.jpg,There are people standing around a table. There is a woman wearing a white hat and a blue jean jacket. There are vegetables on the table in front of her. 
037.jpg,There are people standing around a table. There is a woman wearing a white hat and a blue shirt. She is holding a head of broccoli in her hands. 
038.jpg,There are several people standing around a table. There is a red and white tent behind them. There are people wearing face masks on their faces. One of them is holding a red flag with a yellow star on it.
039.jpg,There are several people standing around a red and white tent. There is a white building behind the people. They are all wearing white hats and face masks. One person is holding a red flag. 
040.jpg,There is a large white sign hanging from a red pole. There are people standing in front of the sign. There is a tree next to the sign with green leaves on it.
041.jpg,There is a large white sign with green writing on it. There are people standing in front of the sign. There is tall green plants next to the signs. 
042.jpg,A man is standing in front of a crowd of people. He is wearing a white shirt. There is a large red and white umbrella behind the man. 
043.jpg,There are several people standing around tables. There are bottles on top of the tables. Some of the people are wearing hats on their heads. 
044.jpg,There are several people standing around a table. There are large white bowls on the table with green food in them. There is a woman in a black and red shirt standing in front of them.
045.jpg,There are several people standing around a table. There is a white building behind them. All of the people have face masks on. There are red flags on top of the table. 
046.jpg,There are several people standing around a table. There is a woman in a white shirt with a blue lanyard around her neck. She is wearing a white hat. 
047.jpg,There are several people standing around a table. They are all wearing white shirts and white hats. There is a red and white tent behind them. 
048.jpg,There is a man and a woman standing in front of a city skyline. The man is wearing a blue shirt and a tie. He is holding a red object in his hands. The woman is also wearing a red dress. She has short black hair. The sky behind them is orange and yellow. There are tall buildings behind them. 
049.jpg,"A man and a woman are standing in front of a city skyline. The man is wearing a blue shirt and tie, and is holding a book in his hands. The woman is wearing short sleeve red dress. She has short black hair. The sky is orange and cloudy, and there are tall buildings in the background."
050.jpg,A man and a woman are standing in front of a city skyline. The man is wearing a blue shirt and a tie. The woman is also wearing a red dress. They are both holding books in their hands. The sky behind them is orange and yellow. There are tall buildings behind them. 
051.jpg,There is a man and a woman standing in front of a screen. The man is wearing a blue shirt and a tie. He is holding a red book in his hands. The woman is standing next to him wearing a red dress. There are tall buildings on the screen behind them. There is clouds in the sky above them.
052.jpg,There is a man wearing a red shirt and a blue lanyard around his neck. He is wearing a black hat. There are people walking around him. There is a building behind them. 
053.jpg,People are standing outside of a building. There is a large red and yellow flag hanging from a pole in front of the building. The building has a black gate on the front of it. 
054.jpg,There are several people standing in a line. There is a man in a red jacket and a red hat. There are flowers in front of them. 
055.jpg,There is a woman wearing a white shirt. She has long black hair in a ponytail. She is wearing earphones in her ears. There are green bars behind the woman. 
056.jpg,A woman is writing in a notebook. She is holding a blue pen in her right hand. Her nails are painted a light pink color. There is a video playing in the bottom right of the image.
057.jpg,There is a small shrine in front of a building. There is a green gate in front and a red curtain hanging from the side of the gate. There are chinese writing on the front of the building. 
058.jpg,A man is wearing a red hat and glasses. He has a red jacket on and a white shirt. There is a red banner behind him. There are pictures on the wall. 
059.jpg,A man is wearing a red hat and glasses. He is standing in front of a white wall with pictures on it. There is a red banner hanging on the wall behind him.
060.jpg,There is a man in a red shirt and a red hat standing next to a woman. They are standing in front of a wall with a gate on it. The woman is wearing a white shirt. 
061.jpg,The image is a screenshot from a video. It is a foreign language. The time is 06:33:28 on the top right corner of the screen. There is an image in the middle that is blurred. There are words in the bottom left and right corners that are not in English. The words on the bottom right corner are in Vietnamese.
062.jpg,There are people standing in front of a building. There are red and yellow flags hanging from the ceiling. There is a man in a black shirt standing in the front of the crowd. 
063.jpg,There are several people standing in a room. There is a man in a black suit standing in front of a yellow pole. There are people wearing blue lanyards around their necks. The man in the red shirt is wearing a red hat.
064.jpg,There are several people walking down the street. There are several buildings on the side of the street next to them. There is a man in a black suit and a black hat on his head. 
065.jpg,There are several people standing in front of a white wall. There is a man in a black shirt and a black hat. He is wearing glasses and has a blue lanyard around his neck. 
066.jpg,There are several people standing in a room. There is a man in a black suit standing in front of a yellow pole. There are people wearing blue lanyards around their necks. The man in the red shirt is wearing a red hat.
067.jpg,There are several people standing in front of a black gate. There are red flags hanging from the gate. The people are wearing hats on their heads. 
068.jpg,A television set is being shown. There is a man and a woman standing in front of a large screen. The man is wearing a blue shirt and tie and is standing behind a white table. The woman is standing next to him wearing a red shirt and a red skirt. There are large buildings on the screen behind them.
069.jpg,A woman in a red dress is standing in front of a screen. She is holding a tablet in her hand. There is a picture on the screen next to her. There are people sitting around a table. 
070.jpg,A woman in a red dress is standing in front of a screen. She is holding a tablet in her hands. There is a picture on the screen next to her. There are people sitting around a table. 
071.jpg,A woman in a red dress is standing in front of a screen. She is holding a tablet in her hands. There is a picture next to the woman on the screen. 
072.jpg,A woman is standing in a room. She is wearing a pink shirt and a pink skirt. There is a large picture on the wall behind her. There are people standing in front of the picture. 
073.jpg,There are people standing around a table. There is a man in a black jacket and a white hat on. There are wooden sticks on the ground around them. 
074.jpg,A man is wearing a white shirt. He is holding a yellow flower in his hand. There is a white table behind him with books and glasses on top of it. 
075.jpg,There are people sitting around a table. There is a large window on the wall behind them. There are shelves on the side of the room with various items on them. 
076.jpg,There is a woman wearing a black shirt. She is wearing glasses. There is a white wall behind her with a red flag hanging on the wall. Next to the woman is a small table with a lamp on it. 
077.jpg,There is a red table in a room. There is a silver clock on the table in front of the dragon. The dragon is made out of paper and has long legs. 
078.jpg,A man is wearing a brown hat and black glasses. He is sitting in front of a white wall. There is a white shelf behind him. 
079.jpg,A man is sitting on the floor. He is wearing a large hat on his head. There are scissors and other items on the ground in front of him. The man is wearing glasses on his face. 
080.jpg,A man is sitting on the floor. He is wearing a large hat on his head. There are scissors and a pair of pliers on the ground in front of him. The man is wearing glasses on his face. 
081.jpg,A person is sitting on a wooden floor. They are wearing a black shirt. There is a white container on the floor in front of the person. The person is holding a yellow object in their hands. 
082.jpg,There is a red wall hanging on a white wall. There are paper animals on the wall hanging. There is a brown butterfly on the red wall. 
083.jpg,A red wall has a white rabbit on it. The rabbit is made out of paper. There is a white board next to the wall. 
084.jpg,Two people are sitting on the floor in a room. They are holding long sticks in their hands. There is a white shelf on the wall behind them. 
085.jpg,There are people sitting on the floor. They are holding yellow flowers in their hands. There is a table in front of them with books on it. 
086.jpg,A man in a blue shirt and tie is standing in front of a city. He is holding a book in his hands. There are tall buildings behind him. 
087.jpg,A man in a blue shirt and tie is standing in front of a city. There are tall buildings behind the man. There is a cloudy sky above the buildings.
088.jpg,A man in a blue shirt and tie is standing in front of a city. He is holding a tablet in his hands. There are tall buildings behind him. 
089.jpg,A bunch of durian fruit is seen in a foreign language. The durian is green and spiky and looks like a jackfruit. There is a white background behind the fruit.
090.jpg,A bunch of durian fruit is seen on a news channel. The durian is green and spiky and looks like it has been cut in a bunch. There is a red banner at the bottom of the screen with the news channel's logo on it. The time on the screen is 06:35:37.
091.jpg,A man is standing outside on a sunny day. He is wearing a long sleeve shirt and a red and black hat. The man is holding a basket in his hands. There are trees and bushes surrounding the man. The ground is covered in grass and dirt.
092.jpg,There are many green spiky trees. There are small brown poles sticking out of the top of the trees. The trees have small white balls on top of them.
093.jpg,A man is standing next to a large bag of fruit. He is wearing a long sleeve white shirt. There is a scale next to the bag. 
094.jpg,A person wearing a white glove is holding a fruit. There is a blue fence in front of the person. There are green plants on the ground behind the fence. 
095.jpg,A person wearing a white glove is holding a green fruit. There are several large fruits in front of the person. There is a brown crate behind them. 
096.jpg,There is a man wearing a white shirt and a green hat. He is leaning on a blue fence. There are trees behind the fence. 
097.jpg,There is a large tree in the middle of a field. There are many leaves on the ground around the tree. There is grass around the trees. 
098.jpg,There is a small pond in the middle of a forest. There are trees surrounding the pond. There is a patch of grass in front of the water. 
099.jpg,There are three men standing under a tree. One of the men is wearing a green hat and glasses. He is holding a fruit in his hand. The other two men are looking at the fruit. 
100.jpg,There are three men standing under a tree. The man on the left is wearing a black hat and glasses. He is also wearing a white shirt with small black dots on it. The other two men are wearing white shirts. They are also wearing hats on their heads. There are large green fruits hanging from the branches of the tree.
101.jpg,A picture of a lush green forest. There are lots of trees and plants in the picture. There is a lot of water coming out of the trees. 
102.jpg,There are a bunch of durian fruit. They are green and spiky. They have small brown tips on the top of them. There is a watermark in the top right corner of the photo.
103.jpg,"The image is red and white. There are dots on the red background. The dots are small and white in color. The lines on the image are dark red. The background is white. On the top right corner of the image there is a watermark that says ""HTV"" in red letters. The watermark is in black letters."
104.jpg,There is a large truck parked in a parking lot. There is a red car parked next to the truck. There are wires hanging above the street.
105.jpg,There is a large white truck on the street. There is a tree next to the truck. There are buildings next to them. 
106.jpg,A picture of a house on fire. The fire is bright orange and yellow. There is a water tower next to the house. There are trees in front of the fire. 
107.jpg,There is a group of people standing in front of a building. There is a large cloud of smoke coming out of the building. The man in the front is wearing a red jersey with the number 3 on it.
108.jpg,A red and white graphic is shown. There is a large white stripe on the right side of the image. There are dots on the bottom left side of this image. The dots are small and are arranged in a triangle shape. The image has a dark red background on the left side.
109.jpg,A man in a blue shirt and tie is standing in front of a city. He is holding a book in his hands. There are tall buildings behind him. 
110.jpg,A man is standing in front of a city skyline. He is wearing a blue shirt and a tie. He has glasses on and is holding a book in his hands. The sky is orange and cloudy. There are tall buildings all around the man.
111.jpg,There are several people sitting in red chairs. There is a podium in front of them. There are people standing in a room behind them. They are all wearing blue jackets.
112.jpg,There are several men standing in a line. They are all wearing blue shirts and have face masks on. There is a white wall behind them.
113.jpg,There are several people sitting at a long table. There are large windows behind them with white curtains on them. There is a man in a black suit standing in front of the table.
114.jpg,A man in a red and black robe is standing behind a podium. He is holding a blue folder in his hands. There is a microphone in front of him. 
115.jpg,There are several men standing in a line. They are wearing blue shirts and have white face masks on their faces. There is a white wall behind them.
116.jpg,There are several men standing in a room. They are all wearing blue shirts and have face masks on. There are red chairs in front of them. There is a white wall behind them.
117.jpg,There are people standing in a room. They are all wearing blue shirts and have face masks on. There is a white curtain hanging on the wall behind them.
118.jpg,There are several people standing in a room. They are all wearing blue shirts and have face masks on. There are red chairs in front of them. 
119.jpg,There are several trucks parked on the street. There are people standing in front of the trucks wearing black uniforms. They are wearing helmets on their heads. 
120.jpg,There are three cars parked in front of a white building. There is a man in a green shirt standing behind a white box. The man is wearing a face mask on his face. 
121.jpg,A woman is standing in front of a screen. She is wearing a red dress and holding a red folder. There is a picture on the screen behind the woman. There are buildings on the ground behind her. 
122.jpg,A woman is standing in front of a screen. She is wearing a red dress and holding a tablet in her hands. There is a large picture on the screen behind her. There are buildings on the ground behind the woman. 
123.jpg,There is a large truck driving on the street. There is a red car next to the truck. There are wires hanging above the street above the cars.
124.jpg,There are several trucks on the street. There is a white car in front of the trucks. There are wires hanging above the cars. 
125.jpg,There is a large truck on the street. There is a white car next to the truck. There are power lines above the street and a large tree. 
126.jpg,There is a large truck parked on the street. There is a red car parked in front of the truck. There are power lines above the street in the air. There's a large tree next to the trucks. 
127.jpg,This is a picture of a city. The picture is very colorful. There is a big tree in the middle of the picture. The tree is green. The sky is blue and white. There are buildings by the road. The road is light brown. The street light is on the right side of the street. The letters on the bottom of the screen are white.
128.jpg,A white car is parked on the street. There is a black car behind the white car. There are people standing in front of a building. 
129.jpg,A white car is parked on the street. There are several vans behind the car. There is a red car next to the white van. 
130.jpg,A white car is parked on the street. There are several trucks behind the car. There is a large white van on the other side of the road. 
131.jpg,There is a large black truck on the street. There is a white car parked on the side of the street in front of the truck. There are power lines hanging above the street next to the car.
132.jpg,A man is wearing a blue shirt and a tie. He is holding a book in his hands. There are tall buildings behind the man. There is a cloudy sky above the buildings.
133.jpg,A man is standing in front of a city skyline. He is wearing a blue shirt and a tie. He has glasses on and is holding a tablet in his hands. The sky behind him is orange and yellow. There are tall buildings all around him.
134.jpg,There is a picture of a fire on the screen. There is a tree in front of the fire. The tree has purple flowers on it. There are white clouds in the sky. 
135.jpg,There is a lot of smoke coming out of a building. There are power lines above the building. The sky is white and cloudy.
136.jpg,There is a building on fire. There is smoke coming out of the building. There are people standing in front of it. They are wearing hard hats. 
137.jpg,There are people standing in front of a building. There is a person wearing an orange shirt with the number 3 on it. There are clouds in the sky above the building.
138.jpg,There is a large structure that appears to be under construction. There are wires hanging above the structure. There is a tree in front of the building. 
139.jpg,A man is wearing a blue shirt and a tie. He is holding a book in his hands. There are tall buildings behind the man. There is a cloudy sky above the buildings.
140.jpg,A man is wearing a blue shirt and a tie. He is holding a book in his hands. There are tall buildings behind the man. There is a cloudy sky above the buildings.
