frame,caption
001.jpg,A beautiful sunset over a city. The sky is orange and pink. There are a couple of giant letters that spell out the name of the city. There is a large body of water in front of the buildings.
002.jpg,A man and a woman are standing in front of a news desk. The desk is white and has a red logo on it. The man is wearing a white shirt and tie and is looking down at his phone. The woman is standing behind him wearing a blue top. There is a large screen behind them. There are buildings on the screen.
003.jpg,A man and a woman are standing behind a news desk. They are both dressed in business attire. The man is wearing a white collared shirt and a black tie. The woman is dressed in a blue long sleeve shirt and blue pants. The desk is white and has red letters on it. There is a large screen behind them that shows a city skyline.
004.jpg,A red and white graphic is shown. There is a large red stripe on the right side of the image. There are dots on the bottom left side. The dots are small and white. The image has a shadow on the left side of it.
005.jpg,The image is a graphic. The background is red and white. There are dots on the left side of the image. There is a big red and silver symbol in the middle. The symbol looks like a fan.
006.jpg,There are several men standing in front of a large white sign. There is a man in a blue shirt standing next to the sign. 
007.jpg,"This is an aerial view of a port. There is a large cargo ship in the middle of the water. The ship has many containers on it. The containers are red, green, and blue. There are two small barge in the water near the ship. The water is a dark green color. The sky above the ship is blue with white clouds."
008.jpg,A red and white graphic is shown. There is a large red diagonal stripe on the right side of the image. There are dots on the left side of an image. The dots are small and white.
009.jpg,A man is wearing a white shirt and a black tie. He is holding a book in his hands. There are buildings behind the man. There is a cloudy sky above the buildings.
010.jpg,A man is standing in front of a cityscape. He is wearing a white shirt and a black tie. He has glasses on and is holding a wallet in his hands. The sky behind him is orange and yellow. 
011.jpg,A man is standing in front of a cityscape. He is wearing a white shirt and a black tie. He has glasses on and is holding a book in his hands. The sky behind him is orange and yellow. 
012.jpg,There are several men standing on a bridge. They are all wearing white shirts and black pants. There is a silver railing on the bridge. There are tall light poles behind them. 
013.jpg,There are several men standing on a bridge. They are all wearing blue shirts and black pants. There is a silver railing on the bridge. There are trees behind the railing. 
014.jpg,There are several men standing in front of a white sign. There is a man in a blue shirt standing next to them. There are trees behind them. 
015.jpg,There is a large white structure with a blue bridge on top of it. There is a fence in front of the building. There are trees behind the fence. 
016.jpg,A picture of a construction site. There is a large crane in the picture. The crane is orange. There are other cranes in the background. The sky above the picture is hazy. 
017.jpg,There is a large green and gray construction vehicle parked in front of a building. There is a man in a white shirt standing inside of the vehicle. There are wires above the building. 
018.jpg,There is a blue and white boat in the water. There are tires on the bottom of the boat. There is trees behind the boat on the ground. 
019.jpg,There are several boats in the water. There are green plants in front of the boats. There is a brown boat in the middle of the water with many items on it. 
020.jpg,There are several cranes in the background. There is a large blue structure in front of the cranes. There are wooden poles in front and a flag hanging from one of the poles. 
021.jpg,There is a large building under construction. There is a tall red crane next to the building. There are several beams in front of the building that are brown. 
022.jpg,There is a large white building under construction. There is a tall crane next to the building. There are wooden beams in front of the building on the ground. 
023.jpg,There is a large building under a blue sky. There is a red flag on the top of the building. There are words under the building in white. 
024.jpg,There is a large metal structure in front of a white building. There is a red flag on top of the building. The sky is blue and there are clouds in the sky.
025.jpg,There is water under a bridge. There is a small boat in the water. There are trees behind the bridge. 
026.jpg,A woman is standing in front of a city skyline. She is wearing a blue long sleeve shirt. She has short black hair and earrings in her ears. The woman is holding a red book in her hands. The sky behind her is orange and yellow. There are tall buildings behind her. 
027.jpg,A woman is standing in front of a city skyline. She is wearing a blue dress and holding a tablet in her hands. The sky is orange and cloudy. There are tall buildings behind the woman. 
028.jpg,A woman is standing in front of a city skyline. She is wearing a blue long sleeve shirt. The sky is orange and cloudy. There are tall buildings behind the woman. 
029.jpg,There are two men sitting at a table. They are wearing orange shirts. There are books and papers on the table in front of them. There is a shelf behind them with books on it. 
030.jpg,A person is writing on a piece of paper. There are several other papers on the table in front of them. The person has a silver watch on their wrist. 
031.jpg,A man is wearing an orange shirt and glasses. There are brown vases behind the man. There is a tree behind the vases. 
032.jpg,There are people sitting on a bus. They are all wearing hats and have their hands up in the air. There are black seats in front of them. 
033.jpg,A man is sitting in a seat. He is wearing a green hat with a red star on it. He has black sunglasses on and a white shirt. There are black seats in front of him.
034.jpg,This is an aerial view of an amusement park. The park has a lot of fun rides. There are a bunch of people enjoying the rides.
035.jpg,This is an aerial view of a city. There is a large body of water in front of the buildings. There are several boats docked in the water next to a large white building. 
036.jpg,There are several people sitting around white tables. There is a man in a blue shirt standing in front of a white table. There are trees behind the tables. 
037.jpg,There are several people standing around a silver machine. There is a man in a yellow tank top standing in front of the machine. Next to him is another man wearing a white tank top. 
038.jpg,A woman in a blue dress is standing on the deck of a boat. There is a man in a black shirt and tan pants sitting in the back of the boat. The boat is white and blue. There are tall buildings in the background. 
039.jpg,There are people sitting around a table. They are holding up glasses with drinks in them. There is a wooden table in front of them with plates of food on it. 
040.jpg,There are several people sitting around a table. There is a man in a blue polo shirt sitting in front of the table with his hands in the air. There are plates of food on the table. 
041.jpg,Two men are wearing orange polo shirts. They are standing in front of a table that has boxes on it. There are shelves behind them with books on them. 
042.jpg,A man is wearing an orange shirt and glasses. There are large green plants behind him. There is a white building behind the man. 
043.jpg,There are two boats in the water. The water is calm and has ripples in it. There are mountains in the distance. The sky is blue with white clouds.
044.jpg,A man in an orange shirt and black pants is standing in front of a bus. There are people sitting in the bus. They are wearing white hats on their heads. There is a white van behind the man. 
045.jpg,A bunch of people are riding on a bus. They are all sitting in the back of the bus. There are a bunch of motorcycles on the street next to them. There is a man in an orange shirt standing in front of them. 
046.jpg,A man is standing in front of a city skyline. He is wearing a white shirt and a black tie. He has glasses on and is holding a tablet in his hands. The sky behind him is orange and yellow. 
047.jpg,A man is wearing a white shirt and a black tie. He is wearing glasses and has short black hair. There are tall buildings behind the man. There is a yellow sky above the buildings.
048.jpg,A man is standing in front of a city skyline. He is wearing a white shirt and a black tie. He has glasses on and has short black hair. The sky behind him is orange and yellow. 
049.jpg,"The image is a screenshot of a website called ""Geopolitical Monitor"" which is a website for the Vietnam's Market Economy status.  The website has a header that says ""The Case for Vietnam's market Economy Status"" and below that is a description of the website.  There is a picture of a flag of Vietnam on the bottom of the page.   The flag is red with a yellow star in the center and is waving in the wind."
050.jpg,"The case for Vietnam's market economy status is displayed on a computer monitor.  The monitor has a white background and a red flag with a yellow star on it.  There is a red banner at the bottom of the monitor with the words ""bao hiem cho ngoi da tham gia bao hiem y te bai buoc"" written in white text."
051.jpg,The background is red and yellow. In the middle of the picture there is a white box with black text in it. The text is in a foreign language. At the top right corner there is the logo for HTV9 HD. The time is 06:34:16.
052.jpg,"The background of the image is red and yellow. There is a white text box in the image. The text box is titled ""The bilateral benefits for US companies derived from recognition of Vietnam as a market economy includes market access and export opportunities, name in agriculture, machinery, aircraft, and pharmaceutical products, all of which contribute to the development of a supply chain that suits America's interests."" "
053.jpg,"The background of the image is red and orange. There is a white text box in the image. The text box is titled ""The bilateral benefits for US companies derived from recognition of Vietnam as a market economy includes market access and export opportunities, name in agriculture, machinery, aircraft, and pharmaceutical products, all of which contribute to the development of a supply chain that suits America's interests."" "
054.jpg,There is a large red crane on the ground. There are trucks next to the crane. There is a white and red truck next to a large black ship. 
055.jpg,"This is a picture of a cargo ship. The ship is loaded with cargo containers. The containers are blue, red, and brown. There is a large white crane on the ship. There are trucks parked next to the crane. The sky above the ship is light blue. The picture has writing on the bottom of it."
056.jpg,There are several large trucks parked next to each other. There are red and blue containers on top of the trucks. There is a man in a white helmet standing on the top of one of the containers.
057.jpg,A woman in a green shirt and black pants is pushing a red shopping cart in a store. There are shelves on the right side of the woman with various items on them. On the left side there is a large yellow sign that says sale on it. 
058.jpg,A man in a yellow shirt is wearing a face mask. There is a blue machine in front of the man. 
059.jpg,There is a large white building with many flags in front of it. There is a white car on the street next to the flags. There are palm trees in the front of the building. 
060.jpg,There are several women sitting around a desk. There is a computer monitor in front of them. One of the women is wearing a white shirt. 
061.jpg,There are tall buildings in a city. There are many windows on the buildings. The sky is cloudy. There is a red and white logo on the top right of the image. 
062.jpg,A man is standing in front of a city skyline. He is wearing a white shirt and a black tie. He has glasses on and is holding a wallet in his hands. The sky behind him is orange and yellow. 
063.jpg,A man is standing in front of a city skyline. He is wearing a white shirt and a black tie. He has glasses on and has short black hair. The sky behind him is orange and yellow.
064.jpg,A man is wearing a white shirt and a black tie. He is holding a tablet in his hands. There are tall buildings behind the man. There is a yellow sky above the buildings.
065.jpg,"This is an aerial view of a port. There is a large cargo ship in the middle of the water. The cargo ship has many containers on it. The containers are red, blue, and green. The ship is gray and white. The water is calm and blue. The sky is blue with white clouds."
066.jpg,This is an aerial view of a port. The port is surrounded by water. The water is calm. There is a dock in the middle of the water. There are lots of containers on the dock. The containers are red and white. The sky above the port is gray. There small hills in the background of the port.
067.jpg,There is a large blue ship in the water. There are many colorful containers on the side of the ship. There is a tall blue crane next to the ship on the ground. The sky above the ship is blue with white clouds.
068.jpg,"There is a large cargo ship in the water. The ship has many containers on it. The containers are red, blue, green, and white. There is land next to the ship. "
069.jpg,"This is an aerial view of a port. The port has many containers. The containers are multicolored. Some containers are blue, red, and white. There are yellow cranes in the port. There is a large body of water to the right of the containers. Mountains can be seen in the background of the image."
070.jpg,"This is an aerial view of a port. The port has lots of containers. The containers are multicolored. Some containers are blue, some are red, and some are white. There are yellow metal structures in the port. There is a large body of water to the right of the containers. Mountains can be seen in the background of the photo."
071.jpg,A large cargo ship is docked at a port. The ship has many containers on it. There is a bridge next to the ship. 
072.jpg,There is a large cargo ship in the water. The ship is white and has a lot of containers stacked on top of each other. The containers are multicolored. There is a dock next to the ship. 
073.jpg,There are several people sitting at long tables. There is a large screen in front of them on the table. There are lights hanging from the ceiling above the tables.
074.jpg,A man in a blue suit is standing in front of orange blinds. He is wearing a white collared shirt. There are people behind him sitting in chairs. 
075.jpg,A man is sitting at a table. He is wearing a blue suit and glasses. There are black chairs in front of him. There is a red sign behind him. 
076.jpg,A man is sitting at a table. He is wearing a blue suit and glasses. There are black chairs in front of him. There is a red sign behind him. 
077.jpg,A man is sitting in a black chair. He is wearing a blue suit and a blue shirt. He has short black hair and is wearing glasses. There is a microphone in front of him. 
078.jpg,There is a large screen in front of a group of people. There is a red wall behind them with a statue on top of a podium. There are black speakers on the wall behind the podium. 
079.jpg,There are several people sitting at a table. There is a man in a suit sitting in front of a microphone. There are bottles and glasses on top of the table. 
080.jpg,There are several people sitting around a table. There is a large monitor on the table in front of them. There are windows on the wall behind them.
081.jpg,"A red and black background with white lines on it. In the center of the background is white writing that says ""Doi SONG TIEU DUNG"". The writing is in all caps and is in a bold font. There is a small logo in the top right corner that reads ""HTV9 HD 06:36:10""."
082.jpg,A woman in a blue dress is standing in front of a screen. There is a large screen on the wall behind her. There are buildings on the screen. 
083.jpg,A woman is standing on a news set. She is wearing a long blue dress. There is a large screen on the wall behind her. There are buildings on the ground behind the screen. 
084.jpg,There is a tree with no leaves on it. There are small green leaves on the branches of the tree. There is a white sky behind the tree with clouds in it.
085.jpg,A white car is driving on the street. There are trees lining the street in front of the car. There is a red sign on the side of the street next to the trees. 
086.jpg,There is a tree with many branches on it. There are small white balls hanging from the branches. There is a red and white sign under the tree. 
087.jpg,A tree branch with green fruit hanging from it. There are no leaves on the branch. There is a blue sky behind the tree. 
088.jpg,A woman is standing in front of a tree. She is wearing a white shirt and black glasses. The tree has pink flowers on it. The woman has dark hair. 
089.jpg,There is a woman wearing a white shirt. She has black glasses on. There are trees behind her with flowers on them. The woman has her mouth open. 
090.jpg,There are several people riding motorcycles on the street. There are trees on the side of the street next to a fence. There is a person in a yellow shirt standing on the sidewalk next to the fence.
091.jpg,A tree branch is seen in a foreign language. The tree has green leaves and white flowers on it. The sky is blue and there are no clouds in the sky.
092.jpg,There are trees in the distance. There are white flowers on the branches of the trees. The sky is blue and there are no clouds in the sky.
093.jpg,There are trees on the side of the road. There are people walking on the sidewalk next to the trees. There is a motorcycle on the street. 
094.jpg,A man and a woman are standing in front of trees. The man is wearing a black shirt with a pair of sunglasses on it. The woman has a yellow shirt on and sunglasses on her head. There is a fence behind them. 
095.jpg,A tree branch with white flowers on it. There are no leaves on the branch. There is a blue sky behind the tree. 
096.jpg,There are four people standing on the sidewalk. There is a man in a black shirt standing in front of them. There are trees behind the fence. 
097.jpg,There is a man and a woman standing next to each other. The man is wearing a black polo shirt with a pair of sunglasses hanging from his shirt. The woman has a yellow shirt on and her hair is up in a bun. There are trees behind them.
098.jpg,"A tree branch is shown with white cotton flowers on it. The cotton flowers are hanging from the branches. The sky is blue and clear. There is a watermark in the top right corner of the image that says ""HTV9 HD"" in red letters. Below the image there is a caption in Vietnamese that ends with ""Loc, tinh lam lam dong co dau hieu bi ke gian pha hoai""."
099.jpg,A tree with white cotton flowers on it. The tree has green leaves on the branches. The sky behind the tree is blue. There is a red and white logo on the top right corner of the image. 
100.jpg,A tree branch is seen in the daytime. The branches are bare and have no leaves on them. There are a bunch of fruit hanging from the branch. The fruit are green in color and some of them are still attached to the branch while others are not. The sky is white and there are no clouds visible.
101.jpg,A tree branch is seen in the daytime. The branches are bare and have a bunch of fruit hanging from them. The fruit are green and some of them are still attached to the branch. There are also some birds on the branches. The sky is white and there are no clouds in the sky.
102.jpg,There are people standing on the sidewalk next to the street. There is a person riding a motorcycle on the street in front of them. There are trees on the side of the street next to them. 
103.jpg,A red light is on a black screen. There are small white dots on the red light. There is a fence behind the fence. 
104.jpg,"The image is a logo for a news channel. The logo is red and white. The background is red with white lines. The letters are red and silver. The word ""giay"" is written in the center of the logo. There is a date and time stamp in the top right corner. The time stamp reads 06:37:26."
105.jpg,There is a motorcycle that has crashed on the side of the road. There is a woman standing next to the motorcycle. There are trees on the hill behind the woman. 
106.jpg,A white jeep is on the ground. There are weeds around the jeep. There is a red border around the image. 
107.jpg,There are people standing in a room. There is a man in a blue suit standing in front of a podium. There are people in green uniforms standing behind him. 
108.jpg,There are several people standing in a room. There is a large window on the wall behind them. There are tables and chairs in front of them. 
109.jpg,There are four guns on a white table. The table is made of tiles. The guns are silver and black. There is a red border around the image. 
110.jpg,"The image is red and white. The background is white. There is a big red circle in the middle of the image. There are dots on the red circle. The dots are small and small. The lines on the image are red. The image has a green tree in the bottom left corner. There's a logo in the top right corner that says ""HTV HD"" in red letters."
111.jpg,A woman is standing in front of a screen. She is wearing a long blue dress and holding a red folder in her hands. There is a large picture on the screen behind the woman. 
112.jpg,A news anchor is standing in front of a city skyline. She is wearing a blue long sleeved dress. She has short dark hair and is holding a tablet in her hands. Next to her is a picture of the city skyline with a large red and white logo.
113.jpg,There is a blue motorcycle on the ground. There is a person standing behind the motorcycle with a basket on the back of it. There are two people standing in front of the motorcycle. 
114.jpg,A person is standing on a hill. They are wearing a striped shirt and purple pants. There is a large silver object on the ground in front of the person. 
115.jpg,A white car is on the ground. There are weeds around the car. There is writing on the bottom of the picture. 
116.jpg,There is a white jeep on the ground. There are weeds around the jeep. There is a large hill behind them. 
117.jpg,A man is wearing a white shirt and a black tie. He is holding a tablet in his hands. There are tall buildings behind the man. There is a yellow sky above the buildings.
118.jpg,A man is standing in front of a city skyline. He is wearing a white shirt and a black tie. He has glasses on and is holding a book in his hands. The sky behind him is orange and yellow. 
119.jpg,There is a white car on the street. There are two large trucks next to the car. There is a red sign behind the truck. 
120.jpg,There are several motorcycles parked on the side of the street. There is a white and red truck on the street next to the motorcycles. There are people standing in front of the flowers. 
121.jpg,There are several large trucks driving on the street. There is a white car behind the trucks. There are wires above the street hanging from poles. 
122.jpg,There is a motorcycle laying on its side on the street. There is a white truck behind it. There are people standing on the sidewalk next to the motorcycle. 
123.jpg,There is a white crosswalk on the street. There is a red and white barricade on the side of the street next to the crosswalk. There are several buildings on the other side of it. A motorcycle is parked in front of the barricade.
124.jpg,There is a white car driving on the street. There is a red building behind the car. There are wires above the street in front of the building. 
125.jpg,There are several people riding motorcycles on the street. There is a white building behind them with a blue awning on the front of it. There are wires above the street hanging from poles. 
126.jpg,A white car is on the street. The front of the car has been smashed in. There is a yellow building behind the car. 
127.jpg,A white car is driving on the street. There is a motorcycle next to the car. There are buildings on the side of the road. 
128.jpg,There are two motorcycles parked on the sidewalk. There is a green and white umbrella in front of the building. There are people standing in front and walking on the street. 
129.jpg,A woman is standing in front of a screen. She is wearing a blue dress and holding a tablet in her hands. There is a large picture on the screen behind her. There are buildings on the ground behind the woman. 
130.jpg,A woman is standing in front of a screen. She is wearing a blue dress and holding a tablet in her hands. There is a large picture on the screen behind her. There are many buildings on the ground behind the woman. 
131.jpg,A woman is standing in front of a screen. She is wearing a blue dress and holding a tablet in her hands. There is a large picture on the screen behind her. There are many buildings on the ground behind the woman. 
132.jpg,A woman is standing in front of a screen. She is wearing a blue dress and holding a tablet in her hands. There is a large picture on the screen behind the woman. There are many buildings on the ground behind her. 
133.jpg,There are several people standing in a room. There is a man in a blue suit standing in front of a podium. There are two people behind him wearing green uniforms. 
134.jpg,There are five people sitting at a table. There is a man in a red suit standing in front of the table. He is holding a piece of paper in his hands. There are two women sitting next to him. They are all wearing white shirts and ties. 
