frame,caption
001.jpg,A beautiful sunset over a city. The sky is orange and pink. There are many buildings in the city. There is a large body of water in front of the buildings. 
002.jpg,A man and a woman are standing behind a white table. There is a large screen behind them. The man is wearing a blue shirt and a white tie. The woman is also wearing a white shirt. They are standing in front of a red carpet.
003.jpg,A man and a woman are standing in front of a news desk. The desk is white and has a red logo on it. The man is wearing a blue shirt and tie and is holding a book in his hands. The woman is also wearing a white top and has long black hair. There is a large screen behind them.
004.jpg,A man and a woman are standing in front of a news desk. The desk is white and has a red logo on it. The man is wearing a blue shirt and a white tie. The woman has a white dress on and has long black hair. There is a large screen behind them that has a city on it and clouds in the sky.
005.jpg,"The image is a graphic. The background is red and white. There are diagonal white and red stripes. In the center of the graphic is a gray circle. The gray circle has a small light inside of it. The light is bright. There is a small text in the top right corner that reads ""HTV9 HD 06:29:45""."
006.jpg,There are several children sitting in chairs. There is a woman in a pink jacket sitting at a table in front of them. There are wooden slats on the wall behind them.
007.jpg,There are people standing on a stage. There is a mannequin wearing a white dress. There are two women standing in front of the mannequins. One of the women is wearing a red dress and a red hat. 
008.jpg,There are several people standing on a stage. They are dressed in different outfits. They have hats on their heads. There is a large screen behind them. 
009.jpg,There is a person riding a motorcycle down the street. There are white lines on the street in front of the motorcycle. There is a blue fence on the side of the street next to the sidewalk.
010.jpg,A group of women are standing on a stage. They are all wearing long dresses. There is a man in a black suit standing behind them. There are lights on the stage behind the women. 
011.jpg,A woman is standing on a stage. She is wearing a white dress with feathers on the shoulders. She has a crown on her head and a sash around her waist. The woman has long blonde hair and is smiling. There are lights behind her.
012.jpg,"The image is a graphic design. The background is red and white. The design is made up of squares. The squares are red with small white dots. The lines are white and black. In the center of the design are the numbers 6 and 6. The numbers are red and silver. There is a small logo in the top right corner of the image that says ""HTTV"" in white letters."
013.jpg,A man is standing in front of a picture of a city. He is wearing a blue striped shirt and a white tie. The man is holding a red wallet in his hands. There are tall buildings behind the man. 
014.jpg,A man is standing in front of a city skyline. He is wearing a blue striped shirt and a white tie. The man is holding a red phone in his hands. The sky behind the man is orange and yellow. 
015.jpg,A man is standing in front of a city skyline. He is wearing a blue striped shirt and a white tie. The man is holding a red wallet in his hands. The sky behind the man is orange and yellow. There are tall buildings all around the man.
016.jpg,A man is standing in front of a city skyline. He is wearing a blue striped shirt and a white tie. The man is holding a red wallet in his hands. The sky behind the man is orange and yellow. There are tall buildings all around the man.
017.jpg,A man is standing in front of a city skyline. He is wearing a blue striped shirt and a white tie. The man is holding a red wallet in his hands. The sky behind the man is orange and yellow. There are tall buildings all around the man.
018.jpg,There are several children sitting on chairs. There is a woman in a pink shirt sitting in front of them. There are wooden sticks behind them.
019.jpg,There are several children sitting around a table. There is a woman in a pink jacket sitting in front of the table. She is holding a piece of paper in her hands. 
020.jpg,There is a wooden fence in front of a blue tarp. There is a tree trunk in the middle of the fence. There are two people standing next to the fence on the right. 
021.jpg,There are several children sitting in chairs in a room. There is a blue wall behind them with a window on it. There are wooden slats on the wall in front of them. 
022.jpg,There is a small wooden structure. There are people standing in front of it. There is a motorcycle parked next to the structure. 
023.jpg,There is a woman standing in front of a doorway. There is a wooden fence next to the woman. The woman is wearing a headscarf on her head. The door is open and there is a blue tarp over the fence. 
024.jpg,There are several children sitting in chairs. There is a woman in a pink jacket standing in front of a table. There are papers on the table. 
025.jpg,A woman in a pink jacket and black pants is standing in front of a group of children. There is a large blue tarp behind the woman. The children are standing next to a building. 
026.jpg,A woman is standing in front of a group of children. She is wearing a pink jacket and blue pants. There is a large blue tarp behind the woman. 
027.jpg,There are several children standing in a circle. There is a motorcycle behind them on the ground. There are trees next to the motorcycle. 
028.jpg,There are several children standing in front of a fence. There is a woman in a pink shirt standing behind them. There are two motorcycles on the ground next to them.
029.jpg,There is a green and white sign on a pole. There are trees behind the sign. There is a white building behind the trees. 
030.jpg,A woman is standing in front of a picture of a city. She is wearing a white dress with long sleeves. The woman has long black hair. There are tall buildings behind the woman. 
031.jpg,A woman is standing in front of a city skyline. She is wearing a white dress with long sleeves. The woman has long black hair and is wearing sunglasses on her head. The sky is orange and yellow. There are tall buildings behind the woman. 
032.jpg,A woman is standing in front of a city skyline. She is wearing a white dress with long sleeves. The woman has long black hair. The sky is orange and cloudy. There are tall buildings behind the woman. 
033.jpg,A large group of people are standing outside of a building. They are all wearing white shirts and black pants. There are large green trees in front of the building. 
034.jpg,There are several people standing in a line. They are all wearing white shirts and black skirts. There is a white building behind them with a large tree in front of it.
035.jpg,A paper is being held by a person. The paper is titled IELTS 9.0 - Study Abroad. The person is holding the paper in their left hand. There are chairs behind the paper.
036.jpg,Two women are standing in a room. There is a white board hanging on the wall behind them. One of the women is wearing a black jacket. She has long brown hair. 
037.jpg,A man is wearing black glasses. He has short black hair and is wearing a black jacket. There is a white shirt on a person behind him.
038.jpg,There are three women standing in a room. One of the women is wearing a black and white checkered shirt. The other two women are wearing white shirts. They are holding papers in their hands. 
039.jpg,There are several people standing in a room. There is a woman in a red dress standing next to a man in a black and white checkered shirt. There are windows on the wall behind them.
040.jpg,There is a woman wearing a white shirt. She is standing in front of a white door. There is a window on the wall behind the woman. 
041.jpg,Two people are sitting at a table. There are papers and pens on top of the table. One of the people is wearing a white shirt. 
042.jpg,A man is standing in front of a city skyline. He is wearing a blue and white striped shirt and a white tie. The man is holding a red phone in his hands. The sky behind the man is orange and yellow. There are tall buildings all around the man.
043.jpg,A man is standing in front of a city skyline. He is wearing a blue striped shirt and a white tie. The man is holding a red phone in his hands. The sky behind the man is orange and yellow. There are tall buildings on the skyline. 
044.jpg,There is a white sign with red writing on it. There is a picture of a white cat on the sign. There are two qr codes next to the picture of the cat. 
045.jpg,A person is holding a tablet in their hand. There is a window behind the person. The person is wearing a green shirt. 
046.jpg,There is a black phone in front of a white paper. There is a basket of green olives behind the phone. There are bags of food next to the phones. 
047.jpg,A woman is wearing a white face mask and a white hat. There are baskets of vegetables in front of her. There is a man in a white jacket standing behind her. 
048.jpg,"A white, red, and blue paper is attached to a clip. On the paper is a picture of a QR code. There is a red check mark on the picture. The background is blurred."
049.jpg,People are walking through a market. There are several stalls on either side of the people. Some of the stalls have bags hanging from the ceiling. There is a man wearing an orange jacket and a black hat. 
050.jpg,A woman is holding a phone in her hand. She has a gold ring on her finger and red nail polish on her nails. There is a white screen on the phone. 
051.jpg,There is a woman wearing a light blue shirt. She is holding a black phone in her hands. There are bags hanging on the wall behind her. There is a white sign in front of the woman. 
052.jpg,There is a white sign next to a jewelry display. There is a bar code on the sign. There are silver bracelets on the display. 
053.jpg,There is a white sign next to a jewelry display. The sign has a qr code on it. There is a red heart on the sign. 
054.jpg,There are several people standing in front of a table full of vegetables. They are wearing hats and face masks. There is a shutter behind them. 
055.jpg,There is a white sign with red writing on it. There is a picture of a white cat on the sign. There are two qr codes next to the cat. 
056.jpg,A person is holding a black phone in their hand. There is a white box in front of the phone. There are red and yellow decorations hanging from the ceiling. 
057.jpg,A woman is standing in a market. She is wearing a white hat and a face mask. There are piles of colorful clothes in front of her. There is a light hanging above her. 
058.jpg,There is a woman in a white shirt standing next to a man. They are in a store. There are clothes hanging on a rack behind them. There is a white hat on the man's head. 
059.jpg,A woman wearing a white hat and a face mask is standing in front of a table full of vegetables. There is a man in a white jacket standing behind her. There are dresses hanging on a rack behind the man. 
060.jpg,A woman is standing in front of a city skyline. She is wearing a white dress with a floral pattern on it. She has long dark hair and is holding a red wallet in her hands. The sky is orange and cloudy. There are tall buildings behind the woman. 
061.jpg,A woman is standing in front of a city skyline. She is wearing a white dress with long sleeves. The woman has long black hair. The sky is orange and cloudy. There are tall buildings behind the woman. 
062.jpg,There is a large white screen in front of a crowd of people. There are lights hanging from the ceiling above the screen. The people are sitting in white chairs. 
063.jpg,There are several tables with yellow tablecloths on them. There are people sitting in chairs in front of the tables. There is a large crowd of people behind them. 
064.jpg,There are several people sitting in chairs. There is a woman in a blue shirt sitting in front of a table with a bouquet of flowers on it. There are water bottles on the table. 
065.jpg,There are several people sitting at a long table. There is a yellow table cloth on the table in front of them. There are white chairs around the table. 
066.jpg,There is a stage with people standing on it. There are lights hanging from the ceiling above the stage. There is a large screen behind the people. 
067.jpg,There are several people standing on a stage. They are dressed in white and pink outfits. There is a large screen behind them with blue and green lights on it.
068.jpg,There is a stage with people standing on it. There is a large tower behind the people on the stage. There are people standing in front of the stage wearing white clothes. 
069.jpg,There is a stage that has people standing on it. There are palm trees on the stage. There is a lot of people standing in front of the stage and there are lights hanging from the ceiling.
070.jpg,There are three people standing on a stage. They are dressed in colorful outfits. They have hats on their heads. There is a man in a white dress standing next to them. 
071.jpg,There are people standing on a stage. They are dressed in colorful outfits. There is a man in a white suit standing in front of them. 
072.jpg,There are several people standing on a stage. They are wearing white and pink outfits. There are large white decorations on the stage. There is a man in a suit walking down the street. 
073.jpg,There are several people standing on a stage. They are dressed in traditional Chinese clothing. There are stairs behind them leading up to the stage. There is a large screen behind them. 
074.jpg,A man and a woman are standing behind a white table. They are both dressed in business attire. The man is wearing a blue shirt and a white tie. The woman is dressed in a white dress with a black collar. There is a large screen behind them with a city scene on it. 
075.jpg,A man and a woman are standing in front of a news desk. The desk is white and has a red logo on it. The man is wearing a blue shirt and tie and is holding a book in his hands. The woman is also wearing a white dress and has long black hair. There is a large screen behind them that has a city scene on it and clouds in the sky.
076.jpg,A man and a woman are standing in front of a large screen. They are both dressed in business attire. The man is wearing a blue shirt and black pants. The woman is dressed in a white dress with a black collar. The screen behind them shows a city skyline with tall buildings. There are clouds in the sky.
077.jpg,A man and a woman are standing in front of a white table. The man is wearing a blue shirt and a white tie. The woman is also wearing a white dress. They are holding red books in their hands. There are tall buildings behind them. 
078.jpg,A man and a woman are standing in front of a white table. The man is wearing a blue striped shirt and a white tie. The woman is also wearing a white dress. They are both holding books in their hands. There is a large cityscape behind them. The sky above them is blue with white clouds.
079.jpg,A city is shown from the top of a skyscraper. There are many buildings in the city. There is a large body of water next to the buildings. The sky above the city is filled with clouds.
080.jpg,A group of people are standing in a large room. They are all holding white papers in their hands. There is a sign hanging from the ceiling that says Danang. There are lights on the ceiling.
081.jpg,There are several people standing in front of a white counter. There is a sign behind them that says Danang. There are lights hanging from the ceiling above them.
082.jpg,This is an aerial view of a city. The buildings are all white with red roofs. There is a large swimming pool in the middle of the buildings. There are trees surrounding the pool. 
083.jpg,This is an image of a resort. The resort has a pool in the middle. The pool is blue. The water is reflecting the sky. The sky is blue with white clouds. There are tall palm trees around the pool. The palm trees are green. There is a lot of flowers in the foreground. The flowers are pink. The bushes are green with yellow flowers.
084.jpg,There are white chairs lined up in a row. There is a pool behind the chairs with water in front of it. There are palm trees behind the pool. In front of the pool is an arch made of purple flowers.
085.jpg,This is a scene from a TV show. There is a large golden domed structure in the background. There are several people standing in front of the structure. They are all wearing white robes and white hats. 
086.jpg,There are people standing outside of a white building. There is a white car parked in front of the building. The people are standing next to a tall palm tree. 
087.jpg,A bald man is wearing a blue suit and a light purple shirt. There are large bushes behind him. There is a tree behind the bushes. 
088.jpg,There are several people standing in front of a white building. There are flowers on top of the people. There is a woman in a purple shirt and a man in a blue shirt. 
089.jpg,There are several people standing in front of a white building. They are holding flowers in their hands. There are trees behind them. 
090.jpg,There are several people standing under a large archway. There is a man in a suit and a white helmet on his head. There are two people in suits holding umbrellas. 
091.jpg,There are several people standing in front of a building. They are all holding umbrellas. There is a man in a suit and a white hat on. 
092.jpg,A man is standing in front of a red sign. He is wearing a black collared shirt and glasses. The sign has writing on it in white letters. There are yellow flowers on the sign.
093.jpg,A large white cruise ship is docked at a port. There are many people walking around the ship. There is a large yellow crane in front of the cruise ship. 
094.jpg,"Five women are standing in front of a large sign that says ""DANANG THE LEADING FESTIVAL AND EXIT DESTINATION"" on it. The women are dressed in yellow outfits with large yellow hats on their heads. Two of the women are wearing hijabs on their head. One woman is wearing a green jacket and the other three are wearing red hijabs."
095.jpg,There are several people standing in a room. There is a woman in a yellow shirt and a man in a black jacket. They are all wearing glasses. 
096.jpg,There are several people standing on a stage. There is a man in a blue shirt holding a guitar. There are microphones in front of him.
097.jpg,There are people standing in front of a building. There are large plants on the wall behind them. There is a woman in a white costume standing next to a person in a red costume.
098.jpg,There are several people standing in front of a building. There are two large white animals standing next to them. There is a man in a suit and a woman in a blue dress.
099.jpg,A man is standing in front of a city skyline. He is wearing a blue striped shirt and a white tie. The man is holding a small red object in his hands. The sky behind the man is orange and yellow. There are tall buildings all around the man.
100.jpg,A man is standing in front of a city skyline. He is wearing a blue striped shirt and a white tie. The man is holding a red wallet in his hands. The sky behind the man is orange and yellow. There are tall buildings all around the man.
101.jpg,A man is standing in front of a picture of a city. He is wearing a blue striped shirt and a white tie. The man is holding a red object in his hands. There are tall buildings behind the man. 
102.jpg,There is a red and white boat in the water. There is a large rock island in the distance. The water is calm and has small waves in it. 
103.jpg,There is a large body of water with several boats in it. There is a red boat in the water. There are large mountains in the distance. The sky above the water is gray and cloudy.
104.jpg,There are several large red boats in the water. There is a large mountain behind the boats. The water is calm and has small waves in it. 
105.jpg,There is a large body of water. There is a dock next to the water with several boats on it. There are cars parked on the dock. 
106.jpg,There is a large red bus on the street. There is a white sign on the side of the bus. There are people standing in front of the train.
107.jpg,A woman is standing in front of a red and white sign. She is wearing a green and yellow jacket. The woman is wearing glasses on her face and is holding a phone in her hand. 
108.jpg,There are several boats in the water. There is a dock next to the water with people standing on it. There are cars parked on the dock. 
109.jpg,There are several boats in the water. There is a large red boat next to a dock. There are people standing on the dock. 
110.jpg,There are boats in the water. There are mountains in the distance. There is a white fence in front of the boats. 
111.jpg,A red and white sign has the word hanging on it. There is a person wearing a white hat in front of the sign. The person is bending down. 
112.jpg,A man in a blue shirt is standing in front of a red train. There is a white sign on the side of the train. The man has short black hair. 
113.jpg,A man is standing in front of a red train. He is wearing a blue collared shirt. There is a white sign on the side of the train. The man has short black hair. 
114.jpg,There is a large red and white boat in the water. There are large mountains behind the boat. The sky above the boat is filled with white clouds.
115.jpg,There is a large white and red boat on the water. There are people standing on the deck of the boat. There is a man in a yellow vest and a white hard hat on. 
116.jpg,There is a large body of water with many small boats in it. There is a red and white boat in the water. There are large mountains in the distance behind the boats. 
117.jpg,A black screen with a red and white image on it. There are small white dots all over the image. There is a red line on the left side of the screen. 
118.jpg,A man is standing on top of a ladder. There is a building behind him. There are people standing in front of the building. 
119.jpg,There is a red truck with blue lights on the top of it. There are people standing in front of the truck. There is a white building behind the trucks. 
120.jpg,A man is sitting in a chair. There is a gray door behind the man. The man is wearing a gray shirt. 
121.jpg,There are six men standing in a line. There are two men in green uniforms holding a white paper. There is a man in a white shirt standing next to them. 
122.jpg,A woman is standing in front of a city skyline. She is wearing a white dress with long sleeves. The woman has long black hair that is pulled back into a ponytail. The sky behind the woman is orange and yellow. There are tall buildings behind the women. 
123.jpg,A woman is standing in front of a city skyline. She is wearing a white dress with long sleeves. The woman has long black hair. The sky is orange and yellow. There are tall buildings behind the woman. 
124.jpg,There is a person riding a motorcycle down the street. There is a blue fence on the side of the street in front of the person. The person is wearing a white helmet on their head. 
125.jpg,There is a large black truck driving on the street. There is a blue fence next to the street in front of the truck. 
126.jpg,There are several motorcycles parked on the street. There are people standing in front of the motorcycles. There is a large black truck next to them. 
127.jpg,Two people are riding motorcycles on a street. There is a blue fence on the side of the street. The person on the motorcycle is wearing a white helmet. 
128.jpg,This is a security camera footage. There is a large black truck parked on the side of the road. There are white lines painted on the street. A large blue fence is standing next to the fence.
129.jpg,There is a large black truck on the street. There are people walking across the street in front of the truck. There is a blue and white truck next to the street on the sidewalk. 
130.jpg,A man is standing in front of a city skyline. He is wearing a blue striped shirt and a white tie. The man is holding a small red object in his hands. The sky behind the man is orange and yellow. There are tall buildings all around the man.
131.jpg,A man is standing in front of a city skyline. He is wearing a blue striped shirt and a white tie. The man is holding a small red object in his hands. The sky behind the man is orange and yellow. There are many tall buildings in the skyline.
132.jpg,There are people standing in front of a building. There is a green tree in the corner of the building. The sky above the building is dark. 
133.jpg,The sky is dark and cloudy. There are buildings in front of the camera. There is a ladder leaning against one of the buildings. 
134.jpg,There are two people standing on top of a building. There is a tree in front of the building. The sky above the building is dark. There are clouds in the sky. 
135.jpg,There is a man standing in front of a white ladder. There is a large building behind the man. The sky is dark behind the building. 
136.jpg,There is a tall building with a ladder in front of it. There is a person standing on top of the ladder. There are people standing around the building. 
137.jpg,A man in a green jumpsuit is holding a long pole above his head. He is wearing a black helmet. There is a ladder behind him. There are people standing around him. 
138.jpg,There are several people standing in front of a building. There is a ladder on the side of the building next to a green tree. There are signs hanging from the building. 
139.jpg,There is a red truck with a blue light on top of it. There are people standing in front of the truck. There is a tree next to the truck on the ground. 
