frame,caption
135.jpg,Two men are sitting at a brown table. The man on the right is wearing a green shirt. He is writing on a piece of paper that is on the table in front of him. He has a pen in his hand. The other man has a blue shirt on. There is a window on the wall behind them. 
136.jpg,"A man is shown on a TV screen. He is wearing a blue collared shirt. The wall behind the man is a light yellow color. The man has brown eyes and a nose. He appears to be speaking. There is a watermark in the top right corner of the image that reads ""HTV HD 06:42:40""."
137.jpg,A man is sitting in a chair. He is wearing a green uniform with red and gold decorations on the shoulders. The man has short black hair. There is a yellow wall behind the man. 
138.jpg,There are six bags of something red in color. They are sitting on top of a gray counter. There is a black and white photo in front of the bags. 
139.jpg,There are four guns on the table. Two of the guns are silver and the other two are black. There is a person's foot on the left side of the image.
140.jpg,A man is wearing a black shirt. He is standing in front of a table. There are red shoes on top of the table. 
141.jpg,Two men are sitting at a table. The man on the left is wearing a green shirt. There are folders on the table in front of him. There is a brown wall behind them. 
142.jpg,A man is shown from the neck up. He is wearing a black leather jacket. The man has facial hair on his face. He has brown eyes. There is a window behind the man.
143.jpg,There is a woman sitting in a chair. The woman has dark colored hair. She is wearing a green sweater. There is a yellow wall behind the woman. 
144.jpg,A man is standing in front of a city skyline. He is wearing a white shirt and a black tie. He has glasses on and is holding a tablet in his hands. The sky behind him is orange and yellow. 
145.jpg,A man is standing in front of a city skyline. He is wearing a white shirt and a black tie. He has glasses on and is holding a tablet in his hands. The sky behind him is orange and yellow. 
146.jpg,A man is wearing a white shirt and a black tie. He is wearing glasses and has short black hair. There are tall buildings behind the man. There is a cloudy sky above the buildings.
147.jpg,There are two red fire trucks parked on the street. There are people standing in front of the trucks. There is a man in a green uniform standing on the sidewalk. 
148.jpg,There are several men in blue uniforms kneeling down on the ground. There is a large white pipe next to them. There are several people standing around them. They are wearing helmets on their heads. 
149.jpg,There are several people standing on a street. There is a large white building next to the street. A man in a red helmet is standing in front of the building.
150.jpg,Four men are standing outside on a sidewalk. They are wearing blue uniforms with yellow stripes on the sleeves and boots. One of the men is sitting on the ground in front of two white containers. A long white hose is running across the sidewalk. Part of a person's legs can be seen in green pants and black shoes. The ground is covered in dirt and grass.
151.jpg,There are several people standing on a street. There is a white fence in front of a building. There are wires above the street. 
152.jpg,There are several people standing on a street. They are wearing black uniforms and red helmets. There is a black gate on the side of a building. There are trees next to the building.
153.jpg,There is a red fire truck parked on the side of the street. There is a white building next to the truck. There are people standing in front of the building. One of the people is wearing an orange jumpsuit.
154.jpg,There are two red trucks parked on the street. There is a man in a green uniform standing in front of them. There are pink flowers hanging from a tree next to the trucks.
155.jpg,There are several people standing outside of a building. They are wearing red helmets on their heads. There is a white fence in front of the building. 
156.jpg,There are several people standing outside of a building. They are wearing hard hats and jackets. There is a white fence in front of the building. 
157.jpg,A picture of a room that is very dark. There are a lot of things in the room. There is a big window on the side of the building. The window has a white frame on it. 
158.jpg,A group of people are standing outside of a building. They are wearing black jackets and red hats. There is a white fence in front of the building. There are wires above the buildings. 
159.jpg,A red and black screen is lit up. There are small white dots on the screen. There is a red arrow pointing up. 
160.jpg,A red and white graphic is shown. There is a large silver object in the middle of the graphic. There are red dots on the top right corner of this graphic.
161.jpg,A white box is sitting on the tracks. There are three people standing next to the box. There is trees surrounding the tracks and a road behind them. 
162.jpg,A machine is shown in this image. It appears to be made of metal. There is a large wheel on the front of the machine. The machine is silver in color. There are red letters on the image that say TIEP THEO. THU NGHIEM CONG NGHIE DEM TU TRUONG TREN DUONG RAY THUONG.
163.jpg,A group of people are standing outside holding a banner. The banner is white with black writing on it. There is a man in a black and white shirt holding the banner. There are several women and men standing next to the people. They are all dressed up in different costumes. They have headdresses on their heads. 
164.jpg,There are several people standing in a crowd. They are all wearing red hats on their heads. There are two men in the middle of the crowd holding drums. There is a red banner on the bottom of the image with white writing on it.
165.jpg,A large group of people are standing together in a group. They are all dressed up in traditional Vietnamese clothing. Some of the people are holding red flags. There is a large brown door behind the people. There are red words on the top and bottom of the image.
166.jpg,There are several people standing in a parade. They are dressed in traditional costumes. There is a large banner in front of them with writing on it. There are red flags around their heads. 
167.jpg,A woman is standing in front of a screen. She is wearing a long blue dress. She has dark hair and is holding a folder in her hands. There is a picture on the screen behind her. 
168.jpg,A woman is standing in front of a screen. She is wearing a blue dress and holding a tablet in her hands. There is a large picture on the screen behind her. There are many buildings on the ground behind the woman. 
169.jpg,A woman is standing in front of a screen. She is wearing a blue dress and holding a tablet in her hands. There is a large picture on the screen behind her. There are many buildings on the ground behind the woman. 
170.jpg,A plane is flying in the sky. The sky is very cloudy. The clouds are white and fluffy. There is a building to the left of the plane. The roof of the building is black. There are trees below the building.
171.jpg,The sky is cloudy and gray. There is a plane flying in the sky. The plane is white. The roof of the building is black. There are trees in the background.
172.jpg,There is a white and brown building in front of a cloudy sky. There is a small airplane flying in the sky above the building.
173.jpg,A city is covered in snow. There are tall buildings in the distance. There is a black fence in front of the buildings. 
174.jpg,An airplane is flying in the sky. There are wires above the airplane. There is a large white building in front of the building. 
175.jpg,There is a car parked in front of a house. There is snow on the ground around the car. There are two planes flying in the sky above the house. 
176.jpg,There is snow on the ground. There are poles sticking out of the snow. There is trees in front of the wall. 
177.jpg,A man is standing in front of a city skyline. He is wearing a white shirt and a black tie. He has glasses on and is holding a tablet in his hands. The sky behind him is orange and yellow. There are tall buildings all around him.
178.jpg,A man is standing in front of a city skyline. He is wearing a white shirt and a black tie. He has glasses on and is holding a tablet in his hands. The sky behind him is orange and yellow. There are tall buildings all around him.
179.jpg,A man is standing in front of a city skyline. He is wearing a white shirt and a black tie. He has glasses on and has short black hair. The sky behind him is orange and yellow.
180.jpg,A black and white picture is on a television screen. There is a black object in the middle of the picture. There are small white dots on the screen. 
181.jpg,A black and white picture of two large objects flying in the sky. There is a large body of water under the objects. The sky above the objects is gray. 
182.jpg,A picture of a spaceship is shown in the dark. There is a bright light coming from the bottom of the spaceship. There are wires hanging from the top of the space ship.
183.jpg,A woman is standing in front of a screen. She is wearing a blue dress and holding a book in her hands. There is a picture on the screen next to her. There are buildings on the ground behind her. 
184.jpg,A woman is standing in front of a screen. She is wearing a long blue dress. She has short dark hair. There is a large picture on the screen behind her. 
185.jpg,There is a white box on the train tracks. There are three people standing next to the box. There is a large tree next to them. 
186.jpg,A picture of a large field. There is a long train track going through the field. The train track has a white object on top of it. There are large fields next to the train track. 
187.jpg,An aerial view of a farm is shown. There is a train track running through the middle of the farm. There are large fields on either side of the train track. A large white building can be seen in the distance.
188.jpg,There is a train track in the middle of a field. There is a white building on the side of the road next to the train track. There are trees and bushes on the sides of the tracks. 
189.jpg,This is an image of a machine. The machine is made up of metal. The metal is silver and black. There is a large circular wheel on the machine. There are large ridges on the metal.
190.jpg,A man is standing in front of a machine. He is wearing a black shirt and black pants. The machine is silver and has wires coming out of it. There are large windows behind the man. 
191.jpg,A man is standing in front of a machine. He is wearing a black shirt and black pants. The machine is silver and has wires coming out of it. There are large white pillars behind the man. 
192.jpg,There is a man in a black shirt. There are white pillars behind him. There is a light on the ceiling above him.
193.jpg,A black and white picture of a tree. The branches of the tree are very long. There is a white building behind the tree. There are wires hanging from the branches. 
194.jpg,There is a train track in the middle of a field. There is a white building next to the street. There are cars on the street next to them. 
195.jpg,There is a train track in the middle of a field. There is a white building on the side of the street. There are trees and bushes next to the train track. 
196.jpg,There is a white building in the distance. There is a large field next to the building. There are tracks in front of the building with a white box on top of it. 
197.jpg,A man in a white shirt and tie is standing in front of a large screen. There is a picture of a woman on the screen behind him. There are many tall buildings on the ground below the screen. 
198.jpg,A man in a white shirt and blue tie is standing in front of a large screen. There is a picture on the screen behind him. There are tall buildings on the other side of the screen. 
199.jpg,A man in a white shirt and tie is standing in front of a screen. There is a picture on the screen behind him. There are tall buildings on the other side of the screen. 
200.jpg,A man is standing in front of a large screen. He is wearing a white shirt and a blue tie. He has glasses on and is holding a tablet in his hands. There is a large picture on the screen behind him. There are tall buildings on the other side of the screen. 
201.jpg,There is a white wall in a room. There is a mannequin wearing a yellow shirt and green pants. There are several tvs hanging on the wall. 
202.jpg,There is a display case in a store. There are gold items on display in the case. There is a red and white sign in front of the display case. 
203.jpg,"On the left side of the image there is a text that says ""Section 3. Alternative Realities"". On the right side of this image there are six images. The first image on the top right shows a red box with the words ""NGOC KHANH"" written on it. The second image shows a woman standing in front of it with her hand on her hip. The third image shows the same woman with her hands on her hips. Below the red box there are several small figurines of people standing on a white surface."
204.jpg,There is a red box on a white shelf. There are pictures on the wall next to the box. There is a white wall behind the red box. 
205.jpg,A picture of a man with a white beard and a crown on his head. The man has white face paint on his face. There is a red curtain behind the man. 
206.jpg,A picture of a man in a white and red costume. The man has a white face and a long white beard. There is a crown on his head. The crown is red and silver. There are red balls on top of the crown. The background behind the man is black. There's writing on the bottom of the picture.
207.jpg,A person is standing on a stage. They are wearing a red and white outfit. There is a red wall behind the person. The person is wearing a mask on their head. 
208.jpg,A picture of a person dressed in a fancy costume. The costume is red and gold. There is a white mask on the person's face. The mask has a long white beard. There are flowers on top of the mask. The person is standing on a stage. The stage is red. The background of the stage is black.
209.jpg,A person is wearing a red and black costume. They have white and black face paint on their face. There is a crown on their head. The background is black. 
210.jpg,A man is wearing a colorful costume. He has a white beard and white face paint. There is a crown on his head. 
211.jpg,A woman is standing in front of a screen. She is wearing a blue dress and holding a book in her hands. There is a picture on the screen behind her. 
212.jpg,A woman is standing in front of a screen. She is wearing a blue dress and holding a tablet in her hands. There is a large picture on the screen behind her. There are many buildings on the ground. 
213.jpg,A woman is standing in front of a screen. She is wearing a blue dress and holding a clipboard. There is a large picture on the screen behind her. There are many buildings on the ground behind the woman. 
214.jpg,People are walking along the beach. The water is calm and blue. There are buildings on the other side of the water. The sky is cloudy.
215.jpg,People are walking on a sidewalk. There is a black fence in front of the people. A large tree with pink flowers is behind the fence. There are clouds in the sky. 
216.jpg,There is a white and red paper lantern on a black pole. There is a picture hanging on the wall behind the lantern. The wall is white and brown in color. 
217.jpg,There is a large screen hanging on the wall. There are wooden slats on the sides of the screen. There is a picture on the screen of two women. The women are wearing traditional Japanese clothing. 
218.jpg,There is a woman in a white jacket pushing a cart. There is a building behind the cart. The woman in the white jacket is wearing a scarf around her neck. The cart has a red blanket on it. 
219.jpg,There is a picture of a geisha on the window. The geisha is wearing a red and blue dress with a flower in her hair. There is a window behind the geisha. 
220.jpg,A man is standing in a kitchen. He is wearing a black jacket and a white shirt. There are shelves behind him with glasses on them. There is a counter behind him. 
221.jpg,There are three people standing in front of a brown building. There is a man in a blue uniform standing next to the building. 
222.jpg,There is a white sign on a pole. There is a picture of a camera on the sign. There are people walking on the sidewalk in front of the building. 
223.jpg,A man and woman are standing next to each other. They are both wearing red jackets. There is a large gray building behind them. There are yellow pipes hanging from the building. 
224.jpg,A man and a woman are standing in front of a building. They are both wearing red jackets. The man has glasses on and is smiling. The woman is wearing a red jacket and has curly blonde hair. There are yellow pipes on the wall behind them.
225.jpg,Two people are walking down a sidewalk. One of the people is wearing a floral print dress. The other person is wearing striped pants. They are also wearing black shoes. 
226.jpg,A woman is standing on a sidewalk. She is wearing a floral dress and black and white shoes. The woman has white socks on her feet. There are buildings behind the woman. 
227.jpg,A man is standing in front of a screen. He is wearing a white shirt and a blue tie. The man is holding a brown wallet. There is a large screen behind the man. 
228.jpg,A man is standing in front of a screen. He is wearing a white shirt and a blue tie. The man is holding a tablet in his hands. There is a large screen behind the man. 
229.jpg,A man is standing in front of a screen. He is wearing a white shirt and a blue tie. The man is holding a tablet in his hands. There is a large screen behind the man. 
230.jpg,There are several people standing together. They are holding a large banner. The banner is red and white. There is writing on the banner. 
231.jpg,There are several people standing together. They are holding a large banner. There is a white building behind them with a green door on it. 
232.jpg,There are several people standing in a room. There are white pillars behind them. They are wearing red hats on their heads. There is a man in a red outfit in front of them. 
233.jpg,Five people are standing together in a line. They are all dressed in traditional Vietnamese clothing. They all have red hats on their heads. The woman on the right is wearing a white veil over her head. The man in the middle is wearing glasses. The two women on the left are wearing scarves around their necks. The wall behind them is white.
234.jpg,Five people are standing together in a line. They are dressed in traditional Vietnamese clothing. Two of the people have red hats on their heads. The other two people are wearing scarves around their necks. There is a white building behind them with white pillars. There are pictures hanging on the wall.
235.jpg,A woman is wearing a red turban on her head. She has a black and white scarf around her neck. She is wearing glasses on her face. There are people standing behind her. 
236.jpg,A woman is wearing a red turban on her head. She has a black and white scarf around her neck. There are people standing behind her. 
237.jpg,There is a man in a white suit with a black and white scarf around his neck. There are people standing next to him in front of a white building. There is a woman wearing a white robe and a headscarf on her head. 
238.jpg,There are several people standing in front of a white building. There is a man in a white suit with a scarf around his neck. There are two women behind him wearing white robes. 
239.jpg,There are several people standing in a crowd. They are all holding red flags. There is a white building behind them with a brown door on it. 
240.jpg,A large group of people are standing together. They are all dressed up in different costumes. Some of the people are holding red flags. There is a white building behind the people. 
241.jpg,A large group of people are standing together. They are all dressed up in different costumes. There is a white building behind them with a brown door on it. There are red flags in front of the people. 
242.jpg,A group of women dressed in traditional costumes are standing on a street. They are holding a large white banner with a red flag on it. There is writing on the bottom of the banner. 
243.jpg,A large crowd of people are walking down a street. They are dressed up in costumes. There are red flags hanging from the ceiling. There is a white building behind the crowd. 
244.jpg,"A red screen has lines on it. There is white writing on the screen that says ""VAN HOA"". There is a small logo on the top right corner of the screen. "
245.jpg,A woman in a blue dress is standing in front of a screen. She is holding a book in her hands. There is a picture on the screen next to the woman. There are many people standing on a street. 
246.jpg,A woman in a blue dress is standing in front of a screen. She is holding a book in her hands. There is a large picture on the screen next to the woman. There are many people standing in a line on the street. 
247.jpg,A woman in a blue dress is standing in front of a screen. There is a picture on the screen next to the woman. There are many people walking on the street. 
248.jpg,There are several people standing in a crowd. There are trees behind them in front of a white building. There is a white pole behind them. 
249.jpg,A large group of people are standing on a street. They are all dressed in colorful clothes. There are trees lining the street behind them. There is a white building in front of the trees. 
250.jpg,A woman is standing on a street. She is wearing a blue and white shirt. There are people standing in front of a building behind her. There is a motorcycle parked on the street behind the woman. 
251.jpg,A woman is standing in front of a building. She is wearing a blue and white shirt. There are people standing outside of the building wearing red and white robes. There is a black car parked on the street behind the woman. 
252.jpg,A woman is standing in front of a building. She is wearing a blue and white shirt. There are several people standing outside of the building. They are wearing long red and white robes. 
253.jpg,There are several women walking down the street. There is a large building behind them with red steps leading up to it. The woman in front of the camera is wearing a white shirt with red flowers on it. 
254.jpg,A woman is wearing a white dress with red flowers on it. She has a pink headband in her hair. There are several other women in the same dress standing in front of her. They are holding hands. 
255.jpg,There are several women in colorful dresses walking down a street. There are trees lining the street behind them. There is a man in a white shirt standing in front of them.
256.jpg,There are several women standing in a line. They are wearing white and pink dresses. They have white headbands on their head. There are trees behind them. 
257.jpg,There are several women standing in a line. They are wearing white and pink shirts with flowers on them. They have white headbands on their heads. There are trees behind them. 
258.jpg,There are several women standing in a line on the street. They are wearing long pink and white dresses. There are trees behind them on the sidewalk. They have their hands up in the air. 
259.jpg,There are several women walking on the street. They are wearing colorful dresses. There is a barcode on the bottom left of the image. 
260.jpg,There are several women dancing on the street. They are wearing white and pink dresses. They have white headbands on their heads. There is a barcode on the bottom left of the image. 
261.jpg,There are several women dancing on the street. They are wearing white and red dresses. They have white headbands on their heads. There is a woman in a blue dress standing in front of them.
262.jpg,A red screen with white writing on it. The writing is in a foreign language. There are lines on the screen that are red. There is a small logo in the top right corner that says htv9 HD.
263.jpg,A man is holding a phone in his hand. He is wearing a white shirt. The man has black hair and is looking down at the phone. 
264.jpg,A woman is sitting in a white chair. She is wearing a white dress. There is a white table in front of her with many items on top of it. There are white curtains behind the woman. 
265.jpg,There is a woman in a white dress. She has long black hair and is wearing large silver earrings. There is a white chair behind her. 
266.jpg,A woman is sitting on a couch. She is wearing a white jacket. The woman has dark brown hair. There is a white wall behind the woman. 
267.jpg,A woman is wearing a pink suit. She has her eyes closed and is smiling. There is a white wall behind her. 
268.jpg,A woman is wearing a pink suit. She has short black hair. There is a white wall behind her. There are lights hanging from the ceiling. 
269.jpg,A woman is shown on a TV screen. She is wearing a pink blazer and has short black hair. There is a blurred background behind her. The words on the bottom of the screen are in Vietnamese.
270.jpg,A woman is wearing a pink suit. She has short black hair and is wearing large silver earrings. There is a white wall behind the woman.
271.jpg,"There is an advertisement for a show called ""Bong cua thi thanh"". There are several people standing in front of a city skyline. There is a large yellow and blue text in the center of the advertisement. There are numbers on the top right corner of the ad that say the time as 6:54:11."
272.jpg,A man is standing in front of a large screen. He is wearing a white shirt and a blue tie. The man is holding a brown book in his hands. There is a large white screen behind the man. 
