frame,caption
273.jpg,There is a man wearing a white shirt and a blue tie. He is holding a brown object in his hands. There is a large screen behind him with a picture on it. 
274.jpg,A man in a white shirt and a blue tie is standing in front of a screen. There is a picture on the screen behind the man. The man is wearing glasses on his face. 
275.jpg,A man is wrestling on a white ring. There are people standing around the ring watching the man. There is red seats behind the ring. 
276.jpg,A man is performing on a stage. He is wearing a black shirt and blue pants. There are people sitting on the stage watching him. There is a man in a red shirt and white pants standing in front of him. 
277.jpg,A man in a red shirt and white pants is standing on a white ring. There are people sitting on the sides of the ring watching the man. There is a man bending down on the ring. 
278.jpg,A man is performing on a wrestling ring. He is wearing a blue shirt and blue pants. There are people surrounding him watching him perform. There is a man in a red shirt and white pants standing on the ring.
279.jpg,A man is sitting in a chair holding a cat. The man is wearing a black shirt. There is a black lamp next to the man. 
280.jpg,A man is sitting in a chair holding a gray and white cat. He is wearing a black long sleeve shirt. There is a desk behind him with a lamp on it. There are boxes on the floor next to the man. 
281.jpg,A man in a black shirt is standing in front of a crowd. There are red and orange seats behind the man. There is a red sign behind him. 
282.jpg,Many people are sitting in a stadium. They are all wearing face masks. The seats are red and green. There is a silver railing in front of the people. 
283.jpg,"A crowd of people are gathered around a wrestling ring. There is a large screen above the ring that has the words ""Breaking for Gold"" on it. There are red seats behind the stage. "
284.jpg,A crowd of people are gathered around a wrestling ring. There is a man in a black shirt crouching down on the ring. Another man is standing in front of him wearing a red shirt and white pants. There are large screens behind the ring with advertisements on them.
285.jpg,There are four people standing in a room. There is a black banner hanging on the wall. There are lights hanging from the ceiling. 
286.jpg,There are people standing in a room. There is a black banner hanging on the wall. There are lights hanging from the ceiling. 
287.jpg,A man is doing a handstand on a white mat. He is wearing black pants and a black shirt. There is a man sitting on the floor in front of him. 
288.jpg,Two people are in a room. There is a large black sign hanging from the wall. One of the people is crouched down on the floor. The other person is standing up on a white mat. 
289.jpg,A man is sitting on the ground. He is wearing a black shirt. There is a white wall behind him. The man has tattoos on his arms and chest. He has short black hair. 
290.jpg,A man is standing on a stage. He is wearing a short sleeve shirt and black pants. There is a large black sign hanging from the wall behind him. Another man is sitting on a stool in front of him. He has a black hat on and a black shirt.
291.jpg,A man is doing a handstand on a white mat. He is wearing a black jacket and black pants. There is a man sitting on a chair behind him. 
292.jpg,A man and a woman are standing behind a desk. The desk is white and has a red logo on it. The man is wearing a white shirt and tie and is holding a book in his hands. The woman is also wearing a blue top and blue pants. There is a large screen behind them. There are buildings on the screen.
293.jpg,Two people are standing behind a desk. There is a large screen behind them. The desk is white and has a red carpet on it. 
