frame,caption
141.jpg,There is a large group of people standing in front of a large green field. There is a black pole next to the people. There are wires hanging from the pole.
142.jpg,A group of people are standing in a field. There is a large field of green grass behind them. There are trees in front of the field. 
143.jpg,There is a large group of people standing in a field. There is a black pole in front of them. There are large trees in the field. 
144.jpg,There is water under a bridge. There are people standing on the bridge next to the water. There is a barcode on the bottom left of the image. 
145.jpg,There are several people standing around a red boat. There are two red fire trucks behind them. There is grass next to the water. 
146.jpg,There is a large body of water in front of a grassy field. There are people standing on the grass next to the water. There is trees on the field behind them. 
147.jpg,There are several people standing on a bridge. There is a small building behind them with a green roof on it. There are power lines above the bridge. 
148.jpg,There are several red trucks parked next to the water. There are people standing on the grass in front of the trucks. There is a large red crane on top of the truck. 
149.jpg,The image is a digital screen. The screen has small white dots on it. The background of the screen is black. There is a bright red line on the left side. The red light is on the right side. There are numbers on the top right corner that are in white.
150.jpg,"A person is holding a coin from the Star Wars franchise. The coin is shaped like a hexagon and has a picture of a spaceship on it. The words ""Star Wars"" are written below the picture of the spaceship. The person holding the coin is pink. There is a small white circle on the top of the coin."
151.jpg,A hand is holding a Star Wars watch. The watch has a spaceship on it. There is a red border around the watch. 
152.jpg,A man is standing outside with his arms outstretched. He is wearing a baseball cap and sunglasses. There is a lot of smoke surrounding the man. Some of the people in the crowd are wearing face masks on their faces. There are buildings behind the crowd.
153.jpg,There is a man standing in front of a crowd. There is smoke coming out of a building behind him. The man is wearing sunglasses and has a white shirt on. 
154.jpg,"A red and white graphic is shown. There is a large white letter ""A"" in the middle of the graphic. There are small dots on the right side of the image. "
155.jpg,A man is wearing a blue shirt and a tie. He is holding a book in his hands. There are tall buildings behind the man. There is a cloudy sky above the buildings.
156.jpg,A man in a blue shirt and tie is standing in front of a city. He is holding a red book in his hands. There are tall buildings behind him. 
157.jpg,The image is a screenshot from a video game. The background is dark blue and there is a vehicle in the middle of the screen. The vehicle has four round lights on the front and two round lights in the center. There is a small opening on the side of the vehicle. The text on the screen is in Vietnamese and the time is 06:45:36.
158.jpg,A black object is on a table. There is a red and white sign in front of the object. The sign has writing on it. 
159.jpg,The image is a screenshot from a video. It is a scene from a movie or TV show. There are four circular windows in the image. The windows are blue in color. There is a small opening in the middle of the room with two white stairs leading up to it. The stairs have white railings on either side of them. The floor in the room is white.
160.jpg,"The image is a screenshot from a video. It shows a scuba diver in the deep water. There are rocks on either side of the diver. At the bottom of the image there is text in Vietnamese that says ""bay va mang duong bay"" and ""Tu ngay 26/3, nganh duong sat mai ban ve tau hue - Da Nang, gia""."
161.jpg,A man is standing in a room. He is wearing a black jacket. There is a large white sign behind him. There are people standing in front of the sign. 
162.jpg,There is a large white object floating in the water. There are stairs leading up to the top of the object. There is a black railing around the stairs.
163.jpg,This is an image of a room. The room has white walls. There is a gray chair in the room. There are pictures on the wall behind the chair. The pictures are black and white. The picture has a circular window on the ceiling. The window has a light on it.
164.jpg,This is an image of a bedroom. The bedroom has a circular window on the wall. The window has a view of the ocean. The ocean is blue. The bed is made up with gray sheets and gray pillows. The pillows are dark gray. The wall is white. There is a small black television on a white shelf above the bed.
165.jpg,This is an aerial view of a large body of water. There is a white boat in the water. Next to the water is a large rock wall. There are trees on the ground next to the wall.
166.jpg,This is an aerial view. There is a large body of water in the middle of the image. There are lots of trees surrounding the water. The sky above the water is gray and cloudy.
167.jpg,A large blue container is sitting in the water. There is a large rock wall behind the container. The container has a white roof on it. 
168.jpg,A man is wearing a blue shirt and a tie. He is holding a tablet in his hands. There are tall buildings behind the man. There is a cloudy sky above the buildings.
169.jpg,A man is wearing a blue shirt and a tie. He is holding a tablet in his hands. There are tall buildings behind the man. There is a cloudy sky above the buildings.
170.jpg,A man is wearing a blue shirt and a tie. He is holding a book in his hands. There are tall buildings behind the man. There is clouds in the sky above the buildings.
171.jpg,A person is holding a Star Wars coin in their hand. The coin is black and has a picture of a spaceship on it. The person is wearing a white shirt. There is a red and white sign in front of the coin.
172.jpg,A person's hand is holding a metal object. The object is round and silver in color. The person is wearing a white shirt. There is a red and white sign in front of the person.
173.jpg,A person is holding a metal object in their hand. The object is black and silver in color. The person is wearing pink fingernails. There is writing on the bottom of the image. 
174.jpg,A person is holding a star wars pendant in their hand. The pendant is clear and has a picture of a white spaceship on it. There is writing on the bottom of the pendant. The person is wearing pink fingernails. The background is black.
175.jpg,A picture of a spaceship is displayed on a black background. The spaceship is white and has a large circle in the center. There are several small circular holes on the sides of the spaceship. There is a large wheel on the bottom of the ship. There appears to be a cockpit on the top left side of the image.
176.jpg,Two robots are standing side by side. They are both gold in color. The background is black and there are small white lights shining down on them. There is a sign next to them that is white with black writing on it.
177.jpg,A bunch of coins are laying on a table. They are silver and have a design on them. There is writing on the bottom of the coins. 
178.jpg,"A bunch of Star Wars coins are laying on a table. They are silver and have a picture of a spaceship on the front of them. The words ""Star Wars"" are written above the spaceship. There is a red and white logo in the top right corner of the image."
179.jpg,The image is a screenshot from a video. The video is in Vietnamese. The text on the bottom of the screen says THPT chuyen Tran Dai Nghia.
180.jpg,"The image is a screenshot of a video. The video is in Vietnamese. At the bottom of the image there is a caption in Vietnamese that reads ""Quan 1 (TP.HCM): De xuat tang muc thu tien an ban tru len 40.000 dong/hoc sinh/ngay""."
181.jpg,There is a white tray with small holes on it. There are small white pieces of food on top of the tray. There is a black table behind it.
182.jpg,There are several small plastic containers with white lids on them. They are shaped like star wars planes. There is writing on the front of the containers that says Star Wars. There are small black dots on the sides of the planes.
183.jpg,There are several stormtroopers standing in front of a window. There are lights on the ceiling above them. There is a black box behind them. 
184.jpg,A woman in a red dress is standing in front of a city skyline. She is holding a book in her hands. There is a large picture on the wall behind her. 
185.jpg,A woman in a red dress is standing in front of a screen. There is a picture on the screen next to her. There are buildings behind her. 
186.jpg,A woman in a red dress is standing in front of a city skyline. She is holding a tablet in her hands. There is a picture of a woman next to her on the screen. 
187.jpg,A woman is looking at a painting. The painting is a drawing of a mother and baby. The frame of the painting is gold. The woman is wearing a black turtle neck.
188.jpg,A group of people are standing in an art gallery looking at paintings on display. There is a man in a black jacket and gray pants standing in front of a white counter. There are several paintings hanging on the walls. A large picture is hanging on a white wall in the center of the room.
189.jpg,Three men are sitting behind a long table. They are wearing suits and ties. There are microphones in front of the men. 
190.jpg,"Two women are standing in a room looking at paintings on the wall. One of the women is wearing a green jacket and has curly blonde hair. The other woman, wearing a red dress, is standing in front of a painting. The painting is of a square with a face on it. The frame of the painting is gold. The walls of the room are white."
191.jpg,Two women are standing in front of a large picture. One of the women is pointing her finger at the picture. She is wearing a red shirt. The other woman has curly brown hair. 
192.jpg,A picture of a painting is hanging on a white wall. The frame is gold and the painting is black and white. There is a statue of an elephant next to the painting. 
193.jpg,A woman is standing in front of a white wall. She is wearing a black jacket. There is a brown statue on a white shelf behind the woman. The woman has blonde hair. 
194.jpg,A woman is standing in a room with white walls. She is wearing a black shirt and a red vest over her shoulders. Her arms are crossed in front of her. There is a large black statue on a white pedestal in the room. A picture frame is hanging on the wall behind the woman.
195.jpg,There are two women standing in a room. There are pictures hanging on the wall in front of them. One of the women is wearing a black jacket and a red scarf. 
196.jpg,A woman is standing in front of a screen. She is wearing a short red dress and holding a tablet in her hands. There is a large picture on the screen behind her. There are tall buildings behind the woman. 
197.jpg,A woman in a red dress is standing in front of a screen. There is a picture on the screen next to the woman. There are buildings behind the woman in the dress. 
198.jpg,A woman in a red dress is standing in front of a screen. There is a picture on the screen next to the woman. There are many buildings behind the woman in the red dress. 
199.jpg,There is a crowd of people standing on a street. There is a fire hydrant on top of a truck. There are buildings on both sides of the street. 
200.jpg,There are several people standing in front of a building. They are holding torches in their hands. There is smoke coming out of the torches. 
201.jpg,There are several people standing in a crowd. There is smoke coming off of the crowd. A man in a white shirt is standing in front of them.
202.jpg,There are people dancing on the street. There is a building behind them with a sign on it. There are people standing in front of the building with their arms up.
203.jpg,A man is wearing a white helmet and yellow sunglasses. There is a yellow building behind the man. There are people standing in front of the building. 
204.jpg,There are people standing in a street. There is smoke coming out of the buildings. There are buildings next to the people. 
205.jpg,There are several people standing on top of a truck. There are several buildings next to the truck. The truck is white and there is a man in a white shirt sitting in the back of it. 
206.jpg,There are people standing in front of a hill. There is red powder coming out of the man's hand. There are clouds in the sky above them.
207.jpg,There are people standing in a crowd. There are trees behind them. There is a man in a brown shirt standing in front of the crowd. 
208.jpg,A woman in a red dress is standing in front of a screen. There is a large white screen behind the woman. There are buildings on the screen behind her. 
209.jpg,A woman is standing in front of a television screen. She is wearing a short red dress and has a microphone clipped to her dress. The woman is holding a tablet in her hands. There is a large screen on the right of the woman. There are many buildings behind the woman on the screen.
210.jpg,There is a woman in a red dress standing in front of a screen. There is a picture on the screen next to the woman. The woman has dark colored hair. 
211.jpg,There is a crowd of people standing on a street. There are several buildings next to the street. The sky above the crowd is black. There is a large tree in the crowd.
212.jpg,There are people standing in a crowd. There is a man in a white fur coat and a black hat. There are buildings behind them. 
213.jpg,There is a dark image in the middle of this image. It appears to be a scene from a movie or TV show. There are a lot of people in the image that appear to be dancing or having a good time. There is a red light shining on the face of the person in the center of the image. The time and date of the movie is 06:50:15.
214.jpg,There are people standing in front of a red light. There is smoke coming out of the light. The people are holding up their hands. 
215.jpg,There are several people walking down the street. There is a white car parked on the street in front of a building. There are several windows on the building. 
216.jpg,A man is standing in front of a white wall. He is wearing a black jacket and a blue and white checkered shirt. There are people standing behind him. There is a staircase behind them. 
217.jpg,A little girl is sitting on a couch. She is wearing a white and black dress. The girl has a blue pacifier in her mouth. There is a woman sitting in front of her. They are holding a toy in their hands. 
218.jpg,There is a man standing in a room. He is wearing a black shirt and a black hat. There is a large white object in front of the man. 
219.jpg,There is a person wearing a white mask. They are standing in a room. There is a white cabinet behind them. There are lights hanging from the ceiling. 
220.jpg,There are two men standing in a room. There are chains hanging from the chains around the men. The man on the left is wearing a white suit and a black hat. 
221.jpg,Two men are standing in a room. They are both wearing black hats on their heads. One of the men is wearing a white jacket and black pants. He is holding chains around his neck. 
222.jpg,There are people standing in front of a large statue. There is a large white building behind the statue. 
223.jpg,There is a crowd of people standing in front of a stage. There is a large white light on the stage. The stage is lit up with red lights. There are white clouds in the sky above the crowd.
224.jpg,A woman with long dark hair is standing in front of a green background. She is wearing a purple shirt and has red lipstick on. There is writing on the bottom of the image in white letters.
225.jpg,A woman with long black hair is wearing a white shirt. There is a red banner in front of the woman with white writing on it. There are trees behind the woman. 
226.jpg,A woman with long black hair is wearing a white blouse. There is a green background behind the woman. The woman has large white earrings on her ears. 
227.jpg,There is a man and a woman in a scene from a TV show. The man is wearing a white shirt and has dark hair. He is looking at the camera with a serious expression on his face. The woman is looking away from the man with a sad look on her face. There is a barcode on the bottom left corner of the screen.
228.jpg,A woman is sitting on a bed. She is wearing a black tank top. There is a large headboard on the bed. The woman has long black hair. 
229.jpg,There is a man standing in a field. There is another man kneeling down in front of him. There are palm trees in the distance. 
230.jpg,There is a man standing in a field. There is a person laying in the grass next to the man. There are palm trees in the distance. 
231.jpg,A man is standing in front of a large screen. He is wearing a blue shirt and a tie. He has glasses on and is holding a book in his hands. There is a large white screen behind the man. 
232.jpg,A man in a blue shirt and tie is standing in front of a screen. He is holding a tablet in his hands. There is a large screen behind him. There are people riding bikes on the street. 
233.jpg,A man in a blue shirt and tie is standing in front of a screen. He is holding a brown object in his hands. There is a man wearing a white shirt and a white helmet on his head. There are people standing behind him. 
234.jpg,There are several people riding bikes down the street. They are all wearing helmets on their heads. There are people standing on the side of the street watching the bikes. 
235.jpg,There are several people riding bikes down the street. There are people standing on the side of the street watching the people on the bikes. There is a large building next to the street with trees on it. 
236.jpg,A long line of cars are traveling down a road. There are trees on both sides of the road. The cars are all lined up in a straight line. There is a small tree next to the road in the distance.
237.jpg,A group of men are riding bicycles down a road. They are all wearing red shirts and black shorts. They have helmets on their heads and sunglasses on their faces. There are cars parked on the side of the road. 
238.jpg,There are several people riding bikes down the street. There are signs on the side of the street next to them. They are holding umbrellas in their hands.
239.jpg,A group of people are riding bicycles down a street. There are people standing on the side of the street holding umbrellas. There is a blue and white sign on a pole next to the street.
240.jpg,There are several cars and bikes on the street. There are trees on the side of the street next to the cars. There is a white car in front of the bikes. 
241.jpg,A man is riding a bicycle on a paved surface. He is wearing a helmet on his head. There is a man standing behind him wearing a red and white striped shirt. There are people standing behind a fence in front of the man. 
242.jpg,A man is riding a bicycle on a track. He is wearing a white and black helmet. There are people standing behind a fence watching him. There is a sign on the side of the fence. 
243.jpg,A man is wearing a white shirt and a white helmet. There are people standing behind him holding umbrellas. There is a green sign behind him. 
244.jpg,There are several cars parked on the side of the road. There are people standing in front of the cars on the sides of the street. There is a large mountain behind the cars. 
245.jpg,A man is standing in front of a large screen. He is wearing a white shirt and a black hat. The man is holding a trophy in his hand. There is a large yellow and blue sign behind the man. 
246.jpg,A man is wearing a white jacket and a black hat. He is shaking hands with another man. There is a yellow and blue sign behind them. 
247.jpg,A woman in a red dress is standing on a news set. There is a large screen behind her. There are buildings on the screen. 
248.jpg,A man and a woman are standing in front of a news desk. The desk is white and has a red logo on it. The man is wearing a blue shirt and tie and black pants. The woman is also wearing a red dress. There is a large screen behind them. There are buildings on the screen. 
249.jpg,"A man and a woman are standing in front of a news desk. The desk is white and has a red logo on it. The man is wearing a blue shirt and tie, and black pants. The woman is also wearing a red shirt and red pants. There is a large screen behind them. There are many tall buildings on the screen."
250.jpg,A man and a woman are standing behind a news desk. The desk is white and has a red logo on it. The man is wearing a blue shirt and tie and black pants. The woman is also wearing a red shirt and red pants. There is a large screen behind them. There are many buildings on the screen.
