frame,caption
001.jpg,A beautiful sunset over a city. The sky is orange and pink. There are many buildings in the city. There is a large body of water in front of the buildings. 
002.jpg,A man and a woman are standing behind a white table. The man is wearing a blue shirt and black pants. The woman is wearing an office uniform. There is a large screen behind them. There are buildings on the screen.
003.jpg,A man and a woman are standing behind a news desk. The desk is white and has red writing on it. There is a large screen behind them. There are buildings on the screen. 
004.jpg,"On the right side of the image there is a red and black background. On the left side there is an orange diagonal line. The background is completely black. There are small white dots on the red background. The dots are arranged in a grid-like pattern. There is a small red and white logo in the top right corner. The logo reads ""HTTV"" in white letters."
005.jpg,A bright red light is lit up. There are small white dots all over the light. There is a black stripe on the side of it. 
006.jpg,There is a large truck driving on the grass. There are yellow towels hanging from the side of the truck. There is a field of grass in front of the trucks. 
007.jpg,A woman in a red dress is standing in front of a row of pictures. There is a large poster behind her. The woman is holding a microphone. 
008.jpg,A boy is sitting on the back of an animal. The animal is white and has horns on it's head. There is a person standing next to the animal. There are rocks and grass on the ground around the animals. 
009.jpg,A woman is holding a little girl in her arms. They are standing in the sand. There is a brown basket behind them. The woman is wearing a blue jacket. 
010.jpg,A woman is standing behind a white podium. There are microphones in front of her on the podium. The woman is wearing a black shirt and earrings. There is flags behind the woman. 
011.jpg,A person is holding a cell phone in front of a laptop. The laptop is black and has a white screen on it. The person is wearing a red shirt. There is a red mark on the screen.
012.jpg,"The image is a logo. The logo is red and white. The background is white. There are dots on the white and red background. The letters are red and silver. The word ""giay"" is written in the middle of the red letters. There is a small orange dot on the right side of the white background."
013.jpg,A man and a woman are standing in front of a desk. The desk is white and has a red logo on it. The man is wearing a blue shirt and tie and is holding a clipboard. The woman is wearing an office uniform. There is a large screen behind them. There are buildings on the screen. 
014.jpg,There is a man and a woman standing behind a white table. There is a large screen behind them. There are buildings on the screen. The man is wearing a blue shirt and a tie. 
015.jpg,There is a man and a woman standing in front of a white table. The man is wearing a blue shirt and a tie. The woman is also wearing a black and white dress. There are tall buildings behind them. There is a cloudy sky above them.
016.jpg,There is a man and a woman standing in front of a desk. The man is wearing a blue shirt and a tie. He is holding a tablet in his hands. The woman is holding an object in her hands. There are tall buildings behind them. There is clouds in the sky above them.
017.jpg,A man is sitting in a field of tall green grass. He is wearing a blue shirt and a large black hat. The sky behind him is filled with white clouds.
018.jpg,A man is kneeling down in a field. He is wearing a blue shirt and a brown hat. There are tall weeds in front of him. The sky is blue with white clouds in it.
019.jpg,A man in a blue shirt and a black hat is standing in front of a machine. There is a small boy in a green shirt behind the man. 
020.jpg,A man in a blue shirt and a baseball cap is standing in front of a machine. There is a small boy in a green shirt behind him. The machine behind them has a red sign on it. 
021.jpg,A large field of green grass is in front of a row of trees. There are clouds in the sky above the field. 
022.jpg,There is a red and white tractor in the middle of a field. There are people standing around the tractor. There is tall grass in front of the tractor and trees in the distance. 
023.jpg,There are people standing in a field. There are yellow bags on the ground in front of them. There is a man in a gray shirt and a white hat standing next to them.
024.jpg,There are people standing in a field. There are yellow bags on the ground in front of them. There is a man in a blue shirt holding a large yellow bag.
025.jpg,A man is standing in front of a machine. He is wearing a blue shirt and a black hat. The man has a pen in his pocket. The machine behind him has a red sign on it. 
026.jpg,There are several tractors in a field. There are people standing around the tractors. There is a man in a blue shirt and a white hat standing in front of them.
027.jpg,There is a large white machine in the middle of a field. There are two people standing next to the machine. There is yellow bags on the back of it.
028.jpg,A tractor is in the middle of a field. There are tall green trees behind the tractor. The tractor has red wheels on it. 
029.jpg,There are yellow bags on the ground. There is a man in a blue shirt carrying a large yellow bag. There are people behind the bags on a truck. 
030.jpg,A man is carrying a yellow bag on his shoulder. He is wearing a blue shirt and a white hat. There are other people behind him. 
031.jpg,A woman is standing in front of a city skyline. She is wearing a black and white dress. The sky is orange and cloudy. There are tall buildings behind the woman. 
032.jpg,A woman is standing in front of a city skyline. She is wearing a black and white shirt. The sky is orange and cloudy. There are tall buildings behind the woman. 
033.jpg,A woman is standing in front of a city skyline. She is wearing a black and white shirt. The sky is orange and cloudy. There are tall buildings behind the woman. 
034.jpg,A woman is standing in front of a city skyline. She is wearing a black and white dress. The sky is orange and yellow. There are tall buildings behind the woman. 
035.jpg,A woman is standing in front of a city skyline. She is wearing a black and white dress. The sky is orange and cloudy. There are tall buildings behind the woman. 
036.jpg,There is a man wearing a yellow shirt and a blue hat. He is wearing a white mask on his face. There is a large machine behind him. 
037.jpg,A man is wearing a white surgical mask. He has a blue cap on his head. He is also wearing a yellow shirt. There is a white wall behind him. 
038.jpg,A group of people are working in a factory. They are all wearing white lab coats and blue scrubs and face masks. There is a green table in front of them with food on top of it. There are lights on the ceiling above them.
039.jpg,This is a picture of some peanuts being processed. The peanuts are on a conveyor belt. The conveyor belts are green. There is a white bucket on the table. The bucket is plastic. The nuts are light brown in color. There are peanuts falling from the conveyer belt onto the green trays.
040.jpg,There are yellow seats on the side of a conveyor belt. There are people wearing white coats and masks on their faces. There is a white wall behind them. 
041.jpg,A machine is sitting in a room. There is a gray pole in front of it. There are purple boxes on top of the machine. 
042.jpg,"This is a picture of a machine. The machine is made up of metal. There are cashews on the machine. There is a blue container on the right side of the machines. The cashews are on a conveyor belt. The nuts are light brown in color. The machines have green, red, and yellow lights on the top of them. The date and time of the picture is 06:32:45."
043.jpg,This is a picture of a machine. The machine is silver in color. There are nuts coming out of the machine. There is a blue plastic container next to the machines. 
044.jpg,An Asian man is standing in front of a wall. He is wearing a black suit with a black and white polka dot shirt and a black tie. He has glasses on and is looking off to the side. The wall behind him is painted yellow and has a brown design on it.
045.jpg,Two hands are touching cashews on a conveyor belt. The conveyor belts are green. The cashews are on top of a green table. There is a black shirt on a person's arm. 
046.jpg,Two hands are touching cashews on a conveyor belt. The hands are white. The cashews are on a green surface. There is a watermelon on the conveyor belts. 
047.jpg,There are two people standing in a room. They are wearing white coats and blue hats. There are machines behind them. There is white sheets hanging from the machines. 
048.jpg,A white bag is filled with small brown seeds. There is a silver object sticking out of the bag. 
049.jpg,There are several people wearing white shirts and white hats. They are wearing surgical masks on their faces. There are blue baskets in front of them. There is food on top of the table. 
050.jpg,There are people wearing white shirts and white hats. They are wearing face masks. There are blue baskets in front of them. There is a light hanging from the ceiling.
051.jpg,Three people are wearing white coats and blue gloves. They are wearing face masks on their faces. There is sand in front of them. 
052.jpg,This is a video of some peanuts being processed. The peanuts are light brown in color. There are cashews coming out of a conveyor belt. There is a brown box above the peanuts. The time on the screen is 06:33:23.
053.jpg, peanuts are being processed in a factory. The peanuts are light brown in color. The machine is silver in color and appears to be made of metal. There is a large piece of machinery at the top of the machine.
054.jpg,There is a large gray machine in a room. There is a plastic bag on top of the machine with food inside of it. There are people standing behind the machine. 
055.jpg,A man is wearing a blue shirt and a black tie. He is holding a book in his hands. There are tall buildings behind the man. There is a cloudy sky above the buildings.
056.jpg,A man is standing in front of a city skyline. He is wearing a blue shirt and a black tie. He has glasses on and is holding a tablet in his hands. The sky behind him is orange and yellow. There are tall buildings all around him.
057.jpg,There are several airplanes lined up on a runway. There is a large building behind the airplanes. There are several trucks parked in front of the planes. 
058.jpg,People are standing in line at a counter. They are all wearing face masks. There is a large yellow sign hanging from the ceiling. 
059.jpg,People are standing in line at an airport. They are all wearing face masks. There are luggage carts in front of them. There is a white wall behind them with signs on it. 
060.jpg,The image is a table that shows the times in different languages. The table is divided into columns. The first column is for 10:00. The second column has the time as 10:45. The third column has 10:25. The last column has VASCO.
061.jpg,"The image is a table of flights in different languages. The table is divided into two columns. The first column is for Pacific Airlines and the second column has the flight times. The flight times are listed as 09:30, 09:40 and 09:55. Each flight times is represented by a different color. The times are written in a different language."
062.jpg,There is a blue sign hanging on the wall. There is a picture of a woman wearing a white hat on the sign. There are people standing in front of the sign wearing face masks. 
063.jpg,People are sitting at a counter wearing face masks. There is a blue and white sign hanging on the wall. There are blue chairs in front of the counter. 
064.jpg,There are three people wearing blue shirts. They are wearing white face masks. There is a red basket in front of them. 
065.jpg,There are three people wearing blue shirts. They are wearing white face masks. There is a red basket in front of them. 
066.jpg,A poster is displayed on a white wall. There is a picture of a man and a woman on the poster. The man is wearing a white shirt and is holding out his hand. The woman is standing behind him. They are both wearing blue shirts. There are circles around the picture of the man and woman. The poster has writing on it in different languages.
067.jpg,There is a woman wearing a white shirt sitting in a blue chair. There is a mirror in front of the woman. The woman is wearing a face mask on her face. 
068.jpg,There are people sitting at desks in a room. They are all wearing white shirts and blue chairs. There is a blue poster hanging on the wall behind them. There are computers on the desk in front of them. 
069.jpg,A woman is standing inside of an office building. She is wearing a short sleeve shirt and black pants. There is a blue stool in front of her on the floor. A large window can be seen on the wall behind the woman. A blue and white sign is hanging from the ceiling above the door. Two black speakers are hanging from a ceiling near the doors.
070.jpg,There are people sitting in chairs. They are all wearing face masks. There is a table in front of them with papers and pens on top of it. There are windows on the wall behind them. 
071.jpg,Two men are sitting at a desk wearing face masks. There is a laptop on the desk in front of them. There are papers and other items on top of the desk. 
072.jpg,There is a large white object in front of a red wall. There is a man in a black shirt sitting in a chair behind the object. 
073.jpg,There is a woman wearing a black blazer standing in front of blue chairs. There are people sitting in chairs behind her. There is a white board on the wall behind them. 
074.jpg,There are several people sitting in desks. There are blue curtains on the wall behind them. There is a white board on the front of the room. 
075.jpg,A man and woman are sitting on a white bench. The man is wearing a gray jacket and glasses. He is looking at a silver laptop that is in front of him. The woman is holding a phone in her hands. There are plants and flowers behind them.
076.jpg,A computer screen is turned on. There are words written in a foreign language on the screen. There is a hand next to the computer screen. 
077.jpg,There is a man wearing a white shirt. He is wearing glasses on his face. There is a laptop in front of him that is turned on. There are papers hanging on the wall next to the laptop. 
078.jpg,A computer screen is turned on. There is a white paper on the screen with black text on it. The paper has a green box in the middle of it. There are red lines on the white paper. 
079.jpg,A woman is standing in front of a screen. She is wearing a black and white dress. She has long dark hair and is holding a book in her hands. There is a picture on the screen next to the woman. 
080.jpg,A woman is standing in front of a screen. She is wearing a black and white dress. She has long dark hair. There is a picture on the screen next to the woman. 
081.jpg,A mountain is covered in fog. There are many white clouds in the sky above the mountain. There is a large hill next to the fog. 
082.jpg,A group of people are standing outside of a stone building. The building has an archway in the middle of it. Some of the people are wearing hats on their heads. The sky is cloudy and gray.
083.jpg,There is a small tunnel on the side of a train track. There is smoke coming out of the tunnel. There are people standing on the other side of the train tracks. 
084.jpg,"A man is standing outside on a sunny day. He is wearing a white hat, sunglasses, and a blue and white striped shirt. The man is carrying a black bag over his shoulder. A stone building can be seen behind the man. Part of a mountain is seen on the side of the building. Large green trees are standing on a grassy field. Power lines are running across the sky above the trees."
085.jpg,There is a small building made of rocks. There is a tree in front of the building. There are clouds in the sky.
086.jpg,There is a small stone building in front of a mountain. There are white clouds in the sky above the building. There is a tree next to the building on the ground.
087.jpg,There are people standing on a sidewalk. There is a large pile of rocks in front of the people. There are trees next to the sidewalk.
088.jpg,A mountain is covered in trees. There is a lot of fog coming off of the top of the mountain. There are clouds in the sky. 
089.jpg,There is a large building on the side of a hill. There are two buses on the street next to the building. There is a lot of smoke coming off of the building and the sky.
090.jpg,An aerial view of a building is shown. There is a lot of smoke coming out of the building. There are several cars on the street in front of the buildings.
091.jpg,There is a man in a white shirt standing in front of a building. There are two women standing behind him wearing white hats. There is a large hill behind them with clouds in the sky above them.
092.jpg,A man in a white shirt is standing in front of a building. There are trees behind the man. There is a hill behind the building. 
093.jpg,There is a man in a white shirt standing in front of a building. There are trees behind him. There is a mountain behind the building. 
094.jpg,There are people standing on the stairs. There is a stone wall behind them. There are clouds in the sky above them. 
095.jpg,A foggy road is seen in a foreign country. There are trees on either side of the road. The sky is blue with white clouds.
096.jpg,There is a foggy road in the middle of a field. There are trees on the side of the road. There is a black pole on the ground next to the field. 
097.jpg,A woman is standing in front of a screen. She is wearing a black and white dress. The woman is holding a red book in her hands. There is a large screen behind the woman. 
098.jpg,A woman is standing in front of a screen. She is wearing a black and white dress. The woman is holding a red book in her hands. There is a large screen behind the woman. 
099.jpg,A woman is standing in front of a screen. She is wearing a black and white dress. There are two pictures on the screen next to her. The woman is holding a book in her hands. 
100.jpg,A woman is standing in front of a screen. She is wearing a black and white dress and holding a small book in her hands. There is a picture on the screen next to the woman. 
101.jpg,There are several people sitting in chairs. There is a woman in a white shirt with a flower on the lapel. There are other people standing behind them. 
102.jpg,A man is standing in front of several pictures. He is wearing a red robe and holding a microphone. There is a large poster behind him. 
103.jpg,A man is wearing a red shirt and a black hat. He is holding a silver microphone in his hand. There is a large picture on the wall behind the man.
104.jpg,A man is wearing a red shirt and a black hat. There are white flowers behind the man. There is a blue sign behind the person. 
105.jpg,There are two pictures on easels in front of a white wall. There are people standing behind the pictures. There is a woman in a white shirt holding a baby in a red bucket.
106.jpg,There are two people wearing white shirts. They have white hats on their head. There is a ladder in front of them. 
107.jpg,"The image is a text written in Vietnamese. The text is titled ""Ben me tron doi"". There is a small logo in the top right corner of the image that says ""HTV HD"". The text in the image is written in red color."
108.jpg,A boy is riding on the back of a white cow. There is a girl standing next to the cow. The girl is wearing a purple shirt and a pink head scarf. There are other cows in the field behind them. 
109.jpg,A black and white photo of a woman and a child. The woman is wearing a headscarf. The child has a hat on his head. There is writing on the bottom of the photo. 
110.jpg,There is a man and a little girl sitting at a table. There are several bowls on the table in front of them. The girl is wearing a red shirt and has a flower in her hair. There is a red scarf on the man's head. 
111.jpg,There is a woman wearing a pink scarf on her head. There is a girl wearing a red shirt on top of her. They are hugging each other. 
112.jpg,A woman is standing in front of two pictures hanging on a wall. The woman is wearing a black shirt and a colorful jacket. She has a gold necklace around her neck. There is a picture on the wall behind the woman. 
113.jpg,There is a woman wearing a white scarf around her neck. She is wearing glasses. There is a person laying in a bed next to her. They have bandages on their arm. 
114.jpg,There are several people standing in a crowd. They are all wearing face masks. There is a man in a black jacket standing in front of them. 
115.jpg,A large group of people are sitting in a room. There is a white wall behind them with a sign on it. There are many chairs in front of them. Some of the people are holding cameras. 
116.jpg,There are four people standing next to each other. There is a man in a yellow outfit holding up a picture frame. There are two other people standing behind him holding up two pictures. 
117.jpg,There are two pictures on display on metal stands. There are people standing behind the pictures. There is a girl wearing a red jacket and a red hat.
118.jpg,A woman and a child are riding a bicycle in a field. The woman is wearing a large brown hat on her head. The child is sitting in front of the woman. There is a large pot on the back of the bicycle. 
119.jpg,The image is completely black. On the right side of the image there is a red and black background. The red part of the background has small white dots on it. The dots are arranged in a circular pattern. The white dots are evenly spaced. At the top right corner there is the logo for HTV9 HD in red letters. The time is 06:37:32.
120.jpg,The image is blurry. It appears to be a rural area. There are power lines in the background. There is a road in the middle of the image. The sky is blue and clear.
121.jpg,The image is blurred. There is a road in the image. The road appears to be wet. There are white lines on the road. The sky is blue and clear. The sun is shining brightly. The grass on the side of the road is green and brown. The image has a red rectangle on it. The red rectangle has a white line through it.
122.jpg,There are two motorcycles driving down the street. There is a white van behind them. There are tall buildings on the other side of the road. 
123.jpg,There are three people riding bikes on the street. There is a white car behind them. There are trees on the side of the street next to the cars. 
124.jpg,A man is standing in front of a cityscape. He is wearing a blue shirt and a black tie. He has glasses on and is holding a tablet in his hands. 
125.jpg,A man is standing in front of a city skyline. He is wearing a blue shirt and a black tie. He has glasses on and is holding a tablet in his hands. The sky behind him is orange and yellow. 
126.jpg,A man is standing in front of a city skyline. He is wearing a blue shirt and a black tie. He has glasses on and is holding a tablet in his hands. The sky behind him is orange and yellow. 
127.jpg,A boy is sitting at a table. He is wearing a black jacket. There is a black phone on the table in front of him. 
128.jpg,A picture of a cellphone screen that says Chien Mobile on it. The phone is black. There is a man sitting on top of a white car. The man is wearing a white shirt and black pants. 
129.jpg,There is a man sitting on the ground. He is wearing a black jacket. There is a bed behind him with a pink blanket on it. 
130.jpg,A person is holding a black phone in their hand. There is a black keyboard behind the person. There are several smaller pictures next to the phone. 
131.jpg,A person is holding a black phone in their hand. There is a keyboard behind the phone on a table. There are several pictures on the screen next to the phone.
132.jpg,A screenshot of a video posted on a computer screen. There is a black and white photo of a motorcycle on the screen. Next to the photo there is a second photo of the same motorcycle. The first photo shows the motorcycle in three different angles. The second photo shows a motorcycle parked in a parking lot. The third photo shows another motorcycle parked next to it.
133.jpg,There is a motorcycle parked in front of a gray brick wall. There is a yellow table behind the motorcycle. There are green plants on top of a table. 
134.jpg,A picture of a motorcycle is shown. The motorcycle is black and has a headlight on it. There is a brick wall behind the motorcycle. 
135.jpg,This is a video of a motorcycle. The motorcycle is black and white. It has a black seat. It is parked on a tiled floor. There are plants next to the motorcycle. 
136.jpg,A man is sitting at a table. He is wearing a black jacket. There is a chair behind him with a red bucket on it. There are phones on the table in front of him. 
137.jpg,A woman is standing in front of a screen. She is wearing a black and white dress. The woman is holding a small book in her hands. There is a picture on the screen behind the woman. 
138.jpg,A woman is standing in front of a screen. She is wearing a black and white dress. She has dark hair and is holding a book in her hands. There is a picture on the screen behind her. 
139.jpg,There are two men standing in front of a white van. The man on the left is wearing a green uniform and glasses. He is standing next to a man wearing a black shirt. He has a white face mask on. The van has the door open. There is a building behind the van.
140.jpg,A man wearing a white face mask is standing next to another man. There is a white van behind them. The man in the green jacket is wearing glasses. 
