frame,caption
141.jpg,There are two men standing in front of a building. There is a man in a black suit holding a stick in his hand. The man in the suit is wearing a white face mask. 
142.jpg,There are several men standing on the street. There is a large white truck behind them. There are wires hanging above the street in front of the truck. 
143.jpg,Four men are standing on a street talking to each other. Two of the men are wearing face masks on their faces. A man in a green uniform is holding a piece of paper in his hand. There is a large truck parked on the side of the street. A scooter can be seen sitting on the street in front of the man in the uniform. There are several buildings and trees on the other side of a street.
144.jpg,This is a black and white image taken on a highway. There are several trucks parked on the side of the road. There is a large truck behind another truck that is parked in front of it. A white van can be seen in the distance. There appears to be a building across the street from the trucks.
145.jpg,"The image is of a battery. It is black in color and has a red and yellow label on it. The label has the word ""PINALU"" on it in white letters. There is also a yellow and black sticker on the back of the battery. The battery is sitting on a gray floor."
146.jpg,A man is standing in front of a white wall. He is wearing a black shirt and a black hat. The man has short black hair. There is writing on the bottom of the image.
147.jpg,A man is standing in front of a city skyline. He is wearing a blue shirt and a black tie. He has glasses on and is holding a tablet in his hands. 
148.jpg,A man is standing in front of a city skyline. He is wearing a blue shirt and a black tie. He has glasses on and is holding a tablet in his hands. The sky behind him is orange and yellow. 
149.jpg,A man in a blue shirt and tie is standing in front of a city. He is holding a tablet in his hands. There are tall buildings behind him. 
150.jpg,The image is a screenshot from a news channel. It is a picture of a road that has been flooded with water. There is a large white pipe on the side of the road. There are power poles in the background. The sky is blue and clear.
151.jpg,There is a large white pipe sticking out of the ground. There is dirt and grass next to the pipe. There are power poles in front of the pipes. 
152.jpg,A tall white pole is standing against a bright blue sky. There is a small white airplane flying in the sky behind the pole. The sky is clear and has no clouds in it.
153.jpg,There is a large white pipe on the side of the road. There are power lines behind the pipe. There is a person standing next to the pipe wearing a black shirt. 
154.jpg,There is a large white tower in the distance. There is a white windmill in front of the tower. There are large white pipes on the ground next to the towers.
155.jpg,There is a tall white pole in the middle of the photo. The sky is a bright blue color. There is a small electrical pole in front of the white pole. 
156.jpg,A woman is wearing a black and white dress. She is holding a red book in her hands. There is a picture next to the woman that has a city on it. 
157.jpg,A woman is standing in front of a screen. She is wearing a black and white dress. She has long black hair. There is a picture on the screen next to the woman. 
158.jpg,A woman is standing in front of a screen. She is wearing a black and white dress. She has long black hair. There is a picture on the screen behind her. 
159.jpg,A woman is standing in front of a screen. She is wearing a black and white dress. The woman is holding a brown book in her hands. There is a picture on the screen behind the woman. 
160.jpg,A woman is standing in front of a screen. She is wearing a black and white dress. She has long black hair and is holding a book in her hands. There is a picture on the screen behind the woman. 
161.jpg,There are three motorcycles and a car driving on the street. There are tall buildings on the side of the street next to trees. There is a red and white sign on the front of the screen.
162.jpg,There are several cars and motorcycles on the street. There is a tall white building behind them. There are trees on the side of the street next to the sidewalk.
163.jpg,Three motorbikes are driving down the street. There is a white car behind them. There are trees on the side of the street next to the sidewalk. 
164.jpg,There are three people riding motorcycles down the street. There is a white car behind them. There are trees on the side of the street next to the sidewalk. 
165.jpg,A man is wearing a blue shirt and a black tie. He is holding a tablet in his hands. There are tall buildings behind the man. There is a cloudy sky above the buildings.
166.jpg,A woman is wearing a black and white dress. She is holding a brown book in her hands. There is a picture next to the woman that has a city on it. 
167.jpg,A woman is wearing a black and white dress. She is holding a small book in her hands. There is a large screen behind the woman. There are buildings on the screen. 
168.jpg,A woman is standing in front of a screen. She is wearing a black and white dress and holding a book in her hands. There is a picture on the screen behind the woman. There are many buildings on the ground behind her. 
169.jpg,There are people sitting in a room. There is a man in a white shirt standing in front of a black desk. There are windows on the wall behind the desk. 
170.jpg,A man in a blue uniform is standing behind a black chair. He is holding a piece of paper in his hands. There is a microphone in front of him. 
171.jpg,There are two men standing next to each other. One of the men is wearing a white collared shirt. The other man has dark hair. There are stairs behind the men. There is a white wall behind them.
172.jpg,A man is standing behind a podium. There is a microphone in front of him. He is wearing a red vest and a white shirt and a black tie. 
173.jpg,There are five men sitting at a desk. There is a man standing in front of the desk. The man is wearing a white shirt. There are two windows on the wall behind them. 
174.jpg,There are people sitting in a room. There are wooden benches in front of them. There is a man in a white shirt sitting at a desk. There two men in green uniforms are sitting on benches. 
175.jpg,There are three men sitting in a room. There are wooden benches behind them. There is a man in a white shirt standing in front of a microphone.
176.jpg,A man in a white shirt and a black tie is sitting at a desk. He is wearing glasses and has a pen in his hand. There is a red sign in front of the man. 
177.jpg,There are two men sitting next to each other. There is a microphone in front of them. The man on the right is wearing a green shirt. There are red and yellow stripes on the shirt. 
178.jpg,There are people sitting at desks in a room. There are windows on the wall behind them. There is a man in a white shirt standing in front of a desk.
179.jpg,A man is standing behind a podium. There is a microphone in front of him. He is wearing a red and black robe and a white shirt and tie. 
180.jpg,There are several people sitting in a room. There are wooden benches in front of them. There is a man in a white shirt standing behind a podium.
181.jpg,A man is sitting in front of a microphone. He is wearing a white collared shirt. There is another man behind him sitting in a chair. There are wooden benches behind them. 
182.jpg,A man is standing in front of a city skyline. He is wearing a blue shirt and a black tie. He has glasses on and is holding a tablet in his hands. The sky behind him is orange and yellow. 
183.jpg,A man is standing in front of a city skyline. He is wearing a blue shirt and a black tie. He has glasses on and is holding a tablet in his hands. The sky behind him is orange and yellow. 
184.jpg,There are people sitting in chairs in a room. There are yellow curtains hanging from the windows. There is a man in a green shirt standing in front of a desk.
185.jpg,A woman is standing in front of a desk. She is wearing a black jacket. There is a blue sign on the desk. There are people sitting in chairs behind her. 
186.jpg,There are five people sitting around a table. There is a window behind them with yellow curtains on it. There are two women and a man sitting next to them. All of them are wearing face masks on their faces. 
187.jpg,A man is standing in front of a podium. He is wearing a white shirt and a black tie. The man is wearing glasses and is holding papers in his hands. There is a microphone on the podium. 
188.jpg,A man in a blue shirt is sitting at a table. There is a red sign in front of the man. There are papers on the table. 
189.jpg,Two men are sitting at a desk. One of the men is wearing a white shirt and tie. He is sitting in front of a black chair. The other man is standing behind him wearing a red robe and holding papers in his hands. There is a red sign on the desk. 
190.jpg,There are people sitting in chairs in a room. There are yellow curtains hanging from the windows. There is a man in a green uniform sitting in front of a table. 
191.jpg,A man in a robe is standing behind a desk. There is a red sign on the desk in front of him. There are two black chairs behind the desk. 
192.jpg,A man in a red robe is standing behind a desk. There is a red sign on the desk in front of him. There are two black chairs behind him. 
193.jpg,A woman is standing in front of a microphone. She is wearing a black shirt. There is a man in a green uniform behind her. There are people sitting in chairs behind them. They are all wearing face masks. 
194.jpg,There are four people sitting at a desk. There is a man in a white shirt and tie sitting in front of a desk with a red sign on it. There are two fans on the wall behind the desk. 
195.jpg,The image is completely black. On the right side of the image there is a red and black background. The red part of the background has small white dots on it. The dots are arranged in a dotted pattern. The time and date are displayed in the top right corner.
196.jpg,A person's hand is pressing a button on a metal object. The object is silver and has a black handle. There is a white counter behind the object. There are colorful bottles on top of the counter.
197.jpg,A hand is holding a black object. There are bottles on a counter behind the hand. There is a red and white sign in front of the person.
198.jpg,A man is standing in front of an arcade machine. He is wearing a black jacket and black pants. The man is wearing glasses on his face. The arcade machine is white and yellow. There is a picture on the side of the machine. 
199.jpg,There are several people standing in front of a wall. There are trees and plants on the wall behind them. There is a man in a camouflage shirt taking a picture of the people. 
200.jpg,There are several people standing in front of a wall. There are large green plants on the wall behind them. There is a large wooden pole next to the plants. 
201.jpg,A woman is standing in front of a screen. She is wearing a black and white dress. She has dark hair and is holding a book in her hands. There is a picture on the screen behind the woman. 
202.jpg,A woman is standing in front of a screen. She is wearing a black and white dress. She has dark hair and is holding a book in her hands. There is a picture on the screen behind the woman. 
203.jpg,A woman is standing in front of a screen. She is wearing a black and white dress. She has dark hair and is holding a wallet in her hands. There is a picture on the screen behind the woman. 
204.jpg,A man and woman are standing behind microphones. There are flags behind them. The man is wearing a suit and a red tie. He has glasses on his face. 
205.jpg,A woman is standing behind a podium. There are microphones in front of her. There is a large flag behind her. The woman is wearing a black shirt. 
206.jpg,A woman is standing behind a podium. There are microphones in front of her on the podium. The woman is wearing a black shirt and earrings. There is flags behind the woman. 
207.jpg,"The image is a slide from a presentation. The slide is titled Takeaways. In early April, we will depreciate the content in the United States and Facebook News was depreciated. People will still be able to view."
208.jpg,A screen shot of a Facebook page. The page is for ABC Australia. There is a blue circle on the top left corner of the page. Below that is the home page. At the top right corner is the time as 6:45:32.
209.jpg,"A screen shot of a Facebook page. The page is for ABC Australia. There is a blue circle on the top left corner of the page with the ABC Australia logo on it. Below the logo there is a home page with various options such as ""About"", ""Groups"", ""Community"", and ""Create Post"". Below that, there are three options: ""Photo/Video"", ""Check In"", ""Tag Friends"", etc."
210.jpg,A person is holding a phone in front of a laptop. The laptop is black and has a screen on it. There is a logo on the screen. 
211.jpg,A person is holding a phone in front of a laptop. The laptop is black and has a white screen on it. There is a blue logo on the screen. 
212.jpg,There are people walking on a sidewalk. There is a man in a blue polo shirt and gray shorts. He is holding a cell phone in his hand. 
213.jpg,A woman is sitting down looking at her phone. She has sunglasses on top of her head. She is wearing a floral shirt and black pants. There is a man standing behind her. 
214.jpg,A woman is sitting down looking down at her phone. She has sunglasses on her head. There are mannequins behind her with dresses on them. There is a black box in front of her.
215.jpg,A woman is standing outside on a sunny day. She is wearing a short sleeve shirt and a leopard print vest. The woman is holding a cell phone in her hands. Two other women can be seen standing behind the woman. One of the women is carrying a plastic bag on her shoulder. Two gray cars are parked on the side of the road. Tall red poles are standing on the road near the women.
216.jpg,A woman is walking down the street. She is wearing a black shirt and carrying a large beige purse. The woman is holding a phone in her hands. There is a large truck behind the woman. 
217.jpg,A man is wearing a blue shirt and a black tie. He is holding a tablet in his hands. There are tall buildings behind the man. There is a cloudy sky above the buildings.
218.jpg,A man is standing in front of a cityscape. He is wearing a blue shirt and a tie. He has glasses on and is holding a book in his hands. The sky behind him is orange and yellow. There are tall buildings all around him. 
219.jpg,A man is wearing a blue shirt and a black tie. He is holding a tablet in his hands. There are tall buildings behind the man. There is a cloudy sky above the buildings.
220.jpg,A man is standing behind a black podium. There are two microphones on the podium. The man is wearing a colorful headdress on his head. There is a large screen behind the man. 
221.jpg,There are people sitting in chairs on a stage. There is a large screen on the wall behind them. There are red steps leading up to the stage.
222.jpg,There is a large screen on the wall. There are people standing in front of the screen. There is a red carpet on the floor. 
223.jpg,There is a woman sitting down. She is not wearing a shirt. She has a necklace around her neck. The woman is holding a baby in her arms. The baby is wrapped up in a blanket. 
224.jpg,A man is standing in a room. He is wearing a colorful headdress on his head. There are pictures hanging on the wall behind the man. The man has a black shirt on with white writing on it. 
225.jpg,A man is wearing a colorful headdress. There are pictures hanging on the wall behind the man. There is a red ribbon in front of the man with writing on it. 
226.jpg,There are people walking on the dirt. There are trees next to the people. There is a small hut behind them. 
227.jpg,There are people standing in the water. There is a hill next to the water with grass on it. There are trees behind the hill. 
228.jpg,There are people sitting in a room. There is a white board in front of them. There are wooden beams on the ceiling of the room. 
229.jpg,A man is standing in a room. There are pictures hanging on the wall behind him. The man is wearing a black shirt and a plaid jacket. He has a black lanyard around his neck. 
230.jpg,This is an aerial view of a forest. The trees are green and thick. There is dirt on the ground. There are small white buildings in the middle of the dirt.
231.jpg,A man in a military uniform is walking towards a bulldozer. The bulldozer is yellow and has a large piece of metal on the front of it. There are trees surrounding the bulldozer and the man. 
232.jpg,There are people standing on a boat. There is water behind them. There are trees on the other side of the water. The sky above the water is filled with clouds.
233.jpg,A bunch of people are on a boat. The boat is on the water. The water is calm. There are a bunch of trees off in the distance. The sky is cloudy.
234.jpg,There are several hammocks hanging from poles in a room. There is a person laying in one of the hammocks. There are bags hanging on the wall next to the hammock. 
235.jpg,A man is looking to the left. He has a beard and mustache. His hair is dark brown. He is wearing a black shirt. Behind him is a wall with a picture frame hanging on it.
236.jpg,A bunch of cameras are set up in front of a group of people. There is a man in a black jacket standing behind them holding a camera. There are several people sitting in chairs behind them. 
237.jpg,Five people are sitting on red chairs on a stage. There are microphones in front of them. There is a large screen behind them with a white sign on it. 
238.jpg,There is a large screen on the wall. There is a red carpet on the floor in front of the screen. There are chairs on the side of the stage. 
239.jpg,A little girl is holding a camera. She is looking at the camera. The camera is black. The girl has braids in her hair. There is a mirror in front of the girl. 
240.jpg,A woman is wearing a blue jacket. She is holding a camera in her hands. There is a tripod in front of her. There are trees behind her. 
241.jpg,There is a jeep parked on the side of a dirt road. There are people standing in front of the jeep. There is a large body of water next to the road. 
242.jpg,A woman with braids on her head is holding a camera. She is wearing a black jacket. There are trees behind her. 
243.jpg,Two people are taking pictures with their cameras. They are both holding the cameras in front of their faces. One of the people is wearing a black hat. There are trees behind them. 
244.jpg,People are walking through an art gallery. The walls on either side of the walkway are painted bright red and white. There are several framed pictures hanging on the walls. The floor of the gallery is white.
245.jpg,"People are walking down a long white carpeted hallway in an art gallery. The walls on either side of the hallway are painted bright red and purple, and each wall has a single picture frame hanging on it. The ceiling of the gallery is white, and there are several rows of framed pictures hanging on the walls."
246.jpg,A woman is standing in front of a screen. She is wearing a black and white dress. The woman is holding a brown wallet. There is a large screen behind the woman. 
247.jpg,A woman in a black and white dress is standing in front of a city. She is holding a tablet in her hands. There is a picture on the screen next to the woman. 
248.jpg,A woman is standing in front of a city skyline. She is wearing a black and white dress and holding a brown purse. She has long dark hair and is speaking into a microphone. There is a large screen next to the woman.
249.jpg,A hand is holding a metal object. There is a silver counter behind the hand. There are colorful bottles on top of the counter. 
250.jpg,A person is holding a tool in their hand. There is a cabinet in front of them. There are white cabinets behind the cabinet. 
251.jpg,There is a video game machine in a room. There is a picture of a blue shark on the side of the machine. There are pictures of mermaids on the sides of the machines. 
252.jpg,The image is a video of a pinball machine. The machine has bright green lights on it. There is a picture of a palm tree on the side of the machine.
253.jpg,A man is standing in a room with his arms crossed. He is wearing a white shirt and has a gold bracelet on his wrist. There are shelves behind him with items on them. 
254.jpg,A man is standing in a room with his arms crossed. He is wearing a white shirt and has a gold bracelet on his wrist. There are shelves behind him with items on them. 
255.jpg,A person's hand is touching a pinball machine. The machine is brightly lit with green and yellow lights. There are cartoon characters on the sides of the machine.
256.jpg,"The image is of a video game pinball machine. The machine is black and has a colorful display on the top. The display has the game name in red letters. Under the display is a clear case with the game pieces inside. The game pieces are red, yellow, and silver. There are two bright lights on the case. The background of the image is white."
257.jpg,A person is holding a black object in their hands. They are wearing a silver ring on their finger. There is a table in front of them with a red and yellow cloth on it. 
258.jpg,This is an image of a game. The game is a pinball. The pinball machine is made of wood. The wood is a light brown color. There is a glass on the front of the machine. The glass is clear. There are metal knobs on the side of the game box. The machine is on a white table. The table has a checkered pattern on it.
259.jpg,There are several posters on the wall. The wall is a light pink color. There is a white sign on the other wall. There are pictures of people on the front of the posters. 
260.jpg,A white paper is on a table. There is a pile of coins on the table in front of the paper. The coins are gold in color. 
261.jpg,A small blue gameboy is sitting on a bright yellow table. Under the gameboy there is a small yellow sign with the numbers 499 FR 108.96 euros written on it.
262.jpg,A bulletin board is attached to a brick wall. There are several pictures pinned to the board. There is a white piece of paper hanging from the board with the pictures on it. 
263.jpg,A bulletin board is attached to a brick wall. There are several pictures pinned to the board. One of the pictures has a face drawn on it. 
264.jpg,A man is standing outside of a building. There are two green banners hanging from the building. The doors of the building are brown. The man is wearing a black shirt and black pants. 
265.jpg,There is a large sign on the side of a building. The sign is black and yellow. There is a black flag hanging from a pole next to the sign.
266.jpg,A hand is holding two coins. There is a black and white checkered table cloth under the hand. The hand is white and the coins are gold. 
267.jpg,A man is standing in front of a small arcade game. He is wearing a black jacket and black pants. There are two red stools in the front of the man. The floor has a blue and white pattern on it.
268.jpg,A man is standing in a room playing a video game. There are two arcade machines in front of him. There is a white door on the wall behind the man. 
269.jpg,A man is standing in a room playing a video game. There are two arcade machines in front of him. The man is wearing a black jacket and black pants. There is a white door behind the man. 
270.jpg,A man in a blue shirt and tie is standing in front of a city. He is holding a book in his hands. There are tall buildings behind him. 
271.jpg,A man is standing in front of a cityscape. He is wearing a blue shirt and a black tie. He has glasses on and is holding a book in his hands. The sky behind him is orange and yellow. There are tall buildings all around him.
272.jpg,A man is standing in front of a cityscape. He is wearing a blue shirt and a black tie. He has glasses on and is holding a tablet in his hands. The sky behind him is orange and yellow. There are tall buildings all around him.
273.jpg,A white wall with writing on it. There is a wooden table in front of the wall. The writing on the wall is in black. 
274.jpg,There are two paintings hanging on the wall. One of the paintings is blue and has a mountain on it. The other painting is green and has trees in it. There is a white wall behind them.
275.jpg,A group of people are standing in an art gallery looking at paintings on the walls. The walls are white and there is a bright yellow wall on the right side of the image. The floor of the gallery is made of light colored wood. The people in the image appear to be of different ages and genders.
276.jpg,A group of people are standing in an art gallery looking at paintings on the walls. The walls are white and there is a bright yellow wall on the right side of the image. The floor of the gallery is made of light colored wood. The people in the image appear to be of different ages and genders.
277.jpg,A woman with long blonde hair is looking at a painting. The painting is on a white wall. The woman is wearing a black shirt. 
278.jpg,"A woman is standing in front of a painting. She is wearing a black jacket. The painting is colorful and has green, orange, yellow and purple on it. The woman has blonde hair. "
279.jpg,A woman is standing in front of a white wall. There are three pictures hanging on the wall. The pictures are framed in white frames. The woman is wearing a black jacket. 
280.jpg,Two people are looking at a painting on the wall. The man is wearing a red sweater. The woman next to him has a white shirt on. There is a black bag on the woman's shoulder. 
