frame,caption
281.jpg,A woman is looking at a painting. She is holding a tablet in her hand. The woman has blonde hair that is in a bun. The painting is colorful. There is a white wall next to the woman. 
282.jpg,A man is standing in an empty room looking at paintings on the walls. The walls are white and the floor is a light brown color. The man is wearing a black jacket and dark pants. There are three paintings hanging on the wall. One of the paintings is blue and the other two are orange.
283.jpg,An empty room with four paintings hanging on the wall. The floor is a light brown color and the walls are white. There are small poles on the floor in front of the paintings. There is a large white door that leads to another room.
284.jpg,A man is standing in front of a painting. He is wearing a black jacket. The painting is hanging on a white wall. There are mountains on the painting. There is a tree on the mountain. 
285.jpg,A person is standing in front of a white wall. There is a picture hanging on the wall next to the person. The person is wearing a black jacket and has a brown bag on their shoulder. 
286.jpg,An older woman is looking at her cell phone. She is standing in front of a painting that is hanging on the wall. The woman is wearing a black jacket and gray pants. She has a cane in her left hand.
287.jpg,Two women are looking at paintings on a white wall. One of the paintings is green and has trees on it. There is a orange sun in the middle of the trees. 
288.jpg,A man is standing in an art gallery looking at three paintings on the wall. He is wearing a black jacket and dark pants. The floor of the gallery is made of light hardwood. The walls are white.
289.jpg,A picture is hanging on the wall. The picture is a painting. The frame is brown. The wall is white. The painting is yellow. There are mountains in the painting. There is a blue and yellow painting to the right of the picture. There's a watermark in the top right corner of the photo. The watermark is red and white.
290.jpg,A painting is hanging on a white wall. The painting has a blue top and yellow bottom. There is a white circle in the middle of the painting. 
291.jpg,There are two paintings hanging on the wall. The painting on the left is a picture of a tree. The picture on the right is a painting of a leaf. The leaves are green. The wall that the paintings are hanging on is white.
292.jpg,There are paintings hanging on the wall. The wall is white and there are three paintings on it. There is a painting on the left side of the wall that is red and has a large flower on it and it has a black base. There are two paintings on the right side that are green and have different colors on them. 
293.jpg,A woman is standing in front of a screen. She is wearing a black and white dress. The woman is holding a brown purse. There is a large screen behind the woman. 
294.jpg,A woman is standing in a black and white dress. She is holding a tablet in her hands. There is a picture next to the woman. 
295.jpg,A woman is standing in front of a screen. She is wearing a black and white dress. She has long dark hair and is holding a brown folder in her hands. There is a large picture on the screen next to the woman. 
296.jpg,This is an image of a runway show. The runway is white. There are rows of windows on either side of the runway. The windows are made of glass. The people are sitting in rows of seats. There is a lot of people sitting in the front of the room. The room has a white painted wall. The floor is also white.
297.jpg,There are several people sitting in chairs. There is a woman in a black robe standing in front of them. There are stairs next to them. 
298.jpg,A crowd of people are sitting in chairs. There is a woman in a black jacket and white skirt walking down the runway. There are people in the audience holding up their phones. 
299.jpg,A model walks down a runway in a black cape and white skirt. The runway is white. There are people sitting on either side of the runway watching the model. 
300.jpg,Two models are walking down the runway. They are both wearing white. There are people sitting on either side of the runway watching the models. There is a white wall behind them. 
301.jpg,A man is walking down the runway at a fashion show. He is wearing a white dress with ruffles on the shoulders. He has a pair of black high heels on his neck and he is wearing sunglasses. There are people sitting in the audience watching him. There is a barcode on the bottom left corner of the image.
302.jpg,A fashion show is going on. There are a lot of people watching the show. There is a woman walking down the runway. She is wearing a white coat and black pants. 
303.jpg,A fashion show is going on. The runway is white. There is a model walking down the runway. The model is wearing a white dress with a black coat over it. She is also wearing black boots. She has long brown hair. There are people sitting on either side of the runway watching the model.
304.jpg,A woman is walking down a runway. She has long brown hair and is wearing a black hat. She is also wearing sunglasses. There are people sitting behind her watching her. 
305.jpg,A fashion show is going on. There are two models walking down the runway. The model in the front is wearing a beige trench coat. She is wearing high heels. There is a crowd of people sitting on either side of the runway watching the models. 
306.jpg,"A picture of a woman walking down a runway. The runway is white. The woman is wearing high heels. There are many people sitting down watching the woman walk down the runway. There is a watermark in the top right corner of the photo that says ""HTV9 HD 06:49:56""."
307.jpg,A woman is walking down a runway. She is wearing a beige trench coat and sunglasses. There are people sitting in front of her watching her. There is another woman walking behind her. 
308.jpg,A woman is walking down a runway. She has long blonde hair and is wearing a beige coat. There are people sitting in front of her watching her. 
309.jpg,Two women are walking down a runway. One of the women is wearing a long black coat and a hat. The other woman is wearing an off-white coat and shorts. There are people sitting on either side of the runway watching the two women.
310.jpg,A model walks down the runway wearing a brown cape over her shoulders. She has a black hat on her head. There are people sitting on either side of her watching her. 
311.jpg,Two women are walking down a runway in front of a crowd of people sitting in chairs. The women are wearing long coats and boots. There is a white wall behind the women. 
312.jpg,A man in a blue shirt and tie is standing in front of a city. He is holding a tablet in his hands. There are tall buildings behind him. 
313.jpg,A man is wearing a blue shirt and a black tie. He is holding a tablet in his hands. There are tall buildings behind the man. There is a cloudy sky above the buildings.
314.jpg,A man is wearing a blue shirt and a black tie. He is holding a tablet in his hands. There are tall buildings behind the man. There is a cloudy sky above the buildings.
315.jpg,A person is swimming in the water. They are wearing a white shirt and a black watch on their wrist. They have goggles on their head. 
316.jpg,There is a large rock in the water. There is a red line in front of the rock. There are small white letters on the bottom of the red line.
317.jpg,"The image is taken underwater. The water appears to be murky. There are a few small waves in the water. There is a large object that looks like a boat. It is black in color and has a curved bottom. There appears to appear to be a large piece of land in the bottom of the water near the boat. The image has a watermark in the top right corner that reads ""HTV9 HD 06:50:37""."
318.jpg,A person is swimming in the water. They are wearing a white shirt and dark pants. There is dirt and rocks on the ground under them. 
319.jpg,A man is wearing a white shirt and has a scuba mask on. There is a large snake in the water in front of the man. 
320.jpg,A man is underwater. He is wearing a white shirt and has goggles on his face. There is a large snake in front of the man. 
321.jpg,A man is holding a large snake. The man is wearing a black watch on his wrist. The snake is wrapped around the man's body. 
322.jpg,A bald man with glasses is sitting on a couch. He is wearing a white collared shirt. There is a white dresser behind him against a wall. There are stuffed animals on the dresser. 
323.jpg,A snake is being held in a hand. The snake is dark brown and has yellow on it. The hand is white and is holding the snake. There are trees behind the hand.
324.jpg,A man in a blue shirt is holding a large snake. The snake is yellow and black. There are trees behind the man. 
325.jpg,A person is holding a snake in their hand. The snake is dark brown and has a pattern on it. The person is wearing a blue shirt. There is a watermark in the top right corner of the image.
326.jpg,An elderly man with glasses is sitting on a couch. He is wearing a blue button down shirt. There is a white dresser behind him against a wall. There are hats hanging on the wall above the dresser. 
327.jpg,A person is swimming in the water. They are wearing a white shirt and dark pants. There is dirt on the ground in front of them. 
328.jpg,A man is wearing a white shirt and scuba gear. He is in the water. There is a large snake in front of the man. The man is looking at the snake. 
329.jpg,A woman is standing in front of a cityscape. She is wearing a black and white dress. She has long dark hair and is holding a book in her hands. There is a large screen behind the woman. 
330.jpg,A woman is standing in front of a cityscape. She is wearing a black and white dress. She has long dark hair and is holding a small book in her hands. There is a large screen behind the woman. 
331.jpg,A woman is standing in front of a screen. She is wearing a black and white dress. She has long dark hair and is holding a tablet in her hands. There is a picture on the screen next to the woman. 
332.jpg,A woman is standing in front of a city skyline. She is wearing a black and white dress. She has long dark hair and is holding a book in her hands. There is a picture on the screen next to the woman. 
333.jpg,A group of people are standing in front of a wall. There are plants and trees on the wall behind them. There is a sign on a pole next to the people. 
334.jpg,A large purple flower is in the middle of a garden. There are many green plants behind the flower. There is a red arrow pointing to the flower on the screen. 
335.jpg,A group of people are standing in a room. There are large green plants on the wall behind them. There is a large wooden pole in front of them. A man in a gray vest is holding a baby in his arms. 
336.jpg,The image is a flower. The petals of the flower are a deep purple color. The center of the petals are a lighter shade of purple. There is a bright yellow light in the middle of the purple petals. At the bottom of the image there is a red banner with white letters. The text on the banner is in Vietnamese.
337.jpg,A group of people are standing inside of a building. There are large plants and trees surrounding the people. There is a large purple flower on the ground in between the plants. 
338.jpg,A woman is wearing a black shirt. There are plants behind the woman. The woman has blonde hair. There is a black sign in front of her. 
339.jpg,A woman is wearing a black collared shirt. There are plants behind her. There is a black sign in front of her. 
340.jpg,A large purple and yellow flower is on display. There is a white sign under the flower. There are many plants around the flower on the ground. 
341.jpg,There are two people standing next to each other. There are large plants behind them. There is a woman in a green shirt with sunglasses hanging from her neck. The girl next to her is wearing a blue shirt.
342.jpg,A man is lifting a little girl up in the air. The girl is wearing a green shirt and black pants. There are large plants next to the girl. 
343.jpg,A man in a black jacket is taking a picture with his phone. He is standing next to a woman. They are surrounded by plants and trees. There is a tall pole in front of them. 
344.jpg,A diagram of the life cycle of the Titan Arum. It shows the different stages of the plant life cycle. There is a large tree on the right side of the diagram. There are several smaller trees on the left side of this diagram.
345.jpg,A diagram of the life cycle of the Titan Arum. The diagram shows the stages of the plant. There is a tree on the right side of the diagram.
346.jpg,A woman is standing in front of a large purple flower. There are large green plants behind the woman. The woman is wearing a gray shirt and blue pants. 
347.jpg,A group of people are standing in a building. There is a small pool next to the people. There are large windows on the side of the building. 
348.jpg,A man in a blue shirt and black pants is standing in front of a large screen. There is a picture of a city on the screen behind him. The man is holding a book in his hands. 
349.jpg,A man and a woman are standing in front of a desk. The desk is white and has a red logo on it. The man is wearing a blue shirt and a tie. The woman is standing behind the desk wearing a gray shirt. There is a large screen behind them. There are buildings on the screen. 
350.jpg,A man and a woman are standing in front of a news desk. The desk is white and has a red logo on it. The man is wearing a blue shirt and tie and glasses. The woman is also wearing a gray suit. There is a large screen behind them. There are many buildings on the screen.
351.jpg,A man and a woman are standing behind a news desk. The desk is white and has a red logo on it. The man is wearing a blue shirt and black pants. The woman is also wearing a gray shirt. There is a large screen behind them. There are buildings on the screen. 
352.jpg,A man and a woman are standing in front of a desk. They are both dressed in business attire. The desk is white and has a red logo on it. There is a large screen behind them that shows a city skyline. There are lights on the ceiling above them.
