frame,caption
140.jpg,There is a red truck with blue lights on top of it. There are people standing in front of the truck. There is a white building behind the truck with a white sign on it. 
141.jpg,A woman is standing in front of a city skyline. She is wearing a white dress with long sleeves. The woman has long black hair. The sky is orange and cloudy. There are tall buildings behind the woman. 
142.jpg,A woman is standing in front of a city skyline. She is wearing a white dress with long sleeves. The woman has long black hair. The sky is orange and yellow. There are tall buildings behind the woman. 
143.jpg,There is a building on fire. There is a large white sign on the side of the building. There are trees in front of the sign. 
144.jpg,A fire is raging. The fire is bright orange and yellow. There is a lot of black smoke coming out of the building. A light is on a pole in front of the fire. A tree is next to the light. 
145.jpg,There is a large fire on the ground. There is black smoke coming out of the fire. There are people standing in front of the burning fire. 
146.jpg,"A picture of a building is being shown on a TV screen. There is a lot of fire and smoke coming out of the building. The picture is very blurry. There are words on the bottom of the screen that say ""Trong hai thang dau nam 2024, xuat khau det may 5,2 ty USD""."
147.jpg,A picture of a fire is being shown. There is a bright light coming from the top of a building. There are wires above the building. 
148.jpg,A picture of a cross is being shown. The cross appears to be burning. There is a lot of fire and smoke surrounding the cross. The picture is very blurry.
149.jpg,A man in a blue shirt and black shorts is standing on a street. There is a motorcycle on the street in front of him. There are trees on the other side of the street. 
150.jpg,There is a group of people standing in front of a black car. There is a lot of black smoke coming out of a building behind the car. 
151.jpg,A man is standing in front of a city skyline. He is wearing a blue striped shirt and a white tie. The man is holding a tablet in his hands. The sky behind the man is orange and yellow. There are tall buildings all around the man.
152.jpg,A man is standing in front of a city skyline. He is wearing a blue and white striped shirt and a white tie. The man is holding a tablet in his hands. The sky behind the man is orange and yellow. There are tall buildings all around the man.
153.jpg,A man is standing in front of a picture of a city. He is wearing a blue striped shirt and a white tie. The man is holding a tablet in his hands. There are tall buildings behind the man. 
154.jpg,A white paper with black writing on it. There is a picture of a man on the right side of the paper. The man has black hair and a white shirt. 
155.jpg,A man is sitting in front of a white wall. He is wearing a gray shirt and a yellow tie. There is a gray door behind the man. 
156.jpg,There are several men standing in front of a white building. There is a man in a white shirt standing next to them. There are two men in uniform holding a white paper. 
157.jpg,There are six men standing in a line. There is a man in a white shirt standing in front of them. There are two men in green uniforms standing next to them. 
158.jpg,There are several men sitting around a table. There is a gray table in front of them. There are papers and cups on top of the table. 
159.jpg,There are several men standing around a table. There is a man in a white shirt standing in front of them. There are two men sitting at the table. 
160.jpg,Five men are sitting around a table. There is a man in a blue shirt sitting in front of the table holding a white piece of paper. There are two men in uniform sitting next to him. 
161.jpg,There are several men sitting around a table. There is a man in a blue uniform sitting in front of the table with papers on it. There are two men standing behind them. 
162.jpg,There are four men standing in front of a building. There is a man in a white shirt and shorts standing against the wall. There are two men in uniform standing next to the building. 
163.jpg,A man is standing in front of a white wall. He is wearing a short sleeve gray shirt and a yellow bag over his shoulder. The man has short black hair and is looking down. There is writing on the bottom of the image.
164.jpg,"A white piece of paper has a picture of a man on it. The man has black hair and is wearing a white collared shirt. There is a red stamp on the top left corner of the paper that says ""DAC BIET"" in red. Below the picture there is a list of words in another language. The first word is ""QUYET DINH TRUY NA"" and the second is ""PHO THU TRUONG"". There is also a stamp that says T.N.T.I.Q. on the bottom right corner."
165.jpg,The image is completely black. On the right side of the image there is a red and black background. The red part of the background has small white dots on it. The dots are arranged in a dotted pattern. The time is 06:42:28 on the top right corner.
166.jpg,"The image is a graphic design. The background is red and white. The design has dots on it. The dots are white. There is a big red circle in the middle. The red circle has the word ""giay"" written on it in gray letters. There are two smaller red circles on either side of the large red circle. The lines are white and thin."
167.jpg,A man is standing in front of a white wall. He is shirtless and wearing white shorts. He has a white face mask on and an orange rectangle on his face. The man has black hair.
168.jpg,A person is laying in a hospital bed. They are wearing a white mask on their face. There is a blue machine behind the bed. 
169.jpg,"The image is an abstract painting. The painting is very colorful. The colors are red, pink, and blue. There is a small red rectangle in the bottom left of the painting. There are a lot of brush strokes in the painting as well."
170.jpg,The image is a screenshot from a video. The background of the image is purple. There are small white dots scattered throughout the image. The image has a red border around the edges. There is a small logo in the bottom left corner that says 16 giay. There appears to be a cityscape in the background. The time and date of the video is 06:42:40 in the top right corner.
171.jpg,The image is a screenshot from a video game. It shows a character standing in a tunnel. The character is blue and white. There are three green boxes in the tunnel. There is a red banner at the bottom of the screen that says 16 giay.
172.jpg,The image is a graphic design. The background is red and white. The design is made up of squares. The squares are arranged in a diagonal pattern. The lines are white and black. In the center of the design is the number 6. The numbers are red and silver. The letters are also red. There is a watermark in the top right corner of the image.
173.jpg,A man and a woman are standing behind a white table. They are wearing a blue shirt and tie. There is a large screen behind them. 
174.jpg,A woman in a white dress is standing in front of a large city. She is holding a brown book in her hands. There is a large screen behind her with several women standing on it. They are wearing sashes around their necks. 
175.jpg,A woman is standing in front of a screen. She is wearing a white dress and holding a gold wallet. There is a picture on the screen next to the woman. 
176.jpg,A woman in a white dress is standing in front of a screen. She is holding an object in her hands. There is a picture of a woman on the screen next to her. 
177.jpg,A group of women are standing on a stage. They are all wearing long dresses. There is a man in a black suit standing behind them. There are lights hanging from the ceiling above the stage.
178.jpg,There are several women standing on a stage. They are all wearing long dresses. There is a man in a black suit standing behind them. There are lights hanging from the ceiling above them.
179.jpg,A woman is wearing a white dress and a crown on her head. She has long blonde hair. There are lights behind her on the stage. She is waving her hand and has a sash around her waist.
180.jpg,A woman is standing on a stage. She is wearing a silver dress and a crown on her head. There is a white sash draped across her dress. There are lights behind her on the stage.
181.jpg,There are several women standing on a stage. They are all wearing long dresses. There is a man standing behind them wearing a black suit and a white shirt. There are lights on the stage behind them.
182.jpg,There are several women standing on a stage. They are all wearing sashes. There is a man in a black suit standing behind them. 
183.jpg,"The image is an advertisement for a TV show called ""Multimedia Winner Vietnam"". The background of the image is blue and there are two yellow stars on either side of a red background. There is a woman in the center of the ad with long brown hair. She is wearing a white dress and has a necklace around her neck. The words ""Vietnam"" are written below the image in white letters."
184.jpg,"The image is an advertisement for a TV show called ""Multimedia Winner Vietnam"". The background of the image is red and blue with yellow stars. There is a woman in the center of the ad. She has long brown hair and is wearing a white dress with a necklace around her neck. The words ""Vietnam"" are written below the woman in white letters."
185.jpg,"A beautiful woman is standing on a stage. She is wearing a white dress and has a white sash draped across her shoulders. The sash has the word ""Vietnam"" written on it in black letters. The woman has long dark hair and is smiling at the camera. There are stairs behind her that are lit up with yellow lights."
186.jpg,"A beautiful young woman is standing on a stage. She is wearing a white sash that says ""Vietnam"" on it. The dress she is wearing is sparkly and has feathers on the shoulders. She has long dark hair and is smiling at the camera."
187.jpg,A beautiful young woman with long dark hair is standing in front of a green screen. She is wearing a white sash with a letter S on it. She has a necklace around her neck and earrings on her ears. Her hands are clasped together in a praying position. There is another woman standing behind her wearing a silver dress.
188.jpg,A woman is standing in front of a screen. She is wearing a white sash around her neck. The sash has a logo on it. The woman has long brown hair and is smiling. There is another woman standing behind her. 
189.jpg,There is a woman wearing a red shirt. She has long brown hair and is smiling. There is a black background behind the woman. 
190.jpg,A woman with long brown hair is smiling. She is wearing a red shirt. There is a black background behind the woman. 
191.jpg,A man is standing in front of a city skyline. He is wearing a blue striped shirt and a white tie. The man is holding a tablet in his hands. The sky behind the man is orange and yellow. There are tall buildings all around the man.
192.jpg,A man is standing in front of a picture of a city. He is wearing a blue striped shirt and a white tie. The man is holding a red object in his hands. There are tall buildings behind the man. The sky above the man is orange and yellow. There is writing on the bottom of the picture.
193.jpg,A man is standing in front of a city skyline. He is wearing a blue striped shirt and a white tie. The sky behind him is orange and yellow. There are tall buildings all around the man.
194.jpg,A man is laying in a hospital bed. He is wearing a white mask on his face. There is a blue headboard on the wall above the bed. 
195.jpg,A person is laying down in a hospital bed. They have a white mask on their head and a blue shirt on. There are black straps on their feet. 
196.jpg,A man is standing in front of a purple sign. He is wearing a white hat and a white shirt. He has a black beard and glasses on. There is a microphone in his hand. 
197.jpg,A man is wearing a white hat and a white shirt. He has glasses on and has a black beard. There is a purple sign behind him.
198.jpg,There is a person laying in a hospital bed. They are wearing a white mask and a blue shirt. There is a woman sitting next to the bed in a white shirt. 
199.jpg,A man is wearing a surgical mask. The mask is white and has writing on it. There is a blue hat on the head of the man. 
200.jpg,A man is standing in front of a white wall. He is wearing a white face mask. There is an orange rectangle on his face. The man has dark hair. 
201.jpg,A woman is standing in front of a screen. She is wearing a white dress. She has long dark hair and is holding a book in her hands. There is a large screen behind the woman. 
202.jpg,A woman in a white dress is standing in front of a screen. There is a man in a black suit on the screen. The man is pointing at a screen that has a black screen on it. 
203.jpg,A woman is standing in front of a screen. She is wearing a white dress with long sleeves. The woman has long dark hair and is holding a book in her hands. There is a large screen behind the woman. 
204.jpg,A large white moon is in front of a large building. There are people standing in the front of the building. The building has a large white sign on it.
205.jpg,"The image is a screenshot of a news channel. The channel is htv9 HD and the time is 06:46:55. The image has a purple and blue color scheme. There are a lot of small white dots scattered throughout the image. At the bottom of the image there is a red banner with the channel name in white letters. There is also a logo in the top right corner that says ""HTV9 HD"" in red letters."
206.jpg,A man is standing on a stage. He is wearing a white jacket and black pants. There is a colorful wall behind him. There are lights on the ceiling above him. 
207.jpg,There is a person standing on a stage. They are wearing a white shirt and black pants. There is a colorful wall behind them. There are lights on the ceiling above them.
208.jpg,A man is standing on a stage. He is wearing a white shirt and black pants. There is a black and white wall behind him. There are lights hanging from the ceiling.
209.jpg,A man is standing in front of a large screen. He is wearing a black jacket. There is a large window behind the man. The window has white blinds on it. 
210.jpg,A man is standing in front of a large screen. He is wearing a long sleeve black shirt. The man is holding a microphone in his hand. There is a large window behind the man. 
211.jpg,This is a scene from a video game. There are shelves lined up against a wall. The shelves are filled with various items. The items on the shelves are colorful. There is writing on the bottom of the screen that is in a foreign language.
212.jpg,There are two cans of Tingles Vape Juice. The cans are blue and have white writing on them. There is a picture of a cartoon face on the front of the cans. 
213.jpg,A man is standing in front of a wall of televisions. He is wearing a black collared shirt and has a blue lanyard around his neck. The televisions are hanging on the wall in a row. There are pictures of cartoon characters on each of them. 
214.jpg,There are several screens on a wall. There are cartoon images on the screens. There is a red light on the wall behind them. 
215.jpg,A person is wearing a black shirt and has a black bracelet on their wrist. They are standing in front of a large screen. There is a circle on the screen with different icons on it. 
216.jpg,A person is standing in front of a large screen. They are wearing a black shirt and a black bracelet on their wrist. The screen is black and has a circle on it. 
217.jpg,"The image is a screenshot from a video game. There are colorful buildings on both sides of the image. There is a sign that says ""Tattoo"" on the right side of the building. The building on the left is green and white. On the ceiling there are red and white paper lanterns hanging. The floor in the image is gray."
218.jpg,A man is wearing a white shirt and a black hat. He is standing in front of a large pink structure. There are purple hands hanging from the top of the structure. 
219.jpg,A man is standing in front of a display case. He is wearing a white and blue shirt. The display case is pink and purple. There are hands hanging from the top of it. 
220.jpg,There is a large screen on the wall. There is a cartoon face on the screen. The face has big eyes and a big smile on it's face. There are lines coming out of the face.
221.jpg,There is a large screen on the wall. There is a pink heart on the screen with a smiley face on it. There are words above the heart. 
222.jpg,A person is standing in front of a screen. They are wearing headphones on their head. There are pictures on the wall behind the person. There is a checkered table in the middle of the room. 
223.jpg,A woman in a white dress is standing in front of a screen. There is a picture on the screen next to her. There are white and red cones on the ground. 
224.jpg,A woman in a white dress is standing in front of a screen. There is a picture of a dog jumping over a hurdle on the screen. 
225.jpg,There is a black dog running on a field. There are white and blue cones on the ground in front of the dog. There is a large white sign on the side of the field. 
226.jpg,There is a man in a black suit running on a field. There are white barriers in front of the man. There is a red and white sign on the ground next to the barriers.
227.jpg,A black and white dog is running on a green field. There is a white and black fence in front of the dog. The dog has white feet and a black head.
228.jpg,There are people standing in a large room. There is a white wall behind them with a sign on it. There are chairs in front of the people. 
229.jpg,There are several people standing in front of a crowd. There is a large white wall behind them. There are two dalmatian dogs on the ground in front. 
230.jpg,There is a woman wearing a black dress. She has long blonde hair and is wearing glasses. There are people sitting in chairs behind her. There is a green floor behind them. 
231.jpg,There are people standing in a room. There is a woman wearing a black shirt and a white lanyard around her neck. There are large windows on the wall behind them.
232.jpg,There is a dog standing on a red carpet. The dog is gray and has a collar around its neck. There is a person standing behind the dog wearing black pants and white shoes.
233.jpg,There is a dog standing in front of a cage. The dog has long hair that is white and black. There is a barcode on the bottom left of the image.
234.jpg,There are several people walking their dogs on leashes. There is a black dog in front of them. There are two brown dogs behind them. 
235.jpg,A dog is jumping over a hurdle. The hurdle is white and green. The dog is brown. There is a person behind the dog. The person is wearing black pants and black shoes. 
236.jpg,A man is standing in front of a picture of a city. He is wearing a blue striped shirt and a white tie. The man is holding an object in his hands. There are tall buildings behind the man. 
237.jpg,This is an image of a room. The room is empty. The walls are white. The floor is a light gray color. There are three windows on the wall. The windows have white blinds on them. The blinds are closed. The ceiling is white and has lights on it. The lights are turned on. There is a row of cabinets on the right side of the room.
238.jpg,The image is a screenshot from a news channel. The channel is HTV9 HD and the time is 06:49:14. There is a red banner at the bottom of the image with the channel name and logo. There are rows of white slats on the ceiling. The slats are arranged in a grid pattern.
239.jpg,There are rows of white shelves in a room. There are lights on the ceiling in front of the shelves. The floor in the room is gray.
240.jpg,A man is standing in a room. He is wearing a blue suit and a white shirt with a black tie. There are long curtains hanging on the wall behind the man. 
241.jpg,A man is wearing a blue suit and a white shirt with a blue tie. He has short blonde hair and is looking off to the side. There are white curtains behind him.
242.jpg,This is an aerial view of a city. The sky is blue with white clouds. There is a large white building in the background. There are trees in front of the building with no leaves on them. 
243.jpg,This is an aerial view of a city. There is a large white building next to a body of water. There are trees in front of the building with no leaves on them. The road is filled with cars and trucks. 
244.jpg,A man is wearing a blue suit and a white shirt with a black tie. He has short blonde hair and is looking to the left. There are white pillars behind him.
245.jpg,A man is standing in a room. He is wearing a blue suit and a white shirt with a black tie. The man has short blonde hair. There are white pillars behind the man. 
246.jpg,A picture of an empty room with white walls. There are lights on the ceiling above the room. There is a white bench in front of the wall. 
247.jpg,This is an image of a room. The room is empty. The walls are white. The floor is gray. There is a long white table in the room. There are stairs leading up to the door. The stairs are made of metal. The railing on the stairs is silver. The table is made of wood.
248.jpg,A room with three windows on the wall. There is a mirror on the side of the room. There are lights on the mirror. 
249.jpg,A man in a blue shirt and black pants is standing in front of a large screen. There is a picture of a city on the screen behind the man. The man is holding a book in his hands. 
250.jpg,A man in a blue shirt and black pants is standing on a red carpet. There is a large screen behind the man. There are buildings on the screen. 
251.jpg,A man and a woman are standing behind a news desk. The desk is white and has a red logo on it. The man is wearing a blue shirt and a white tie. He is holding a book in his hands. The woman is also wearing a white dress. There is a large screen behind them. There are many tall buildings on the screen.
252.jpg,There is a man and a woman standing behind a white table. There is a large screen behind them with a city on it. The man is wearing a blue shirt and a white tie. 
253.jpg,A man and a woman are standing behind a news desk. The desk is white and has a red logo on it. The man is wearing a blue shirt and a white tie. The woman has a white top on and has long black hair. There is a large screen behind them.
254.jpg,A man and a woman are standing behind a desk. There is a large screen behind them on the wall. The desk is white and has a red logo on it. 
