frame,caption
269.jpg,A group of people are sitting inside of a large tent. There are lights hanging from the ceiling of the tent. Some of the people are standing in front of them. There is a large black object on the ground in between the people.
270.jpg,A white bucket is sitting on the ground. There are two large logs in front of the bucket. There is a white string hanging from the logs. 
271.jpg,There are people standing in a field. There are trees behind them. There is grass and dirt on the ground around them. 
272.jpg,A man and a woman are standing behind a news desk. The desk is white and has a red logo on it. The man is wearing a blue shirt and a pink tie. He is holding a tablet in his hands. There is a large screen behind them. There are buildings and clouds in the sky.
273.jpg,A man and a woman are standing behind a news desk. The desk is white and has a red logo on it. The man is wearing a blue shirt and a pink tie. He is holding a tablet in his hands. The woman has a pink shirt on. There is a large screen behind them. There are many buildings and skyscrapers on the screen.
274.jpg,A man and a woman are standing in front of a desk. The desk is white and has a red rug on it. There is a large screen behind them. There are buildings on the screen. 
