frame,caption
132.jpg,There are several people standing in a field. There are trees behind them in the grass. They are all wearing 3d glasses on their eyes. There is a man in a black jacket standing behind them. 
133.jpg,A telescope is sitting on the grass. There are people sitting in chairs behind it. There is a man in a blue jacket standing in front of the telescope. 
134.jpg,There are people standing on the side of a mountain. There are large boulders on the sides of the mountain. The people are standing in front of a large rock formation. 
135.jpg,A man is standing in front of a large rock formation. He is wearing a black cap with a white logo on it. He has a blue jacket and a white scarf around his neck. There is a yellow strap hanging from his jacket.
136.jpg,There are two people walking on a path. There is a large rock formation behind them. There are small rocks on the ground in front of them.
137.jpg,A man and woman are standing in front of a large rock formation. The man is wearing a black hat and a black jacket. The woman is wearing glasses and a red jacket. They are both smiling. There is writing on the bottom of the image.
138.jpg,"A ring of light is glowing in the dark. The background is completely black. At the top right corner of the image there is a watermark that reads ""HTV7 HD 18:40:56"". Below the image it is written in Vietnamese."
139.jpg,A large crowd of people are gathered in a park. There are several tents set up behind the crowd. Some of the people are holding umbrellas. There is grass on the ground in front of them. 
140.jpg,"A bright yellow circle is glowing on a dark brown background. There is a watermark in the top right corner that reads ""HTV7 HD 18:41:06"". Below the circle, there is white writing that says ""Quang Nam: NHieu ho thuy lai, thuy dien da tich day nuoc""."
141.jpg,A man is standing in front of a city skyline. He is wearing a striped blue shirt and a pink tie. He has black glasses on and has short dark hair. The sky behind him is orange and pink.
142.jpg,A man is standing in front of a city skyline. He is wearing a striped blue shirt and a pink tie. He has black glasses on and has short dark hair. The sky behind him is orange and pink. There are tall buildings in the skyline. 
143.jpg,A man is standing in front of a city skyline. He is wearing a striped blue shirt and a pink tie. He has black glasses on and is smiling. The sky behind him is orange and pink. There are several tall buildings in the skyline.
144.jpg,A woman is standing in a room. She is wearing a black jacket. There are two white robots in front of the woman. The woman is holding a brush in her hand. 
145.jpg,A woman is wearing a black suit. There are two white robots in front of the woman. The woman is holding a pen and paper in her hands. 
146.jpg,A woman is painting on a white table. There is a white robot standing next to the table. The woman is wearing a black shirt. She is holding a paintbrush in her hand. 
147.jpg,There is a white table with a painting on it. There is a silver paintbrush on top of the painting. The paintbrush is being used to paint the design on the white table. The writing on the bottom of the image is in Vietnamese.
148.jpg,A woman with long black hair is wearing a black shirt. There is a white wall behind the woman. There are white robots on the wall behind her. 
149.jpg,A woman with long black hair is wearing a black blazer. There is a white table behind the woman with a white machine on it. The wall behind the table is white. 
150.jpg,A person is standing in front of a white wall. They are wearing a black shirt and a bracelet on their wrist. There are black splashes of paint on the wall. 
151.jpg,A person is drawing on a piece of paper. They are holding a red marker in their hand. There are blue lines and shapes on the paper. The paper is sitting on a table. 
152.jpg,Someone is drawing on a piece of paper. The paper is white and the person is holding a red marker. There are blue lines on the paper. 
153.jpg,There are three people standing in a room. There is a white wall behind them. There are pictures hanging on the wall. The man in the front is wearing a black jacket. 
154.jpg,A woman is standing in front of a screen. She is wearing a short sleeve pink shirt and gray bottoms. The woman is holding a red book in her hands. There is a large white screen behind the woman. 
155.jpg,There is a woman in a pink shirt standing in front of a red wall. She is holding a red book in her hand. There is a picture next to the woman in the pink shirt. There are people behind them in a crowd. 
156.jpg,There is a woman in a pink shirt standing in front of a red wall. She is holding a red book in her hand. There is a picture next to the woman with two men in suits on the screen. 
157.jpg,There is a woman in a pink shirt standing in front of a screen. There are three men sitting next to her. They are wearing suits and glasses. There is a red background behind them.
158.jpg,Three men are sitting down on a chair. They are all wearing suits and glasses. The man on the right is wearing a white button down shirt and blue jeans. 
159.jpg,There are several people standing in front of a glass door. There is a man in a blue suit sitting on a black chair. 
160.jpg,An older man with gray hair and glasses is sitting down. He is wearing a blue suit and a light blue shirt. Behind him are several other men in suits and ties. They are standing in front of a glass door. There is a barcode on the bottom left of the image.
161.jpg,There are several people standing in front of a building. There is a man in a suit and glasses standing next to a woman in a blue jacket. There are several other people standing behind them. 
162.jpg,There are two older men standing next to a woman. They are both wearing suits. The man on the left is wearing glasses on his face. The woman is wearing a black dress with a leopard print scarf around her neck. There is a crowd of people behind them. 
163.jpg,There are people standing next to each other. They are all wearing sunglasses. There is a man in a suit next to a woman in a black dress. There are trees behind them.
164.jpg,A man and a woman are standing in front of a white desk. The man is wearing a blue shirt and a pink tie. He is holding a tablet in his hands. The woman is wearing pink shirt and has black hair. There is a large cityscape behind them. The sky is red and orange. 
165.jpg,A man and a woman are standing behind a white desk. The man is wearing a blue striped shirt and a pink tie. The woman is also wearing a pink shirt. There is a large cityscape behind them. 
166.jpg,A man and a woman are standing in front of a white desk. They are both dressed in business attire. The man is wearing a blue striped shirt and a pink tie. The woman has a pink shirt on and is holding a red folder. There is a large cityscape behind them. The sky is orange and pink. 
167.jpg,A man and a woman are standing behind a white desk. The man is wearing a blue striped shirt and a pink tie. The woman is also wearing a pink shirt. There are tall buildings behind them. 
168.jpg,There are two men sitting at a table. They are wearing green uniforms. There is a man in a white shirt standing in front of them. 
169.jpg,There are two men sitting at a table. The man on the left is wearing a green uniform. There is a man in a white shirt standing in front of the table. 
170.jpg,A man is wearing a white shirt. There is a white wall behind the man. The man has short black hair. 
171.jpg,Two men are wearing green uniforms. One of the men is wearing a green hat and a face mask. The other man is wearing white gloves. They are putting something in a brown box. 
172.jpg,A man in a green uniform is wearing a face mask. There are boxes in front of him. There is a window behind him with blue curtains on it. 
173.jpg,There is a brown cardboard box on the ground. There are white bags inside of the box. There is green balls in a bag in front of the bags. 
174.jpg,Two men are wearing green uniforms and white gloves. They are kneeling down in front of a table. There are many items on top of the table. One of the men is wearing a green hat and a face mask. 
175.jpg,There are several bags of fruit on the ground. There are green and red olives in the bags. There is a white paper on top of the olives. 
176.jpg,There are several men standing in front of a fence. There is a silver pole behind them. The men are wearing shirts. 
177.jpg,There are several men standing in front of a fence. They are all wearing white shirts. There is a white fence behind them. 
178.jpg,There are several men standing in a line. There is a silver fence behind them. The man in the front is wearing a white shirt. 
179.jpg,A man is standing in front of a city skyline. He is wearing a striped blue shirt and a pink tie. He has black glasses on and has short black hair. The sky behind him is orange and pink. There are tall buildings in the skyline. 
180.jpg,A man is standing in front of a city skyline. He is wearing a striped blue shirt and a pink tie. He has black glasses on and has short black hair. The sky behind him is orange and pink. There are tall buildings in the skyline. 
181.jpg,There are several men standing around a table. There is a window on the wall behind them. There are boxes on top of the table. 
182.jpg,There are several people standing around a table. There are boxes wrapped in silver foil on top of the table. The people are wearing white gloves on their hands. There is a laptop on the table in front of them.
183.jpg,There are several men standing around a table. There is a window behind them on the wall. There are boxes on top of the table. 
184.jpg,Two people are wearing white gloves. One of the people is holding a black phone. There is a black table in front of them with a blue book on it. 
185.jpg,Two hands are wearing white gloves. One hand is holding a red tool. There is a black phone in front of them. There are papers on top of a table. 
186.jpg,Two men are standing in front of a green wall. The man on the left is wearing a black hat and a plaid shirt. He is wearing glasses on his face. The other man is standing behind him wearing a short sleeve shirt. 
187.jpg,A man and a woman are standing behind a white desk. They are both dressed in business attire. The man is wearing a blue striped shirt and a pink tie. He is holding a tablet in his hands. The woman is wearing short sleeve pink shirt. She has short black hair. There is a large cityscape behind them. The sky is orange and pink.
188.jpg,A man and a woman are standing in front of a white desk. The man is wearing a blue striped shirt and a pink tie. The woman is also wearing a pink shirt. There is a large cityscape behind them. The sky is red and orange. 
189.jpg,There is a large truck on the street. There is a red container on the side of the truck. The truck is black and has a black tarp on the back of it. 
190.jpg,There are several trucks driving on the street. There is a large white truck with a red trailer attached to it. Next to the trailer is a black truck. 
191.jpg,A truck that has crashed into another truck is on the side of the road. There is a red car behind the truck. The truck has a yellow license plate on the front of it. 
192.jpg,A picture of a truck that has been hit by a car. The front of the truck is black. There is a red car behind the black truck. There are white lines on the ground around the cars. 
193.jpg,The image is a video of a vehicle. The vehicle is blue in color. It has two large black tires. There is a yellow license plate on the front of the vehicle. It also has white writing on it.
194.jpg,A truck is driving down the street. There is a red container on the back of the truck. There are large black tires on the truck with a white trailer attached to it. 
195.jpg,A large truck is driving down the street. There is a red container on the side of the truck. There are large tires on the truck with silver rims. 
196.jpg,There are two large trucks driving on the street. There is a large orange cone on the ground in front of the trucks. There are trees on the side of the street next to the truck. 
197.jpg,There are several cars on the street. There is a large white truck behind the cars. There are street lights on the sidewalk next to the truck. 
198.jpg,A man and a woman are standing in front of a white table. The man is wearing a blue striped shirt and a pink tie. The woman is also wearing a pink shirt. There are tall buildings behind them. 
199.jpg,A man and a woman are standing in front of a white desk. They are both holding tablets in their hands. The man is wearing a blue striped shirt and a pink tie. The woman is also wearing a pink shirt. There is a large cityscape behind them. The sky is orange and pink. 
200.jpg,A man and a woman are standing in front of a white desk. They are both holding tablets in their hands. The man is wearing a blue striped shirt and a pink tie. The woman has a pink shirt on and is holding a red folder. There is a large cityscape behind them. The sky is orange and pink.
201.jpg,There are several people standing on a street. There is a white building behind them. There are lights on the street in front of the people.
202.jpg,There is a large white truck on the street. There is a black fence in front of the truck. There are people standing on the sidewalk next to the fence. 
203.jpg,There is a white truck behind a black fence. There are people standing in front of the truck. There is a bright light on the ground behind the fence.
204.jpg,There are several motorcycles parked in a pile. There are two men standing in front of them. They are wearing hats on their heads. There is a red pole behind them.
205.jpg,"The image is a screenshot from a video. It shows a motorcycle parked on the ground. The motorcycle is black and has white and red writing on it. There is a large tire on the front of the motorcycle. The text on the bottom of the screen says ""Mua lon o mien Trung co xu huong mo rong xuong phia Nam""."
206.jpg,There are several motorcycles parked next to each other. One of the motorcycles is red and white. There is a black helmet on the ground next to it. 
207.jpg,There are several people wearing hats. They are writing on a piece of paper. There is a man in a red jacket standing in front of them. 
208.jpg,There are several people standing in front of a truck. There is a man in a yellow vest standing next to the truck. The truck has a motorcycle in the back of it. 
209.jpg,A man and a woman are standing in front of a news desk. The desk is white and has a red logo on it. The man is wearing a blue shirt and a pink tie. He is holding a tablet in his hands. The woman is wearing pink. There is a large screen behind them. There are many tall buildings on the screen.
210.jpg,A man and a woman are standing behind a white table. They are both dressed in business attire. There is a large screen behind them with a city on it. The sky is red and orange. 
211.jpg,There are trees and bushes on the ground. There is a person walking on the sidewalk in front of the trees. The person is wearing a purple shirt and black pants. 
212.jpg,A man is walking through a forest. He is wearing a white jacket and blue pants. There are tall trees surrounding the man. There is a red arrow pointing to the left. 
213.jpg,"The image is a screenshot of a news channel. The channel is HTV7 HD and the time is 18:50:19. There is a red banner at the bottom of the screen that says ""Dong Cua Cong Vien O Rach Gia De Truy Tim Cau Song Chuong"". There are trees in the background that are blurred."
214.jpg,There are trees next to a body of water. There is a white umbrella on a stand in front of the water. 
215.jpg,A person is standing on a bridge. They are wearing a white shirt and brown pants. There are trees surrounding the bridge. There is writing on the bottom of the screen. 
216.jpg,A white bear is standing in the woods. There are trees surrounding the bear. There is a white fence in front of the bear on the ground. 
217.jpg,"A man is standing on the bank of a river. He is wearing a green cap, green jacket and black pants. A brown bag is hanging on his shoulder. A man is sitting on the back of a boat that is floating on the water. The man is holding a long stick in his hand. The water is calm and still. There are green trees in the background of the photo."
218.jpg,There is a person riding a motorcycle on the street. There is a large body of water behind the motorcycle. There are trees surrounding the water. The person is wearing a yellow shirt and a black helmet. 
219.jpg,A man in a yellow shirt is sitting on a black motorcycle. There is water in front of the man. There are trees on the other side of the water. 
220.jpg,There are people standing in the woods. They are wearing blue shirts and pants. There are trees surrounding them. There is a camera on a stand in front of them. 
221.jpg,A picture of a field of green plants. There are lots of trees surrounding the field. There is a white sky above the plants. 
222.jpg,There are several small alligators in the water. There are small waves in front of the alligators. There is a yellow leaf floating on the water next to them. 
223.jpg,There are two men standing next to a fence. There are trees behind the fence. The man in front of the fence is wearing a blue shirt. 
224.jpg,A crocodile is in the water. The crocodile has a very large eye. The eyes of the crocodile are black. The water is calm and still.
225.jpg,Two men are walking through a dense forest. One of the men is wearing a blue shirt and a blue hat. The other man has a dark shirt and pants on. There are many trees and bushes surrounding the men.
226.jpg,A man is wearing a purple hat and a striped shirt. There are trees surrounding the man. There is water in front of the trees. 
227.jpg,There is a body of water with trees surrounding it. The trees have white flowers on them. There is a small boat in the water. The water is calm and still. 
228.jpg,There are trees in the water. There are branches hanging off of the trees. The water is calm and still. There is writing on the bottom of the picture. 
229.jpg,A river is surrounded by trees. There are many branches on the trees. The water is calm and still. 
230.jpg,Two men are sitting in a canoe on the water. The canoe is brown. One of the men is wearing a green jacket and a white hat. The other man is wearing an all white shirt. The water is calm and there are small waves in it. There are tall weeds and grass next to the canoe.
231.jpg,A man is standing in front of a large screen. He is wearing a blue striped shirt and a pink tie. He has glasses on and is holding a tablet in his hands. There is a red and white sign behind the man.
232.jpg,A man is standing on a news set. He is wearing a blue striped shirt and a pink tie. He has glasses on and is holding a tablet in his hands. There is a large building behind the man. 
233.jpg,This is an aerial view of a soccer stadium. The stadium is large and has many seats. There is a large green field in the middle of the stadium. There are white lines on the field.
234.jpg,The image is a screenshot from a news channel. The channel is HTV7 HD. The time is 18:54:45. There is a large sign on the building that says MANCHESTER UNITED. The letters are red. The building is made of glass. The sky is blue and clear. There are white beams on the top of the building.
235.jpg,There is a large white airplane on the ground. There are people standing in front of the airplane. There is a red star on the tail of the plane.
236.jpg,There are several people standing in front of a red staircase. They are all wearing white robes and face masks. There is a man in a yellow vest standing next to them.
237.jpg,There are four men standing together wearing white suits. They are all wearing face masks on their faces. There is a man in a yellow vest standing next to them. There are people in front of them holding up their cell phones. 
238.jpg,Two men in suits are standing in front of a white door. There is a television on a stand in the corner of the room. A woman is standing behind the door with a camera on her shoulder. 
239.jpg,There are several men standing in front of a red sign. They are all wearing black suits and red ties. There is a large white table under them. 
240.jpg,Two men are standing in front of a large picture. The man on the left is wearing a black suit and a white shirt. He has short brown hair. He is smiling. The other man is standing next to him wearing a white jacket with a red Nike logo on it. 
241.jpg,There are two men standing next to each other. The man on the left is wearing a black suit and a white shirt. He has blonde hair and is looking down at the other man. He is also wearing a white jacket with a red Nike logo on it. There is a white wall behind them.
242.jpg,There are two men standing in front of a camera. One of the men is holding a microphone. The other man is wearing a black jacket and a hat. There is a large building behind them. 
243.jpg,There are two men sitting on a vehicle. They are both wearing suits. There is a large white building behind them. The man on the left is laughing. 
244.jpg,A man is standing on a soccer field. He is wearing a white jacket and black pants. There are several soccer balls on the field in front of him. There is a white goal post on the ground. There large signs on the side of the field. 
245.jpg,"Two men are running on a soccer field. The man on the left is wearing a black jacket with yellow stripes on the sleeves and black pants. He is running towards a white soccer ball that is in front of him. On the right is a man wearing a white hooded sweatshirt, black pants and white socks. There is a goal post on the field behind them."
246.jpg,A man is standing in front of a large screen. He is wearing a blue striped shirt and a pink tie. He has glasses on and is holding a tablet in his hands. There is a large picture on the screen behind him. 
247.jpg,A man is standing in front of a large screen. He is wearing a blue shirt and a pink tie. He has glasses on and is holding a tablet in his hands. There is a large picture on the screen behind the man. 
248.jpg,"The image is a screenshot from a video. The background is completely black. There is a bright red light in the middle of the screen. There are small white dots in the background. At the top right corner there is a logo that says ""HTV7 HD 18:55:51"". At the bottom of the image there are words that are in Vietnamese."
249.jpg,A man is standing behind a white podium. There are three flags behind the man. The man is wearing a black suit and a red tie. There is a blue screen behind him.
250.jpg,A man is standing behind a white podium. There are two white flags behind him. The man is wearing a black suit and a red tie. There is a blue wall behind the man. 
251.jpg,A man is standing behind a white podium. There are three flags behind the man. The man is wearing a suit and tie. 
252.jpg,A man is standing behind a white podium. There are three flags behind the man. The man is wearing a suit and tie. There is a blue wall behind him. 
253.jpg,There is a stage in front of a crowd. There are people standing on top of the stage. There is a purple sign on the stage with white writing on it.
254.jpg,A screenshot of a video game. There is a blue circle in the middle of the screen. There are words above the circle that say shut down. 
255.jpg,There are three men sitting in front of a computer. They are wearing headphones on their head. There is a purple light behind them. 
256.jpg,A stage is lit up with purple lights. There are people standing on top of the stage. There is a large sign on the stage that says champion.
257.jpg,"A round stage is lit up with purple lights. There are words on the stage that say ""CHAMPIONS"". There are people standing on top of the stage. "
258.jpg,A group of people are standing on a stage. They are all wearing white shirts and black pants. There are people sitting in the stands behind them. There is a purple wall behind them with writing on it.
259.jpg,A man in a blue shirt and tie is standing in front of a large screen. He is holding a tablet in his hands. There are large buildings on the screen behind him. 
260.jpg,A man and a woman are standing in front of a news desk. The desk is white and has a red logo on it. The man is wearing a blue shirt and a pink tie. The woman has a pink shirt on. There is a large screen behind them. There are buildings on the screen. 
261.jpg,There is water on the ground. There are trees next to the water. There is a blue rope hanging from a pole in front of the trees.
262.jpg,A picture of a river that has been flooded. The water is brown and muddy. There are trees on the other side of the river. There is debris on the ground next to the water. 
263.jpg,There is water on the ground. There are trees next to the water. There is writing on the bottom of the picture. 
264.jpg,A picture of a flooded area. There are trees in the water. There is a large pile of trash on the side of the river. The water is brown and muddy. 
265.jpg,The image is a video of a flooded area. The water is up to the ground. The ground is brown and muddy. There are trees in the background that are green. The time on the image is 18:58:18.
266.jpg,There are trees that have fallen down. There is water on the ground in front of the trees. The water is reflecting the trees and the ground. 
267.jpg,"The image is of a flooded area. The water is up to the knees. There are tall trees in the water. The trees are reflecting the sky and the surrounding vegetation. The image is blurred. There is a watermark in the corner that says ""TRANG PHUC: MECIA - KHATOCO"". The time is 18:58:27."
268.jpg,There are people standing in a field. There are trees behind them in the distance. The people are wearing orange vests. 
