frame,caption
001.jpg,A beautiful sunset over a city. The sky is orange and pink. There are many buildings in the city. There is a large body of water in front of the buildings. 
002.jpg,A man and a woman are standing in front of a news desk. The desk is white and has a red logo on it. The man is wearing a suit and tie and is looking down at something in his hands. The woman is also wearing a pink shirt and has her hair pulled back in a ponytail. There is a large screen behind them that shows a city skyline.
003.jpg,A man and a woman are standing in front of a large screen. They are both dressed in business attire. The woman is wearing a short sleeve pink shirt and black pants. The man has a blue shirt and a pink tie. The screen behind them shows a city with tall buildings. There is a red and white logo on the front of the screen.
004.jpg,"The image is completely black. On the right side of the image there is a red and white graphic. At the top right corner there is text that reads ""HTV7 HD 18:30:12""."
005.jpg,A picture of a flooded street at night. There is a yellow caution sign in the middle of the street. There are yellow umbrellas on the sidewalk next to the street next to a building. 
006.jpg,People are standing in a flooded area in front of a building. There is an orange life preserver on the ground in the water. A woman in a red vest is standing near the entrance of the building. 
007.jpg,There are seven men standing on a stage. They are all wearing white shirts. There are white podiums in front of them with red cups on top of them. There is a large screen behind them with writing on it.
008.jpg,There are several people standing behind white podiums. They are all wearing white shirts. There is a large screen behind them with writing on it. The screen has a red border around it. 
009.jpg,A bright white circle is on a dark gray background. There are red lines on either side of the circle. There is white writing on the bottom of the picture. 
010.jpg,There is a brown box on the ground. There is a green plastic bag under the box. There are blue and yellow boxes in the box on top of the bag.
011.jpg,A man is looking down with his eyes closed. He has short black hair. He is wearing a white shirt. There is a white wall behind him. There are red words on the image.
012.jpg,A man and a woman are standing behind a news desk. The desk is white and has a red logo on it. The man is wearing a blue suit and a pink tie. The woman is also wearing a pink shirt. There is a large screen behind them. There are many buildings and skyscrapers on the screen.
013.jpg,A man and a woman are standing behind a white desk. They are both dressed in business attire. The man is wearing a blue striped shirt and a pink tie. The woman is dressed in a pink shirt and black pants. There is a large screen behind them that shows a city with tall buildings. The sky is orange and pink.
014.jpg,A man and a woman are standing behind a white desk. The man is wearing a blue striped shirt and a pink tie. The woman is also wearing a pink shirt. There is a large cityscape behind them. 
015.jpg,This is an aerial view of a city. The city appears to be densely populated. There are many buildings clustered together. There is a large body of water in the middle of the city.
016.jpg,This is an aerial view of a city. The city appears to be densely populated. There are many buildings and houses scattered throughout the city. There is a lot of green trees in the city as well. In the background there are large mountains. The sky above the city is gray and cloudy.
017.jpg,A man is wearing a white face mask. He is wearing glasses. There is water on the ground behind him. There are trees next to the water. 
018.jpg,There is water on the ground. There are trees next to the water. There is a man standing on the side of the water with a white fence in front of him. He is wearing a black jacket and a black helmet. 
019.jpg,A small waterfall is seen on a TV screen. The water appears to be flowing over rocks. There are green plants growing on the rocks near the waterfall.
020.jpg,Two people are standing in the middle of a flooded street. There are trees surrounding the street. One of the people is wearing a white shirt and black shorts. 
021.jpg,There is a man in a white shirt standing in front of a white building. There is a motorcycle behind the man. There are trees next to the building.
022.jpg,There is water on the ground. There are people standing in the water. There is a fence on the side of the street. 
023.jpg,This is an aerial view of a city. The city appears to be densely populated. There are a few mountains in the background. The sky above the city is gray and cloudy. There is a red and white building in the middle of the city.
024.jpg,This is an aerial view of a city. The city appears to be densely populated. There are a lot of buildings and houses scattered throughout the city. Some of the buildings appear to be made of metal. There is a large body of water in the middle of the city that looks like a lake or pond. The water is brown and muddy.
025.jpg,A woman in a red shirt and black shorts is standing in front of a white gate. There is a red flag hanging from the gate. The ground is wet and there is water on the ground.
026.jpg,A flooded street is seen in a foreign country. The water is up to the street level. There is a black fence on the left side of the street. There are trees on both sides of the water.
027.jpg,This is an image of a street. The street is very wet. The water is reflecting the buildings. The sidewalk is yellow. There is a sign on the sidewalk. The sign is yellow with black letters and a black exclamation mark. There are umbrellas on the side of the sidewalk that are yellow and green. The buildings are on both sides of the street.
028.jpg,This is an image of a street. The street is flooded. The water is yellowish brown. There are people walking on the street in the rain. The people are wearing raincoats. The umbrellas are yellow and white. There is a building in the background. The building is dark gray. The trees have green leaves on them.
029.jpg,People are standing on a flooded street. There are yellow umbrellas on the side of the street. The people are wearing orange vests. 
030.jpg,There is water on the ground. There is a person wearing an orange vest standing in the water. There are yellow umbrellas next to the person.
031.jpg,There is water on the ground. There are people standing in front of a building. There is an orange raft in the water. 
032.jpg,There is a yellow boat in the water. There are yellow umbrellas above the boat. There is a man in a blue jacket sitting on top of the yellow boat. 
033.jpg,A woman is standing in front of a city skyline. She is wearing a short sleeve pink shirt. The sky behind her is orange and red. There are tall buildings all around her. 
034.jpg,A woman is standing in front of a cityscape. She is wearing a short sleeve pink shirt. The woman has long dark hair and is wearing earrings. There is a red phone in her hand. 
035.jpg,A woman is standing in front of a city skyline. She is wearing a short sleeve pink shirt. She has earrings in her ears and is holding a red folder in her hand. The sky behind her is orange and red. There are tall buildings all around her.
036.jpg,There is a large blue screen behind a table. There are people sitting in chairs in front of the screen. There is a man standing behind a red podium. 
037.jpg,A man is standing behind a podium. There are microphones in front of the man. He is wearing a white collared shirt and glasses. There is a blue screen behind him. 
038.jpg,A group of men are standing in front of a large map. They are all wearing white shirts. One of the men is holding a camera. The map is on a white wall. 
039.jpg,There are several men standing in a line. They are all wearing white collared shirts. There is a blue lanyard around their necks. The man in the front has glasses on and is wearing a white shirt. 
040.jpg,A map of a city is shown. There are several blue signs on the map with white writing on them. There is a red line going through the center of the map.
041.jpg,This is an aerial view of a rural area. There is a long white line running through the center of the image. There are several buildings and trees surrounding the area. 
042.jpg,A map of a city is shown on a TV screen. The map is green and has several roads marked on it. There are several red markers on the map. There is a red logo on the top right corner of the screen.
043.jpg,A bridge is seen in a foreign language. The sky is blue and there are a lot of clouds. The bridge appears to be very long.
044.jpg,The image is a screenshot from a video game. The background is green and there is a bridge in the middle of the screen. The bridge is brown and white. There are a few cars on the bridge. The text on the screen is in Vietnamese.
045.jpg,A large group of people are sitting at long tables. The tables have blue tablecloths on them. There is a white and blue tent above the tables. There are yellow construction vehicles behind the people. 
046.jpg,Many people are sitting in a row. They are all clapping their hands together. They all have white shirts on and some have blue lanyards around their necks. There are white and blue chairs in front of them. There is a woman in a purple shirt sitting next to a man. 
047.jpg,Five men are standing behind white podiums. They are all wearing white collared shirts. Each of the men has a red cup in front of them. There is a large bridge behind the men. 
048.jpg,There are several people standing in front of white podiums. They are all wearing white shirts. There is a large screen behind them with writing on it. 
049.jpg,There are several yellow construction vehicles on the ground. There is a blue sign on the front of one of the vehicles. There are people standing in front of the trucks. 
050.jpg,A picture of a yellow and black construction vehicle. There is a large bucket in front of the vehicle. The bucket is filled with dirt. There are tracks on the bottom of the vehicles. 
051.jpg,There are several large yellow construction vehicles. There is a man standing in front of one of the trucks. There are palm trees behind the vehicles. 
052.jpg,A man and a woman are standing in front of a white table. The man is wearing a blue striped shirt and a pink tie. The woman has a pink shirt on and is holding a red book. There is a large cityscape behind them. 
053.jpg,A man and a woman are standing in front of a white table. The man is wearing a blue striped shirt and a pink tie. The woman is also wearing a pink shirt and holding a red purse. There is a large cityscape behind them. The sky is orange and pink.
054.jpg,A man and a woman are standing in front of a white table. They are both dressed in business attire. The man is wearing a blue striped shirt with a pink tie and black pants. The woman has a pink shirt on and has black hair. There is a large cityscape behind them. The sky is orange and pink.
055.jpg,A man and a woman are standing in front of a white table. The man is wearing a blue shirt and a pink tie. The woman is also wearing a pink shirt. There are buildings and trees behind them. 
056.jpg,There are several people standing on a stage. They are wearing pink shirts and black pants. There is a large white building behind them. There are stairs leading up to the building.
057.jpg,There are people dancing on the street. They are wearing pink shirts and black pants. There are trees lining the street in front of them. There is a tall building in the distance. 
058.jpg,There are several people standing in a street. They are wearing pink shirts and black pants. There is a large white building behind them. There are trees in front of the building.
059.jpg,There are several people dancing on the street. They are wearing pink shirts and black pants. There are tall buildings next to them. 
060.jpg,There are several women wearing pink shirts and black pants. They are standing in a line on the street. There is a large building behind them. There are trees next to the building. 
061.jpg,A woman in a white polo shirt is standing on the street. There are several buses and cars behind her. There is a white building behind the woman. 
062.jpg,There are several women dancing on the street. They are wearing pink shirts and black pants. There are tall buildings behind them. There is a white sign on the side of one of the buildings. 
063.jpg,There are several women wearing pink shirts and black pants. They are dancing in the street. There is a large building behind them. There are trees in front of the building. 
064.jpg,A woman is standing on the street. She is wearing a white polo shirt. There is a bus and a car on the road behind her. There are tall buildings on the side of the road. 
065.jpg,There are people wearing pink shirts and black pants. They are walking down the street. There are tall buildings behind them. There is a red sign hanging from the building. 
066.jpg,There are several women wearing pink shirts and black pants. They are standing in a line with their arms up. There is a large building behind them. There are trees next to the building. 
067.jpg,A large group of women are marching down a street. They are all wearing pink shirts and black pants. There is a large white building on the side of the street. Tall green trees are standing on the sidewalk next to the building. Tall buildings can be seen behind the trees. 
068.jpg,A large group of women are marching down a street. They are all wearing pink shirts and black pants. There are tall buildings on either side of the street. Tall green trees are standing on the sidewalk in front of the buildings. 
069.jpg,There are several women wearing pink shirts and black pants. They are dancing in the street. There is a large brown building behind them. There are trees in front of the building.
070.jpg,A large group of women are posing for a photo in front of a large white building. All of the women are wearing pink shirts and black pants. There is a large blue and white sign hanging from the building. 
071.jpg,A man is standing in front of a city skyline. He is wearing a striped blue shirt and a pink tie. He has black glasses on and has short black hair. The sky behind him is orange and pink. There are tall buildings in the skyline. 
072.jpg,There is a black sign with white writing on it. There is a white and red traffic cone behind the sign. There are motorcycles parked on the street behind them.
073.jpg,There are several people standing in front of a yellow sign. There is a man wearing a yellow vest and a helmet on his head. He is talking on a cell phone. 
074.jpg,A man in a brown shirt is holding a microphone. There are people standing behind him wearing yellow vests. There is a red and white cone on the ground. 
075.jpg,A man is wearing a red hat and a gray shirt. There is a large green plant behind the man. There are tables and chairs in front of them. 
076.jpg,There are several people standing on the street. There is a white car on the road in front of them. There are several buildings behind the car. They are all wearing helmets and face masks.
077.jpg,There are several people standing on the street. They are all wearing face masks. There is a man in a yellow vest standing in front of them. 
078.jpg,There are several motorcycles parked on the street. There are people standing in front of the motorcycles. They are all wearing face masks. There is a white car next to them. 
079.jpg,There are two people wearing a white face mask. They are wearing a yellow helmet. There is a large building behind them. There are lights on in front of the building.
080.jpg,There are several people standing in front of a building. They are all wearing helmets on their heads. There is a man in a yellow vest standing next to them. 
081.jpg,A person is holding a smart phone. They are touching the screen of the phone. There is a pattern on the wall behind the person. 
082.jpg,A police officer in a white shirt and a yellow vest is writing on a piece of paper. He is wearing a white helmet. There are several people standing around him. There is a red and white pole in front of him. 
083.jpg,A man in a uniform is standing in front of a bush. He is wearing a red and gold hat. There is a white building behind him. 
084.jpg,There are people standing on a street. They are wearing white masks on their faces. There is a yellow vest on one of the people. 
085.jpg,Two men are standing on a street at night. They are both wearing helmets on their heads. One of the men is wearing a black shirt and the other one is wearing an orange shirt. There are several vehicles on the street in front of them. A large white truck is parked on the side of the street. The headlights of the vehicles are on.
086.jpg,A man and a woman are standing behind a white desk. They are both dressed in business attire. The man is wearing a blue striped shirt and a pink tie. He is holding a tablet in his left hand. The woman is also wearing a short sleeve pink shirt. She has short black hair. There is a large cityscape behind them.
087.jpg,A man and a woman are standing in front of a white table. They are both dressed in business attire. The man is wearing a blue striped shirt with a pink tie and black pants. The woman is dressed in a pink shirt and has long black hair. She is holding a red folder in her hand. There is a large cityscape behind them. The sky is orange and pink.
088.jpg,A man and a woman are standing in front of a white table. They are both dressed in business attire. The man is wearing a blue striped shirt and a pink tie. The woman has a pink shirt on and is holding a red folder. There is a large cityscape behind them. 
089.jpg,A man and a woman are standing in front of a white table. The man is wearing a blue striped shirt and a pink tie. The woman is also wearing a pink shirt. There is a large cityscape behind them. 
090.jpg,A man is sitting on a black couch. He is wearing a white shirt and glasses. There is a white table in front of him with a cup on top of it. A large t.v. is sitting in a white entertainment center. There are beige curtains on the window behind the man.
091.jpg,A man is sitting in front of a television. He is wearing a white collared shirt and glasses. The television is turned on and is sitting on top of a white counter. There is a bookshelf behind the man with books on it. 
092.jpg,There are two people sitting on a small boat in the water. There are trees on the other side of the boat. The sky is blue and there are clouds in the sky. 
093.jpg,There are two people standing under a thatched roof. There are trees behind them. There is a man in a white shirt walking on the ground. 
094.jpg,There is a man sitting on a bed. There is a white curtain hanging over the bed. The man is wearing a white shirt and black pants. 
095.jpg,A man is looking at the camera with a serious expression on his face. He has dark hair and a mustache. He is wearing a gray shirt. Behind him is a lamp.
096.jpg,There are four people standing outside of a house. There is a man in a blue shirt carrying a large brown bag on his shoulder. There are trees and bushes in front of the house. 
097.jpg,A man is wearing a white shirt. He is holding a small black object in his hand. There are trees behind the man. The man has dark colored hair. 
098.jpg,A woman is shown in a scene from a TV show. She is wearing a blue blouse and has earrings in her ears. Her hair is pulled back and she is looking off to the side. There is a white curtain behind her.
099.jpg,A man is standing outside in a forest. He is wearing a long sleeve shirt and pants. There are large trees surrounding the man. The ground under the man is covered in grass. 
100.jpg,A man is crouched down in a field of tall grass. He is wearing a yellow jacket and a face mask. The grass is green and there are raindrops falling from the sky. There is a red and white logo on the top right of the image.
101.jpg,There is a large television on a stand. There are shelves behind the television on the wall. There is books and other items on the shelves. 
102.jpg,A man is sitting in a chair. He is wearing a white collared shirt and black glasses. There is a large white curtain behind him. The wall behind him is white. 
103.jpg,Four people are sitting around a table. There is a white table in front of them. There are plates and cups on top of the table. 
104.jpg,A woman is shown in a scene from a TV show. She is wearing a white shirt and has earrings in her ears. Her hair is pulled back and she has a serious look on her face. There is a window behind her with a blue wall.
105.jpg,A woman is sitting outside on a chair. She is wearing a sleeveless shirt and blue pants. The woman is wearing glasses on her face. She has earphones in her ears. A small black table is sitting in front of her. A silver laptop is sitting on top of the table. A plant with green leaves and purple flowers is sitting beside the woman. Part of a wall can be seen behind the plant.
106.jpg,The image is a graphic design. The background is red and white. There are dots on the red background. The lines are white and black. The design is made up of blocks. The blocks are red and silver. The letters on the blocks are also red. There is a small logo in the top right corner of the image.
107.jpg,There are cars driving on the street. There are tall buildings on the side of the street next to the cars. There is a white truck in front of the white car. 
108.jpg,There are three people standing on the street. There is a white building behind them with graffiti on it. There are people walking on the sidewalk in front of the building. 
109.jpg,A woman is standing in a room with white walls. She is wearing a black jacket and black pants. There are two white robotic arms in front of the woman. There is a white table in the room with black writing on it. 
110.jpg,A man in a black suit is standing in front of two white robots. The man is holding a long stick in his hand. There is a white wall behind the man. 
111.jpg,A person is drawing on a white paper. They are holding a red tool in their hand. There is a red banner in front of the paper. 
112.jpg,A man and a woman are standing in front of a desk. The desk is white and has a red logo on it. There is a large screen behind them. There are buildings on the screen. 
113.jpg,"A man and a woman are standing behind a white table. They are both dressed in business attire. The man is wearing a blue shirt, pink tie and black pants. The woman has a pink shirt on and is wearing black heels. There is a large screen behind them that shows a city with tall buildings and a red sky."
114.jpg,A man and a woman are standing in front of a large screen. They are both dressed in business attire. The woman is wearing a pink shirt and black pants. The man is wearing glasses and a blue shirt and pink tie. There is a large cityscape on the screen behind them.
115.jpg,There are two trucks driving down the street. There are tall buildings on the side of the street next to the trucks. There is a white van on the street in front of the truck. 
116.jpg,There is a white truck on the street. There are people sitting in the back of the truck. There is a black car on the road in front of it. 
117.jpg,People are walking down a street in a foreign country. There is a large white truck parked on the side of the street. There are tall buildings on both sides of the road. The sky above the people is blue.
118.jpg,People are walking down a street. There is a white building with graffiti on the side of it. There are trees on the other side of the street. 
119.jpg,There is a white car parked on the street. There is a pile of rubble in front of the car. There are several buildings behind the cars. 
120.jpg,There is a man pushing a woman in a wheelchair. There is a large building behind them. There are other people walking around them. 
121.jpg,There are several people standing outside of a building. There are clothes hanging on a line in front of the people. There is a motorcycle next to the clothes. 
122.jpg,There is a woman wearing a black robe and a headscarf. She is standing in front of a silver pot. There are people standing behind her. There is a tree next to the woman. 
123.jpg,There are several people standing in a crowd. There is a man in a white shirt and blue jeans standing in front of them. There are several other people standing around them.
124.jpg,A crowd of people are standing around a pile of rubble. There is a man wearing a white shirt and an orange vest. There are trees behind the crowd. 
125.jpg,There are several people standing in a room. There is a large rock wall behind them. There are several men with gray hair standing in front of them.
126.jpg,There are people standing in front of a pile of rubble. There is a yellow construction vehicle next to the pile. There are clouds in the sky above them.
127.jpg,A woman is standing in a news studio. She is wearing a short sleeve shirt and a gray skirt. There is a large screen behind her that shows a city skyline. 
128.jpg,"There are two people standing in front of a black umbrella. There is a yellow, blue and red flag on a stand next to them. There are mountains in the distance behind them. "
129.jpg,A bright white circle is on a black background. There is red writing on the bottom of the picture. The writing is in a foreign language.
130.jpg,There are several people standing in front of a building. There is a man in a gray shirt with a yellow circle on the front of it. There are several other people sitting in chairs behind them. 
131.jpg,"A bright white circle is glowing in the dark. The background is completely black. At the top right corner of the image there is a watermark that reads ""HTV7 HD 18:40:31"". At the bottom of the screen there is some foreign writing."
