frame,caption
135.jpg,There are several people standing in front of a white building. There is a red and white barricade in the front of the building. All of the people are wearing hats and masks on their faces. 
136.jpg,There are several trucks lined up in a parking lot. There is a green building behind the trucks. There are trees on the hill behind the building. A person is standing in front of the trucks wearing a black jacket and blue pants.
137.jpg,The image is a picture of a building. The building is white. There is a mountain in the background. The mountain is covered with trees. The sky is white and cloudy. There are lights hanging from the ceiling of the building.
138.jpg,The image is a picture of a building. The building is white. There is a mountain in the background. The mountain has green trees on it. The sky is white and cloudy. There are lights hanging from the ceiling of the building. There's a man in the bottom left of the picture wearing a baseball cap. The man is standing in front of a large white building.
139.jpg,There are several trucks lined up in a row. There are trees behind the trucks. There is a man standing in front of one of the truck. 
140.jpg,There are several trucks lined up in a row. There are trees behind the trucks. There is a black truck in front of the red truck. 
141.jpg,There are several trucks lined up in a parking lot. There is a green building behind the trucks. There are trees on the hill behind the building. 
142.jpg,There are several trucks lined up in a parking lot. There is a green building behind the trucks. There are trees on the hill behind the building. 
143.jpg,"The image is a photo of a building. The photo is taken from the ground up. There is a white truck parked on the right side of the photo. The truck has the letters ""CMC"" on the side of it. The building has a large entry way that is made up of white pillars. There are lights hanging from the ceiling of the entry way."
144.jpg,The image is a screenshot from a news channel. It is a foreign language. There are two men standing on the left side of the image. The men are wearing dark colored clothing. There is a large building on the right side. The building has a large white archway in front of it. The archway is supported by four white pillars. The road is in the middle of the road.
145.jpg,There are several trucks lined up in a row. There are trees behind the trucks. There is a man standing in front of one of the truck. 
146.jpg,A man and a woman are standing in front of a large screen. The man is wearing a white collared shirt and a black tie. He is holding a red object in his hands. The woman is dressed in a blue dress and high heels. The screen behind them has a city scene on it. There are clouds in the sky.
147.jpg,A woman in a blue dress is standing in front of a large screen. There is a picture on the screen next to her. There are buildings on the ground behind her. 
148.jpg,A woman is standing on a news set. She is wearing a short blue dress and white heels. There is a large screen behind her with a picture of a city on it. 
149.jpg,There are several small boats in the water. There are mountains in the distance behind the boats. The boats are green and blue in color. 
150.jpg,A man is bending over in the water. He is wearing shorts. There is a boat in front of the man. The boat is blue and gray. The water is wet. 
151.jpg,A man is pushing a boat. The boat is blue and brown. The man is wearing a blue shirt and shorts. There is another boat behind the blue boat. 
152.jpg,"A man is bending over a blue and brown boat on the beach. He is wearing a blue shirt, shorts and a hat. There is another boat in front of the man. "
153.jpg,There are several boats on the beach. There are people standing next to the boats. There is a large mountain behind the boats in the distance. 
154.jpg,There is a blue boat on the water. There is a person wearing a blue shirt and a black hat. They are holding a long wooden stick. In front of the person is a white bowl with something in it. 
155.jpg,A man is standing inside of a blue boat. He is wearing a black hat and a blue shirt. There is a white bowl on the ground in front of the man. A long stick is leaning against the side of the boat. 
156.jpg,A man is holding a shrimp in his hands. He is wearing a blue long sleeve shirt. There is a blue pole in front of the man. There are wires hanging from the pole. 
157.jpg,A white bucket is sitting on a wooden table. There is something inside of the bucket. There are words written on the bottom of the picture. 
158.jpg,A white bucket is sitting on top of a wooden table. There are leaves in the bucket. There is dirt on the top of the bowl. 
159.jpg,There are several boats in the water. There is a hill behind the boats with trees on it. There are people standing in front of the boats.
160.jpg,There are several boats in the water. There is a hill behind the boats with trees on it. There are people standing in front of the boats.
161.jpg,There is a white bucket sitting on top of a green net. There is a wooden bench next to the bucket. A person is standing in front of the net. 
162.jpg,A white bucket is sitting on top of a green net. There is a person wearing a blue shirt. There are wires coming out of the white bucket. 
163.jpg,A white bucket is sitting on the ground. There is a green net in front of the bucket. There are wires coming out of the net. 
164.jpg,There are three baskets on the ground. There is a yellow basket in front of the person. The person is holding a white object in their hand. 
165.jpg,A person is bending over a yellow basket. There are other baskets on the ground next to the basket. The person is wearing a gray shirt. 
166.jpg,There is a yellow basket on the ground. There are shrimp inside of the basket. There is a watermark on the top right corner of the image.
167.jpg,There are several baskets on the ground. There is a person holding a silver bowl in one of the baskets. The other baskets are yellow and red. 
168.jpg,There are several baskets on the ground. There is a person standing in one of the baskets. The basket on the left is yellow and has small white objects in it. The person is holding a silver bowl in their hand. 
169.jpg,A person is holding something in their hand. There is a silver bowl on top of a blue and green basket. The person is wearing a red shirt. 
170.jpg,There are several baskets on the ground. There is a blue basket with a silver bowl in it. There are white shrimp inside of the bowl. 
171.jpg,A man is standing in front of a microphone. He is wearing a white collared shirt. The man has short gray hair. There is a large window behind the man. 
172.jpg,A man is standing in front of a microphone. He is wearing a white collared shirt. He has short gray hair. There is a large window behind him. 
173.jpg,A man is standing in front of a white wall with small holes on it. He is wearing a white collared shirt. The man has gray hair and is looking off to the side. There is red writing on the bottom of the image.
174.jpg,A man in a green uniform is standing in front of a table. He is holding a piece of paper and a pen in his hands. There is another man standing next to him in a white shirt. There are papers on top of the table. 
175.jpg,A man is standing in front of a window. He is wearing a white collared shirt. The window has white bars on it. There is a white wall behind the man. 
176.jpg,"The image is a graphic design. The background is red and white. The design is made up of squares. The squares are arranged in a diagonal pattern. The lines are white. In the center of the design is the number 60. The number 60 is outlined in silver. There is a red circle in the center with the word ""giay"" written inside of it."
177.jpg,A man is wearing a white shirt and a black tie. He is holding a small tablet in his hands. There are tall buildings behind the man. There is a cloudy sky above the buildings.
178.jpg,A man is wearing a white shirt and a black tie. He is holding a red wallet in his hands. There are tall buildings behind the man. There is a cloudy sky above the buildings.
179.jpg,A man is wearing a white shirt and a black tie. He has glasses on and has short black hair. There are tall buildings behind the man. 
180.jpg,A man is wearing a white shirt and a black tie. He is wearing glasses and has short black hair. There are tall buildings behind the man. 
181.jpg,A man is standing in front of a microphone. He is wearing a white collared shirt. The man has short gray hair. There is a large window behind the man. 
182.jpg,A man is standing in front of a microphone. He is wearing a white collared shirt. The man has short gray hair. There is a large window behind the man. 
183.jpg,A man is standing in front of a microphone. He is wearing a white collared shirt. The man has short gray hair. There is a large window behind the man. 
184.jpg,A man is standing in front of a white wall. He is wearing a white collared shirt. There is a large hole on the wall behind the man. The man has short gray hair. 
185.jpg,"A man is standing in front of a white wall with holes on it. He is wearing a white collared shirt. The man has gray hair and is looking directly at the camera. There is a watermark in the top right corner of the image that reads ""HTV HD 06:39:17""."
186.jpg,A man is standing in front of a microphone. He is wearing a white collared shirt. The man has short gray hair. There is a large window behind the man. 
187.jpg,A man is standing in front of a microphone. He is wearing a white collared shirt. The man has short gray hair. There is a large window behind the man. 
188.jpg,A man is standing in front of a microphone. He is wearing a white collared shirt. The man has short gray hair. There is a large window behind the man. 
189.jpg,A man is standing in front of a microphone. He is wearing a white collared shirt. He has short gray hair. There is a large window behind him. 
190.jpg,A man is standing in front of a white wall. He is wearing a white collared shirt. There is a large hole on the wall behind the man. The man has short gray hair. 
191.jpg,A man is standing in front of a white wall with holes on it. He is wearing a white collared shirt. The man has gray hair and is looking directly at the camera. 
192.jpg,A woman is standing in front of a screen. She is wearing a short blue dress. She has short black hair and is holding a book in her hands. There is a large picture on the screen behind the woman. 
193.jpg,A woman is standing in front of a screen. She is wearing a blue dress and holding a tablet in her hand. There is a large picture on the screen behind the woman. There are many buildings on the ground behind her. 
194.jpg,A woman is standing in front of a screen. She is wearing a blue dress and holding a tablet in her hands. There is a large picture on the screen behind her. 
195.jpg,A man in a green uniform is standing in front of a table. He is holding a piece of paper and a pen in his hands. Another man is standing next to him wearing a white button down shirt. There is a large window behind them with green curtains on it. 
196.jpg,A person is holding a piece of paper. The paper is white and has black writing on it. There is a brown table under the paper.
197.jpg,A man is sitting in front of a window. He is wearing a white collared shirt. There is a large window behind the man. The window has white blinds on it. 
198.jpg,A man is standing in front of a window. He is wearing a white collared shirt. There is a large window behind the man. The window has white bars on it. 
199.jpg,There are three people sitting around a table. There is a man in a white shirt standing in front of them. There are windows on the wall behind them. 
200.jpg,There are three people sitting around a table. There is a man in a white shirt standing in front of them. There are windows on the wall behind them. 
201.jpg,There are four people sitting around a large wooden table. There is a man in a green shirt standing behind the table. He is holding a piece of paper in his hands. There are yellow flowers on the table in front of him. 
202.jpg,There are two men sitting at a green table. There is a black laptop on the table in front of them. The man on the left is wearing a green uniform. 
203.jpg,A man in a green shirt is sitting at a green table. There is a black laptop on the table in front of him. There are windows behind the man. 
204.jpg,A man in a green shirt is sitting in a chair in front of a green table. There is a black laptop on the table. The man is wearing a watch on his wrist. 
205.jpg,A man is sitting in a room. He is wearing a white collared shirt and a black lanyard around his neck. There is a green table behind him with a black computer on it. The walls of the room are white. A window can be seen behind the man.
206.jpg,A man is sitting in a room. He is wearing a white collared shirt and a black lanyard around his neck. There is a green table behind him with a black computer on it. The walls of the room are white. A large window can be seen behind the man.
207.jpg,A man in a green shirt is sitting at a glass table. There is a black laptop on the table in front of him. There are lockers behind the man. 
208.jpg,A man in a green shirt is sitting at a glass table. There is a black laptop on the table in front of him. There are lockers behind the man. 
209.jpg,There are two men sitting at a table. There is a black laptop on the table in front of them. The man on the left is wearing a green shirt and has a red patch on his sleeve. 
210.jpg,There are two men sitting at a table. There is a black laptop on the table in front of them. The man on the left is wearing a green shirt. 
211.jpg,There is a white car parked on the street. There are lights on top of the car. There is a man in a plaid shirt walking in front of them. 
212.jpg,There is a white car parked on the street. There are red lights on top of the car. There is a man in a plaid shirt standing in front of them. 
213.jpg,A man is wearing a white shirt and a black tie. He is wearing glasses and has short black hair. There are tall buildings behind the man. 
214.jpg,A man is wearing a white shirt and a black tie. He is wearing glasses and has short black hair. There are tall buildings behind the man. 
215.jpg,A man is wearing a white shirt and a black tie. He has glasses on and has short black hair. There are tall buildings behind the man. 
216.jpg,There are several motorcycles parked on the side of the street. There are trees next to the street with leaves on the ground. There is a man in a white shirt standing in front of the motorcycles. 
217.jpg,A beautiful view of a lake is shown on a TV screen. The water is very calm and still. There are a lot of trees on the other side of the lake. The sky is very cloudy and blue.
218.jpg,There is a large body of water. There are trees on the other side of the water. The water is reflecting the trees on it. There is a red and white logo on the top right corner of the screen.
219.jpg,There are several people standing in a wooded area. There is a red and white pole in front of them. There are trees surrounding the people. 
220.jpg,There are several motorcycles lined up on the street. There are trees next to the street with leaves on the ground. There is a man in a black shirt standing next to one of the motorcycles. 
221.jpg,There are several cars on the street. There is a white van with red lights on the top of it. There are trees next to the street behind the cars.
222.jpg,There is a pair of blue jeans and a black shirt laying on the ground. There are two blue shoes next to the jeans. There is grass and leaves around them.
223.jpg,There are people standing in front of a lake. There are trees surrounding the people. There is water in the lake. 
224.jpg,There are several people standing in front of a lake. There are trees surrounding the people. There is water in the lake. 
225.jpg,There are people standing in the woods. There are trees and bushes around them. There is a white fence in front of them. 
226.jpg,There are several people standing in the woods. There are trees and bushes around them. There is a white fence in front of them. 
227.jpg,A man is wearing a white shirt and a black tie. He is holding a red object in his hands. There are tall buildings behind the man. There is a cloudy sky above the buildings.
228.jpg,A man is wearing a white shirt and a black tie. He is holding a tablet in his hands. There are tall buildings behind the man. There is a cloudy sky above the buildings.
229.jpg,A man is wearing a white shirt and a black tie. He is wearing glasses and has short black hair. There are tall buildings behind the man. 
230.jpg,A man is wearing a white shirt and a black tie. He is wearing glasses and has short black hair. There are tall buildings behind the man. 
231.jpg,There is a truck driving on the street. There is a large orange cone on the side of the truck. The truck has a white trailer on the back of it. There are clouds in the sky.
232.jpg,There is a large white truck on the street. There is a man in a red shirt standing next to the truck. There are men in orange vests standing behind a fence. 
233.jpg,There is a car that has crashed on the side of the road. There are two men standing next to the car. One of the men is wearing a yellow vest and a red helmet. There is a large truck behind them. 
234.jpg,A car that has crashed into a wall. The car is black. There is a white license plate on the back of the car. 
235.jpg,A car that has crashed is sitting on the side of the road. There is a man in a white shirt kneeling down next to the car. There are workers standing behind the car wearing hard hats. 
236.jpg,There is a large truck driving on the street. There is a small white car behind the large truck. There are orange cones on the side of the street next to the truck. 
237.jpg,There is a large truck driving on the street. There is an orange cone on the ground in front of the truck. There are trees on the side of the street next to the truck and a white van. 
238.jpg,There is a black car parked on the street. There is an orange cone on the ground next to the car. The street has white writing on it in the middle of it. There are white lines painted on the pavement.
239.jpg,There is a large red truck on the street. There is a man in a blue shirt standing next to the truck. There are yellow signs on the side of the trucks. 
240.jpg,A large yellow truck is driving on the street. There are orange cones on the ground in front of the truck. There is a white car behind the truck and a black car behind it. 
241.jpg,A large yellow truck is driving on the street. There are orange cones on the ground around the truck. There is a black car on the other side of the truck in traffic. 
242.jpg,The truck is yellow. The truck has two big wheels on it. The wheels are black. There is a red container on the back of the truck. The ground under the truck is gray.
243.jpg,A car that has crashed into the side of the road. The front part of the car is completely smashed in. There is a white plastic bag on top of the back seat. The car is silver. The side door is open and the window is partly open. The tire is black and the rims are silver. There are small pieces of trash on the ground around the car.
244.jpg,There is a large truck on the road. There are two men standing in front of the truck. There is a white car on the side of the road next to them. 
245.jpg,A news anchor is standing in front of a city skyline. She is wearing a short blue dress with a microphone attached to her shirt. She has short black hair and is holding a book in her hands. There is a large screen behind her with a cityscape on it. 
246.jpg,A news anchor is standing in front of a city skyline. She is wearing a short blue dress with a microphone attached to her shirt. She has short black hair and is holding a folder in her hands. Next to her is a picture of the city skyline with a large red and yellow logo on it.
247.jpg,A woman is standing in front of a screen. She is wearing a blue dress and holding a tablet in her hands. There is a large picture on the screen behind her. There are many buildings on the ground behind the woman. 
248.jpg,There is a black truck parked in front of a building. There is a motorcycle parked next to the truck. There are people sitting at a table in a room behind the motorcycle. 
249.jpg,There is a black van parked in front of a building. There is a motorcycle next to the van. There are people sitting around a small table in the room. 
250.jpg,There is a black truck parked in front of a building. There is a motorcycle next to the truck. There are two men bending over a table next to them. 
251.jpg,A man is standing inside of a building. He is wearing a black cap and a red and white jacket. There are blue cylinders behind him. There is a white door on the wall. 
252.jpg,A man is standing inside of a building. He is wearing a brown jacket and black pants. There are large blue cylinders behind him. There is a white door on the wall behind the cylinders.
253.jpg,There are several blue cylinders lined up against a wall. There is a ladder in front of them with a large blue cylinder on top of it. 
254.jpg,There is a window on the right side of the image. The window is made up of small square tiles. There is a pile of plastic bags in front of the window. The plastic bags are blue in color.
255.jpg,There is a window on the right side of the image. The window is made of glass. The glass is white. There is a plastic bag on the floor in front of the window. The plastic bags are blue in color. There are bubbles on the wall. The bubbles are reflecting light. The wall is made up of small square tiles. The light is reflecting on the glass.
256.jpg,There are several blue cylinders in a room. There is a white door on the wall behind the cylinders. There are shoes on the floor in front of them. 
257.jpg,The image is a still from a video. It appears to be taken in a factory or a warehouse. There are stacks of tires in the background. The tires are white in color and appear to be stacked on top of each other. There is a large window in the front of the image. The floor in the room looks to be made of concrete. The lighting in the image is very dim.
258.jpg,There are several blue bottles in a room. There are windows on the wall behind them. There is a white door in front of them. 
259.jpg,There are blue dumbbells in a room. There is a white wall behind them. There are windows on the wall behind the dumbbelles. 
260.jpg,There are several blue cylinders in a room. There is a ladder in front of them with a large blue cylinder on top of it. Next to the cylinder on the wall is a white door. 
261.jpg,A man is standing in a room. There are large blue cylinders behind him. There is a white door on the wall behind the cylinders. The man is wearing a brown vest and black shorts. 
262.jpg,There are several blue cylinders in a room. There is a ladder in front of the cylinders. There are white doors on the wall behind them. 
263.jpg,There are several blue cylinders in a room. There is a ladder in front of them with a large blue cylinder on top of it. Next to the cylinder on the wall is a white cabinet. 
264.jpg,There is a large window on the wall. There are bubbles in front of the window. There is writing on the bottom of the picture. 
265.jpg,There is a window on the right side of this image. The window has white blinds on it. There is a pile of garbage on the floor in front of the window. The garbage is covered with a plastic bag. There are blue circles on the wall. The walls of the room are made of glass. The room is dark blue in color.
266.jpg,A man is standing in front of a cityscape. He is wearing a white collared shirt and a black tie. He has glasses on and is holding a red wallet in his hands. The sky behind him is orange and yellow. There are tall buildings all around him.
267.jpg,A man is standing in front of a large cityscape. He is wearing a white collared shirt and a black tie. He has glasses on and is holding a clipboard in his hands. The sky behind him is orange and yellow. There are tall buildings all around him.
268.jpg,A man is standing in front of a white table. He is wearing a white shirt and a black tie. There are tall buildings behind the man. There is clouds in the sky above the buildings.
269.jpg,There are people sitting around a table. There is a white table in front of them. There are windows on the wall behind them. The people are sitting in chairs around the table. 
270.jpg,There are people sitting around a table. There is a large white table in front of them. There are windows on the wall behind them. The people are wearing green shirts. 
271.jpg,There are four people sitting around a table. There is a white board on the wall behind them. The woman is wearing a white jacket and has her hand on her chin. 
272.jpg,There are two people sitting at a table. There is a white board on the wall behind them. The woman is wearing a white jacket and has her eyes closed. 
273.jpg,Two men and a woman are sitting at a table. They are wearing green uniforms. The man on the right is writing on a piece of paper with a blue pen. The woman is looking at him. There is a black purse on the table in front of them. 
274.jpg,There is a black purse on the table. There are several bills on top of the purse. There is a person writing on a piece of paper. 
275.jpg,There is a black purse on the table. There are several bills on top of the purse. There is a pen next to the bills. 
276.jpg,There are two men sitting at a table. They are both wearing green uniforms. The man on the right is writing something on a piece of paper. There is a window behind them. 
277.jpg,There are four people sitting at a table. There is a blue wall behind them. There are two windows on the wall. The woman is wearing a white jacket. 
