frame,caption
001.jpg,A beautiful sunset over a city. The sky is orange and pink. There are many buildings in the city. There is a large body of water in front of the buildings. 
002.jpg,A man and a woman are standing in front of a TV set. They are both dressed in business attire. The man is wearing a red shirt and the woman is a light blue shirt. There is a large screen behind them that shows a city skyline. The floor of the set is gray. There are lights on the ceiling above the set.
003.jpg,A man and a woman are standing behind a news desk. The desk is white and has a red logo on it. There is a large screen behind them. There are buildings on the screen. 
004.jpg,A man and a woman are standing in front of a desk. The desk is white and has a red logo on it. The man is wearing a purple shirt and tie. The woman is wearing earphones on her ears. There is a large screen behind them. There are buildings on the screen. 
005.jpg,"The image is completely black. On the right side of the image there is a red and white graphic. The graphic has small white dots on it. The top right corner has the letters ""HTV9 HD"" in red. The bottom left corner has a red line. The time is 06:30:52."
006.jpg,There are people riding motorcycles on the street. There is a white building behind them. There are people standing on the sidewalk in front of the building. 
007.jpg,There are several people standing in a field. There are trees behind them. There is a man in a black shirt standing in front of a motorcycle.
008.jpg,Four men are standing in front of a green curtain. They are all wearing green uniforms and hats. There are two pictures hanging on the wall behind them. There is a podium in between them. 
009.jpg,A red and white graphic is shown. There is a large red diagonal stripe on the right side of the image. There are dots on the left side of an image. The dots are small and white.
010.jpg,A man and a woman are standing in front of a large screen. They are both dressed in business attire. The man is wearing a purple shirt with a pink tie and black pants. He is holding a red object in his hands. The woman is also wearing a short sleeve shirt and brown bottoms. She has short dark hair. The screen behind them has a cityscape on it.
011.jpg,A man and a woman are standing in front of a large screen. They are both dressed in business attire. The man is wearing a purple shirt with a pink tie and black pants. The woman is dressed in a short sleeve shirt and brown pants. She is holding a tablet in her hands. The screen behind them has a city scene on it.
012.jpg,There are people standing in front of a building. There are lights hanging from the building behind them. There is a red sign on the front of the building. 
013.jpg,There is a large crowd of people gathered in a street. There are lights on a building behind them. There is a red and white sign in front of the crowd. 
014.jpg,There are several people standing in a field. There are two motorcycles in front of them. There is a man in a black shirt standing next to them. 
015.jpg,There are several people standing in a crowd. There is a white wall behind them with trees on it. There are white lines on the ground in front of them.
016.jpg,There is a large pink building with a pointed roof. There are small pink balls hanging from the roof of the building. There is a black sky behind the building with white clouds in it.
017.jpg,There is a large pink building with a large white clock on the front of it. There are trees in front of the building with lights on them. There is a crowd of people standing around the building. 
018.jpg,"The image is a screenshot from a TV program. It shows a large pink building with a clock on the front of it. There is a large sign in front of the building that says ""NHA THO TAN DINH TAN CATHOLIC CHURCH"". There are two small Christmas trees on either side of the sign."
019.jpg,There are statues of a woman and a man. There is a baby in a nest in between the statues. There are purple flowers behind them. 
020.jpg,"The image is a screenshot from a TV show. The background is black and there is a large circle with a star in the center. Around the circle are white lights that are shining. In the center of the circle is a pink banner with white letters. At the bottom of the banner is a barcode and the words ""Dong Nai thu hut dau tu mai trong tang 6 lan trong nam 2023""."
021.jpg,There are several people standing in a crowd. There is a white wall behind them. There are blue lights hanging from the ceiling above them.
022.jpg,"The image is a night time photo. The background is black. In the center of the photo there is a structure that is made up of small lights. The lights are gold and purple in color. There is a barcode on the left side of the image that says ""n trong nam 2023"". At the bottom of the picture there are words that say ""San La, Kon Tum xay ra dong dat"" and ""Dap tat dam ou"" on the bottom right."
023.jpg,There are several people standing in a room. There are lights hanging from the ceiling above them. There is a white wall behind them. 
024.jpg,There are people standing in front of a white building. There are large trees with lights hanging from them. There is a yellow helmet on the person's head. 
025.jpg,There is a crowd of people standing in front of a building. There are large christmas trees on the side of the building. The trees are decorated with lights on them. 
026.jpg,There is a crowd of people on the street. There is a large white building behind the crowd. There are lights hanging off of the building. 
027.jpg,A man is wearing a purple striped shirt and a tie. He is holding a red object in his hands. There are tall buildings behind the man. There is clouds in the sky above the buildings.
028.jpg,There is a large crowd of people on the street. There is a white truck in front of the crowd. There are buildings next to the street with lights on them. 
029.jpg,A busy street is seen in a foreign country. There are a lot of people on the street. Some of the people are wearing face masks. The buildings on the side of the street are lit up with lights.
030.jpg,A blurry picture of a busy city street. There are many bright lights on the buildings. There is a person standing in the middle of the crowd. 
031.jpg,There is a large white tower with a large pink star on top of it. There are string lights hanging above the tower. There is colorful flags hanging from the string.
032.jpg,There is a large crowd of people standing in front of a building. There are lights hanging from the building around the crowd. There is a white car parked in the front of the building.
033.jpg,There is a large crowd of people standing in front of a building. There are colorful flags hanging from a string above the crowd. There is a white statue on the side of the building. 
034.jpg,There are people standing on the street. There are trees next to the street with lights on them. There is a white building in front of the trees. 
035.jpg,A large archway is lit up at night. The archway has red and yellow writing on it. There are small white signs on either side of the archway. There is a picture of a christmas tree on one of the signs.
036.jpg,A church is lit up at night. There is a large white sign on the side of the building. There are people standing in front of the church. 
037.jpg,There is a large building with a stage in front of it. There is a blue sign hanging from the top of the building. There are lights on the building around the stage. People are standing on the stage watching it.
038.jpg,There are several motorcycles on the street. There are people sitting on top of the motorcycles. There is a building behind them with a sign on it. 
039.jpg,There are several motorcycles on the street. There are people standing on the sidewalk next to them. There is a building behind them with a red sign on it. 
040.jpg,There is a white building with a large white star on the top of it. There are colorful flags hanging in front of the building. 
041.jpg,A church is lit up at night. There is a large white star on the top of the tower. There are flags hanging from the sides of the church.
042.jpg,A woman is standing on a news set. She is wearing a short brown dress. There is a large screen behind her. There are tall buildings on the other side of the screen. 
043.jpg,A woman is standing on a news set. She is wearing a short brown dress and high heels. There is a large screen behind her. There are buildings on the screen. 
044.jpg,There are several motorcycles parked on the street. There is a large arch in front of the motorcycles. There are people standing next to the arch. 
045.jpg,There are several people standing on a stage. There is a large decoration in front of them. There are lights behind them on the stage. 
046.jpg,There is a red and yellow decoration on the wall. There are many white circles on the decoration. There is a silver decoration hanging from the ceiling. 
047.jpg,There is a man dressed as Santa Claus. He is wearing a red suit with white trim and a white beard. He has a red and white hat on his head. There is another man standing behind him holding a small child. There are balloons behind them. 
048.jpg,A bright blue light is shining in the dark. There is a white pole in front of the light. The sky around the light is black.
049.jpg,Two hands are touching a white object. There is a red and yellow object in front of the hands. A person is wearing a blue shirt and a watch on their wrist. 
050.jpg,There are people standing in front of a large red and yellow decoration. There is a man in a red shirt and a woman in a black dress. There are lights behind them. 
051.jpg,There is a large decoration in the shape of a Christmas tree. The decoration is red and orange. There are small white balls on the top of the decoration. There is a string hanging from the ceiling next to it. The sky behind the decoration is black.
052.jpg,A woman is taking a picture of a group of people. She is holding her phone up to take a picture. The people are standing in front of a large decoration. The decoration is red and yellow. There are lights behind the decoration. There is a white fence behind the people.
053.jpg,Someone is holding a phone in their hands. The phone is turned on and the screen is showing a picture of a Christmas tree. There are two people standing in front of the tree. The tree is decorated with red and white flowers.
054.jpg,There is a man holding a little girl. The girl is wearing a pink dress. There is a white fence behind them. There are motorcycles parked next to the fence. 
055.jpg,A man and a little girl are sitting on the ground. The girl is wearing a pink dress and a white headband. There is a large pile of presents behind them. 
056.jpg,There are several people standing on a stage. There is a white fence in front of them. There are large balloons on the stage. 
057.jpg,A person is holding a cell phone. There is a picture on the phone of a man standing in front of a large tree. The tree is decorated with many colorful items on it. 
058.jpg,A red screen with white writing on it. The writing is in a foreign language. There are lines on the screen. There is a small logo in the top right corner that says htv9 HD. The time is 06:36:12.
059.jpg,A woman is standing in front of a city skyline. She is wearing a short sleeve shirt and holding a tablet in her hands. The sky behind her is orange and yellow. There is a picture on the right of the woman.
060.jpg,A woman is standing on a television screen. She is wearing a short sleeve shirt and a skirt. The woman is holding a tablet in her hands. There is a picture on the screen next to the woman. 
061.jpg,There are several people sitting around a blue table. There is a man in a blue jacket standing next to them. There are trees behind them. 
062.jpg,A man is shown on a TV screen. He is wearing a yellow shirt and has short black hair. There is a large window behind him. 
063.jpg,There are people standing on a street. There is a white sign on a pole in front of them. There are bowls on top of a blue table. 
064.jpg,There is a dark picture on the screen. There are words written on the bottom of the screen in a foreign language. There is a small logo in the top right corner that says htv.
065.jpg,There are several people standing in front of a white building. There is a large tree on the wall behind them. There are blue bags on the ground next to them. 
066.jpg,There is a man wearing a black hat. He is wearing a brown shirt. There is a tree behind him with white flowers on it. A woman is standing in front of him holding a black phone. 
067.jpg,A person is wearing a black sandal on the ground. There are small rocks under the foot of the person. They are wearing black pants. 
068.jpg,There is a white building with a red and white sign on the front of it. There are two men standing in front of the building. One of the men is bending over and reaching towards the ground. There is a motorcycle parked next to the building behind them.
069.jpg,A group of people are posing for a photo. There are trees behind them. There is a girl in an orange shirt standing in front of them. 
070.jpg,The image is a screenshot of a video. The background is completely black. On the right side of the image there is a tree with green leaves. The tree is on a blue background. The bottom half of the screen has a red stripe. There are small white dots on the screen. The time is 06:37:07.
071.jpg,"The image is a graphic design. The background is red and white. There are dots on the red background. There is a diagonal white and black striped pattern. The number 6 is in the center of the image. The letters are red and silver. The word ""glay"" is written in the middle of the number 6. The date and time of the photo is 06:37:08."
072.jpg,There are three men standing next to each other. The man in the middle is wearing a blue polo shirt and blue jeans. He has handcuffs on his wrists. There is a man on the left wearing a white shirt and gray pants. The person on the right wearing a black shirt and black pants. 
073.jpg,There are two men in a room. One of the men is sitting on a red couch. He is wearing a black jacket and blue jeans. The other man is standing in front of him with his back to the camera. There is a large window on the wall behind them. There are many brown couches in the room. 
074.jpg,There are two motorcycles laying on the side of the street. There is a orange cone on the street next to the motorcycles. There are people standing on the sidewalk next to them. 
075.jpg,There is a green car driving on the street. There are orange cones on the side of the street next to the car. There is a person sitting on the ground in front of the orange cones. 
076.jpg,A motorcycle is on the ground. There is a white license plate on the front of the motorcycle. There are pieces of grass next to the motorcycle and the tire. 
077.jpg,A man is wearing a purple striped shirt and a tie. He is holding a red box in his hands. There are tall buildings behind the man. There is a cloudy sky above the buildings.
078.jpg,A man is standing in front of a city skyline. He is wearing a purple striped shirt and a tie. He has glasses on and a watch on his wrist. The sky is orange and cloudy.
079.jpg,A man is wearing a purple striped shirt and a tie. He is holding a red object in his hands. There are tall buildings behind the man. There is clouds in the sky above the buildings.
080.jpg,"The image is of a building. The building is white and light blue. There is a blue sign on the front of the building that says ""CHI CUC DANG KIEM LONG AM"". There are palm trees surrounding the building."
081.jpg,A man in a green shirt is standing in front of a desk. There is a woman in a blue shirt sitting in a chair next to him. There are gray cabinets behind him. 
082.jpg,A man in a green uniform is holding a piece of paper. He is wearing a red and gold hat. There is a red sign behind him. 
083.jpg,A man is standing in front of a red sign. The man is wearing a blue collared shirt and glasses. He has short black hair. The wall behind the man is white. 
084.jpg,A man is wearing a white shirt and black pants. He has a watch on his wrist. There is a green wall behind the man. 
085.jpg,A man is wearing a white striped shirt and black pants. He is wearing silver handcuffs on his wrists. There is a green wall behind the man. 
086.jpg,There are three men standing in front of a white wall. They are wearing green uniforms and green hats. There is a man in a white shirt standing between them. 
087.jpg,There is a man wearing a white collared shirt. There are two men in green uniforms standing in front of him. There is a white wall behind them.
088.jpg,There are two men standing next to each other. The man on the left is wearing a blue shirt and glasses. He has short black hair. He is looking at the other man. The other man is wearing glasses and a green uniform with a red hat. He also has glasses. There is a red sign behind the men. 
089.jpg,Four men are standing in a room. They are all wearing green uniforms and red hats. There is a green curtain hanging on the wall behind them. A man in a blue shirt is standing in between two of the men. 
090.jpg,A woman is standing in front of a screen. She is wearing a short sleeve shirt and holding a book in her hands. There is a large picture on the screen behind her. There are tall buildings on the ground. 
091.jpg,A woman is standing in front of a screen. She is wearing a short sleeve shirt and holding a tablet in her hands. There is a picture on the screen behind her. There are tall buildings on the ground. 
092.jpg,There are three men standing next to each other. The man in the middle is wearing a blue shirt and blue jeans. He is wearing handcuffs on his wrists. There is a man on the left wearing a white shirt and gray pants. He has tattoos on his arms and wrists. The person on the right wearing a black shirt and black pants. 
093.jpg,Three men are standing next to each other. One of the men is wearing a white shirt. The other two men are wearing black shirts. There is a large curtain behind them. 
094.jpg,A man is wearing a white shirt. He has short black hair. There is a white wall behind the man. 
095.jpg,A man is wearing a blue collared shirt. There are white curtains behind the man. There is another man in a white shirt next to the man in the blue shirt. 
096.jpg,There are three people standing in a line. They are all wearing handcuffs on their wrists. There is a man in a white shirt with tattoos on his arm. The man in the blue shirt is wearing blue pants. 
097.jpg,There are three men standing in front of a white curtain. The man on the left is wearing a white shirt. There is a man in a blue shirt next to him. 
098.jpg,A shirtless man is standing in front of a brown leather couch. There is a man in a suit sitting on top of the couch. 
099.jpg,There are two men in a room. One of the men is shirtless and wearing black and white shorts. The other man is sitting on a brown leather couch. There is a white table in front of the couch with a mug on top of it. 
100.jpg,There are two men in a room. One of the men is shirtless and wearing shorts. The other man is sitting on a red couch. There is a coffee table in front of the couch. 
101.jpg,Two people are sitting at a brown table. There is a laptop on the table in front of them. One of the people is wearing a white shirt and has handcuffs on their wrists. 
102.jpg,A man is sitting at a table. He is wearing a black shirt and has tattoos on his arm. There is a blue chair in front of him and a large window behind him. 
103.jpg,A man is standing in front of a city skyline. He is wearing a purple striped shirt and a tie. He has glasses on and is holding a red object in his hands. The sky is orange and yellow and there are clouds in the sky. There are tall buildings in the background.
104.jpg,A man is standing in front of a city skyline. He is wearing a purple striped shirt and a tie. He has glasses on and is holding a red object in his hands. The sky behind him is orange and yellow. 
105.jpg,There are two men walking down a hallway. There are white doors on the wall next to the men. There is a red sign hanging from the wall. 
106.jpg,There is a man sitting in a chair. There are wooden chairs behind him. There is a white wall behind the man. The man is wearing a gray shirt. 
107.jpg,A person is wearing white gloves and a silver watch. They are holding a green object in their hand. There are boxes and a red bag on the table in front of them. 
108.jpg,There is a white table with several items on top of it. There is a person wearing white gloves on their hands. There are two bags on the table. 
109.jpg,There is a man sitting in a chair. The man is wearing a gray shirt. There are brown chairs in front of him. There is a white wall behind him.
110.jpg,A man is sitting in a chair. He is wearing a gray shirt with white stripes on it. There are brown chairs behind him. There is a white wall behind the man. 
111.jpg,A man in a green shirt is sitting in a chair. There is a desk behind him with a computer on it. There are windows on the wall behind the desk. 
112.jpg,A woman is standing in front of a screen. She is wearing a short sleeve shirt and holding a book in her hands. There is a picture on the screen behind her. There are tall buildings on the ground. 
113.jpg,A woman is standing in front of a screen. She is wearing a short sleeve shirt and a skirt. The woman is holding a tablet in her hands. There is a picture on the screen behind the woman. 
114.jpg,A woman is wearing a purple dress. She is holding a tablet in her hands. There is a picture next to the woman that has a city on it. 
115.jpg,Four people are standing in a room. Two of the people are wearing uniforms and hats. There is a table in front of them with papers and a green bowl on top of it. 
116.jpg,There are four people standing in a room. There is a man in a green uniform standing in front of a white table. There are two men and a woman in uniform standing next to him. 
117.jpg,There are four people standing in a room. There is a large window on the wall behind them. There are stairs leading up to a grassy area in front of the window. 
118.jpg,There are four people standing in a room. There is a large window on the wall behind them. There are two men in uniform standing in front of a white table. 
119.jpg,There are four people standing in a room. There is a man in a gray shirt standing in front of a white table. There are two men in uniform standing next to a woman in a blue shirt. 
120.jpg,"A document in Vietnamese is displayed on a white background. The document is written in black text. There is a watermark in the top right corner of the image that says ""HTV HD"". The document appears to be a formal document."
121.jpg,There are three people in a room. They are wearing green uniforms and green hats. There is a black dresser behind them with vases on top of it. 
122.jpg,Three men in green uniforms are standing in a room. They are wearing green hats on their heads. One of the men is holding papers in his hands. There is a woman in a white shirt standing behind them. 
123.jpg,Three men in green uniforms are standing in a room. They are wearing red hats on their heads. One of the men is holding papers in his hands. There is a woman in a blue shirt standing behind them. 
124.jpg,There are two men standing in a room. They are wearing green uniforms and red hats on their heads. There is a woman in a blue shirt standing behind them. There are pictures hanging on the wall.
125.jpg,Three men are standing in a room. They are wearing green uniforms. One of the men is wearing a red hat on his head. The other man is holding papers in his hands. There is a brown box on a table in front of them. 
126.jpg,A man is wearing a purple striped shirt and a tie. He is holding a red object in his hands. There are tall buildings behind the man. There is a cloudy sky above the buildings.
127.jpg,A man is standing in front of a picture of a city. He is wearing a purple striped shirt and a tie. He has glasses on and a watch on his wrist. There are tall buildings behind him. 
128.jpg,There are two motorcycles on the side of the street. There is an orange cone on the street next to the motorcycles. There are people standing on the sidewalk next to them. 
129.jpg,There is a green car driving on the street. There are orange cones on the side of the street next to the car. There is a person sitting on the ground in front of the orange cones. 
130.jpg,A motorcycle that has crashed is lying on the road. There is a white license plate on the front of the motorcycle. There are pieces of trash all around the motorcycle on the ground. 
131.jpg,A motorcycle is laying on its side on the ground. There is a white license plate on the front of the motorcycle. There are broken pieces of the bike scattered around the bike. 
132.jpg,The image is of the front part of a motorcycle that has been taken apart. The motorcycle is laying on its side on a paved road. There is a blue helmet on the left side of the motorcycle. The front tire has been removed from the motorcycle and a red spring is attached to the rear part of the vehicle. The license plate on the motorcycle is white with black letters and numbers on it. The text on the image is in Vietnamese.
133.jpg,Two motorcycles are on the side of the road. There are orange cones on the street. There is dead grass next to the motorcycle. 
134.jpg,A motorcycle is laying on its side on the ground. There is another motorcycle behind it on the other side of the road. The motorcycle has its front wheel turned off. 
135.jpg,There are several motorcycles on the street. There are orange cones on the side of the street next to the motorcycles. There is a person on a red motorcycle in front of them. 
