frame,caption
278.jpg,There are four people sitting around a table. There is a blue wall behind them. There are two windows on the wall. The woman is wearing a white jacket. 
279.jpg,There are people sitting around a table. There is a man in a green uniform sitting in front of the table with a phone in his hand. There are red signs hanging on the wall behind them. 
280.jpg,There are three men sitting at a table. There is a white board behind them on the wall. There are chairs around the table. The men are wearing jackets. 
281.jpg,There are two men sitting at a table. There is a white board behind them on the wall. There are chairs around the table. The men are wearing jackets. 
282.jpg,There are two men sitting at a table. There is a white board on the wall behind them. The men are wearing black jackets. 
283.jpg,Three men in green uniforms are sitting at a table. The man in the middle is holding a black phone to his ear. There is a piece of paper on the table in front of them. 
284.jpg,There are five people standing in front of a red and green curtain. There is a man in a green uniform handing something to a woman in a white jacket. There are two gold stars on the curtain behind them.
285.jpg,There are four people standing in front of a green curtain. There is a man in a green uniform handing something to a woman in a white jacket. There are two men standing next to them. 
286.jpg,There are four people standing in front of a table. There is a woman in a white shirt shaking hands with a man in a green uniform. There are green curtains behind them. 
287.jpg,"A red and white diagonal stripe is shown. The white stripe is on the right side of the red wall. On the top right corner of the image there is a small logo that says ""HTV"" in red letters."
288.jpg,A white airplane with a green stripe down the side of it. There are small circular windows on the front of the plane. There is a large propeller on the plane with green lights hanging from it. 
289.jpg,The image is a screenshot from a news channel. The channel is HTV9 HD and the time is 06:45:53. There is an image of an airplane in the middle of the screen. The airplane is white and has a bright orange and yellow light coming from the engine. The text on the screen is in a foreign language.
290.jpg,There are two cartoon characters hugging each other. The character on the right is wearing a green hat. The rabbit on the left is smiling. There is a pink picture frame in front of them. 
291.jpg,There are two cartoon characters on a red and white background. The character on the right is wearing a green hat. He has big eyes and a big nose. He is also wearing a brown hat. On the left is a white rabbit with big ears and a pink nose. They are hugging each other. There is a pink frame in front of them.
292.jpg,A picture of a Disneyland theme park. There is a statue of Mickey Mouse on the right side of the image. There are many tall towers on the building. There many trees surrounding the castle. The sky above the castle is blue.
293.jpg,A woman is wearing a blue dress. She has short black hair. She is holding a book in her hands. There is a picture next to the woman. 
294.jpg,A woman is standing in front of a screen. She is wearing a short blue dress. She has short black hair. There is a picture on the screen behind her. There are tall buildings on the ground. 
295.jpg,A woman is standing in front of a screen. She is wearing a short blue dress. She has short black hair. There is a large picture on the screen behind her. There are tall buildings on the ground. 
296.jpg,A woman is standing in front of a screen. She is wearing a blue dress and holding a tablet in her hands. There is a large picture on the screen behind her. There are many buildings on the ground behind the woman. 
297.jpg,People are walking across the street in the rain. There is a large white building next to the street. There are trees in front of the building. 
298.jpg,The image is a screenshot of a news story in Vietnamese. The story is about a Hyundai car dealership. The building is white and has the Hyundai logo on the side of it. The Hyundai logo is gray and the letters are gray. The sky is overcast and the image is in black and white. There is a red banner at the bottom of the image with the company name and logo on it.
299.jpg,There are three cars lined up in a row. There are two men in blue uniforms standing next to the cars. There is a white car in front of them. The door of the car is open. 
300.jpg,There are several cars lined up in a row. There is a white car in front of them. There are two men in blue uniforms standing next to the cars. 
301.jpg,A picture of a car assembly line in a factory. There is a white car on the assembly line suspended in the air. There are several people working on the cars. The man on the right is wearing a blue jumpsuit. 
302.jpg,A man in a blue shirt is standing under a car. There is a white car under the man. The man is wearing a baseball cap. 
303.jpg,A man is standing inside of a factory. He is wearing a blue long sleeve shirt and blue pants. There are several tables and shelves behind him. The ceiling of the factory is large and has many lights hanging from it.
304.jpg,A man is standing under a car in a factory. He is wearing a blue shirt and blue pants. He has white gloves on his hands. There are boxes on a table in front of him. 
305.jpg,A man is wearing a blue shirt and white gloves. He is working on a vehicle. There is another man behind him wearing a black shirt. There are yellow boxes under the vehicle. 
306.jpg,A picture of a factory is being shown. There are several machines inside of the building. There is a metal railing in front of the machines. 
307.jpg,The image is a picture of a metal object. It appears to be a part of a vehicle. The metal is silver in color. There are holes in the middle of the metal. There is a white box on the right side of the image. The text on the image is in Vietnamese.
308.jpg,The image is a picture of a car body. The body is made up of metal. The metal is silver in color. There are holes in the middle of the body. There is a white machine to the right of the silver body.
309.jpg,A picture of a car being assembled in a factory. The car is yellow and black. There are two men standing under the car. The man on the left is wearing a blue shirt and a black hat. There is boxes under the cars. 
310.jpg,A man in a blue shirt is standing in front of a car. He is holding the steering wheel of the car. There are wires hanging from the ceiling. 
311.jpg,A man is wearing a blue shirt and black gloves. He is holding the steering wheel of a vehicle. There is a large window behind the man. 
312.jpg,A picture of a car assembly line in a factory. There are several cars on the assembly line with the hood up. There is a man in a blue shirt standing next to one of the cars. 
313.jpg,A man is standing in front of a cityscape. He is wearing a white shirt and a black tie. He has glasses on and is holding a phone in his hands. The sky is orange and yellow. There are tall buildings all around the man.
314.jpg,A man is standing in front of a cityscape. He is wearing a white shirt and a black tie. He has glasses on and is looking at something in his hands. There are tall buildings in the background. 
315.jpg,A man is wearing a white shirt and a black tie. He is standing behind a white podium. There are tall buildings behind the man. There is a cloudy sky above the buildings.
316.jpg,A man is standing in front of a white table. He is wearing a white shirt and a black tie. There are tall buildings behind the man. There is a red phone in his hands. 
317.jpg,There are several men standing in front of a large machine. The machine is white and has many wires attached to it. There is a man in a black jacket standing next to the machine. 
318.jpg,A picture of a plane that has a bunch of missiles attached to it. The plane is white and has a green stripe on the side of it. There is a red and white sign under the picture of the plane.
319.jpg,The image is from the window of an airplane. The sky is dark and cloudy. The wing of the airplane is white. There is writing on the bottom of the image in Vietnamese.
320.jpg,The image is of the control panel of a plane.  There are three screens in the panel.  The screen in the middle is showing a diagram of the plane's landing gear.  On the right side of the panel is a display screen showing the time as 6:50:41.  A person's hand is visible in the bottom left corner of the image.   The text on the image is in Vietnamese.
321.jpg,A picture of a control panel in a plane. There are several screens on the panel. There is a person in a white shirt standing in front of one of the screens. 
322.jpg,The image is taken from an airplane window. The sky is dark and cloudy. There is a bright orange and yellow light coming from the wing of the plane. The wing is white and there is a railing on the left side of the wing.
323.jpg,The image is a video of a river. The water appears to be choppy. There are small waves in the water. The image is in black and white. At the bottom of the image there is text in Vietnamese.
324.jpg,There are trees and bushes in front of a white building. There is a red watermark on the top right corner of the photo.
325.jpg,A picture of water is shown on a screen. The water appears to be very choppy. There are small waves in the water. There is a red and white logo on the top right corner of the screen.
326.jpg,The sky is hazy and foggy. There is a street light on the side of the road. There are cars driving on the street. There's a tree to the right of the street light.
327.jpg,The sky is hazy and foggy. There is a billboard on the side of the road. There are power lines running across the sky. A tall light pole is standing next to the billboard. A tree is standing in front of the sign.
328.jpg,This is an image of a city. The sky is very cloudy and foggy. There is a large white building in the background. There are tall towers in front of the building. The towers are light brown in color. The building has a dome on top of it. The dome is shaped like a dome with a small opening at the top. The top of the dome is pointy.
329.jpg,There is a tall chimney sticking out of the ground. There are wires above the chimney. There is a large cloud of smoke coming out of it.
330.jpg,There are several people riding motorcycles on the street. There are signs hanging from the poles on the side of the street next to them. There is a yellow vehicle behind them. 
331.jpg,There are several people riding motorcycles on the street. There is a yellow vehicle behind them. There are signs hanging from the poles next to the sidewalk. 
332.jpg,There are people standing on the street. There is a white car behind them. There are signs on the poles in front of the car. 
333.jpg,Two men are standing inside of a store. There are many buckets of paint on the shelves behind them. One of the buckets is white and the other is purple. The man on the right is wearing a white shirt and a hat. He is also wearing glasses. 
334.jpg,A woman is standing in front of a screen. She is wearing a blue dress and holding a tablet in her hands. There is a large screen behind her with a red logo on it. There are buildings behind her. 
335.jpg,A woman is standing in front of a screen. She is wearing a blue dress and holding a tablet in her hands. There is a large screen behind her with a red logo on it. There are buildings behind the woman. 
336.jpg,A woman in a blue dress is standing in front of a screen. There is a picture on the screen next to her. There are buildings behind her. 
337.jpg,A woman is standing in front of a screen. She is wearing a short blue dress. She has short black hair. There is a picture on the screen next to her. 
338.jpg,There are two cartoon characters standing next to each other. There is a pink picture frame in front of them. One of the characters is wearing a green hat. 
339.jpg,There is a fountain in front of a building. There are people standing around the fountain. There is a statue of mickey mouse on top of the boat. 
340.jpg,There are two animals standing in front of a sign. The animal on the left is wearing a red mask and a blue shirt. The rabbit on the right is wearing blue clothes and a black glove. The sign behind the animals is brown and has a gold emblem on it. 
341.jpg,There are two animals standing next to each other. The animals are wearing uniforms. One of the animals is a red fox. The other is a gray rabbit. They are standing in front of a wall. There is a brown door behind them. 
342.jpg,A cartoon character is holding a stuffed animal. The character is wearing a blue shirt. The stuffed animal is gray and white. The eyes of the character are purple. There is a brown curtain behind the character. 
343.jpg,A man is standing in front of a building. He is wearing a black suit and a white collared shirt. The building behind him is brown and blue. There are trees behind the building. 
344.jpg,A man is wearing a black suit and a white shirt. There is a brown building behind the man. There are trees behind the building. 
345.jpg,A cartoon is being shown on a TV screen. There is a large blue tank behind a black car. There are orange barrels on the ground in front of the tank. 
346.jpg,There is a black and yellow barricade in front of a building. There is snow on the barricade. There are boxes on the ground behind the barrier. 
347.jpg,There are two cars driving on a road. There is a colorful tunnel behind the cars. There are bright lights on the ceiling of the tunnel. 
348.jpg,"The image is a screenshot from a video. It shows a cheetah mascot. He is white with black spots and an orange nose. His eyes are wide open and he has a big smile on his face. Behind him is a white plate with a gold emblem on it that says ""Integrity""."
349.jpg,This is a scene from a TV show. There is a large circular light fixture hanging from the ceiling. There are white chairs in front of the light fixture. 
350.jpg,This is a scene from a TV show. There is a large circular light fixture hanging from the ceiling. There are several white chairs in front of the light fixture. 
351.jpg,There are several people standing in front of a colorful building. There is a woman in a white jacket taking a picture of the building. 
352.jpg,There is a cartoon image of a building. The building is made of red bricks. There is a sloth in the window of the building.  The sloth is wearing a green shirt and tie. 
353.jpg,A man is standing in front of a cityscape. He is wearing a white shirt and a black tie. He has glasses on and is holding a tablet in his hands. The sky behind him is orange and yellow. There are tall buildings all around him.
354.jpg,A man is wearing a white shirt and a black tie. He is holding a tablet in his hands. There are tall buildings behind the man. There is clouds in the sky above the buildings.
355.jpg,A man is standing in front of a large cityscape. He is wearing a white shirt and a black tie. He has glasses on and is holding a small red object in his hands. The sky behind him is orange and yellow. There are tall buildings all around the man.
356.jpg,A man is standing in front of a white table. He is wearing a white shirt and a black tie. There are tall buildings behind him. There is a yellow and blue sky above the buildings.
357.jpg,A man is standing in front of a cityscape. He is wearing a white shirt and a black tie. He has glasses on and is looking at his phone. There are tall buildings in the background. 
358.jpg,A man is standing in front of a machine. He is wearing a black shirt and glasses. The machine is silver and has a large bowl on top of it. There is a white wall behind the man. 
359.jpg,This is a news report in Vietnamese. It is dated 06:52:41. There is a metal grate on the ground. Inside the grate are small brown objects. The grate is made of metal. There are two metal bars on either side of the grate.
360.jpg,There is a large metal container with a brown liquid inside of it. There is a silver pipe coming out of the side of the container. 
361.jpg,There is a silver machine with red and yellow knobs on it. There is a white table in front of the machine. There are wires coming out of the red knobs. 
362.jpg,This is a picture of a machine. The machine is silver in color. There are red and yellow knobs on the front of the machine. There is a red liquid coming out of the top of it. The liquid appears to be a reddish color. 
363.jpg,The image is a screenshot from a video. There is a barcode in the bottom left corner of the image. The barcode is white with black text. There are four metal bars in the image that are silver in color. The bars appear to be made of metal. The metal bars have a rough texture on them. The surface of the metal bars is a reddish brown color.
364.jpg,There is a blue table in front of a silver faucet. There are brown rectangular objects on top of the table. There is a white barcode on the bottom left of the image. 
365.jpg,There is a blue conveyor belt in a factory. There is a plastic bag on the side of the belt. There are silver machines next to the blue belt. 
366.jpg,Two people are wearing blue gloves. They are standing in front of a brown tray. There is a machine behind them. 
367.jpg,A man is sitting in front of a bookshelf. He is wearing a suit and a tie. He has glasses on and has a white beard. There are books on the shelves behind him. 
368.jpg,A man is sitting in front of a bookshelf. He is wearing a suit and tie. He has glasses on and has a white beard. There are books on the shelves behind him. 
369.jpg,A man is sitting in front of a book shelf. He is wearing a suit and a tie. He has glasses on and has a white beard. There are books on the shelf behind him. 
370.jpg,This is an image of a machine. The machine is made up of metal. The metal is silver and green. There is a large metal wheel in the middle of the machine. There are small black screws on the side of the wheel. The wall behind the machine is white. The text on the bottom of the image is in Vietnamese.
371.jpg,A man is wearing a white shirt and a white apron. He is holding a large knife in his hand. There are shelves behind the man with bottles on them. 
372.jpg,A man is wearing a white shirt and a white apron. He is holding a large knife in his hand. There are shelves behind the man with bottles on them. 
373.jpg,A man is wearing a white apron and a watch on his wrist. He is holding two knives in his hands. There is a white cutting board in front of him. There are brown pieces of food on top of the board.
374.jpg,A woman is standing in front of a screen. She is wearing a short blue dress. She has short black hair and is holding a red folder in her hands. There is a picture on the screen behind the woman. 
375.jpg,A woman is standing in front of a screen. She is wearing a blue dress and holding a tablet in her hands. There is a large picture on the screen behind her. There are many buildings on the ground behind the woman. 
376.jpg,A woman is standing in front of a screen. She is wearing a short blue dress. She has short black hair. There is a large picture on the screen behind the woman. 
377.jpg,A woman is standing in front of a screen. She is wearing a blue dress and holding a tablet in her hands. There is a large picture on the screen behind her. There are tall buildings on the ground. 
378.jpg,"The image is a red background with diagonal lines. The lines are bright red. There is a white letter ""C"" in the middle of the red background. At the top right corner of the image there is a date and time stamp that reads 06:53:51. The time stamp reads ""HTV9 HD"". At the bottom of the screen there is the name of the company and the year of the year."
379.jpg,There is a white house with a brown roof. There are trees in front of the house. There is a red and white sign on the bottom of the screen.
380.jpg,There are two men standing next to each other. The man on the left is wearing a blue shirt and a black hat. He has black suspenders hanging over his shoulders. He is looking to the side. The other man is looking directly at the other man. There are trees behind the two men. 
381.jpg,Two men are standing in the middle of a forest. There are tall trees surrounding the men. One of the men is wearing a blue jacket and a black hat. The other man is wearing black pants and a blue shirt. 
382.jpg,Two men are standing in the middle of a forest. There are tall trees surrounding them. One of the men has his arm around the other man's waist. They are both wearing jackets. 
383.jpg,There are two men standing in front of each other. The man on the left is wearing a brown shirt. He has short black hair. He is looking at the other man. The other man has a blue shirt on. 
384.jpg,There are two men standing in front of each other. One of the men is wearing a blue collared shirt. The other man has short black hair. There are trees behind the men. 
385.jpg,There are two men hugging each other. The man on the right is wearing a brown shirt. There are trees in the distance behind them. The sky above them is gray. There is a red circle on the bottom right of the image that saysSubscribe.
386.jpg,A poster has two people on it. The people have dark hair. There is a yellow background on the poster. There are words in red and blue on the front of the people. 
387.jpg,"A city is shown at night time. There are many tall buildings and skyscrapers in the city. There is a bright red circle in the sky above the buildings. In the center of the image, there is white writing."
388.jpg,The image is a poster or advertisement. The background of the poster is a city at night. The city is lit up with lights. There are many buildings and skyscrapers in the city. The sky is dark. The text on the poster says Duoi Bong binh yen. There is a red circle on the left side of the text. The date and time of the show is 06:54:25.
389.jpg,There is a man standing behind a silver cart. There is a light hanging above the cart. The man is wearing a white shirt and a hat. There are blue stools in front of the man.
390.jpg,"The background of the screen is a maroon color. In the middle of the picture there is some text written in a foreign language. The text is written in white. At the top right corner there is a small logo that says ""HTV9 HD"" in red letters. The time is 06:54:35."
391.jpg,"A man is smiling and looking at a woman. The man is wearing a white collared shirt. The woman is touching the man's face with her hand. The background is blurred. There is writing on the bottom of the screen that says ""Quang Ninh""."
392.jpg,A woman with long brown hair is standing in front of a man. The woman is wearing a white shirt and a black watch on her wrist. The man is wearing glasses on his face. There are trees behind the woman. 
393.jpg,A man and a woman are holding hands. The man is wearing a light blue button down shirt. The woman has long brown hair. She has a white shirt on and jeans. There are trees behind them. 
394.jpg,There is a man and woman sitting in a white boat on the beach. The man is wearing a blue shirt. There is water behind them in the ocean. There are white clouds in the sky.
395.jpg,A couple is sitting in a boat on the beach. The boat is white and is on the sand. There are waves in the water behind them. The sky is blue with white clouds in it. There is a tree next to the couple. 
396.jpg,A woman in a blue dress is standing on a news set. There is a large screen behind her that shows a city skyline. There are clouds in the sky. 
397.jpg,A man and a woman are standing in front of a large screen. They are both dressed in business attire. The woman is wearing a short sleeve shirt and black pants. The man is wearing glasses and a tie. He is holding a red object in his hands. The screen behind them has a city scene on it. There is a red and white chair in the front of the screen.
398.jpg,A man and a woman are standing behind a news desk. The desk is white and has a red logo on it. The man is wearing a white shirt and tie and is holding a red book in his hands. The woman is also wearing a short sleeve blue shirt and black pants. There is a large screen behind them that shows a city skyline.
399.jpg,A man and a woman are standing behind a white table. There is a large screen behind them with a city on it. The man is wearing a white shirt and tie. 
400.jpg,"The image is dark. The background is completely black. At the top right corner of the image there is a logo that says ""HTV9 HD"". The logo is in red and white colors. The time is 07:00:16."
