frame,caption
132.jpg,There is a man and a woman standing behind a white table. The man is wearing a white shirt and a tie. There is a large screen behind them. There are buildings on the screen. 
133.jpg,There is a man and a woman standing in front of a white table. The man is wearing a white shirt and a tie. There is a large screen behind them. There are buildings on the screen. 
134.jpg,There is a man and a woman standing in front of a white table. The man is wearing a white shirt and tie. There is a large screen behind them. There are buildings on the screen. 
135.jpg,A woman in a blue headscarf is sitting in a wheel chair. There are several people standing around her. There is a man in a yellow vest standing next to her. 
136.jpg,A man in a green shirt is wearing a face mask. There are people standing in front of him. There is a woman in a white shirt sitting in a chair. 
137.jpg,A man in a green and white shirt is wearing a face mask. There are people standing in front of him. There is a woman in a white shirt sitting down. 
138.jpg,There are people standing in a line. They are all wearing face masks. There is a woman in the front wearing a black scarf. 
139.jpg,There are several people standing in a room. There is a man pushing a cart with a red bag on it. The man is wearing a face mask on his face. 
140.jpg,A person is standing in front of a white wall. They are wearing a red shirt and carrying a blue bag. There is a black sign hanging from the ceiling above the wall.
141.jpg,A man in a white shirt and a yellow vest is wearing white gloves. He is wearing a face mask. There is a large screen in front of him. 
142.jpg,People are sitting in red chairs in an airport. There is a man in a blue shirt standing in front of the red chairs. There are suitcases on the floor next to the chairs. 
143.jpg,A woman is sitting on a red chair. She is wearing a black and white checkered shirt and a purple head covering. She has a black suitcase in her lap. There are red chairs next to her. 
144.jpg,There are people standing in a line. They are all wearing face masks. There is a man in a blue shirt standing in front of them. 
145.jpg,A man is standing in front of a city skyline. He is wearing a white striped shirt and a striped tie. The sky is orange and yellow. There are tall buildings behind the man. 
146.jpg,A man is standing in front of a city skyline. He is wearing a white striped shirt and a striped tie. The sky behind the man is orange and yellow. There are tall buildings in the skyline.
147.jpg,A man is standing in front of a city skyline. He is wearing a white striped shirt and a striped tie. The man is holding a red folder in his hands. The sky behind the man is orange and yellow. There are tall buildings behind the person. 
148.jpg,There is a small boat on the water. There are trees on the other side of the boat. There is a person standing on the boat and holding a stick. 
149.jpg,There are several bags of food in a plastic bag. There is a black sticker on the bag. The sticker has white writing on it. 
150.jpg,There is a person wearing a white suit and a black helmet. They are standing in front of a large machine. There are silver pipes and tubes around them. 
151.jpg,A cow is standing under a metal structure. The cow is white with some brown spots on it. There is dirt on the ground under the cow. 
152.jpg,"There is a white container with a black and white label on it. The label has the words ""Floating Farm"" on it in black letters. There is a black wave design on the label. The container is filled with a white liquid. "
153.jpg,There are several people standing in front of a wall. There is a man in an orange jacket standing next to a woman in a gray jacket. There are words written on the bottom of the image.
154.jpg,A woman is wearing a black jacket and a purple scarf. There are cows behind her. There is a red sign in front of the woman. 
155.jpg,There is a large structure in the middle of the water. The structure is made of metal and glass. There are clouds in the sky above the structure.
156.jpg,A woman is standing in front of cows. She is wearing a black coat and a scarf around her neck. The cows behind her are white and brown. There is a metal fence behind the woman. 
157.jpg,Two men are working in a factory. They are wearing white lab coats. There is a large machine in front of them. There are plastic containers on top of a silver table. 
158.jpg,There are four people standing together. There is a man in an orange jacket standing next to two women. The woman in the middle is wearing glasses and has long brown hair. 
159.jpg,There is a large body of water. There is a dock next to the water with a large building on it. There are clouds in the sky above the water. 
160.jpg,There is a large body of water. There is a white building in the water next to a dock. There are clouds in the sky above the water.
161.jpg,The statue of liberty is in the fog. There are cranes behind the statue. The sky is cloudy and foggy.
162.jpg,A television set is being shown. There is a man and a woman standing in front of a large screen. The man is wearing a white shirt and tie and is standing behind a white table. The woman is standing next to him wearing a short sleeve shirt and a floral shirt. There are large buildings on the screen behind them.
163.jpg,A woman is standing on a news set. She is wearing a silver dress and holding a red purse. There is a large screen behind her. There are buildings on the screen. 
164.jpg,A woman is standing on a news set. She is wearing a short floral dress and holding a red purse in her hand. There is a large screen behind her with a picture of a man and a woman on it. There are buildings behind the screen. 
165.jpg,A woman is standing in front of a large screen. She is wearing a short dress and holding a red purse. There is a picture on the wall behind her. 
166.jpg,There are several white objects on top of red boxes. There is a red banner in front of the boxes with white writing on it. There are large windows on the wall behind the boxes.
167.jpg,A white statue of a man is shown. There is a gray wall behind the statue. The statue is bald and has no hair on it. 
168.jpg,A statue of a man is shown in a black and white photo. The statue is white and appears to be made of clay or plaster. The man has a bald head and a nose. His eyes are squinted and his mouth is slightly open. There are words written in a foreign language around the statue. There is a date and time stamp in the top right corner of the photo.
169.jpg,There is a white statue on a white pedestal. There are people standing around the statue. There is a ladder next to the statue on the wall. 
170.jpg,There are several people standing around a white statue. There is a ladder leaning against the wall behind the statue. 
171.jpg,A statue of a woman is shown on a white pedestal. The statue is white and appears to be made of plastic. The hands of the statue are covering the woman's face. There is a black and white background behind the statue. The pedestal the statue is sitting on is white. There are words and numbers on the bottom of the image.
172.jpg,There is a statue of a man bending over. The statue is white. There is a black wall behind the statue. The man is bending his head down. 
173.jpg,"This is an image of a street. The street is lined with buildings. The buildings are old. There is a store called ""Mister X"" on the right side of the street. There are people walking on the sidewalk. The sidewalk is made of cobblestone. The cobblestones are gray and white. The man walking is wearing a black suit."
174.jpg,There are several buildings next to each other. There is a large white building with a blue flag hanging from the side of it. There are black balconies on the buildings. 
175.jpg,A picture of a white hand is shown. There is a gray background behind the hand. There are words written in front of the hand on the bottom of the picture. 
176.jpg,"A red light is shining on something. The background is black. There is a small logo in the top right corner that says HTV9 HD. There are words under the logo that say Mau, tong kinh phi 690 iy dong da thong xe sang nay 10/12."
177.jpg,A red background with white writing on it. The writing is in a foreign language. There is a red stripe on the right side of the image. There are numbers at the bottom of the screen that are in white.
178.jpg,There is a woman wearing a white shirt. She has dark hair and earrings in her ears. There is a mirror behind the woman. The woman has a frown on her face. 
179.jpg,There is a woman with dark hair wearing a white shirt. There is a mirror behind her on the wall. The woman has earrings hanging from her ears. 
180.jpg,A woman with dark hair is wearing a white shirt and a scarf around her neck. She has earrings in her ears. There is a brick wall behind the woman. 
181.jpg,"The image is blurred. The background is green. There is a red logo in the top right corner that says ""HTV9 HD 06:49:40"". Below the logo there is a description in Vietnamese that is written in the bottom left corner."
182.jpg,There are five people sitting around a table. There is a man in a blue shirt standing in front of a door. There are windows on the wall behind them. 
183.jpg,An Asian man with dark hair and a mustache is sitting in a room. He is wearing a brown jacket. There is a window behind him with a green frame on it. 
184.jpg,There are three women sitting on a bed. There is a white curtain on the bed. One of the women is wearing a blue jacket and black pants. 
185.jpg,A woman is standing in front of a brown door. She is wearing a blue dress and a white necklace. The wall behind the woman is beige. There is writing on the bottom of the picture. 
186.jpg,"The image is a screen saver. It has a dark background. There is a woman in the center of the screen. The woman has long dark hair. The text on the screen says ""Dau Be Muia XUA"" in red letters. The date and time of the show is 19/30/11/12/2013."
187.jpg,A man in a white shirt and a striped tie is standing in front of a large screen. There is a large picture on the screen behind the man. There are tall buildings on the ground behind the screen. 
188.jpg,A man is standing in front of a screen. He is wearing a white shirt and a striped tie. The man is holding a tablet in his hands. There is a large picture on the screen behind the man. 
189.jpg,A man in a white shirt and a striped tie is standing in front of a large screen. There is a large picture on the screen behind the man. The man is holding a tablet in his hands. 
190.jpg,A man is wearing a white collared shirt and a striped tie. He is holding a book in his hands. There is a large screen behind the man. There are many people on the screen. 
191.jpg,People are sitting at long white tables in a room. There are chess boards on the tables in front of them. There is a man in a blue shirt sitting at the table. 
192.jpg,There is a large chess board on a white table. There are white and black chess pieces on the board. There is a black clock next to the board on the table. 
193.jpg,There are people sitting at tables in a room. There are large windows on the wall behind them. There is a man standing in front of the table. 
194.jpg,A man is standing in a room. He is wearing a white and black collared shirt. There are tables and chairs in front of him. People are standing around the tables. 
195.jpg,A group of people are sitting around a table playing a game of chess. There are white and black chess pieces on the table. There is a woman sitting in front of the table with a white shirt on. 
196.jpg,A man is standing in a room. He is wearing a blue shirt and glasses. There is a table in front of him with chess pieces on top of it. There are people standing in the room behind him. 
197.jpg,A man is wearing a blue shirt and glasses. There are people standing behind him in a room. There is a white table in front of him with chess pieces on top of it. 
198.jpg,Two people are playing a game of chess on a long table. The table is white and the chess pieces are black and white. The man on the left is wearing a white shirt and is leaning over the table.
199.jpg,A man is standing in front of a table. He is wearing a white shirt and green pants. There are people sitting in chairs around the table. The table has white tablecloths on it and there are large windows on the wall behind the people. 
200.jpg,A man and a woman are standing in front of a news desk. The desk is white and has a red logo on it. The man is wearing a white shirt and tie and is holding a book in his hands. The woman is standing behind the desk wearing a floral dress and high heels. There is a large screen behind them. There are buildings and clouds in the sky.
201.jpg,There is a man and a woman standing behind a white table. There is a large screen behind them. There are buildings on the screen. The man is wearing a white shirt and a tie. 
202.jpg,There are people standing in front of a building. There is a light on the roof of the building. The people are wearing shorts and shirts. 
203.jpg,There are two people standing in front of a building. There is a red light coming off of the building. The sky is dark behind them.
204.jpg,A red truck is parked outside. There are people standing in front of the truck. There is a large tree next to the red truck. 
205.jpg,There are people standing in a room. There is a man in a blue shirt and shorts standing in front of him. There are other people standing around him. 
206.jpg,There are people standing in front of a building. There is a bright orange light coming from the building. The people are standing in a dark room. 
207.jpg,Two people are standing in front of a fire. The fire is bright and yellow. There is a white light hanging from the ceiling. 
208.jpg,Two people are standing in front of a building that is on fire. The fire is bright orange and yellow. There is a large crack in the wall of the building. 
209.jpg,A man is standing in a dark room. He is wearing a white shirt. There is a large white building behind him. There are red lights on the building. 
210.jpg,There are people standing on a stage. There is a large light behind them. There are people in front of the stage with their hands up in the air.
211.jpg,A man in a green shirt and blue pants is standing on a stage. There are people standing in front of him. There is a white light behind him. 
212.jpg,A man and a woman are standing behind a news desk. The desk is white and has a red logo on it. The man is wearing a white shirt and a striped tie. The woman is standing behind the desk. There is a large screen behind them. There are buildings on the screen. 
213.jpg,A man and a woman are standing behind a news desk. The desk is white and has a red logo on it. The man is wearing a white shirt and tie and is holding a tablet in his hands. The woman is standing behind the desk wearing a floral dress. There is a large screen behind them. There are many tall buildings on the screen.
214.jpg,"The image is dark. The background is completely black. At the top right corner of the image there is a watermark that reads ""HTTV9 HD 06:59:50""."
