frame,caption
270.jpg,"Two men are sitting at a table. The man on the right is wearing a green camouflage shirt. He is writing on a piece of paper with a purple pen. He has short black hair. The other man is sitting in front of him with his arms crossed. He wears a white, pink, and black polo shirt. The wall behind them is white. There is a large screen on the wall."
271.jpg,Four people are standing in front of a white car. Two of the people are wearing uniforms. There is a building behind them with lights on. 
272.jpg,Two men are sitting at a table. One of the men is wearing a white and red shirt. There is a large black screen on the wall behind them. 
273.jpg,"Two men are sitting at a table. The man on the right is wearing a green camouflage shirt. He has short black hair. He is sitting in front of a white wall. On the left is a man wearing a white, black, and pink shirt. His arms are crossed over his chest. A green window is on the wall behind the man."
274.jpg,Two men are sitting at a brown table. The man on the right is wearing a green camouflage shirt. He is writing on a piece of paper with a pen in his hand. He has short dark hair. The other man is wearing an orange and white striped shirt. His arms are crossed over his chest. The walls of the room are white.
275.jpg,A red and white graphic is shown. There is a large red stripe on the right side of the image. There are dots on the bottom of the red stripe. The dots are small and white. 
276.jpg,The image is a graphic design. The background is red and white. The design is made up of dots. The dots are small and bright red. There is a diagonal white and black striped pattern. In the center of the design is the number 6. The numbers are red and silver. The letters are bold and stand out against the red background.
277.jpg,A man in a white shirt and black pants is standing on a red carpet. There is a large screen behind the man. There are buildings on the screen. 
278.jpg,There are several people sitting at a long table. There is a large blue wall behind them with flags on it. There are laptops on the table in front of them. 
279.jpg,"Three men are sitting at a table in front of a large blue wall that has the word ""FIFA"" on it. All of the men are wearing suits and ties. The man in the middle is wearing a suit and tie and is shaking hands with the man on the right. There is a flag on the wall behind them."
280.jpg,A bald man is standing in front of a wall that says FIFA on it. He is wearing a black suit with a white shirt and a blue striped tie. The man is looking off to the side with a serious look on his face.
281.jpg,A bald man is standing in front of a wall that has the word FIFA on it. He is wearing a black suit with a white shirt and a blue striped tie. The man is looking off to the side.
282.jpg,There is a large white building in the distance. There are trees in front of the building with no leaves on them. There is a white van on the street next to the building. 
283.jpg,There are bare trees in front of a building. The building has a large glass window on the side of it. There are clouds in the sky above the building.
284.jpg,The image is a video of a building. The building has large glass windows on the side of it. There is a black door in front of the glass windows. The floor of the building is made of gray tiles.
285.jpg,There are several flags on poles. There are trees behind the flags. There is a blue sky with white clouds in the background. 
286.jpg,There are several flags on poles. There are trees behind the flags. There is a blue flag in front of a white flag. 
287.jpg,"A soccer ball is on a pole. The ball is white, black, and has blue and green on it. There is a large building behind the ball. There are trees next to the pole. "
288.jpg,A man is standing in front of a screen. He is wearing a blue shirt and a black tie. The man is holding a brown book in his hands. There is a large white screen behind the man. 
289.jpg,A man is standing in front of a screen. He is wearing a blue shirt and a black tie. He has glasses on and is holding a book in his hands. There is a picture on the screen behind him.
290.jpg,Aston Villa gia nhap cuoc dua vai barcelona va juvee is the title of the video shown. There are a bunch of people on the mountain getting ready to ski. The mountain is covered in snow. The sky is cloudy and foggy.
291.jpg,There are several people standing on top of a mountain. They are wearing red jackets and black pants. There is snow on the ground around them. 
292.jpg,A man is snowboarding down a hill. He is wearing a white jacket and black pants. The hill has lots of snow on it. There is a red and white sign in front of the man.
293.jpg,A person is standing in front of a purple and white sign. The person is wearing a yellow shirt and black pants. They are holding up a black and white object. 
294.jpg,A woman is standing in front of a purple and white sign. She is wearing a yellow and white shirt and black pants. The woman is holding up a pair of shoes in the air. 
295.jpg,A person is skiing down a snowy hill. There is a mountain behind the person. There are clouds in the sky above the hill. 
296.jpg,A woman is holding up a trophy. She is wearing a hat and sunglasses. There is a sign behind her that says World Tour. There are two people standing in front of her. 
297.jpg,A woman is standing on a stage holding up a trophy. She is wearing a black and white shirt and green sunglasses. There is a large white sign behind her. 
298.jpg,A mountain is covered in snow. There is a large rock on the side of the mountain. There are clouds in the sky. 
299.jpg,A mountain is covered in snow. There are rocks on the side of the mountain. There is a person standing on top of the snow. 
300.jpg,This is an aerial view of a mountain. The mountain is covered in white snow. There are patches of dark green trees scattered throughout the snow. 
301.jpg,A woman is standing in front of a large screen. She is wearing a long dress and heels. There is a man in a blue shirt standing next to her. 
302.jpg,A man and a woman are standing in front of a news desk. The desk is white and has a red logo on it. The man is wearing a blue shirt and tie and is holding a clipboard. The woman is standing behind him wearing a beige dress. There is a large screen behind them that has a city on it and a red sky.
303.jpg,A fire is raging. The smoke is thick and dark black. There is a fire burning at the bottom of the roof of the building. There are several houses surrounding the fire. 
304.jpg,A picture of a house on fire. There is a lot of black smoke coming out of the roof of the house. There are trees in front of the houses. 
305.jpg,There is a large black cloud of smoke in the air. There are buildings in front of the smoke. There is a green roof on one of the buildings. 
306.jpg,A building is on fire. There is a lot of black smoke coming out of the building. There are power lines above the building and a white sign on the front of the store. 
307.jpg,There are several cars and trucks on the street. There are people standing on the sidewalk next to the cars. There is a white building with a red sign on it. 
308.jpg,A fire is raging. There is thick black smoke billowing up into the sky. A bright orange fire is burning on a pole. There are several buildings surrounding the fire. 
309.jpg,There is a lot of black smoke coming from a building. There is a white building in front of the building with a white sign on the front of it. There are power lines above the building.
310.jpg,There are pink flowers on a power pole. There are wires above the pole. The sky behind the power pole is gray. There is a white building behind the flowers. 
311.jpg,There is a building on fire. There is smoke coming out of the building. There are pink flowers on the branches of the tree next to the power lines. 
312.jpg,There is a large cloud of smoke in the sky. There is a white building in front of the building. There are power lines hanging from a pole in the air. The pole has pink flowers on it. 
313.jpg,There is a lot of trash on the ground. There are two black fences in front of the trash. There is black smoke coming out of the fence.
314.jpg,Two men are standing at the top of a gate. The gate is silver and there is a fence next to it. There are bags on the ground in front of the gate. 
315.jpg,There is a lot of debris on the ground. There is black smoke coming out of a building. There are two gates in front of the building.
316.jpg,A man and a woman are standing behind a news desk. The desk is white and has a red and white logo on it. The man is wearing a blue shirt and tie and glasses. He is holding a piece of paper in his hands. The woman is standing behind the desk wearing a patterned dress. There is a large screen behind them.
317.jpg,There are people standing on the side of the road. There are trees next to the street. There is a yellow helmet on the person's head. 
318.jpg,There are people standing on the street. There is a large truck behind them. There are trees on the side of the road. 
319.jpg,There are several people standing on the street. There are motorcycles parked on the side of the street next to the people. There is trees on the hill behind them. 
320.jpg,There is a motorcycle laying on its side on the street. There are people standing on the side of the street next to the motorcycle. There is a large tree on the sidewalk next to them. 
321.jpg,A motorcycle is upside down on the ground. There is dirt and grass next to the motorcycle. There are other motorcycles parked on the side of the street. 
322.jpg,There are several motorcycles and cars on the street. There are people walking on the side of the street next to trees. There is a black car in front of them. 
323.jpg,A soldier is sitting on a motorcycle. He is wearing a helmet and a face mask. There is a large truck behind him. There are trees on the side of the road. 
324.jpg,A motorcycle is laying on its side on the ground. There are two large tires on the motorcycle. There is dirt and grass next to the street. 
325.jpg,A motorcycle is laying on its side on the ground. There are two large tires on the front of the motorcycle. There is dirt and grass on the other side of the road. 
326.jpg,"A picture of a vehicle that has been flipped over on its side. The vehicle is red and white. There is a white license plate on the front of the vehicle. There are green plants on the ground next to the vehicles.  There is writing on the bottom of the picture that says ""KY THUAT: THANH HA - TRUNG ThANH - HOANG VIET - VU HUNG - THU HAI - LY HAN - TRONG THAN""."
327.jpg,There is a large white truck driving on the street. There are two people on bikes in front of the truck. There is a white car behind the truck on the road. 
328.jpg,Two people are standing in front of a large screen. There is a city on the screen behind them. The man is wearing a blue shirt and tie. 
329.jpg,A man and a woman are standing in front of a news desk. The desk is white and has a red logo on it. The man is wearing a blue shirt and black pants. The woman is standing behind the desk wearing a beige top. There is a large screen behind them. There are buildings and a sunset on the screen.
