frame,caption
132.jpg,"The image is of the United States Capitol Building in Washington, D.C. It is a cloudy day. There are trees on the right side of the image with no leaves on them. There is a row of light poles in front of the building on the left side. The words ""Ong Donald Trump thu su so phieu tranh vien thong dang cong hoa"" are written below the image. "
133.jpg,A woman is wearing a green shirt and black glasses. There are bookshelves behind the woman. There is a stack of books on the wall behind her. 
134.jpg,A hand is holding a cell phone in front of a laptop. The laptop is black and has a picture of a man on the screen. The man is wearing a baseball cap. 
135.jpg,A woman is wearing a green shirt and black glasses. There are books on the shelves behind the woman. There is a stack of books on a shelf behind her. 
136.jpg,A man is standing in front of a glass door. He is wearing a black shirt and a face mask. The door has red poles on the sides of it. There is writing on the glass door that is black.
137.jpg,There is a white car parked on the street. There is a silver fence in front of the building. There are many windows on the building and a red sign on the front of it. 
138.jpg,The building is white and has a large window on it. There is blue writing on the window. The writing is in a foreign language. 
139.jpg,A man is sitting at a podium and speaking into a microphone. He is wearing a suit and tie. There is a sign on the podium that says Mr. Shou Chew. There are several men behind him sitting in chairs. There bottles on the table in front of them. 
140.jpg,Two men are standing behind a podium. They are wearing suits and ties. There is a man standing behind them wearing a suit and tie. The podium has a name plate on it that says Mr. Cotton. 
141.jpg,A man is standing behind a podium and speaking into a microphone. He is wearing a suit and tie. There is a sign on the front of the podium that says Mr. Shou Chew. There are several people behind him standing in front of him. 
142.jpg,"The background of the screen is dark blue. In the center of the picture there is a colorful logo of a music note. The music note is pink, blue, green, and purple. At the top right corner there is the time and the time as 18:39:54. Below the logo there is text in different languages."
143.jpg,A woman is standing in front of a screen. She is wearing a white shirt and a white skirt. She has long dark hair. The woman is holding a red object in her hands. There is a large white screen behind the woman. 
144.jpg,A woman is standing in front of a red and orange background. She is wearing a white long sleeve shirt and a white skirt. She has long dark hair and is holding a red book in her hands. There is a picture on the screen behind her.
145.jpg,A woman is standing in front of a screen. She is wearing a white shirt and has long black hair. There is a large cloud of smoke behind her.
146.jpg,There is a large cloud of white smoke rising from the water. There are small rocks in the water next to the smoke. There is a red and white sign in front of the water with writing on it.
147.jpg,There is a large cloud of smoke in the sky. There is a building in front of the smoke. There are trees surrounding the building.
148.jpg,A picture of a fire is being shown. There is a lot of smoke coming out of a building. The fire is bright orange and yellow. There are large white clouds in the sky.
149.jpg,A large fire is burning on a street. There is thick black smoke billowing up into the sky. The fire is bright yellow and orange. A street light is standing in front of the fire.
150.jpg,There is a large cloud of smoke in the sky. There is a light on a pole next to the smoke. There are mountains in front of the light.
151.jpg,There is a large fire on the ground. There is thick black smoke coming out of the fire. The fire is bright yellow and orange. 
152.jpg,A rocket is being launched from a launch pad. There is a lot of white smoke coming out of the rocket. There are two towers surrounding the launch pad that the rocket is on.
153.jpg,A rocket is being launched. There is a lot of smoke coming out of the rocket. There are two towers in front of the launch. 
154.jpg,A woman is standing in front of a red and orange background. She is wearing a white long sleeve shirt and white bottoms. She has long dark hair that is pulled back in a ponytail. The woman is holding a red folder in her hands. There is a large white screen behind the woman. The screen has a red logo on it.
155.jpg,A woman is standing in front of a red background. She is wearing a white shirt and has long black hair. The woman is holding a red book in her hands. There is a screen next to the woman with a picture on it. 
156.jpg,There are two cars driving on the street. There are tall buildings on both sides of the street with trees on the sidewalk in front of them. There is a large cloud of smoke in the sky above the cars.
157.jpg,There is a large cloud of smoke in the sky. There are people standing in front of the smoke. There is a red and white sign on the screen.
158.jpg,There are people walking on the sidewalk. There are trees next to the sidewalk with no leaves on them. There is a white pole in front of them. 
159.jpg,There is a tall building with many windows on the side of it. There is a white fence in front of the building. There are two cars parked in the street. 
160.jpg,There is a red tractor in front of a building. There is a lot of smoke coming out of the building. 
161.jpg,There is a black car on the ground. There is a large orange forklift next to the car. There are buildings behind the forklift. 
162.jpg,There are two people standing in front of a building. They are wearing black jackets and red and yellow helmets. There is smoke coming out of the building. 
163.jpg,A man is standing in front of a city skyline. He is wearing a blue shirt and a black and white tie. He has short dark hair and glasses on. The sky behind him is orange and red.
164.jpg,A man is standing in front of a city skyline. He is wearing a blue shirt and a striped tie. He has glasses on and has short dark hair. The sky behind him is orange and red.
165.jpg,A man is wearing a white t-shirt and wearing a virtual reality headset. He is standing in front of a white table. On top of the table is a white robot. The wall behind the man is black.
166.jpg,Five people are standing in a line in a dark room. They are all wearing dark clothes. There is a white wall behind them. The floor in front of them is black. 
167.jpg,A black screen with green writing on it. There is a red and white logo on the top right corner of the screen. There are white words under the green writing.
168.jpg,A man is standing in front of a black wall. He is wearing a white shirt and has a headset on his head. The headset is black and has wires hanging from it. The man is holding a white remote in his hand. There is a microphone stand next to the man. 
169.jpg,A woman is wearing a red shirt and black pants. She is sitting in front of a white table. There is a black head set on her head. The woman is holding a white object in her hand. 
170.jpg,A woman is wearing a red shirt and black pants. She is sitting in a chair in front of a white table. She has a virtual reality headset on her head. There is a silver robot sitting on top of the table. 
171.jpg,There are five people standing in a room. They are all wearing black suits. There is a white wall behind them. There are lights on the ceiling above them. 
172.jpg,A woman is standing in front of a screen. She is wearing a white shirt and a white skirt. She has long dark hair. The woman is holding a red purse. There is a picture on the screen behind the woman. 
173.jpg,A woman is standing in front of a screen. She is wearing a white dress and has long black hair. She has a microphone clipped to her shirt. She appears to be holding a red folder in her hand. There is a large picture on the screen behind her. The picture is of a city with tall buildings and a bright yellow sky.
174.jpg,A woman is standing in front of a red and orange background. She is wearing a white long sleeve shirt and a white skirt. The woman has long dark hair that is pulled back in a ponytail. She has a microphone clipped to her shirt. The women is holding a red wallet in her left hand. There is a large picture of a city on the right of the woman.
175.jpg,Someone is holding a phone in their hand. There is a picture of a bowl of food on the screen of the phone. The phone is black and the person is wearing a black shirt. 
176.jpg,A person is holding a phone in their hand. The phone is black and has a white screen on it. The person is pointing at the screen of the phone. There is a red and white sign in front of the person.
177.jpg,There is a woman standing in a room. There is a white desk in front of her with a computer on top of it. The woman is wearing a black shirt and has dark hair. 
178.jpg,A woman is sitting in a room. She is wearing a black sweater. There is a table in front of her with a bottle and other items on it. 
179.jpg,A woman with dark curly hair is sitting in a chair. She is wearing a black shirt. There is a white wall behind her with a window on it. 
180.jpg,A person is holding a cell phone in their hand. The phone is black and has a white screen on it. There is a text message on the screen. The person is touching the screen with their thumb.
181.jpg,A woman is shown on a video call. She is wearing a purple shirt and purple glasses. There is a white couch behind her. 
182.jpg,A woman is shown on a video call. She is wearing pink glasses and a pink shirt. There is a white couch behind her. 
183.jpg,"A computer screen is showing a message that says ""Messaging Notifications"". There is a black icon of a briefcase and a hand pointing at it. There are several other icons on the screen. "
184.jpg,A person's hands are typing on a black keyboard. The keyboard is sitting on top of a white table. There is a black mouse pad on the table next to the keyboard. 
185.jpg,"The image is a screenshot of a video. There is a picture of a woman in the middle of the screen. The woman has dark hair and is wearing a white headband. There are three white boxes on the screen with text in them. The first box says ""Good morning, Kevin!"" and the second box has the text ""Do you have any plans for to""."
186.jpg,A woman is holding a black phone in her hands. She has long dark hair and is wearing a black suit. There is a white wall behind the woman. 
187.jpg,A person's hand is on a keyboard. The keyboard is black and has red lights on it. There is a monitor in front of the keyboard. 
188.jpg,A black and white photo of a person's hand on a keyboard. The keyboard is black and silver. There is a white wall behind the keyboard. 
189.jpg,A picture of a man in a suit sitting at a table. There is a white phone in front of the man. The man is bald. 
190.jpg,"The image is a graphic design. The background is red and white. There are dots on the red background. The number 6 is in the middle of the design. There is a book on the left side of the number 6. The book is red. The word ""glay"" is written on the right side. The numbers are in a bold red color."
191.jpg,There are several signs on a pole. There is a red light next to the sign. There are people walking on the street under the signs. 
192.jpg,There are several motorcycles parked in front of a building. There are people standing around the motorcycles. There is a large white building behind them with a gate on the entrance. 
193.jpg,There is a small white building with a red roof. There are people standing in front of the building. There is a blue sign on the side of a building. 
194.jpg,Three men are sitting at a brown desk. Two of the men are wearing green uniforms. The other man is wearing a brown shirt and blue pants. There is a red stool in front of the desk. 
195.jpg,"A black object has a black label on it. The label has white letters on it and says ""Direct-current ultrahigh voltage"". The object has two metal caps on it's top. The object is sitting on a red surface. There is a black plastic bag next to the object."
196.jpg,Three men are standing in a room. They are wearing green uniforms. One of the men is wearing a white face mask on his face. The other two men are holding a white box in their hands. There is a large window behind them. 
197.jpg,The image is a graphic. The background is red and white. There is a big gray circle in the middle of the graphic. There are small dots on the red background. The numbers on the gray circle are also in the same gray color.
198.jpg,A woman is standing in front of a screen. She is wearing a white dress and has long dark hair. The woman is holding a red object in her hands. There is a picture on the screen behind the woman. 
199.jpg,A woman is standing in front of a red and orange background. She is wearing a white long sleeve shirt and white bottoms. She has long dark hair that is pulled back in a ponytail. The woman is holding a red wallet in her hands. There is a large picture on the right of the woman. The picture is of a city with tall buildings and a bright orange sky.
200.jpg,There are several signs on the street. There is a red light on a pole next to the signs. There are trees next to a building. 
201.jpg,There are several motorcycles parked in front of a building. There are people standing around the motorcycles. They are all wearing helmets on their heads. 
202.jpg,There are several motorcycles parked in front of a building. There is a white van on the street. There are trees behind the building. 
203.jpg,There are several people riding motorcycles on the street. There is a red building next to the street with a sign on it. There are trees next to them. 
204.jpg,There are several motorcycles on the street. There are people standing next to the motorcycles. There is a white building behind them. 
205.jpg,There are several cars and motorcycles on the street. There are people standing on the sidewalk next to the cars. There is a green car in front of the motorcycles. 
206.jpg,There are people standing on the street. There are tall buildings behind them. All of the people have helmets on their heads. There is a man in a yellow shirt carrying a brown bag. 
207.jpg,Two men are walking across the street. They are both wearing white shirts and black pants. There are red and white barriers on the street in front of them. There is a building behind them. 
208.jpg,There are several people riding motorcycles on the street. There is a building behind them with a red awning on it. There are trees next to the building. 
209.jpg,There is a white car parked in front of a building. There are several motorcycles and people on the street next to the car. There is a red and white building behind them. 
210.jpg,Two people are wearing face masks. They are standing next to a red scooter. There is a white scooter behind them. 
211.jpg,There are several people sitting on a red motorcycle. There is a man in a purple jacket wearing a red helmet and a white face mask. There are people standing behind him wearing helmets. 
212.jpg,A man is standing in front of a cityscape. He is wearing a blue collared shirt and a striped tie. He has short dark hair and glasses on. The sky behind him is orange and red. There are tall buildings in the background.
213.jpg,A man is standing in front of a city skyline. He is wearing a blue shirt and a striped tie. He has glasses on and has short dark hair. The sky behind him is orange and yellow.
214.jpg,There is a white car on the street. There is a red and blue light on top of the car. There are large trucks on the road next to the white car. 
215.jpg,A large white truck is driving on the road. There is a large white building behind the truck. There are trees on the side of the road next to the building. 
216.jpg,A motorcycle is laying on its side on the street. There is a gray wall next to the motorcycle. The motorcycle is black and has a black tire on it. 
217.jpg,There is a large truck driving on the street. There is a silver fence on the side of the street next to the truck. There are people walking on the sidewalk next to them. 
218.jpg,A motorcycle is laying on its side on the street. There are pieces of trash all around the motorcycle. There is a gray wall next to the motorcycle on the sidewalk. 
219.jpg,There is a large truck driving on the street. There is a motorcycle laying on the ground in front of the truck. There are trees on the side of the road next to the street behind the motorcycle. 
220.jpg,There are several motorcycles and trucks driving on the street. There is a silver fence on the side of the street next to the motorcycles. There are tall light poles on the sidewalk. 
221.jpg,There are several trucks driving on a road. There is a silver fence on the side of the street. There are several motorcycles on the street in front of the trucks. 
222.jpg,There are several cars and trucks on the street. There is a white car in front of the trucks. There are people on motorcycles next to the cars. 
223.jpg,A woman is standing in front of a red background. She is wearing a white dress and has long black hair. The woman is holding a red object in her hands. There is a large picture on the wall behind the woman. The picture is of a city with tall buildings and a bright yellow sky.
224.jpg,A woman is standing in front of a red background. She is wearing a white shirt and a white skirt. She has long dark hair that is blowing in the wind. The woman is holding a red object in her hands. There is a large picture on the right of the woman. The picture is of a city with tall buildings and a bright yellow sky.
225.jpg,There are three men standing inside of a car. They are wearing face masks on their faces. There is a black steering wheel in front of them. 
226.jpg,A person is standing next to a brown box. They are wearing black pants and black sandals. There is another brown box in front of them. 
227.jpg,Four men in green uniforms are standing around boxes. They are wearing face masks on their faces. One of the men is holding a rifle in his hand. There is a white car behind them. 
228.jpg,Four men are standing outside of a white car. They are wearing green uniforms and green hats. All of the men are wearing face masks on their faces. One of them is holding a rifle in his hands. Another man is bending over a table that is in front of him. There are boxes on top of the table. A large potted plant with purple flowers is sitting on the side of the building.
229.jpg,There are three men in uniform standing in front of a white wall. They are wearing green hats and face masks. There is a man in a brown jacket sitting at a table. 
230.jpg,There are three men standing in front of a white wall. They are wearing green uniforms and green hats. They have face masks on their faces. One of the men is holding a gun in his hand. 
231.jpg,There is a clear water bottle with a silver faucet attached to it. There is a plastic bag next to the bottle. 
232.jpg,A man is standing in front of a city skyline. He is wearing a blue shirt and a striped tie. He has glasses on and has short dark hair. There is a red sky behind the man.
233.jpg,A man is standing in front of a city skyline. He is wearing a blue shirt and a tie. He has glasses on and has short dark hair. There is a red sky behind the man.
234.jpg,There are three men sitting at a table. The men are wearing green uniforms. There is a window on the wall behind them. The man in the middle is writing on a piece of paper. 
235.jpg,A black box is sitting on a table. There is a white tag on the front of the box. The tag has a barcode on it. 
236.jpg,A black object is sitting on a red surface. There is a black plastic bag next to the object. The object has a black label on it with white writing. There are two small holes on the top of the device.
237.jpg,There are two people sitting at a table. There is a man wearing a white face mask on his face. He is writing on a piece of paper that is on the table in front of him. 
238.jpg,A person's hand is writing on a paper. The paper is on top of a black table. The person is holding a blue pen. There are words written on the top and bottom of the paper. 
239.jpg,A person is writing on a sheet of lined paper. There are two hands holding a blue pen. There is a black table under the paper. 
240.jpg,There are two people sitting at a table. They are wearing green uniforms. There is a black bag on a yellow chair in front of them. The man in the green uniform is holding a bottle in his hand. 
241.jpg,There are two men sitting at a table. They are wearing green uniforms. There is a window on the wall behind them. The man sitting in front of the table is wearing a face mask. 
242.jpg,Three men are standing in a room. Two of the men are wearing green uniforms. The other man is wearing a brown shirt and a white face mask. There is a desk in front of them with papers on top of it. 
243.jpg,A woman is standing in front of a red and orange background. She is wearing a white shirt and a white skirt. She has long black hair that is styled in a ponytail. The woman is holding a red folder in her hands. There is a large picture on the right of the woman. The picture is of a city with tall buildings and a large red and yellow logo on it.
244.jpg,A woman is standing in front of a screen. She is wearing a white shirt and has long black hair. The woman is holding a red book in her hands. There is a picture on the screen behind the woman. 
245.jpg,A woman is standing in front of a screen. She is wearing a short sleeve shirt and a white skirt. She has long dark hair. The woman is holding a red book in her hands. There is a large picture on the screen behind the woman. 
246.jpg,A man in a green shirt is sitting at a brown table. There is a desk behind him with a computer on it. There are papers and a fan on the desk. 
247.jpg,A man in a green shirt is sitting in a chair. There is a desk in front of him with a computer on it. There are stacks of papers on top of the desk. 
248.jpg,A man is wearing a green uniform. There is a white poster on the wall behind the man. The man has short black hair. 
249.jpg,A man in a green uniform is sitting at a table. There are blue boxes on the table in front of him. There is a white board on the wall behind him. 
250.jpg,A man in a green uniform is sitting at a brown desk. He is holding a white piece of paper in his hands. There is another man sitting in a brown shirt in front of him. There are stacks of files behind the man in the green uniform. 
251.jpg,A man in a green uniform is sitting at a desk. There is a white board behind him on the wall. There are papers pinned to the board. 
252.jpg,There is a man sitting on a brown chair. There is a white window behind the man. The man has black hair and is wearing a brown shirt. 
253.jpg,Two men are sitting in an office. The man on the left is wearing a green uniform. He is sitting at a brown wooden desk. The other man is sitting next to him wearing a brown shirt. There is a computer monitor on a desk in the background. There are stacks of files behind the man in green. A fan is sitting on top of a desk near the computer monitor.
254.jpg,A man in a green shirt is sitting at a brown desk. There are folders and papers on the desk in front of him. There is a computer monitor on a desk behind him. 
255.jpg,A man is standing in front of a city skyline. He is wearing a blue shirt and a striped tie. He has glasses on and has short dark hair. The sky behind him is orange and red.
256.jpg,A man is standing in front of a city skyline. He is wearing a blue collared shirt and a striped tie. He has short black hair and glasses on. The sky behind him is orange and red.
257.jpg,A man is sitting in a vehicle. He is wearing a gray jacket. The man has short black hair. There is a window behind the man. 
258.jpg,A man is riding a motorcycle in a gas station. The gas pumps are lined up in front of him. There is a red bag on the ground next to him. 
259.jpg,There is a motorcycle parked on the ground. There is a person standing next to the motorcycle. There are several boxes behind the motorcycle on the floor. 
260.jpg,A picture of a man riding a motorcycle. There is a red stool in front of the man. There are pictures on the wall behind the motorcycle. 
261.jpg,Two men are sitting at a table. One of the men is wearing a green uniform. There is a black laptop on the table in front of them. There are large cabinets behind the men. 
262.jpg,Two men are sitting at a table. The man on the right is wearing a green uniform. There is a black laptop on the table in front of him. There are several lockers behind the men. 
263.jpg,There are several stacks of money on a table. There are several bills on top of each other. There is a white envelope on the table next to the money. 
264.jpg,A black object is laying on the ground. There are leaves and sticks around the object. There is a small green plant next to the black object. 
265.jpg,The image is of a motorcycle. It is a Honda brand. The motorcycle is black and brown. It has two headlight on the front and one on the back. It also has a kickstand on the left side. The bike is parked on a concrete floor. The headlights are clear. The date and time of the image is 18:50:42.
266.jpg,There are two men sitting at a table. There is a black laptop on the table in front of them. The man on the right is wearing a green shirt. There are cabinets behind them. 
267.jpg,A woman is standing in front of a red background. She is wearing a white dress and has long dark hair. The woman is holding a red object in her hands. There is a large picture on the wall behind the woman. The picture is of a city with tall buildings and a bright yellow sky.
