frame,caption
268.jpg,A woman is standing in front of a red background. She is wearing a white shirt and a white skirt. She has long dark hair. The woman is holding a red object in her hands. There is a large picture on the wall behind the woman. The picture has a city on it. There are many buildings in the picture. 
269.jpg,There is a car driving on the street. There is a lot of smoke coming out of a building. There are people standing on the sidewalk next to the car.
270.jpg,There is a large truck on fire. There is black smoke coming out of the back of the truck. There are people standing in front of the fire. 
271.jpg,There are several motorcycles parked in a row. There is a large black cloud of smoke coming out of a fire. There are people standing in front of the fire.
272.jpg,There is a large screen on fire. There is a lot of smoke coming out of the screen. There are people standing around the screen on motorcycles. 
273.jpg,Three men in green uniforms are standing on a wet sidewalk. They are holding a long white hose. There is a large building behind them. There are trees on the sidewalk next to the men. 
274.jpg,Two men in green uniforms are standing on a wet street. They are holding a long white hose. There is a large red truck on the street in front of them. There are street lights on the sidewalk next to the truck. 
275.jpg,A man in a green uniform is standing on a street. There are large hoses on the ground in front of him. There is smoke coming off of a building. 
276.jpg,A red truck is driving on the street. There is a tree next to the truck. There are people standing in front of the truck on the sidewalk. 
277.jpg,There is a large truck that is on fire. There is smoke coming out of the back of the truck. There are people standing in front of the pile of trash. They are wearing blue uniforms and red helmets. 
278.jpg,There are people standing around a pile of trash. There is a large truck behind them. There are trees next to the trash. 
279.jpg,A truck is parked on the side of the road. There is a pile of trash in front of the truck. There are men in uniform standing in the truck door. 
280.jpg,A woman is standing in front of a large screen. She is wearing a long white dress and a purple shirt. The screen behind her has a city on it with tall buildings. There is a red carpet on the floor under the screen. 
281.jpg,A man and a woman are standing in front of a news desk. The desk is white and has a red logo on it. The man is wearing a blue shirt and tie and glasses. The woman has long black hair and a white shirt. There is a large screen behind them.
282.jpg,A man and a woman are standing behind a news desk. The desk is white and has a red logo on it. The man is wearing a blue shirt and tie and is looking at his phone. The woman is wearing purple and has long black hair. There is a large screen behind them that shows a city with tall buildings and a red sky.
