frame,caption
273.jpg,A woman is standing in front of a white wall. There is a picture hanging on the wall behind the woman. The woman is wearing a black jacket and a white shirt. There are flowers hanging from the wall. 
274.jpg,There is a woman standing in front of a white wall. There is a picture hanging on the wall behind the woman. The woman has long brown hair and is wearing a black jacket. 
275.jpg,"A purple heart is in the middle of a circle. Around the heart are words in different languages. There is a small logo in the top right corner that says ""HTV9 HD""."
276.jpg,There is a woman standing in front of a white wall. There is a picture hanging on the wall behind the woman. The woman is wearing a black jacket and a white shirt. There are flowers hanging from the wall.
277.jpg,There are two paintings hanging on the wall. One of the paintings has flowers on it. The other painting is a picture frame. The frame is gold in color. The wall is white.
278.jpg,"The image is a painting of flowers. The flowers are pink and purple in color. The painting is very messy. There are words written on the bottom of the image in a foreign language. There is also a watermark in the top right corner that says ""HTV9 HD 06:51:57""."
279.jpg,A man and a woman are standing in front of a white wall. There is a picture hanging on the wall behind them. The man is wearing a blue shirt. 
280.jpg,A man is standing in front of a large screen. He is wearing a gray shirt and a striped tie. The man is holding a tablet in his hands. 
281.jpg,A man is standing in front of a large screen. He is wearing a gray shirt and a striped tie. There is a soccer field on the screen behind him. There are people playing soccer on the field.
282.jpg,A man is standing in front of a large screen. He is wearing a long sleeve shirt and a tie. The man is holding a tablet in his hands. There is a picture on the screen behind the man. 
283.jpg,A soccer game is being played on a TV screen. There are several players on the field. They are wearing white and blue uniforms. There is a goal post on the side of the field that is white. 
284.jpg,Three men are wearing blue and yellow jerseys. They are hugging each other and are smiling. There is a red banner in front of them with white writing on it.
285.jpg,A soccer game is being played. There are several players on the field. One of the players is wearing a blue uniform and is kicking a white soccer ball. There is a man in a yellow uniform standing in front of them. 
286.jpg,A soccer game is being played in a stadium. There are many people in the stands watching the game. The field is green with white lines on it. 
287.jpg,There are several soccer players on a field. They are wearing white and blue uniforms. There are white lines on the field. There is a large crowd sitting in the stands behind the players. 
288.jpg,A man is standing on a soccer field. He is wearing a white jersey and white shorts. The number 21 is on the back of the jersey. The man has short black hair. The field is green with white painted lines on it. There is a goal post on the field.
289.jpg,A soccer game is being played. There are several players on the field. They are wearing white and blue uniforms. There is a crowd of people sitting in the stands watching the game. 
290.jpg,A soccer game is being played on a TV screen. There are several players on the field. There is a white soccer ball on the ground. A man in a red shirt is kicking the ball towards the goal. 
291.jpg,A soccer game is being played. There are several players on the field. They are wearing blue and white uniforms. There is a man in a red shirt running towards the goal. 
292.jpg,Athletes are running on a soccer field. They are wearing white uniforms. There is a large white goal behind them. There are people in the stands watching them. 
293.jpg,This is a soccer game. The players are wearing white uniforms. There is a large white goal in front of the players. There are people in the stands watching the game. 
294.jpg,A crowd of people are cheering. They are wearing white and green shirts. There are flags in the crowd. There is a sign on the front of the crowd that says IRAN. 
295.jpg,A crowd of people are cheering and waving their hands in the air. They are all wearing white shirts with red and green stripes on them. Some of the people are wearing white hats. There is a man in a gray jacket standing in the crowd. 
296.jpg,A woman is standing in front of a screen. She is wearing a blue shirt and a white skirt. The woman is holding a small brown purse. There is a picture on the screen next to the woman. 
297.jpg,A woman is standing in front of a screen. She is wearing a blue shirt and a white skirt. The woman is holding a brown object in her hands. There is a picture on the screen next to the woman. 
298.jpg,A soccer game is being played. There are several players on the field. They are wearing white and red uniforms. There is a crowd of people sitting in the stands watching the game. 
299.jpg,A soccer game is being played on a TV screen. There are several players on the field. They are wearing white and red uniforms. There is a crowd of people sitting in the stands watching the game. 
300.jpg,Three men are wearing red jerseys. They are standing in front of a blue wall. There are people standing in the stands behind them. 
301.jpg,A soccer game is being played on a TV screen. There are several players on the field. They are wearing white and red uniforms. There is a white soccer ball in the air. 
302.jpg,Two teams are playing a match on a soccer field. The field is green with white lines on it. There are several players on the field wearing white and red uniforms. There is a scoreboard on the side of the field. 
303.jpg,A soccer game is being played in a large stadium. The field is green with white lines on it. There are several players on the field wearing white and red uniforms. The stands surrounding the field are filled with spectators.
304.jpg,A soccer game is being played in a stadium. The field is green with white lines on it. There are several players on the field wearing white and red uniforms. The stands surrounding the field are filled with spectators.
305.jpg,This is a soccer game. The players are on a green field. There are white lines on the field. The stands are filled with people. One of the players is wearing a yellow uniform. 
306.jpg,"Two soccer players are running towards a soccer ball. One of the players is wearing a white uniform with the number 9 on it. The other player, wearing a red uniform, is running towards the ball. There is a large crowd of people sitting in the stands watching the game. There are advertisements on the side of the field."
307.jpg,There are several men standing in a circle. They are wearing pink shirts and white vests. There is a man in a black shirt standing in front of them. 
308.jpg,A soccer game is being played on a TV screen. There are several players on the field. One of the players is wearing a white uniform. There is a white soccer ball on the ground in front of them. A man in a yellow uniform is walking towards the goal. 
309.jpg,A soccer game is being played on a TV screen. There are several players on the field. One of the players is wearing a yellow uniform. There is a white goal in front of them. 
310.jpg,There is a large crowd of people in a stadium. There are flags in the crowd. The flags are red and white. There is writing on the bottom of the screen. 
311.jpg,There is a man covering his face with his hands. He is wearing a black and white striped shirt and a black hat. There is a person standing behind him wearing a white shirt. There are green and white flags around them.
312.jpg,There are several soccer players standing on a field. There is a large crowd of people sitting in the stands behind them. The players are wearing blue and white uniforms. 
313.jpg,A man and a woman are standing in front of a large screen. They are both dressed in business attire. The woman is wearing a blue blazer and white pants. The man is dressed in a suit and tie. He is holding a tablet in his hands. The screen behind them has a cityscape on it. There are clouds in the sky. 
314.jpg,A man and a woman are standing behind a news desk. The desk is white and has a red logo on it. There is a large screen behind them. There are buildings on the screen. 
315.jpg,A picture of a building being demolished. The picture is black and white. There is a crane hook in the picture. The crane hook is red. The building that is demolished is white and gray. There are many pieces of rubble on the ground.
316.jpg,A picture of a building being demolished. There is a crane lifting the building off of the ground. The sky above the building is gray. There are many wires hanging from the crane. 
317.jpg,A building is being demolished. There is a crane lifting a car off of the building. There are rubble and debris on the ground. 
318.jpg,A man and a woman are standing behind a news desk. The desk is white and has a red logo on it. The man and woman are dressed in business attire. The woman is wearing a light blue blazer. Behind the desk is a large screen with a cityscape on it and a cloudy sky.
319.jpg,A man and a woman are standing behind a news desk. The desk is white and has a red logo on it. The man is wearing a suit and tie and is holding a clipboard. The woman is wearing headphones on her ears. There is a large screen behind them. There are many tall buildings on the screen.
320.jpg,A man and a woman are standing behind a desk. The desk is white and has a red logo on it. There is a large screen behind them. There are buildings on the screen. 
321.jpg,A man and a woman are standing behind a news desk. The desk is white and has a red logo on it. There is a large screen behind them. There are buildings on the screen. 
