frame,caption
140.jpg,A man is wearing a blue striped shirt and a tie. He is holding a tablet in his hands. There are tall buildings behind him. There is a yellow sky behind the man. 
141.jpg,A man is standing in front of a city skyline. He is wearing a blue striped shirt and a striped tie. He has glasses on and is holding a tablet in his hands. The sky behind him is orange and yellow. 
142.jpg,A motorcycle is laying on its side on the ground. There is a tire next to the motorcycle. The motorcycle is red in color. 
143.jpg,There is a large white bus on the street. There are several cars behind the bus. There is a white building next to the street with lights on it. 
144.jpg,There are two motorcycles driving on the street. There is a white fence behind the motorcycles. There are lights on the motorcycle in front of the fence.
145.jpg,There are several cars driving on the street. There are lights on the front of the cars. There is a crowd of people standing on the side of the street next to motorcycles. 
146.jpg,People are standing on the side of the road at night. There is a large truck driving on the road. There are street lights on the sidewalk next to the street. 
147.jpg,"The background of the screen is red. The screen has a bright red color on it. There are small white dots on the screen. There is a small white logo in the top right corner that says ""HTV9 HD"". There are words written in the bottom left and bottom right corners that say ""Tho Nhi Ky cung cang may bay khong nguyai lai cho Ai Cap""."
148.jpg,There are several motorcycles driving down the street. There is a red flag on a pole in front of the motorcycles. There are trees and bushes on the side of the street next to the motorcycle. 
149.jpg,There are several motorcycles on the street. There are people standing next to the motorcycles. There is a red flag on a pole next to them. 
150.jpg,"The image is of a motorcycle. The motorcycle is black and white. It has the word ""Citi"" written on the side of it in white letters. There is a small mirror on the left side of the motorcycle. It also has a kickstand on the right side. The wheels are black and the tires are thick and rubber. It is parked on a paved road. "
151.jpg,A motorcycle is laying on its side on the road. The motorcycle has a white license plate on the back of it. There is a large tire on the front of the motorcycle. 
152.jpg,A red and black scooter is parked on the street. There is a blue helmet on top of the seat of the scooter. The street is gray and has grass on the side of it. 
153.jpg,There are several people standing on the side of the street. There is a white motorcycle on the ground in front of them. There are two red flags hanging from a pole next to them. 
154.jpg,There are people standing on the side of the street. There are motorcycles parked next to the people. There is a red flag hanging from a pole in front of them. 
155.jpg,There is a black shoe on the ground. There are small plants around the shoe. There is grass around the shoes. 
156.jpg,A woman is standing in front of a screen. She is wearing a yellow shirt and black pants. The woman is holding a tablet in her hands. There is a picture on the screen behind the woman. 
157.jpg,There are several people riding motorcycles on the street. There is a white van behind them. There are trees next to the street in front of the van.
158.jpg,Two men are walking down a sidewalk at night. They are both wearing dark colored pants and dark shoes. There is a tall gray pole in front of them. There are chairs on the sidewalk next to them. 
159.jpg,The image is a screenshot from a video. The background is completely black. There is a plant on the left side of the image. The plant has green leaves and stems. There are grates on the ground in front of the plant. The grates are dark brown in color and appear to be made of metal. The image has a blurred effect. The time and date of the video is 06:41:56.
160.jpg,There is a boat in the water. There are people standing on the deck of the boat. There is lights on the top of the deck. 
161.jpg,There are people standing on a pier. There is water next to the pier. The sky above the water is dark. There are bright lights above the people. 
162.jpg,Five people are standing on a platform next to a body of water. They are all wearing blue scrubs and masks on their faces. There is a man sitting on a bench in front of them. 
163.jpg,There is a motorcycle parked in front of a fence. There is a yellow tape around the motorcycle. There are lights behind the fence. 
164.jpg,There is a man wearing a blue suit and carrying a large blue bag. He is wearing a face mask on his face. There is water next to the man. 
165.jpg,There are people standing on the sidewalk. There is a red chair in front of a building. There are two people wearing blue suits. 
166.jpg,There are several cars on the street. There are people on bikes next to the cars. There is a man in a blue shirt standing on the side of the road. 
167.jpg,A man is wearing a blue striped shirt and a striped tie. He is holding a tablet in his hands. There are tall buildings behind the man. There is a cloudy sky above the buildings.
168.jpg,There is a small blue boat on the water. There are trees around the boat. There is a man in a green shirt walking next to the blue boat. 
169.jpg,There is a small blue boat on the water. There are two men standing next to the boat. One of the men is wearing a blue shirt and is taking a picture of the other man. 
170.jpg,A man is wearing a blue shirt. There are people standing in front of him. There is a small boat on the ground next to the people. 
171.jpg,There are several men standing in a field of tall green grass. One of the men is wearing a green shirt and green pants. There is a man in a blue shirt standing in front of him. 
172.jpg,There are several men standing in a field. There is tall green grass in front of them. One of the men is wearing a green pants and a blue shirt. 
173.jpg,There are people standing around a person laying on the ground. There is tall grass next to them. There are two men in green pants bent over over the person laying down. 
174.jpg,There are people standing in a field. There is tall green grass in front of them. There are men in green pants and a white shirt. 
175.jpg,There are people standing in a field. There is tall green grass in front of them. There are men in green pants and a white shirt. 
176.jpg,The image is a digital art piece. The background is black. On the right side of the image there is a red circle with small white dots. In the center of the circle there is an outline of a room with a door and a ladder. The ladder is leaning against the wall. The image has a red tint to it.
177.jpg,A man is wearing black sunglasses and a black shirt. He has headphones on his head. He is holding a microphone in his hand. There is a white wall behind the man.
178.jpg,A man is standing in front of a microphone. He is wearing a black shirt and black pants. There is a blue chair behind him. 
179.jpg,There are several people walking down the street. They are all wearing face masks. There are panda bears in their arms. 
180.jpg,There is a man in a blue suit holding a black and white panda bear. There is a silver door behind the man. 
181.jpg,There are several men standing in a line. They are wearing uniforms and have face masks on. There is a red banner behind them. The men are holding stuffed animals in their hands.
182.jpg,A woman is standing in front of a screen. She is wearing a yellow shirt and a black skirt. The woman is holding a tablet in her hands. There is a large screen behind the woman. 
183.jpg,A woman is standing in front of a screen. She is wearing a yellow shirt and a black skirt. The woman is holding a book in her hands. There is a picture on the screen next to the woman. 
184.jpg,A woman in a yellow shirt and black skirt is standing in front of a screen. She is holding a book in her hands. There is a picture on the screen next to the woman. There are people standing in a room behind them. 
185.jpg,There is a large tree in the middle of a field. There are several buildings behind the tree. There is grass in front of the trees. 
186.jpg,There is a large tree in the middle of a field. There are several buildings behind the tree. There is a red and white sign in front of the trees.
187.jpg,A large cloud of smoke is rising over a field. There are trees in front of the smoke. There is a white building behind the trees. 
188.jpg,There is a lot of rubble on the ground. There are people standing around a large truck. There is smoke coming out of the pile of rubble. 
189.jpg,There are several men walking on the ground. They are wearing yellow hard hats on their heads. There is a man in a blue shirt walking next to them.
190.jpg,There are several people standing in a line. They are wearing bright orange jackets. There is a man in a blue jacket standing in front of them. 
191.jpg,An ambulance is parked outside of a building. There are several people standing in front of the ambulance. There is a man in a brown jacket standing next to the door of the van. 
192.jpg,There are several men standing in a room. One of the men is wearing a striped shirt. There is a man in a black tank top sitting on a bed. 
193.jpg,There are five men standing around a man who is sitting down. He is wearing a white face mask. There is a man in a striped shirt standing next to him. 
194.jpg,A picture of a destroyed building. The building is yellow. There is a pile of rubble and debris on the ground. There are words written in a foreign language on the bottom of the picture. 
195.jpg,There is a lot of cars and trucks on the street. There is a large field next to the street with trees on it. There are people standing in front of the trucks. 
196.jpg,A man is wearing a blue striped shirt and a tie. He is holding a tablet in his hands. There are tall buildings behind him. There is a cloudy sky above the buildings.
197.jpg,A man is standing in front of a city skyline. He is wearing a blue striped shirt and a striped tie. He has glasses on and is holding a piece of paper in his hands. The sky behind him is orange and yellow. 
198.jpg,A man is standing in front of a city skyline. He is wearing a blue striped shirt and a striped tie. He has glasses on and is holding a tablet in his hands. The sky behind him is orange and yellow. There are tall buildings all around him.
199.jpg,A man is standing in front of a microphone. He is wearing a black shirt. There is a desk behind him with a computer on it. There are headphones on the desk. 
200.jpg,A hand is pressing a button on a sound board. The sound board is black and silver. There are black knobs on the board. 
201.jpg,A man is wearing headphones and sunglasses. He is sitting in a blue chair. There is a microphone in front of him. 
202.jpg,A man is wearing headphones and sunglasses. He is sitting in front of a microphone. There is a white wall behind him. 
203.jpg,A person wearing a black sweater is typing on a black laptop. There are wires all around the laptop on a white table. There is a red box next to the laptop. 
204.jpg,A pair of hands are touching a keyboard. The keyboard is black and silver. There are small holes on the keyboard. There is a sticker on the side of the keyboard with a white sticker on it.
205.jpg,A picture of a hand is being shown. The hand is open and the fingers are spread out. There is a white wall behind the hand. There are words written in red on the bottom of the picture.
206.jpg,"The image is a screenshot of a video. It shows a list of songs that have been extended. At the bottom of the image there is a caption that says ""Lan dau tien Nha Trang co pho ban van hoa am thuc 2024""."
207.jpg,A man is standing in a room wearing headphones. He is wearing a black shirt and black sunglasses. There are two lights on the ceiling above the man. There is a blue chair in front of him.
208.jpg,A man is wearing black headphones. He has blue tinted sunglasses on his eyes. He is wearing a black shirt. There is a white wall behind him. 
209.jpg,A man is wearing black headphones. He has blue tinted sunglasses on his eyes. He is wearing a black shirt. There is a white wall behind him. 
210.jpg,A man is wearing black headphones and sunglasses. He is sitting in a blue chair. There is a black desk in front of him. 
211.jpg,A woman is standing in front of a screen. She is wearing a yellow shirt and a black skirt. The woman is holding a tablet in her hands. There is a large screen behind the woman. 
212.jpg,A woman is standing in front of a screen. She is wearing a yellow shirt and a black skirt. The woman is holding a tablet in her hands. There is a picture on the screen next to the woman. 
213.jpg,A group of people are carrying panda bears. They are all wearing face masks. There are trees behind them. There is a man in a uniform holding one of the pandas. 
214.jpg,A man in a blue scrubs is holding a black and white panda bear. There is a silver door behind the man. 
215.jpg,There are panda bears laying on the floor. There are people in blue scrubs standing around them. There is a brown tray on the ground in front of them. 
216.jpg,There are three panda bears sitting on the floor. They are wearing blue surgical gowns and blue gloves. There is a wooden tray in front of them with food on it. 
217.jpg,There is a green stage with a large sign on it. There are panda bears on the stage. There is two red bears on either side of the sign. 
218.jpg,A panda bear is sitting on a green platform. There are boxes on the platform behind the panda. There is grass in front of the platform. 
219.jpg,Three people are wearing blue scrubs and face masks. They are holding stuffed panda bears. There is a blue background behind them. 
220.jpg,A panda bear is sitting on top of three red boxes. There is a red wall behind the panda. There are white flowers on the wall. 
221.jpg,A panda bear is sitting in front of a man. The man is wearing a gray jacket. There is a red flower next to the panda. 
222.jpg,There are two pandas on a stage. The pandas are black and white. One of the pandas is looking at the other panda. There is a colorful toy on the stage. 
223.jpg,There are pandas sitting on a table. There are people sitting next to them wearing face masks. There is a red wall behind them. 
224.jpg,A man is wearing a blue striped shirt and a striped tie. He is holding a tablet in his hands. There are tall buildings behind him. There is a cloudy sky above the buildings.
225.jpg,A man is standing in front of a city skyline. He is wearing a blue striped shirt and a striped tie. He has glasses on and is holding a tablet in his hands. 
226.jpg,A man is standing in front of a city skyline. He is wearing a blue striped shirt and a striped tie. He has glasses on and is holding a tablet in his hands. The sky behind him is orange and yellow. There are tall buildings all around him.
227.jpg,"There is a red background with white hearts on it. There is an envelope with a white card inside of it. The card has writing on it that says ""Valentine's Day"". There are two cats in front of the envelope. "
228.jpg,There is a white building next to a parking lot. There are cars parked in front of the building. There is a black car parked in the lot.
229.jpg,A man is standing in a hallway. He is wearing a gray jacket and a purple shirt. There are large metal cages on the wall behind him. There is an exit sign hanging from the ceiling.
230.jpg,A white rat is laying down. There are two green chairs behind the rat. There is a light above the chairs. 
231.jpg,A man is standing in front of glass doors. He is wearing a gray jacket and a purple shirt. There is a cat sitting on top of a shelf behind him. 
232.jpg,A cat is laying down inside of a cage. The cage is silver and metal. The cat is orange and white. There are towels under the cat. There is a white tub next to the cage. 
233.jpg,The cat is looking directly at the camera. The cat has green eyes. The whiskers of the cat are white. The cats whiskers are long and thin. The nose is pink and the cat has black spots on it. The fur on the cat is a mix of brown and black stripes.
234.jpg,A man is standing in front of glass doors. He is wearing a gray jacket and a purple shirt. There is a cat sitting on top of a shelf behind him. 
235.jpg,There is a cat laying on a white blanket. There is a pink spray bottle next to the cat on the blanket. The cat is brown and black. 
236.jpg,A man in a gray shirt and black pants is standing in between several metal cages. There is a red bag hanging from one of the cages. 
237.jpg,A cat is eating out of a silver bowl. The cat is orange and white. There are small brown chips in the bowl. 
238.jpg,A cat is eating out of a silver bowl. The cat is orange and white. There are small brown chips in the bowl. 
239.jpg,"The image is a digital art piece. The background is completely black. On the right side of the image there is a red circle that has small white dots on it. The dots are arranged in a circular pattern. There is also a small logo in the top right corner that says ""HTV9 HD 06:49:41""."
240.jpg,A soccer game is being played. There are several players on the field. They are wearing white and black uniforms. There is a white ball in the air. 
241.jpg,There are three men standing in front of a black wall. They are wearing black and white shirts. They have blue lanyards around their necks. One of the men has his hand up to his face. 
242.jpg,There is a man in a suit standing in front of an American flag. The man is wearing a white shirt and a red tie. There is a blue curtain behind the man. 
243.jpg,"The image is a graphic design. The background is red and white. The design is made up of small dots. The dots are arranged in a diagonal pattern. In the center of the design is the number 60. The number 60 is red with a silver outline around it. The word ""giay"" is written in the middle of the red and silver letters."
244.jpg,A man in a blue shirt and black pants is standing behind a white table. There is a large screen behind the man. There are tall buildings on the screen. 
245.jpg,"A man is standing on a news set. He is wearing a blue striped shirt, black pants and a blue and white striped tie. The man is holding a tablet in his hands. There is a large screen on the wall behind the man."
246.jpg,A soccer game is being played on a TV screen. There are several players on the field. They are wearing white and black uniforms. There is a white soccer ball on the ground. 
247.jpg,A soccer game is being played on a TV screen. There are several players on the field. They are wearing white and black uniforms. There is a white soccer ball in the air. 
248.jpg,A soccer game is being played in a stadium. There are several players on the field. One of the players is wearing a black uniform. There is a white soccer ball on the ground.
249.jpg,Two men are playing soccer on a field. One of the men is wearing a black uniform and the other is wearing white. There is a large net on the field in front of them. 
250.jpg,A soccer game is being played on a TV screen. There are several players on the field. They are wearing white uniforms. There is a large crowd sitting in the stands watching the game. 
251.jpg,A soccer game is being played on a TV screen. There are several players on the field. They are wearing black and white uniforms. There is a large crowd sitting in the stands watching the game. 
252.jpg,A soccer game is being played in a stadium. There are several players on the field. One of the players is wearing a white uniform. There is a white goal on the ground. 
253.jpg,There are several soccer players on a field. There is a white soccer ball on the ground in front of them. There are several players in white uniforms on the field. 
254.jpg,A soccer game is being played in a stadium. The field is green with white lines on it. There is a large white goal in front of the field. There are several players on the field wearing black uniforms. A white ball is soaring towards the goal. 
255.jpg,A soccer player is kneeling on the ground. He is wearing a white and red uniform and red shoes. The ground is covered in green grass. There is a purple sign in front of the player. 
256.jpg,A man is shown on a TV screen. He is wearing a black shirt. The shirt has white writing on it. The man has short black hair. The background is blurry.
257.jpg,A man is standing in front of a television screen. He is wearing a blue striped shirt and a blue and red tie. The man is holding a tablet in his hands. There is a picture of a man on the screen behind him. 
258.jpg,A man in a blue shirt and tie is standing in front of a screen. He is holding a tablet in his hands. There is a picture on the screen next to the man. 
259.jpg,An elderly man and woman are sitting in a living room. The man is wearing a blue sweater and is looking at a magazine. The woman is wearing glasses and a white shirt. There is a brown dresser behind them with pictures on it. Part of a clock can be seen hanging on the wall behind the people.
260.jpg,An elderly man and woman are sitting at a table. The man is wearing a blue shirt and tie. The woman is wearing glasses and a white sweater. There is a lamp behind them on a shelf. 
261.jpg,An elderly man and woman are sitting at a table looking at a piece of paper. The man is wearing a blue sweater and the woman has a white sweater on. There is a brown dresser behind them with pictures on it. 
262.jpg,An elderly man is sitting in a room. He is wearing a blue sweater and has a microphone clipped to his shirt. The man has white hair and is looking down. There is a brown cabinet behind him. 
263.jpg,An elderly man and woman are sitting at a table. The woman is wearing a white sweater and glasses. The man has a blue shirt on. There is a wooden table in front of them. 
264.jpg,A statue of a man riding a bike is on a red wall. The statue is brown in color. The man riding the bike is wearing only a shirt and shorts. The wall behind the statue is red. There is a red and white sign under the statue. 
265.jpg,An elderly man is sitting down. He has white hair and is wearing a blue sweater. There is a brown cabinet behind him. 
266.jpg,"A medal is displayed on a maroon background. The medal has five white stars with green leaves around them. In the center of the star is a gold coin with a woman's face on it. Above the coin is the word ""republique fran"" in blue letters. Below the medal is the words ""Bien Dich: Viet Hung - Minh DuC"" in white letters."
267.jpg,Someone is holding up a photograph of a man. The photograph is black and white. The man is wearing a white shirt. There is writing on the bottom of the photograph.
268.jpg,A hand is touching a medal. There are several other medals on the wall behind the hand. There is a colorful medal hanging from the medal. 
269.jpg,A woman is wearing a yellow shirt and black pants. She is holding a brown book in her hands. There is a large screen behind the woman. There are buildings on the screen. 
270.jpg,A woman is standing in front of a screen. She is wearing a yellow shirt and a black skirt. The woman is holding a tablet in her hands. There is a picture on the screen behind the woman. 
271.jpg,A woman in a yellow shirt and black pants is standing in front of a city skyline. She is holding a tablet in her hands. There is a large picture on the wall behind the woman. 
272.jpg,A stack of papers is sitting on a table. The papers are white and have black writing on them. The table is a light wood color. There is a watermark in the top right corner of the photo.
273.jpg,"A certificate is titled United States Court of Appeal for the District of Columbia Circuit. The certificate is white with a red border. The text on the certificate is written in black. There is a small logo in the top right corner that says ""HTV HD""."
274.jpg,The image is a screenshot of a news article. The article is about the president of the United States of America. It is written in black text on a white background. There is a red and white logo at the bottom of the article.
275.jpg,"The image is a page from a book. The page is white with black text. The title of the page is ""57"" at the top. There is a small barcode on the left side of the image. The barcode is in the shape of a square. The text is in black font and is centered on the page."
276.jpg,A black screen with white text on it. There is a small white square on the bottom left corner of the screen. The text on the screen is in black and white.
277.jpg,This is a courtroom. The benches are brown. There are black chairs in front of the desk. There is an American flag hanging on the wall. There picture frames on the walls. 
278.jpg,There is a man in a suit standing in front of an American flag. The man is wearing a white shirt and a red tie. There is a blue curtain behind the man. 
279.jpg,There is a man in a black suit and a red tie. There are two American flags behind him. There is a staircase behind him with two green vases on top of it. The man is making a face and has his mouth open. 
280.jpg,There is a man in a black suit and a red tie. There are two American flags behind him. There is a staircase behind him with two green vases on top of it. The man is making a face and has his mouth open. 
281.jpg,"A large crowd of people are gathered outside of the U.S. Capitol building in Washington, D.C. on a cloudy day. Some of the people are holding flags, and some are carrying bags. There are cars parked in front of the building."
282.jpg,A large crowd of people are gathered on a street. There is a silver fence in front of the crowd. There are two large white pillars on the sidewalk. 
283.jpg,A bunch of people are standing in a building. They are all wearing red hats. There is a man in a black jacket standing in the middle of the crowd. 
