frame,caption
001.jpg,A beautiful sunset over a city. The sky is orange and pink. There are a couple of giant letters that spell out the name of the city. There is a large body of water in front of the buildings.
002.jpg,A man and a woman are standing behind a white table. The man is wearing a blue shirt and a tie. The woman is also wearing a pink dress. There is a large screen behind them.
003.jpg,A man and a woman are standing in front of a news desk. The desk is white and has a red sign on it. The man is wearing a blue shirt and a tie. The woman has a pink dress on. There is a large screen behind them. There are buildings on the screen. 
004.jpg,The image is a graphic. The background is red and white. There are dots on the left side of the image. There is a big red and silver symbol in the middle. The symbol looks like a fan.
005.jpg,Two cars are driving down the road. There is a white line painted on the road in front of the car. There are trees on the side of the road on both sides of the street. 
006.jpg,Three men are sitting at a table. The man in the middle is wearing a pink shirt and a face mask. There is a white board behind them with writing on it.
007.jpg,This is a video call. There is a girl in the picture. The girl is wearing a light colored hoodie. The hoodie has a zipper on the front of it. The girls face is not visible. Her hair is light brown. The hair is messy. The room the girl is in has white walls and a white ceiling. There are shelves in the background with items on them.
008.jpg,"A red and white graphic is shown. There is a large red stripe on the right side of the image. The red stripe is on the left side of a white stripe. There are small dots on the bottom of the red stripe. On the top right corner there is a small logo that says ""HTTV9 HD 06:30:48""."
009.jpg,A man and a woman are standing behind a white table. The man is wearing a blue shirt and a pink tie. There is a large screen behind them with a city on it. 
010.jpg,A man and a woman are standing in front of a white table. The man is wearing a blue shirt and a pink tie. The woman has a pink dress on. There is a large screen behind them.
011.jpg,A man and a woman are standing in front of a large screen. They are both dressed in business attire. The man is wearing a blue shirt and a light colored tie. The woman is dressed in a light pink dress. There are large buildings on the screen behind them. 
012.jpg,A man and a woman are standing behind a white table. The man is wearing a blue shirt and a pink tie. There is a large screen behind them. There are buildings on the screen. 
013.jpg,A man and a woman are standing in front of a white table. The man is wearing a blue shirt and a pink tie. The woman is also wearing a pink dress and glasses. There are tall buildings behind them. 
014.jpg,There is a man and a woman standing in front of a red car. There is a white car driving on the street behind them. There are buildings on the side of the street. 
015.jpg,The image is blurred. The background is red and black. At the bottom of the image there is a red banner with white text. The text on the banner is in a foreign language. The date and time of the video is 06:31:25.
016.jpg,A man wearing a white face mask is sitting in a car. He is wearing glasses and a black shirt. The man is holding the steering wheel with his left hand. There is a red sign behind the man. 
017.jpg,There is a blue sign on the side of the road. There is a large brown truck on the street next to the fence. There are white lines on the ground in front of the truck.
018.jpg,There is a long road with white lines on it. There is a blue sign on the side of the road. There are trees next to the street. 
019.jpg,There are two trucks driving on the road. There is a green sign above the street. There are trees on the side of the road next to the trucks. 
020.jpg,There are two cars driving on the street. There are large bushes on the side of the street next to the cars. There is a white truck in front of the white car. 
021.jpg,A man is standing in a hallway. He is wearing a black suit and a purple striped shirt. He has glasses on and has short black hair. There are windows on the wall behind the man. 
022.jpg,There is a black car driving on the road. There are green signs hanging above the street. There is a yellow sign on the side of the street under the signs. 
023.jpg,There is a black car driving on the street. There is a yellow sign next to the street on the sidewalk. There are trees on the side of the street next to a fence. 
024.jpg,There is a large green sign on the side of the road. There are trees on the hill behind the sign. There is a silver fence next to the street. 
025.jpg,There is a long white fence on the side of the road. There is a green sign behind the fence. The fence is made of metal and has slats on the top of it. 
026.jpg,"This is an image of a highway. The highway has white lines on it. There is a large concrete barrier on the side of the road. There are colorful flags on the barrier. The flags are pink, yellow, purple, and green. The sky above the flags is gray."
027.jpg,There are two people walking on the street. There is a green sign above the street that is attached to a pole. There are trees on the side of the road. 
028.jpg,A man and a woman are standing in front of a white table. The man is wearing a blue shirt and a tie. The woman is wearing glasses and a pink dress. There are tall buildings behind them. 
029.jpg,A man and a woman are standing in front of a white table. They are both holding red boxes in their hands. The man is wearing a blue striped shirt and a pink tie. The woman has a pink dress on and glasses on. There are tall buildings behind them. 
030.jpg,A man and a woman are standing in front of a white table. The man is wearing a blue striped shirt and a pink tie. The woman is also wearing a pink dress and glasses. There are tall buildings behind them. 
031.jpg,A man and a woman are standing in front of a window. The man is wearing a blue striped shirt and a tie. The woman is sitting at a white table. There is a large window behind them. 
032.jpg,A person is holding a long green stick. They are wearing a black jacket and a black watch on their wrist. There is a red sign in front of the person with white writing on it.
033.jpg,A man is sitting in front of cardboard boxes. He is wearing a blue jacket. The boxes are stacked on top of each other. There is a green wall behind the man. The man has gray hair. 
034.jpg,A man is standing in a room. He is wearing a blue jacket. There is a tree behind him with green leaves on it. There are stairs behind him. 
035.jpg,A man is standing in a room. He is wearing a blue jacket. There is a tree behind him with green leaves on it. There are stairs behind him. 
036.jpg,There are several people sitting at desks in a room. There are many computer monitors on top of the desks. There is a red sign hanging on the wall in front of the desk. 
037.jpg,There are four women sitting at a desk. There are several computer monitors on the desk in front of them. There is a large window on the wall behind them. 
038.jpg,"A computer screen is turned on. There are words written in a foreign language on the screen. The screen is white and has a blue border around it. There is a date and time stamp on the top right corner of the screen that reads ""06:33:11""."
039.jpg,There are several people sitting at desks. There are many computer monitors on top of the desks. They are all wearing white shirts. There is a man in a yellow shirt sitting in front of them. 
040.jpg,A woman is sitting at a desk in front of a computer monitor. She is wearing a blue shirt and has dark hair in a ponytail. A man is sitting behind her wearing a black shirt and a white face mask. There are blue chairs behind them. People are sitting in chairs behind the man. 
041.jpg,A computer screen is turned on. There is a white paper on the screen. There are words written on the bottom of the screen in black. 
042.jpg,A woman is standing in front of a yellow building. She is wearing a gray hoodie and a black shirt. There is a large tree behind the woman. 
043.jpg,A woman is standing in front of a yellow building. She is wearing a gray jacket and a black shirt. There is a large tree behind the woman. The door to the building is white. 
044.jpg,A computer screen is turned on. There are several papers on the screen. There is a red watermark on the bottom of the screen that says htv9.
045.jpg,A yellow pamphlet is being held by a person's hand. The pamphlet has blue and yellow writing on it. There is a picture of a man on the bottom right of the pamphlet. 
046.jpg,A man and a woman are sitting on a red bench. The man is wearing a black suit and a blue shirt. The woman is wearing glasses and a black and white jacket. They are looking at a piece of paper. The wall behind them is painted green.
047.jpg,A man is wearing a blue striped shirt and a tie. He is holding a red object in his hands. There are tall buildings behind the man. There is a cloudy sky above the buildings.
048.jpg,A man is wearing a blue striped shirt and a light colored tie. He is holding a red object in his hands. There are tall buildings behind him. There is a cloudy sky above the buildings.
049.jpg,A man is standing in front of a city skyline. He is wearing a blue and white striped shirt and a light colored tie. The man is holding a red object in his hands. The sky behind the man is cloudy and orange. There are tall buildings all around the man.
050.jpg,There are several people sitting at desks. They are all wearing face masks. There are computers in front of them on the desks. There is a sign on the wall behind them. 
051.jpg,A woman is wearing a blue surgical mask. The woman has dark brown hair. There is a wooden cabinet behind the woman. The caption on the image is in red and white.
052.jpg,A woman is wearing a white face mask. She is sitting in front of a white table. There is a black bag on the table. 
053.jpg,A woman is wearing a white face mask. She is sitting in front of a large window. There is a black bag on a table in frontof her. 
054.jpg,A person is standing in front of a printer. They are holding a green object in their hand. There are papers on top of the printer. The printer is gray and white. 
055.jpg,There is a person wearing a black shirt. They have a red wristband on their wrist. There is a printer in front of them. The person is putting money into the printer. 
056.jpg,There are two women sitting at a desk. There is a man in a white shirt standing behind them. The woman in front of the man is wearing a blue shirt. 
057.jpg,An older Asian man with gray hair is wearing a white striped shirt and a blue tie. He is wearing gold framed glasses. There are trees behind him. 
058.jpg,A white device with two blue lights on it. There is a white cord coming out of the device. The device is sitting on top of a metal surface. 
059.jpg,A white device with two blue lights on it. There is a white cord coming out of the device. The device is sitting on a silver surface. 
060.jpg,"The image is a screen saver. It is a screenshot from a video or a news report. There are three panels in the image. The first panel is a phone. The second panel is made of metal. The metal is a dark gray color. There is a red and white logo in the top right corner of the image that reads ""HTV9 HD 06:34:34"". There are words in the bottom left and right corners that read ""Lam Dong: Tim thay nguai dan ong sot sot duoi suoi sau nam""."
061.jpg,The image is a screen saver of a mobile phone. The phone is black in color and has a very small amount of scratches on it. The background of the phone is very blurry. The time and date of the photo is 06:34:35.
062.jpg,A white printer is sitting on a table. There is a person's hand holding a piece of paper in front of the printer. There are words written on the bottom of the machine. 
063.jpg,There are people sitting at a desk. There is a man in a blue shirt sitting on a blue chair. There are two women sitting in front of a computer. 
064.jpg,There are several stacks of money in a white cart. There is a white box next to the money. There are words written on the bottom of the cart.
065.jpg,A man is wearing a blue uniform and an orange hard hat. He is standing in front of metal sheets. There are large machines behind him. 
066.jpg,Four workers are working in a factory. They are all wearing orange hard hats and safety jackets. There are large metal beams in the middle of the room. There is a yellow crane hanging from the ceiling. 
067.jpg,There are several rows of desks in a room. There are people standing in front of the desks. They are wearing blue shirts and white gloves. They have face masks on their faces. 
068.jpg,There are several women wearing blue shirts and white gloves. They are wearing face masks on their faces. There are shelves behind them with plastic containers on them. 
069.jpg,A woman is standing in front of a city skyline. She is wearing a pink dress and glasses. The sky is orange and yellow. There are tall buildings behind the woman. 
070.jpg,A woman is standing in front of a city skyline. She is wearing a light pink dress and glasses. She has short black hair and is holding a phone in her hands. The sky behind her is orange and yellow. There are tall buildings behind her. 
071.jpg,A woman is standing in front of a city skyline. She is wearing a pink dress and glasses. The sky is orange and yellow. There are tall buildings behind the woman. 
072.jpg,There are three people sitting around a table. There is a white board on the wall behind them. The person in the middle is wearing a pink shirt and a face mask. 
073.jpg,A man is sitting down wearing a blue surgical mask. He has short cut hair and is wearing a pink shirt. There is a white wall behind him.
074.jpg,There is a man wearing a white coat standing behind a man in a pink shirt. There is a white board on the wall behind them. The man is wearing a face mask on his face. 
075.jpg,A man is wearing a white face mask. The mask is attached to his ear with a white string. The man has dark brown hair on his head and neck. There are small black spots on his neck.
076.jpg,There are two pictures side by side. The picture on the left shows a person preparing food. The person is wearing gloves and is holding a utensil. There is a pot on the table. The photo on the right shows the food being prepared. There are letters and numbers on the top right of the picture.
077.jpg,A black and white image of a man's head. There is a white background behind the head. The head has a large cut in the middle of it. There are writing on the side of the cut. 
078.jpg,A man is wearing a white collared shirt. He has short black hair and is wearing glasses. There is a gray curtain behind the man.
079.jpg,There are several people sitting at a long table. There are microphones in front of the people. There is a man in a blue shirt holding a camera. 
080.jpg,"The image is a presentation in Vietnamese. The presentation is titled ""Cac Van De TREN BENH NHAN NA"" which is written in a foreign language. The background of the presentation is a light blue color. There is a small logo in the top right corner that says ""HTV9 HD"" in red letters. Below the logo there is a description in another language that says, ""Ton thong nang rat kho xur tri""."
081.jpg,There are several people sitting at a long table. There are microphones in front of them. There is a large screen on the wall behind them. 
082.jpg,A man is sitting at a table with two microphones in front of him. He is wearing a white suit and a white collared shirt. There are several black chairs behind him. 
083.jpg,There are people sitting at a table with laptops in front of them. There are water bottles on the table next to the laptops. There is a red wall behind them. 
084.jpg,There is a man wearing a blue surgical mask. There is a white string coming out of the mask. The man has dark brown eyes and a bald head. 
085.jpg,A man and a woman are standing in front of a white table. The man is wearing a blue shirt and a tie. The woman is wearing glasses and a pink dress. There are tall buildings behind them. 
086.jpg,There is a man and a woman standing in front of a white table. The man is wearing a blue shirt and a tie. He is holding a red object in his hand. The woman is wearing glasses and a pink dress. There are tall buildings behind them. There is a yellow sky above them.
087.jpg,A man and a woman are standing in front of a white table. They are both dressed in business attire. The man is wearing a blue shirt and a light colored tie. The woman is wearing glasses and a pink dress. There are tall buildings behind them. The sky is orange and cloudy. There is writing on the bottom of the screen.
088.jpg,A man is laying on a hospital bed. He is wearing a blue shirt and black pants. A man in a white shirt is standing next to the bed holding a clipboard. There is a woman sitting on a chair in front of the bed. 
089.jpg,A man is wearing a white lab coat. He has short black hair. There is a white wall behind the man. The man is looking down at something. 
090.jpg,A man is wearing a white lab coat. There is a white wall behind the man. The man has short black hair. 
091.jpg,A man is laying in a hospital bed. He is wearing a blue shirt and black pants. There is a nurse standing next to him wearing a white coat and a face mask. The walls of the room are white. 
092.jpg,A man and a woman are standing in a room. They are both wearing white lab coats. The woman is wearing a white face mask. There is a white wall behind them. 
093.jpg,A man is laying in a hospital bed. He is wearing a blue shirt. There is a man in a white shirt standing next to the bed. A woman is sitting on the bed in front of him. 
094.jpg,A man is wearing a white lab coat. He has a black shirt under the coat. There is a white wall behind the man. 
095.jpg,A man is wearing a white shirt and a white face mask. He is standing in front of a large window. There is a large screen on the wall behind him. 
096.jpg,A man is wearing a white lab coat and a face mask. He is standing in front of a shelf that has files on it. The man has short black hair. 
097.jpg,A man in a white lab coat is wearing a white face mask. He is standing in front of a large black shelf. There is a large screen on the wall behind him. 
098.jpg,A man is wearing a white lab coat and a face mask. He is standing in front of a large shelf. There is a large screen on the wall behind him. 
099.jpg,A man is wearing a surgical mask. He has short dark brown hair. He is also wearing a white lab coat. There is a shelf behind him with papers on it. 
100.jpg,A man is wearing a surgical mask on his face. He has short dark hair. He is standing in front of a shelf that has files on it. There is a white wall behind him. 
101.jpg,A man in a white shirt is standing in front of a bed. There is a man laying in the bed with his eyes closed. There are white tiles on the wall behind the bed. 
102.jpg,A man is standing in front of a city skyline. He is wearing a blue striped shirt and a light colored tie. The man is holding a red object in his hands. The sky behind the man is orange and yellow. There are tall buildings all around the man.
103.jpg,A man is wearing a blue striped shirt and a pink tie. He is holding a red object in his hands. There are tall buildings behind the man. There is a cloudy sky above the buildings.
104.jpg,There are several people standing behind a yellow table. There is a large white sign behind them with writing on it. There are two people sitting in front of the table with signs on them.
105.jpg,A group of people are standing behind a yellow table. There is a large screen behind them with writing on it. There are two men sitting in front of the table. 
106.jpg,There are several people standing on a stage. There is a large white sign behind them with writing on it. There are several lights hanging from the ceiling above the stage.
107.jpg,Three people are standing in front of yellow boxes. There is a white fence behind them. There are cars parked on the street behind the fence. 
108.jpg,There are four people standing around a table. There are yellow boxes on top of the table with the word mango written on them. There is a white fence behind the people. 
109.jpg,A group of people are standing in front of a truck. They are all holding bananas in their hands. There is a large white sign on the side of the truck. There are trees behind the sign. 
110.jpg,There are several buses driving on the street. There are trees on the side of the street next to the road. There is a red bus in front of a blue bus. 
111.jpg,There are two buses driving on the street. There are trees on the side of the street next to the buses. There is a blue sky in front of the bus. 
112.jpg,A large white building with a red sign on the front of it. There are people walking on the sidewalk in front of the building. There is a large tree next to the sidewalk.
113.jpg,There are two people standing in front of a hospital bed. They are wearing white face masks. There is a woman in a blue shirt standing next to the bed. 
114.jpg,A man is sitting in a hospital bed. He is wearing a black shirt. There is a man in a white shirt standing next to him. There are medical supplies on a table next to the bed. 
115.jpg,"The image is red and white. The background is white. There is a big red circle in the middle of the image. There are dots on the red circle. The dots are small and small. The lines are thin and red. The image has a black border around it. The letters ""HTV"" are in the top right corner of the photo."
116.jpg,A woman is standing in front of a city skyline. She is wearing a pink dress and holding a tablet in her hands. The woman has dark hair and glasses on. The sky behind the woman is orange and yellow. There are tall buildings all around the woman.
117.jpg,A woman is standing in front of a city skyline. She is wearing a pink dress and glasses. The sky behind her is orange and yellow. There are tall buildings all around her.
118.jpg,A woman is standing in front of a city skyline. She is wearing a pink dress and glasses. The sky behind her is orange and yellow. There are tall buildings all around her.
119.jpg,An Asian man is sitting in a chair in front of a window. He is wearing a blue button down shirt and blue pants. There is a red wall behind him with holes on it. 
120.jpg,A man is standing in front of a red wall. He is wearing a blue button up shirt. There are small holes on the wall next to him. There is a window behind him. 
121.jpg,A woman in a green uniform is sitting at a white desk. She is writing on a piece of paper that is in front of her. There is a red wall behind her. 
122.jpg,A woman in a green uniform is sitting in front of a red wall. There is a window behind her. She is holding a pen in her hand. 
123.jpg,A man is sitting on a chair. He is wearing a blue shirt and blue pants. There are red walls behind him with holes on them. There is a window on the wall behind him. 
124.jpg,An Asian man is sitting down and talking to someone. He is wearing a blue collared shirt. There is a red wall behind him with holes on it. There are windows behind him. 
125.jpg,A man is standing in front of a red wall. He is wearing a blue button down shirt. There is a window behind the man. 
126.jpg,A man is sitting on a chair. He is wearing a blue button down shirt and blue pants. There is a red wall behind him with holes on it. A window is behind him. 
127.jpg,A man is wearing a blue striped shirt and a pink tie. He is holding a red object in his hands. There are tall buildings behind him. There is clouds in the sky above him.
128.jpg,A man is standing in front of a city skyline. He is wearing a blue striped shirt and a light colored tie. The man is holding a red object in his hands. The sky behind the man is orange and yellow. There are tall buildings all around the man.
129.jpg,A picture of a person is being shown on a video call. The person is wearing a white jacket. There is a white wall behind the person. There are words written in front of the person on the screen. 
130.jpg,A picture of a woman is being shown on a video call. The woman has dark brown hair and a white jacket. There is a white wall behind the woman. 
131.jpg,A picture of a woman is being shown on a video call. The woman is wearing a white jacket. The picture is blurry. There is a microphone in front of the woman. 
132.jpg,A picture of a woman is being shown on a video call. The woman is wearing a white hoodie. There is a window behind the woman on the wall. The picture is blurry. There are words written on the bottom of the picture.
133.jpg,A picture of a woman is being shown on a video call. The woman is wearing a white hoodie. There is a barcode on the bottom left of the picture. 
134.jpg,A picture of a woman is being shown on a video call. The woman is wearing a white hoodie. There is a barcode on the bottom left of the picture. 
135.jpg,A woman is standing in a room. She has long brown hair and a headband on her head. She is wearing a green shirt. There is a light hanging from the ceiling in front of her.
136.jpg,A girl is standing in a room. She has long dark brown hair and a tiara on her head. She is wearing a green shirt. There is a light hanging from the ceiling in front of her. 
137.jpg,A man is sitting in a chair. He is wearing a black shirt. There are lockers behind the man. The man has short black hair. 
138.jpg,A man is sitting in a chair. He is wearing a black shirt. There are lockers behind the man. The man has short black hair. 
139.jpg,A man and a woman are standing in front of a white table. The man is wearing a blue shirt and a pink tie. He is holding a red object in his hands. There are tall buildings behind them. 
