frame,caption
284.jpg,A crowd of people are standing inside of a building. There are columns on the walls of the building. The people are all wearing red hats. There is a person standing in front of the columns. 
285.jpg,There is a man in a black suit and a red tie. There are two American flags behind him. There is stairs behind him with two green vases on top of them. The man has his eyes closed and his mouth is open. 
286.jpg,There is a man wearing a black suit and a red tie. There are two American flags behind him. There is a staircase behind him with two green vases on top of it. The man has blonde hair and is wearing a white shirt. 
287.jpg,A woman is standing in front of a news set. She is wearing a short sleeve shirt and a black skirt. There is a large screen behind her that shows a city with tall buildings. The sky is orange and blue.
288.jpg,"A man and a woman are standing in front of a large screen. They are both dressed in business attire. The man is wearing a blue shirt and black pants, and the woman is dressed in a yellow shirt. The screen behind them has a city scene on it, with tall buildings and a bridge. There is a large red and white sign on the front of the screen."
289.jpg,A man and a woman are standing in front of a large screen. They are both dressed in business attire. The man is wearing a blue shirt and a tie. The woman is wearing an off-white shirt and black pants. The screen behind them has a city scene on it. There is a red carpet on the floor under the two people.
290.jpg,"A man and a woman are standing in front of a large screen. They are both dressed in business attire. The man is wearing a blue shirt and black pants, and a tie. The woman is dressed in a beige shirt and pants. She is also wearing earrings in her ears. The screen behind them has a city scene on it. There is a large red and white logo on the bottom of the screen."
291.jpg,A man and a woman are standing behind a news desk. The desk is white and has a red and white logo on it. The man is wearing a blue shirt and tie and is holding a book in his hands. The woman is also wearing a yellow shirt and black pants. There is a large screen behind them that shows a city with tall buildings. There are clouds in the sky.
292.jpg,A man and a woman are standing behind a desk. They are both dressed in business attire. There is a large screen behind them with a city skyline on it. The desk in front of them is white and has a red carpet on the floor. There are lights hanging from the ceiling.
