frame,caption
140.jpg,A man and a woman are standing in front of a white table. The man is wearing a blue shirt and a tie. He is holding a red object in his hands. The woman is standing next to him wearing a pink dress. There are tall buildings behind them. There is a cloudy sky above them.
141.jpg,A man and a woman are standing in front of a white table. The man is wearing a blue shirt and a tie. The woman is wearing glasses and a pink dress. There are tall buildings behind them. 
142.jpg,There are three buses driving on a road. There are trees on the side of the road next to the buses. There is a red bus in front of the blue bus. 
143.jpg,There are two buses driving on the street. There are trees on the side of the street next to the buses. There is a red bus in front of the blue bus. 
144.jpg,There are several buses driving on the street. There are trees on the side of the street next to the buses. There is a person riding a motorcycle next to them. 
145.jpg,There are two buses driving on the street. There is a green and yellow building on the side of the street next to the buses. There are trees on the sidewalk next to them. 
146.jpg,There are several buses driving on the street. There are trees on the side of the street next to the road. There is a brown building on the sidewalk next to them. 
147.jpg,There are three cars and buses driving on the street. There are trees on the side of the street next to the cars. There is a white car in front of the buses. 
148.jpg,There are two buses driving on the street. There is a blue bus behind the red bus. There are trees on the side of the street next to the buses. 
149.jpg,A woman is standing in front of a city skyline. She is wearing a pink dress and glasses. The woman has dark hair and is holding a cell phone in her hand. The sky behind the woman is orange and yellow. There are tall buildings all around the woman.
150.jpg,A woman is standing in front of a city skyline. She is wearing a pink dress and glasses. The sky is orange and cloudy. There are tall buildings behind the woman. 
151.jpg,There is a large white building with a red sign on the front of it. There are people walking on the sidewalk in front of the building. There is a tree on the other side of the sidewalk.
152.jpg,There are several people standing in a room. There are several beds in front of them with people laying on them. There is a man in a black jacket standing next to one of the beds. 
153.jpg,There is a syringe with a white cord attached to it. The syringe is made of clear plastic. There is a blue cap on the top of the syringe. The background is gray.
154.jpg,There is a red sign with white writing on it. There is a silver railing next to the sign. There are people standing in front of a tree.
155.jpg,A man is laying on a stretcher. He is covered with a blue blanket. A man is standing next to the stretcher wearing a face mask. There is a white van behind the man. 
156.jpg,There are several hospital beds lined up against a wall. There are people laying on top of the beds. There is a man in a white coat standing in front of them. 
157.jpg,There are several hands reaching towards a table. There is a person wearing a black suit and a white shirt. There are striped shirts on the table. 
158.jpg,A man is laying in a hospital bed. He is wearing a black shirt. There is a man in a white shirt standing next to him. 
159.jpg,A man and a woman are standing in front of a white table. The man is wearing a blue shirt and a tie. He is holding a red object in his hands. The woman is wearing glasses and a pink dress. There are tall buildings behind them. 
160.jpg,A man and a woman are standing in front of a white table. They are both holding red objects in their hands. The man is wearing a blue shirt and a tie. There are tall buildings behind them. 
161.jpg,A man and a woman are standing in front of a white table. The man is wearing a blue shirt and a tie. The woman is wearing glasses and a pink dress. There are tall buildings behind them. 
162.jpg,A man and a woman are standing in front of a white table. The man is wearing a blue shirt and a tie. He is holding a red object in his hands. There are tall buildings behind them. 
163.jpg,"Many colorful flags are waving in the air. The flags are red, blue, yellow, green, and purple. There is a large window behind the flags. "
164.jpg,There are several people standing on a street. There are flags hanging from poles in front of the people. There is a large tree on the side of the street. 
165.jpg,There is a red sign with yellow writing on it. There are two flags on poles next to the sign. There is a yellow star on the red flag.
166.jpg,There is a red sign with yellow writing on it. There are two flags on poles next to the sign. There is a yellow star on the red flag.
167.jpg,There are several people standing in front of a crowd. There are flags on poles behind them. There is a man in a black suit walking in the front of the crowd. 
168.jpg,There is a crowd of people standing around a bull. There are several flags hanging from poles in front of the crowd. There is grass on the ground around the bull. 
169.jpg,Four people are standing on a street. There is a man in a green jacket and a green hat on his head. There are cars parked on the street behind him. 
170.jpg,There are two men standing in front of a yellow building. The man on the right is wearing a green uniform and a red hat. He is also wearing glasses. He has a white shirt and a green tie. The other man is wearing an army green uniform. They are both wearing hats. There are people walking on the sidewalk behind them. 
171.jpg,People are walking on the street. There is a large red and yellow sign on the sidewalk. There are trees on the other side of the walkway. 
172.jpg,There is a red flag with a yellow star on it. There are wires behind the flag. There is a silver pole in front of the red flag. 
173.jpg,There are several people standing in front of a white car. They are wearing green uniforms and hats. There are several flags hanging from poles next to the car. 
174.jpg,There are several people standing on a stage. There are colorful flags hanging from poles in front of them. There is a man in a suit and a woman in a red dress. 
175.jpg,There are several men in military uniforms standing in a line. There are red flags behind them. There is a man in a white shirt standing in front of them.
176.jpg,There are four men standing in front of a row of red flags. There is a woman behind them with a red dress on. There are mountains behind the flags. 
177.jpg,There are several people in uniform standing in a line. They are all wearing hats on their heads. There is a woman in a white shirt standing next to them.
178.jpg,Two men are standing in front of a large body of water. One of the men is wearing a green shirt and a hat. There is a large building behind the water. There are red buildings on the side of the building. 
179.jpg,A man in a green uniform is standing in front of a gate. The man is wearing a green hat with a gold emblem on it. He is wearing glasses. 
180.jpg,A man is standing in front of a building. He is wearing a gray jacket and a white collared shirt. There is a large red and yellow sign behind the man. 
181.jpg,There are several people standing in a crowd. There is a woman in a white jacket holding a white phone. There are two boys in front of her wearing hats. 
182.jpg,There are several people standing in a crowd. There is a man in a green suit and a white hat. There are white pillars in front of the crowd.
183.jpg,There are several people walking down the street. There are several flags behind them. There is a white fence next to the people. 
184.jpg,There are several people standing in a crowd. There are several flags behind them. There is a man in a black jacket holding a black umbrella. 
185.jpg,"The image is red and white. There are dots on the red background. The dots are small and white in color. The lines on the white background are also red. The image has a black border around it. There is a small logo in the top right corner of the image that says ""HTV HD"" in red letters. The date and time of the photo is 06:45:03."
186.jpg,"The image is a logo for a television channel. The logo is red and white. The background is white and there are red dots on the left and right side of the image. The red dots are arranged in a diagonal pattern. The letters of the logo are red and there is a big red circle in the center. The word ""giay"" is written in the middle of the red circle. The words ""Tiep Theo"" are written below the logo in red."
187.jpg,This is an image of a sidewalk. The sidewalk is made up of concrete. The concrete is gray and yellow. There is a large tree with pink flowers on it. The tree is in the middle of the sidewalk. There are people walking on the sidewalk by the tree. The trees have green leaves on them. The woman is standing by the road. The road has white lines on it and there is a black car on the street. The car has a green sign on the side of it.
188.jpg,A woman is standing outside of a building. She is wearing a white shirt and holding a black camera in her hand. There is a tree in front of the woman with pink flowers on it. The building behind the woman has large windows on the side of it.
189.jpg,There are three women sitting next to each other. One of the women is wearing a black hat. There is a tree behind them with pink flowers on it. 
190.jpg,This is an aerial view of a rural area.  There is a small village with a few houses and a few cars parked in front of one of the houses.  In the center of the image is a large metal structure that looks like an Eiffel tower.  The surrounding area is lush green grass and trees.
191.jpg,There is a man in a black jacket sitting in a wheel chair. There is a wood fence behind him. There are two people standing next to him. 
192.jpg,A man is wearing a blue striped shirt and a pink tie. He is holding a red object in his hands. There are tall buildings behind the man. There is a cloudy sky above the buildings.
193.jpg,A man is standing in front of a city skyline. He is wearing a blue striped shirt and a light colored tie. The man is holding a red object in his hands. The sky behind the man is orange and yellow. There are tall buildings all around the man.
194.jpg,There is a man wearing a blue striped shirt and a light colored tie. He is standing in front of a yellow and orange sky. There is a tree with pink flowers on it behind him.
195.jpg,A woman is taking a picture of a tree with pink flowers. She is holding a black camera in her hand. There is a large building behind her with large windows on it. 
196.jpg,A man in a white shirt and a red hat is walking on the street. There are people walking next to him. There is a green sign behind him. 
197.jpg,There are several people walking on a sidewalk. There is a black car parked on the street behind them. There are orange cones on the sidewalk next to the car. 
198.jpg,There are several people sitting on a bench outside of a building. There are trees behind them with pink flowers on them. There is a woman standing in front of the building. She is wearing a black jacket and carrying a white bag.
199.jpg,There are several people standing in front of a tree. There is a man in a white shirt wearing a black backpack. 
200.jpg,A tree with pink flowers is in front of a tall building. The building has many windows on the side of it. There is a light on the building. 
201.jpg,There are three women sitting under a tree. The tree has pink flowers on it. There is a blue building behind them. The woman in front is wearing a yellow shirt and a brown hat. 
202.jpg,People are walking down a sidewalk. There are trees on the side of the sidewalk. The trees have pink flowers on them. There is a wooden fence on the sidewalk next to the people.
203.jpg,A tree with pink flowers on it. The sky behind the tree is blue. There are green leaves on the branches of the tree. 
204.jpg,People are walking on a sidewalk. There are trees on the side of the sidewalk. The trees have pink flowers on them. There is a hill behind the trees. 
205.jpg,There are three women sitting next to each other. There is a tree behind them with pink flowers on it. The woman on the left is wearing a yellow shirt and a hat. 
206.jpg,There are people sitting under a tree. There is a large white building behind them. The tree has pink flowers on it. The man in front of the camera is wearing a white hat. 
207.jpg,A bunch of pink flowers are on a tree. The flowers are very beautiful. They are a pretty pink color. There are some green leaves on the branches of the tree.
208.jpg,A tree branch is covered in pink flowers. The branches are brown and have green leaves on them. There is a blue sky behind the tree. 
209.jpg,A woman is standing in front of a city skyline. She is wearing a pink dress and glasses. The sky behind her is orange and yellow. There are tall buildings all around her. 
210.jpg,A woman is standing in front of a city skyline. She is wearing a pink dress and glasses. The woman is holding a phone in her hands. The sky behind the woman is orange and yellow. There are several tall buildings in the skyline. 
211.jpg,There are two gold bracelets on display. They are on top of a white table. There is a person in a black jacket standing behind the table. 
212.jpg,A man and a woman are standing in front of a counter. The man is wearing a brown jacket and a white hoodie. He is looking down at a phone in his hand. The woman is standing next to him wearing a face mask. There is a glass display case behind them. 
213.jpg,There are two women standing in front of a glass counter. There are red decorations hanging from the ceiling above them. There is a man in a red jacket standing behind the counter. 
214.jpg,There are several white boxes with gold rings on top of them. There are small gold tags attached to the rings. There is a white box next to the gold rings. 
215.jpg,There are several boxes with gold rings on top of them. They are sitting on a table. There are lights above the boxes. 
216.jpg,A woman is wearing a white jacket. She is holding a black phone in her hand. There are large windows behind the woman. 
217.jpg,A woman is wearing a white jacket. She is holding a small black object in her hand. There are large windows behind the woman. 
218.jpg,A woman is standing in a room. She is wearing a white jacket and a black shirt. The woman is holding a small black object in her hand. There are large windows behind the woman. 
219.jpg,A woman is wearing a white jacket. She is holding a small black object in her hand. There are large windows behind the woman. 
220.jpg,There are several gold bracelets on display in a case. There are small tags on the front of the bracelets. There is a white box behind them with more bracelets in it.
221.jpg,There are people standing in front of a counter. There is a man in a white jacket pointing at something on the counter. 
222.jpg,There are people standing in front of a counter. There are red paper lanterns hanging from the windows. There is a man in a black jacket standing behind the counter.
223.jpg,There are people standing in front of a counter. They are wearing face masks on their faces. There is a man in a black jacket standing behind them. 
224.jpg,A man is wearing a blue striped shirt and a light colored tie. He is holding a red object in his hands. There are tall buildings behind him. There is a cloudy sky above the buildings.
225.jpg,A man is wearing a blue striped shirt and a light colored tie. He is holding a tablet in his hands. There are tall buildings behind him. There is a cloudy sky above the buildings.
226.jpg,There are people standing in front of the Eiffel tower. There are two large buildings on either side of the people. The sky is cloudy and foggy.
227.jpg,There are people walking in front of the Eiffel Tower. There are two large buildings on either side of the people. The sky is cloudy and foggy.
228.jpg,There are several eiffel towers on the ground. There are people standing around them. There is a large statue of a person wearing a long coat. 
229.jpg,A picture of the Eiffel Tower is shown. There is a tree to the left of the picture with no leaves on it. The sky is very cloudy and foggy.
230.jpg,A picture of the Eiffel Tower is shown. There is a tree to the left of the picture. The sky is very cloudy and gray.
231.jpg,A man in a black jacket is taking a picture of the Eiffel Tower. There is a woman in a blue jacket standing in front of the tower. 
232.jpg,A large crowd of people are walking down a street. There are tall buildings behind the crowd. There is a silver fence on the side of the street. 
233.jpg,"The image is of the Eiffel Tower in Paris, France. There is a small white tent set up on the left side of the image. There are buildings in the background. The sky is overcast and the image is taken during the day time. The image also has a caption in Vietnamese that reads ""Lai Chau: Ngan chan tinh trang cay hoa do quyen rung de ban""."
234.jpg,"The image is of the Eiffel Tower in Vietnam. The image is in black and white. There are words in Vietnamese below the image. The words on the bottom left and right of the image say ""Ngan chan tinh trang chat cay hoa do quyen rung de ban"" and ""Bac Giang: Trung bay 150 co viet"". There is a watermark in the top right corner that says ""HTV9 HD 06:49:48""."
235.jpg,There are several people standing in front of a building. There are large windows on the building behind them. There is a man in a black jacket and a woman in a white shirt.
236.jpg,A man is wearing a black suit. He is holding something in his hands. There is a white wall behind the man. 
237.jpg,A man and a woman are standing together looking at a cell phone. The man is wearing a black hoodie and the woman is wearing an off-white jacket. There is a man in a blue jacket walking behind them.
238.jpg,A man is holding a cell phone. He is taking a picture of two people standing in front of the Eiffel Tower. The man is wearing a black shirt. 
239.jpg,There are two people shaking hands. There is a man taking a picture of them. The man is wearing a suit. The woman has a red shirt under a gray coat. 
240.jpg,A woman is standing in a room. She is wearing a short dress and black high heels. There are large screens on the wall behind her. There is a picture on the screen. 
241.jpg,A woman is standing in a room. She is wearing a short pink dress and black heels. There is a large screen behind her that is showing a picture of a hand holding something. 
242.jpg,A woman is standing on a news set. She is wearing a pink dress and holding a book in her hand. There are large screens on the wall behind her. There is a picture on one of the screens.
243.jpg,A man is carrying a long wooden plank over his shoulder. He is wearing a blue jacket and blue jeans. There is a large wooden structure behind the man. 
244.jpg,A machine is sitting on top of a blue table. There is dirt on the ground around the table. The machine has a black handle on it. 
245.jpg,A person is using a circular saw to cut a piece of wood. The saw is sitting on top of a blue table. The person is wearing blue pants and a blue shirt. There is dirt on the ground behind the table.
246.jpg,A man is wearing a black hat and a black jacket. He is holding a black drill in his hand. There are wooden beams behind him. 
247.jpg,A man is standing on top of a ladder. He is wearing a black jacket and pants. There is a large wooden structure in front of the man. There are trees behind the structure. 
248.jpg,This is a picture of a bridge. The bridge appears to be made of wood. The beams on the bridge are brown. The sky is very clear and white. There is a watermark in the top right corner of the image. The watermark is in red and black. There are words in the bottom left and in the middle of the picture.
249.jpg,There is a large structure made of wood. There is a ladder hanging from the side of the structure. There are two people standing in front of it. One of them is in a wheel chair. 
250.jpg,A man is wearing a black hat and a blue jacket. There is a wooden structure behind the man. There are trees behind the structure. 
251.jpg,This is an aerial view of a farm. The farm has large green fields. There are several small buildings scattered around the farm. There is a large brown tower in the middle of the photo. Three cars are parked in front of one of the buildings.
252.jpg,A man is wearing a black hat and a blue jacket. There is a wooden structure behind the man. There are trees behind the structure. 
253.jpg,A man is standing in front of a wooden structure. He is wearing a black jacket. The man has short white hair and a beard. There are trees behind the structure. 
254.jpg,There is a man in a black jacket sitting on a black wheelchair. There is a wooden structure behind him. There are people standing in front of a building behind the man. 
255.jpg,A picture of an Eiffel Tower is being constructed. There is a ladder in the middle of the structure. There are trees behind the structure in the distance. The sky above the eiffel tower is filled with clouds.
256.jpg,The Eiffel Tower is shown from the bottom. The sky is cloudy and gray. There is a tree to the right of the eiffel tower.
257.jpg,This is an aerial view of a rural area. There is a small building with a blue roof next to a large field. There are several cars parked in front of the building. In the center of the field is a large tower. 
258.jpg,A woman is standing in front of a large screen. She is wearing a short pink dress and black heels. The screen behind her has a picture of a city on it. There is a red carpet on the floor under the screen. 
259.jpg,A man and a woman are standing in front of a desk. The desk is white and has a red logo on it. The man is wearing a blue shirt and a pink tie. The woman is sitting behind the desk. There is a large screen behind them. There are buildings on the screen. 
260.jpg,A man and a woman are standing in front of a white table. The man is wearing a blue shirt and a tie. The woman has a pink dress on. There is a large screen behind them.
261.jpg,A man in a blue suit is sitting behind a wooden table. There is a name plate on the table in front of him. There are other men behind him sitting in chairs. 
262.jpg,Many people are sitting at a round table. Most of the people are wearing suits. There is a large window on the side of the room. 
263.jpg,A large group of people are sitting in a room. They are all dressed in business attire. There is a large wooden table in front of them with papers and microphones on top of it. There are blue chairs around the table. 
264.jpg,There are several people sitting at a table. There is a wood paneled wall behind them. There are microphones in front of the table. 
265.jpg,There are several people sitting at a table. There are signs on the table in front of them. There is a wood wall behind them. 
266.jpg,There is a large round table in the middle of a room. There are people sitting in chairs around the table. There is a painting on the wall behind them. 
267.jpg,There are several people sitting at a table. There are signs on the table in front of them. There is a wood wall behind them. 
268.jpg,A woman is sitting at a table with a microphone in front of her. She is wearing a black and white shirt and glasses. There is a sign on the table that says United States on it. There are people behind her sitting in chairs. 
269.jpg,A woman is sitting at a table with a microphone in front of her. She is wearing a black and white shirt and glasses. There is a sign on the table that says United States on it. There are several people behind her sitting in chairs. 
270.jpg,A bald man in a blue suit is sitting behind a wooden table. There is a black sign on the table in front of him. There are people behind him sitting in chairs. 
271.jpg,A bald man in a blue suit is sitting at a table. There is a sign in front of him that says Russian Federation. There are other people behind him sitting in chairs. 
272.jpg,A large round table is in the middle of a room. There are people sitting around the table. There is a large painting on the wall next to the room. 
273.jpg,A man and a woman are standing in front of a white table. The man is wearing a blue shirt and a tie. The woman has a pink dress on and is wearing glasses. There is a large screen behind them.
274.jpg,A man and a woman are standing in front of a white table. The man is wearing a blue shirt and a tie. The woman has a pink dress on. There is a large screen behind them.
275.jpg,A man and a woman are standing behind a news desk. The desk is white and has a red logo on it. There is a large screen behind them. The man is wearing a blue shirt and tie. 
