frame,caption
136.jpg,A man is standing in front of a cityscape. He is wearing a gray shirt and a striped tie. He has glasses on and is holding a tablet in his hands. The sky behind him is orange and yellow. There are tall buildings all around him.
137.jpg,A man is standing in front of a city skyline. He is wearing a gray shirt and a striped tie. He has glasses on and is holding a tablet in his hands. The sky behind him is orange and yellow. 
138.jpg,A motorcycle is laying on its side in a parking lot. There are several orange cones on the ground around the motorcycle. There is a truck behind the motorcycle on the other side of the street. 
139.jpg,The image is a screenshot from a Vietnamese news channel. It shows the time as 06:39:28 and the channel name as HTV9HD. There is a white license plate on the back of a vehicle. The license plate reads 613.88 and the numbers are in black. The vehicle has a large black tire on it. The background of the image is dark.
140.jpg,There is a large truck driving on the street. There is a white cone on the ground in front of the truck. There are several other trucks on the other side of the road. 
141.jpg,A red truck is parked on the street. There is a yellow license plate on the front of the truck. There are white lines on the ground in front of it. 
142.jpg,A red truck is driving on the street. There is a yellow license plate on the front of the truck. There are orange cones on the ground next to the road. 
143.jpg,There are several trucks driving on the street. There are lights on the side of the street next to the trucks. There is a large red truck in front of the other truck. 
144.jpg,There are several trucks driving on the street. There are orange cones on the ground in front of the trucks. There is a motorcycle on the road next to the cones. 
145.jpg,A large brown truck is driving on the street. There are orange cones on the ground in front of the truck. There is a person riding a motorcycle on the road. 
146.jpg,A red and black screen has lines on it. The lines are white. There are small black dots on the screen. There is a small white logo on the top right corner of the screen that says htv9.
147.jpg,A red car is driving on a highway. There is a white barrier in front of the car. There are other cars on the other side of the road. 
148.jpg,A red car is driving on the street. There is a yellow license plate on the front of the car. The car has headlights on it. 
149.jpg,There are several cars on the street. There is a white car with a blue stripe on the side of it. There are people standing in front of the car. 
150.jpg,There is a white car with blue stripes on the side of it. There are red lights on the top of the car. There is a man standing next to the white car. 
151.jpg,There are several cars on the street. There is a white car with blue writing on the side of it. There are people standing in front of the car. 
152.jpg,There are several cars driving on the street. There is a large white sign on the side of the street next to the cars. There are clouds in the sky above the road. 
153.jpg,A woman is standing in front of a screen. She is wearing a blue shirt and a white skirt. The woman is holding a brown object in her hands. There is a picture on the screen behind the woman. 
154.jpg,A woman is standing in front of a screen. She is wearing a blue blouse and white bottoms. The woman is holding a brown object in her hands. There is a large picture on the screen behind the woman. 
155.jpg,A black SUV is driving down the street. There are other cars and motorcycles on the street behind it. There is a blue pole on the sidewalk next to the sidewalk. 
156.jpg,There are several people standing on the sidewalk. There are cars and motorcycles on the street behind them. There is a green sign on the side of the street. 
157.jpg,There is a large window on the wall. There is a white door next to the window. The door is open and there is a pillar in front of the door. 
158.jpg,This is a security camera footage of an office. It is taken from the top floor of the building. There are several desks and chairs in the room. People are standing around the desks. There is a large red circle in the middle of the photo.
159.jpg,There is a black and white image on a screen. There is a red and white logo on the top right corner of the screen. The screen has writing on the bottom of it.
160.jpg,This is a picture of a room. There are people in the room. The people are sitting at desks. The desks are white. The chairs are blue and gray. There is a man standing in front of the desk. The man is wearing a dark colored jacket. The floor in the picture is white. There large windows in the background. The windows have white frames on them.
161.jpg,This is a picture of an office. The room is very cluttered. There are many desks in the room. The desks are white. The chairs are blue and black. There is a person standing in the middle of the room by the desk. The person is wearing a black shirt. The man is standing in front of a large window. The window has lots of frames on it.
162.jpg,A man is standing in an office. He is wearing a gray shirt and black pants. There are blue chairs in front of a white desk. There is a large window on the wall. 
163.jpg,A man is wearing a gray shirt and a striped tie. He is holding a tablet in his hands. There are tall buildings behind him. There is a yellow sky above the buildings.
164.jpg,A man is standing in front of a city skyline. He is wearing a gray shirt and a striped tie. He has glasses on and is holding a tablet in his hands. The sky behind him is orange and yellow. There are tall buildings all around him.
165.jpg,A man is wearing a gray shirt and a striped tie. He is holding a tablet in his hands. There are tall buildings behind the man. There is a cloudy sky above the buildings.
166.jpg,There are people sitting around a table. There is a large table in front of them. There are blocks on top of the table. The blocks are purple and pink. 
167.jpg,There is a large table in a room. There are pink and blue blocks on top of the table. There is a person in a white shirt sitting at the table in front of them. 
168.jpg,A man in a white shirt is sitting at a brown table. There is a black laptop on the table in front of him. There are pink and blue items on top of the table. 
169.jpg,There are people sitting around a table. There is a woman wearing a black shirt and a face mask on her face. The table has a large blue and pink object on top of it. 
170.jpg,A man is sitting at a brown desk. He is wearing a white long sleeve shirt and a face mask. There is a white box on the desk in front of him. 
171.jpg,There are several people sitting at a table. There is a man in a white shirt writing on a piece of paper. There are people wearing face masks on their faces. 
172.jpg,A woman is standing in front of a screen. She is wearing a blue blouse and a white skirt. The woman is holding a red purse in her hands. There is a large picture on the screen behind the woman. There are tall buildings on the ground behind her. 
173.jpg,A woman is standing in front of a screen. She is wearing a blue blouse and a white skirt. The woman is holding a red object in her hands. There is a picture on the screen behind the woman. 
174.jpg,There are two men sitting at a table. The man on the left is wearing a green shirt and a green hat. He is writing on a piece of paper. The other man is wearing glasses and a white jacket. There is a plant in front of the table.
175.jpg,There is a man sitting in a chair. He is wearing a white shirt and glasses. There is a window behind him on the wall. There are two brown chairs in front of him.
176.jpg,A man is wearing a green and red uniform. There is a green hat on his head. The man is sitting in front of a red chair. 
177.jpg,A man is wearing a green and red uniform. He has a green hat on his head. There is a brown chair in front of him. 
178.jpg,There are two men sitting at a table. The man on the left is wearing a green uniform and a red hat. He is typing on a laptop that is on the table in front of him. The other man is sitting next to him wearing a black uniform. There is a stack of papers on the right side of the table. 
179.jpg,Two men are sitting at a table. The man on the left is wearing a green shirt and a green hat. He is looking at a laptop that is on the table in front of him. 
180.jpg,There are several boxes of fruit on a table. There are bags of sugar on the table next to the boxes. There is a silver scale on top of the table.
181.jpg,A man is sitting on a brown chair. He is wearing a white shirt and glasses. There is a white cabinet behind the man. The man has short black hair. 
182.jpg,A man is wearing a gray shirt and a striped tie. He is holding a tablet in his hands. There are tall buildings behind the man. There is a cloudy sky above the buildings.
183.jpg,A man is standing in front of a city skyline. He is wearing a gray shirt and a striped tie. The man is holding a red book in his hands. The sky behind the man is orange and yellow. There are many tall buildings in the skyline. 
184.jpg,There are several white cars parked on the street. There are people standing on the sidewalk next to the cars. There is a blue sign in front of the car. 
185.jpg,There is a large blue sign with white writing on it. There are trees behind the sign. There is a white arrow pointing to the left and a white letter on the right.
186.jpg,There are several men in uniform standing around a white car. There are white umbrellas behind them. There is trees behind the men. 
187.jpg,There are several police officers standing around a black car. There are people standing on the side of the street in front of the cars. There is a white building behind them. 
188.jpg,A car is parked on the street. There are people standing on the sidewalk next to the car. There is a pile of black bags in the back of the car that are wrapped up. 
189.jpg,A car is parked on the street. There are people standing on the sidewalk next to the car. There is a black bag in the back of the car that is wrapped up. 
190.jpg,A man in a white shirt and a red hat is bending over. There is a white license plate on the back of a car. There are people standing around the man. 
191.jpg,A man in a white shirt and a red hat is bending over. There is a white license plate on the back of a car. There are people standing behind the car. 
192.jpg,A picture of a person is made up of small blue and white squares. The person is wearing a white shirt and has brown hair. There is a blue stripe on the shirt. 
193.jpg,"The image is a screenshot from a video game. It is a pixelated image. The image appears to be a map of the world. The colors are blue, white, brown and light blue. There are a lot of small squares in the image. There is a red and white logo in the top right corner that says ""HTV9 HD"" and the time is 06:43:21."
194.jpg,People are standing on a platform next to a train. The train is green and white in color. There are large windows on the side of the train. 
195.jpg,There is a man and a woman standing in front of a white wall. The man is wearing a green vest. He is holding a black object in his hand. The woman is wearing black clothes and holding a phone in her hand. There is a white sign on the wall behind them.
196.jpg,"A picture of a phone that says called Tradivia, this handheld device can translate from French into 16 different languages. The phone is black and white. The screen of the phone is on. There is a red and white banner at the bottom of the picture."
197.jpg,A woman is wearing a gray sweatshirt. She has black glasses on and her hair is in a ponytail. There is a white machine behind the woman. 
198.jpg,A woman is standing in front of a cityscape. She is wearing a blue blouse and a white skirt. The woman is holding a red object in her hands. There is a large screen behind the woman. 
199.jpg,A woman is standing in front of a screen. She is wearing a blue blouse and a white skirt. The woman is holding a small red object in her hands. There is a picture on the screen behind the woman. 
200.jpg,A woman is standing in front of a screen. She is wearing a blue shirt and a white skirt. The woman is holding a brown object in her hands. There is a picture on the screen behind the woman. 
201.jpg,A classroom is filled with people sitting at desks. There is a woman standing in front of a whiteboard. There are papers and books on top of the desks. 
202.jpg,There are people sitting at desks in a room. There is a woman standing in front of a white board. There are colorful flags hanging from the ceiling. 
203.jpg,There are two boys sitting at a table. There is a woman standing in front of them. There are blue chairs around the tables. 
204.jpg,There are four kids sitting at a table. There are blue chairs in front of them. There is a window behind them with white blinds on the window. 
205.jpg,"A sign on the side of a building says ""Welcome to Madcaps Out of School Club"". There is a picture of a boy and girl on the sign. The sign is yellow and blue. The building is made of brick. The door to the store is open. There are words on the bottom of the picture that say ""Chuong trinh Luong thuc Thei gai keu goi tang cuong vien tra cho Sudan""."
206.jpg,There are several children sitting around a red table. There are red chairs around the table. The children are playing with toys on the table and chairs. 
207.jpg,A woman is sitting at a table. She is wearing a white shirt. There is a silver machine on the table in front of her. There are colorful blocks on the desk in front. 
208.jpg,There is a little girl bent over looking down. She is wearing a yellow shirt. There is a table behind her with chairs around it. 
209.jpg,There is a red chair in front of a red table. There is a gray object on the table next to the red chair. There are boxes on the floor behind the table.
210.jpg,There is a small boy sitting at a table. There is a blue water bottle on the table in front of him. There are plates of food on top of the table. 
211.jpg,A man is standing in front of a news desk. He is wearing a gray shirt and a striped tie. There are tall buildings behind him. There is a yellow sky above the buildings.
212.jpg,A man is standing in front of a city skyline. He is wearing a gray shirt and a striped tie. He has glasses on and is holding a tablet in his hands. The sky is orange and yellow. There are tall buildings all around him.
213.jpg,A man is standing in front of a news desk. He is wearing a gray shirt and a striped tie. There are tall buildings behind him. There is a yellow sky above the buildings. 
214.jpg,This is an animated image of a train station. The train is green and white. There are people standing on the platform next to the train. There is a man standing in front of the train wearing a suit and tie. 
215.jpg,There is a man and a woman standing in a room. They are both looking at something in front of them. The woman is wearing a black jacket and holding a phone in her hands. There is a white wall behind them.
216.jpg,"A picture of a phone that says called Tradivia, this handheld device can translate from French into 16 different languages."
217.jpg,A phone screen is shown in French. The phone is black and the screen is white. There is a green box on the screen with foreign writing on it. The words on the box are in black.
218.jpg,A picture of a phone that is turned on. The phone is black. There is a white and green screen on the phone. There are words written in a foreign language on the screen. The picture of the phone is being held by a person.
219.jpg,A phone screen is turned on. The phone is black and the screen is white. There are words in different languages on the screen. There is a blue and white logo on the top right corner of the screen that says France 24.
220.jpg,A man is standing inside of an airport terminal. He is wearing a black suit and a white collared shirt. The man has short cut hair and a beard. The ceiling of the terminal is white and there are lights on the ceiling. There is a blue and white logo on the top right corner of the image.
221.jpg,There are several people standing in front of a white machine. There is a man in a green vest standing next to them. There are signs on the wall behind them.
222.jpg,There are several people standing in front of a machine. There is a man in a black jacket standing next to them. There are signs on the wall behind them.
223.jpg,A woman in a yellow coat with a white fur collar is standing in front of a mirror. There is a woman behind her wearing a black coat. 
224.jpg,There are three people standing in front of a green wall. There is a man in a black jacket holding a tablet in his hand. 
225.jpg,People are standing in line at a train station. They are all wearing coats and hats. There are machines on the side of the people. The floor of the station is gray. The ceiling has lights on it.
226.jpg,A woman is standing in front of a cityscape. She is wearing a blue blouse and a white skirt. The woman is holding a brown object in her hands. There is a large screen behind the woman. 
227.jpg,A woman is standing in front of a screen. She is wearing a blue shirt and a white skirt. She has a necklace around her neck. The woman is holding a brown object in her hands. There is a picture on the screen behind the woman. 
228.jpg,A woman is standing in front of a screen. She is wearing a blue blouse and a white skirt. The woman is holding a small red object in her hands. There is a picture on the screen behind the woman. There are tall buildings on the ground behind her. 
229.jpg,A woman is standing in front of a large screen. She is wearing a blue blouse and a white skirt. The woman is holding a red object in her hands. There is a large picture on the screen behind the woman. 
230.jpg,There are several people standing in a line. There is a large white building behind them. There are signs on the front of the building. 
231.jpg,Three men are walking down a path in a wooded area. Two of the men are wearing baseball caps on their heads. The third man is wearing a black t-shirt and white shorts. The trees on the side of the path are tall and green.
232.jpg,Four people are walking down a path in the woods. There are trees on either side of the path. The people are wearing backpacks on their backs. There is a hill behind them with trees on it. 
233.jpg,There are several people walking down a road. There is a large hill behind them with trees on it. There are clouds in the sky above them.
234.jpg,A man is standing in front of a news desk. He is wearing a gray shirt and a striped tie. There are tall buildings behind him. The sky is orange and white. 
235.jpg,A man is standing in front of a news desk. He is wearing a gray shirt and a striped tie. There are tall buildings behind him. There is a cloudy sky above the buildings.
236.jpg,A man is standing in front of a cityscape. He is wearing a suit and tie. He has glasses on and is holding something in his hands. There are tall buildings and skyscrapers in the background.
237.jpg,There are four people standing in a room. There is a window on the wall behind them. The person in front of them is wearing a gray jacket and glasses. They are holding a stack of boxes. 
238.jpg,This is a picture of a bedroom. There is a white bed in the room. There are stuffed animals on top of the bed. The bed has a blue blanket on it. The floor is made up of wood. The shelves are white and filled with various items. 
239.jpg,This is a picture of a bedroom. There is a small white bed in the middle of the room. There are stuffed animals on top of the bed. The window above the bed has purple curtains on it. The floor in the room is made of wood.
240.jpg,There is a blue box on the ground. There are many papers scattered around the blue box. There is a picture on the front of the blue book. 
241.jpg,There are two women standing in a room. They are both wearing face masks on their faces. The women are holding white paper towels. There is a white wall behind them. 
242.jpg,A woman is wearing a gray sweatshirt. She has black hair in a ponytail. She is wearing glasses. There is a white machine behind her. 
243.jpg,A person wearing white gloves is putting clothes in a yellow basket. There is a striped shirt in the basket. 
244.jpg,A woman is wearing a gray shirt and black glasses. There are gray curtains behind the woman. There is a red sign in front of the woman with white writing on it.
245.jpg,A woman is wearing a black shirt and black glasses. There is a white wall behind the woman. The woman has short black hair. 
246.jpg,There is a large glass display case. There are many small toys on the shelves. There is a pink toy on top of the shelf. 
247.jpg,There are shelves on the wall with toys on them. There is a white air conditioner on the side of the wall. There are pictures on the walls. 
248.jpg,There are several stuffed animals on top of a white couch. There is a window behind the couch with purple curtains on it. There are several pillows on the couch in front of the window. 
249.jpg,There is a woman standing in front of a screen. She is wearing a blue shirt and a white skirt. The woman is holding a small tablet in her hands. There is a picture on the screen next to the woman. 
250.jpg,A woman is standing in front of a screen. She is wearing a blue shirt and a white skirt. The woman is holding a book in her hands. There is a picture on the screen next to the woman. 
251.jpg,A woman is standing in front of a screen. She is wearing a blue shirt and a white skirt. She has a necklace around her neck. The woman is holding a brown object in her hands. There is a picture on the screen next to the woman. There are pink flowers on a tree branch. 
252.jpg,There are people standing in front of a tree. The tree has pink flowers on it. There is a man in a blue shirt standing next to the tree.
253.jpg,A butterfly is sitting on a branch of a tree. The tree has many pink flowers on it. The butterfly is black and yellow. There is a red and white sign under the branch of the tree. 
254.jpg,A man is standing in front of a microphone. He is wearing a black and white shirt and has glasses on. There are trees behind him with pink flowers on them. There is another man standing behind him wearing a pink shirt and carrying a black backpack. 
255.jpg,A man is standing in front of a microphone. He is wearing a black and white shirt. There are trees behind him with pink flowers on them. There is green grass on the ground. 
256.jpg,There are three people standing in front of microphones. There are trees behind them with pink flowers on them. There is a woman in a blue shirt wearing a white hat. 
257.jpg,There are people standing in front of a tree with pink flowers on it. There are two women wearing sunglasses. There is a man in a white hat behind them holding a microphone. 
258.jpg,There are several people standing in front of a white fence. There are trees behind the fence with pink flowers on them. There is a man in a blue shirt with a black backpack on. 
259.jpg,"A tree is blooming with pink flowers. The branches of the tree are brown and bare. There are small green leaves on the branches. There is a watermark in the top right corner that says ""HTV HD"" and the time is 06:50:48."
260.jpg,There are people standing in front of a tree. The tree has pink flowers on it. There is a man in a green shirt standing in the crowd. 
261.jpg,There are three people standing in front of a white fence. There are trees behind the fence with pink flowers on them. There is a man in a gray shirt holding a phone in his hand. 
262.jpg,A tree is full of pink flowers. The branches of the tree are brown and have green leaves on them. There are small pink flowers on the branches. 
263.jpg,There are several people standing in a field. There are trees with pink flowers on them in front of them. There is a man in a white jacket holding a black camera. 
264.jpg,A man is standing in front of a screen. He is wearing a gray shirt and a striped tie. The man is holding a tablet in his hands. There is a large picture on the wall behind the man. 
265.jpg,A man in a gray shirt and tie is standing in front of a large screen. There is a picture of a car on the screen behind him. There are tall buildings on the other side of the screen. 
266.jpg,A man is standing in front of a colorful background. He is wearing a long sleeve shirt and a striped tie. He has glasses on and is holding a tablet in his hands. There is a large picture hanging on the wall behind the man. 
267.jpg,"On the left side of the image there is a large bouquet of purple flowers. The background is black. Next to the bouquet is a painting of a group of people. The painting is in a brown frame. There is a watermark in the top right corner that says ""HTV9 HD 06:51:16""."
268.jpg,There are large flowers on the wall. The flowers are black and white. There is a red sign in front of the flowers. The sign has white writing on it. 
269.jpg,There are three paintings hanging on the wall. The first painting on the right is a painting of a woman in a red dress. The second painting is a picture of a building. The third painting is of a bouquet of flowers. The flowers are multicolored. The wall is a light beige color.
270.jpg,A painting is displayed on a wall. The frame of the painting is ornate and gold. There are three flowers hanging on the wall next to the frame. 
271.jpg,There are lights hanging from the ceiling in a room. There are tables in front of the wall with white and black items on top of them. There is a person standing behind them. 
272.jpg,There is a woman standing behind a counter. There are lights hanging above the counter. The counter has several items on top of it. There is a red wall behind the woman. 
