frame,caption
001.jpg,A beautiful sunset over a city. The sky is orange and pink. There are a couple of giant letters that spell out the name of the city. There is a large body of water in front of the buildings.
002.jpg,A man and a woman are standing behind a desk. The desk is white and has a red logo on it. There is a large screen behind them. There are buildings on the screen. 
003.jpg,A man and a woman are standing behind a desk. The desk is white and has a red logo on it. There is a large screen behind them. There are buildings on the screen. 
004.jpg,The image is a graphic. The background is red and white. The design is made up of stripes. The stripes are white and red. There is a gray symbol in the middle of the design. The gray symbol has a big white circle in the center. There are small dots on the red background.
005.jpg,There are five people standing behind a red ribbon. There are two women and two men in front of them. They are wearing white shirts and blue ties. There is a pink wall behind them with a large sign on it. 
006.jpg,There are colorful flags on poles in the water. There are plants and flowers on the ground in front of the flags. There is a large building behind them. 
007.jpg,There are several motorcycles parked on the street. There is a white building behind them with a red car parked in front of it. There are people standing around the motorcycles.
008.jpg,People are walking in a park. There are trees with pink flowers on them. There is a white picket fence in front of the people. 
009.jpg,A butterfly is sitting on a branch of a tree. The tree has many pink flowers on it. The butterfly is black and yellow. There is a red border around the image. 
010.jpg,A soccer game is being played in a stadium. There are many people in the stands watching the game. The field is green with white lines on it. 
011.jpg,A soccer game is being played on a TV screen. There are several players on the field. They are wearing white and blue uniforms. There is a large crowd sitting in the stands watching the game. 
012.jpg,A man and a woman are standing behind a white table. The man is wearing a gray shirt and a striped tie. The woman is also wearing a blue blouse and a lanyard around her neck. She is holding a brown purse in her hands. There is a large cityscape behind them. The sky above them is blue with white clouds.
013.jpg,A man and a woman are standing in front of a white table. They are both holding red objects in their hands. The man is wearing a gray shirt and a striped tie. The woman has a blue blouse on and a necklace around her neck. There are tall buildings behind them. 
014.jpg,There is a man and a woman standing in front of a desk. The man is wearing a gray shirt and a striped tie. The woman is also wearing a blue blouse and a necklace. There are tall buildings behind them. 
015.jpg,There are several people standing in front of a podium. There is a large screen behind them with a picture of a man and a woman on it. They are all wearing suits and ties. 
016.jpg,There is a pink background with white writing on it. There are four colorful decorations on the pink background. There is a red and black design on the wall behind the decorations. 
017.jpg,There is a large body of water in front of a building. There are trees that are lit up in the water. There is a white building behind the trees. 
018.jpg,There is a pond with many plants in it. There are colorful flags in front of the plants. There is a building behind the pond. 
019.jpg,There are people standing in front of a large golden coin. There is a woman in a yellow shirt standing next to a girl in a blue shirt. There are plants behind them. 
020.jpg,There are people standing in front of a large golden coin. There is a white picket fence around the coins. There are flowers on the ground around the coin. 
021.jpg,There are several people standing in front of a yellow arch. They are all wearing black shirts and have white face masks on. There is a red umbrella behind them. 
022.jpg,A woman is taking a picture with her phone. She is surrounded by other people. There is a large tree behind her with yellow flowers on it. 
023.jpg,An aerial view of a city at night. There is a large building on the left side of the image. There are several trees surrounding the building. 
024.jpg,A woman is taking a picture of another woman. The woman taking the picture is wearing a white shirt. There is a pond in front of the women with flowers on it. There are white poles next to the pond. 
025.jpg,There is water in front of a white building. There are lights on the trees in the water. The sky is black and there are no clouds in the sky.
026.jpg,A man and a woman are standing behind a white table. They are both dressed in business attire. There is a large screen behind them with a city on it. 
027.jpg,A man and a woman are standing behind a desk. They are both dressed in business attire. The desk is white and has a red logo on it. There is a large screen behind them. There are many tall buildings on the screen. 
028.jpg,A man and a woman are standing behind a white table. They are both dressed in business attire. There is a large screen behind them with a city on it. 
029.jpg,There is a man and a woman standing in front of a white table. The man is wearing a gray shirt and a striped tie. The woman has a blue shirt on and a necklace around her neck. There are tall buildings behind them. 
030.jpg,A man and a woman are standing in front of a cityscape. The man is wearing a suit and tie and is holding a tablet in his hand. The woman is wearing earphones on her ears and a necklace around her neck. She is holding an object in her hands. There are cars parked on the street behind them. Tall trees are standing on the side of the street.
031.jpg,There are several cars parked on the street. There are green umbrellas on the sidewalk next to the cars. There is a red and white sign in front of the umbrella. 
032.jpg,A hand is holding a phone. The phone is connected to a white charger. There is a white barcode on the phone. 
033.jpg,A man wearing a white face mask and a white hard hat is standing in front of a toll booth. He is wearing a yellow safety vest and white gloves. There are yellow barriers on the side of the road. 
034.jpg,There are several cars parked in front of a building. There are blue signs hanging from the ceiling above the cars. There is a person walking on the sidewalk next to them. 
035.jpg,There are several cars lined up on the street. There is a man standing next to a silver car. There are signs hanging from the ceiling above the cars.
036.jpg,A man is wearing a gray shirt and black pants. He is carrying a red suitcase. There is a woman standing next to him wearing a yellow shirt and white shorts. There are several cars parked in front of them. 
037.jpg,People are standing outside of a building. There are two large white pillars in front of the building. A man in a green jacket is walking in front. 
038.jpg,A man and a woman are standing in front of a white table. The man is wearing a gray shirt and a striped tie. The woman is wearing blue and white clothes. There are tall buildings behind them. 
039.jpg,A man and a woman are standing in front of a backdrop of a city. The man is wearing a long sleeve shirt and a tie. He is holding a red object in his hands. The woman is wearing earphones and a blue blouse. The sky behind them is orange and cloudy. There are tall buildings in front the woman.
040.jpg,There is a man and a woman standing in front of a white table. There are tall buildings behind them. The man is wearing a gray shirt and a striped tie. The woman is holding a red purse. 
041.jpg,A man and a woman are standing in front of a large picture of a city. The man is wearing a long sleeve shirt and a tie. He is holding a red object in his hands. The woman is standing next to him wearing a blue shirt. There are tall buildings in the picture behind them. The sky above them is blue with white clouds.
042.jpg,This is an aerial view of a highway. There are several lanes of traffic on both sides of the freeway. There is a large body of water on the right side of the highway. 
043.jpg,An aerial view of a city is shown. There are a lot of vehicles on the road. There is a billboard on the side of the road that says CONS.
044.jpg,"This is an aerial view of a city. The city has lots of traffic. There are containers on the right side of the road. The containers are red, blue, and gray. There is a large white building in the background."
045.jpg,This is an aerial view of a city. There are a lot of vehicles on the road. There is a large white billboard on the side of the road next to the water. The water is calm and still. 
046.jpg,"An aerial view of a city. There are many cars on the road. There is a billboard on the side of the road that says ""Viet-Tiep"". There are several buildings surrounding the street. "
047.jpg,This is an aerial view of a city. There is a large green sign on the side of the road. There are several lanes of traffic on the road with cars and trucks driving on them. The buildings are surrounding the road and there are several trees in front of the buildings.
048.jpg,"An aerial view of a city is shown. There are multiple lanes of traffic on the road. There is a green sign on the right side of the road that says, ""E"" on it. On the left side there are several buildings that are white in color. The trees are green and there are a few people walking on the sidewalks."
049.jpg,This is an aerial view of a city. There are several lanes of traffic on the road. The lanes are divided into two sections. There is a large patch of green grass between the lanes. On both sides of the road there are trees and buildings.
050.jpg,This is an aerial view of a city. The city appears to be very small. There are a lot of buildings in the city. There is a road in the middle of the city with lots of cars on it. The sky above the city is hazy and white.
051.jpg,A red and black screen has lines on it. The lines are white. There is a small logo in the top right corner that says htv9. The time on the screen is 06:33:19.
052.jpg,A large group of people are riding motorcycles and cars on a busy street. They all have on helmets and face masks. There is a large red and black bus on the street. 
053.jpg,There are several people riding motorcycles on the street. They are all wearing face masks. There is a yellow motorcycle in front of them. 
054.jpg,A large group of people are standing on the side of a road. They are all wearing white and red helmets. There are several cars and trucks on the road. Tall light poles are standing next to the street. 
055.jpg,There are several cars and trucks driving on the street. There are tall poles next to the street with wires hanging from them. There is a red sign on the side of the road. 
056.jpg,A large group of people are riding motorcycles and cars on a busy road. All of the people are wearing helmets and face masks. There are tall buildings and trees on the side of the road. Power lines are running across the sky.
057.jpg,There are several cars parked on the street. There are trees next to the cars. There is a blue car in front of the white car. 
058.jpg,This is an aerial view of a city. There are a lot of cars parked on the street. There is a large white building next to the street with a blue roof on it. 
059.jpg,There are several cars parked on the street. There is a man in a white shirt standing next to a red motorcycle. There are several people on motorcycles next to the cars.
060.jpg,There is a lot of traffic on a busy street. There are many cars and trucks driving on the street. Most of the cars are white. There is a large orange sign hanging from a pole on the side of the street next to some trees. Many people are standing on the sidewalk in front of the car. They are all wearing helmets on their heads. 
061.jpg,There is a lot of traffic on the street. There are many cars and motorcycles in the road. There is a large metal bridge above the street with cars and trucks on it. There trees on the side of the street next to the cars. 
062.jpg,A large group of people are riding motorcycles on a road. They all have helmets and face masks on. There are three red flags on poles in front of the people. 
063.jpg,A man and a woman are standing in front of a white table. They are both holding red books in their hands. The man is wearing a gray shirt and a striped tie. The woman is also wearing a blue blouse and a necklace. There are tall buildings behind them. The sky is blue with white clouds in it.
064.jpg,A man and a woman are standing in front of a white table. The man is wearing a gray shirt and a striped tie. The woman is also wearing a blue shirt. There are tall buildings behind them. 
065.jpg,A man and a woman are standing in front of a white table. They are both holding red boxes in their hands. The man is wearing a gray shirt and a striped tie. The woman is also wearing a blue blouse and a necklace. There are tall buildings behind them. The sky is blue with white clouds.
066.jpg,There is a man standing in front of a store. He is wearing a blue jacket and a pink hat. There is a tree behind him. 
067.jpg,A woman is wearing a pink hat and holding a blue phone. There is a red car behind her. There are people standing in front of the car. 
068.jpg,There is a person wearing a blue jacket and a pink hat. They are wearing gloves on their hands. There is a table in front of them with bags on top of it. 
069.jpg,A white truck is parked on the street. There is a black tarp covering the back of the truck. There are boxes stacked on top of a blue crate. 
070.jpg,A woman is sitting outside on a sidewalk. She is wearing a black short sleeve shirt and a red vest. There are boxes and bags on the ground in front of her. A large red bag is sitting on top of a cart that is parked on the side of the street. There is a gray wall behind the woman. Part of a green grassy field can be seen behind the cart.
071.jpg,A woman is standing outside of a building. She is wearing a short sleeve shirt. The woman is holding a brown box in her hands. There is a motorcycle parked in front of the woman. A large green plant is sitting on the side of the motorcycle. A black gate is standing behind the woman on the sidewalk. There are cars parked on the street behind the girl.
072.jpg,A woman with long black hair is standing in front of a black motorcycle. She is holding a brown box in her hands. There is a white brick wall behind the woman with green plants on it. 
073.jpg,A person is holding a box in their hand. The box is pink and white. There is writing on the side of the box. The person is wearing a watch on their wrist. There are leaves on the ground behind the person.
074.jpg,"A woman is standing in front of a white sign that says ""Best Express"". She is wearing a brown jacket and black pants. She has a brown purse on her shoulder. There are people sitting in chairs around her. "
075.jpg,A man in a black jacket is pushing a blue crate on a scooter. The scooter is black and has a red basket on the back of it. There is a green car on the street behind the man. 
076.jpg,There is a blue basket on the ground. There are cardboard boxes and plastic bags in the basket. There is a black bag in the bag. 
077.jpg,There are several motorcycles parked in front of a building. There is a red sign on the front of the building that says viettel post. There are blue baskets on the motorcycles. 
078.jpg,There are several motorcycles parked in front of a building. There are blue baskets on top of the motorcycles. There is a man in a black shirt standing next to them. 
079.jpg,There are several blue crates on the ground. There are cardboard boxes next to them. There is a black laptop on top of one of the crates. 
080.jpg,A pile of bags and boxes are sitting on the ground. There is a blue crate next to the bags. A man is sitting in front of the crates. 
081.jpg,There is a white building with a green sign on the front of it. There are motorcycles parked in front of the building. There is a green van and a red car on the street in front. There trees on the side of the street. 
082.jpg,There are several motorcycles parked in front of a building. There is a red sign on the front of the building that says viettel post. 
083.jpg,A man and a woman are standing in front of a white table. The man is wearing a gray shirt and a striped tie. The woman is also wearing a blue blouse and a white skirt. There are tall buildings behind them. 
084.jpg,A man and a woman are standing in front of a white table. The man is wearing a gray shirt and a striped tie. The woman is also wearing a blue blouse and a white skirt. There are tall buildings behind them. The sky is blue and white. There is writing on the bottom of the screen.
085.jpg,There are two men standing on a dirt road. There are large pots with plants in them next to the men. One of the men is wearing a white hat and a white shirt. 
086.jpg,There are two men standing in front of trees. One of the men is wearing a white hat and a striped shirt. The other man has a yellow shirt on and glasses. 
087.jpg,A hand is reaching out towards a tree. The tree has small green leaves on it. There is a white shirt on the arm of the person. 
088.jpg,A person is wearing a white hat and a blue jacket. They are holding a blue hose and spraying water on the trees. There are large pots with plants in them. 
089.jpg,A tree is seen on a TV screen. The tree has brown branches and green leaves. There are red flowers on the branches of the tree. There is a red and white logo on the screen.
090.jpg,There are small green buds on a tree branch. There are small yellow flowers on the branches. There is writing on the top and bottom of the image. 
091.jpg,A hand is shown in front of a tree branch. The hand is pink. The tree branch has small green buds on it. There is writing on the top and bottom of the image.
092.jpg,There are several trees in a field. There are large tires on the ground in front of the trees. There is a white sky in the distance.
093.jpg,A yellow flower is on a branch. There are green leaves on the branch next to the flower. There is a blurry background behind the branch. 
094.jpg,A man is shown on a TV screen. He is wearing a blue and white checkered shirt. There are trees behind him with yellow flowers on them. There is a wire above the trees. 
095.jpg,A man is standing in front of a tree. He is wearing a white collared shirt and a brown jacket. The tree has no leaves on it. There is a large window behind the man. 
096.jpg,A man is shown on a TV screen. He is wearing a brown jacket and a white collared shirt. There is a tree behind him with no leaves on it. The man has dark brown hair and is looking off to the side.
097.jpg,A man is wearing a gray jacket and a brown hat. There is a large tree in front of the man. There are blue ribbons hanging from the tree. 
098.jpg,There is a person standing in front of a tree. There are yellow flowers on the ground around the tree. The person is wearing a brown shirt and black pants. There is a brown building behind the person.
099.jpg,There are yellow flowers on a tree. The tree has green leaves on it. There is a watermark in the top right corner of the photo. 
100.jpg,There are two men standing in front of a bush with yellow flowers on it. There is a red trash can next to the bush. There are motorcycles behind the men. 
101.jpg,There are several people standing in front of a red trash can. There are yellow flowers around the people. There is a large tree next to the flowers. 
102.jpg,A man is wearing a blue collared shirt. He has black hair and glasses on. There is a tree behind the man. 
103.jpg,There are two men standing in front of a large tree. There are large plants with yellow flowers around them. There is a red trash can next to the tree. 
104.jpg,There are several people standing in front of a red trash can. There are yellow sunflowers on the ground around the people. There is a large tree in the front of the flowers. 
105.jpg,"A man is standing outside on a sunny day. He is wearing a white long sleeve shirt, black pants and a baseball cap on his head. A large tree is standing in front of the man. Part of a building can be seen behind the tree. The sky is blue with white clouds in it."
106.jpg,A man is wearing a white shirt and a yellow hat. He is standing in front of a bush. There are trees behind the man. 
107.jpg,There are two men standing next to each other. There are trees behind them. One of the men is wearing a gray shirt. There is a yellow flower on the branch of the tree.
108.jpg,A tree branch with yellow flowers on it. There are small green buds on the branches. There is a white sky behind the tree. 
109.jpg,There is a man and a woman standing in front of a white table. There is a large screen behind them with a city on it. The man is wearing a gray suit and a tie. The woman is also wearing a blue blazer and a white dress. They are both holding papers in their hands.
110.jpg,A woman is standing on a news set. She is wearing a white dress and a blue blazer. There is a large screen on the wall behind her. There are buildings on the screen. 
111.jpg,A woman is standing in front of a large screen. She is wearing a white skirt and a blue blazer. There is a large picture on the wall behind her. 
112.jpg,A woman is standing in front of a large screen. She is wearing a white skirt and a blue shirt. There is a picture on the wall behind her. The man is holding a camera in his hand. 
113.jpg,A woman is standing in front of a large body of water. She is wearing a red coat and holding a bunch of yellow flowers. The woman has dark hair and is smiling. There are trees behind the woman. 
114.jpg,There is a woman wearing a red jacket. There are people standing behind her. There is a man in a white shirt standing in front of a tree. 
115.jpg,A woman in a red dress is standing in front of water. She is holding a bouquet of yellow flowers. There are trees on the other side of the water. 
116.jpg,A woman in a red dress is standing in front of water. She is holding a yellow flower bouquet in her hand. There are trees on the other side of the water. 
117.jpg,There is a woman wearing a red shirt. She is standing in front of a microphone. There are people sitting on a bench behind her. There is a tree next to the bench. 
118.jpg,There are people standing in front of a white building. There is a baby in a stroller next to the people. There are stairs leading up to the building. 
119.jpg,A woman is standing in front of a microphone. She is wearing a green shirt and a black backpack. There are other women standing behind her. There is a large building behind them. 
120.jpg,There are two women sitting next to each other. They are both wearing sunglasses. There are other people behind them standing next to them. There is leaves on the ground around them. 
121.jpg,A woman is standing in front of a tree. She has short blonde hair and is wearing glasses. She is wearing a black and white jacket and a necklace. The tree has green leaves on it. There is a brown wall behind the woman.
122.jpg,A woman is wearing a black and white shirt. She has short blonde hair and is wearing glasses. There is a tree behind the woman with green leaves on it. 
123.jpg,There are several people standing on a sidewalk. There are trees behind them with red flags hanging from them. There is a woman in a white dress holding a bouquet of flowers.
124.jpg,A woman is wearing a black and white shirt. She has a pearl necklace around her neck. She is wearing glasses and has blonde hair. There is a tree behind her with green leaves on it.
125.jpg,There are several people standing on the street. There are trees next to a fence. There is a man in a brown jacket standing in front of the fence.
126.jpg,There is a woman wearing a white shirt. She has long brown hair. She is waving her hand. There is a building behind her with a blue sign on it. 
127.jpg,There are several people walking on the street. There are large trees on the sides of the street next to a white building. There is a white pole with red flags hanging from it. 
128.jpg,There are people walking down the street. There are trees lining the sidewalk. There is a white pot on the sidewalk next to the street with plants in it. Two red flags are hanging from a pole. 
129.jpg,The image is a graphic design. The design is red and white. The red part is in the shape of a heart. The white part has a thin white line going down it. The gray part is to the left of the red part. There is a light shining on the gray part. The light is reflecting off of it.
130.jpg,A red truck is driving down the street. There is a yellow license plate on the front of the truck. There are other trucks on the street next to the red truck. 
131.jpg,The image is a screenshot from a video. It shows a truck driving down the road. The headlights of the truck are on and the road appears to be wet. The text on the image is in Vietnamese and the time is 06:38:02.
132.jpg,A person is riding a motorcycle. The motorcycle is black. The person is wearing a black helmet. There is a pile of dirt behind the motorcycle. 
133.jpg,There is a large window on the wall. There is a white cabinet next to the window. There are people sitting in front of the windows. 
134.jpg,The image is red and white. There are dots on the red background. The dots are small and white in color. There is a big red circle in the middle of the image. The red color is very bright. The white background is very plain. The lines on the image are very thin and dark red.
135.jpg,A man is standing in front of a cityscape. He is wearing a long sleeve gray shirt and a black and white striped tie. The man is wearing glasses and is holding a tablet in his hands. The sky behind the man is orange and yellow. There are tall buildings all around the man.
