frame,caption
141.jpg,There are several cars and motorcycles driving on the street. There is a bridge above the street with a large billboard on it. There are two men standing on the side of the street wearing yellow helmets. 
142.jpg,There are several people riding motorcycles. They are all wearing white face masks. There is a white car behind them. They all have helmets on their heads. 
143.jpg,A man is driving a car. He is wearing a white hat and a white face mask. He has a blue bandage on his arm. The car has a large window on the side. It is gray in color.
144.jpg,There is a black car on the street. There is a red car behind the black car. There are orange and white barriers on the side of the street in front of the cars. A man in a blue shirt is standing on the sidewalk next to a red and white sign.
145.jpg,There are several cars driving on the street. There is a large building behind the cars. There are several light poles on the sidewalk in front of the building. 
146.jpg,People are standing in line at an airport. There are blue barriers in front of them. There is a large screen on the wall behind them. 
147.jpg,A woman is wearing a white blouse and a red skirt. She is holding a book in her hands. There is a large orange sign next to the woman. 
148.jpg,A woman is standing in front of a city skyline. She is wearing a pink blouse with a large bow on the front of it. She has dark hair and is holding a tablet in her hands. There is a large orange sign next to the woman.
149.jpg,A person is standing in a doorway of a building. The person is wearing a black jacket and a black hat. There is a light on the wall behind the person. 
150.jpg,There is a large red truck on the street. There are people standing in front of the truck. There is a white building next to the truck with a red light on it.
151.jpg,A red truck is driving down the street. There are people standing on the sidewalk in front of the truck. There is a white building next to the people. 
152.jpg,There are several people walking down a street. There is a large red truck on the street in front of them. There are buildings on both sides of the street. 
153.jpg,There are people walking down the street at night. There are tall buildings on both sides of the street. There is a street light hanging over the street next to the buildings. 
154.jpg,There is a red truck parked on the side of the street. There are people standing in front of the truck. There is a man in a white shirt and blue pants walking on the street in front.
155.jpg,This is a picture of a building. The building has large windows on it. There is a man standing in front of the window. The man is wearing a black shirt and black pants. The window has a white air conditioner attached to it. The door to the building is blue and pink. There are small white flowers on the wall next to the door.
156.jpg,A man in a white shirt is standing in front of a building. There is a pink door on the building. A white air conditioner is hanging on the wall. 
157.jpg,A dark picture of a window with a metal fence in front of it. There is a person standing behind the fence looking out of the window. The person is wearing a white helmet. 
158.jpg,Two people are looking out of a window. There is a black fence in front of the window. One of the people is wearing a white hat. 
159.jpg,A man is standing in front of a city skyline. He is wearing a white striped shirt and a tie. The man is holding a red tablet in his hands. The sky behind the man is orange and yellow. There are tall buildings all around the man.
160.jpg,A man is standing in front of a city skyline. He is wearing a white striped shirt and a tie. The man is holding a red object in his hands. The sky behind the man is orange and yellow. There are many tall buildings in the skyline. 
161.jpg,There are several people standing around a table. There is a man in a green shirt sitting on a red stool in front of the table. 
162.jpg,There are people sitting around a table. There is a man in a green shirt sitting on a red stool. There are motorcycles next to the table. 
163.jpg,There is a red stool on the ground. There are leaves all around the stool. There is a person standing in front of a tree. 
164.jpg,There are people standing in the dark. There are trees behind them. There is a white light on the ground in front of them.
165.jpg,There are people standing in the dark. There are leaves on the ground in front of them. There is a bright light in the background. 
166.jpg,A dark scene is shown on a TV screen. There is a large building in the distance. There are trees in front of the building. The sky is filled with white clouds.
167.jpg,There are two men sitting at a table. There is a white car behind them. There are two red stools in front of the table. 
168.jpg,A woman is standing in front of a city skyline. She is wearing a white blouse with a large bow on the neck. She has dark hair and is holding a brown book in her hands. There is an orange screen behind the woman. 
169.jpg,A woman is standing in front of a cityscape. She is wearing a light pink blouse with a large bow on the front. She has dark hair and is holding a tablet in her hands. The sky is orange and yellow and there are buildings in the background. There is a large orange sign next to the woman.
170.jpg,There are several cans on a table. There is a label on one of the cans. There are nuts inside of the can. 
171.jpg,There are three men standing in a room. There are boxes on the floor in front of them. One of the men is wearing a striped shirt and a black fanny pack. He is looking at a phone. 
172.jpg,There are two men sitting on the floor. There is a white table in front of them with many items on top of it. One of the men is wearing a white face mask. 
173.jpg,Someone is wearing a white glove. There are boxes and plastic bags on the table. There is a roll of tape in front of the person. 
174.jpg,There are several bags of money sitting on a table. There is a brown paper bag next to the bags. There are red cans on the table in front of them. 
175.jpg,Four men are standing in a room. They are wearing green uniforms. The man in the front is wearing a black shirt and has a white face mask on. There are white cabinets behind the men. 
176.jpg,A man is wearing a black shirt. There is a white wall behind the man. The man has dark hair and is looking down. 
177.jpg,A picture of a white bag with a qr code on it. There are plastic bags on the ground around the bag. There is a person with white gloves on top of the bags. 
178.jpg,There are boxes on the ground. There is a black keyboard in front of the boxes. There are wires coming out of the keyboard. 
179.jpg,A man is standing in front of a city skyline. He is wearing a white striped shirt and a tie. The man is holding a tablet in his hands. The sky behind the man is orange and yellow. There are many tall buildings in the skyline. 
180.jpg,A man is standing in front of a city skyline. He is wearing a white striped shirt and a tie. The man is holding a red object in his hands. The sky is orange and yellow. There are tall buildings behind the man. 
181.jpg,There are people standing in front of a counter. There are lights hanging from the ceiling above the people. There is a large screen behind the counter. 
182.jpg,There are people standing in a room. There are purple lights hanging from the ceiling. There is a large screen on the wall in front of them.
183.jpg,There are glasses on top of a table. There is a red soda can next to the glasses. There are slices of fruit on a plate behind them. 
184.jpg,There is a man in a green suit standing in front of a black wall. There is a red light hanging on the wall next to the man. The man is holding a microphone in his hand. 
185.jpg,A person is wearing green pants. They are standing inside of a black bag. There is a plastic bottle and other items inside of the bag. 
186.jpg,There are four different types of propane tanks. They are yellow and blue in color. They have blue caps on top of them. There is a person standing next to them wearing green pants. 
187.jpg,Three people are standing in a room. They are all wearing green suits. They have face masks on their faces. There is a table in front of them with food on it. 
188.jpg,There is a glass table with several glasses on top of it. There is a plate with food on top next to the glasses. There are two cans on the table next to a water bottle. 
189.jpg,A man is standing outside of a building. He is wearing a black shirt and a face mask. There are lights hanging from the ceiling of the building. A man in a green jacket is standing in front of the entrance of the store.
190.jpg,A woman is wearing a white blouse and a red skirt. She is holding a clipboard in her hands. There is a large orange sign next to the woman. 
191.jpg,A woman is standing in front of a screen. She is wearing a white blouse and a red skirt. The woman is holding a tablet in her hands. There is a large orange screen behind the woman. 
192.jpg,A woman is standing in front of a city skyline. She is wearing a white blouse and a red skirt. The woman has dark hair and is holding a tablet in her hands. There is a large orange sign next to the woman.
193.jpg,Five men are standing in a line in front of a yellow wall. They are all wearing green uniforms. There are large green plants behind the men. 
194.jpg,There are two men standing in front of a yellow wall. There is a tree behind them. The man on the left is wearing a blue shirt. He has short black hair. 
195.jpg,A man is standing in front of a yellow wall. He is wearing a light blue collared shirt. There is a large green plant behind him. The man has short black hair. 
196.jpg,There are three men standing in front of a yellow wall. There are large green plants behind the men. The man on the left is wearing a green jacket. 
197.jpg,There are three men standing in front of a yellow wall. There is a large tree behind them. The man on the right is wearing a green uniform. He has red and white badges on his jacket. The other two men are wearing shirts. 
198.jpg,There are three men sitting at a table. There is a man in a blue shirt sitting in front of the table. The man in the blue shirt is looking at the other man. 
199.jpg,There are several potted plants on the ground. There are several motorcycles parked next to the plants. There is a white wall behind them. 
200.jpg,There are several potted plants on the ground. There are several motorcycles parked next to the plants. There is a white wall behind them. 
201.jpg,There are several motorcycles lined up against a wall. There is a white door on the wall next to the motorcycles. There are wires hanging from the wall. 
202.jpg,There are three people sitting around a white table. There is a television hanging on the wall behind them. There are two speakers on the table in front of the television. 
203.jpg,A man is wearing a green military uniform. There are gold stars on the shoulders of the uniform. The man has black hair and is looking down. There is a brown chair behind him.
204.jpg,A black screen with a red and white image on it. There are small white dots on the image. There is a red line on the screen. 
205.jpg,"The image is a graphic design. The background is red and white. There are dots on the red background. The lines are white and black. The design is made up of blocks. The blocks are red and silver. The letters on the blocks are also red. There is a small logo in the top right corner of the image that says ""HTV HD""."
206.jpg,A cartoon of a man is standing next to a large phone. The man is wearing a red shirt and black pants. There is a speech bubble above the man's head. 
207.jpg,A cartoon picture of two men standing in front of a large phone. The phone is purple and has a white phone on it. The man on the right is wearing a white shirt and tie and is talking on a phone. There is a man in a black suit standing next to the phone. 
208.jpg,A woman in a red shirt is standing in front of drums. There is a large building behind her with people walking around it. There are trees behind the building. 
209.jpg,There is a man in a black suit standing behind a table. There are people sitting in front of the man. They are holding instruments in their hands. There is a large white building behind them.
210.jpg,There is a person standing in front of a large white structure. There is snow on the ground around the person. There are trees behind the person in the snow. 
211.jpg,A red and white graphic is shown. There is a silver object in the middle of the graphic. There are red dots on the top right corner of this graphic.
212.jpg,A man is standing in front of a cityscape. He is wearing a white striped shirt and a tie. The man is holding a tablet in his hands. There are tall buildings and skyscrapers in the background. The sky is orange and cloudy.
213.jpg,A man is standing in front of a city skyline. He is wearing a white striped shirt and a tie. The man is holding a red tablet in his hands. The sky behind the man is orange and yellow. There are tall buildings all around the man.
214.jpg,A man is standing in front of a city skyline. He is wearing a white striped shirt and a tie. The man is holding a tablet in his hands. The sky behind the man is orange and yellow. There are many tall buildings in the skyline. 
215.jpg,A man in a blue suit is standing on the grass. There are trees behind him. The man is wearing sunglasses on his eyes. 
216.jpg,A man in a blue suit is standing outside of a helicopter. The helicopter is black and has stairs leading up to the door. There is grass on the ground under the helicopter. 
217.jpg,There is a man in a suit standing next to a small airplane. There is a person in a uniform standing in front of the airplane. They are wearing a white hat. 
218.jpg,A man in a suit is getting into a helicopter. The helicopter is black and white. There is a man in uniform standing in front of the helicopter saluting. 
219.jpg,A helicopter is sitting on the grass. There are trees behind the helicopter. The sky is blue and there are no clouds in the sky. The helicopter is black and white. 
220.jpg,A helicopter is flying over a grassy field. There is a tall tower in the distance. There are trees on the field under the helicopter. 
221.jpg,A helicopter is flying in the sky. There are trees under the helicopter. There is a tall white tower in the distance. 
222.jpg,A woman is standing in front of a city skyline. She is wearing a white blouse with a large bow on the neck and a red skirt. The woman is holding a book in her hands. There is a large orange sign next to the woman. 
223.jpg,A woman is standing in front of a city skyline. She is wearing a light pink blouse with a large bow on the neck and a red skirt. The woman is holding a tablet in her hands. There is a large orange sign next to the woman. 
224.jpg,There are many small white figures on a black background. There is a red and white logo on the top right corner of the image. 
225.jpg,"A blue screen has a fingerprint on it. There is a white box next to the fingerprint with the words ""USERNAME"" and ""AD'I INISTRATOR"". There are numbers on the screen. "
226.jpg,A graphic is displayed on a computer screen. The background of the screen is blue. There are many numbers and symbols on the screen. There is a person wearing a green hoodie sitting in front of a laptop. The person has a large mustache and a large open mouth. Above the person's head there is a yellow triangle with an exclamation mark on it.
227.jpg,A cartoon of a man is standing next to a large phone. The man is wearing a red shirt and black pants. He is holding a phone in his hand. There is a speech bubble above the man's head. 
228.jpg,There are two men standing in front of a large screen. There is a man in a white shirt and tie standing next to the screen. 
229.jpg,Five people are sitting around a table. There are four laptops on top of the table. They are all looking at the laptops. There is a large bookcase behind them with many books on it. 
230.jpg,A person is holding a white cell phone. They are holding a pair of glasses. There is a wooden table under the phone. 
231.jpg,A person is holding a white cell phone in their hand. They are wearing a white sweater. There is a wooden table under the phone. 
232.jpg,A man is standing in front of a city skyline. He is wearing a white striped shirt and a tie. The man is holding a red object in his hands. The sky behind the man is orange and yellow. There are tall buildings on the skyline. 
233.jpg,A man is standing in front of a picture of a city. He is wearing a white striped shirt and a tie. The man is holding a red object in his hands. There are tall buildings behind the man. The sky above the man is filled with clouds. There is writing on the bottom of the picture.
234.jpg,A man is standing in front of a picture of a city. He is wearing a white striped shirt and a tie. The man is holding a brown object in his hands. There are tall buildings behind the man. The sky above the man is orange and white. There is writing on the bottom of the picture.
235.jpg,This is an image of a shopping center. The shopping center has a lot of people walking around it. There is a large tree in front of the building. The tree is green and leafy. The building has many windows on it. The sky above the building is white. There are red letters on the side of the store. The store front is lit up with lights.
236.jpg,There are several people standing in front of a building. There is a large window on the building with a picture of a woman on it. There are several signs hanging from the building.
237.jpg,A man with grey hair and a beard is wearing a black shirt. There is a white building behind the man. There are people walking on the sidewalk next to the street. 
238.jpg,There is a man in a black shirt standing on the street. There are people walking on the sidewalk behind him. There is a white building behind him with a black awning on it.
239.jpg,A man with grey hair and a beard is wearing a black shirt. There is a white building behind the man. There are people sitting under a white umbrella on the sidewalk. 
240.jpg,There is a large white building on the corner of a street. There is a black flag on a pole in front of the building. There are trees surrounding the flag pole. 
241.jpg,A man is sitting on a brown bench. He is wearing a short sleeve blue shirt. There are pink flowers next to the man. There is a large rock wall behind him. 
242.jpg,The Sydney Opera House is seen from across the water. There is a bridge in the distance. The water is calm and blue. The sky is cloudy.
243.jpg,There are tall buildings in the background. There is water in front of the buildings. There are two boats in the water. The sky is blue with white clouds in it.
244.jpg,There are tall buildings in a city. There are trees in front of the buildings. There is a tall tower on the left side of the building. 
245.jpg,There is a large brown building on the corner of a street. There is a red and black bus on the street in front of the building. There are people walking on the sidewalk next to the street. 
246.jpg,There are people walking on the sidewalk. There are trees next to the people. There is a man in a white shirt holding a white bag. 
247.jpg,A woman is standing in front of a screen. She is wearing a white blouse with a large bow on the front of it. She has dark hair and is holding a brown box in her hands. There is a large screen behind her with a red logo on it. There are buildings behind her.
248.jpg,There is a woman standing in front of a screen. She is wearing a white blouse and a red skirt. There is a picture next to the woman on the screen. There are many people in the picture. 
249.jpg,A large crowd of people are gathered on a street. There are several buildings on the side of the street. Some of the people are holding umbrellas. There is a large balloon arch in the middle of the crowd. The balloon arch is red and green. The sky above the crowd is gray. The clouds in the sky are white.
250.jpg,Two hands are holding two bottles. The bottles are clear and have yellow liquid in them. There is a black arm with a watch on it. 
251.jpg,There is a large crowd of people standing in front of a building. There is a man wearing a gold crown on his head. He has a red scarf around his neck. 
252.jpg,A woman is wearing a red and white hat. She has a colorful scarf around her neck. There are other people standing behind her. 
253.jpg,A large crowd of people are gathered together. They are all dressed up in costumes. There is a silver fence behind them. There are buildings behind the crowd. 
254.jpg,There are several people standing in a crowd. There are buildings behind them. There is a man in a white jacket with a red scarf around his neck. 
255.jpg,There are several people standing in a crowd. They are wearing hats and jackets. There is a woman in a black jacket holding a glass in her hand. 
256.jpg,There are several people standing together. They are all wearing hats. There is a woman in a black jacket holding a drink in her hand. 
257.jpg,There are people standing in a crowd. There is a woman wearing a yellow jacket and a colorful scarf around her neck. She has pink hair and a blue hat on top of her head. 
258.jpg,There are two people standing together. One of the people has blue hair. There is a tree behind them with no leaves on it. The sky is white. 
259.jpg,There are several people standing in a crowd. They are all wearing hats and raincoats. There is a man in a red hat and glasses in the crowd. 
260.jpg,There are several people standing in a crowd. There is a woman in a colorful shirt standing in the crowd. She has blonde hair and is wearing a colorful headband on her head. 
261.jpg,A man is standing in front of a city skyline. He is wearing a white striped shirt and a tie. The sky behind him is orange and yellow. There are tall buildings all around the man.
262.jpg,A man is standing in front of a city skyline. He is wearing a white striped shirt and a tie. The man is holding a book in his hands. The sky behind the man is orange and yellow. There are many tall buildings in the skyline. 
263.jpg,There are people sitting on a stage. They are wearing a pink dress. There are balloons on the wall behind them. They have their hands up in the air. 
264.jpg,There is a woman wearing a red dress. There is a red necklace around her neck. There are other people behind her. They are holding up their hands. 
265.jpg,There are three women wearing pink dresses. They are dancing together. There are purple lights behind them. There is a person's hand in front of them. 
266.jpg,There are three women standing next to each other. They are wearing pink dresses. There are people behind them sitting down. The women are smiling and looking at the camera. 
267.jpg,There are people standing on a stage. There are lights hanging from the ceiling above them. There is a white wall behind them. They are wearing black and white outfits.
268.jpg,There are two women standing next to each other. One of the women is wearing a silver crown on her head. The other woman has a pink shirt on. There are words written on the bottom of the image.
269.jpg,There are several people dancing on a stage. They are wearing short skirts and dresses. There is a white wall behind them with pictures on it. There are decorations hanging from the wall. 
270.jpg,There is a man wearing a red and gold crown. There are people standing behind him. There is a white wall behind them with red and white balloons hanging from it.
271.jpg,There are several women standing in a line. They are wearing pink dresses. They have crowns on their heads. There is a white wall behind them. 
272.jpg,A man is wearing a red and gold crown on his head. There are people standing behind him in a room. There is a blue light on the wall behind him.
273.jpg,There are several women standing next to each other. They are wearing colorful dresses. There is a crown on their head. There are other people standing behind them. 
274.jpg,A woman is standing in front of a cityscape. She is wearing a light pink blouse with a large bow on the front. She has dark hair and is smiling. She appears to be holding a tablet in her hands. There is a large screen behind her. The screen has a logo on it that is red and white.
275.jpg,There is a woman wearing a pink blouse and a red skirt. She is holding a tablet in her hands. There is a picture next to the woman on the screen. The man in the picture is wearing a black suit and a white shirt. 
276.jpg,There are several people standing in front of a large body of water. They are all wearing red clothes and playing musical instruments. There are tall buildings in the distance behind them. 
277.jpg,A man is wearing a black suit. He is raising his hands up in the air. There is a red banner in front of the man with white writing on it. 
278.jpg,There are several people sitting in white chairs. They are all wearing red dresses. There is a man in a black suit standing in front of them. There are white stands in front if them. 
279.jpg,A large group of people are performing on a stage. They are all dressed in red. There are tall buildings behind them. There is a man in a black suit standing in front of them. 
280.jpg,A man is standing in front of a crowd. He is wearing a black suit and a white shirt. There is a large white pole behind the man. 
281.jpg,There are people standing in front of a white building. There are trees surrounding the building. Two women are wearing red dresses. One of the women is holding a microphone. 
282.jpg,There are two women wearing red dresses. They are standing in front of a large white building. There are trees surrounding the building. 
283.jpg,A man is standing in front of drums. He is wearing a black shirt. There is a giant wheel behind him. There are tall buildings behind the man. 
