frame,caption
284.jpg,A man in a red shirt is playing drums. There is a large building behind him. There are people standing in front of the building. 
285.jpg,A man is standing inside of a building. He is wearing a black tank top and red pants. There is a large white table in front of the man. There are large windows on the building. 
286.jpg,There are three men sitting in a room. They are all playing musical instruments. There are large windows on the wall behind them. The man on the right is holding a guitar. 
287.jpg,A man and a woman are standing on a stage. They are both dressed in formal attire. The woman is wearing an orange dress and the man is wearing a black suit. There is a large red curtain behind them.
288.jpg,Four people are sitting on a balcony playing guitar. There are tall buildings behind them. There is a small table in front of them with a guitar on it. 
289.jpg,There are four people standing on a stage. They are all wearing black suits. There are large buildings behind them. The man in the middle is holding a stick in his hand. 
290.jpg,There are several people sitting on a stage. They are dressed in white and yellow outfits. They have white hats on their heads. There are mirrors behind them on the stage. 
291.jpg,There is snow on the ground. There are two white statues in front of a person. The person is wearing a white jacket. There is trees behind the person. 
292.jpg,There is a painting on the wall. There are people standing in front of the painting. They are holding sticks in their hands. There is a large piece of art on top of the art. 
293.jpg,There is an image of a dragon. The dragon is very colorful. There are people surrounding the dragon. There is a red hat on the dragon's head. The sky above the dragon is blue. There's a watermark in the top right corner of the image that says htv9 HD. The time is 06:53:49.
294.jpg,A group of people are sitting on chairs. They are dressed in white and yellow outfits. They have hats on their heads. There are drums in front of them. 
295.jpg,A man is playing drums. He is wearing a black shirt and red pants. There are large drums in front of him. There is a large window behind him. 
296.jpg,A man is standing in front of a screen. He is wearing a white shirt and a red tie. The man is holding a tablet in his hands. There is a large screen behind the man. 
297.jpg,A man is standing in front of a screen. He is wearing a white shirt and a red tie. The man is holding a tablet in his hands. There is a large picture on the screen behind the man. 
298.jpg,There are people standing on a stage. There are lights hanging from the ceiling. There is a large crowd of people sitting in front of the stage. 
299.jpg,"Three medals are hanging on a blue background. The medals are gold, white and pink in color. They are hanging from pink ribbons. Below the medals is a red banner with white writing on it."
300.jpg,The Eiffel Tower stands tall in the middle of a park. There are trees surrounding the eiffel tower. The sky is filled with white clouds. There is writing on the bottom of the image. 
301.jpg,A picture of the Eiffel Tower is shown. There is a statue of a winged person next to the tower. The statue is white. There are words written on the bottom of the picture. 
302.jpg,Three medals are displayed on a black background. The first medal on the left is silver in color. The middle one is gold in color and has a design on it. The second coin on the right is brown and has an image on it and is also gold. Behind the medals are blue ribbons with white Olympic rings on them.
303.jpg,A medal is displayed on a black background. The medal is gold and has a blue ribbon around it. There is writing below the medal.
304.jpg,A person is wearing white gloves. They are holding a medal. The medal is gold and has a black center. There is writing on the center of the medal. 
305.jpg,There is a black box with a gold medal on top of it. There is a blue ribbon tied around the medal. The box is sitting on a table.
306.jpg,A person wearing white gloves is putting a medal into a black case. The medal has a red ribbon around it. There is a white box next to the case. 
307.jpg,A man is wearing a white hoodie. There are shelves behind the man with green binders on them. There is a ladder next to the man. 
308.jpg,A hand is holding a gold coin. There is writing on the bottom of the coin. The hand is wearing a black suit. 
309.jpg,A person is wearing a black jacket and white gloves. They are holding a white object in their hands. There is a brown table in front of them.
310.jpg,"The image is a logo for the Paris 2024 Olympic Games. The logo is in the shape of a diamond and is surrounded by gold rays. The background of the logo is black. On the top right corner of the image there is a watermark that reads ""HTV9 HD 06:59:48""."
311.jpg,A woman is standing in front of a cityscape. She is wearing a light pink blouse with a large bow on the front and a red skirt. She has short dark hair and is holding a clipboard in her hands. The sky is orange and yellow and there are buildings in the background. There is a large orange sign next to the woman.
312.jpg,A woman is standing in front of a screen. She is wearing a long sleeve shirt and a red skirt. The woman is holding a tablet in her hands. There is a large orange sign behind the woman. 
313.jpg,A woman is standing in front of a cityscape. She is wearing a light pink blouse with a large bow on the front of it. She has dark colored hair and is holding a tablet in her hands. The sky behind her is orange and yellow. There is a large orange sign next to her that has a red logo on it.
314.jpg,A man is sitting in a chair. He is wearing a camouflage uniform. There is a white book case behind him with books on it. A white table is in front of him with a white cup on top of it. 
315.jpg,A man is wearing a camouflage shirt. He is sitting in front of a white bookcase. There are books on the shelves. 
316.jpg,A man is standing in a room. He is wearing a black shirt and has short black hair and a beard. There is a red sign in front of the man. 
317.jpg,A man is standing in a room. He is wearing a black shirt. There is a large window behind the man. The door to the room is brown in color. A blue flag is hanging on the door. 
318.jpg,Three men are standing in a room. They are wearing camouflage uniforms. There is a man sitting at a desk in front of a computer. There are papers and files on top of the desk. 
319.jpg,Three men in military uniforms are standing next to each other. They are wearing bulletproof vests. One of the men is carrying a large brown vest on his back. There is a white wall behind them. 
320.jpg,There are five men in military uniforms standing around a table. They are all looking down at the table and writing something on a piece of paper. There is a man in a white hat on his head. 
321.jpg,There are three men standing around a table. They are wearing camouflage uniforms. There is a man in a green shirt standing next to them. 
322.jpg,There are two men standing next to each other. They are wearing camouflage uniforms. One of the men is wearing a hat on his head. There is a patch on the jacket of the man next to him. 
323.jpg,There are several men standing around a table. There is a man in a green shirt standing in front of the table. He is wearing a camouflage uniform. 
324.jpg,There are several men standing in a crowd. They are all wearing camouflage uniforms. There is a microphone in front of them. One of the men is wearing glasses. 
325.jpg,Four men are standing outside of a building. All of the men are wearing camouflage jackets and green hats. The man on the left is holding a bouquet of yellow and purple flowers. The building behind them is yellow and white. There are tall white pillars in front of the building. Tall leafless trees can be seen behind the men.
326.jpg,Four men in camouflage jackets and hats are walking down the street. They are holding bouquets of flowers in their hands. There is a building behind them with columns on the side of it. 
327.jpg,Men in military uniforms are laying flowers on a cemetary. There is a large tree trunk behind them. There are several people standing in front of them. 
328.jpg,A bunch of people in military uniforms are standing around a casket. There is a man laying in the casket with flowers around him. There are two people holding flags in front of them. 
329.jpg,A woman is standing on a news set. She is wearing a red skirt and a white blouse. There is a large screen behind her with a city on it. 
330.jpg,A man and a woman are standing in front of a news desk. The desk is white and has a red logo on it. The man is wearing a blue shirt and a tie. The woman is also wearing a white blouse. There is a large screen behind them. There are buildings on the screen. 
331.jpg,A man and a woman are standing behind a news desk. The desk is white and has a red logo on it. The man is wearing a white shirt and tie and is holding a book in his hands. The woman is wearing an off-white blouse and has short black hair. There is a large screen behind them that shows a city skyline.
332.jpg,A man and a woman are sitting behind a news desk. They are both dressed in business attire. The desk is white and has a red logo on it. There is a large screen behind them that shows a city skyline. There are lights on the ceiling above them.
